title,author,genre_id,genre,ISBN,description_aladin,description_naver,salesPoint,mallType
모질게 토익 Economy LC 1000제 5 문제집 (해설집 별매) - 정답과 스크립트까지 있는 문제집,권오경 (지은이),49855,국내도서>외국어>토익>Listening,9788950934415,"최신 출제경향과 난이도를 100% 반영한 실전 완벽 대비서. 최신 경향의 문제만 엄선하여 수록해 실전감각을 다지도록 구성하였으며, 모질게 토익 홈페이지(www.mozilge.com) 에서는 문항별, 파트별, 복습용 등 학습자의 스타일에 맞게 세분화된 MP3 파일을 추가로 제공한다.",,1864,BOOK
중국과 이란 - 무기 수출과 석유에 대한 진실,"존 W. 가버 (지은이), 박민희 (옮긴이)",51166,국내도서>사회과학>정치학/외교학/행정학>외교정책/외교학,9788994963204,"20세기와 21세기에 걸친 중국과 이란의 외교적 관계의 역사를 다룬다. 두 나라는 지리적 격차에도 불구하고 오랫동안 군사적, 경제적으로 협력해왔다. 저자는 양국의 관계를 지속시켜주는 기본적인 신념과 이해관계의 바탕을 분석하고, 구체적인 관계의 양상을 세 시기로 나누어 자세하게 설명한다.","중국과 이란의 외교적 관계를 새로운 시각에서 분석하다!

무기 수출과 석유에 대한 진실『중국과 이란』. 조지아공과대학의 국제관계학 교수인 존 W. 가버가 중국과 이란의 관계를 미국인의 시각이 아닌, 그들의 시각에서 꼼꼼하게 분석하였다. 먼저 저자는 양국의 관계를 지속시켜주는 기본적인 신념과 이해관계를 바탕으로 구체적인 관계의 양상을 샤 왕조와 마오쩌둥의 시기, 호메이니와 덩샤오핑의 시기, 포스트 냉전의 시기 등으로 나누어 각 시기별로 두 나라의 관계를 이끈 국제정치적인 배경과 목적, 전개 양상 등을 살펴본다. 더불어 흥미로운 이슈를 중심으로 중국과 이란의 관계를 살펴보고, 핵 프로그램에 대한 중국의 전략을 비롯하여 중국과 미국의 협력에 따른 중국과 이란 관계의 성격 변화 등을 주요하게 다루었다. 이를 통해 글로벌 정치를 보다 심도 있게 바라보는 새로운 시각을 제시하였으며, 오래되고 거대한 두 고대 문명 사이의 줄타기식 무기 협력관계를 바탕으로 강대국들의 욕망과 석유에 얽힌 국제정세의 역사와 전망을 밝혀냈다.",101,BOOK
통통 세계사 2 - 통일 제국의 번성부터 중세의 성립까지,"신현수 (지은이), 김분묘, 조혜주, 전미화 (그림)",48905,국내도서>어린이>사회/역사/철학>세계사,9788937835285,"세계사를 처음 접하는 어린이들을 위한 세계사 이야기책이다. 2권에서는 한나라와 로마 제국이 위용을 떨치던 시대부터 중세의 기틀이 형성되기까지의 이야기를 담고 있다. 비단길을 통해 동서양이 서로 통하게 되고 크리스트교, 불교 같은 세계 종교가 탄생한 이야기, 사산 왕조 페르시아 제국과 비잔티움 제국, 돌궐 제국 등 생생하게 살아 움직이는 세계사를 만날 수 있다.",,500,BOOK
도교문화 15강 - 당신이 궁금해 하는 도교에 관한 모든 것,"잔스촹 (지은이), 안동준, 런샤오리 (옮긴이)",51503,국내도서>인문학>동양철학>도가철학/노장철학>도가철학 일반,9788994963105,"베이징대학의 교양강의 교재로 선정된 도교 정통 입문서. 도교는 그저 없었던 것, 얼토당토않은 허무맹랑한 그 무엇이 아니다. 오늘날에 되살려야 하는 소중한 문화다. 이 책은 친근하고 담담한 어조로 수천 년에 걸친 도교의 온갖 방대한 지식을 망라한다. 또한 두 번의 과정을 거친 번역 작업도 믿음직스럽다.","중국의 바탕은 온전히 ‘도교’에 있다!

당신이 궁금해 하는 도교에 관한 모든 것『도교문화 15강』. 베이징대학의 교양강의 교재로 선정된 도교 정통 입문서로, 도교와 관련된 지식과 정보를 전반적이고 포괄적으로 아우른다. 도교의 철학과 사상, 역사, 윤리, 예술에서부터 도교 법술과 수련법, 의학, 제의에 이르기까지 이론과 실용을 막론한 다양한 지식을 망라한다. 저자 잔스촹은 도교와 관련된 거의 모든 주제들을 체계적으로 소개하며, 사상계에서 도교가 차지하고 있는 위상 및 그 현대적 의미까지 다루고 있다. 이를 통해 되살려야 하는 소중한 문화인 ‘도교’를 다시 살펴보는 계기를 마련하며, 친근하고 담담한 어조로 서양문명의 한계를 뛰어넘는 새로운 대안을 제시한다.",212,BOOK
습관부터 바꿔라 - 100만 독자의 인생을 바꾼 『이기는 습관』전옥표 박사의 최신작,전옥표 (지은이),3101,국내도서>경제경영>CEO/비즈니스맨을 위한 능력계발>성공학/경력관리,9788927802426,"삼성이라는 최강 조직에서 혁신과 변화를 이끌었던 명사령관 전옥표 박사의 현장 노하우와 위닝경영연구소에서 수많은 기업과 개인의 컨설팅하며 깨달은 반드시 성과를 내는 방법이 크게는 5단계, 세부적으로 22가지 원리로 담겨 있다.","성과는 의지에 좌우되고 의지는 습관이 결정한다

위닝경영연구소 대표 전옥표의 『습관부터 바꿔라』. 대한민국 직장인의 필독서로 불리는 밀리언셀러 으로 '습관 신드롬'을 일으킨 저자가, 성공을 꿈꾸는 개인이 습관을 구조화하여 자신은 물론, 조직까지 이기도록 만드는 방법을 소개하고 있다. 불황이라는 단어가 일상이 되어버린 지금, 성과를 창출하기 위해 바꿔야 할 것은 전략이 아닌 일상을 지배하는 습관임을 강조한다. 특히 삼성이라는 최강 조직에서 혁신과 변화를 이끈 저자가 깨우친 '습관 바꾸기'의 원리를 22가지 '체인징 해빗(Changing Habit)'으로 정리하여 소개하고 있다. 조직에서 승승장구하고 싶은 사람들뿐 아니라, 조직의 변화를 꿈꾸는 사람들에게 일상에 적용 가능한 살아있는 전략서가 되어준다.",1321,BOOK
엄마가 화났다,최숙희 (지은이),35134,국내도서>유아>그림책>나라별 그림책>한국 그림책,9788993242447,"그림책이 참 좋아 시리즈 3권. 전작 &lt;괜찮아&gt;에서 아이들에게 조금 늦어도 괜찮다는 희망의 말을 건네준, 그리고 &lt;너는 기적이야&gt;에서 아이의 탄생과 성장을 지켜보는 엄마의 감동과 아픔을 대변해 준 그림책 작가 최숙희가, 이번에는 아이와 엄마 사이에서 일상적으로 일어나는 갈등과 화해에 대해 이야기한다.","오늘도 사랑하는 아이에게 화내서 속상하세요?

『엄마가 화났다』는 아이와 엄마 사이에서 일상적으로 일어나는 갈등과 화해에 대해 이야기하는 그림책이다. 좋아하는 자장면을 먹다 신이 난 주인공 산이. 식탁에서 장난을 치자, 엄마는 가만히 앉아서 얌전히 먹으라고 꾸짖는다. 깨끗이 씻으려다 거품이 신기해서 장난을 치자, 엄마는 버럭 소리를 지른다. 그림을 그리다가 종이가 작아서 벽에 그리자, 엄마는 불같이 화를 낸다. 아이의 잘못된 습관과 태도를 지적하다가 자신도 모르게 더 험한 말과 화를 내는 엄마. 속상하고 가슴 아프지만, 아이는 엄마의 마음은 이해하지 못한 채 깊은 상처를 받는다. 이 책은 이런 엄마와 아이를 위해 어떻게 하면 서로를 더 이해하고 제대로 소통할 수 있는지 들려준다. 더불어 상상력이 넘치는 재미있고 감동적인 이야기를 다채로운 그림으로 표현하여 아이들에게 책읽기의 즐거움을 선사한다.",9712,BOOK
고양이 도우미,"다케시타 후미코 (지은이), 스즈키 마모루 (그림), 양선하 (옮긴이)",48877,국내도서>어린이>동화/명작/고전>외국창작동화,9788925539935,"재미난 책이 좋아 시리즈 10권. 일본 초등학교 2.3학년 아침독서운동 추천 도서, 일본 전국학교도서관협의회 선정 도서. 집안일로 너무나 바쁜 하루를 보내고 있던 아주머니 앞에 가사도우미 고양이가 나타난다. 하지만 설거지, 빨래, 청소 그 무엇도 제대로 할 줄 모르는 고양이 도우미는 하는 일마다 실수를 저지르고 마는데…. 가족이란 함께하는 것만으로도 큰 힘이 되는 존재임을 일깨워주는 동화이다.","『고양이 도우미』는  실수투성이 고양이 도우미가 한 가족의 '진짜' 가족이 되기까지 벌어지는 에피소드를 들려주는 이야기다. 집안일로 너무나 바쁜 하루를 보내고 있던 아주머니가 고양이 손이라도 빌리고 싶다고 말한 순간 얼룩 고양이 한 마리가 보따리를 들고 서 있는다. 설거지, 빨래, 청소 그 무엇도 제대로 할 줄 모르는 고양이 도우미가 집안일이라면 뭐든지 잘할 수 있다고 큰소리치면서 하는 일마다 실수를 저지르고 마는데.......",1482,BOOK
달 샤베트,백희나 (지은이),35134,국내도서>유아>그림책>나라별 그림책>한국 그림책,9788996478201,"&lt;구름빵&gt;의 작가 백희나의 두번째 창작책. 아주아주 무더운 여름날 밤 녹아내린 달을 샤베트로 만든 반장 할머니의 이야기이다. 몹시도 더웠던 어느 여름 밤, 자꾸만 데워져 가는 지구를 걱정하다가 떠오른 이야기라고 한다. 지구의 소중함과 환경의 중요성을 일깨워주는 책으로, 환경을 위해 콩기름 인쇄를 했고, 표지코팅은 하지 않았다.","달 샤베트로 더위를 이겨볼까요?!

〈구름빵〉의 저자 백희나의 두번째 창작동화 『달 샤베트』. 이 책은 아주아주 무더운 여름날 밤 녹아내린 달을 샤베트로 만든 반장 할머니의 이야기를 담고 있다. 전기를 너무 많이 써서 정전된 아파트에 '달 샤베트'로 더위를 잊게 만들고, 달이 사라져 버려서 살 곳이 없어진 옥토끼에게 달맞이 꽃으로 달을 만들어준 반장 할머니의 재미있는 생각들이 아이들의 상상력을 자극한다. 또한 이 책의 그림들은 인물 등을 직접 만들어 배경이 있는 세트에 놓고 사진으로 찍어냄으로써 그림에서는 느끼기 어려운 입체감을 느낄 수 있다.",6838,BOOK
1Q84 3 - 10月-12月,"무라카미 하루키 (지은이), 양윤옥 (옮긴이)",50998,국내도서>소설/시/희곡>일본소설>1950년대 이후 일본소설,9788954611800,"최단 기간 밀리언셀러 돌파, 19주 연속 종합 베스트셀러 1위를 차지한 무라카미 하루키의 &lt;1Q84 3&gt;권. 덴고와 아오마메의 장이 교차되었던 1,2권과는 달리 3권에서는 덴고와 아오마메, 그리고 독자의 허를 찌르는 제3의 인물이 매 장을 번갈아 진행하게 된다. 과연 덴고와 아오마메는 서로 만나게 될 것인가? 그리고 두 사람은 두 개의 달이 뜨는 1Q84의 세계에서 벗어날 수 있을까?","당신의 하늘에는 몇 개의 달이 떠 있습니까?

무라카미 하루키가  이후 5년 만에 펴낸 장편소설『1Q84』제3권. 해마다 노벨상 후보에 거론되며, 일본은 물론 세계적으로 많은 사랑을 받고 있는 작가 무라카미 하루키. 그가 이번에는 두 남녀의 아련한 첫사랑 이야기인 동시에 '1Q84'를 헤쳐나가며 겪게 되는 환상적인 이야기를 그렸다. 압도적인 이야기의 강렬함과 흡인력이 돋보인다. 스타일리시한 여자 암살자 아오마메와 작가지망생 덴고. 꽉 막힌 고속도로의 비상계단을 내려오면서 다른 세계로 접어든 아오마메와, 천재적인 문학성을 가진 열일곱 소녀 후카에리를 만나 기묘한 사건에 휘말리게 된 덴고 앞에 '1Q84'의 세계가 펼쳐진다. 그들은 몇 개의 달이 떠 있는 하늘 아래에서 만나게 될까?",34049,BOOK
新일본어 능력시험 한권으로 끝내기 N3 (교재 + 모의테스트 문제집 + 스피드 체크북 + MP3 CD 1장),"이치우, 기타지마 치즈코 (지은이)",49895,국내도서>외국어>일본어>JLPT>N3,9788927710110,"2010년부터 새롭게 시행되는 新일본어 능력시험 N3 대비 교재로, 실제 시험 문제와 같은 형식인 1교시 언어지식(문자.어휘), 2교시 언어지식(문법).독해, 3교시 청해 순으로 구성되었다. 각 분야별로 새롭게 도입된 문제 팬턴의 철저한 분석 및 총정리, 충분한 연습문제가 실려 있다.",,4097,BOOK
광고천재 이제석 - 세계를 놀래킨 간판쟁이의 필살 아이디어,이제석 (지은이),51371,국내도서>에세이>한국에세이,9788956251073,"최고 권위의 뉴욕 원쇼 페스티벌 최우수상, 광고계의 오스카상이라 불리는 클리오 어워드 동상, 미국광고협회가 수여하는 애디 어워드 금상……. 뉴욕으로 건너간 지 2년만에 세계 유수의 국제 광고제에서 무려 29개의 메달을 휩쓴 한국인 이제석. 이 책은 광고천재라는 별명을 얻은 이제석의 광고 세계와 아이디어 필살기, 뉴욕에서의 삶과 직업정신에 대한 단상을 모두 4개장으로 나눠 다룬다. 다소 거칠고 직설적이지만 유쾌하고 기발한 에피소드와 창의력 넘치는 발상법 등을 고스란히 펼쳐 보인다.","한국이 버린 광고천재, 세계를 놀래키다!

지방대 출신의 별 볼 일 없는 간판쟁이였던 이제석. 하지만 뉴욕으로 건너간 지 2년 만에 뉴욕 원쇼 페스티벌 최우수상, 클리오 어워드 동상, 애디 어워드 금상 등 세계 유수의 국제 광고제에서 무려 29개의 메달을 휩쓸게 된다. 공모전 신화를 기록한 그는 세계 최고의 광고 대행사에서 아트 디렉터로 일하며 수많은 히트작을 만들어냈고, 이제 그만의 광고를 만드는 '이제석 광고연구소'를 운영하고 있다.『광고천재 이제석』은 그의 광고 세계와 아이디어 필살기, 뉴욕에서의 삶과 직업 정신에 대한 단상을 담은 책이다. 거칠고 직설적이지만 유쾌하고 기발한 에피소드와 창의력 넘치는 발상법을 보여준다.",5863,BOOK
세상을 바꾼 생각천재들 - 창의력으로 꿈을 이룬 24인의 이야기,"박성철 (지은이), 강일석 (그림)",48899,국내도서>어린이>문화/예술/인물>세계인물,9788981652029,"포테이토칩을 만든 조지 크럼, 빨대를 만든 마빈 스톤, 라면을 만든 안도 모모후쿠, 지우개 달린 연필을 만든 하이만, 코카콜라 병을 디자인한 루드, 일회용 반창고를 만든 어얼 딜슨, 칫솔을 만든 윌리엄 애디스, 전자레인지를 만든 퍼시 스펜서 등 창의력과 상상력으로 세상을 바꾸고 꿈을 이룬 24인의 이야기.","창의력과 상상력으로 꿈을 이룬 24인의 이야기

포테이토칩을 만든 조지 크럼, 빨대를 만든 마빈 스톤, 라면을 만든 안도 모모후쿠, 지우개 달린 연필을 만든 하이만, 코카콜라 병을 디자인한 루드, 일회용 반창고를 만든 어얼 딜슨, 칫솔을 만든 윌리엄 애디스, 전자레인지를 만든 퍼시 스펜서 등 창의력과 상상력으로 세상을 바꾸고 꿈을 이룬 24인의 이야기를 담았다. 불편한 걸 참지 못하고, 실패를 두려워하지 않는 그들의 생생한 일화를 통해 그 누구도 따라올 수 없었던 그들만의 특별한 삶의 비법을 배워 보자.",4848,BOOK
Step by Step MOS 2007 Powerpoint 시험대비서,"Joyce Cox, Joan, Preppernau (지은이), YBM시사닷컴 (엮은이)",6436,국내도서>컴퓨터/모바일>활용능력>MOS/MCAS,9788960415133,2011년 3월부터 시행되는 MOS의 시험의 평가 항목을 기준으로 시험에 필요한 기능한 시험 내용을 익힐 수 있도록 구성하였지만 단순히 시험 교재로써 뿐 아니라 MS Office 2007의 기본적인 기능을 익힐 수 있도록 자세한 기능 설명과 개념 설명을 수록하였다.,,2038,BOOK
문단열의 만만한 패턴으로 영어회화 사로잡기,문단열 (지은이),49849,국내도서>외국어>영어회화>생활영어,9788960373563,실제 대화에서 쓰이는 영어는 알고 있는 패턴에서 크게 벗어나지 않는다. 이미 알고 있는 만만한 패턴으로 자신감을 가지고 새롭게 시작해보자.,"아는 패턴만 활용해도 영어회화가 술술!

문단열의 와인(Wise 人) 시리즈. 『만만한 패턴으로 영어회화 사로잡기』는 우리가 알고 있는 일상적이고 흔한 패턴들로 영어회화를 자연스럽게 할 수 있도록 구성한 책이다. 정말로 많이 사용되고 있는 패턴들만을 수록해 꼭 필요한 상황에서 자유자재로 영어를 구사할 수 있게 하였다.

이 책에서는 유사한 의미의 패턴으로 묶어서 연습한 후 Let's try in conversation에서 실제로 그 패턴이 회화에서 어떻게 쓰이는지 한눈에 보이도록 하였다. 문단열 선생님의 강의를 들은 후 네이티브를 따라 연습하다보면 어느새 230개의 패턴과 영어표현이 내 것이 되어 있음을 느끼게 될 것이다.",4966,BOOK
마지막 강의,"랜디 포시, 제프리 재슬로 (지은이), 심은우 (옮긴이)",70211,국내도서>자기계발>행복론,9788952209245,"췌장암으로 시한부 인생을 선고 받은 교수, 랜디 포시의 마지막 강의를 담은 동영상은 전 세계에 큰 화제를 불러일으켰다. 책으로 출간된 이 강의는 아마존과 뉴욕타임스 베스트셀러 1위에 올랐다. &lt;마지막 강의&gt;는 ‘세상에서 가장 아름다운 작별인사’로 랜디 포시의 인생과, 그가 우리에게 부탁하는 소중한 가치들을 담고 있다.","시한부 선고를 받은 대학 교수의 감동적인 마지막 강의!

이 책은 췌장암으로 시한부 인생을 선고 받은 한 교수의 마지막 강의이자 세상에서 가장 아름다운 작별인사이다. 카네기멜론대학의 컴퓨터공학 교수 랜디 포시. 그는 시한부 암 선고를 받았다. 그러나 좌절하지 않고 남은 시간을 어떻게 하면 재미있게 지낼 수 있는지, 아이들에게 어떤 지혜를 남겨줘야 할지 등을 고민하였다.

그리고 캠퍼스의 마지막 강의에서 학생과 동료 교수들에게 장애물을 헤쳐 나가는 방법, 다른 사람들이 꿈을 이룰 수 있게 돕는 방법, 모든 순간을 값지게 사는 방법, 당신의 인생을 사는 방법 등을 이야기한다. 모두 랜디가 살아오면서 믿게 된 모든 가치의 최종 요약들이다.

특히 행복한 삶은 지금 이 순간에 존재하는 것이며, 매일매일을 감사하며 살라고 조언했다. 이는 오늘을 힘겨워하는 많은 이들에게 내일을 살아갈 용기를 선사하고, 삶을 살아가는 즐거움에 대해 생각할 기회를 제공한다. 자신도 모르게 잃어버렸던 어린 시절의 소중함 꿈을 되찾는 방법에 대해서도 배우게 된다. [양장본]",24841,BOOK
안네의 일기,"안네 프랑크 (지은이), 한상남 (엮은이), 이주현 (그림)",48875,국내도서>어린이>동화/명작/고전>세계명작,9788931919875,"프리미엄 세계 명작선 시리즈 1권. 독일군의 박해를 피해 은신처에 숨어 지내야 했던 15세의 유대인 소녀 안네 프랑크의 일기로, 전쟁에 대한 두려움, 이성 친구에 대한 고민 그리고 자기 자신에 대한 반성과 희망이 생생하게 담겨 있다.","희망을 잃지 않았던 한 소녀의 일기, 꿈과 희망 그리고 평화를 이야기하다

『프리미엄 세계 명작선』시리즈 제1권《안네의 일기》. 본 시리즈는 전 세계 독자들에게 사랑받는 세계 명작 중에서도 어린이가 꼭 읽어봐야 할 작품만을 엄선하여 선별했습니다. 각 권은 원작을 훼손하지 않는 범위에서 어린이의 눈높이에 맞게 쉽게 풀어썼습니다. 1권 안네의 일기는 유태인 소녀 안네의 삶의 기록인 동시에 유태인이었기 때문에 겪어야 했던 고통과 공포가 상세하게 기록된 책입니다. 안네는 은신처에서 숨막히는 공포를 느끼며 불안한 세월을 보내는 동안 사춘기 소녀의 성장 과정과 어른들 세계에 대한 통렬한 비판을 일기 속에 적어 내려갔습니다.",8070,BOOK
"엄마, 나는 자라고 있어요 - 0~20개월까지, 꼬마 아인슈타인을 위한 두뇌육아법","헤티 판 더 레이트, 프란스 X. 프로에이 (지은이), 유영미 (옮긴이), 김수연 (감수)",51786,국내도서>좋은부모>육아>육아법/육아 일반,9788937831652,"각 단계별로 나타나는 아기의 성장 신호와 발달 과정을 알아본다. 단계마다 행동, 시각, 청각, 언어발달, 신체발달, 인지능력, 이해도 등을 주제로 영역별 체크리스트를 제시하고, 아이가 얻게 되는 새로운 지각능력과 학습능력에 대해 다뤘다. 또 부모가 아이의 발달을 도와줄 놀이와 활동, 방법을 상세하게 담았다.","전세계 15개국에 번역되어 100만부 팔린 선진육아법의 바이블

태어나서 20개월까지 어떻게 아기를 키워야 하는 가에 대한 방법을 담은 육아서『엄마 나는 자라고 있어요』. 이 책은 두 명의 발달 심리학자가 30년간 연구한 결과를 아기의 성장과 변화를 중심으로 발달에 관한 관찰법을 담아 정리한 것이다. 아기의 울음과 짜증이 아기의 도약을 의미하는 것이며 그런 증상에 맞춰 엄마들이 어떻게 대처해 나가야 하는가에 관해 설명한다. 

《엄마 나는 자라고 있어요》에서는 아기의 출생부터 10단계의 도약 과정을 건강한 아이 52명의 사례를 중심으로 구성했다. 또한 각 장 끝부분에는 워크북처럼 활용할 수 있도록 아기의 특별한 행동이나 태도를 메모할 수 있도록 했다.",12770,BOOK
난 싫다고 말해요 - 나쁜 사람들로부터 나를 지키는 책,"베티 뵈거홀드 (지은이), 가와하라 마리코 (그림), 이향순 (옮긴이)",35101,국내도서>유아>4~7세>그림책,9788989863489,"책은 언젠가부터 사회적 이슈로 떠오른 아동 성폭력을 예방할 수 있도록, 어린아이들에게 스스로 판단하는 법을 가르쳐 준다. 성적인 것에 대해 무턱대고 덮어 놓는 것이 아니라 아이들이 자신이 원하지 않는 상황에 처했을 때 ""싫어요"", ""안 돼요""라고 말할 수 있도록 돕는 것이다.","유괴ㆍ성폭력을 예방하는 그림책!

『난 싫다고 말해요』는 아이들에게 일어날 수 있는 범죄 상황에서, 아이들 스스로 자신을 지킬 수 있는 방법을 알려주는 그림책입니다. 뒷편에는 부모들이 꼭 알아야 할 성폭력 예방 지침이 실려 있습니다. 

이 책은 백화점, 공원, 아파트, 여행지 등의 공간에서 발생할 수 있는 문제와 성폭력 문제를 자연스럽게 이해할 수 있도록 담아냈습니다. 어린이는 부모와 함께 그림책을 읽으면서, 각 상황에서 자신을 보호하는 방법을 배우게 됩니다.",7670,BOOK
"버전업 굿모닝 독학 일본어 첫걸음 (무료 동영상 강의, MP3 무료 다운로드, 워크북, 핸드북) - 최신 개정판","정선영 (지은이), 오현정 (감수)",49885,국내도서>외국어>일본어>일본어 첫걸음,9788983004925,150만 독자가 선택한 일본어 입문서 베스트 1위를 자랑하는 교재의 최신 개정판. 이 책은 일본어를 전혀 모르는 완전초보자를 위한 독학용 일본어 학습서다.,"더욱 알찬 구성으로 돌아온 일본어 독학 교재!

일본어를 전혀 모르는 완전초보자를 위한 독학용 일본어 학습서『버전업 굿모닝 독학일본어 첫걸음』. 오래된 표현과 회화를 바꾸고 새롭고 참신한 내용으로 새롭게 업그레이드된 최신 개정판이다. 회화문을 통한 문법해결 방식이 아닌 먼저 중요 학습 포인트를 학습한 후 학습자 스스로 회화문의 이해를 돕도록 구성하였다. 현장감 있는 대화체로 하나의 문법을 통해 다른 관련문법도 함께 익힐 수 있는 입체적 학습방법을 제시하고 있다. 또한 일본어 시작의 기본인 [오십음도]는 물론 입문 과정에서 꼭 알아야 할 본문에 나온 한자를 써 보며 익힐 수 있는 [워크북]과 언제 어디서나 휴대 가능한 핸드북을 제공하여, 일본어를 처음 시작하는 학습자들도 쉽게 학습할 수 있도록 배려하였다.",18187,BOOK
