title,author,genre_id,genre,ISBN,description_aladin,description_naver,salesPoint,mallType
굿모닝 예루살렘,"기 들릴 (지은이), 해바라기 프로젝트 (옮긴이)",36192,국내도서>만화>그래픽노블,9788960522152,국경없는 의사회에서 근무하는 아내를 따라 예루살렘에 가게 된 작가의 일상을 1년 동안 함께 한다. 하루 아침에 생겨나는 정착촌을 목격하는 비현실적인 일상도 경험하게 되는 곳. 예루살렘의 이야기이다.,"기나긴 분쟁의 역사에 눌린 평범한 사람들의 삶!

퀘백 출신만화가 기 들릴의 다큐멘터리 만화 『굿모닝 예루살렘』. 전작에서 중국, 버마, 북한을 이야기하였던 작가는 이 작품을 통해 예루살렘 장벽의 실체를 담담하게 이야기하고 있다. 국경없는 의사회에서 근무하는 아내를 따라 예루살렘을 가게 된 작가의 일상을 1년 동안 함께 한다. 작가는 제3세계에 살게 된다는 막연한 기대를 품고 예루살렘에서의 생활을 시작한다. 하지만 예루살렘에서도 아이를 돌보고, 이웃을 만나고, 가끔 휴가를 떠나는 평범한 생활은 계속된다. 역시 사람이 사는 곳은 어느 곳이나 비슷하다는 생각이 들 즈음엔, 정착촌을 목격하는 비현실적인 일을 경험하게 된다. 분쟁의 원인과 단면에 대한 직설적인 표현 대신 사소한 일상을 꼼꼼하고 예리하게 보여주고 있다.",984,BOOK
예언자 - 전2권 (한글판 + 영문판),"칼릴 지브란 (지은이), 유정란 (옮긴이)",51373,국내도서>에세이>외국에세이,9788997213726,"더클래식 세계문학 컬렉션 6권. 칼릴 지브란의 &lt;예언자&gt;는 사랑과 결혼, 기쁨과 슬픔, 이성과 열정 등 삶의 보편적 화두를 다루며 인생을 관통하는 잠언집이다. 때문에 과거보다는 현재가, 현재보다는 미래에 가치가 더해지고 빛을 발하는 책이다.","삶의 진리와 사랑을 전하는 칼릴 지브란의 목소리!

20세기의 예언자 칼릴 지브란이 전하는 삶의 진리와 사랑 『예언자』. 고전 중에서도 세계적으로 그 문학적 가치를 인정받고 시대를 뛰어넘어 사랑받는 작품들을 모은 「더클래식 세계문학 컬렉션」의 여섯 번째 책으로, 영문판을 함께 제공한다. 작은 나라 레바논을 빛낸 칼릴 지브란의 역작인 이 책은 그의 정신적 순례 과정을 담고 있다. 사랑, 결혼, 아이들, 일, 기도, 아름다움, 자유 등 삶의 보편적인 화두를 다루며 인생을 관통하는 잠언집이다. 

예언자 알무스타파는 열두 해 동안이나 기다리던 배가 마침에 오팔리즈 항구에 들어오는 것을 기다리고 있다. 떠나려는 그를 붙잡고 오팔리즈 사람들은 마지막으로 진리를 전해 달라고 청한다. 그의 진리의 말들은 문답 형식으로 진행되고, 드디어 그는 모든 가르침을 끝내고 배에 올라 작별을 고한다. 칼릴 지브란은 사람들에게 여러 가지 진리를 전파하는 예언자의 입을 통해 자신의 사상을 세상 사람들에게 설파하고자 했다.",3716,BOOK
똑똑한 만들기 놀이책,김충원 (지은이),35147,국내도서>유아>유아 교양/학습>유아 문화/예술>미술,9788972217633,"만들기를 처음 시작하는 4~6세 유아를 위해 종이와 가위, 풀, 테이프만 있으면 아주 쉽고 간단하게 완성할 수 있는 만들기 작품 46가지를 소개한다. 혼자서 만들기를 잘하고 즐길 수 있도록, 아이의 눈높이에 맞춰 아주 쉽고 단순하게 내용을 구성했다.","신기하고 놀라운 ‘종이’의 다양한 변신!
‘종이’만 있으면 바로 시작하는 ‘준비물 초간단’ 만들기 놀이!

《똑똑한 만들기 놀이책》은 만들기를 처음 시작하는 4~6세 유아를 위해 종이와 가위, 풀, 테이프만 있으면 아주 쉽고 간단하게 완성할 수 있는 만들기 작품 46가지를 소개합니다. 동물과 식물을 주제로 장난감, 인형, 가면 등 재미있는 작품부터 카드, 지갑, 필통 등 실용적인 작품까지 다양한 만들기가 가득하답니다. 부록 ‘똑똑한 만들기 본’은 만들기에 사용하는 도안이 예쁜 색지 위에 큼직하게 인쇄되어 있어, 도안을 그리는 과정 없이 바로 오리고 만들어서 작품을 완성할 수 있어요.",1755,BOOK
생각 버리기 연습,"코이케 류노스케 (지은이), 유윤한 (옮긴이)",70238,국내도서>자기계발>힐링>마음 다스리기,9788950926298,"쓸데없고 부정적인 생각은 우리를 혼란스럽게 만들어 실패를 가져온다. 하지만 이런 잡다한 생각을 멈추기란 쉬운 일이 아니다. 일본 전서점 베스트셀러의 저자인 코이케 류노스케 스님은 우리를 괴롭히는 잡념의 정체를 짚어내며, 일상에서 바로 실천할 수 있는 생각 버리기 연습을 제시한다.","생각병을 치유하다!

일본 쓰키요미지 주지 스님으로 일반인을 위한 좌선 지도를 해온 코이케 류노스케의 『생각 버리기 연습』. 뇌의 역할을 지나치게 강조하고 감사하게 여기는 풍조를 뒤엎을 '휴뇌법'을 공개한다. '생각 버리기 연습'을 통해 우리를 끝없이 괴롭히는 잡념의 정체를 밝혀, 그것을 완전히 없애는 방법을 배울 수 있다. '말하기'부터 '기르기'까지 8가지 영역으로 나누어 일상생활에서 쉽게 실천하도록 인도한다. 특히 생각하지 않고 오감으로 느낌으로써 어지러운 마음을 서서히 사라지게 하도록 이끌고 있다. 뇌를 쉬게 할 뿐 아니라, 충전하여 날카로움과 명철함으로 가득한 새로운 세계로 들어서게 될 것이다.",22180,BOOK
4천만이 검색한 오늘의 요리 - 네이버 최다 검색인기메뉴를 스타 블로거 요안나가 쉽고 맛있게,이혜영 (지은이),53472,국내도서>요리/살림>생활요리,9788961884310,"하루 평균 방문객 2만 명, 총 방문객 700만에 이르는 파워 블로그 ‘요안나의 행복이 팍팍’의 주인장이자 20년차 베테랑 주부인 요안나의 솜씨로 만나볼 수 있다. 주부들의 가장 큰 고민인 저녁 식사 메뉴뿐만 아니라 아침 식사, 점심 식사는 물론이고 주말 특별식, 만사가 귀찮은 날 후다닥 해먹는 일품 요리, 폼 나는 초대 요리, 간식과 베이킹 등이 두루 담겨 있다.","네이버 최다 검색 인기 메뉴를 파워블로거 요안나가 쉽고 맛있게 소개한 요리책

'오늘 뭐 해먹지?' 를 고민하는 대한민국 평균 주부를 위한 『4천만이 검색한 오늘의 요리』. 대한민국 사람들이 1년간 포털사이트 네이버에서 검색한 요리 중 월별 검색 순위 1위~100위에 오른 요리에서 식탁에 자주 오르는 메뉴를 선별하고 거기에 몇 가지를 더해 모두 186가지 대한민국 대표 메뉴를 담았다. 아침, 점심, 저녁 식사는 물론이고 주말 특별식, 만사가 귀찮은 날 후다닥 해먹는 일품요리, 폼 나는 초대 요리, 간식과 베이킹이 두루 담겨 있다. 각 레서피들은 현재 네이버 오픈캐스트 발행 키친 분야 1위를 차지하고 있는 파워블로거 요안나 이혜영이 쉽고 맛있게 소개한다.",11282,BOOK
엄마를 부탁해,신경숙 (지은이),50993,국내도서>소설/시/희곡>한국소설>2000년대 이후 한국소설,9788936433673,"2011년 맨 아시아 문학상 수상작으로, 신경숙의 8번째 장편소설이다. 2007년 겨울부터 2008년 여름까지「창작과비평」에 연재된 작품이다. 지하철역에서 아버지의 손을 놓치고 실종된 어머니의 흔적을 추적하면서 기억을 복원하는 과정을 그렸다. 각 장은 전단지를 붙이고 광고를 내면서 엄마를 찾아 헤매는 자식들과 남편, 엄마의 시선으로 전개된다.","어머니로서 아내로서 여자로서 엄마는 어떤 인생을 살았을까?

우리 어머니들의 삶과 사랑을 절절하고 아름답게 그려낸 신경숙의 소설『엄마를 부탁해』. 2007년 겨울부터 2008년 여름까지 '창작과비평'에 연재되어 뜨거운 호응을 받았던 작품으로, 작가가  이후에 펴내는 여덟 번째 장편소설이다. 연재 후 4장으로 구성된 원고를 정교하게 수정하고, 100여 장에 달하는 에필로그를 덧붙였다. 

소설의 이야기는 시골에서 올라온 엄마가 서울의 지하철 역에서 실종되면서 시작된다. 가족들이 사라진 엄마의 흔적을 추적하며 기억을 복원해나가는 과정은 추리소설 같은 팽팽한 긴장감을 유지하면서 전개된다. 늘 곁에서 무한한 사랑을 줄 것 같은 존재였던 엄마는 실종됨으로써 가족들에게 새롭게 다가오고 더욱 소중한 존재가 된다. 

각 장은 엄마를 찾아 헤매는 자식들과 남편, 그리고 엄마의 시선으로 펼쳐진다. 딸, 아들, 남편으로 관점이 바뀌면서 이야기가 펼쳐질 때마다 가족들을 위해 평생을 헌신해온 엄마의 모습이 생생하게 되살아난다. 각자가 간직한, 그러나 서로가 잘 모르거나 무심코 무시했던 엄마의 인생과 가족들의 내면을 섬세하게 그려내고 있다.",83806,BOOK
연금술사,"파울로 코엘료 (지은이), 최정수 (옮긴이)",50920,국내도서>소설/시/희곡>스페인/중남미소설,9788982814471,"세상을 두루두루 여행하기 위해 양치기가 된 청년 산티아고의 '자아의 신화' 찾기 여행담. 자칫 딱딱하게 보일 수 있는 제목과는 달리 간결하고 경쾌한 언어들로 쓰여 있어서, 물이 흘러가듯 수월하게 읽히는 작품이다.","삶에 대한 깊은 통찰을 담은 현대의 고전!

1987년 출간이후 전세계 120여 개국에서 변역되어 2,000만 부가 넘는 판매량을 기록한 파울로 코엘료의 『연금술사』. 청년 산티아고가 만물에 깃들인 영혼의 언어들을 하나하나 배워가는 과정을 그리고 있다. 마음의 목소리에 귀를 기울이는 것이 얼마나 중요한지를 증언하고, 진정 자기 자신의 꿈과 대면하고자 하는 모든 이들을 축복하는 희망과 환희의 메시지를 담은 작품이다. 

신부가 되기 위해 라틴어, 스페인어, 신학을 공부한 산티아고는 어느 날 부모님의 기대를 저버리고 떠돌아다니기 위해 양치기가 되어 길을 떠난다. 그의 인생을 살맛나게 해주는 건 ‘꿈이 실현되리라고 믿는 것’. 언제나 자신이 원하는 게 무엇인지 알고 있어야 한다는 늙은 왕의 말과 그가 건네준 두 개의 보석을 표지로 삼아 기약없는 여정에 뛰어든 그는 집시여인, 늙은 왕, 도둑, 화학자, 낙타몰이꾼, 아름다운 연인 파티마, 절대적인 사막의 침묵과 죽음의 위협 그리고 마침내 연금술사를 만나 자신의 보물을 찾게 되는데…….",82666,BOOK
하늘의 유실물 12,미나즈키 수 (지은이),4134,국내도서>만화>본격장르만화>판타지>드라마틱 판타지,9788954248204,,Suu Minazuki의 만화 『하늘의 유실물』 제12권. 내 이름은 사쿠라이 토모키. 세계 유람을 떠났던 엄마가 집으로 돌아왔다! 여자를! 그리고 미남을! 너무나 사랑하는 엄마가 마수를 뻗친 상대는 에이시로 선배! 그건 좀 곤란한데… 에이시로 선배는 ‘그’ 학생회장이 이미 찜 했거든요?! 이렇게 해서 사츠키타네 가문과 사쿠라이 가문의 목숨을 건 전쟁이 시작된다!,372,BOOK
8282 아침상 - 10분 안에 만들고 5분 안에 먹는다,최경진 (지은이),53472,국내도서>요리/살림>생활요리,9788997686063,요일별로 정리한 레시피를 통해 한 가지 재료로 다양한 메뉴를 즐길 수 있도록 한다. 곧바로 실생활에 적용하고 싶어지는 실용적인 레시피들을 차근차근 따라가다보면 ‘오늘은 또 뭘 먹나’ 하는 고민은 사라지고 아침상에 대한 기대가 커질 것이다.,"바쁜 아침을 배부르고 맛있게!

시간, 맛, 건강을 모두 챙기는 생활밀착형 아침밥 레시피 『8282 아침상』. 요리 커뮤니티 《82cook》에서 ‘쟈스민’이라는 닉네임으로 활동하며 인기를 얻은 저자가 고등학생 딸에게 차려준 1년 동안의 아침밥 일기이다. 바쁜 아이에게 무엇이라도 먹여 보내기 위한 엄마의 고민이 고스란히 담겨 있다. 빠르게 준비해서 맛있게 만들어내는 134가지 알찬 레시피로 아이는 물론 온가족의 아침상을 책임진다. 손으로 집어먹을 수 있는 간편밥부터 먹기 쉽게 꾹 누른 샌드위치, 시판 제품으로 재빨리 만들어내는 한 접시 요리까지 만날 수 있다. 시간은 여유있게, 배는 든든하게 집을 나설 수 있도록 도와주는 아침상 노하우를 전한다.",1077,BOOK
다이어터 한정판 세트 - 전3권,"네온비 (지은이), 캐러맬 (그림)",7443,국내도서>만화>인터넷 연재 만화,9788927802419,"온오프라인에서 폭팔적인 반응을 얻으며 다이어트 만화의 절대 갑(甲)으로 불리던 &lt;다이어터&gt;가 완결되었다. 고도비만의 늪에서 허우적 거리던 주인공 '수지'의 체중은 어느새 60kg대로 줄어들며 결실을 맺었다. 고급 양장 케이스, 디지털 체중계, 캐릭터 엽서 세트로 구성되었다.","고도비만 25세 신수지의 본격 다이어트!

건강한 생활을 위한 본격 다이어트 한정판 웹툰만화 『다이어터 세트』. 포털사이트 Daum의 ‘만화속 세상’에 연재되었으며, 네티즌들의 입소문을 타고 인기를 누리고 있는 웹툰 ‘다이어터’를 담은 책이다. 다이어트에 대한 환상은 모두 걷어내고, 25세 신수지의 다이어트 과정을 보여주면서 생생한 다이어트법을 흥미진진하게 소개한다. 무절제한 생활로 고도비만의 삶을 사는 25세 신수지는 잘못된 다이어트를 반복하며 돈도 버리고, 좌절에 빠져든다. 그러던 어느 날 그녀에게 악마 같은, 그리고 빈대 같은 다이어트 트레이너 서찬희가 나타난다. 음식 조절부터 운동, 생활습관에 이르기까지 본격적인 다이어트를 위한 동거가 시작되는데….

▶ 『다이어터』 1권부터 3권까지를 엮은 세트입니다. (전3권)",212,BOOK
ZE : 카미의 책 - 뉴 루비코믹스 1276,시미즈 유키 (지은이),6130,국내도서>만화>순정만화>그 남자들의 사랑,9788927006800,겐마의 심술에 취해 쓰러진 류세이와 부끄러운 듯 조르며 겐마의 화를 누그러뜨리는 히미. 아사리의 수작에 휘둘리는 쇼우이와 라이조의 침실에 난입하는 와키. 스핀오프 스토리 외 추가 번외편 26페이지를 수록하였다.,Yuki Shimizu의 만화『ZE 카미의 책』. 겐마의 심술에 취해 쓰러진 류세이와 부끄러운 듯 조르며 겐마의 화를 누그러뜨리는 히미. 아사리의 수작에 휘들리는 쇼우이와 라이조의 침실에 난입하는 와키. 《ZE》의 스핀오프 스토리 외 추가 번외편 26페이지 수록!,675,BOOK
"하루 10분, 내 아이를 생각하다 - 소아청소년정신과 전문의 서천석의 '트윗 육아'",서천석 (지은이),51790,국내도서>좋은부모>육아/교육 에세이,9788926399934,"대부분의 부모는 아이를 키우면서 셀 수 없는 고민을 하고 어려움을 겪는다. 하지만 어떤 부모는 늘 비슷비슷한 고민을 반복하고, 또 어떤 부모는 문제를 하나둘씩 해결해가며 아이와 함께 성장한다. 소아청소년정신과 전문의 서천석은 그 해답을 ‘생각의 차이’에서 찾았다. 아이를 키우면서 ‘얘는 도대체 왜 이럴까’ 라는 생각 대신 ‘부모인 내가 무얼 어떻게 잘 도울 수 있을까’를 생각해야 부모와 아이 모두 행복해질 수 있다는 것.","육아에 지친 외로운 부모들의 마음을 달래주는 격려의 메시지!

MBC 라디오 ‘여성시대’의 ‘우리 아이 문제없어요.’ 코너에서 아이들의 문제를 상담해주는 소아청소년 정신과 전문의 서천석의 육아 지침서『하루 10분 내 아이를 생각하다』. 이 책은 파워 트위터리안인 저자가 트위터에 올려 많은 이들의 사랑을 받았던 육아에 대한 단상 중 부모들에게 큰 방향을 일으킨 글을 모아 엮은 것이다. 어려운 지침들이 아닌 이미 알고 있지만 실천하지 못하는 것들을 실천할 수 있도록 적절한 방법을 알려주고, 구체적인 상황별 대처법을 제시한다. “괜찮아, 잘했어, 사랑해.” 짧은 세 마디 말이 아이를 키운다고 이야기하고, 아이에게 신뢰를 얻고 있다면 권위는 저절로 얻어짐을 일깨워준다. 더불어 부모의 교육이란 생활의 매순간에 나누는 대화임을 깨닫게 해준다. 이와 같이 365가지의 이야기를 통해 아이의 심리와 행동을 이해하고 스스로 어떤 양육자가 되어야 하는지를 생각할 기회를 전해준다.",11648,BOOK
우아한 거짓말,김려령 (지은이),50759,국내도서>청소년>청소년 문학>청소년 소설,9788936456221,"2008년, 출판계에 성장소설 붐을 일으키며 베스트셀러가 된 <완득이>의 작가 김려령의 새로운 청소년 소설. 촌철살인의 문장과 날카로운 재치가 돋보이는 ‘김려령표’ 문체는 여전하지만, 인간관계와 심리를 깊숙이 파고든 작품의 메시지가 새로이 눈길을 사로잡는다.
","『완득이』의 작가 김려령의 신작! 나를 지키기 위한 잔인한 거짓말...

『완득이』의 작가 김려령이 선보이는 새로운 장편소설『우아한 거짓말』. 이 작품은 평범해 보이던 열네 살 소녀의 죽음에서 시작된다. 동생의 죽음을 이해할 수 없었던 언니는 동생이 남긴 흔적을 살펴보고, 숨겨져 있던 진실이 그 모습을 드러낸다. 〈완득이〉와는 전혀 다른 분위기의 작품이지만, 한층 깊고 넓어진 작가의 문학세계를 엿볼 수 있다. 

열네 살 소녀 천지가 자살한다. 언니 만지는 동생이 남긴 흔적을 좇으며 퍼즐을 맞추어간다. 가까웠던 친구 화연은 친구들 사이에서 자신의 자리를 지키기 위해 천지를 이용했고, 천지가 사랑했던 가족들은 그녀의 고민을 알아주지 못했다. 하지만 천지는 자신이 미워했고 사랑했던 사람들에게 용서의 편지를 남겼는데…. 

이 소설에서 사건의 실마리를 추적하는 과정과 인물들의 심리는 쉽게 드러나지 않는다. 추리소설을 보는 듯한 구성과 복선이 팽팽한 긴장감을 선사한다. 특히 산 자와 죽은 자, 두 가지 시점에서 이야기를 교차시키며 천지와 주변인물들을 둘러싼 사건과 감정의 변화를 세밀하게 묘사했다. '죽은 자'인 천지는 내레이션을 통해 그동안 겪어온 가슴 아픈 일들과 고통을 솔직하게 털어놓는다.",30007,BOOK
고 녀석 맛있겠다 - 별하나 그림책 4,"미야니시 타츠야 (지은이), 백승인 (옮긴이)",35139,국내도서>유아>그림책>나라별 그림책>일본,9788990364661,"옛날 아주 먼 옛날, 아기 안킬로사우르스가 알에서 깨어나 아빠를 찾아 터덜터덜 걸어건다. 그런데, 갑자기 티라노사우르스가 나타나 군침을 흘리며 말한다. ""헤헤헤... 고 녀석 맛있겠다."" 그때 아기 안킬로사우르스가 말한다. ""아빠! 슬펐어요. 무서웠어요."" 그리고 왈카닥 매달린다.","옛날 아주 먼 옛날, 아기 안킬로사우르스가 알에서 깨어나 아빠를 찾아 터덜터덜 걸어건다. 그런데, 갑자기 티라노사우르스가 나타나 군침을 흘리며 말한다. ""헤헤헤... 고 녀석 맛있겠다."" 그때 아기 안킬로사우르스가 말한다. ""아빠! 슬펐어요. 무서웠어요."" 그리고 왈카닥 매달린다.



안킬로사우르스는 자신의 이름이 '맛있겠다'라고 알아 듣고, 태어나서 처음 본 공룡이자 자신에게 처음으로 '이름'을 불러준 티라노사우르스를 아빠로 안 것. 졸지에 안킬로사우르스의 아빠가 된 티라노사우르스는 처음엔 어이없어 하지만 갈수록 이 작은 공룡의 보호자 노릇을 하는 것에 재미를 붙인다.



자기를 먹잇감으로 생각하는 티라노사우르스를 아빠로 착각하는, 생존본능이 0에 가까운 어벙한 아기 공룡과 안킬로사우르스를 통해 처음으로 '따뜻한 사랑'을 경험하는 티라노사우르스의 이야기가 유머러스하게 펼쳐진다. 자기를 보고 '맛있겠다'고 입맛을 다시는 다른 공룡들을 보고, ""어, 저 아저씨도 나를 알고 있네."" 라고 납득하는 귀여운 공룡의 모습에 웃지 않을 수 없다.



☞ 한겨레 기사 보기",20443,BOOK
솔이의 추석 이야기,이억배 (지은이),35134,국내도서>유아>그림책>나라별 그림책>한국 그림책,9788986621198,"추석날 아침 고향으로 떠나는 솔이네 가족들의 모습을 주인공으로, 추석 명절의 풍경을 그려낸 그림책. 명절을 맞는 사람들의 모습, 길거리의 풍경들이 솔이의 하루를 통해 자세히 그려졌다.","온 가족이 함께 하는 추석!

이억배의 『솔이의 추석 이야기』. 해마다 추석이나 설날이 되면 도시는 텅 비어 버리지만, 시골은 가득 채워집니다. 도시에 살던 사람들이 자신의 고향으로 가기 때문이지요. 이 그림책은 도시에 사는 솔이네 가족이 추석을 지내기 위해 시골로 가면서 벌어지는 사건사고를 담아냈습니다. 그동안 소홀한 가족과의 사랑을 확인할 뿐 아니라, 이웃과 기쁨과 슬픔을 함께 나누는 추석의 의미를 되새기면서 고향의 푸근함과 정겨움을 듬뿍 느끼게 해줍니다. 

추석이 다가와요. 사람들은 고향에 갈 준비를 하느라 바쁘군요. 솔이네 가족은 아침 일찍 집에서 나섰어요. 하지만 버스 터미널에는 고향으로 가는 사람들로 가득하네요. 도로가 꽉 막혀버렸어요. 고향으로 가는 사람들이 탄 차로요. 드디어 시골에 도착했어요. 할머니가 반갑게 맞아주셨지요. 온가족이 모였어요. 맛있는 음식도 만들어요. 송편도 만들었답니다. 추석 날 아침 일찍 일어나 정성껏 차례를 지내요. 다음에는 성묘를 간대요. 그런데 마을에서 풍물 소리가 들려왔는데…….",22387,BOOK
강아지똥,"권정생 (글), 정승각 (그림)",35134,국내도서>유아>그림책>나라별 그림책>한국 그림책,9788986621136,"이 책은 가장 낮은 곳으로부터의 아름다움을 감격스럽게 그린 어린이 그림책이다. 아무도 거들떠 보지 않고 쓸모없는 것으로 치부해 버리는 강아지똥, 그 똥이 민들레 꽃으로 다시 태어나는 과정을 통해 어린이들에게 자연의 감동스럽고 신비스러운 이치를 자연스럽게 보여 준다.","""쓸모없는 것은 없단다.""

『강아지똥』은 아동작가 권정생의 대표작으로, 아무도 거들떠 보지 않는 세상에서 가장 버림받는 존재인 '강아지똥'도 알고 보면 정말 소중한 존재라는 사실을 일러주는 그림책입니다. 아무짝에도 쓸모없는 것처럼 여겨지는 강아지똥이라는 한낱 미물이 민들레 꽃을 피워내는 데 소중한 거름이 된다는 이야기가 펼쳐집니다. 화가 정승각의 그림은 의인화된 강아지똥과 강아지똥이 만나는 주변 친구들의 모습을 감동적으로 그려냈습니다.",70800,BOOK
메이드 인 코리아 7 - Seed Novel,"이금영 (지은이), 19 (그림)",51071,국내도서>소설/시/희곡>라이트 노벨>시드(Seed) 노벨,9788926781579,마침내 신임 교장에게 인정을 받은 메이드 광(狂) 한지현에게 더 큰 위기가 찾아온다. 교내 도난 사건의 범인으로 지목되고 명백한 증거로 인해 빼도 박도 못하는 상황. 퇴학 유예기간 동안 기숙사에 갇힌 한지현을 두고 악성 소문이 퍼진다.,"이금영의 SEED NOVEL 『메이드 인 코리아』 제7권. 마침내 신임 교장에게 인정을 받은 메이드 광(狂) 한지현에게 더 큰 위기가 찾아온다. 교내 도난 사건의 범인으로 지목되고 명백한 증거로 인해 빼도 박도 못하는 상황. 퇴학 유예기간 동안 기숙사에 갇힌 한지현을 두고 악성 소문이 퍼진다. 참을 수 없게 된 천은혜를 비롯한 슈팅게임부의 소녀들은 한지현을 구하기 위해 나선다. 평소에 한지현을 껄끄럽게 여기던 교내 사교계의 마왕 오덕배가 이들을 비웃지만, 천은혜는 모두가 괄시하는 한 소년의 결백을 되찾기 위해 물불을 가리지 않는다. ""만일 지현이가 범인이 아니라면, 각오해 두는 게 좋을 거야."" 거리로 나선 소녀들에게 차례대로 닥쳐오는 거대한 위협의 정체는···?!",144,BOOK
