title,author,genre_id,genre,ISBN,description_aladin,description_naver,salesPoint,mallType
"멈추면, 비로소 보이는 것들 - 혜민 스님과 함께하는 내 마음 다시보기","혜민 (지은이), 이영철 (그림)",51371,국내도서>에세이>한국에세이,9788965700609,"관계에 대해, 사랑에 대해, 마음과 인생에 대해, 머리로는 알지만 마음으론 잘 안 되는 문제들을 하나하나 해결해나갈 수 있도록 돕는 혜민 스님의 마음 매뉴얼. '영혼의 멘토, 청춘의 도반' 혜민 스님이 위로와 성찰의 메시지를 전한다. 마음이 힘들 때, 위로받고 싶을 때, 용기 내고 싶을 때 펼쳐보면 좋은 책이다.",,96915,BOOK
"의자놀이 - 공지영의 첫 르포르타주, 쌍용자동차 이야기",공지영 (지은이),51059,국내도서>사회과학>비평/칼럼>한국사회비평/칼럼,9788958625254,"2009년 쌍용자동차 2,646명의 해고 발표와 뒤이은 77일간의 옥쇄파업. 파업은 인간사냥과도 같은 경찰의 진압으로 끝나고, 어제까지 함께 울고 웃으며 일했던 동료는 오늘, 의자에서 쫓겨난 자와 의자를 잡은 자 두 편으로 나뉘었다.","공지영이 이야기하는 또 다른 도가니!

《도가니》, 《우리들의 행복한 시간》의 저자 공지영의 첫 르포르타주『의자놀이』. 2009년 쌍용자동차 2,646명의 해고 발표 이후 시작된 77일간의 뜨거운 파업의 순간부터 22번째 죽음까지 작가적 양심으로 써내려간 쌍용자동차 이야기를 담은 책이다. 인간사냥과도 같은 경찰의 진압으로 파업이 끝나고, 어제까지 함께 울고 웃으며 일했던 동료들이 의자에서 쫓겨난 자와 의자를 잡은 자 두 편으로 나뉘게 되기까지의 잔혹한 의자놀이와 연이은 죽음에 대해 이야기한다. 쌍용자동차 노동자, 대체 그들에게 무슨 일이 있었기에 죽음의 그림자가 이토록 깊게 드리운 것인지 생각해보고, 우리 모두의 의자를 위해 우리가 해야 할 일은 무엇인지 깊이 고민해볼 기회를 전해준다.",11025,BOOK
안철수의 생각 - 우리가 원하는 대한민국의 미래 지도,"안철수 (지은이), 제정임 (엮은이)",51059,국내도서>사회과학>비평/칼럼>한국사회비평/칼럼,9788934958710,"안철수 교수의 정치 참여에 대한 고민에서 인간 안철수에 대한 궁금증, 사회 쟁점에 대한 견해, 복지와 정의와 평화를 바탕으로 쌓아올린 대한민국의 비전과 통찰, 그리고 미래의 주인공인 청소년들에 대해 제정임 교수와 이야기하고 이를 책으로 엮은 것이다.","가슴 가장 깊숙한 곳에서 꺼내놓는 안철수의 생생한 육성과 내면 고백!

우리가 원하는 대한민국의 미래 지도『안철수의 생각』. 유력한 대권 후보로 거론되는 서울대학교 융합과학기술대학원장 안철수와 세명대 저널리즘스쿨대학원 교수 제정임의 대담집이다. 정치 참여에 대한 고민부터 인간 안철수에 대한 궁금증, 사회 쟁점에 대한 견해와 대한민국의 비전과 통찰, 미래의 주인공인 청소년들에 대한 이야기를 담고 있다. 지금의 ‘안철수 현상’을 들어 낡은 체제와 미래 가치의 충돌이라고 말하고, 자신에 대한 기대가 환상이나 거품이 낀 것은 아닌지에 대한 냉철한 판단하는 등 저자의 다양한 생각들을 통해 저자가 지나치리만큼 정치 참여 문제에 신중을 기하는 이유를 알아볼 수 있다. 더불어 한국사회의 현재와 미래에 대한 생각과 정의로운 복지국가의 전제인 평화 체제 구축의 중요성에 대해 이야기하는 등 대한민국이 가야할 길을 그리고 있다. 세상의 긍정적인 변화를 추구하며 달려온 저자의 경험과 지식, 고민은 한국사회의 변화를 바라는 많은 이들에게 안철수라는 인물을 이해하는데 길잡이가 되어준다.",29732,BOOK
그레이의 50가지 그림자 1,"E. L. 제임스 (지은이), 박은서 (옮긴이)",50919,국내도서>소설/시/희곡>영미소설,9788952766441,"E L 제임스의 로맨스 소설. 과거 아픔을 지닌 27세의 억만장자 크리스천 그레이와 이제 막 대학을 졸업한 21세의 아니스타샤 스틸의 파격적인 사랑을 관능적인 묘사로 그려낸 작품으로, 출간되자마자 폭발적인 판매 부수를 기록했다.","세계적인 열풍을 일으킨 관능적인 로맨스!

전 세계 여성들을 사로잡은 사랑 이야기 『그레이의 50가지 그림자』 제1권. 전 텔레비전 방송사 간부이자 평범한 주부인 작가 E. L. 제임스의 첫 소설로 출간 석 달 만에 시리즈 포함 총 2100만 부가 판매되었고, 영화 판권 역시 높은 금액으로 판매되어 화제를 낳았다. 아픔을 지닌 젊은 억만장자 크리스천 그레이와 이제 막 대학을 졸업한 아나스타샤 스틸의 파격적인 사랑을 관능적인 묘사로 그려냈다. 아픈 친구를 대신하여 청년 부호 그레이를 인터뷰하게 된 영문학과 졸업반의 아나스타샤. 처음 만난 순간부터 그레이는 아나에게 기묘한 관심을 보이고, 그녀 역시 젊고 잘생긴 그레이에게 끌리지만 자신과는 다른 세계 사람이라 생각하며 애써 잊으려 한다. 며칠 후, 우연히 그와 만나게 된 아나는 그레이를 향한 자신의 마음을 깨닫고 그를 잡는다. 그러나 그레이가 원하는 것은 평범한 사랑이 아닌 깊고 어두운 그 무엇이었는데….",6496,BOOK
천 번을 흔들려야 어른이 된다 - 세상에 첫발을 내디딘 어른아이에게,김난도 (지은이),52906,국내도서>에세이>명사에세이>기타 명사에세이,9788954618984,국내 출판 역사상 최단기간에 밀리언셀러를 기록한 &lt;아프니까 청춘이다&gt;의 저자 김난도 교수의 에세이. 청춘의 불안을 지나 세상 속에서 뜨거운 볕을 맨몸으로 견디며 흔들리고 있는 어른아이들을 위한 '란도샘'의 가슴 벅찬 인생 멘토링이 시작된다.,"흔들리며 어른의 문턱에 선 이들에게 보내는 란도샘의 가슴 벅찬 인생 멘토링!

《아프니까 청춘이다》의 저자 김난도가 들려주는 새로운 이야기를 담은 에세이『천 번을 흔들려야 어른이 된다』. 청춘의 불안을 지나 세상 속에서 뜨거운 볕을 맨몸으로 견디며 흔들리고 있는 어른아이들, 어른이라 불리는 이들이 짊어져야 하는 “당신은 어른입니까”라는 질문의 무게에 관해 이야기하는 책이다. 학교를 떠나 사회에 나가 겨우 어른 되기를 시작할 때의 그 흔들림, 사회초년생들이 힘겨워하는 문제와 딜레마 들을 다양한 사례를 통해 보여주고 함께 고민한다. 조금은 흔들려도 괜찮다고, 지금의 흔들림은 지극히 당연한 어른 되기의 여정이라는 위로와 응원의 메시지를 전하며 어른의 흔들림은 자연스러운 것이며, 그러므로 부끄러워하지도 말고 너무 많이 아파하지도 말라는 것, 삶이 나를 거칠게 흔들 땐 꼿꼿이 버티다가 나가떨어지거나 부러지기보단 함께 흔들리며 한 뼘씩 성장하고 새로워지는 것이 진짜 어른이라는 것을 일깨워준다.",16383,BOOK
그레이의 50가지 그림자 2,"E. L. 제임스 (지은이), 박은서 (옮긴이)",50919,국내도서>소설/시/희곡>영미소설,9788952766458,"E L 제임스의 로맨스 소설. 과거 아픔을 지닌 27세의 억만장자 크리스천 그레이와 이제 막 대학을 졸업한 21세의 아니스타샤 스틸의 파격적인 사랑을 관능적인 묘사로 그려낸 작품으로, 출간되자마자 폭발적인 판매 부수를 기록했다.","세계적인 열풍을 일으킨 관능적인 로맨스!

전 세계 여성들을 사로잡은 사랑 이야기 『그레이의 50가지 그림자』 제2권. 전 텔레비전 방송사 간부이자 평범한 주부인 작가 E. L. 제임스의 첫 소설로 출간 석 달 만에 시리즈 포함 총 2100만 부가 판매되었고, 영화 판권 역시 높은 금액으로 판매되어 화제를 낳았다. 아픔을 지닌 젊은 억만장자 크리스천 그레이와 이제 막 대학을 졸업한 아나스타샤 스틸의 파격적인 사랑을 관능적인 묘사로 그려냈다. 아픈 친구를 대신하여 청년 부호 그레이를 인터뷰하게 된 영문학과 졸업반의 아나스타샤. 처음 만난 순간부터 그레이는 아나에게 기묘한 관심을 보이고, 그녀 역시 젊고 잘생긴 그레이에게 끌리지만 자신과는 다른 세계 사람이라 생각하며 애써 잊으려 한다. 며칠 후, 우연히 그와 만나게 된 아나는 그레이를 향한 자신의 마음을 깨닫고 그를 잡는다. 그러나 그레이가 원하는 것은 평범한 사랑이 아닌 깊고 어두운 그 무엇이었는데….",5099,BOOK
마조 앤 새디 vol.2 - 탐나는 주부 마조의 영근영근한 생활툰,정철연 (지은이),7443,국내도서>만화>인터넷 연재 만화,9788959137015,이번에 출간된 2편에서는 하루하루 주부로서의 품격과 아우라를 짙게 갖춰가는 마조의 이야기들이 펼쳐진다. ‘마조마조 상담소’ ‘의표’ ‘잊혀진 찬장’ ‘오늘의 반찬’ ‘불지옥’ 등의 에피소드에서 주부로서의 노하우와 공감 요소를 느낄 수 있다.,"주부의 품격과 아우라를 갖추어가는 마조의 깨알같은 생활일기!

≪마린블루스≫의 작가 정철연의 만화 『마조 앤 새디』 제2권. 이 책은 막 주부생활을 시작한 초보 주부로서 겪는 다양한 사건사고를 보여주었던 제1권에 이어 마조와 새디 부부의 알콩달콩한 일상을 재미있게 보여주고 있다. ‘마조마조 상담소’, ‘의표’, ‘잊혀진 찬장’, ‘오늘의 반찬’, ‘불지옥’ 등의 에피소드를 통해 주부로서의 경험치가 녹아있는 깨알 같은 노하우를 얻을 수 있을 것이다. 특히 본권에서는 마조&새디의 실속있는 여행에 관한 이야기를 선보인다. 비행기를 타지 않고도 세계의 맛을 즐기는 ‘이태원으로 떠나는 맛집세계여행’을 비롯하여 2010년에 다녀온 도쿄 여행기가 수록되었다. 뼛속까지 주부인 마조가 선호하는 도쿄 현지의 음식과 다양한 장소들을 다루어 현장감 있는 재미를 더해준다.",2112,BOOK
파도가 바다의 일이라면,김연수 (지은이),50993,국내도서>소설/시/희곡>한국소설>2000년대 이후 한국소설,9788954428224,"동인문학상, 황순원문학상, 이상문학상, 동서문학상, 대산문학상 수상작가 김연수의 장편소설. 2011년 여름부터 2012년 여름까지 계간 「자음과모음」, 중국 격월간「소설계」에 '희재'라는 제목으로 한.중 문예지 동시 연재를 했던 작품이다.",,6598,BOOK
바람이 분다 당신이 좋다 - 이병률 여행산문집,이병률 (지은이),51371,국내도서>에세이>한국에세이,9788993928488,"이병률 여행산문집. &lt;끌림&gt; 두 번째 이야기. 길 위에서 쓰고 찍은 사람과 인연, 사랑. 작가의 이 여행노트는 오래전부터 계획된 여행기가 아니라, 소소하지만 낯선 여행지에서의 일상과 그리고 주변의 사람들 이야기 날것 그대로임을 알게 해준다.","7년 만에 다시 돌아온 이병률의 ‘사람, 인연, 그리고 사랑 이야기’

이병률 여행 산문집『바람이 분다 당신이 좋다』. 시인이자 MBC FM '이소라의 음악도시'의 구성작가였던 이병률이 《끌림》에 이어 두 번째 여행 에세이로 돌아왔다. 여행을 하며 느꼈던 감성적인 사진과 글들로 가득 채워져 있는 이 책에는 ‘사람’에 대한 따뜻한 호기심과 ‘사람’을 기다리는 쓸쓸하거나 저릿한 마음을 만나볼 수 있다. 목차도 페이지도 순서도 없이 마치 여행을 떠났다 돌아오는 듯한 느낌으로 구성되어 있으며, 페이지마다 그가 생각하고 느꼈던 기록들을 오롯이 담아냈다. 길 위에서 쓰고 찍은 사람과 인연, 그리고 사랑의 여행 이야기를 만나본다.",23180,BOOK
사랑하지 말자,도올 김용옥 (지은이),51512,국내도서>인문학>동양철학>한국철학>한국현대철학,9788982641251,"어떤 젊은이와의 문답 형식으로, 인생에서 맞부딪히는 각종 주제에 대하여 다양하게 묻고 답한 책이다. 오늘 우리의 철학적 관심은 무엇일까? 올 대선에서 누가 이길까? 이러한 등등의 문제야말로 현재 한국인들의 진정한 철학적 과제상황이라고 도올은 말한다.","도올 김용옥, 우리의 역사적 난관을 극복하는 방법을 말하다!

『사랑하지 말자』는 철학자 도올 김용옥이 한국인들의 진정한 철학적 과제상황을 극복해 나가기 위하여 우주ㆍ천지, 그리고 종교ㆍ역사의 제 문제로부터 근원적으로 파헤쳐 총체적인 시각을 가질 수 있도록 안내한 책이다. 도올은 ≪맹자, 사람의 길≫을 탈고 한 후 쉬는 틈에 어느 젊은이의 물음에 의해 이 책을 쓰게 되었고, 이 책에는 이 세상을 어떻게 바라봐야 하고, 어떻게 살아가야 할지 도올 자신의 언어로 풀어냈다. 청춘, 역사, 조국, 대선, 우주, 천지, 종교, 사랑, 음식 등에 대한 내용을 우리가 생각할 수 있는 모든 분야를 망라하여 설명한 도올의 목소리를 들어본다.",4773,BOOK
아프니까 청춘이다 - 인생 앞에 홀로 선 젊은 그대에게,김난도 (지은이),51371,국내도서>에세이>한국에세이,9788965700036,"네이버와 싸이월드에서 '아무리 독한 슬럼프 속에서라도, 여전히 너는 너야'라는 글 '슬럼프'로 수많은 청춘들의 가슴을 울린 서울대학교 김난도 교수가 여러 매체에 기고했던 글을 비롯한 총 42편의 글을 묶었다. 저자는 학생들과 교정에서 매일같이 부대끼며, 또 인터넷으로 청춘들과 쉼 없이 소통하며 그들만의 아픔을 헤아려 수많은 청춘들의 공감을 얻어왔다.","인생의 홀로서기를 시작하는 청춘을 위한 김난도 교수의 따뜻한 멘토링!

불안한 미래와 외로운 청춘을 보내고 있는 이 시대 젊은이들에게 보내는 편지 『아프니까 청춘이다』. 수많은 청춘들의 마음을 울린 김난도 교수가 여러 매체에 기고했던 글을 비롯해 총 42편의 격려 메시지를 하나로 묶어 소개한다. 네이버와 싸이월드를 통해 청춘들의 공감을 얻어내는 멘토링을 던져왔던 김난도 교수는 서울대학교 학생들이 뽑은 최고의 멘토이기도 하다. 그는 미래에 대한 불안감으로 힘들어하는 이들에게 따뜻한 위로의 글을 전한다. 또 때로는 차가운 지성의 언어로 청춘들이 미처 생각하지 못한 깨달음을 일깨워주어 아무리 독한 슬픔과 슬럼프를 만나더라도 스스로 극복하고 이겨낼 수 있는 용기를 전한다.",73345,BOOK
그레이의 50가지 그림자 1~2권 세트 - 전2권,"E. L. 제임스 (지은이), 박은서 (옮긴이)",50919,국내도서>소설/시/희곡>영미소설,,"E L 제임스의 로맨스 소설. 과거 아픔을 지닌 27세의 억만장자 크리스천 그레이와 이제 막 대학을 졸업한 21세의 아니스타샤 스틸의 파격적인 사랑을 관능적인 묘사로 그려낸 작품으로, 출간되자마자 폭발적인 판매 부수를 기록했다.",,2749,BOOK
달팽이가 느려도 늦지 않다,정목 (지은이),51371,국내도서>에세이>한국에세이,9788960652811,"불교방송 '마음으로 듣는 음악'과 인터넷 유나방송으로 헤아릴 수없이 많은 청취자와 네티즌에게 위안과 감동을 선물하고 있는 정목스님의 정갈한 산문과 아포리즘. 감사, 자비, 분노, 사랑, 화해, 평화 등을 주제로 행복을 찾는 현대인들에게 마치 족집게 과외 선생님처럼 기쁨과 휴식의 정답을 선사한다.",,16820,BOOK
내가 알고 있는 걸 당신도 알게 된다면 - 전세계가 주목한 코넬대학교의 &quot;인류 유산 프로젝트&quot;,"칼 필레머 (지은이), 박여진 (옮긴이)",70216,국내도서>자기계발>성공>성공학,9788994013503,"지난 30년간 ‘인간과 삶의 가치’에 대해 연구해온 칼 필레머 코넬대 교수는 지난 5년에 걸쳐 70세 이상 인생을 산 1000여 명의 현자들을 직접 찾아다니며 통찰 깊은 조언을 구했다. ‘지금껏 살면서 얻은 가장 소중한 것은 무엇인가?’라는 질문을 통해 우리가 꼭 알아야 할 인생의 지혜와 조언들을 발굴해냈다. 그가 만난 현자들의 삶은 모두 합쳐 8만 년에 달했다. 그들은 3만 년의 결혼생활을 지켜왔고, 3000명의 아이를 키워냈다. 이 책은 이 엄청난 시간의 퇴적층에서 발굴된 보석 같은 교훈들을 담아낸 책이다.","1000명의 현자가 전하는 인생의 30가지 지혜!

전세계가 주목한 코넬대학교의 인류 유산 프로젝트『내가 알고 있는 걸 당신도 알게 된다면』. 코넬대학교에서 저명한 사회학자로서 30년간 ‘인간학’을 연구해온 저자 칼 필레머가 2006년부터 지금까지 1000명이 넘는 70세 이상의 사람들을 대상으로 진행해온 프로젝트를 통해 총 30가지의 지혜의 정수를 뽑아 이 책에 고스란히 담아냈다. 

수천 년 세월동안 ‘검증된 지혜’들은 시대가 강요하는 행복에 휘둘릴 필요는 없으며, 보다 더 나은 미래를 선택하기 위해 지켜야 할 것들은 생각보다 작은 것임을 보여준다. 잘 맞는 짝과 살아가는 법, 평생 하고픈 일을 찾아가는 법, 나머지 인생을 헤아리는 법 등 인생의 현자들의 실천적인 조언들을 통해 어떻게 사는 것이 과연 잘 사는 것이며, 무엇이 우리의 삶에서 우선 시 되어야 하는지를 제시하였다.",38545,BOOK
사람은 무엇으로 사는가 - 전2권 (한글판 + 영문판),"레프 톨스토이 (지은이), 장영재 (옮긴이)",52650,국내도서>소설/시/희곡>러시아소설,9788997213689,'더클래식 세계문학 컬렉션' 4권. 톨스토이의 단편 중 가장 널리 알려진 《사람은 무엇으로 사는가》를 비롯해 총 일곱 편의 작품이 실려 있다.,"대문호 톨스토이의 위대한 사유가 담긴 단편들!

러시아 문학을 대표하는 대문호이자 사상가인 톨스토이의 단편집 『사람은 무엇으로 사는가』. 고전 중에서도 세계적으로 그 문학적 가치를 인정받고 시대를 뛰어넘어 사랑받는 작품들을 모은 「더클래식 세계문학 컬렉션」의 네 번째 책으로, 영문판을 함께 제공한다. 이 책은 《사람은 무엇으로 사는가》, 《사람에게는 얼마나 많은 땅이 필요한가》 등 톨스토이의 단편 중에서 가장 널리 알려진 일곱 편의 작품을 소개한다. 참다운 인생을 탐구하는 이야기, 끝없는 인간의 탐욕을 그려낸 이야기, 베푸는 삶을 강조하는 이야기, 순수한 아이들의 모습에서 참된 진리를 발견하는 이야기 등 현대인의 영혼을 위로하는 따뜻한 단편들을 만날 수 있다. 인생의 참 의미와 인간 내면의 본성을 탐구했던 톨스토이의 사상과 인생관을 엿볼 수 있다.",9915,BOOK
나와 호랑이님 7 - Seed Novel,"카넬 (지은이), 영인 (그림)",51071,국내도서>소설/시/희곡>라이트 노벨>시드(Seed) 노벨,9788926781616,"성훈과 랑이를 제342대 견우와 직녀로 선별, 둘을 각기 갈라놓겠다는 천상계의 결정에 랑이는 분노한다. 하지만 성훈은 랑이와 다른 아이들을 위해 그 결정을 받아들이고, 그렇게 견우성으로 끌려간 성훈은 한 아리따운 여인을 만나게 되는데…","카넬의 라이트노벨 『나와 호랑이님』 제7권. “안 되겠느니라! 오늘부터 나는 천상계와 전쟁을 벌이겠느니라!!” 성훈과 랑이를 제 342대 견우와 직녀로 선별, 둘을 각기 견우성과 직녀성에 놓아 갈라놓겠다는 천상계의 결정에 랑이는 분노한다! 하지만 성훈은 랑이와 다른 아이들을 위해 그 결정을 받아들이고, 그렇게 견우성으로 끌려간 성훈은 한 아리따운 여인을 만나게 되는데…….",1836,BOOK
코믹 메이플 스토리 오프라인 RPG 53,"송도수 (글), 서정은 (그림)",49995,국내도서>어린이>TV/만화/영화>만화 일반,9788926391945,"2004년 4월에 1권을 출간하여 지금까지, ‘8년 연속 초특급 베스트셀러’,  ‘1200만부 돌파’를 기록하며 독자들의 꾸준한 사랑을 받고 있는 아동 만화책이다. 개성만점의 주인공들, 3D그래픽을 사용한 입체적이고 풍부한 색감의 그림이 돋보인다.","게임 《메이플 스토리》를 만화로 읽다!

송도수가 쓰고 서정은이 그린 『코믹 메이플 스토리 오프라인』 제53권. MMORPG 게임 《메이플 스토리》를 만화로 재구성했다. 번뜩이는 상상력으로 가득한 이야기에다가 3D그래픽을 사용한 입체적이고 풍부한 색감의 그림이 어우러져 있다. 특히 개성적 캐릭터들과 함께 모험을 떠나며 우정, 도전, 배려, 정의를 배우면서 상상력과 창의력을 높인다. 아울러 이야기 속 필수어휘를 재미있는 예문으로 익히며 언어 능력을 향상할 수 있다.",2021,BOOK
빅 픽처,"더글라스 케네디 (지은이), 조동섭 (옮긴이)",50919,국내도서>소설/시/희곡>영미소설,9788984371026,더글라스 케네디의 장편소설. 전 세계 30여 개국에 판권이 팔린 더글라스 케네디의 대표작이다.「뉴욕타임스」는 이 소설에 대해 '한시도 눈을 뗄 수 없다. 마지막 페이지가 다가오는 게 두려울 만큼 흥미진진하다!'고 극찬한 바 있다. 지금과 다른 삶을 살 수 있다면? &lt;빅 픽처&gt;는 진정 '나'를 위한 삶을 살고 싶었던 한 남자 이야기이다.,"이루지 못한 꿈이 당신의 정체를 바꾼다!

조국에 대한 비판적 관점으로 자신만의 소설 세계를 구축해가는 미국 태생의 소설가 더글라스 케네디를 대표하는 『빅 픽처』. 빼어난 착상 위에 반전을 거듭하는 폭발적 흡입력의 스토리가 생생한 유머와 위트와 함께 펼쳐져 유럽을 사로잡은 스릴러 소설이다. 변호사 '벤'에서 사진가 '게리'로 살아가게 된 한 남자의 일상 속으로 초대한다. 주어진 삶에 만족하지 못한 채 일탈을 꿈꾸고는 하는 우리를 완전한 몰입의 세계로 인도하고 있다. 특히 벤이 잃어버린 꿈으로 인해 고독과 슬픔, 방황과 일탈에 빠져든 모습은 마치 거울처럼 우리를 비춘다. 이루지 못한 꿈에 대해 생각하느라 밤마다 잠을 설치는 우리에게 섬뜩한 긴장감을 안겨주고 있다. 

미국 뉴욕 주 월가의 변호사 '벤'은 아름다운 아내 '베스'와 함께 '애덤'과 '조시'라는 두 아들을 키우고 있다. 벤은 어린 시절부터 사진가가 되기를 간절히 바랐으나 아버지의 반대로 변호사가 되었다. 베스는 벤을 마치 벌레라도 본 듯 피해다니기 바빠 그의 일상은 지쳐만 갔다. 그러던 어느 날 베스가 이웃집에 사는 사진가 게리와 불륜에 빠졌다는 것을 알게 된다. 벤은 게리네 집에 찾아가 말싸움을 벌이던 중 우발적으로 그를 살해했다. 요트사고로 위장하여 게리의 시신을 불태운 다음, 몬태나 주 마운틴폴스로 도망친다. 남은 생애를 게리로 살아가기를 결심하고는 젊은 시절에 접어버린 사진가의 꿈을 이루게 되었다. 그런데 벤이 찍은 인물 사진이 지역 신문에 실리면서 비밀이 드러날 위험에 처하는데…….",36144,BOOK
그리스인 조르바 - 전2권 (한글판 + 영문판),"니코스 카잔차키스 (지은이), 베스트트랜스 (옮긴이)",51055,국내도서>소설/시/희곡>세계의 소설>기타 국가 소설,9788997213450,"우리가 걸어온 인생의 길을 바꾸고 싶게 만드는 인물을 우리는 '멘토'라고 부른다. 대한민국 명사들의 멘토로 지목된 조르바는 '일자무식'이면서도 영혼을 날아오르게 하는 자유를 일깨운다. 뜨겁게 용솟음치는 생명력, 사려 깊은 현자의 진리를 알려준다. 명사들뿐만 아니라 이제 우리의 인생까지 뒤흔들 조르바의 경이로움을 더클래식 세계문학 컬렉션 &lt;그리스인 조르바&gt;를 통해 만난다.","꿈과 여행의 작가 니코스 카잔차키스의 대표작!

진정한 자유란 무엇인가라는 주제를 생각하게 만드는 걸작 『그리스인 조르바』. 사실주의와 시적 정서가 공존하는 이 작품에서 조르바는 지식인들과 전혀 다른 방식으로 깨달음을 찾는다. 이성이냐 감성이냐를 택해야 할 때, 조르바는 본능에 힘입어 자신의 길을 결정한다. 반면에 작품 속 ‘나’는 책과 지식을 믿으며 살아간다. 나는 문명에 갇힌 현대인을 대표한다. 작가 카잔차키스는 조르바라는 인물의 의식과 생활을 나와 같은 현대인과 대비하며 왜곡된 세상을 풍자하고 비판했다.",7992,BOOK
