title,author,genre_id,genre,ISBN,description_aladin,description_naver,salesPoint,mallType
틀려도 괜찮아,"마키타 신지 (지은이), 하세가와 토모코 (그림), 유문조 (옮긴이)",48824,국내도서>어린이>초등1~2학년>그림책,9788990611260,"""아는 사람 손 들어봐"", ""할 수 있는 사람 나와 봐""로 시작하는 수업 시간에 잘 모르는 아이, 자신이 없는 아이의 가슴은 오그라든다. 망설이는 초등학교 신입생들에게 교실이 틀려도 괜찮은 곳, 틀리면서 정답을 찾아가는 곳이라는 것을 깨닫게 해주는 그림 동화책이다.","틀린다고 뭐가 이상해. 틀리는 건 당연하다고.

『틀려도 괜찮아』는 초등학교에 막 입학한 아이들에게 교실은 틀려도 괜찮은 곳, 틀리며서 정답을 찾아가는 곳이라고 가르쳐 줍니다. 특히 다정하게 말을 거는 문체는 학교 생활에 대한 두려움을 갖고 있는 어린이에게 자신감을 가지라고 조근조근 다독이고 있습니다. 어린이의 눈높이에 맞춘 귀엽고 익살맞은 그림이 사랑스럽습니다.",39337,BOOK
"총 균 쇠 (무선 제작) - 무기.병균.금속은 인류의 운명을 어떻게 바꿨는가, 개정증보판","재레드 다이아몬드 (지은이), 김진준 (옮긴이)",51378,국내도서>인문학>교양 인문학,9788970127248,"왜 어떤 민족들은 다른 민족들의 정복과 지배의 대상으로 전락하고 말았는가? 왜 원주민들은 유라시아인들에 의해 도태되고 말았는가? 왜 각 대륙들마다 문명의 발달 속도에 차이가 생겨났는가? 인간 사회의 다양한 문명은 어디에서 비롯되었는가? 1998년 퓰리처 상을 수상한 <총, 균, 쇠>는 이런 의문을 명쾌하게 분석한 명저이다.","왜 어떤 민족들은 다른 민족들의 정복과 지배의 대상으로 전락하고 말았는가? 왜 원주민들은 유라시아인들에 의해 도태되고 말았는가? 왜 각 대륙들마다 문명의 발달 속도에 차이가 생겨났는가? 인간 사회의 다양한 문명은 어디에서 비롯되었는가? 1998년 퓰리처 상을 수상한 는 이런 의문을 명쾌하게 분석한 명저이다.



진화생물학자인 재레드 다이아몬드는 각 대륙의 문명이 서로 다른 길을 걷게 된 이유가 인종적.민족적 차이 때문이 아니라 환경적 요소들 때문이라는 것을 생태지리학, 생태학, 유전학, 병리학, 문화인류학, 언어학 등을 동원해 설득력 있게 밝힘으로써 인종주의적 이론의 기반을 무너뜨린다. 



이번 개정증보판에서는 특별 증보면 '일본인은 어디에서 왔는가'를 추가 수록했다. 여기서 재레드 다이아몬드는 현대 일본인의 조상이 누구였는지를 추적하면서, 한국인의 이주가 분명 현대 일본인에게 막대한 영향을 미쳤다고 말한다.",64490,BOOK
신공략 중국어 (책 + CD 1장) - 초급편,"마전비, 소영하, 적염 (지은이), 변형우, 강필임 (옮긴이)",49910,국내도서>외국어>중국어>중국어 첫걸음,9788959955077,<신공략 중국어> 최신개정판. 시대에 뒤떨어지는 단어와 표현을 바로 이 순간 중국 현지에서 사용되고 있는 어휘와 표현으로 전격 교체했다. 또 기초 학습자들의 취약점인 간체자와 번체자 구별을 위한 쓰기연습 및 다양한 중국 관련 상식 코너를 신설했다.,,5498,BOOK
노팅힐 (대본 + MP3 CD 1장),성기완 (지은이),49852,국내도서>외국어>영어회화>스크린영어,9788987915685,"영화를 통해 영어를 학습하도록 구성한 'Screen Play' 시리즈. 영화 [노팅힐]과 동일한 완벽한 대본, 자세한 지문, 이에 대한 정확한 번역 및 상세한 해설을 실었다. 영화에 등장하는 고유 명사, 인명, 문화, 상황 등에 대한 설명과 TOEFL, TOEIC, TEPS 등 영어 시험에 직접 관련된, 문법을 포함한 다양한 설명들을 곁들였다.","노팅힐은 모든 사람이 한 번은 꿈꾸어 봤음직한 욕망이란 코드를 현실화한 부담 없이 볼 수 있는 영화. 그리고 한 번쯤 그런 욕망을 다시 갖기도 해보고, 그런 시절을 생각하면서 스윽 웃어보거나 황당한 상상에 왜 그랬을까하고 질문을 던져 보게 하는 영화다. 즉 재미있는 영화라기보다는 우리가 충분히 공감하고 이해할 수 있는 구성으로 이루어진 영화다. 

하지만 모든 영화는 제작자, 각본가, 각본, 연기자, 제작기술자, 그리고 관객 이상의 그 무엇이다. 노팅힐은 영국 사람이나 그곳에 사는 사람들 아니면 몇몇의 지리학자나 사...",5675,BOOK
현대 이상심리학,권석만 (지은이),8328,국내도서>대학교재/전문서적>인문계열>심리학,9788975489211,"<현대 이상심리학>은 15주 정도의 강의일정에 따라 매주 한 장씩 학생들이 얽어나갈 수 있도록 15개의 장으로 구성되었다. 1장부터 3장까지는 이상심리학에 대한 기본적인 이해를 돕기 위해서 이상심리학의 연구 주제와 방법, 여러 이론적 입장, 정신장애의 분류체계를 소개하였다.",,2275,BOOK
몰라쟁이 엄마,"이태준 (지은이), 신가영 (그림)",48874,국내도서>어린이>동화/명작/고전>국내창작동화,9788980405428,"1930년대 우리나라 문학사에 뚜렷한 발자취를 남겼던 월북 작가 이태준의 단편 동화 열두 편이 담겼다. 짧지만 이야기는 기승전결이 확실하게 전개되고, 남는 여운이 길다.","1930년대 우리나라 문학사에 뚜렷한 발자취를 남겼던 월북 작가 이태준의 단편 동화 열두 편이 담겼다.

무엇보다 눈에 띄는 것은 몇 장 안되는 분량에 걸맞는 작가의 이야기 구성 솜씨이다. 짧지만 이야기는 기승전결이 확실하게 전개되고, 남는 여운이 길다. 등장인물에 생동감을 부여하고, 살아 움직이는 듯 느끼게 하는 짧은 입말의 대화도 깔끔하면서 깊이 남는다.

이야기의 대부분은 1900년대 초반의 어려운 시절, 어린이들이 아직 어린이로 인정받지 못하던 시기를 담고 있다. 부모가 돌아가시고 딴 집에 얹혀살면서 온갖 고생을 겪는 내용이 특히 많다. 놀라운 것은 그런 내용을 동화로 형상화하는 지은이의 솜씨이다. 그 과정을 통해 이야기들은 단순히 슬프고 안된 아이들에 대한 이야기로 그치는 것이 아니라 가슴 속의 울림을 남겨놓는다.",7185,BOOK
괭이부리말 아이들 - MBC 느낌표 선정도서. 양장본,"김중미 (지은이), 송진헌 (그림)",48874,국내도서>어린이>동화/명작/고전>국내창작동화,9788936433444,2000년 7월 두 권으로 선보였던 <괭이부리말 아이들>의 양장본. 제4회 '좋은 어린이책' 원고공모 창작부문 대상 수상작이었던 이 작품은 2001년 11월 방송된 TV 오락프로그램에서 국민필독서로 선정되면서 한 권으로 묶여 다시 선보이게 되었다.,"2000년 7월 두 권으로 선보였던 의 양장본. 제4회 '좋은 어린이책' 원고공모 창작부문 대상 수상작이었던 이 작품은 2001년 11월 방송된 TV 오락프로그램에서 국민필독서로 선정되면서 한 권으로 묶여 다시 선보이게 되었다.



창작과비평사에서는 MBC와 독서캠페인을 벌임으로써 얻어지는 이 책의 수익금 전액을 불우어린이 돕기와 독서진흥운동에 쓸 예정이라고 한다.



한 권으로 묶였을 뿐 내용은 기존의 책과 같다. 인천 만석동 달동네의 별칭인 괭이부리말을 배경으로 서로 위로하고 의지하며 꿋꿋하게 성장해나가는 아이들의 모습을 그려진다. 괭이부리말은 6·25 전쟁 직후 가난한 피난민들이 모여 살면서 만들어진 이 동네는 인천에서 가장 오래된 빈민 지역이다.



지은이 김중미는 1987년부터 괭이부리말에서 살며 지역운동을 해왔고, 지금도 그곳에서 공부방을 운영하고 있다. 지은이는 자신의 경험을 생생하게 살려, 초등학교 5학년인 숙희와 숙자 쌍둥이 자매를 중심으로 가난한 달동네의 구석구석을 착실하게 그려 나간다.",24732,BOOK
독도를 지키는 사람들,김병렬 (지은이),49223,국내도서>어린이>동화/명작/고전>학습동화,9788971967355,"15년 동안 독도 문제를 연구해 온 김병렬 교수가 우리나라의 기록을 비롯하여 일본의 자료를 샅샅이 뒤져 독도에 얽힌 길고도 복잡한 역사를 명쾌하게 풀어나간다. 이렇게 자료의 객관성을 확보하면서, 안용복 장군이나 홍순칠 대장 같은 이들이 독도를 힘겹게 지켜나간 얘기들이 펼쳐진다.","독도 문제에 있어 출판되었던 책들은 대부분은 편향적인 시각으로 쓰여졌던 것이 사실이다. 그런 시각 아래에서는 일본이 왜 계속 독도를 자신들의 영유권으로 주장하는지를 이해할 수 없다. 이럴 때쯤 '사실은 무엇인가?' 란 의문을 속시원히 풀어줄 책은 없는 지 돌아보게 된다. 



15년 동안 독도 문제를 연구해 온 김병렬 교수가 우리나라의 기록을 비롯하여 일본의 자료를 샅샅이 뒤져 독도에 얽힌 길고도 복잡한 역사를 명쾌하게 풀어나간다. , 등의 우리 자료와 , ,  등과 같은 일본 책 속의 기록이 바탕이 되어 자료의 객관성을 확보하면서, 안용복 장군이나 홍순칠 대장 같은 이들이 독도를 힘겹게 지켜나간 얘기들이 펼쳐진다. 



고지도를 활용한 신혜원씨의 삽화가 이야기 구성이 맛깔나도록 돕고 있다.",6914,BOOK
아티스트의 스케치북 - 일러스트레이터.그래픽디자이너.화가.만화가 44인의 아이디어 보물창고,"줄리아 로스먼 (지은이), 이지선 (옮긴이)",50978,국내도서>예술/대중문화>미술>미술 이야기,9788961961073,"아티스트 44인의 비밀스런 스케치북 속을 한 권에 담았다. 어떤 스케치북에서 아티스트들은 사고 과정을 드러내고, 또 어떤 스케치북에서는 드로잉 스타일, 작가들이 사용하는 재료, 주제에 접근하는 방식, 색채를 쓰는 방법 등을 볼 수 있다.","아티스트들의 비밀스러운 스케치북을 훔치다!

아티스트 44인의 아이디어 보물창고『디자이너의 스케치북』. 일러스트레이터로 활동 중인 줄리아 로스먼은 아름다운 예술 서적들을 소개하는 인기 블로그 ‘북 바이 잇츠 커버’에서 아티스트의 첫 아이디어가 생생히 살아 있는 스케치북을 소개하는 코너를 운영했다. 이 책은 블로그 내용에 작가들의 프로필을 덧붙이고, 스케치북이 각 작가에게 어떤 의미인지, 스케치북을 어떤 용도로 사용하는지, 어떤 재료를 사용해서 스케치북을 채우는지 등의 질문과 답을 담아냈다. 스케치북에는 순수예술가, 만화가, 디자이너와 일러스트레이터까지 다양한 44인의 작가들의 개성이 오롯이 담겨져 있으며, 이를 통해 그들의 브레인스토밍, 낙서, 작업 아이디어를 발전시키는 과정, 사색의 흔적 등에 이르는 비밀스럽고 신선한 아이디어를 꺼내어 보여준다.",759,BOOK
행복한 열 살 지원이의 영어 동화,"최명진, 배지원 (지은이)",51793,국내도서>좋은부모>교육/학습>독서/작문 교육,9788996922209,입학사정관제의 도입으로 준비되지 않은 우리나라 교육현장에 또다시 불어닥치는 조기교육 열풍. 책읽기와 글쓰기가 강조되고 있는 가운데 어떻게 교육을 해야 할지 좌충우돌하는 부모들에게 교육적 스킬보다 더 중요한 메시지를 전달하고자 한다.,"평범한 가정에서 자라난 한국 소녀 지원이가 영국 초등학교에 다니며 작문 숙제로 동화를 썼다. 이란성 쌍둥이 토끼 로리와 도리, 그리고 그들이 사는 세계를 만들고 1년 동안 스물일곱 편의 에피소드를 써내려 갔다. 선생님은 수업시간에 영국의 아이들 앞에서 지원이의 동화를 읽어주었고, 한국에서 온 열 살 소녀에게 동화를 책으로 엮어낼 것을 권유하기에 이른다. 

책 속에는 특별할 것 없는 보통의 열 살 소녀가 쓴 동화, 그리고 그 동화가 탄생하게 된 배경과 과정이 담겨 있다. 지원이의 글과 그림 속에는 지원이의 가족, 학교 선생님, 그리고 친구들의 이야기가 녹아 있다. 평범한 샐러리맨 아빠와 전업주부 엄마 밑에서 자란 지원이는 값비싼 영재교육이나 특별한 글쓰기 교육을 받은 적이 없다. 다만 최선을 다해 아이가 되어 놀아주는 아빠, 아이가 좋아하는 일들을 하기 위해 배려하는 엄마와 함께하는 소소하지만 따뜻한 일상이 아이의 상상력의 든든한 뿌리가 되었다.",243,BOOK
"남자의 속마음, 여자의 속마음 - 1000만 네티즌을 중독시킨 ‘미친 연애’의 최정이 알려주는 연애 심리 불변의 법칙",최정 (지은이),3812,국내도서>자기계발>인간관계>남녀관계,9788989456339,"Daum 연애 블로그 1위 ‘미친 연애’의 최정이 말하는 남녀의 은밀한 속마음. 남녀의 속마음에 관한 포괄적인 정의, 상황별 행동 뒤에 숨겨진 본심, 알쏭달쏭 대화 속에 감춰진 속마음을 파헤친다.","남자와 여자, 그들의 말과 행동에 담긴 속마음을 간파하라!

1000만 네티즌을 중독 시킨 《미친 연애》의 최정이 알려주는 연애 심리 불변의 법칙『남자의 속마음 여자의 속마음』. 저자가 운영하는 연애 블로그에 한 번도 공개하지 않았던 새로운 내용을 반 이상 담고 있는 이 책은 블로그의 애독자들을 대상으로 진행했던 수많은 연애 상담 경험을 바탕으로 겉 다르고 속 다른 남녀의 말과 행동을 분석해 보여준다. 모두 4부로 나누어 남녀의 속마음에 대한 포괄적인 정의를 내리고, 상황별 행동 뒤에 숨겨진 본심과 대화 속에 감춰진 속마음을 파헤친다. 또 블로그의 애독자들이 가장 많이 궁금하다고 질문한 내용을 Q&A 형식으로 풀어내 사랑 때문에, 연애 때문에 고민 중인 많은 사람들에게 실질적 멘토가 되어준다. 상대방의 성격과 취향, 상황을 먼저 이해해야 속마음이 보인다는 것, 다른 여자들과 남자들에게 어떻게 행동하는지, 말과 행동에 일관성이 있는지를 살피면 오해와 편견을 줄일 수 있음을 알려준다.",913,BOOK
다크 존,"기시 유스케 (지은이), 한성례 (옮긴이)",51120,국내도서>소설/시/희곡>판타지/환상문학>외국판타지/환상소설,9788997722082,"&lt;검은집&gt;, &lt;악의 교전&gt;의 작가 기시 유스케의 장편소설. 작가의 취미이자 일본의 국민 스포츠인 '장기'를 판타지.호러에 접목시킨 작품이다. 이 작품의 새로운 시도를 높이 평가받아 제23회 장기 펜클럽 대상 특별상을 수상하였다.","현실과 비현실의 틈새, 지옥의 배틀이 시작된다!

일본의 모던 호러를 대표하는 작가 기시 유스케의 소설 『다크 존』. 작가의 취미이자 일본의 국민 스포츠인 ‘장기’를 판타지 호러에 접목시킨 작품으로, 새로운 시도를 높이 평가받아 제23회 장기 펜클럽 대상 특별상을 수상하기도 했다. 프로 장기 기사를 일생의 목표로 삼은 청년 쓰카다 히로시. 어두컴컴한 폐허에서 정신을 차린 그는 영문도 모른 채 17명의 병사들을 이끌고 적군과 전쟁을 벌이게 된다. 그곳은 현실과 비현실의 틈에 존재하는 기묘한 세계 ‘다크 존’. 적을 죽이지 않으면 내가 죽는 절체절명의 상황에서 처절한 전투가 벌어지는데…. 판타지와 리얼리티를 넘나들며 다크 존의 비밀이 하나씩 벗겨진다. 다크 존에서의 대국이 끝날 때마다 ‘단장’을 통해 현실에서의 이야기를 들려주는 형식으로 궁금증을 해소시켜준다.",336,BOOK
1dish 저칼로리 식사법,장소영 (지은이),53474,국내도서>요리/살림>다이어트 요리,9788970909035,"무엇보다 이 책이 좋은 것은 식품영양학자이자 한식전문가의 지식과 노하우로 엄선한 프로그램이라는 점이다. 아무리 몸에 좋은 음식이라 해도 맛이 없으면 지속 불가능하고, 아무리 맛있는 음식이라 해도 신뢰가 없으면 몸에 득이 되지 않을 것이다.","풍요로운 식탁에서 건강을 지키는 저칼로리 식사법!

한국인의 입맛과 체질을 고려한 저칼로리 식사법 『1 DISH 저칼로리 식사법』. 한식 전문가이자 식품영양학자인 장소영 박사가 영양적으로는 고른 균형을 유지하면서 칼로리는 낮은 건강한 식사 프로그램을 소개한다. 채식과 육식의 비율을 8:2로 둔 채식 위주 식단으로 구성하고, 90가지의 다채로운 식단을 우리 입맛에 맞는 한식 조리법으로 제시하고 있다. 극단적으로 식사량을 줄이거나 금기 식품을 지정하는 것이 아니라, 우리가 늘 먹는 한식으로 총 500kcal 내외의 저칼로리 식단을 만들었다. 특히 이를 ‘1 DISH’ 한 그릇에 담아 복잡한 상차림을 없애주고, 자신이 먹은 양을 자연스럽게 체크할 수 있다. 또한 재료가 가지고 있는 영양적 가치를 최대한 보존하는 간단한 조리법을 지향한다.",553,BOOK
바쿠만 BAKUMAN 18 - 여유와 난장판,"오바 츠쿠미 (지은이), 오바타 다케시 (그림)",3748,국내도서>만화>논픽션/휴먼만화,9788967251680,"베테랑 작가들이 대두되는 가운데 초조감을 느끼기 시작한 젊은 작가진. 한편, 아즈마에게 삼촌 카와구치 타로의 모습을 겹쳐보는 사이코는 복잡한 심경이었다. 그러던 중. 아시로기 무토에게 그 남자로부터 한 통의 전화가 걸려오며 사태는 급변하는데...","Tsugumi Ohba의 만화 『바쿠만』 제18권. 왕도에 사도를 도입한 니즈마 에이지. 사도를 왕도까지 밀어 올린 아시로기 무토. 서로를 의식해온 라이벌들이 신작 단편 정면 대결을 펼친다! 왕도VS왕도! 만화계의 미래를 짊어진 두 작가, 그 결과는…?!",976,BOOK
"행복의 충격 - 지중해, 내 푸른 영혼",김화영 (지은이),51425,국내도서>에세이>여행에세이>해외여행에세이,9788954618748,"1969년 처음으로 지중해 연안의 땅에 발 디딘, 한 젊은 학자가 느낀 '행복의 충격'을 담은 책이다. 경이로움으로 가득한 여행자의 눈에 비친 지중해의 정경을 시적인 문체로 그려낸 여행자, 그는 바로 문학평론가이자 번역가인 김화영이다.","자유와 행복을 향해 내닫는 벌거벗은 젊음의 외침!

《알베르 카뮈 전집》, 《어린 왕자》, 《어두운 상점들의 거리》등의 다양한 작품을 번역해온 문학평론가이자 번역가인 김화영의 산문집『행복의 충격』. 1975년 6월 민음사에서 처음 출간되었던 저자의 첫 저서인 이 책은 하나의 꿈이 어떤 현실의 풍경과 서로 만나는 사랑의 기록을 담고 있다. 대도시의 현대인인 저자가 거의 20년 만에 처음으로 여권을 소지하고 비행기에 실려 지구를 돌아 자신이 항상 상상하던 곳인 프로방스를 찾아 그곳을 고향처럼 느끼며 살아가는 동안 경험하고 생각한 다양한 이야기들을 담은 글들로 구성되어 있다. 자정의 어둠 속에도 지중해는 항상 최초의 아침이며 자신의 최초의 영원한, 최초의 청춘이라고 밝히고, 지중해는, 빛 속의 지중해는, 바람 속의 올리브나무 골짜기는, 모든 것의 출발이라고 이야기하는 등 저자가 전하는 아름다운 글들을 통해 언제나 다시 시작하는 젊음의 목소리를 느낄 수 있다.",3064,BOOK
명탐정 코난 76,아오야마 고쇼 (지은이),2556,국내도서>만화>본격장르만화>추리/미스터리,9788926331545,"코고로의 제자가 되기를 희망하는 탐정 아무로 토오루, 여고생 탐정인 세라까지 가세해 사건은 이야기의 핵심에 다가간다. 검은 조직의 그림자가 어른거리는 사건의 진상은? 연재 800회를 맞이한 코난의 유괴 사건, 바비큐 살인사건, 경시청을 진동시킨 경관에 대한 도전 사건을 수록했다.","외모는 초등학생이지만 추리력은 빛을 발하는 거대한 명탐정!

아오야마 고쇼의 탐정만화 『명탐정 코난』 제76권. 세계적인 추리소설가 아버지를 둔 고교생 쿠도 신이치가 검은 조직의 음모에 의해 위기를 넘기고 간신히 살아남아 초등학교 1학년의 모습으로 변해버렸다. 이리하여 신이치는 자신을 되찾기 위해 란에게 정체를 숨긴 채 에도가와 코난이라는 필명을 쓰고, 조직의 사내들과 연결된 단서들을 풀어나간다. 본권에서는 코고로의 제자가 되기를 희망하는 탐정 아무로 토오루의 이야기가 펼쳐진다. 여고생 탐정인 세라까지 가세하여 사건은 이야기의 핵심에 다가간다. 검은 조직의 그림자가 어른거리는 사건의 진상은…. 연재 800회를 맞이하여 코난의 유괴 사건, 바비큐 살인사건, 그리고 경시청을 진동시킨 경관에 대한 도전 사건을 수록하였다.",1235,BOOK
시간을 만드는 방법,"에블린 드 플리허 (지은이), 웬디 판더스 (그림), 최진영 (옮긴이)",48877,국내도서>어린이>동화/명작/고전>외국창작동화,9788994621210,펠릭스에게 황금 같은 일요일 정말 하기 싫은 일이 생겨 버렸다. 바로 ‘마녀’ 같은 즈베임 이모의 생일을 축하하러 혼자 이모 집을 방문하는 것이다. 시간이 없다는 핑계에 돌아오는 엄마의 대답은 “그럼 시간을 만들면 되지.”였다. ‘시간을 어떻게 만들까?’ 그때부터 시간 만들기는 펠릭스를 사로잡는 절실한 문제가 되었는데….,"벨기에 작가 에블린 드 플리허의『시간을 만드는 방법』. 우리의 삶에서 뗄 수 없는 ‘시간’에 대해 다룬 환상 철학 동화이다. 주인공 펠릭스에게 황금같은 일요일 정말 하기 싫은 일이 생겨 버렸다. 바로 ‘마녀’ 같은 즈베임 이모의 생일을 축하하러 혼자 이모 집을 방문하는 것이다. 시간이 없다는 핑계에 엄마는 시간을 만들라고 대답하고, 그때부터 시간 만들기는 펠릭스를 사로잡는 절실한 문제가 되었다. 그런데 할아버지 유령, 신비한 안경사 펩 아저씨, 친구 피터가 기발한 생각을 내 도와주면서 불가능할 것만 같았던 펠릭스의 계획에 조금씩 빛이 비치기 시작한다. 과연 펠릭스는 마녀 이모와 보낼 시간을 만드는 데 성공할까?",596,BOOK
철학을 권하다 - 삶을 사랑하는 기술,"줄스 에반스 (지은이), 서영조 (옮긴이)",51440,국내도서>인문학>철학 일반>교양 철학,9788966184002,한 발만 잘못 디디면 삶이 무너질 것 같은 현대사회에서 철학은 우리의 삶을 지탱해주고 나아갈 방향을 찾는 ‘삶의 기술’이 되어줄 수 있을까? 거리마다 철학자들이 있던 고대 그리스·로마 시대의 현인 12명의 스승에게 배워본다.,"철학이란, 삶을 풍요롭게 하는 기술이며 예술이다!

삶, 그리고 위태로운 순간들을 위한 철학『철학을 권하다』. 사람들이 고대의 철학을 오늘날의 삶에 어떻게 적용하고 있는지를 입체적으로 그려낸 젊은 저널리스트 줄스 에반스의 저서로, 삶과 맞닿은 실용 철학을 전하고 있다. 저자는 명문대를 졸업한 후 우울증을 경험하고 극복해 나가는 과정에서 고대의 철학을 현대의 삶 속에 적극적으로 받아들이는 방법을 연구한다. 이 책은 고대의 위대한 스승 열두 명을 초빙하여 우리 감정을 어떻게 다스려야 하는지, 우리 사회에 어떻게 관여해야 하는지, 어떻게 살아야 하는지에 대해 들어본다. 철학자 알랭 드 보통, 심리학자 대니얼 카너먼 등을 인터뷰하여 고대철학에서 무엇을 통찰했는지, 또한 군인, 소방대원, 전직 조폭 등 보통 사람들은 혼란스러운 세상에서 어떻게 삶을 사랑하는 기술을 찾았는지 생생하게 보여준다. 고대철학으로부터 삶을 구원받은 한 저널리스트가 일상을 철학하는 방법을 알려줌으로써 좀 더 풍요로운 삶이 될 수 있도록 안내한 책이다.",773,BOOK
