title,author,genre_id,genre,ISBN,description_aladin,description_naver,salesPoint,mallType
나의 프랑스식 서재 - 김남주 번역 에세이,김남주 (지은이),51380,국내도서>에세이>독서에세이,9788954620574,"'자신이 가장 잘 할 수 있는 뉘앙스'에 더 많은 무게를 두고 번역서를 선정하는 사람. 스스로를 느린 번역가라 칭하는 사람. 자신이 번역한 책들을 두고 '오랜 세월, 시간의 무게를 견디고 살아남은 글들'이라 말하는 사람. 이 책은 김남주의 번역 에세이이다.","첫 번째 독자인 번역자가 들려주는 이야기!

김남주 번역 에세이 『나의 프랑스식 서재』. 그동안 저자가 번역한 책들에 실린 ‘옮긴이의 말’을 모아 엮은 책으로 저자의 젊은 시간의 기록까지 모두 담겨있다. 20대 후반부터 30대, 40대를 살아오는 동안 저자에게 밥벌이이자 삶의 징검다리 같은 것이었던 번역. 원서와 공감한다고 느꼈을 때 번역을 하기에 자신의 이름 석 자 그 자체가 되는 번역목록을 살펴보며 번역가의 번역가다운 이야기를 만나볼 수 있다.

아멜리 노통브, 프랑수아즈 사강, 아민 말루프, 가즈오 이시구로, 장 그르니에, 에밀 아자르, 앙투안 드 생텍쥐페리, 장루이 푸르니에, 모한다스 K. 간디 등 수많은 작가들의 작품을 번역하며 써내려간 이야기를 만나볼 수 있다. 사랑, 문학, 자아와 예술에 대한 저자의 특별한 시선이 담긴 글을 통해 삶에 닿아있는 저자의 목소리를 들어보고 시야가 넓어짐을 경험하게 된다.",640,BOOK
명탐정 코난 79,아오야마 고쇼 (지은이),2556,국내도서>만화>본격장르만화>추리/미스터리,9788926335284,"코고로의 제자가 되기를 희망하는 탐정 아무로 토오루, 여고생 탐정인 세라까지 가세해 사건은 이야기의 핵심에 다가간다. 검은 조직의 그림자가 어른거리는 사건의 진상은? 연재 800회를 맞이한 코난의 유괴 사건, 바비큐 살인사건, 경시청을 진동시킨 경관에 대한 도전 사건을 수록했다.","Aoyama Gosho의 만화 『명탐정 코난』 제79권. 레드 다이아몬드 ‘블러시 머메이드’를 등에 두른 거북이가 소실되었다. 그러나 화려한 매직 이면에서 키드는 치명적인 실수를…. 그리고 코난과 하쯔토리가 또 다시 콤비를 짜서 새로운 사건에 뛰어든다. 블러시 머메이드 사건 해결편, 자살 트릭 살인사건, 참극이 펼쳐지는 흡혈귀 계획 사건을 수록하고 있다.",1399,BOOK
닿을 듯 말 듯,이노 (지은이),51125,국내도서>소설/시/희곡>로맨스소설>한국 로맨스소설,9788928012121,"이노의 로맨스 소설. 플라워 코디네이터를 꿈꾸며 열심히 살아가는 여자, 권홍. 카페 아르바이트를 시작하던 첫날, 우는 여자를 그대로 내버려 둔 채 무심하게 앉아 있는 남자를 보고 무심결에 속마음을 흘리고 만다. ""여자나 울리고. 얼굴값 하기는.""","이노의 로맨스 장편소설 『닿을 듯 말 듯』. 플라워 코디네이터를 꿈꾸며 열심히 살아가는 여자, 권홍. 카페 아르바이트를 시작하던 첫 날. 우는 여자를 그대로 내버려 둔 채 무심하게 앉아 있는 남자를 보고 무심결에 속마음을 흘리고 만다. 당황한 홍은 자신의 실수를 수습하려 하지만, 또 다시 그의 옷에 코코아를 엎지르는 사고를 치는데….",241,BOOK
"하고 싶다, 연애 - 놀아도 보고 아파도 본 선영 언니의 개념연애사전",안선영 (지은이),52905,국내도서>에세이>명사에세이>방송연예인에세이,9788997835201,"놀아도보고 아파도보고, 결론은 제대로 사랑해본 '연애인' 안선영이 말하는 개념연애. 대한민국 싱글녀들을 열광의 도가니에 빠뜨린 연애특강의 내용을 바탕으로, 그 누구도 들려주지 않았던 적나라한 연애의 진실을 파헤친다.","책으로 만나는 안선영의 연애특강!

놀아도 보고 아파도본 선영 언니의 개념연애 『하고 싶다, 연애』. 제대로 사랑해본 ‘연애인’ 안선영이 말하는 개념연애란 무엇인지 살펴볼 수 있는 책이다. 그저 동네 찜질방에서 마주칠 법한 생계형 연예인인 안선영과 함께 마주앉아 맥주 한 잔 하며 도란도란 나눌 수 있을만한 이야기들을 담았다. 누구보다 오랜, 그리고 많은 연애 경험을 통해 똥도 밟아보고 지뢰도 밟아보며 아프고 깨지고 울고불고하며 몸으로 깨우친 연애의 비밀을 생생하게 들려준다.

저자는 이 책에서 듣기만 해도 피가 되고 살이 되는 연애의 노하우, 나아가 세련되게 일하고 현명하게 살아가는 방법에 대해 펼친다. 평판 관리에 있어 특히 신경을 곤두세울 무대는 소개팅이고, 나의 위치와 상황과 나이를 파악해 ‘우아한 애교’가 필요하다는 것, 자신만의 반전미를 만들 것, 남자는 절대 당신 인생의 해답이 될 수 없다는 것 등 살아 있고 실용적인 연애 팁을 만나볼 수 있다. 외모, 능력, 성격, 무엇 하나 빠지지 않은 2030 훈남 16인의 인터뷰를 수록해 알쏭달쏭한 남자들의 진짜 속마음을 알 수 있는 기회도 마련했다.",961,BOOK
머물지 마라 그 아픈 상처에,허허당 (지은이),52906,국내도서>에세이>명사에세이>기타 명사에세이,9788959136902,"허허당 스님이 보내는 따뜻한 위로와 격려. 허허당 스님이 세상과 소통하는 도구는 트위터다. 그림을 그리며 떠오르는 단상을 시로 읊고, 그 시에서 소재를 얻어 그린 그림을 트위터에 올리며 많은 이들의 아픈 마음을 위로하고 격려하고 있는 허허당 스님. 이번에 스님은 자신의 글과 그림 중 가려 뽑아 책으로 엮어냈다.","불이 나면 꺼질 일만 남고 상처가 나면 아물 일만 남는다.

선 수행에 바탕을 둔 선화 작업을 통해 세상을 통쾌하게 품어내는 허허당 스님의 『머물지 마라 그 아픈 상처에』. 경상북도 비학산자락 작은 암자 후유암에 머물면서, 파괴되고 유린되고 상처 입은 생명을 위로하기 위해 끊임없이 참선하며 붓을 들어온 저자의 글과 그림을 담아냈다. 인간, 사회, 자연에 대한 아픈 통찰과 무한한 사랑에서 솟아난 따뜻한 위로와 격려를 받을 수 있다. 세상 모든 사람이 아픔, 괴로움, 집착을 잊고서 즐겁고 자유로울 뿐 아니라, 충만하게 살아가기를 바라는 수행자의 마음이 고스란히 묻어난다.",1608,BOOK
북유럽 생활 속 디자인,"시주희, 박남이 (지은이)",53501,국내도서>요리/살림>뜨개질/바느질/DIY>패션/소품/DIY,9788994545370,"세계적으로 주목받고 있는 북유럽 디자이너들의 집과 작업실을 공개한다. 식기, 가구, 조명, 패브릭 등 생활 디자인 전반에서 북유럽 열풍이 거세다. 4~5년 전만 해도 마니아층이 수집하는 특별한 디자인으로 인식되던 북유럽 디자인이 언제부턴가 한국에 전염병처럼 퍼지기 시작했고, 북유럽 디자인이라는 단어는 이제 더 이상 낯설게만 느껴지지 않는다.","북유럽 유명 디자이너 8인과 함께 떠나는 생활 속 디자인 이야기!

『북유럽 생활 속 디자인』은 세계적으로 주목받는 북유럽 디자이너들의 집과 작업실을 공개한 책이다. 식기, 가구, 조명, 패브릭 등 생활 디자인 전반에서 북유럽 디자인의 인기가 하늘로 치솟고 있는 이유는 무엇인지에 대해 살펴보기 위해 이 책에서는 현재 활발하게 활동하고 있는 북유럽 디자이너들의 이야기를 직접 들어본다. 올레 옌센, 로타 오델리우스, 감프라테시, 마이야 루에카리 등 8명의 북유럽 유명 디자이너들이 북유럽 디자인을 친절하게 소개하며, 그들의 집과 작업실을 생생한 사진으로 만나볼 수 있다. 만인을 위한 북유럽 디자인 이야기의 이모저모를 만나볼 수 있는 책이다.",1096,BOOK
"고구려 3 - 미천왕, 낙랑 축출",김진명 (지은이),51123,국내도서>소설/시/희곡>역사소설>한국 역사소설,9788993964288,"&lt;무궁화꽃이 피었습니다&gt;, &lt;천년의 금서&gt;의 작가 김진명의 역사장편소설. 김진명 작가가 &lt;무궁화꽃이 피었습니다&gt;로 데뷔했을 때부터 숙원해왔던 필생의 역작이다. 1~3권은 미천왕의 일대기를 담았다.","천년 제국 고구려의 역사가 펼쳐진다!

고구려 여섯 왕의 이야기를 그린 김진명의 역사소설 『고구려』 제3권 《낙랑 축출》. 현실과 픽션을 넘나들며 우리나라 역사의 미스터리들을 다뤄온 작가가 데뷔했을 때부터 숙원해왔다는 필생의 역작이다. 고구려 역사 중 가장 극적인 시대로 꼽히는 미천왕부터 고국원왕, 소수림왕, 고국양왕, 광개토대왕까지 다섯 왕의 일대기와 그들을 둘러싼 역사가 펼쳐진다.

제1~3권에서는 미천왕의 시대를 다루고 있다. 17년간의 사료 검토와 해석을 바탕으로 당시의 고구려 상황은 물론, 급변하는 동북아 정세까지 아우른다. 속도감 있는 문체와 치밀한 구성, 짜임새 있는 줄거리, 개성을 지닌 매력적인 인물들, 스펙터클한 전투 장면 등이 돋보인다.",7716,BOOK
"해커스 토익 실전 1000제 Reading 1 해설집 (문제와 해석.해설) - 단어 암기 MP3, 정답 음성 MP3 무료 제공",해커스어학연구소 편집부 (엮은이),49858,국내도서>외국어>토익>실전,9788990700919,"《해커스 토익 실전 1000제 Reading》문제집 + 해설집 세트. 고득점 달성을 돕는 철저한 오답 분석과 효율적인 문제 풀이를 위한 유형별 공략법을 제시함으로써 학습자들이 토익에 완벽 대비할 수 있도록 돕는다. 또한 토익 기본 학습서로서 정평이 나 있는 해커스 토익 Reading과 동일하게 문제 유형을 분류하여, 보충 학습이 필요한 경우 해커스 토익 Reading과의 연계 학습을 통해 학습 효율을 극대화할 수 있도록 하였다.",,4954,BOOK
인 디즈 워즈 1 - MM 코믹스,"Guilt|Pleasure (지은이), 이혜리 (옮긴이)",6130,국내도서>만화>순정만화>그 남자들의 사랑,9788960522459,정신과 전문의 아사노 카츠야는 악몽에 시달리고 있었다. 얼굴이 보이지 않는 남자가 자신을 감금하고 범하며 ‘사랑해’라는 말을 계속 속삭이는 악몽. 꿈과 현실을 이어주는 연쇄살인범이 카츠야 앞에 나타났을 때 어느새 그 꿈은 현실의 경계를 넘어왔다.,Guilt|Pleasure의 만화 『인디즈워즈』 제1권. 정신과 전문의 아사노 카츠야는 악몽에 시달리고 있었다. 얼굴이 보이지 않는 남자가 자신을 감금하고 범하며 ‘사랑해’라는 말을 계속 속삭이는 악몽. 꿈과 현실을 이어주는 연쇄살인범이 카츠야 앞에 나타났을 때 어느새 그 꿈은 현실의 경계를 넘어왔는데….,2084,BOOK
나나와 카오루 4,"아마즈메 류타 (지은이), 이기진 (옮긴이)",2562,국내도서>만화>성인/성애만화,9788960522503,"백천사의 청년만화잡지 『영애니멀』과 『영애니멀 증간 ‘아라시(嵐)’』를 통해 연재되어온 아마즈메 류타의 대표작이자 21세기 최고의(조금 과장) 순애 & 러브코미디 「나나와 카오루」 한국어판 3권과 4권이 1,2권의 뜨거운 반응을 바탕으로 이어서 선보인다.","아마즈메 류타의 성인만화 『나나와 카오루』 제4권. 기분전환’이라는 명분으로 두 사람만의 비밀스러운 시간을 만들어가는 나나와 카오루. 그토록 사모하는 나나를 부드럽고 아름답게 묶기 위해 카오루는 삼밧줄을 끓이고, 말리고, 기름을 먹이고, 거스러미를 태운다. 나나의 몸을 기분 좋게 묶어 나가는 카오루의 밧줄, 그리고 거기에 담긴 카오루로부터의 메시지, 돌이킬 수 없는 기분에 빠져드는데….",743,BOOK
폰 쇤부르크 씨의 우아하게 가난해지는 법,"알렉산더 폰 쇤부르크 (지은이), 김인순 (옮긴이)",51373,국내도서>에세이>외국에세이,9788998045203,"부유한 귀족 친척들 및 대부호들 사이에서 최상류 생활을 접해본 체험담과 유럽의 역사, 문화, 사회과학을 동원해서 종횡무진 진단하고 비판하는 ‘자유 저널리스트’의 통찰이 어우러져 현대 소비문화의 왜곡과 부질없음을 신랄하게 풍자하고 있다.","우아하게 가난을 과시하면서 쿨하게 부자들을 경멸하는 방법!

『폰 쇤부르크 씨의 우아하게 가난해지는 법』은 언론계 구조 조정으로 신문사에서 퇴직당한 저자가 자신의 경험을 바탕으로 중산층 소멸의 시대에 재산 없이도 품위 있게 인간다운 삶을 유지할 수 있는 방법을 현실적으로 제시하는 책이다. 삶의 군더더기, 불필요한 것을 포기하고 자신에게 진정으로 소중한 것을 인식하고서 집중적으로 즐길 때 기쁨을 극대화시킬 수 있다는 포기의 호사에 대해 역설하며 실용적인 삶의 철학을 제시한다.

저자는 현대사회에 대한 날카로운 분석과 신랄한 비판을 토대로 이미 붕괴하고 있는 복지 국가, 사회 구성원 다수의 빈민화 등의 조건 앞에서 개인이 자신의 진정한 삶을 발견하는 방법을 모색해나간다. 해학적이고 감동적인 한편 현실적이고 냉정하기도 한 목소리로 소비주의에 젖어 살아가는 이들에게 자신을 돌아볼 수 있는 기회와 함께 내적으로 윤택한 삶을 영위할 수 있는 길을 제시한다. 이를 통해 현명하기만 하다면 돈이 없는 대로 우아한 삶을 꾸려 나갈 수 있음을 강조한다.",1361,BOOK
난 엄마가 일하는 게 싫어,"안느마리 피이오자, 이자벨 피이오자 (지은이), 임영신 (옮긴이), 홍현주 (감수)",73196,국내도서>좋은부모>부모교육,9788965132363,"자신의 행복을 만끽하면서도 예의바르고 자율성, 창의력이 뛰어난 아이로 키울 수 있는 육아법과 일하는 엄마들을 병들게 하는 잘못된 죄책감의 고리를 끊고 엄마와 아이가 함께 행복해지는 해법을 찾아 제시한다.","직장생활과 가정생활을 조화하고 죄책감에서도 벗어나려면 어떻게 해야 할까?

『난 엄마가 일하는 게 싫어』는 미안하고 불안한 엄마, 실망시키지 않으려 긴장하는 아이의 고민과 불안을 해소하는 프랑스식 해법을 담은 책이다. 일하는 엄마, 일하지 않는 엄마 모두의 죄책감의 본질을 파헤치고 엄마와 아이뿐만 아니라 아내와 남편, 엄마와 할머니 사이의 상호작용을 분석하며 나아가 수많은 여성이 엄마로서 겪는 불합리한 죄책감에서 벗어날 수 있도록 이끌어주고자 한다.

두 저자는 자신들의 경험과 다양한 임상 실험, 논리적이고 과학적인 데이터를 바탕으로 일하는 엄마들의 아이가 훨씬 행복해질 수 있다고 조언한다. 엄마 자신의 행복을 만끽하면서도 예의바르고 자율성, 창의력이 뛰어난 아이로 키울 수 있는 육아법과 일하는 엄마들을 병들게 하는 잘못된 죄책감의 고리를 끊고 엄마와 아이가 함께 행복해지는 해법을 찾아 제시하고 일하는 엄마들에게 필요한 실질적인 육아법을 소개하고 있다.",380,BOOK
허영만 맛있게 잘 쉬었습니다 - 일본의 숨겨진 맛과 온천 그리고 사람 이야기,"허영만, 이호준 (지은이)",50855,국내도서>여행>일본여행>일본여행 에세이,9788994909202,국내 맛집을 두루 섭렵한 허화백이 식객의 스토리 작업을 함께한 이호준 씨와 함께 이번에는 일본으로 떠났다. 지난 2년 간의 철저한 취재를 통해 탄생한 이 책에는 일본이 자랑하는 13개 지방의 진짜 기막힌 음식과 쉬기 좋은 온천들이 소개된다. 또한 ‘맛’과 ‘휴식’을 찾아 떠났지만 그들은 일본 곳곳에 숨어 있는 달인들을 만나 인생의 작은 ‘깨달음’까지 덤으로 얻게 되었다.,"먹고 쉬고, 잠시 걷고, 자는 원초적인 일본 여행!

일본의 숨겨진 맛과 온천 그리고 사람 이야기『허영만 맛있게 잘 쉬었습니다』. 평소 여행을 즐기는 허영만 화백이 전하는 맛있는 휴식 여행책으로, ‘얼마나 행복감을 느꼈느냐’에 중점을 두고 탐방한 여행기를 소개한다. 식객의 스토리 작업으로 이호준 기자가 함께 하였으며, 2년간의 철저한 취재를 통해 일본이 자랑하는 13개 지방의 기막힌 음식과 쉬기 좋은 온천들을 공개한다. 아키다, 훗카이도 등 13개의 지방마다 크게 온천, 볼거리, 먹을거리로 구성하여 일본의 구석구석을 전하며, 또한 맛과 멋을 넘어 일본 곳곳에 숨어 있는 달인들을 만나 인생의 작은 깨달음을 얻을 수 있다.",3498,BOOK
아무도 울지 않는 연애는 없다 - 사람에 상처 입은 나를 위한 심리학,"박진진, 김현철 (지은이)",51514,국내도서>인문학>심리학/정신분석학>교양 심리학,9788994353081,"사랑을 토대로 한 ‘연애’는 인간관계 중 가장 강렬한 대인관계라고 할 만큼 우리에겐 가장 복잡하고 어려운 화두로 늘 우리 곁을 맴돌고 있다. 그러나 매번 연애 때문에 상처받는 상황이 반복된다면, 매번 연애하는 것이 힘들다면, 더군다나 연애를 해도, 연애를 하지 않아도 매번 우울하고 불안하다면 분명 문제가 있다. 바로 ‘연애’가 아닌 ‘나’에게 말이다. 
",,639,BOOK
ETS TOEIC VOCA 30일 완성 (교재 + CD-ROM 1장),ETS (지은이),49857,국내도서>외국어>토익>Vocabulary,9788917208214,"토익 출제기관 ETS에서 제공한 양질의 토익 컨텐츠로 구성한 토익 보카 교재로, 토익 학습자의 점수대에 관계 없이 이 책 하나로 어휘에 자신감을 갖고 원하는 점수를 높일 수 있도록 하였다. '표제어-우리말 뜻-예문'의 틀을 기반으로 하여, 필요한 추가 해설은 '적중 포인트'를 통해 제시하였고, 고득점을 위한 혼동어휘와 파트별 어구는 부록에서 보충했다.",,2913,BOOK
"Hackers TOEFL Listening (해커스 토플 리스닝) (iBT) (책 + CD 1장) - 2nd edition, 2판 13쇄",David Cho (지은이),49867,국내도서>외국어>토플>Listening,9788990700674,"기본에서 실전까지 완벽 대비 가능한 토플 리스닝 정규서. 최신 iBT 리스닝 출제 경향을 철저히 분석하여 가장 실전다운 iBT 실전 문제를 최다 수록하였다. 아울러 유형별 핵심 리스닝 전략을 제시함으로써 실전 시험에 효과적으로 적용할 수 있도록 하였고, 실제 대학 생활에서 접할 수 있는 대화와 강의 주제들을 빈출 토픽별로 다루어 학습자들이 유학 생활에서도 실질적인 도움을 얻을 수 있도록 하였다.",,6782,BOOK
생애 최고의 날은 아직 살지 않은 날들,"도종환, 박범신, 박완서, 박재동, 법륜, 안철수, 오한숙희, 이윤기, 장일순, 정운찬, 정채봉, 정호승, 최일도, 김종철, 윤구병 (지은이)",52906,국내도서>에세이>명사에세이>기타 명사에세이,9788992378055,"입학과 졸업, 결혼, 아이의 탄생, 사랑하는 사람과의 이별... 삶의 한 장이 끝난 전환점에 선 이들에게 전하는 격려의 글을 모아 엮은 책이다. 시인 정호승, 법륜 스님, 소설가 박완서, 정운찬 전 서울대 총장을 비롯, 총 열다섯 명의 필자가 '어떻게 살아갈 것인가?'라는 공통된 주제로 이야기를 풀어나간다.","<b>첫 장과 마지막 장 사이에 생애 최고의 날을 향한 길을 담았다!</b>

우리 시대를 대표하는 15명의 지혜와 깨달음을 담은 책. 우리 시대를 대표하는 15명이 우리에게 부모로, 스승으로, 친구로 다가와 들려주는 지혜와 깨달음을 담고 있다. 그들의 목소리는 서로 상반되기도 하다. 하지만 그들이 한 목소리로 들려주는 인생의 비밀은, 어떤 길로 가야 할지 알 수 없을 때가 진정한 삶의 시작이라는 것이다. 

또한 사랑을 주고받는 것이 지친 삶에 힘이 되어준다는 것을 가르쳐준다. 그리고 우리 삶에 있을 최고의 가능성이 열릴 수 있도록 매일 새로운 곳을 향해 즐겁게 출발하라고 권하고 있다. 왜냐하면 생애 최고의 날은 우리가 아직 살지 않은 날들이기 때문이다. 

이처럼 우리 시대를 대표하는 정채봉, 안철수, 정호승, 이윤기, 박완서 등은 이 책을 통해 자신만의 삶을 우리에게 선사한다. 그들은 자신만의 눈물로 둥글어진 경험을 고백함으로써 '삶'에 대해 묻는 모든 사람에게 지금보다 나은 삶을 향한 길을 제시하고 있다. 그래서 지혜와 통찰과 조언으로 가득한 그들의 격려는 새로운 여정의 첫걸음을 내딛는 사람들에게 진정한 용기를 건넨다.

<font color=""ff69b4"">☞</font> 서울대학교 총장 정운찬의 <서로에게 선물이 되는 삶을 살라>는 가수 싸이의 결혼식의 주례사입니다.",19778,BOOK
괜찮아,최숙희 (지은이),35096,국내도서>유아>0~3세>그림책,9788901052922,"아이에게 놀림받았던 동물들은 아이에게 반문한다. ""그럼 너는?"" 잠시 당황한 아이가 생각에 잠긴다. 아이는 뭘 잘 할 수 있을까? 아이는 자기만이 할 수 있는 것을 생각해 낸다. 세상에서 가장 크게 웃을 수 있는 것! 그 건강한 웃음이 바로 아이의 가장 특별한 능력이자 자랑이다.","베스트셀러 작가 최숙희가 건네는 따뜻한 메시지

자아존중감을 높여 주는 그림책! 주인공 여자아이가 보기에는 동물들이 참 이상합니다. 개미는 너무 작고, 고슴도치는 따끔거리는 가시가 많습니다. 또, 뱀은 다리가 없고, 타조는 새면서 날지 못합니다. 하지만 각 동물들은 저마다의 장점을 가지고 있다고 말합니다. 이에 질세라 동물들도 아이에게 ""그럼 너는?""하고 반문합니다. 

『괜찮아』는 저연령 유아를 대상으로 한 인지 그림책입니다. 무엇보다 아이들이 흥미로워 할 동물의 생태 정보를 바탕으로 '자신감'이란 주제를 절묘하게 결합시켰습니다. 2박자 반복 구조로 표현된 동물의 동작 변화와 형태감은 유아의 시각을 즐겁게 합니다. 귀엽고 사랑스런 표지부터 각 장마다 재미있게 구성된 화면들은 유아들의 시선을 사로잡기에 충분합니다.",35359,BOOK
"불완전 신성기관 이리스 2 - 100억의 시간을 떠도는 성녀, Novel Engine","사자네 케이 (지은이), 카스카베 아키라 (그림), 엄태진 (옮긴이)",54719,국내도서>소설/시/희곡>라이트 노벨>노블엔진(Novel Engine),9788967306014,여름방학 직전에 있는 정기 시험을 가까스로 통과한 나는 같은 반 친구들이 이야기를 듣고 반 강제적으로 바다에 가게 됐다. 바다를 만끽하던 우리들은 자신을 ‘사라’라고 소개하는 소녀를 만나는데….,"『불완전 신성기관 이리스』 제2권. 나, 호조 군사학교-아카데미- 용병과에 다니는 고학생 나기는 기계공학과 편입을 고민하는 기계 마니아다. 여름방학 직전에 있는 정기 시험을 가까스로 통과한 나는 같은 반 친구들이 이야기를 듣고 반 강제적으로 바다에 가게 됐다(물론 밥통 메이드 이리스도 함께). 바다를 만끽하던 우리들은 자신을 ‘사라’라고 소개하는 소녀를 만난다. 사라는 모두의 사랑을 한 몸에 받았지만, 나랑 단 둘이 있자마자 곧장 ‘입 다물어, 평민’이라고 말하며 본성을 드러내는데──. 이리스를 손에 넣으려는 소녀의 정체, 그리고 소녀의 진정한 목적은!?",207,BOOK
