title,author,genre_id,genre,ISBN,description_aladin,description_naver,salesPoint,mallType
"2013 한자능력검정시험 3급 - 한국어문회 지침서, 개정판",한국어문교육연구회 (지은이),49927,국내도서>외국어>한자>한자 시험 대비,9788994281803,한국어문회가 직접 발간한 교재로 한자능력검정시험 필수 교재. 읽기 한자와 쓰기 한자를 분리하여 학습의 편리를 도모하였다. 기출문제 정리 및 실전문제를 수록 한국어문회 출제문제를 완전 분석하였다.,,865,BOOK
일빵빵 스토리가 있는 영어회화 1,서장혁 (지은이),49849,국내도서>외국어>영어회화>생활영어,9788996895107,"미국인들의 일상에 등장하는 수천 가지 회화 표현을  어렵지 않게, 학습하기 쉽게 정리해 놓은 영어 회화 책. 아무리 기초 실력자라도 누구나 간편하고, 쉽게 볼 수 있도록 1강부터 진도가 구성되어 있으며, 100만 팟캐스트 청취자가 인정한 명강의를 무료로 제공함으로써, 지금까지 해 보지 못했던 방식으로, 지하철, 버스, 집, 또는 출퇴근길에, 스마트폰이나 컴퓨터만 있으면 마음껏 공부할 수 있도록 하였다.
","미국 일상 회화를 쉽고 재미있게 미드로 학습한다!

미국에서 건축 디자인 공부 중 우연한 기회에 영어 컨텐츠 제작에 뛰어든 서장혁의 『스토리가 있는 일빵빵 영어회화』. 무료 팟캐스트 영어회화 방송을 진행 중인 저자가, 미국 드라마 의 내용을 바탕으로 영어회화 패턴 진도에 맞춰 각색한 영어회화 교재다. 한국인이 느끼는 영어 문장과 외국인이 사용하는 회화 문장에 차이가 큰 것을 느껴온 저자가, 쉽게 영어회화를 배우고 올바른 문장 표현법에 대한 명쾌한 해답을 얻도록 구성했다.",29715,BOOK
아침 1시간 노트 - 인생을 바꾸는,"야마모토 노리아키 (지은이), 서수지 (옮긴이)",70221,국내도서>자기계발>시간관리/정보관리>시간관리,9788997263080,"저자가 직접 경험하고 축적한 ‘실천 가능한’ 아침 활용법을 소개하는 책으로, 꿈과 목표를 이루기 위한 ‘아침 1시간 노트’를 작성하는 방법과 활용법을 담고 있다. 저자가 강조하는 ‘아침 1시간 활용’의 이유를 구체적인 증거를 들어가며 설명하고, 그 핵심 실천법인 ‘아침 1시간 노트’의 활용법에 대해서도 상세하게 담아냈다. 영업직, 사무직, 기술직, 경영자를 위한 맞춤 ‘아침 1시간 노트’와 노트 작성법을 한 단계씩 구체적인 예시와 함께 제시한다.","‘아침 1시간’으로 인생을 변화시키자!

인생을 바꾸는『아침 1시간 노트』. 현재 개인 세무사무소를 운영하고 있는 저자 야마모토 노리아키가 평범한 회사원에서 ‘아침형 인간’으로 다시 태어나 아침시간을 적극 활용하면서 인생역전을 맛본 자신의 경험을 바탕으로 일과 사생활에 두루 효과를 발휘하는 ‘아침 1시간 활용법’을 제시하였다. 저자는 ‘아침’이라는 누구에게도 방해받지 않는 시간에 ‘1시간’이라는 제한을 두어 꾸준히 실천한다면 인생을 바꾸는 힘을 발휘할수 있다고 조언한다. ‘아침 1시간’이 중요한 5가지 이유와 아침형 인간으로 거듭나는 9가지 전략, ‘아침 1시간’을 더욱 알차게 활용하기 위한 도구 등을 소개한다. 더불어 실제로 저자가 사용하는 ‘아침 1시간 노트’활용법을 예로 들어 구체적으로 설명하고, 부록으로 활용할 수 있는 양식도 함께 제공하였다. 각 장마다 앞에서 설명한 내용의 포인트를 짚어낸 재미있는 그림을 수록하여, 독자들이 핵심 내용을 머릿속에 선명히 각인 시킬 수 있도록 안내한다.",2052,BOOK
경선식 영단어 초스피드 암기비법 - 공무원/경찰/편입/토플/텝스 필수.수능 고난도,경선식 (지은이),49838,국내도서>외국어>영어어휘,9788957979310,"공무원, 편입, 토플, 텝스 등에 필요한 필수 어휘는 물론 고난이도 수능 영단어까지 동영상 강의와 함께 5~10배 빠르고 오래 암기되는 해마학습법을 이용하여 쉽고 빠르게 암기할 수 있도록 구성한 책이다. 각 시험 기출 어휘 및 필수 어휘들을 우선순위로 망라하였으며, 복습용 암기장(별매), 무료 MP3 제공으로 확실하고 완벽하게 어휘 공부를 할 수 있도록 하였다.
",,3135,BOOK
나는 세계 일주로 경제를 배웠다,"코너 우드먼 (지은이), 홍선영 (옮긴이)",854,국내도서>경제경영>기업/경영자 스토리>벤처/인터넷 기업/경영자,9788901110691,회사를 박차고 나온 억대 연봉 애널리스트의 살아 있는 세계 경제 체험기. 경제학 이론으로 무장한 전직 애널리스트가 6개월 동안 세계를 여행하며 물건을 사고팔면서 경제를 배운 경험을 책으로 펴냈다. 5000만 원으로 여행을 시작해 1억 원을 들고 집으로 돌아오기까지 그의 겁 없는 도전은 경제의 본질을 이해하는 새로운 길을 제시하는 동시에 일상에 파묻혀 꿈을 접어둔 모든 이들에게 용기와 희망을 제시한다.,"회사를 박차고 나온 억대 연봉 애널리스트의 살아 있는 세계 경제 체험기!

영국을 열광시킨 TV 다큐멘터리 〈80일간의 거래일주〉 원작『나는 세계일주로 경제를 배웠다』. 경제학 이론으로 무장한 전직 애널리스트가 6개월 동안 세계를 여행하며 물건을 사고팔면서 경제를 배운 경험을 담은 책이다. 저자는 모로코, 남아프리카공화국, 인도, 키르기스스탄, 중국 등 돈이 될 만한 곳은 어디든지 갔고, 낙타에서 커피, 말, 와인, 목재까지 돈이 될 만한 것은 무엇이든 사고팔았다. 4대륙 15개국 베테랑 상인들과의 치열한 협상과 경쟁 속에서 살아 있는 세계 경제를 체험했고, 성공과 실패를 거듭하며 상상도 못했던 난관을 거쳐 나가는 과정을 통해 비즈니스와 사람을 이해했다. 5000만원으로 여행을 시작해 1억 원을 들고 집으로 돌아오기까지 그의 겁 없는 도전은 경제의 본질을 이해하는 새로운 길을 제시하는 동시에 일상에 파묻혀 꿈을 접어둔 모든 이들에게 용기와 희망을 전한다.",5043,BOOK
덕혜옹주 - 조선의 마지막 황녀,권비영 (지은이),51123,국내도서>소설/시/희곡>역사소설>한국 역사소설,9788963700342,"가장 고귀한 신분으로 태어났지만 가장 외롭게 생을 마감했던 덕혜옹주에 관한 소설이다. 작가는 덕혜옹주뿐 아니라 망국의 시대를 견뎌야 했던 모든 이들 ― 황제와 황족들, 청년들, 여자들과 아이들 ― 의 울분과 고통을 생생하게 되살리려고 노력했다.","덕혜옹주의 비극적 삶을 다룬 최초의 소설!

가장 고귀한 신분으로 태어났지만 가장 외롭게 생을 마감했던 덕혜옹주에 대한 소설『덕혜옹주』. 어린 나이에 고종황제의 죽음을 목격한 후, 일본으로 끌려가 냉대와 감시로 점철된 십대 시절을 보낸 덕혜옹주는 일본 남자와의 강제결혼, 10년간의 정신병원 감금생활, 딸의 자살 등을 겪으면서 정서적으로, 신체적으로 쇠약해진다. 치욕스러운 시간 속에서 그녀를 붙들었던 건 조국에 대한 그리움과 삶의 터전을 되찾겠다는 결연한 의지뿐이었다. 그러나 그녀가 그토록 사랑했던 조국은 해방 후에 그녀를 찾지 않는데….",30538,BOOK
히페리온,"댄 시먼스 (지은이), 최용준 (옮긴이)",89481,국내도서>소설/시/희곡>과학소설(SF)>외국 과학소설,9788932909059,"장르 문학계의 주요 상을 두루 수상한 댄 시먼스의 대표작. 시먼스는 고전 문학에 대한 깊은 이해와 힘 있으면서도 섬세한 문체를 바탕으로 흡인력 있는 이야기를 자유자재로 끌어 나가는 작가로 정평이 나 있으며, &lt;히페리온&gt;은 그러한 작가의 특성이 가장 잘 드러난, 스페이스 오페라 사상 최고의 작품으로 손꼽히는 소설이다.","우주 전쟁의 전야, 고통의 신을 찾아 떠난 순례자들!

휴고상을 수상한 댄 시먼스의 스페이스 오페라『히페리온』. 고전 문학에 대한 깊이 있는 이해와 힘차면서도 섬세한 문체로 이야기를 이끌어 나가는 작가의 특성이 잘 드러난 작품이다. 우주 전쟁의 전야, '고통의 신' 슈라이크를 찾아 나선 일곱 순례자가 각자의 이야기를 들려준다. 1990년 권위 있는 SF 문학상인 휴고상을 수상하며 많은 사랑을 받았다.

'대실수' 이후 인류가 지구를 떠난 지 수백 년, 우주 곳곳에 흩어진 인류는 '헤게모니 연방'을 이루며 평화롭게 살고 있다. 그러나 적군 아우스터가 변방 행성인 히페리온에 접근하면서 전운이 감돌고, 그와 때를 같이하여 히페리온에는 고통의 신 슈라이크가 출현한다. 이러한 아마겟돈의 전야에 일곱 사람이 슈라이크를 만나러 갈 순례자로 선정되는데….

가톨릭의 사제, 대령, 시인, 학자, 탐정 등 각자의 소망을 이루기 위해 순례에 참여한 사람들은 돌아가며 자신들의 이야기를 풀어놓는다. 일곱 순례자의 이야기는 저마다 완결성을 지니면서도, 서로 복합적으로 얽혀 있다. 한 사람 한 사람의 이야기가 펼쳐지면서 슈라이크와 히페리온, 그리고 연방과 아우스터에 얽힌 거대한 비밀이 밝혀진다. [양장본]",1067,BOOK
티베트 말하지 못한 진실,"폴 인그램 (지은이), 홍성녕 (옮긴이)",51241,국내도서>사회과학>정치학/외교학/행정학>각국정치사정/정치사>중국,9788992525343,"중국의 침공, 점령에 뒤따른 종교, 문화, 국가적 정체성을 말살하기 위한 중국의 끊임없는 만행에 관한 진실하고 균형 잡힌 해설을 담았다. 티베트에 관해 처음 접하는 독자도 쉽게 이해할 수 있는 방식으로 집필했다. 제3자의 선입견과 지배자의 거짓 선전에 오랫동안 맞서온 사람들의 정직한 기록이다.","티베트에 관한 세부적인 진실

티베트에 관한 객관적인 사실을 담은『티베트 말하지 못한 진실』. 이 책은 영국 런던에 있는 비영리 단체 '과학적 불자연합'이 국제연합 인권 소위원회 활동을 위해 작성한 보고서로 사실과 자료만을 통해 티베트에 관한 내용을 수록했다. 

 보고서의 주요 목표는 1959년 중국이 무력을 앞세워 티베트를 점령한 뒤 벌어진 본격적·조직적 대량 인명학살(제노사이드)과 티베트 고유한 문명 말살에 대한 세부 사실 및 핵심 정보와 자료를 세계 여러 나라에 제공하며 제대로 알려지지 않은 티베트의 실상을 소개한다. 

《티베트 말하지 못한 진실》은 제1부 유구한 문화의 죽음, 제2부 오늘날의 티베트, 제3부 국제연합 미국 유럽 그리고 티베트, 제4부 자율 티베트라는 미신과 인도의 곤경, 제5부 붉은 용의 권좌 퇴출 등 5부로 나눠 티베트에 대한 정치적 입장에도 구속받지 않고 이해관계 없는 설명을 제시한다. 

또한 책 뒤편에는 중화인민공화국 통치하의 티베트 지도와 정복당한 소수민 지역을 제외한 중국의 지도, 달라이라마의 미래 티베트 비전 등을 함께 수록했다.",265,BOOK
아이를 잘 키운다는 것 - 소아정신과 최고 명의가 들려주는 아이들의 심리와 인성발달,노경선 (지은이),51786,국내도서>좋은부모>육아>육아법/육아 일반,9788991731189,"최신 두뇌과학 및 정신의학의 연구 성과와 소아 정신과 전무의인 저자의 40년간에 걸친 임상 경험에 기초하여 '자녀교육의 본질이 무엇인지', '아이는 어떠한 시각으로 대하고 어떻게 키워야 하는지' 그 핵심을 뽑아 알기 쉽게 설명하는 책.","소아정신과 분야 최고 명의가 들려주는 아이들의 심리와 인성발달!

『아이를 잘 키운다는 것』은 소아정신과 분야에서 최고의 명의로 손꼽히는 노경선 박사가 40여 년간에 걸친 임상 실험을 바탕으로, 아이들의 심리와 인성발달에 대해 짚어주는 자녀교육서다. 아이들의 인성발달 과정을 심리학, 소아정신학, 두뇌과학에 근거해 과학적으로 설명한다. 

이 책은 부모에 대한 정의를 다양한 사례를 통해 재정의한 다음, 아이가 성장과 두뇌의 발달에 대해 면밀하게 분석한다. 또한 행복한 아이로 키우는 10가지 덕목을 제시해, 아이를 잘 키우는 방법에 대해 다시 한 번 성찰하도록 돕고 있다. 뿐만 아니라 자녀 양육에 대한 궁금증 22가지를 문답식(Q&A)으로 정리했다.",13037,BOOK
왜 세계의 절반은 굶주리는가?,"장 지글러 (지은이), 유영미 (옮긴이), 주경복, 우석훈",51073,국내도서>사회과학>사회문제>빈곤/불평등문제,9788990809179,2000년부터 유엔 인권위원회의 식량특별조사관으로 활동하고 있는 장 지글러가 기아의 실태와 그 배후의 원인들을 대화 형식으로 알기 쉽게 조목조목 설명해놓고 있는 책.,"전 세계 기아의 실태와 배후 요인들을 대화형식으로 알기 쉽게 소개!

부족한 것 없이 하루하루를 보내는 전 세계의 많은 사람들. 음식점에서는 손만 조금 댄 반찬들이 쓰레기통으로 버려지는 경우가 허다하다. 그러나 우리가 이렇게 음식을 낭비하며 살아가고 있는 지금 이 순간에도 지구 어느 곳에서는 밥 한끼, 빵 한 조각을 먹지 못해 죽어가고 있는 이들이 많다는 것을 알고 있는가?

『왜 세계의 절반은 굶주리는가』는 유엔 인권위원회 식량특별조사관인 장 지글러가 기아의 실태와 그 배후의 원인들을 아들과 나눈 대화 형식으로 설명한다. 전쟁과 정치적 무질서로 인해 구호 조치가 무색해지는 비참한 현실, 소는 배불리 먹으면서 사람은 굶은 모순된 현실 등을 자세히 설명한다.

또한 사막화와 삼림파괴, 도시화와 식민지 정책, 불평등을 야기하는 금융과두지배 등 기아를 발생시키는 정치·사회·경제적인 문제들을 살펴본다. 그리고 구호조직의 활동과 딜레마 속에 사각시대에 놓여 있는 기아들, 부자들의 쓰레기로 연명하는 사람들의 모습을 들려주며 사람이 가져야 할 인정과 지구촌 식구로써 당연히 해야 할 도리를 촉구한다. 

☞ <b>이 책의 독서 포인트!</b>
기아의 원인을 깊숙이 파고든 이 책을 통해 인간의 생사를 가르는 상황들이 얼마나 정치, 경제 질서와 깊은 연관을 맺고 있나를 실감하게 될 것이다. 특히 단순히 이론이나 사례를 나열하며 기아의 객관적 현실을 보여주는 것이 아니라, 사회에 물들지 않은 순수한 아이와의 대화 형식으로 꾸며져 있어 기아의 진실이 한층 더 와닿는다.",41005,BOOK
한권으로 읽는 조선왕조실록 - 개정증보판,박영규 (지은이),1955,국내도서>역사>조선사>조선시대 일반,9788901047546,1996년 출간된 이후 10년이 지난 지금까지 100만부 이상 판매되며 널리 읽혀온 <한권으로 읽는 조선왕조실록>의 개정증보판. 방대한 분량의 <조선왕조실록>을 쉽게 풀어 쓴 책으로 일반 독자들에게서 멀어진 역사를 생활 속으로 끌어들였다는 평가를 받은 바 있다.,"조선을 가장 정통한 역사 기록으로 서술한 책! 한 권으로 조선의 역사를 짚어본다!

『한 권으로 읽는 조선왕조실록』. 증보 개정판. 이상과 현실이 조화를 이룬 인본주의 나라, 조선. 가장 정통한 역사 기록인 을 한권으로 정리한 책이다. 과 왕실 족보인 , 그리고  등을 대조하여 왕들의 가족관계와 가계도를 수정 보완하였다.

이 책에는 조선 사람들의 경제생활과 각종 인구, 시장 정책 등을 시기에 맞게 정리하여 배치하고 있다. 또한 훈민정음 창제 과정과 그 내막에 얽힌 비밀들 그리고 '조사의의 난' 과 같은 꼭 알아야할 사건들을 첨가하는 등 정렬과 무게가 내제되어 있는 깊이 있는 세계인 조선왕조의 역사를 보여준다. 조선왕조의 세계도를 한 장에 담아 한 눈에 볼 수 있도록 하였다.",31126,BOOK
구름빵,백희나 (지은이),35134,국내도서>유아>그림책>나라별 그림책>한국 그림책,9788953527058,비 오는 날 아침 작은 구름 하나가 나뭇가지에 걸려 있다. 아이들은 신기해서 엄마에게 구름을 가져다 주고 엄마는 작은 구름을 반죽해 빵을 굽는다. 잘 구워진 구름빵을 먹은 엄마와 아이들은 구름처럼 두둥실 떠오른다. 2005년 볼로냐 국제도서전 픽션 부분에서 올해의 일러스트레이터로 뽑히게 한 작품.,"구름빵을 먹으면 하늘에 두둥실 떠오를 수 있어!

'마음씨앗 그림책' 시리즈, 제2권 『구름빵』. 2020년 아스트리드 린드그렌상을 수상한 백희나 작가의 작품으로 구름으로 빵을 만들어 그것을 먹으면 하늘에 두둥실 떠오르게 된다는 아름다운 판타지 이야기를 담고 있습니다. 인물 등을 직접 만들어 배경이 있는 세트에 놓고 사진으로 찍어냄으로써 그림에서는 느끼기 어려운 입체감이 도드라집니다. 특히 솜털처럼 보드라운 그름의 촉감과 비가 내리는 촉촉한 하늘의 어우러짐은 눈과 마음을 즐겁게 합니다. 마치 구름빵 냄새를 직접 맡을 수 있을 것만 같은 착각도 불러일으킵니다. 

비가 오는 날 산책을 나선 고양이 형제는 나뭇가지에 걸린 구름을 발견하여 집으로 가지고 옵니다. 엄마는 구름으로 빵을 만들고 그것을 먹은 아이들은 하늘로 두둥실 떠오르게 됩니다. 밥을 먹지 못하고 출근한 아빠가 걱정된 아이들은 구름빵을 들고 하늘로 두둥실 떠오르는데…….",43788,BOOK
"해커스 그래머 스타트 (Hackers Grammar Start) - 시험 대비 기본 영문법, 토익.토플.텝스.편입.공무원.수능.IELTS",David Cho (지은이),49868,국내도서>외국어>토플>Grammar,9788990700056,"토플, 편입 시험 등 각종 시험 준비생들 뿐만 아니라, 부족한 문법 기초를 다지고자 하는 일반 영어 학습자들이 기본 문법을 완벽하게 익히고, 나아가 실전에 대비할 수 있도록 구성되어 있다. 본문에는 문법의 기본이 되는 사항들이 상세하게 정리되어 있고, 문제유형잡기 코너에는 시험에 빈출되는 문법 문제 유형별로 해법이 제시되어 있다. 또한 이러한 유형별 해법을 충분히 적용해 볼 수 있도록 다양한 실전 문제가 수록되어 있다.","초보를 위한 기본 문법책 

영어 초보자를 위한 기본 문법 교재. 문법 사항의 기본과 원리를 이해한 뒤, 문제를 통해 문법의 이해와 응용을 돕도록 구성하였다. 문법 체계에 따라 단계적 구성을 취하고 있으며, 주요 문법을 정리하여 수록하였다. 초보를 위한 자세한 설명과 다양한 예문, 문제 유형별 해법을 제시한다. 

www.gohackers.com를 통하여 다양한 연습문제를 제공할 뿐 아니라, 해커스토플 그래머Q&A 게시판란을 마련하여 신속한 답변을 통해 여러분들의 학습을 돕고 건의사항을 수용할 수 있도록 하였다.",24368,BOOK
엘리엇의 특별한 요리책,"크리스티나 비외르크 (지은이), 레나 안데르손 (그림), 오숙은 (옮긴이)",48844,국내도서>어린이>초등5~6학년>과학/수학/사회,9788970876122,"'리네아' 시리즈를 만든 크리스티나 비외르크와 레나 안데르손이 쓰고 그린 어린이 요리책. 음식을 만들고 나누어 먹는 즐거움을 아름다운 그림과 함께 즐기도록 했다. 엘리엇과 스텔라 할머니의 음식 만들기를 통해, 자연스럽게 영양과 건강, 자연보호와 환경문제 등에 관심을 가지도록 책을 구성했다.","이 책은 ‘독일 아동 도서상’을 수상했으며,『모네의 정원에서』『꼬마정원』『신기한 식물일기』로 이미 국내에 잘 알려져 있는 두 작가가 호흡을 맞춰 만들어낸 또 하나의 작품이다. 먼저 출간된 책들이 ‘리네아’라는 여자아이를 주인공으로 했다면 이번 작품은 ‘엘리엇’이라는 남자아이를 주인공으로 했다. 이번 역시 친근감 넘치는 귀여운 캐릭터와 섬세함이 돋보이는 글과 그림이 잘 어우러진 아름다운 작품이다",2365,BOOK
꼬마 정원,"크리스티나 비외르크 (지은이), 레나 안데르손 (그림), 김석희 (옮긴이)",49223,국내도서>어린이>동화/명작/고전>학습동화,9788970876016,"그 달에 자라는 식물이나, 새에 대한 이야기다. 꽃이 피는 때와 새들의 특징을 자연스럽게 알 수 있다. 꽃이나 새를 키우면서 우리가 할 수 있는 새 먹이 주는 법이라든가 씨 뿌리기, 정원 가꾸기 따위 이야기가 나와 있다. 그러나 외국 동화라서 우리가 정월에 하는 연날리기를 5월에 하는 것으로 다르게 나와 있는 것도 있다.","자연을 사랑하는 리네아가 1년 동안 자연을 관찰한 이야기를 적어 놓았다. 재미있는 이야기와 그림으로 계절에 맞는 정원 꾸미기와 자연관찰을 기록하고 있다. 1월에는 겨울새에게 모이를 주기 위해 창가에다 '새의 레스토랑'을 차리고, 3월에는 봄에 가장 먼저 피는 꽃을 찾아내는 리네아의 반짝반짝하는 아이디어가 넘친다. 이 밖에도 민들레로 목걸이를 만드는 방...",6186,BOOK
제3의 침팬지,재레드 다이아몬드 (지은이),51545,국내도서>인문학>인류학/고고학>인류학,9788970122175,"700만 년 전 침팬지들과 같은 조상에서 갈라져 나온 인간이라는 종, 즉 제3의 침팬지가 어떤 변화를 거쳐 다른 어떤 생물 종과도 일치시킬 수 없는 독특한 재능을 갖게 되었나에 대해 흥미진진하게 풀어나가고 있다.",,2184,BOOK
거대 권력의 종말 - 디지털 시대에 다윗은 어떻게 새로운 골리앗이 되는가,"니코 멜레 (지은이), 이은경, 유지연 (옮긴이)",51008,국내도서>사회과학>미래학,9788925550374,"세계적인 IT 미래학자 니코 멜레가 디지털 시대 권력의 속성을 정치· 경제· 사회· 문화 등 전 분야에 걸쳐 고찰한 사회비평서로, 가속이 맹위를 떨치는 기술 진보가 불러올 ‘기회와 위협의 패러독스’를 풍부한 글로벌 사례 제시와 함께 분석했다.","새로운 디지털 시대의 권력 구조조정!

디지털 시대에 다윗은 어떻게 새로운 골리앗이 되는가『거대 권력의 종말(The End of Big)』. 세계적인 IT 미래학자 니코 멜레 교수가 전 세계적으로 기존의 거대 권력들이 무너져 가는 시대에 인간의 가치와 사회구조, 자유를 지킬 수 있는 길을 제시하였다. 디지털 시대 권력의 속성을 정치, 경제, 사회, 문화 등 전 분야에 걸쳐 날카롭게 들여다본다. 

저자는 어떤 첨단 기술이라도 거대 권력을 붕괴시키는 과정에서 우리에게 소중한 민주주의 가치를 훼손해서는 안 된다고 이야기하며, ‘새로운 골리앗의 시대’에 걸맞은 새로운 기관과 메커니즘의 설계 방법을 제시한다. 가속이 맹위를 떨치는 기술 진보가 불러올 ‘기회와 위협의 패러독스’를 풍부한 글로벌 사례 제시와 함께 입체적 관점으로 분석하였다.",196,BOOK
어젯밤 꿈속에,"시린 에이들 (지은이), 신혜규 (옮긴이)",35137,국내도서>유아>그림책>나라별 그림책>유럽,9788994149134,온갖 꿈나라 이야기가 담겨 있는 그림책이다. 아이는 가지각색 꿈나라를 돌아다니면서 신비한 꿈의 세계에 빠지기도 하고 자신의 꿈과 연결 짓기도 한다. 자유롭게 상상의 나래를 펼치다 보면 아이의 상상력은 쑥쑥 자라게 된다.,,103,BOOK
