title,author,genre_id,genre,ISBN,description_aladin,description_naver,salesPoint,mallType
기도 - 내려놓기,법륜 (지은이),51639,국내도서>종교/역학>불교>불교명상/수행,9788985961660,"&lt;즉문즉설&gt;의 저자 법륜스님이 전하는 자기 변화 프로젝트. 아직도 사람들은 이 종교 저 종교, 이 절 저 절 다니며 기도를 통한 영험을 찾아 헤맨다. 원하는 것이 성취되면 영험 있다거나 부처님의 가피를 입었다고 기뻐하고, 원하는 것이 이루어지지 않으면 낙담하고 원망한다. 그러나 법륜스님은 &lt;기도-내려놓기&gt;에서 복을 부르는 기도와 화를 부르는 기도를 설명한 뒤, ‘모두 성취되는 기도’, ‘어떤 상황에서도 행복해질 수 있는 방법’을 알려준다.","지금 당신은 왜 기도하는가?

불교 TV 즉문즉설에서 법륜스님이 말하는  이야기 『기도 내려놓기』. 평화와 화해의 메시지를 전하는 평화의 운동가 법륜 스님은 행복을 부르기도 하고, 화를 부르기도 하며, 마음을 다스리고 행복을 설계하는 기도에 대해 이야기한다. 복을 부르는 기도와 화를 부르는 기도를 설명한 뒤, ‘모두 성취되는 기도’, ‘어떤 상황에서도 행복해질 수 있는 방법’을 알려준다. ‘마음 다스리는 법’과 ‘화를 내려놓는 법’ 등의 수행을 현대인의 눈높이에 맞추어 설명한다.  지혜와 직관, 통찰이 빛나는 이야기를 통해 기도에 대한 깨달음을 얻을 수 있도록 전하고 있으며, 스스로의 마음을 돌아볼 수 있도록 안내한다.",16628,BOOK
지성에서 영성으로,이어령 (지은이),51596,국내도서>종교/역학>기독교(개신교)>기독교(개신교) 신앙생활>간증/영적성장,9788970636511,시대의 지성 이어령이 전하는 영성에 대한 참회론적 메시지. 이어령은 2007년 세례를 받기 위해 무릎을 꿇었다. 무엇이 그를 이성과 지성의 세계에서 영성의 세계로 떠나게 만들었을까. 이 책은 크리스천 이어령의 지성에서 영성의 길로 나아가는 과정과 영성의 세계에 들어오면서 과정과 그에 따른 솔직한 생각에 대해서 세세하고 기록하고 있다.,,12483,BOOK
누구와도 15분 이상 대화가 끊이지 않는 66가지 Point,"노구치 사토시 (지은이), 윤성규 (옮긴이)",70227,국내도서>자기계발>협상/설득/화술>화술,9788961091190,"어떤 상황에서도 대화가 활기를 띠는 방법을 알려 준다. 저자는 이 책에서 자연스럽게 대화하는 힘이 길러지는 말하기 법칙을 자세히 풀어서 설명한다. 책에는 누구나 실전에서 바로 쓸 수 있으며 효과도 만점인 말하는 법, 듣는 법, 질문하는 법, 지적하는 법의 구체적인 예가 가득 실려 있다.","어떤 상황에서든 누구와도 즐겁게 대화할 수 있는 실전 비법

낯가림이 심한 당신에게 용기를 주는 66가지 대화 포인트. 이 책에서는 어떤 상황에서도 대화가 활기를 띠는 방법을 알려준다. 본문은 먼저 기본적으로 알아야 할 사항인 듣는 힘, 말하는 힘, 질문하는 힘의 순서로 설명한다. 한발 더 나아간 대화의 기술로 대응의 기술, 관계 만들기 비결, 여러 사람과 대화하는 비결, 말 잘하는 법을 설명한다. 직장, 거래처, 회의, 모임 등에서 그대로 사용할 수 있는 구체적이고 실질적인 표현들을 예로 들었다.",3735,BOOK
조선의 영웅 김덕령,"신동흔 (지은이), 김용철 (그림)",48945,국내도서>어린이>책읽기/글쓰기>논리/논술,9788984313156,"임진왜란을 배경으로 한 비운의 영웅 두 사람에 관한 옛이야기. 한겨레 옛이야기 시리즈 인물편, 다섯번째 책이다. 가난한 선비의 집안에서 태어나 하늘이 부여해준 능력을 맘껏 발휘하지도 못하고, 역적의 누명을 쓰고 죽어야 했던 장수 김덕령과 미천한 신분으로 태어나 뛰어난 능력이 있으면서도 숨어 지내야 했던 기인 송구봉의 이야기를 담았다.","조선을 사로잡은 영웅들의 이야기

〈한겨레 옛이야기〉 시리즈 제10권 『조선의 영웅 김덕령』. 이 시리즈는 1999년에 출간된 「한겨레 옛이야기」시리즈를 유명 동화작가들과 삽화가들의 손으로 다시 태어난 <b>개정판</b>입니다. 민족의 정서가 가득한 내용과 우리 민족의 고유 색채에 한국적 캐릭터를 접목하여 신화를 재미있게 보여줍니다. 총 5부로 구성했으며, 이 책은 제2부 조선을 사로잡은 영웅들의 이야기 '인물편' 에 해당합니다.

10권 『조선의 영웅 김덕령』은 역사에 실존했던 인물 김덕령과 송구봉의 이야기를 담았습니다. 두 인물은 난세에 태어나 억압과 차별을 받으며 불꽃같은 삶을 살았다는 공통점이 있습니다. 김덕령은 힘이 세고 무예가 뛰어난 장수였지만 능력을 제대로 발휘하지 못한 채 누명을 쓰고 처형을 당합니다. 후에 무죄가 밝혀져 병조판서 벼슬과 '충장공'이라는 시호를 받았습니다.

송구봉은 조선 중기의 큰 학자였으나 천한 출신이었던 까닭에 나라를 위해 큰 일을 할 기회를 얻지 못하고 세상을 떠나고 말았습니다. 이 책에서 풀어낸 두 사람의 이야기에는 역사의 진실이 고스란히 담겨 있습니다. 우리나라에 훌륭한 인재가 있었지만, 인재들이 제 능력을 발휘할 기회를 얻지 못한 채 안타깝게 뜻을 꺾고 말았다는 사실입니다.",2078,BOOK
우리는 한편이야 - 4학년 1학년 국어교과서 국어 4-1(가) 수록도서,"정영애 (지은이), 원유미 (그림)",48874,국내도서>어린이>동화/명작/고전>국내창작동화,9788957981580,"한 살 터울의 어린 남매가 자신들의 눈높이로 바라보는 부모의 사소한 말다툼과 이혼 위기, 그리고 화해하기까지의 모습을 아주 경쾌하게 그려 나간 동화. 즉, '이혼'을 어른들의 입장에서 그려 나가는 것이 아니라, 아이들의 시선에서 바라보며 아이들의 심리를 잘 반영한 작품이다.
","부모님의 부부싸움을 바라보는 어린 남매의 경쾌한 눈!

『우리는 한편이야』는 한 살 터울의 어린 남매가 자신들의 눈높이로 바라보는 부모의 사소한 말다툼과 이혼 위기, 그리고 화해하기까지의 모습을 경쾌하게 그려나갑니다. 부모님의 부부싸움과 이혼을 아이들 입장에서 바라보며 아이들의 심리를 잘 반영하고 있습니다. 

평소 건망증이 심한 아빠가 엄마의 생일을 잊어버리자 그 일을 계기로 엄마는 쌓여있던 모든 불만을 터트리며 화를 냅니다. 사이 좋은 남매 진호와 진경이는 엄마 아빠의 화해를 위해 애써 보지만, 엄마는 아빠의 무신경함과 오랜 무관심에 단단히 화가 나 있습니다.

서로 외면하며 냉랭하게 지내던 엄마 아빠는 급기야 '이혼'이라는 말까지 하며 심하게 다투고, 우연히 엄마 아빠의 말을 엿듣게 된 남매는 큰 충격을 받고 불안한 나날을 보냅니다. 얼마 뒤 엄마 아빠는 남매를 불러 놓고 당분간 서로 떨어져 살기로 했으니, 둘 중 누구랑 같이 살고 싶냐고 묻는데….

▶ 초등 4학년 1학년 국어교과서 국어 4-1(가) 수록도서입니다.",4640,BOOK
글쓰기의 공중부양 - 이외수가 처음으로 공개하는 실전적 문장비법,이외수 (지은이),51538,국내도서>인문학>책읽기/글쓰기>글쓰기,9788973378937,"베스트셀러 작가 이외수가 전격적으로 공개하는 글쓰기 비법서. 실제적인 어휘·문장 연습과 함께 작가 특유의 위트와 유머를 가미한 사례들이 풍부하게 소개된다. 논술이나 기획안, 소설창작, 이메일에 이르기까지 글로써 소통을 원하는 이들에게 유용한 지침서가 되어줄 것이다. 2006년 출간된 &lt;글쓰기의 공중부양&gt;의 개정판.","글에 영혼을 불어넣는 이외수식 글쓰기 비결

이외수의 글쓰기 지침서 . 감성적인 언어부터 파격적이고 명쾌한 문장까지 30년 동안 베스트셀러 작가로 사랑받아온 이외수가 공개하는 글쓰기 비법을 담은 책이다. 지난 2006년에 펴냈던 책을 개정출간한 것으로, 작가 특유의 위트와 유머를 통해 글쓰기 비법을 쉽고 재미있게 배울 수 있도록 구성하였다.  

이외수는 먼저 '단어채집'을 이야기하며, 글쓰기를 잘하려면 기본이 되는 단어부터 챙겨야 한다고 주장한다. 이후 문장쓰기에서는 글은 머리가 아닌 가슴으로 쓰는 것임을 강조하고, 본격적인 창작에서는 자기 허물을 끊임없이 벗겨낼 것을 권하면서 자신만의 개성을 살릴 것을 제안한다. 특히 마지막 '깊이 있는 사색'에서는 글에도 기운이 있으니 사랑이 담긴 말을 사용하라는 노하우의 결정체를 제시하고 있다. 

이 책은 어휘, 문장 연습과 함께 다양한 사례들을 소개한다. 기술과 핵심을 동시에 아우르는 '마음쓰기'를 제안하는 이외수식 글쓰기는 글에 마음을 담는 방법을 알려주고 있다. 논술에서부터 기획안, 소설창작, 이메일 등에 이르기까지 한 편의 글에 진심을 담아 글로써 소통하기를 원하는 사람들에게 좋은 지침서가 되어주는 책이다.",4890,BOOK
프레임 - 나를 바꾸는 심리학의 지혜,최인철 (지은이),5247,국내도서>자기계발>인간관계>교양심리학,9788950911546,"'프레임(Frame)'은 흔히 창문이나 액자의 틀, 안경테를 의미한다. 이것은 모두 어떤 것을 보는 것과 관련이 있다. 심리학에서 '프레임'은 '세상을 바라보는 마음의 창'을 의미한다. 어떤 문제를 바라보는 관점, 세상을 관조하는 사고방식, 세상에 대한 비유, 사람들에 대한 고정관념 등이 모두 여기에 속한다.",,16176,BOOK
반기문 총장님처럼 되고 싶어요! - 세계를 빛낼 어린이에게 꿈과 희망을 주는 이야기,"김경우 (글), 가랑비 (그림), 신웅진",48902,국내도서>어린이>문화/예술/인물>한국인물,9788976772442,"반기문 유엔 사무총장이 세계의 청소년에게 전하는 꿈과 희망의 메시지, <바보처럼 공부하고 천재처럼 꿈꿔라>의 어린이판. 초등학교 시절 변영태 외교부 장관의 연설을 듣고 자극을 받아 '나라를 위해 일하는 사람이 되겠다'는 큰 꿈을 품고 꿈을 이루기 위해 노력했던 소년 반기문의 이야기를  위인동화로 엮었다.",,9029,BOOK
누구나 10kg 뺄 수 있다,유태우 (지은이),53514,국내도서>건강/취미>다이어트,9788915049291,"약물이나 치료가 아닌, 자신의 의지로 체중을 줄이는 방법을 소개한다. 첫 3개월만에 6kg를 감량, 전체 6개월이 걸리는 프로젝트는 몸에 무리가 가지 않는 다이어트이다.","서울대학교병원 건강증진센터 비만 환자 치료법을 담고 있는『누구나 10KG 뺄 수 있다』. 이 책에는 지난 4~5년간 서울대학교병원 가정의학과 유태우 박사가 실제로 시행하고, 저자  스스로도 감량하기 위해 사용한 방법을 담고 있다. 체중감량을 위해서 적게 먹는 법, 이에 따른 몸의 변화와 그 대처법까지 상세하게 설명하고 있다.
<BR>
<BR>《누구나 10KG 뺄 수 있다》는 실패하는 다이어트법, 누구나 10KG는 뺄 수 있는 프로젝트법, 저자의 6개월 프로젝트 경험기, 특별한 사람을 위한 프로그램 등으로 구성되었다.",9755,BOOK
이현세 만화 한국사 바로보기 1~10권 세트 - 전10권,"유경원, 권민정, 김미영 (지은이), 이현세 (그림)",48904,국내도서>어린이>초등 한국사,9788991481183,"서기전 50만년 전, 한반도에 구석기 시대가 시작된 순간부터 1945년 광복을 맞이할 때까지, 지난날 세대를 감동시켰던 이현세 만화의 주인공 까치, 엄지, 두산, 동탁과 함께하는 한국사 여행. 2002년 첫 번째 기획 회의 이후 4년만에 전 10권으로 완간되었다.",,7994,BOOK
마사코의 질문,손연자 (지은이),50759,국내도서>청소년>청소년 문학>청소년 소설,9788957980309,"일본인 소녀의 일본의 죄를 묻는 내용의 표제작을 비롯하여 '생체 실험', '관동대지진', '정신대 문제' 등과 같이 일제 강점기에 우리 민족이 겪었던 온갖 수난들을 생생하고 절실하게 그려 내는 9편의 작품들이 실렸다.","끊임없이 망발을 내뱉고 역사 왜곡을 자행하는 일본. 역사에 대한 반성없이 원폭 피해만을 내세우며 자신들이 피해자임을 강조할 뿐이다. 이렇게 역사의 진실 앞에 떳떳치 못한 일본인들에게, 책의 주인공인 일본인 소녀 마사코는 묻는다. ""왜 전쟁을 해? 누가 먼저 싸움을 걸었어?""



일본인 소녀의 일본의 죄를 묻는 내용의 표제작을 비롯하여 '생체 실험', '관동대지진', '정신대 문제' 등과 같이 일제 강점기에 우리 민족이 겪었던 온갖 수난들을 생생하고 절실하게 그려 내는 9편의 작품들이 실렸다. 



* 양장본으로, 삽화는 들어있지 않습니다.",4870,BOOK
한권으로 읽는 조선왕조실록 - 개정증보판,박영규 (지은이),1955,국내도서>역사>조선사>조선시대 일반,9788901047546,1996년 출간된 이후 10년이 지난 지금까지 100만부 이상 판매되며 널리 읽혀온 <한권으로 읽는 조선왕조실록>의 개정증보판. 방대한 분량의 <조선왕조실록>을 쉽게 풀어 쓴 책으로 일반 독자들에게서 멀어진 역사를 생활 속으로 끌어들였다는 평가를 받은 바 있다.,"조선을 가장 정통한 역사 기록으로 서술한 책! 한 권으로 조선의 역사를 짚어본다!

『한 권으로 읽는 조선왕조실록』. 증보 개정판. 이상과 현실이 조화를 이룬 인본주의 나라, 조선. 가장 정통한 역사 기록인 을 한권으로 정리한 책이다. 과 왕실 족보인 , 그리고  등을 대조하여 왕들의 가족관계와 가계도를 수정 보완하였다.

이 책에는 조선 사람들의 경제생활과 각종 인구, 시장 정책 등을 시기에 맞게 정리하여 배치하고 있다. 또한 훈민정음 창제 과정과 그 내막에 얽힌 비밀들 그리고 '조사의의 난' 과 같은 꼭 알아야할 사건들을 첨가하는 등 정렬과 무게가 내제되어 있는 깊이 있는 세계인 조선왕조의 역사를 보여준다. 조선왕조의 세계도를 한 장에 담아 한 눈에 볼 수 있도록 하였다.",31126,BOOK
어느 날 내가 죽었습니다 (반양장),이경혜 (지은이),50759,국내도서>청소년>청소년 문학>청소년 소설,9788990878052,"중학교 3학년 유미는 오토바이 사고로 죽은 재준이의 일기를 읽게 된다. '어느 날 내가 죽었습니다. 내 죽음의 의미는 무엇일까요?'라는 섬뜩한 글로 시작한 재준이의 일기를 읽어내려가며, 함께 한 추억을 더듬는다. 짝사랑, 성적, 학원, 선생님... 평범한 중학생의 일상이 펼쳐진다.","어느 날 내가 죽었습니다. 내 죽음의 의미는 무엇일까요?'

『어느 날 내가 죽었습니다』는 어느 날 오토바이 사고로 죽은 재준이의 일기를 중학교 3학년 유미가 읽게 되면서 펼쳐지는 성장소설이다. '어느 날 내가 죽었습니다. 내 죽음의 의미는 무엇일까요?'라는 섬뜩한 글로 시작한 재준이의 일기에는 짝사랑, 성적, 학원, 선생님... 평범한 중학생의 일상이 담겨져 있다. 삶과 죽음을 오가는 이야기는 단도직입적으로 ‘죽음’에 대하여 질문하며, 더불어 ‘삶’에 대해서도 생각하는 계기를 마련해 준다.",21364,BOOK
"가방 들어주는 아이 - MBC 느낌표 선정도서, 보급판","고정욱 (지은이), 백남원 (그림)",48874,국내도서>어린이>동화/명작/고전>국내창작동화,9788971969243,"다리가 불편한 영택이를 놀린 벌로 석우는 1년 동안 영택이의 가방을 들어다 주게 된다. 장애인으로 살아가는 영택이를 곁에서 지켜보면서, 석우의 마음은 조금씩 변화하게 된다. 그리고, 석우의 변화는 다른 반 아이들의 변화를 이끌어 낸다.",,18466,BOOK
"교과서에서 찾아낸 1학년 상식, 이거 알아? - 개정판","양대승 (지은이), 정수영 (그림)",48827,국내도서>어린이>초등1~2학년>상식/교양,9788953302778,"초등학교 1학년 교과서에서 찾아낸 알짜 상식을 질문과 답의 형태로 풀어 놓은 책이다. 책을 읽으며 어린이들이 갖고 있던 호기심과 궁금증을 시원하게 해결하고, 다양한 배경 지식을 쌓을 수 있으며, 지혜와 창의력을 키울 수 있다. 또한 각 질문과 관련된 교과목 및 단원명이 표시되어 있어 학교 공부에도 큰 도움이 된다.","1학년 교과서에서 찾아낸 상식를 문답식으로 풀어서 엮은 책이다. 파리가 다리를 계속 비비는 이유, 남극과 북극중 어느곳이 더 추운지 등의 다양한 호기심과 궁금증에 대한 해답이 있다.",827,BOOK
종이밥,"김중미 (지은이), 김환영 (그림)",48874,국내도서>어린이>동화/명작/고전>국내창작동화,9788989646020,"<괭이부리말 아이들>의 작가 김중미, <나비를 잡는 아버지>의 일러스트레이터 김환영이 함께 만든 동화. 약한 자, 소외된 자, 알려지지 않은 자들에 대한 마음 따뜻한 시선이 가득 울려나온다.","이 책은 특이한 재질을 가졌습니다. 거칠것만 같은, 그렇지만 부드러운 갈색 한지느낌의 종이위에 가볍게 스케치를 한 듯한 그림과 중간크기의 글자가 쓰여져있습니다. '제목이 '종이밥'이라 그런가?'하는 생각이 들기도 합니다.

「괭이부리말 아이들」이후 2년여만에 펴낸 김중미씨의 이번 작품은 송이와 철이라는 어린 오누이를 등장시켰습니다. 판자촌에서 할아...",19653,BOOK
삼국지 세트 - 전10권,"나관중 (지은이), 이문열 (엮은이)",51124,국내도서>소설/시/희곡>역사소설>외국 역사소설,9788937450501,"한국 출판사상 최고의 베스트셀러. 1988년에 발행된 초판, 1993년에 선보인 신조판에 이어 십여 년 만에 개정판이 나왔다. 제1권의 경우, 2002년 2월까지 초판 19쇄와 신조판 81쇄를 합하여 총 100쇄를 발간했을 정도.","동양인의 원초적 사고와 처세의 기본이 담겨있는 새로운 시각의 삼국지(개정판). 한나라 멸망 후 펼쳐지는 무수히 많은 영웅호걸들의 쟁투와 죽음, 전쟁, 음모와 지략을 들려주는 책. 유비, 관우, 장비의 도원결의부터 솥발처럼 셋으로 나누어진 촉, 오, 위 나라가 하나로 합쳐지기까지 조조, 손권, 제갈공명, 사마의, 조자룡 등 수많은 영웅호걸들이 펼치는 흥미진진한 역사적 내용을 풀어썼다.",17941,BOOK
프린들 주세요,"앤드루 클레먼츠 (지은이), 양혜원 (그림), 햇살과나무꾼 (옮긴이)",48877,국내도서>어린이>동화/명작/고전>외국창작동화,9788971968345,닉과 그레인저 선생님이 프린들(Frindle)이라는 새로운 말을 둘러싸고 벌이는 '언어 전쟁'- 펜은 프린들이다!,"닉은 아이디어 박사. 기발한 아이디어로 따분한 수업을 재미있게 만들고, 선생님에게 엉뚱한 질문을 해서 수업 시간을 축내곤 해요. 하지만 5학년이 되자, 닉은 만만찮은 적수를 만났어요. 바로 그레인저 선생님. 국어를 담당한 그레인저 선생님은 쉴 틈 없이 수업을 진행하고, 숙제도 어마어마하게 내 주기로 유명해요. 깜찍한 소년 닉과 엄격한 그레인저 선생님이 벌이는 이야기.",38580,BOOK
아빠가 들려주는 태교동화 - 개정판,김양현 (지은이),51770,국내도서>좋은부모>태교,9788986145885,뱃속의 아이에게 들려줄만한 동화들을 엮은 책. 이 책의 저자는 임신 중에 태교의 중요성을 생각하고 많은 동화들을 들려주었다고 한다. 그 경험을 통해 얻게 된 몇 가지 원칙을 가지고 태교동화집을 엮었다.,,13064,BOOK
황소 아저씨,"권정생 (글), 정승각 (그림)",35134,국내도서>유아>그림책>나라별 그림책>한국 그림책,9788986621778,"<강아지 똥>의 작가 권정생의 따뜻한 글과 토속적인 정감이 물씬 묻어나는 이야기. 그리고 그 책을 살리고 있는 것은 바로 정승각의 그림으로, 정성이 가득 담긴 그림 덕에 놓치기 싫은 그림책이 되었다. 한밤중에 찾아온 새앙쥐를 내쫓지 않고, 자신의 것을 나누어주는 황소 아저씨와 그 정을 고맙게 받고 모두 행복해지는 이야기를 담고 있다.","마음이 따뜻한 황소 아저씨의 도움으로 부모를 잃은 새앙쥐 형제들이 추운 겨울날 배고픔을 잊고 건강하게 자란 이야기를 아름답게 그린 유아 그림동화. 한밤중, 황소 아저씨네 추운 외양간에 하얀 달빛이 비치었어요. 둥그런 보름달님이 은가루 같은 달빛을 쏟아 놓은 거예요. 황소 아저씨는 보릿짚에 주동이를 파묻고 쌕쌕 숨소리를 내며 잠들어 있었는데, 새앙쥐 한 마리가 외양간 모퉁이 벽 뚫린 구멍으로 얼굴을 쏙 내밀고 찾아왔어요. 황소 아저씨 등을 타고 구유 쪽으로 달려가던 새앙쥐는 황소 아저씨게 새차게 내리친 꼬리에 동댕이쳐지는데... 파란색 바탕에 하얀색과 노랑색이 어우러진 헝겊 위 그림은 전체적으로 힘이 느껴지면서 정겹기만하다.",12464,BOOK
달과 6펜스,"서머싯 몸 (지은이), 송무 (옮긴이)",50919,국내도서>소설/시/희곡>영미소설,9788937460388,<달과 6펜스>는 15종에 이르는 번역본이 이미 소개되어 있을 만큼 국내에서 크게 환영받는 작품이다. 이 작품은 서머싯 몸을 전세계에 널리 알린 결정적인 작품으로 제1차 세계대전이 끝난 이듬해인 1919년에 출판되어 대단한 인기를 끌었다.,프랑스의 후기 인상파 화가 폴 고갱을 모델로 한 중년의 사내(스트릭랙드)가 달빛 세계의 마력에 끌려 6펜스의 세계를 탈출하는 과정을 그린 이야기. 세속의 세계에 대한 냉소 또는 인습과 욕망에 무반성적으로 매몰되어 있는 대중의 삶에 대한 풍자가 담겨있는 소설.,45841,BOOK
한국문학의 이해,김흥규 (지은이),8297,국내도서>대학교재/전문서적>어문학계열>국어국문학>국문학사/국문학개론,9788937410499,,"한국 문학을 이야기 해야하는 이유와 한국 문학의 영역,갈래,비평등 한국 문학의 위상을 보여준다.",2636,BOOK
곰 사냥을 떠나자,"마이클 로젠 (글), 헬린 옥슨버리 (그림), 공경희 (옮긴이)",35137,국내도서>유아>그림책>나라별 그림책>유럽,9788972590781,"집안 식구들이 곰 사냥을 떠났다가 막상 곰을 보니 겁이 나서 황황히 집으로 돌아와 이불 속에 숨는 이야기. 의성어와 후렴처럼 반복되는 문장이 흥을 돋우어 준다. 모험꾼들의 마음 졸임과, 부모와 자식간의 기분 좋은 사랑이 산뜻한 수채화로 표현되어 있다.","집안 식구들이 곰 사냥을 떠났다가 막상 곰을 보니 겁이 나서 황황히 집으로 돌아와 이불 속에 숨는 이야기. 의성어와 후렴처럼 반복되는 문장이 흥을 돋우어 준다. 모험꾼들의 마음 졸임과, 부모와 자식간의 기분 좋은 사랑이 산뜻한 수채화로 표현되어 있다.",29742,BOOK
거신 7 - 소드 마스터,김강현 (지은이),51122,국내도서>소설/시/희곡>판타지/환상문학>한국판타지/환상소설,9788954248716,"김강현의 판타지 장편소설. 슈린 공작의 흉계에 의해 가문과 재산, 아버지까지 모두 잃은 제론은 초고대 문명이 남긴 유적의 비밀을 우연히 알게 되고 그곳의 주인이 된다. 살아남기 위해서, 복수하기 위해서 유적의 힘을 얻으려 노력하는데…","김강현의 판타지 장편소설『거신』제7권 《소드 마스터》. 흙먼지가 일었고, 다시 걷혔다. 붉은 검에 조종석을 꿰인 몰레스와 그 옆에 오연히 서 있는 핏빛 실바가 보였다. 한 줄기 바람이 전장을 휩쓸고 지나갔다. 그 바람은 몰레스를 탄 라이더들의 귓가에 스산하게 울렸다. 그리고 레늄 왕국 라이더들의 가슴에 뜨겁게 스며들었다. 전장을 지배하는 붉은 학살자, 하지만 그것은 시작에 불과했으니……. 초고대 문명이 남긴 유적의 주인, 그가 기간틱 마스터가 되는 그 날 누구도 본 적 없는 강철 거신이 눈을 뜨리라!",55,BOOK
