title,author,genre_id,genre,ISBN,description_aladin,description_naver,salesPoint,mallType
까치와 소담이의 수수께끼놀이,"김성은 (지은이), 김종도 (그림)",35134,국내도서>유아>그림책>나라별 그림책>한국 그림책,9788971966686,"도시에 살다 보면 계절의 흐름을 잊기 쉽다. 넥타이 맨 아빠들은 도심의 콘크리트 빌딩 상자 속에서 계절을 잃어버리고, 아파트 숲에 파묻힌 아이들 역시 계절을 잊고 산다. 새로 나온 그림책 <까치와 소담이의 수수께끼 놀이>와 '도토리 계절 그림책' 시리즈는 자연의 아름다움을 그림으로나마 아이들에게 돌려주고 있다. -조선일보","나이가 어리다고 아무도 놀이에 끼어주지 않는 소담이에게 까치가 다가온다. 까치는 수수께끼 놀이를 하자고 하고, 첫번째 문제를 낸다. 



""하얀 우산을 쓰고 훨훨 날아가는 게 무얼까?""



3월의 들판 이곳저곳에서도, 4월의 진달래에서도 소담이는 수수께끼를 풀지 못하다가 마침내 5월이 되자 수수께끼를 풀 수 있게 되었다. 답은 민들레 씨. 



다음에 까치는 또 수수께끼를 내고, 소담이는 매달 자연 속에서 뛰어놀며 수수께끼를 풀려고 궁리하다가 풀게된다는 이야기. 3월 봄부터 시작하여 다음 해 2월이 될 때까지 소담이에게 까치는 4개의 수수께끼를 낸다. 



까치의 수수께끼가 무얼 의미하는지는 자연 속에서 맘껏 뛰어놀은 어른들이라면 으례 알 것이다. 바로 봄, 여름, 가을, 겨울 네 계절의 가장 특징적인 것들을 묻는 것을. 그러나 도시 한 복판 회색 빌딩 속에서만 자란 아이들은 정말 모를 수수께끼. 



하지만 책 가득히 펼쳐진 김종도의 그림을 보고 있노라면, 아마 도시 아이들도 이내 가상체험을 한 것 같은 느낌을 받으리라. 계절의 색을 편안하면서도 화면 가득 펼쳐놓고 있는 그 그림에서 어른들은  어린 시절의 향수를, 아이들은 '이런 것도 있었나' 싶은 호기심을 맘껏 끄집어 낼 수 있다. 



1년이 지나 소담이는 이제 언니, 오빠들과 놀고 있고, 까치는 다시 어린 '누리'에게 말을 건다. 



""누리야, 누리야. 나랑 수수께끼 놀이 하지 않을래?"" 



한 해가 흘러가면 또다시 신비한 4계절을 가진 또 한 해가 온다는 자연의 이치와 자연과 함께 성장하는 아이들의 모습을 곱게 담고 있는 창작그림동화. 취학전 어린이용.",7540,BOOK
새로 찾은 우리 신화,"김종상 (지은이), 김용철 (그림)",48876,국내도서>어린이>동화/명작/고전>어린이를 위한 고전,9788930207614,"초등학교 저학년을 위한 우리 신화 이야기. '바다와 땅에 생겨난 유래', '집을 지키는 성주신', '삼신 할머니', '바리 공주 이야기', '감은장아기',  '저승에서 있었던 일' 등 14편의 우리 민족 특유의 아기자기한 정서를 나타낸 전래동화와 신화가 그림과 함께 실려 있다.","초등학교 저학년을 위한 우리 신화 이야기. '바다와 땅에 생겨난 유래', '집을 지키는 성주신', '삼신 할머니', '바리 공주 이야기', '감은장아기',  '저승에서 있었던 일' 등 14편의 우리 민족 특유의 아기자기한 정서를 나타낸 전래동화와 신화가 그림과 함께 실려 있다.",2257,BOOK
어린이책 이야기 - 소년한길 어린이문학 5,이오덕 (지은이),48914,국내도서>어린이>아동 문학론>아동 문학 일반,9788935654390,,,497,BOOK
너 자신을 혁명하라,"함석헌 (지은이), 김진 (엮은이)",51374,국내도서>에세이>명상에세이,9788977181991,"이 책은 함석헌이 남겼던 말과 글들을 모아 놓은 '명상집'이다. 학문으로서 그의 사상을 파고드는게 아닌, 그의 글 속에서 자신과 세상에 대한 자연스러운 깨달음을 얻을 수 있도록, 그래서 '명상과 실천'의 조화로운 삶을 살 수 있도록 도와주는 책이다.",,410,BOOK
들쑥이와 날쑥이의 종이 나라 여행 - 내 손으로 직접 만드는 입체 그림책,"안티예 폰 스템 (지은이), 고영아 (옮긴이)",51820,국내도서>어린이>문화/예술/인물>음악/미술/예체능,9788949170527,"단순히 읽어나가는 책이 아니라, 도중에 책장을 잘라내고 다시 접고 오려서 무언가를 만들어 내는 책. 그리하여 완성되는 것은 원래의 책과는 완전히 달라진 입체책이다.",,1568,BOOK
병원균의 습격 - 영재과학 생명공학 시리즈 2,"프랜 보크윌 (지은이), 믹 롤프 (그림), 한현숙 (옮긴이)",48869,국내도서>어린이>과학/수학/컴퓨터>생물과 생명,9788988907450,,피할 수 없는 병원균이 몸에 들어와도 우리가 아프지 않는 것은 방어세포 때문입니다. 100조개나 되는 복잡한 세포로 이루어진 우리 몸에는 병원균을 방어하는 유용한 세포들이 있습니다. 에서는 그러한 세포들을 재미있는그림과 함께 알아봅니다. 그리고 병들고 아프게 하는 나쁜 세포들을 가지고 힘들게 살아가는 우리 친구들도 만나봅니다.,1051,BOOK
광기의 역사 - 현대 프랑스 철학총서 11,미셸 푸코 (지은이),8333,국내도서>대학교재/전문서적>사회과학계열>사회학,9788974185114,우리는 일반적으로 사람을 '정상적인 사람'과 '비정상적인 사람'으로 나눈다．그러나 그 나눔의 기준은 무엇일까．예컨대 멀쩡한 사람과 미친 사람을 가르는 기준은 도대체 무엇일까．이러한 나눔은 과연 객관적인 것일까．푸코는 우리 사회에서 통용되는 나눔들중 상당수가 매우 불투명한 근거 위에서 이뤄져 있음을 역설한다.,"프랑스 철학자 미셀 푸코가 파시즘으로 대표되는 광인의 문제는 바로 인간의 문제로 직결됨을 설명하는 저서. '광인의 항해', '대감금', '열정과 정신착란', '조증과 우울증', '히스테리와 히토콘드리아' 등 7개 장으로 구성되어 있다.",2531,BOOK
풀 하우스 Full House 8,원수연 (지은이),3742,국내도서>만화>순정만화>레이디스 코믹,9788953239654,,,641,BOOK
유리가면 6 - 애장판,미우치 스즈에 (지은이),3742,국내도서>만화>순정만화>레이디스 코믹,9788952851574,,"엄마를 잃고 마음에 큰 상처를 입은 마야는 연기에도 열중하지 못한다. 호시탐탐 기회를 노리고 있던 스타 지망생 오도베 노리에의 함정에 빠진 마야. 결국 무대를 펑크내고 노리에는 마야의 대역으로 영광스런 스타의 자리로 발돋움한다. TV에서 출연정지를 당한 채 서서히 추락하는 마야. 한편 아유미는 노래에의 책략으로 마야가 추방당한 걸 알자, 분노하여 마야의 복수를 위해 나서는데!!",689,BOOK
운명,"임레 케르테스 (지은이), 박종대, 모명숙 (옮긴이)",51036,국내도서>소설/시/희곡>세계의 소설>동유럽소설,9788989805380,"2002년 노벨문학상을 수상한 임레 케르테스의 대표작. 1975년에 발표한 작품으로 '운명 3부작'(<운명>, <좌절>, <태어나지 않은 아이를 위한 기도>) 중 첫 번째 권이다. 원제는 'Sorstalansag', '운명은 없다'라는 뜻이다.",,1174,BOOK
오페라의 유령,"가스통 르루 (지은이), 성귀수 (옮긴이)",50921,국내도서>소설/시/희곡>프랑스소설,9788970752365,가스통 르루의 1910년 원작소설이지만 앤드류 로이드 웨버의 뮤지컬로 전세계적으로 알려진 이야기. 천사의 목소리를 타고 났지만 선천적인 기형 때문에 가면을 쓰고 오페라 극장 지하에서 살아야 했던 남자 주인공의 비극적인 사랑 이야기이다.,"프랑스의 대표적인 추리작가 가스통 르루의 대표작. [오페라의 유령]의 주인공은 언제나 오페라 극장 2층의 5번 박스석을 차지하는 괴신사다. 그는 천상의 목소리를 타고났지만 사람들 앞에 모습을 드러낼 수 없는 비운의 음악가이며, 천재적이고 악마적인 건축가이기도 하다. 오페라의 유령은 극장의 프리마돈나를 사랑하게 되어 그녀를 납치한다. 서양 문화권의 이야기 원형인 [미녀와 야수]류의 섬뜩하면서도 애절한 로맨틱 미스터리 소설.",7937,BOOK
이문열 이희재 만화 삼국지 8 - 솥발처럼 갈라선 천하,"나관중 (지은이), 이문열 (옮긴이), 이희재 (작화)",49224,국내도서>어린이>초등 전학년>학습만화,9788937811340,"이문열.이희재의 만화 삼국지. 이문열의 삼국지를 판본으로 하여, 만화가 이희재가 작화했다. 이희재는 이문열 삼국지의 특성, 10권의 기본구도와 스토리 라인을 최대한 존중하면서도, 만화적 구성력을 한껏 살려내었다.",,3861,BOOK
토마토 업앤다운 팩 Up & Down Pack - 2nd Edition,오혜정 (지은이),50003,국내도서>외국어>토익>종합,9788971768709,"인터넷 사이트(http://www.englishcare.com)를 통해 학습자의 약점을 진단,보완해주는 시스템을 갖추고 있는데, 개별 학습자의 가려운 부분을 리얼타임으로 해결해 주고 있으며 최신 정보와 학습 기법을 매일매일 업데이트하고 있다고 한다.",,1097,BOOK
메주 도사 - 옛이야기 보따리 3 (보급판),"서정오 (지은이), 이형진 (그림)",48825,국내도서>어린이>초등1~2학년>동화/명작/고전,9788985494878,"어린이에게 직접 이야기하듯 쓴 전래 동화. 〈메주도사〉는 겉모양으로 사람을 판단하고 무시하는 어리석은 선비이야기. 이 책에는 표제작 외에 모두 9편의 동화가 실려 있는데, 재미있으면서도 한번쯤 생각하게 하는 이야기를 모았다.",,3804,BOOK
후니의 쉽게 쓴 시스코 네트워킹,진강훈 (지은이),2737,국내도서>컴퓨터/모바일>컴퓨터 공학>네트워크/데이터 통신,9788955980059,PC통신상에서 쉽고 재미있게 네트워크를 설명해준다고 하여 먼저 입소문이 났던 책이다. 통신상에 연재했던 글을 기본으로 하여 수정과 추가를 거쳐 책으로 출간했다. 책의 제목인 '후니'는 통신상에서 사용한 필명이다.,,1347,BOOK
작은 책방,"엘리너 파전 (지은이), 에드워드 아디존 (그림), 햇살과나무꾼 (옮긴이)",48837,국내도서>어린이>초등3~4학년>동화/명작/고전,9788955820386,"어린 시절을 '작은 책방'이라는 먼지투성이 방에서 보낸 저자가 풍부한 상상력과 아름다운 문체로 쓴 이야기. 두 권으로 나누어 출간되었던 책을 원래의 모습대로 한 권으로 묶고, 5편의 작품을 추가로 번역해 총 20가지 이야기를 실었다.",,4504,BOOK
성서의 길을 따른 여정 - 구약편 3 (문제집 포함) - 예언서,국제성서연구소 (엮은이),51630,국내도서>종교/역학>가톨릭>가톨릭 성서>성서의 이해,,,,44,BOOK
신문 읽기의 혁명 - 개정판,손석춘 (지은이),51345,국내도서>사회과학>언론/미디어>언론학/미디어론,9788985548946,1997년 발행 이후 대학 새내기들의 필독서로 꾸준히 사랑받아온 손석춘의 <신문 읽기의 혁명> 개정1판. 2003년 오늘의 시각에 맞게 좀더 상세한 설명과 함께 최근 신문 편집의 예를 덧붙였다.,"신문에 대한 일대 계몽이 절실할 만큼 신문독자 대다수가 신문에 대해 무지할뿐더러 신문을 잘못 읽고 있다는 문제의식을 나타낸 책. 올바른 신문 읽기란 곧 '기사 읽기'를 넘어선 '편집 보기'에 있음을 보여주며, 신문 독자의 관점을 포괄해내는 가운데 신문이라는 사회적 현상을 바라보았다. 또한 언론의 보이지 않는 장막에 갇혀진 삶이 아니라 언론의 장막으로부터 해방된 삶으로서의 '신문 읽기'를 제안한다.",3721,BOOK
경제기사랑 친해지기,류대현 (지은이),3065,국내도서>경제경영>경제학/경제일반>경제이야기,9788955330793,이 책은 골치 아프게만 느껴지는 경제기사를 말로 설명을 듣는 듯한 쉬운 표현과 기발하고 코믹한 사례 그리고 재치있는 문장력으로 우리와 친하게 만들어준다. 경제에 대해 전혀 모르는 일반인은 물론 중·고등 학생도 부담없이 읽을 수 있는 수준이다.,,337,BOOK
짱뚱이의 나의 살던 고향은,"오진희 (지은이), 신영식 (그림)",49995,국내도서>어린이>TV/만화/영화>만화 일반,9788970571249,"만화로 배우는 `자연사랑`. 고향이라는 말엔 그리움이 묻어난다. 자신도 모르는 사이에 스며들어 가슴이 먹먹해지는, 저마다의 추억이 춤추는 곳. 그 흙 냄새, 바람 냄새…. 하지만 자연과 더불어 함께 뛰놀지 못하고 기껏해야 `구경`이나 다녀야 하는 요즘 아이들이라니.

없이 살아도 마음 푸근했던 그 시절, 고향의 정겨운 ...",,4588,BOOK
"이문열 이희재 만화 삼국지 9 - 출사표, 드높아라 충신의 매운 얼이여","나관중 (지은이), 이문열 (옮긴이), 이희재 (작화)",49224,국내도서>어린이>초등 전학년>학습만화,9788937811357,"이문열.이희재의 만화 삼국지. 이문열의 삼국지를 판본으로 하여, 만화가 이희재가 작화했다. 이희재는 이문열 삼국지의 특성, 10권의 기본구도와 스토리 라인을 최대한 존중하면서도, 만화적 구성력을 한껏 살려내었다.",,3822,BOOK
맨큐의 경제학 - 3판,"그레고리 맨큐 (지은이), 김경환, 김종석 (옮긴이)",8560,국내도서>대학교재/전문서적>경상계열>경제학,9788970856186,하버드 대학의 그레고리 맨큐 교수가 경제학에 입문하려는 학생들을 위해 내놓은 경제학 원론. 경제 이론 나열에 그치지 않고 풍부한 사례와 비유를 사용해 경제학의 기본 원리를 흥미롭게 풀어나간 것이 특징이다.,"경제학의 기본원리를 체계적으로 정리한 대학교재 겸 이론서.『맨큐의 경제학』은 초판이 출간된 이래로 전 세계 수많은 대학에서 경제학 전공교재로, 또는 교양교재로 많이 채택하고 있다. 경제학 전공자라면 모르는 사람이 없을 정도로 유명한 이 책은 경제학의 기본원리를 자세하게 설명하고, 현실에 적용될 수 있는지 알기 쉽게 보여준다.
<BR>
<BR>저자인 맨큐교수는 프린스턴대학교를 졸업하고 MIT에서 공부하였으며, 현재 하버드대학교 경제학과에 재직하고 있다. 거시경제학, 미시경제학, 통계학, 경제학 원론등 많은 과목을 강의하고, 각종 저술활동, 학술 토론, 정책 토론에 참여하였다. 또한 맨큐교수가 쓴 는 거시경제학 교과서의 전설적인 베스트셀러이다.
<BR>
<BR>맨큐교수는 이 책을 집필하면서 학생들이 문제의 핵심을 보지 못하게 하는 복잡한 설명이나 산만한 내용을 배제하였으며 딱딱한 경제이론보다는 사례 분석과 정책 문제에 많은 부분을 할애하였다. 그리고 다양한 사례를 보여주면서 경제학적 사고를 통해 우리 시대의 사회문제를 어떻게 조명할 수 있는지도 알려준다.",2078,BOOK
꼴찌에게 보내는 갈채,박완서 (지은이),51371,국내도서>에세이>한국에세이,9788933840559,1977년에 발간된 <꼴찌에게 보내는 갈채>의 개정 증보판이다. 작가에서 에세이스트로서 박완서를 널리 알리게 된 책이다. '세계사'는 출간 25주년을 기념하여 원고를 보충하고 장정을 새로 선보였다.,"1977년에 발간된 의 개정 증보판이다. 작가에서 에세이스트로서 박완서를 널리 알리게 된 책이다. '세계사'는 출간 25주년을 기념하여 원고를 보충하고 장정을 새로 선보였다. 



초판본 책머리에는 ""원태 간직하거라, 엄마가""라는 헌사가 들어 있었지만, 그 후에 외동아들이 먼저 세상을 떠나는 가슴 아픈 일이 있었다. 이번에 수록된 '내가 걸어온 길'은 아들을 잃은 애통함을 토로한 글로 독자들의 마음을 적신다.



기성세대와 새세대의 마찰을 그린 '머리털 좀 길어 봤자', 자연과의 아름다운 동화(同化)를 이야기 한 '까만손톱', 이웃에 대한 따뜻한 정을 보여주는 '나의 아름다운 이웃' 등 50여편의 글이 수록되었다. 그녀가 체험하고 느낀 삶의 풍경과 세태 속에서 세월의 흐름을 읽을 수 있다.",3717,BOOK
"아들아, 머뭇거리기에는 인생이 너무 짧다 1 - 비전(VISION) 편",강헌구 (지은이),32399,국내도서>청소년>청소년 자기계발,9788988798560,서울과 수원에 있는 '비전스쿨'에서 젊은이들에게 '비전을 가지는 것의 중요함'을 가르치고 있는 강헌구 교수가 쓴 젊은이를 위한 인생 지침서.,,7648,BOOK
인연 - 반양장,피천득 (지은이),51371,국내도서>에세이>한국에세이,9788946413641,<인연>은 '수필'하면 떠오르는 이름인 금아 피천득 선생의 수필집이다. '수필'이란 것이 자꾸만 잡문으로 여겨져 한옆으로 치워지는 세상에서 다시 읽는 <인연>은 교과서를 통해 읽는 것보다 훨씬 아름답다.,"<인연>은 '수필'하면 떠오르는 이름인 금아 피천득 선생의 수필집이다. 교과서에도 실렸던 아사꼬와의 이야기 '인연'부터, '수필은 청자 연적이다...'로 시작하는 '수필', '내가 늙고 서영이가 크면 눈 내리는 서울 거리를 같이 걷고 싶다'로 끝나는 '나의 사랑하는 생활'까지.<BR>
<BR>
이 단아하고 정결한 문체의 수필 80여편 중 단 한 편이라도 읽어보지 못한 사람이 있을까. '수필'이란 것이 자꾸만 잡문으로 여겨져 한옆으로 치워지는 세상에서 다시 읽는 <인연>은 교과서를 통해 읽는 것보다 훨씬 아름답다.",5377,BOOK
로지컬 씽킹 - 맥킨지식 논리적 사고와 구성의 기술,"오카다 게이코, 데루야 하나코 (지은이), 김영철 (옮긴이)",70226,국내도서>자기계발>협상/설득/화술>설득,9788985893893,"현직 맥킨지 에디터가 커뮤니케이션을 단순한 테크닉이나 재주가 아니라 전달이라는 것을 하나의 과학적 방법으로 파악하고, 맥킨지의 MECE와 So What? / Why So?을 구체적으로 학습하며 로지컬 커뮤니케이션 기법을 실제로 훈련할 수 있도록 구성했다.
",,4965,BOOK
태백산맥 8,조정래 (지은이),51123,국내도서>소설/시/희곡>역사소설>한국 역사소설,9788973374151,,,911,BOOK
Harry Potter - 전4권 세트 - 미국판 반양장본,J.K. 롤링 (지은이),106416,외국도서>어린이>픽션>문학 >판타지/매직 ,9780439434867,,,450,FOREIGN
사람은 무엇으로 사는가,"레프 니콜라예비치 톨스토이 (지은이), 방대수 (옮긴이)",52650,국내도서>소설/시/희곡>러시아소설,9788979441147,"러시아의 민간 전설을 토대로 톨스토이가 쓴 작품들, 「사람은 무엇으로 사는가」「사람에겐 얼마만큼의 땅이 필요한가」「바보 이반」등을 아기자기한 일러스트와 함께 엮었다.","마음을 풍요롭게 해주는 러시아 대문호의 소설선집. 가난한 구두장이 부부와 천사의 교제를 통해 사랑과 지식의 중요성을 강조한 표제작 외에 러시아 민간 전설을 토대로 한 ,,  등을 엮었다.",4877,BOOK
반딧불이의 무덤,"노사카 아키유키 (지은이), 타카하타 이사오 (그림), 서혜영 (옮긴이)",51255,국내도서>소설/시/희곡>세계의 문학>일본문학,9788988964217,"병든 엄마는 공습 와중에 죽어버리고 아버지는 전쟁에 나가 소식을 알 수 없다. 하루아침에 고아가 되어버린 어린 남매 앞에 놓인 현실은, 굶주림과 질병, 사람들의 멸시와 무관심 뿐이다. 어머니의 유품을 팔아 하루하루 연명하는 남매에게 희망의 불빛 같은 건 존재하지 않는다.",,913,BOOK
이 땅의 큰 나무,"고규홍 (지은이), 김성철 (사진)",4869,국내도서>역사>문화/역사기행>한국 문화/역사기행,9788990620002,"<이 땅의 큰 나무>는 바로 이러한 큰 나무들을 찾아가 나무에 얽힌 이야기를 듣고 그 모습을 살펴 밝힌 답사기로, 우리나라의 대표적인 나무라 할 수 있는 천연기념물과 지방기념물급의 나무들을 일일이 찾아가 살핀 후 그 중 특히 의미가 있다고 생각되는 130그루의 모습을 책에 담았다.",,167,BOOK
마음에는 평화 얼굴에는 미소,"틱낫한 (지은이), 류시화 (옮긴이)",51637,국내도서>종교/역학>불교>불교 문학,9788934910299,평화를 향한 틱낫한의 가르침을 담았다. 명상의 중요함을 설명한 예화와 초발심 시절의 이야기도 친근감있게 다가온다. 그는 죽음과 그 이후에 대해서도 많은 장을 할애했다.,,2514,BOOK
베르세르크 24,미우라 켄타로 (지은이),3724,국내도서>만화>소년만화>액션,9788925261164,,"『베르세르크』 제24권. 여행의 새로운 동료로 이시도르, 파르네제, 세르피코가 끼게 된 가츠 일행은 그리피스가 부활한 이후, 세계가 그 모습을 바뀌어 가는 도중, 숲속에서 마녀와 만나게 된다. 정령수의 저택에서 가츠 일행을 기다리고 있었다고 말하는 마녀 플로라, 그녀의 진의는?! 그리고 가츠는 마법과 마녀를 통해 무엇을 알게 될 것인가?!",355,BOOK
당나귀 귀,"쎄르쥬 뻬레즈 (지은이), 문병성 (그림), 박은영 (옮긴이)",50759,국내도서>청소년>청소년 문학>청소년 소설,9788986396294,"세계 청소년 화제작 시리즈 3권. 부모, 선생, 친구로부터 학대받고 따돌림당하는 한 아이의 섬세한 내면을 통해 위선과 부조리에 가득 찬 어른들의 세상을 보여주고 있는 책이다. '당나귀 귀', '이별처럼', '난 죽지 않을 테야' 등 3부작으로 이루어졌고, 이 책은 그 중에 첫 편에 해당한다.",,1692,BOOK
태백산맥 7,조정래 (지은이),51123,국내도서>소설/시/희곡>역사소설>한국 역사소설,9788973374144,,,892,BOOK
소금이 온다 - 서해 염전에서 나는 소금,"도토리 (엮은이), 백남호 (그림)",35141,국내도서>유아>유아 교양/학습>유아 자연관찰/과학>자연관찰/과학일반,9788984281646,"너무나 친근해서 잘 몰랐던 우리 소금에 대한 지식을 알 수 있는 그림책이다. 소금이 만들어지는 과정을 생생히 그리기 위해, 전라 북도 부안에 있는 곰소 염전, 전라 남도 신안에 있는 압해도 염전, 인천 소래 염전 등을 답사한 후 만들었다고 한다.",,4528,BOOK
링구아포럼 e-토플 - 독해편 (입문용),링구아포럼 리서치센터 (지은이),49866,국내도서>외국어>토플>Reading,9788989260592,초등학교때부터 영어를 공부한 중학교 1-2학년 학생을 대상으로 한 독해 학습 교재. TOEFL의 학습 방향을 토대로 하고 있다. 6가지의 기본 Approcah학습은 지문을 정확히 이해하는 훈련을 하는데에 효과적이다. 독해 연습 외에도 TOEFL에 대한 전반적인 정보를 제공하여 시험 준비에 만전을 기할 수 있도록 했다.,,586,BOOK
이문열 이희재 만화 삼국지 6 - 불타는 적벽,"나관중 (지은이), 이문열 (옮긴이), 이희재 (작화)",49224,국내도서>어린이>초등 전학년>학습만화,9788937811326,,,4040,BOOK
아즈망가 대왕 2,"아즈마 키요히코 (지은이), 이은주 (옮긴이)",2552,국내도서>만화>코믹/명랑만화,9788952835727,"일본에서 이미 137만 부가 팔렸고, 애니메이션으로도 제작된 인기작. <아즈망가 대왕>은 편안하다. 심각한 철학적 문제도, 얼굴이 찌푸려지는 엽기적인 설정도, 일부 사람들만 즐거워할 꽃미남도 없이, 여고생의 일상을 네 컷 안에 깔끔하게 담아 놓았다.",,965,BOOK
해맑은 피부를 되찾은 아이 - 자연건강법으로 아토피(천식·비염) 고치기,최민희 (지은이),51789,국내도서>좋은부모>건강/환경,9788995350409,"이 책은 저자가 운영하는 자연건강법 관련 사이트 '수수팥떡'에 실린 아토피 아이를 둔 엄마들의 생생한 치료 사례와 수기, 아토피 치료에 대한 수많은 궁금점에 관한 저자의 자상하고 소신있는 답변을 수록한 아토피 자연치료 정보서이다.",,1828,BOOK
아기 오리는 어디로 갔을까요? (양장),"낸시 태퍼리 (지은이), 박상희 (옮긴이)",35135,국내도서>유아>그림책>나라별 그림책>미국,9788949110493,"아이들이 그림책을 한 번만 보고 마는 경우는 드물다. 아이들은 한 권의 책을 보고 또 보면서 어른들이 무관심하게 스쳐버리는 구석구석의 장치들을 캐낸다. 낸시 태퍼리는 이런 아이들의 특성을 아주 잘 살릴 그림책을 만들었는데, 바로 이 책이다.","어느날 아침, 아기오리는 호랑나비를 좇아 둥지를 떠나자 엄마오리는 아기오리를 찾아 나선다. 해오라기, 거북, 비버, 뿔논병아리 모두 아기오리를 못봤다는데... 아기오리는 어디서 뭘하고 있는 걸까? 숨은그림찾기와 섬세한 동식물 그림으로 관찰력을 기르는 책이다.칼테콧명예상 수상작이다.",6545,BOOK
