title,author,genre_id,genre,ISBN,description_aladin,description_naver,salesPoint,mallType
유시민의 경제학 카페,유시민 (지은이),3065,국내도서>경제경영>경제학/경제일반>경제이야기,9788971991367,"'경제학적 사고방식'을 제공하는 책. 경제학이 어떤 철학적 토대 위에 서 있으며, 그것이 실제 경제현상을 어디까지 얼마나 설명할 수 있는지 알아본다. 딱딱한 경제학 교과서를 좋아하지 않는 평범한 시민과 학생들을 위해 써내려 간 경제학 책이다.","문제는 '경제학적 사고방식'으로 생각할 수 있는가다!

시사평론가 유시민이 평범한 시민과 학생들을 위해 써내려 간 흥미로운 경제서 『유시민의 경제학 카페』. '경제학'이라는 전공 학문의 이론적 토대 위에, 자유롭고 신선한 발상이 존재하는 지성의 공간, '경제학 카페'를 차리고 독자들을 초대했다. 튼튼한 학문적 바탕에다 시사평론가로서의 명징하고 정연한 논리, 그리고 예리한 시각으로 무장한 이 책은, 차분하면서도 직설적인 유시민 특유의 문체로 경제학이라는 까다로운 학문의 벽을 무너뜨린다.

책에는 어째서 동네 다방의 커피 한 잔이 자장면 한 그릇보다 더 값이 비싼지, 컴퓨터 값은 갈수록 떨어지는데 집 값은 왜 오르기만 하는 것인지, 박찬호는 한국에 있으나 미국에 있으나 똑같은 박찬호인데, 메이저리그에 가서는 국내에서보다 몇십 배 많은 연봉을 받는 이유가 무엇인지 등 일상 속에서 궁금한 내용들을 다루고 있다.

이처럼 이 책은 실생활에서 만나는 수많은 경제 문제의 본질이 한눈에 파악되고, 복잡하게 꼬인 세상이 밑바닥부터 이해할 수 있또록 안내한다. 경제학과 경제현상에 대한 정보와 지식을 얻을 수 있으며, 궁극적으로는 '경제학적 사고방식'으로 생각할 수 있도록 안내한다.",14025,BOOK
일요일 스키야키 식당,배수아 (지은이),50993,국내도서>소설/시/희곡>한국소설>2000년대 이후 한국소설,9788932013985,"인터넷에 연재했던 연작형식의 소설. 대학교수에서 준 금치산자로 전락해버린 마(馬)의 집에 전처가 방문하는 이야기로 소설은 시작된다. 스키야키(일본식 전골요리)를 먹으러 가고 싶어하는 마, 하지만 돈이 없다. 침을 질질 흘리며 '먹고 싶은 것은 다 먹고 살아야지'라고 말하는 그의 모습은 참으로 비루하다.","모든 빈곤은 타인과 비교됨으로써 상대적이며 또한, 한번 그 늪에 빠지게 되면 탈출이 거의 불가능하기에 절대적이기도 하다. 이 소설이 그리고 있는 '빈곤'은 물질적 조건에서의 결핍만은 아니다. 정신적 육체적 상대적인 모든 '결핍'과 그것에 뒷덜미를 잡힌 채 살고 있는 인간군상들이 이 안에서 구물거리고 있다. 배수아 식의 독특한 인물설정이 눈에 띄며 이전 작품들과 비슷하면서도 확연히 다른 분위기를 풍기는, 작가의 변신이 돋보인다.",515,BOOK
삼국지 해제,"장정일, 김운회, 서동훈 (지은이)",8284,국내도서>대학교재/전문서적>어문학계열>중어중문학,9788934912514,"현대적 시각, 새로운 해석으로 바라본 <삼국지>의 모든 것. <삼국지>의 역사적 진실을 규명하고, 심오한 동양사상과 현대 국제정치, 경제, 경영, 통일 문제 등을 조망했다.","여러 동양사상들과 최근에 확보된 동아시아의 고대 역사는 물론, 현대의 국제경제, 국제정치, 대통령학, 통일이론, 전쟁이론, 기업전략, 리더십 이론 등이 동원되고 연계되고 있다. 이런 광범위한 연구를 통해 좀 더 넓은 안목으로 『삼국지』을 조망하고 그것으로부터 새로운 해석을 이끌어 내고 있다. 이처럼 『삼국지 해제』는 그동안 아무도 시도하지 않았던 『삼국지』에 대한 탁월한 분석과 안목으로 근본적인 시각의 변화를 일으키는 계기가 될 것이다.",301,BOOK
"기업을 알려면 재무제표를 읽어라 - 기본의 기본편, 모든것 시리즈 40","이시지마 요우이치 (지은이), 이신애 (엮은이)",174,국내도서>경제경영>재테크/투자>주식/펀드,9788935204717,"공적인 주식투자를 위해 기업의 성적표인 재무제표를 읽는 법을 가르쳐 주는 입문서. 손익계산서, 대차대조표에서 현금흐름표까지 분석하는 54가지 방법을 가르친다. -- 국민일보",,605,BOOK
나무를 심은 사람,"장 지오노 (지은이), 김경온 (옮긴이)",50921,국내도서>소설/시/희곡>프랑스소설,9788974430054,단 한 사람의 외로운 노력으로 프로방스의 황무지가 거대한 숲으로 바뀐 기적 같은 이야기. 한 늙은 양치기의 이야기.,,2746,BOOK
바빠요 바빠 - 가을,"윤구병 (지은이), 이태수 (그림)",35134,국내도서>유아>그림책>나라별 그림책>한국 그림책,9788984280571,"결실의 계절 가을에는 사람 뿐만 아니라 동물들도 나무도 풀도 바쁘다. 화가 이태수는 쉽게 보기 힘든 풍경들을 연필과 목판의 중간단계 도구인 콘테를 통해 ""까실까실한"" 질감으로 표현해냈다. -동아일보","초등학교 국어 읽기 교과서에 실린 바 있는 ‘도토리 계절그림책’시리즈 가을편이다. 자연과 더불어 생활하는 작가 윤구병씨가 글을 쓰고, 세밀화로 유명한 삽화가 이태수씨가 그림을 그렸다. 산골 마을의 가을 풍경을 배경으로 마루네의 여행 이야기와 산속 동물들의 삶의 모습이 자연스럽게 녹아 있다. 어린이에게는 생소하지만 재미난 농촌이야기로, 어른들에게는 그리...",20519,BOOK
칠칠단의 비밀 - 방정환의 탐정소설,"방정환 (지은이), 김병하 (그림)",48874,국내도서>어린이>동화/명작/고전>국내창작동화,9788971967652,소파 방정환 선생이 쓴 탐정소설. 방정환 탄생 100돌을 맞아 출간한 이 책은 중편 「동생을 찾으러」와 장편「칠칠단의 비밀」로 구성되었다. 두 편 모두 납치 당한 여동생을 찾아 나선 오빠가 일본인의 음모에 맞서 싸우는 과정을 흥미진진하게 그렸다.,,5962,BOOK
"Let's Go: 4: Student Book (Paperback, 2 Revised edition)","K. Frazier (지은이), Oxford University Press (엮은이)",106306,외국도서>어린이>코스북>초등 코스북,9780194364737,,,2619,FOREIGN
우리 아이가 영어동화에 폭 빠졌어요,김인경 (지은이),3390,국내도서>좋은부모>교육/학습>언어/외국어 교육,9788974748678,"이 책은 압구정동에서 어린이 영어 교육연구소를 운영하며, 국내에 영어동화 읽기를 본격적으로 소개하고 있는 저자가 동화가 영어교육에 효과적인 이유, 영어 동화를 선택하는 방법, 영어동화 읽어주는 방법 등 영어동화에 대한 궁금증을 풀어준다.",,1528,BOOK
관촌수필,이문구 (지은이),50994,국내도서>소설/시/희곡>한국소설>2000년대 이전 한국소설,9788932008509,"문체의 아름다움에 있어서 `북에 홍명희, 남에 이문구`라는 찬사를 듣게 한 이문구의 대표작. 잡지 발표를 거쳐 1977년 단행본으로 묶여 나온 이 연작소설집은 작가의 고향인 충남 보령  관촌마을을 배경으로 한 자전소설이다. 소설의 태반은 한국전쟁기를 그리고 있는데，그로부터 20여년 뒤 고향을 찾은 작가가 옛일을 회상하는 형식을 취하고 있다.",,10005,BOOK
"인간 복제, 그 빛과 그림자",안종주 (지은이),8345,국내도서>대학교재/전문서적>자연과학계열>생물학,9788988804827,생명공학 연구의 진행사항과 그에 대한 각계의 반응을 일목요연하게 정리한 것으로 인간 배아 복제를 둘러싼 세계 각국의 규제 행태도 비교 검토했다.,,176,BOOK
언제까지나 나는 꿈꾸는 청년이고 싶다,류태영 (지은이),51427,국내도서>에세이>종교에세이>기독교,9788971542118,"<언제까지나…>는 류박사가 구두닦이, 신문팔이, 행상 등을 하면서 야간고등학교와 대학교를 다녔고 세계적인 대학에서 석·박사 학위를 받아 우리나라 최고의 '엘리트'가 되기까지의 삶을 집중 조명한 책．-국민일보-",산촌 오지 마을에서 가난한 농부의 아들로 태어나 박사가 되고 교수가 되기까지 저자가 살아온 삶이 솔직하고 담담하게 그려져 있다. 미래의 꿈을 잉태하고 꾸준히 마음을 쓰며 노력해 나간다면 가슴속 깊이 드리운 꿈이 언젠가는 반드시 이루어진다고 이 책에서 저자는 말하고 있다.,1413,BOOK
설득의 법칙,"로저 도슨 (지은이), 박정숙 (옮긴이)",70226,국내도서>자기계발>협상/설득/화술>설득,9788995274514,이 책은 설득의 달인이 되기 위한 노하우를 알려주는 책이다. 그러나 분명 그 탁월함을 드러낸다. 설득의 법칙과 실례를 깔끔하게 엮어 저자가 말하고자 하는 요점이 명료하게 전달되기 때문이다.,,3676,BOOK
"English Cafe - 제5탄 - 톡톡 Vocabulary, 2003년 4월분",문단열 (지은이),49849,국내도서>외국어>영어회화>생활영어,9788990481054,"방송에서 나온 표현과 문장을 재미있는 에피소드와 삽화를 곁들여 소개하는 '보고들은 그대로' 코너, 입에서 말이 바로 튀어나올 수 있도록 그 날 배운 표현 중에서 반드시 기억해야 될 핵심패턴에 관련 어휘를 끼워 넣는 즉각반응 트레이닝 '입에서 바로바로' 코너, 저자의 발음특강 '소리!소리!소리!' 등 다양한 코너로 알차게 꾸몄다.",,292,BOOK
"너도 하늘말나리야 - 아동용, 중학교 국어교과서 수록도서","이금이 (글), 송진헌 (그림)",48874,국내도서>어린이>동화/명작/고전>국내창작동화,9788957981023,"1999년 5월 초판이 출간된 이래 지금까지 총 스물여덟 곳의 단체와 기관으로부터 '좋은 책'으로 추천을 받았고, 30만부가 팔린 이금이 작가의 대표작.","『너도 하늘말나라야』는 사춘기에 접어든 미르, 소희, 바우의 이야기가 담겨 있습니다. 세 친구가 처한 환경은 각각 다르지만 '가정의 결손'이라는 공통점을 갖고 있습니다. 이러한 결손은 세 아이에게 상처를 남기고, 저마다의 방법으로 상처에 반응합니다. 

미르는 어린애마냥 떼를 쓰고, 그와 반대로 소희는 조숙하기만 합니다. 그리고 바우는 '선택적 함구증'에 스스로를 가두고 맙니다. 하지만 세 아이는 자신이 미처 알아차리기도 전에 아픈 상처를 치유해 나갑니다. 또 자신의 아픔에 힘겨우면서도 다른 사람의 아픔을 들여다보게 됩니다. 이를 통해 훌쩍 커 버린 세 아이의 모습을 볼 수 있습니다. [개정판]",32090,BOOK
엄마가 들려주는 태교동화,김양현 (지은이),51770,국내도서>좋은부모>태교,9788986145878,"뱃속의 아이에게 들려줄만한 동화들을 엮은 책. 임산부와 아이를 위한 밝고 맑고 재미있는 이야기 40편을 두 권에 각각 20편씩 담았다. 엄마가 아이에게 들려주는 동화, 아빠가 들려주는 동화로 나누어져 있다.",,7996,BOOK
생명이 있는 것은 다 아름답다 - 최재천의 동물과 인간 이야기,최재천 (지은이),51290,국내도서>과학>동물과 식물>동물 일반,9788986361438,"서울대학교 생명과학부 교수이자, 여러 언론 매체에 활발하게 기고해온 동물학자 최재천의 '동물과 인간 이야기'. 이 책은 동물들의 생태를 소재로 한 흥미진진한 과학적 사실에 인문학적 성찰을 덧붙인다.","동물들이 사는 모습을 알면 알수록 그들을 더욱 사랑하게 되는 것은 물론 우리 스스로도 더 사랑하게 된다는 믿으로 이 글을 썼다는 저자. 그는 제1회 대한민국 과학문화상 수상자인 동시에 현재 서울대학교 생명과학부 교수이기도 하다. 개미군단의 만리장성 쌓기, 고래들의 따뜻한 동료애, 가시고기 아빠의 사랑, 갈매기의 이혼, 까치의 기구한 운명, 블루길 사회의 열린 교육, 황소개구리의 세계화, 여왕벌의 별난 모성애 등  이 책은 그가 각기 다른 동물들의 세계를 들여다보며 그들이 살아가는 이런저런 모습들을 애정어린 시선으로 담은 것이다.",16341,BOOK
마녀 위니,"코키 폴 (지은이), 밸러리 토머스 (글), 김중철 (옮긴이)",35140,국내도서>유아>그림책>나라별 그림책>외국 그림책,9788949110233,까만 집에 사는 마녀 위니가 까만 고양이 윌버의 색깔을 제멋대로 바꾸자 윌버는 자신의 모습을 슬퍼한다. 이기적인 아이가 되기 쉬운 아이들에게 상대방을 배려할 줄 아는 마음을 심어 주는 책이다.,"이기적이 되기 쉬운 아이들에게 상대방을 배려할 줄 아는 마음을 심어주는 그림 동화. 까만 집에 사는 마녀 위니가 까만 고양이 윌버의 색깔을 제멋대로 바꾸자, 윌버는 자신의 모습을 슬퍼한다. 섬세한 터치와 과감한 색을 사용한 코키 폴의 그림이 인상적이다.",11680,BOOK
황금빛 똥을 누는 아기 - 자연건강법으로 아이 낳고 키우기,최민희 (지은이),51789,국내도서>좋은부모>건강/환경,9788974781552,"자연건강법을 오랫동안 연구하고 강의했던 지은이가 임신, 태교, 출산, 육아까지 자연건강법에 따라 자신의 아이(마흔살에 낳은 늦둥이)를 키운 체험과 방법을 소개한다.",,7465,BOOK
청소년 토지 6 - 2부 3권,"박경리 (지은이), 토지문학연구회 (엮은이)",50759,국내도서>청소년>청소년 문학>청소년 소설,9788957070079,,,560,BOOK
대화의 기술 - 공격적이지 않으면서 단호하게 나를 표현하는,"폴렛 데일 (지은이), 조영희 (옮긴이)",70227,국내도서>자기계발>협상/설득/화술>화술,9788971843642,"이 책은 자기 의사 표현을 제대로 하지 못해 늘상 피해의식에 사로잡혀 사는 이들, 특히 여성에 촛점을 맞춰서 '공격적이지 않으면서 단호하게' 내 생각을 말하는 법을 알려준다. 저자 자신과 주변 사람들의 다양한 실례를 읽다보면 저절로 고개가 끄덕거려지면서 이제 다시는 당하지 않으리라 결심하게 된다.",,5165,BOOK
달걀껍질 속의 과학,"로빈 베이커 (지은이), 유은실, 문혜원 (옮긴이)",51002,국내도서>과학>기초과학/교양과학,9788989418313,"과학의 결과에 영향을 미치는 여러 요소들인 정치적 압력, 여론 조작에 의한 대중의 압력, 과학자의 태도 등에 대해서도 매우 날카롭게 분석하고 비판한 책.",,145,BOOK
"아이들의 잠, 일찍 재울수록 건강하고 똑똑하다","마크 웨이스블러스 (지은이), 김지현 (옮긴이)",51789,국내도서>좋은부모>건강/환경,9788995139844,시카고 아동병원에서 수면장애센터를 운영하면서 수천 명의 어린이들을 대상으로 건강한 수면법을 연구해온 마크 웨이스블러스 박사. 그는 25년간의 임상 경험과 실제로 아들 넷을 키우면서 얻게 된 경험까지 보태 '아이들을 건강하게 재울 수 있는 수면법'을 아주 구체적으로 제시한다. 또한 저자의 수면법을 실제 생활에 적용했던 구체적인 사례들을 함께 적고 있다.,,3026,BOOK
에베레스트 등정하기,"박애라 (글), 유병윤 (그림), 허영호 (감수)",48867,국내도서>어린이>과학/수학/컴퓨터>과학 일반,9788937812064,"레포츠 만화 과학상식 시리즈 다섯번째 권. 초등학교 6학년 마로는 8000m급 봉우리를 두 번이나 오른 전문 산악인 아빠와 무뚝뚝하지만 탁월한 등반실력을 지닌 셰르파(히말라야 산맥에 사는 고산족, 높은 산을 오르는 사람들을 돕는 안내원으로 일한다.) 파쌍, 셰르파 지망생 앙마야와 함께 에베레스트를 오른다.",,1024,BOOK
들으면서 정리하는 이보영의 120분 영문법 (교재 + 테이프 3개),이보영 (지은이),49834,국내도서>외국어>영문법,9788982209017,"2개의 강의 테이프와 더불어 요점을 알기 쉽게 꾸민 책, 연습문제 정답과 패턴을 녹음한 '훈련 테이프'를 함께 활용하여 영문법을 간단히 마스터 할 수 있도록 돕는다.","이보영이 영문법 강의를 2개의 테잎에 담았다. 그녀과 함께 EBS-FM Morning Special을 진행하는 Issac이 콤비를 이루어 강의를 더욱 재미있게 구성했다. 2개의 강의 테이프와 더불어 요점을 알기 쉽게 꾸민 책, 연습문제 정답과 패턴을 녹음한 '훈련 테이프'를 함께 활용하여 영문법을 간단히 마스터 할 수 있도록 돕는다.",7282,BOOK
다니엘 학습법,김동환 (지은이),4621,국내도서>청소년>학습법,9788970468600,"2000년에 서울대학교를 수석으로 졸업(서울대 종교학과 4년간 평균 점수 99.26 취득)한 저자가 소개하는 신앙과 성적을 함께 높힐 수 있는 공부법. ""기도하지 않으면 밥 먹지 말아라. 성경읽지 않으면 공부하지 말아라."" 는 엄한 어머니 밑에서 신앙을 체득한 저자의 경험이 고스란히 녹아 있는 책이다.",,4601,BOOK
꽃보다 남자 33,카미오 요코 (지은이),3743,국내도서>만화>순정만화>틴에이지 순정,9788953239746,,,505,BOOK
주기도문 - 주제별성경연구  6,케이 아더 (지은이),51597,국내도서>종교/역학>기독교(개신교)>기독교(개신교) 신앙생활>예배/기도/묵상(QT),9788986504354,,,47,BOOK
부자 아빠 가난한 아빠 1 - 부자들이 들려주는 '돈'과 '투자'의 비밀,"로버트 기요사키, 샤론 레흐트 (지은이), 형선호 (옮긴이)",2225,국내도서>경제경영>재테크/투자>재테크/투자 일반,9788982732362,"이 책은 투자와 투기를 명확히 구분지으면서, 학교에서는 가르치지 않는 <돈>과 <투자>와 <경제>의 기본 원리를 아이들이 어른들에게 들려주고자 쓴 책이다. 즉 <돈 버는 방법>이 아니라 돈과 자신에 대한 명확한 이해를 바탕으로 <돈을 관리하는 방법>을 알려주고 있다.",,22994,BOOK
뇌 - 전2권 세트,,50921,국내도서>소설/시/희곡>프랑스소설,9788932904481,"언제나 흥미진진한 작품세계로 독자를 매혹시켜 온 베르나르 베르베르의 일곱 번째 장편소설이 출간됐다. 이번에 그가 소설로 담아낸 탐구영역은, 인간 머릿속의 작은 우주-'뇌'의 세계이다. 상뻬의 아름다운 그림이 담긴 마이북이 들어있다.",,3657,BOOK
한비야의 중국견문록,한비야 (지은이),50857,국내도서>여행>중국여행>중국여행 에세이,9788971844779,"'바람의 딸' 한비야는 그동안 어디에 있었을까? <한비야의 중국견문록>을 보니 궁금증이 풀린다. 2000년 3월부터 꼬박 1년간, 베이징에서 중국어를 배웠다는 것이다. 그 이야기를 담은 <중국견문록>은 표지부터 활달한 글폼새까지 모두 유쾌하다.","'바람의 딸' 한비야는 그동안 어디에 있었을까? 을 보니 궁금증이 풀린다. 2000년 3월부터 꼬박 1년간, 베이징에서 중국어를 배웠다는 것이다. 그 이야기를 담은 은 표지부터 활달한 글품새까지 모두 유쾌하다.



한비야가 베이징에 체류하게 된 것은 '앞으로 시작하게 될 긴급 구호 활동에 중국어가 많이 필요할 것 같아서'. 아프가니스탄에서 구호활동가가 되겠다고 결심한 그녀가 내처 실행으로 옮긴 것이다. 덕분에 학원과 학교를 오가며 공부하느라 '바람의 딸'이 아니라 '의자의 딸'이었다고 너스레가 대단하다.



책 속에서는 중국의 봄, 여름, 가을, 겨울이 순서대로 펼쳐진다. 꼬박꼬박 일기를 적은 덕분에 이야기가 생생하다. 중국어를 배우며 겪은 일들이며 베이징 사람들에게서 느낀 점, 한비야 특유의 친화력으로 사귄 친구들 이야기 속에서 있는 그대로의 중국을 볼 수 있다.



중국이 우리 못지않은 입시지옥이라는 것, 난데없는 '인민재판'을 겪은 것을 통해 깨달은 중국인들의 품성 등의 이야기가 그야말로 '중국견문록'이다. 앞으로 한비야가 활동하게 될 캄보디아와 케냐로의 짧은 답사여행과 하얼빈, 항저우 여행도 덤으로 들어있다.",15693,BOOK
까마귀 소년,"야시마 타로 (지은이), 야시마 타로 (그림), 윤구병 (옮긴이)",35139,국내도서>유아>그림책>나라별 그림책>일본,9788949110264,공부할 때도 놀 때도 뒤쳐지고 외톨박이였던 한 남자 아이가 새로 부임한 선생니의 관심과 애정으로 마을 사람 모두에게 인정받는 ‘까마귀 소년’이 되기까지의 이야기이다. 자연 속에서 자연의 소리를 들으며 자란 아이의 심성과 행동이 잘 드러나 있다. 과거의 이야기를 누군가에게 들려주는 듯한 느낌이 든다.,"1956년 칼데콧 명예도서상 수상. , , 로 칼데콧 상을 세 번이나 받은 야시마 타로의 작품이다. 



짙은 일본풍의 수채그림과 마치 정말로 그런 일이 있었다는 듯이 '들려주는 목소리'로 이야기되어지는 그림책이다. 비록 그림책이지만, 초등학교 6학년이 읽어도, 아니 어느 어른이 읽어도 감동받고 책을 품에서 떼고 싶지 않은 책이다. 



정말 어리고 작아서 모두 땅꼬마라고 부르는 소년이 있었다. 선생님도 아이들도 다 무서워한 땅꼬마 소년은 늘 숨어 있기 바빴다. 그래서 어느새 모두들 땅꼬마를 따돌림시키고 있었다. 하지만 소년 역시 늘 다른 곳에 시선을 두었다. 누구나 대충 지나치기 쉬운 것들에 눈을 맞추고 귀를 귀울이고 소년은 그렇게 초등학교 6년을 지냈다. 



그러다 새로 온 이소베 선생님에 의해 땅꼬마 소년이 가진 빛남들이 비로소 제 빛을 찾아가기 시작한다. 머루가 산의 어디에 자라는지, 꽃이름들은 무엇인지 땅꼬마만은 알고 있었다. 



그리고 학예회 무대에서 땅꼬마 소년이 까마귀 소리를 낸다. '까우우워워아악! 까우우워워아악!'. 소년이 토해내는 그 소리 속에 소년의 가슴 속 아픔과 슬픔들이 구경하던 사람들에게 고스란히 전달된다. 눈물을 흘리며 사람들은 비로소 땅꼬마 소년을 다시 보기 시작한다. 



그 뒤로 땅꼬마 소년은 '까마귀 소년'이라 불렸다 한다.",17106,BOOK
로마인 이야기 10 - 모든 길은 로마로 통한다,"시오노 나나미 (지은이), 김석희 (옮긴이)",52596,국내도서>역사>서양사>로마사,9788935653249,2002년 새롭게 내놓은 제10권 '모든 길은 로마로 통한다'는 바로 로마 1천년의 역사가 어떻게 장구하게 흘러갈 수 있었는지를 사회 인프라스트럭처 문제에 초점을 맞춰 기술하고 있다.,"장쾌한 로마의 흥망성쇠를 들려주는 책. 〈모든 길은 로마로 통한다〉편. 기원전 3세기에 지구의 동쪽과 서쪽에서 대규모 토목사업이 시작되었다. 동쪽에서는 만리장성, 서쪽에서는 로마 가도. 중국과 로마는 왜 국가 규모의 대토목사업을 시작하면서 한쪽은 방벽을 건설했고 또 한쪽은 가도를 건설했을까. 방벽은 사람의 왕래를 차단하지만, 가도는 사람의 왕래를 촉진시킨다. 국가 방위라는 가장 중요한 목적을 실현하기 위해 이민족과의 왕래를 차단할 것인가, 아니면 왕래를 촉할 것인가. 두 민족의 이같은 사고방식의 차이는 결국 중국과 로마라는 두 강국의 운명까지 결정했다. 중국의 만리장성과 로마의 도로망, 이 둘의 차이는 분명 지구의 동과 서의 차이보다 훨씬 컸다...",6814,BOOK
신명용의 플래시 MX 액션스크립트 I - 모든걸 알켜주마,신명용 (지은이),2666,국내도서>컴퓨터/모바일>웹디자인/홈페이지>플래시,9788985966634,"플래시MX 액션스크립트에 대한 기본기를 다지는 내용뿐만 아니라 수학과 물리의 원리 응용, 3D활용을 통한 보다 체계적이고 활용도 높은 애니메이션과 액션스크립트 구현에 대해 학습한다. 독자들의 이해와 활용도를 높이기 위해 300여개 이상의 예제샘플, 도전문제와 활용예제, 저자의 동영상 강의가 담겨있다.",,3836,BOOK
