title,author,genre_id,genre,ISBN,description_aladin,description_naver,salesPoint,mallType
엑셀 2000 무작정 따라하기,김종학 (지은이),2602,국내도서>컴퓨터/모바일>오피스(엑셀/파워포인트)>엑셀,9788975600470,(주)SK 해운에서 신입사원을 대상으로 엑셀 등 컴퓨터 교육을 담당하고 있는 필자 김종학은 수년간 신입사원들에게 엑셀 사용법을 강의한 경험을 토대로 <엑셀 2000 무작정 따라하기>를 실무에 곧바로 써먹을 수 있도록 구성했다.,,2402,BOOK
정상에서 만납시다 - 2001년 최신개정판,"지그 지글러 (지은이), 성공가이드센터 (옮긴이)",70216,국내도서>자기계발>성공>성공학,9788980970322,"성공학의 바이블로 불리는 지그 지글러의 <정상에서 만납시다>의 2001년 수정판. 저자는 주방 기구를 판매하는 세일즈맨으로 시작하여 업계의 최고 실적을 올리면서 남다른 세일즈 방법을 다른 이들에게 공유, 훈련시키는 훈련가로 명성을 날렸던 인물. 이 책은 1975년 출판된 이래 지금까지 수천만부 이상이 팔렸으며 지속적인 개정판으로 유명하다.",,1546,BOOK
천재 유교수의 생활 13,야마시타 카즈미 (지은이),2552,국내도서>만화>코믹/명랑만화,9788952938213,,,338,BOOK
금융채권관리사 - 자격시험대비 객관식 2차,"선민중, 이세민, 이태원 (엮은이)",52258,국내도서>수험서/자격증>경제/금융/회계>경제/경영 기타자격증>기타,9788990005083,,,117,BOOK
라이팅 선수되기 토플라이팅 만점맞기,민상홍 (지은이),49870,국내도서>외국어>토플>Writing,9788982208997,"50일동안 토플 에세이를 체계적으로 연습해 나갈 수 있게 구성했다. 1일-16일까지는 서론, 본론, 결론의 영어 에세이 구조를 익히고, 17일-10일까지는 에세이 토픽들을 7개 유형으로 나누어 설명하고 연습시킨다. 마지막 31-10일까지는 앞서 배운 것을 토대로 20개의 토픽을 가지고 실제 글을 쓰는 연습을 하도록 구성했다.",,995,BOOK
천재 유교수의 생활 14,야마시타 카즈미 (지은이),2552,국내도서>만화>코믹/명랑만화,9788984436404,,,371,BOOK
무소유 - 양장본,법정(法頂) (지은이),51637,국내도서>종교/역학>불교>불교 문학,9788908041318,"76년 첫 출간된 이 책은 그동안 80만부를 돌파한 스테디셀러. 문고판 수필집으로는 드물게 대학의 교재로 사용되기도 했고 선물용으로 가장 인기를 끈 책이기도 했다. 책을 읽고 스님에게 감사의 글을 띄운 뒤 출가(出家)한 사람도 있었다. 이 책에 담겨있는 35편의 맑은 글들은 길지 않지만, 숲에서 만나는 시원한 바람 같고 차가운 샘물 같다.",,14555,BOOK
아이의 뇌를 읽으면 아이의 미래가 열린다,"멜 레빈 (지은이), 이창신 (옮긴이)",51794,국내도서>좋은부모>교육/학습>학교/학습법,9788990247032,아이들에게 뭔가를 효율적으로 가르치려면 무엇보다 먼저 아이들이 어떻게 배우는지 알아야 한다. 또한 아이마다 다른 학습방식을 이해해야 한다. 이 책은 부모나 교사들이 이해하기 쉬운 글로 아이들의 학습방식을 설명한다.,,1351,BOOK
지금 알고 있는 걸 그때도 알았더라면 - 잠언 시집,류시화 (엮은이),51168,국내도서>소설/시/희곡>시>외국시,9788970638331,"시인이자 명상가인 류시화씨가 엮은 잠언시집．인디언에서 수녀, 유대의 랍비, 회교의 신비주의 시인, 걸인, 에이즈 감염자, 가수 등 지역과 시대를 뛰어넘은 다양한 무명씨들의 고백록이나 기도문들을 모아 엮었다.","지역과 시대를 뛰어넘은 고백록과 기도문을 엮은 잠언시집!

시인 류시화가 엮은 잠언시집 『지금 알고 있는 걸 그때도 알았더라면』．인디언에서 수녀, 유대의 랍비, 회교의 신비주의 시인, 걸인, 에이즈 감염자, 가수 등 지역과 시대를 뛰어넘은 다양한 무명씨들의 고백록이나 기도문들을 모아 엮은 책이다. ‘행복해진다는 것’, ‘어느 17세기 수녀의 기도’, ‘만일’, ‘두 사람’, ‘잠시 후면’, ‘젊은 수도자에게’, ‘그런 길은 없다’ 등 지금과는 다른 새로운 삶을 원하는 사람, 새로운 존재를 영위하고 싶은 모든 사람들에게 자신의 삶의 방식에 대한 냉정한 관찰법과 웃음과 감동을 전해준다.",31409,BOOK
신기한 스쿨버스 키즈 25 - 꿀 호수에 빠지다,"조애너 콜 (지은이), 브루스 디건 (그림), 이강환 (옮긴이)",48867,국내도서>어린이>과학/수학/컴퓨터>과학 일반,9788949151069,,,773,BOOK
전쟁에 반대한다 - 우리시대에 고하는 하워드 진의 반전 메시지,"하워드 진 (지은이), 유강은 (옮긴이)",13652,국내도서>대학교재/전문서적>사회과학계열>정치외교학,9788988105603,"2차 세계대전부터 리비아, 베트남, 코소보, 유고슬라비아, 그리고 이라크 전쟁까지 지금껏 미국이 발발 또는 개입한 전쟁을 고발하고 새 세기의 평화를 위해 우리가 무엇을 할 수 있으며, 해야 하는지 진지하게 이야기했다.","하워드 진의 이 책은 ‘전쟁’, 특히 미국의 전쟁에 포커스를 맞추고 있다. 2차 세계대전부터 리비아, 베트남, 코소보와 유고슬라비아, 그리고 이라크 전쟁까지, 지금까지 미국이 개입하고 일으킨 전쟁들을 성찰하면서 새 세기의 평화를 위해 우리가 무엇을 할 수 있는지, 해야 하는지 진지하게 이야기하고 있다.",424,BOOK
어린 왕자 - 좋은생각 좋은소설선,"앙투안 드 생텍쥐페리 (지은이), 고수현 (옮긴이)",50921,국내도서>소설/시/희곡>프랑스소설,9788986429336,"별에 혼자 피어있는 장미꽃, 여섯 개의 별에서 만난 어른들, 어린 왕자가 길들인 여우와의 만남, 사막에서 우물을 찾는 법 등 주옥같은 에피소드를 통해 인생이라는 사막에서 한 번씩 부딪치는 '내가 지금 잘 살고 있는 건가'하는 막연한 의문에 작은 해답을 제시하는 소중한 책이다.","중요한 것은 눈에 보이지 않아...

신선한 감각으로 새롭게 만나는 생텍쥐페리의 작품『어린 왕자』. 세대를 거쳐 검증된 근현대 문학 작품을 엄선한「좋은생각 좋은 소설선」의 하나로, 새로운 디자인과 편집으로 태어났다. 1943년 출간 이래 103개 언어로 번역된 이 스테디셀러는 순수한 아이들부터 어린 시절의 동심을 마음 한구석에 담아둔 어른들까지 다양한 독자층을 보유하고 있다.
혼자 사는 별에서 자기의 권위만을 내세우는 왕, 허영에 가득 찬 사람, 무엇이든 소유하려고만 하는 사업가, 쉼 없이 고된 일상만 반복하는 가로등 켜는 사람…. 생텍쥐페리는 어린 왕자가 만나는 다양한 인간들을 통해 가장 중요한 것이 무엇인지를 다시 생각하게 한다. 진정한 행복과 사랑의 의미를 찾아 떠났던 어린 왕자의 목소리를 만날 수 있다. [양장본]",402,BOOK
이건희 - 그의 시선은 10년후를 향하고 있다,홍하상 (지은이),87644,국내도서>경제경영>[포브스 100대 기업]>삼성,9788947524193,"영국의 파이낸셜 타임스는 2003년 1월 19일 발표한 '2003년 세계에서 가장 존경받는 기업 50'에서 삼성전자를 42위로, '세계에서 가장 존경받는 기업 지도자 50'에서 이건희 삼성전자 회장을 32위로 뽑았다. 이는 국내 기업과 기업인을 통틀어 최초의 일이다. 이 책은 삼성 경쟁력의 핵심, 신념과 열정의 승부사 이건희의 초일류 마인드를 살펴본다.",,946,BOOK
정선 중한.한중사전 - 포켓판,"이영구, 지재운, 강신도 (지은이)",49914,국내도서>외국어>중국어>중국어 사전,9788980103164,"8X16X4Cm 사이즈로, 중한과 한중 합본임에도 휴대가 편리한 크기와 무게이다. 중한사전 부분에는 <현대한어사전>을 편찬한 곳으로 유명한 상무인서관에서 추린 표제어 약 2만 여개와 예문이 들어있다.",,2644,BOOK
목적이 이끄는 삶 (반양장),"릭 워렌 (지은이), 고성삼 (옮긴이)",51596,국내도서>종교/역학>기독교(개신교)>기독교(개신교) 신앙생활>간증/영적성장,9788938810618,"하나님은 우주를 만드시기 전부터 우리를 마음에 품으시고, 당신의 목적을 위해 우리를 계획하셨다. 지금 이 순간 이 자리에 우리가 살아 있는 이유가 무엇이며, 우리를 향한 하나님의 뜻이 무엇인지를 깨닫도록 도와준다. 삶의 가장 중요한 질문인 “나는 왜 이 땅 위에 존재하는가?”에 대한 답을 보인다.",,24425,BOOK
바람의 딸 걸어서 지구 세바퀴 반 4 - 몽골 중국 티베트,한비야 (지은이),50871,국내도서>여행>세계일주여행>세계일주여행 에세이,9788986903171,"오지 여행가로 유명한 저자가 몽골, 중국, 티벳 등지를 여행하며 남긴 기행문이다. 세계일주여행을 통해 여행 １년은 평범한 인생 10년과 맞먹는다는 생각을 갖게 됐다는 그는 ""자기기준으로 현지문화를 판단해서는 안된다는 것을 요즘 배낭여행에 나서는 젊은이들에게 꼭 해주고 싶다""고 말한다．",,4344,BOOK
교과서보다 쉬운 독학국사 2 - 6차,박천욱 (지은이),52593,국내도서>역사>한국사 일반,9788985893435,"현직 교사인 지은이는 마치 독자들을 앞에 두고 있는 듯 강의하는 형식으로 서술하고 있으며, 또한 이해를 돕기 위해 쉬운 설명과 그림, 도표, 사진 등을 적절히 동원하고 있다. 또한 중요한 포인트와 단어 등은 굵은 글씨와 푸른 밑줄로 표시해 눈에 띄도록 하였다.",,1137,BOOK
TV동화 행복한 세상,KBS한국방송 (지은이),51371,국내도서>에세이>한국에세이,9788946413535,"투박하고 정감 넘치는 그림이 따뜻하다. 동심, 사랑, 나눔, 희망의 메시지를 담은 프로그램의 취지를 살려 책도 이 시대를 살아가는 우리 이웃과 가족, 나아가 사회의 아름다운 모습과 행복을 전한다.",,3923,BOOK
반동적 근대주의자 박정희,전재호 (지은이),3288,국내도서>사회과학>책세상문고.우리시대,9788970131481,"이 책은 1990년대 중반 이후 한국 사회에 유행하고 있는 박정희 신드롬에 대한 비판적 인식에서 출발한다. 박정희 정권은 한편으로는 한국의 경제발전을 성공시킴으로써 민족적 자긍심을 높인 개발정권으로 평가받는 반면, 다른 한편으로는 민주주의를 파괴하고 1인 지배체제를 공고화한 독재정권으로 평가받는다.","박정희 정권이 추진한 근대화가 어떤 측면에서 반동적 성격을 갖고 있는지 추적한 연구서. 박정희를 평가하는 민족주의와 여러 관점들을 구분하고, 민족주의 시각을 통해 그들의 사고가 지닌 한계를 지적했다. 아울러 박정권의 정치, 경제, 역사에 대한 정책을 다뤘다.",639,BOOK
"Basic Grammar in Use with Answers, Korean Edition : Self-study Reference and Practice for Students of English (Paperback, 2 Rev ed)",Raymond Murphy (지은이),107497,외국도서>ELT/어학/사전>제2외국어>영어,9780521528771,"대부분의 학습자가 처음 구입할 때 추천할 만한 것은 책만으로 이루어진 <a href=""/shop/wproduct.aspx?isbn=0521528771"">&lt;Basic Grammar in Use (2판)- with Answers&gt;</a>이다. 책에 수록된 연습문제에 대한 해답이 함께 실려있어 한 권만으로도 독학이 가능하다.",,14502,FOREIGN
청소년 토지 4 - 2부 1권,"박경리 (지은이), 토지문학연구회 (엮은이)",50759,국내도서>청소년>청소년 문학>청소년 소설,9788957070055,,,721,BOOK
"오퍼상이나 해볼까? - 세상에서 제일 근사한 직업, 최신개정판",이기찬 (지은이),180,국내도서>경제경영>창업/취업/은퇴>창업정보,9788988486382,"초판 이후 지금까지 무역부문 베스트셀러로 확고한 위치를 차지하고 있는 <오퍼상이나 해볼까?>의 최신개정판이다. 그동안 저자가 홈페이지나 이메일을 통해 독자들과 주고받은 상담 내용을 반영, 독자들이 가장 궁금해하거나 잘 이해하지 못하는 부분을 좀더 명확하게 설명하는 데 주안점을 두고 수정, 보완했다.",,744,BOOK
나는 싸기대장의 형님,"조성자 (글), 김병하 (그림)",48874,국내도서>어린이>동화/명작/고전>국내창작동화,9788952709479,'엄마와 아빠가 변했다.'로 시작하는 이야기의 주인공은 초등학교 1학년인 기훈이. 기훈이에게는 얼마전 태어난 동생 기영이가 있다. '싸기 대장'은 걸핏하면 똥과 오줌을 잘 싼다고 해서 기훈이가 붙여준 별명.,"동생이 생기자, 늘 귀염을 독차지했던 기훈에 대한 부모님과 할머니의 관심이 시들해졌어요. 싸기 대장, 기영이에게만 예쁘다고, 늘 웃으면서 토닥거려주고, 안아주고 그러는거예요. 하루는 청거북을 만진 손으로 우유를 먹였다가, 기영이가 체하는 바람에 엄마에게 호되게 혼도 났어요. 그래서 할머니 집에 청거북을 데려다 주려고 집을 나섰다가 그만 집을 잃고 마는데. 동생을 둔 사내아이 기훈이의 섭섭한 기분을 솔직담백하게 잘 표현한 초등학교 저학년을 위한 그림동화.",8232,BOOK
"단군신화 - 솔거나라 전통문화 그림책 12, 개정판","이형구 (지은이), 홍성찬 (그림)",48861,국내도서>어린이>초등 전학년>그림책,9788943300807,"신화는 원래 상상의 이야기로 상징적인 가치를 지니면서 동시에 역사를 담아내는 독특한 장르다. 이 책은 그 독특함을 그림으로 잘 풀어내고 있다. 상상 속의 이야기를 세밀화로 장면 장면을 사실적으로 그려, 책을 읽는 아이가 마치 실제 세계인 것처럼 느끼게 했다. 어린이를 위한 동화이기에 더욱 더 역사적인 자료에 충실하려고 했다.",,4722,BOOK
엄마의 런닝구,한국글쓰기연구회 (엮은이),48865,국내도서>어린이>초등 전학년>어린이가 쓴 책,9788985494212,한국글쓰기연구회 회원들이 지도한 아이들의 시를 모았다. 한국글쓰기회 회원들은 아이들이 살아가면서 가슴으로 느끼고 온 몸으로 겪은 것을 시로 쓰게 한다. 시 옆에는 이호철 회원이 지도한 아이들 그림을 넣었다. 10년 동안에 쓴 한국 어린이들의 시를 대표한다.,머리로 짜내고 꾸며 맞춘 죽은 시. 어른들을 흉내내 거짓스럽게 말재주를 부리는 가짜 동시가 아니라 어린이들이 살아가면서 가슴으로 느낀 것. 온몸으로 겪은 것을 쓴 참된 시들만 모아 놓았다. 또래 친구들이 쓴 참된 시들을 보면서 참된 어린이 마음으로 돌아갈 것이다.,5273,BOOK
손 큰 할머니의 만두 만들기,"채인선 (지은이), 이억배 (그림)",14024,국내도서>유아>그림책>문화/예술/인물/역사 그림책,9788986565065,"어린 시절부터 설날이면 어김없이 밥상을 지키던 만두. 지금까지도 우리가 아끼는 민속음식으로 남아있는 만두를 소재로 한 담백하고 토속적인 동화. 무엇을 하든지 엄청 많이 해대는 '손 큰 할머니'는 옛날부터 여유롭게 음식을 만들어 이웃과 더불어 나누어 드시던 우리의 할머니, 어머니를 생각나게 한다.",무엇이든지 엄청 크게 하는 손 큰 할머니가 숲속 동물들과 함께 매년 새해에 먹을 엄청 많은 양의 만두를  만든다. 이번 해도 할머니는 며칠 밤을 새우며 동물들과 만두를 빚는데 좀체로 줄어들지 않자 동물들이 불 평을 하기 시작한다. 재미있는 내용의 유아그림책.,28660,BOOK
천재 유교수의 생활 12,야마시타 카즈미 (지은이),2552,국내도서>만화>코믹/명랑만화,9788952938206,,,338,BOOK
오세암,"정채봉 (지은이), 이현미 (그림)",48874,국내도서>어린이>동화/명작/고전>국내창작동화,9788936440190,"교과서에 수록된 단편 '오세암'을 비롯, 깊은 산 속 맑은 물 같은 아름다운 동화 22편이 수록되었다. 표제작'오세암'은 설악산 오세암을 배경으로 스님과 길손 감 남매의 얘기를 담았다.","교과서에 수록된 단편 「오세암」을 비롯, 깊은 산 속 맑은 물 같은 아름다운 동화 22편이 수록되었다. 표제작「오세암」은 설악산 오세암을 배경으로 스님과 길손 감 남매의 얘기를 담았다. 길손이의 순진무구한 마음이 불교를 배경으로 깊이 있게 그려졌다.",9760,BOOK
밤티마을 큰돌이네 집,이금이 (지은이),48874,국내도서>어린이>동화/명작/고전>국내창작동화,9788939514072,"가족의 소중함, 형제의 사랑을 생각하게 하는 책이다. 우리 주위의 보이지 않는 곳에는 불행한 사람들이 많다는 것을 보여준다.",,606,BOOK
스피노자와 표현의 문제,"질 들뢰즈 (지은이), 이진경 (옮긴이)",51467,국내도서>인문학>서양철학>근대철학>스피노자,9788974185411,"스피노자는 들뢰즈가 가장 큰 존경과 경의를 표한 철학자로, <스피노자와 표현의 문제>에서 들뢰즈는 이제까지 거의 주목받지 못했으며 스피노자 자신도 그 중요성을 의식하지 못한 표현 개념에 주목한다.",,628,BOOK
내 동생 아영이,"김중미 (지은이), 권사우 (그림)",48874,국내도서>어린이>동화/명작/고전>국내창작동화,9788936451080,영욱이에게는 다운 증후군에 걸린 동생 아영이가 있다. 얼굴 생김새부터도 보통 아이 같지는 않지만 말소리도 어눌하고 글자를 읽을 줄도 모른다. 소외된 사람들의 일상을 꾸준히 그리고 있는 작가의 네 번째 책!,『괭이부리말』『종이밥』를 지은 저자가 또 한 권의 아름다운 이야기를 펼쳐냈습니다. 장애를 가진 아영이는 오빠가 다니는 학교에 함께 가고 싶어합니다. 오빠는 동생 아영이가 창피하기도 하지만 평범하지 않은 동생이 안타깝기도 합니다. 아영이 말고도 영욱이네 반 희수 역시 남들과 어울리지 못하는 소외받는 친구랍니다. 우리 친구들 주위에도 모두가 함께 할 때 혼자 있는 친구가 있지는 않나요? 우리 친구들이 먼저 마음의 문을 열어 보세요.,3064,BOOK
마지막 거인,"프랑수아 플라스 (지은이), 윤정임 (옮긴이)",48846,국내도서>어린이>초등5~6학년>동화/명작/고전,9788970418421,"프랑스뿐만 아니라 독일, 벨기에 그리고 미국에까지 번역되어 읽혔고 수없이 많은 상을 받았다. 자유자재로 부려쓴 강단 있는 펜 터치와 담수로 그려낸 듯 맑은 수채화가 아름답다. 그림의 색과 빛이 자연스러우면서도 곳곳에 작가의 위트가 숨어 있어 보는 재미를 더한다.","특이한 질감의 표지와 속지에 붓글씨로 쓴 듯한 글자, 붓자국이 선명한 그림이 눈에 띄는 책이다.

1992년 프랑스 몽트뢰이 어린이 도서 전시회의 토템 앨범과 프랑스 문인 협회의 어린이 도서 부문 대상, 프랑스 주간 서적의 세르클 도르 상 수상, 1993년에는 프랑스 어린이 전문 서점과 도서관 협회가 공동으로 선정하는 마법사 상과 벨기에 비평가들이...",12299,BOOK
7인 7색 여행이야기 - 한국여행작가협회,"송일봉, 유연태, 허시명, 이신화, 정보상, 홍순율, 양영훈 (지은이)",50846,국내도서>여행>국내 여행가이드>전국여행 가이드북,9788988323397,"유연태, 양영훈, 정보상, 허시명 등 한국여행작가협회 소속 작가들이 공동집필한 여행서. 작가들은 가장 자신 있는 컨셉으로 권할만한 여행지를 7곳씩 뽑았고, 서로 중복되지 않도록 조율해 가며 49곳의 여행 명소를 알차게 담아냈다.",,182,BOOK
"세계의 교양을 읽는다 1 - 개정판, 종합편, 바칼로레아 논술고사의 예리한 질문과 놀라운 답변들","최병권, 이정옥 (엮은이)",51440,국내도서>인문학>철학 일반>교양 철학,9788958620839,"1권 '종합편'은 지난 10여년 동안 출제되었던 바칼로레아의 철학 시험 문제와 답안 중에서 총 64개를 선별하여 인간, 인문, 예술, 과학, 정치, 윤리 등의 6개 장으로 구분하여 엮었다.","우리의 수능에 해당하는 프랑스의 대학입학시험인 '바칼로레아'. 그 중에서도 철학시험은 가장 비중이 높을 뿐더러 문제 자체만으로도 사회적 이슈가 되곤 한다. 시험을 치르는 것은 학생이지만, 그 해의 출제 주제에 대한 이야기는 철학 토론으로 이어지기도 한다.



1권 '종합편'은 지난 10여년 동안 출제되었던 바칼로레아의 철학 시험 문제와 답안 중에서 총 64개를 선별하여 인간, 인문, 예술, 과학, 정치, 윤리 등의 6개 장으로 구분하여 엮었다. '행복은 단지 순간적인 것인가?' '철학이 세상을 바꾸는가?' '예술작품은 반드시 아름다운가?' 등의 근원적인 주제에 달린 놀라운 답변들을 읽고 있노라면, 문제의식을 느끼고 이에 대해 자유롭게 토론하는 문화가 얼마나 중요한 것인가를 새삼 깨닫게 된다.



2, 3, 4권은 2003년 2월에 출간한 를 '1권 종합편'으로 간주하고 그 후속인 심화편에 해당한다.  바칼로레아의 질문들에 대한 이 책의 답변은 다른 여러 프랑스 철학 선생님들의 답안지들을 비교, 종합하여 부분적으로 엮은이가 편역한 것이며, 구성과 편집에 있어서 엮은이의 주관을 개입하였다. 직역의 어색함과 난해함을 피하기 위함이었다. 



아울러 질문과 답변마다 '더 생각해 봅시다'는 코너를 마련하여 추상적으로 여겨지는 주제들에 대해 한국의 현실, 혹은 구체적 상황과의 관계에서 고찰해 볼 수 있도록 하였다. 



2권 '인문학편'에서는 인간과 역사, 예술에 대해 고찰한다. '인간이란 무엇인가? 육체인가 정신인가?' '우리는 왜 아름다움에 끌리는가?' '역사는 반복되는가, 아니면 진보하는가?' 등의 질문들에 답하면서 나에 대한 이해 없이는 세상에 대한 이해도 불가능하며, 역사를 알지 못하고는 현실을 이해할 수 없다는 사실을 살펴본다. 



3권 '사회.자연과학편'에서는 과학과 사회제도가 현대인에게 무엇을 의미하는지 살펴본다. '기술발전을 두려워해야 하는가?' '생명보다 더 소중한 것이 있는가?' '공동체는 개인의 자유를 억압하는가?' 등의 질문에 답하면서 21세기에 생명윤리, 환경보호, 사회불평등 등의 문제에 어떻게 대처할 것인지를 생각해본다. 



4권 '윤리학'편에서는 행복과 자유와 타자를 다룬다. '타인과 더불어 산다는 것은 무엇을 의미하며 행복과 덕은 공존할 수 있을까?' '현실적 삶 속에서 과연 행복에 이를 수 있는 것일까?' '이기적이지 않은 욕망이 존재하는가?' 등의 질문을 통해 어떻게 하면 타자와 함께 행복하고 자유로워질 수 있는지에 대해 고찰한다. 



'세계의 교양을 읽는다' 시리즈는 논술 고사를 준비하는 수험생에게도 유용하겠지만, 광범위한 교양과 토론에 관심을 갖고 있는 일반인들이라면 한 번쯤 읽어봄직 하다.",7847,BOOK
기탄 수학 F단계 2집 - 초등 2학년,기탄교육연구소 (엮은이),0,,9788989425762,,,17183,BOOK
꽃들에게 희망을 (반양장),트리나 폴러스 (지은이),48877,국내도서>어린이>동화/명작/고전>외국창작동화,9788972598435,"나비가 되기까지 자신을 찾아 헤매는 애벌레의 모습으로, 자아를 찾기 위한 노력이 얼마나 어려운지, 또 진정한 자아가 무엇인지 깨닫게 하는 이야기다.","사랑과 희망, 당신에게 감동을 선사할 또 한 편의 이야기

『꽃들에게 희망을』은 청소년뿐만이 아니라 어른들을 위한 감동적인 내용을 담고 있는 세계적인 고전이다.  두마리 애벌레가 겪는 사랑과 희망의 모험을 원색의 삽화와 함께 들려주는 책. 호랑애벌레와 노랑애벌레, 이들은 단순히 먹고 자라는 것 이상을 원한다. 마치 우리의 모습처럼 자신의 자아를 위해 고통을 이겨내고, 살벌한 현실에서 벗어나려고 노력한다. 우리 아이들에게 사랑과 희망이라는 소중한 가치를 자연스럽게 배울 수 있도록 알려줄 것이다.",19964,BOOK
하느님의 눈물,권정생 (지은이),48874,국내도서>어린이>동화/명작/고전>국내창작동화,9788976500083,"토끼, 다람쥐, 아기 소나무, 까마귀, 늑대 같은 여러 동식물들의 입을 빌어 참되게 살아가는 모습을 보여주는 동화집이다. 아이들에게 바르게 살고 생명을 사랑하며, 더불어 살아간다는 것이 무엇인지를 아름답고 재미있는 이야기로 보여주는 동화집이다. 자연과 생명을 사랑하는 마음들과 만날 수 있다.",,5827,BOOK
