title,author,genre_id,genre,ISBN,description_aladin,description_naver,salesPoint,mallType"나는 왜 네 말이 힘들까 - 상대의 말이 듣기 힘들 때 후회되는 말을 했을 때, 꼬인 관계를 풀어주는 연결의 대화 수업",박재연 (지은이),51514,국내도서>인문학>심리학/정신분석학>교양 심리학,9791190846011,"상대와 말을 하면 할수록 나만 상처 받은 적이 있는가? 혹은 마음에도 없는 말이 불쑥 튀어나와 상대와의 관계가 묘하게 어긋난 적이 있는가? 이 책은 오해 없이 상대의 말을 듣고, 내 마음을 진솔하게 표현하는 방법을 다양한 방식으로 연습해볼 수 있도록 도와주는 대화 안내서다. 
",,9890,BOOK
"초격차 : 리더의 질문 - 위기와 기회의 시대, 기업의 길을 묻다",권오현 (지은이),2173,국내도서>경제경영>기업 경영>경영전략/혁신,9791165342159,"‘초격차 기업’을 향해 도전하는 기업 경영자와 조직의 리더들이 가장 궁금해하는 문제들에 대한 삼성전자 권오현 회장의 해법! 20만 부 이상 판매된 2018년작 《초격차》 이후, 리더들의 실질적 고민과 현실적 질문에 답하기 위해 삼성전자 권오현 회장이 2년간의 침묵을 깨고 다시 돌아왔다.",,5742,BOOK
김락희의 인체 드로잉,"김락희 (지은이), 윤관현 (감수)",50987,국내도서>예술/대중문화>미술>미술 실기,9788931588507,국내에서 유튜브 드로잉 채널을 운영하면서 드로잉 강의를 하고 있으며 미 마블 사의 애니메이션 캐릭터 작업도 하고 있는 김락희 작가가 드로잉 입문자를 위한 인체 해부학 입문서를 출간하였다.,,35738,BOOK
창의적 공학설계 - 3판,김은경 (지은이),51702,국내도서>대학교재/전문서적>공학계열>공학일반,9791156644934,남들보다 먼저 문제를 발견하고 창안해서 새로운 제품을 개발해야 하는 공학자에게는 창의적 문제 해결 능력이 절실히 요구된다. 이 책은 다양한 창의적 발상 도구를 활용하여 문제를 해결하는 방법을 알려준다.,,2703,BOOK
데이터베이스 개론 - 2판,김연희 (지은이),6794,국내도서>컴퓨터/모바일>컴퓨터 공학>데이터베이스 개론,9791156644316,"마인드맵으로 생소한 개념 간의 관계를 한눈에 보여주고, 친근한 예와 비유를 들어 명료하게 풀어내, 데이터베이스 기본기를 탄탄히 다져준다. 2판에서는 4차 산업혁명 시대로 불리는 오늘날 큰 주목을 받고 있는 빅데이터에 대해 좀 더 풍부한 설명을 담았다.",,1823,BOOK
팩트풀니스 - 우리가 세상을 오해하는 10가지 이유와 세상이 생각보다 괜찮은 이유,"한스 로슬링, 올라 로슬링, 안나 로슬링 뢴룬드 (지은이), 이창신 (옮긴이)",51378,국내도서>인문학>교양 인문학,9788934985068,"전 세계적으로 확증편향이 기승을 부리는 탈진실의 시대에, 막연한 두려움과 편견을 이기는 팩트의 중요성을 일깨우는 세계적 역작이다. ‘느낌’을 ‘사실’로 인식하는 인간의 비합리적 본능 10가지를 밝히고, 우리의 착각과 달리 세상이 나날이 진보하고 있음을 명확한 데이터와 통계로 증명한 통찰을 담았다.",,39082,BOOK
2050 거주불능 지구 - 한계치를 넘어 종말로 치닫는 21세기 기후재난 시나리오,"데이비드 월러스 웰즈 (지은이), 김재경 (옮긴이)",51304,국내도서>사회과학>사회학>사회학 일반,9791155401651,‘지구의 날’ 50주년을 맞이해 출간되는 《2050 거주불능 지구》는 최신 연구 자료와 통계적 근거를 바탕으로 가장 믿을 만한 기후변화의 미래 시나리오를 제시한다.,,6889,BOOK
킨 (리커버 에디션),"옥타비아 버틀러 (지은이), 이수현 (옮긴이)",89481,국내도서>소설/시/희곡>과학소설(SF)>외국 과학소설,9788934992868,"흑인, 그리고 여성. SF 역사상 가장 유니크한 작가이자, 문학적 성취와 상업적 성공을 모두 거머쥔 작가로 손꼽히는 옥타비아 버틀러. &lt;킨&gt;은 그의 대표작이자 최고 성공작이다.",,8168,BOOK
중국어뱅크 집중 중국어 STEP 1 - 중국어 4단계 집중훈련,"안영희, 김태순 (지은이), 주샤오찌엔, 리따쑤이 (감수), 동양북스 교재개발연구소 (기획)",49915,국내도서>외국어>중국어>중국어 회화,9791157682652,본 교재 <중국어뱅크 집중 중국어 STEP 1>은 중국어의 '기초 내용을 학습하고 필수 어법 설명으로 충분한 이해를 도와 연습문제로 확실하게 연습할 수 있게 하여 워크북으로 복습을 하는 4단계 과정'으로 구성되었다.,,3889,BOOK
데미안,"헤르만 헤세 (지은이), 전영애 (옮긴이)",50922,국내도서>소설/시/희곡>독일소설,9788937460449,2차 세계대전 중 많은 독일 젊은이들이 전장에 나가면서 군복 주머니 속에 품고 갔던 책. 어른이 되기 위해 보이지 않는 껍질을 깨고 고통스런 현실의 세계로 나서는 젊은이들을 그렸다. 지금까지도 젊은이들에게 '통과의례'처럼 읽히고 있는 명작을 새로 옮겼다.,,97746,BOOK
"지금 여기, 무탈한가요? - 괜찮아 보이지만 괜찮지 않은 사회 이야기",오찬호 (지은이),51304,국내도서>사회과학>사회학>사회학 일반,9791189799304,억울하면 성공해라？ 노력하면 잘살 수 있다？ 불평등에 무감각한 세상에 사는 우리를 위한 사회학자 오찬호의 아주 특별한 강의를 담은 책이다.,,2228,BOOK
"진짜 중국어 - 유튜브 중국어 학습채널 1위, 교과서에 나오지 않는 생동감 1000% 리얼 중국어","성구현, 진준 (지은이)",49910,국내도서>외국어>중국어>중국어 첫걸음,9788962818581,"유튜브 중국어 학습채널 1위를 달리고 있는 『진짜 중국어』가 책으로 출간됐다. 60일 동안, 필수 문형(패턴) 60개를 중국 현지인들이 사용하는 리얼한 문장과 함께 마스터할 수 있다. 기초부터 중급 표현까지 담고 있으며, 쉬운 표현이라도 중국 현지에서 자주 사용하는 트렌디한 중국어로 말할 수 있도록 구성했다.",,1600,BOOK
열두 살에 부자가 된 키라 - 개정판,"보도 섀퍼 (지은이), 원유미 (그림), 김준광 (옮긴이)",49223,국내도서>어린이>동화/명작/고전>학습동화,9788950966980,"2001년 출간된 &lt;열두 살에 부자가 된 키라&gt;의 개정판으로, 주인공 키라가 말하는 개 머니의 도움을 받아 스스로의 힘으로 미래를 설계하고, 자신감을 키우며, 어른 못지 않은 ‘경제박사’가 되어 가는 과정을 자연스럽게 그렸다.",,14270,BOOK
노멀 피플,"샐리 루니 (지은이), 김희용 (옮긴이)",52652,국내도서>소설/시/희곡>세계의 소설>아일랜드소설,9788950986339,"청소년 시기에 만난 두 남녀가 사랑으로 서로의 삶을 구원하며 어른이 되어가는 이야기를 담고 있다. 이 소설은 출간 즉시 《뉴욕타임스》 베스트셀러에 오르고 전 세계 100만 부 이상 판매되었으며 브리티시북어워드를 비롯해 《타임》, 《파리리뷰》 등이 ‘올해의 책’에 선정하기도 했다.",,3324,BOOK
팅커벨 죽이기,"고바야시 야스미 (지은이), 김은모 (옮긴이)",51058,국내도서>소설/시/희곡>추리/미스터리소설>일본 추리/미스터리소설,9791165791438,"‘죽이기 시리즈’의 네 번째 이야기 《팅커벨 죽이기》는 세계적인 동화 《피터 팬》을 모티프로 삼았다. 특히 ‘피터는 자신이 죽인 사람은 잊는다’, ‘네버랜드 아이들은 살육을 즐긴다’, ‘피터의 부하는 피터가 모르는 사실을 알아서는 안 된다’는 원전 문장을 기반으로 이야기를 확장하였다.",,2454,BOOK
가족치료의 이해 - 3판,"정문자, 전영주, 정혜정, 이선혜 (지은이)",8328,국내도서>대학교재/전문서적>인문계열>심리학,9788999714924,"가족치료에서 꼭 알아야 할 내용을 체계적으로 풀어내고 있으며, 다양한 사례와 참고자료를 곳곳에 삽입하여 독자의 이해를 최대한 높일 수 있도록 구성하였다. 또한, 이번 개정판에서는 독자들이 혼란을 겪지 않도록 각 치료 모델에 맞는 사례만을 적용하였다.",,11821,BOOK
교육사회학 - 제5판,김신일 (지은이),8416,국내도서>대학교재/전문서적>사범계열>교육사회/심리학,9788925409238,"교육은 역사의 산물인 동시에 역사를 만드는 힘이다. 현재의 교육은 고난에 찬, 그러면서도 역동적인 민족 현대사에 의하여 형성된 것이며, 동시에 이 교육은 그 역사의 한복판에서 민족사의 전개과정에 영향을 끼쳐 왔다.",,1757,BOOK
당신이 옳다 - 정혜신의 적정심리학,정혜신 (지은이),51514,국내도서>인문학>심리학/정신분석학>교양 심리학,9788965746669,"타인의 시선과 기대에 부응하려 발버둥치고, 갑질 하는 조직에서 억지 미소로 참아내고, 성공과 효율을 좇는 사회의 기준에 허덕이고, 관계의 고단함 속에 내 마음은 뒷전이 될 때… 우리는 존재 자체로 존중받지 못한 채 각자의 개별성은 무시된다.",,48721,BOOK
아내를 모자로 착각한 남자,"올리버 색스 (지은이), 이정호 (그림), 조석현 (옮긴이)",51520,국내도서>인문학>심리학/정신분석학>뇌과학/인지심리학,9791159920257,&lt;아내를 모자로 착각한 남자&gt; 개정판. 일상생활에 불편을 겪는 경증 환자부터 현실과 완전히 격리될 정도로 중증의 정신질환을 겪는 환자들까지 올리버 색스가 엄밀히 관찰하고 따뜻하게 써낸 '우리와는 조금 다른' 사람들의 독특한 임상 기록이다.,,26335,BOOK
어린 여우를 위한 무서운 이야기 - 2020년 뉴베리 아너상 수상작,"크리스천 맥케이 하이디커 (지은이), 이원경 (옮긴이)",48877,국내도서>어린이>동화/명작/고전>외국창작동화,9788965463665,"어린이 문학에 기여한 최고의 작품에 수여하는 뉴베리상에서 2020년 뉴베리 아너상(Newbery Honor)을 수상한 작품이다. 모험, 생존, 그리고 유머, 심지어 무서움까지도 이 이야기의 가치를 빛내고 있다고 평가 받았다.",,5468,BOOK
일곱 해의 마지막,김연수 (지은이),50993,국내도서>소설/시/희곡>한국소설>2000년대 이후 한국소설,9788954672771,"&lt;파도가 바다의 일이라면&gt; 이후 8년 만에 펴내는 김연수 장편소설. 청춘, 사랑, 역사, 개인이라는 그간의 김연수 소설의 핵심 키워드를 모두 아우르는 작품으로, 한국전쟁 이후 급격히 변한 세상 앞에 선 시인 '기행'의 삶을 그려낸다.",,7779,BOOK
2021 이동기 핵심문법 100포인트 요약노트,이동기 (지은이),34626,국내도서>수험서/자격증>공무원 수험서>7/9급 공무원>영어>단어/문법/독해 외,9791165761707,‘선택’과 ‘집중’의 원칙 하에서 시험에 자주 출제되는 문법포인트 100개를 엄선하여 핵심 내용만을 표로 도식화하여 정리한 문법 요약집으로 시험 전까지 항상 휴대하면서 암기 확인할 수 있도록 휴대성을 고려한 교재이기도 하다.,,2932,BOOK
변변찮은 마술강사와 금기교전 16 - L Novel,"히츠지 타로 (지은이), 미시마 쿠로네 (그림), 최승원 (옮긴이)",51106,국내도서>소설/시/희곡>라이트 노벨>L 노벨,9791127856816,"마술제전 준결승에 진출한 알자노 제국 대표 선수단. 시스티나는 일륜국(日輪國)의 메인 위저드 사쿠야와의 만남을 통해 마술사로서의 존재 방식─ 『그대, 바라는 것이 있다면 타인의 소망을 화로에 지펴라』 즉, 자신의 소망을 위해 타인의 소망을 짓밟을 각오를 시험받는데...",,894,BOOK
푸른 사자 와니니 2 - 검은 땅의 주인,"이현 (지은이), 오윤화 (그림)",48874,국내도서>어린이>동화/명작/고전>국내창작동화,9788936443054,창비아동문고 305권. 어린 사자 와니니의 모험을 그리며 많은 어린이 독자들의 사랑을 받고 있는 &lt;푸른 사자 와니니&gt;(2015)의 후속작이다. 와니니와 친구들이 자신들만의 땅을 갖기 위해 노력하는 과정을 그렸다.,,23255,BOOK
IFRS 중급회계 - 제8판,"신현걸, 최창규, 김현식 (지은이)",8563,국내도서>대학교재/전문서적>경상계열>세무/회계,9788955406306,"개정 8판은 지난 7판의 골격을 유지하되 여러 부분을 수정 및 보완하였다. 교재 전체에 걸쳐 설명이나 예제의 질을 높이기 위하여 다양하게 보완을 하였고, 기업이 공시한 재무제표와 주석 자료를 관련되는 부분에 대폭 추가하였다.",,751,BOOK
월간최신 취업에 강한 에듀윌 시사상식 2020.9 - 취업상식 대비,에듀윌 상식연구소 (지은이),64312,국내도서>수험서/자격증>취업/상식/적성>월간 이슈&상식,9791136006769,에듀윌 시사상식은 알기 쉽고 자세한 최신 뉴스 상식 키워드 설명과 어려운 단어 하나하나의 뜻까지 다룬 친절한 설명으로 정평이 나 있다. 여기에 재미있고 취업에 도움도 되는 다방면의 지식까지 한 권에 담았다.,,436,BOOK
센서,"이토 준지 (지은이), 서현아 (옮긴이)",3723,국내도서>만화>본격장르만화>호러/스릴러,9791165791681,"센고쿠다케 기슭을 걷는 뱌쿠야 쿄코. 그곳에 그녀를 기다리고 있었다는 남자가 나타나, 마을로 초대한다. 놀랍게도 그 마을에서는 모든 것이 황금색으로 빛나고 있었다. 밤, 마을 사람들과 밤하늘을 바라보니 무수한 물체가 쏟아진다. 그것은 이제부터 일어날 무시무시한 사건의 시작이었다.",,1384,BOOK
페인트 (반양장) - 제12회 창비청소년문학상 수상작,이희영 (지은이),50759,국내도서>청소년>청소년 문학>청소년 소설,9788936456894,제12회 창비청소년문학상 수상작. 심사위원 전원의 압도적인 지지와 청소년심사단 134명의 열렬한 찬사 속에 수상작으로 선정되어 세상에 나온 작품이다. 이희영 작가는 &lt;페인트&gt;를 통해 누구나 한 번쯤 품어 보았을 도발적인 상상력을 펼쳐 보인다.,,41275,BOOK
경제학원론 - 제6판,"이준구, 이창용 (지은이)",8560,국내도서>대학교재/전문서적>경상계열>경제학,9791185994703,경제학을 공부하는 주요한 목적은 현실에서 경제가 어떻게 돌아가고 있는지를 이해하는 능력을 키우는 데 있다. 이번 개정작업의 포커스는 독자들의 현실 감각을 가장 최근의 상황으로 업데이트해 준다는 데 맞춰져 있다.,,9686,BOOK
미네르바 인문 읽기와 쓰기 - 인간과 세계에 대한 성찰,미네르바 교양대학 교재편찬위원회 (지은이),51378,국내도서>인문학>교양 인문학,9791159012242,"&lt;소통과 공감&gt;, &lt;미디어로 들여다 본 사회&gt;, &lt;열린 사회와 관용&gt;, &lt;옛 것과 새로운 것&gt;등 총 8장으로 구성되어 있다. 각 장의 핵심 키워드를 볼 때 현대사회를 살아가는데 가장 필요한 가치들을 학습할 수 있도록 기획되었다.",,551,BOOK
"한 권으로 끝내는 해커스 토익 700+ (LC + RC) - 신토익 출제유형 100% 반영으로 빠르게 700점 달성 가능, 신토익 실전모의고사 2회분 제공",해커스어학연구소 (지은이),49855,국내도서>외국어>토익>Listening,9788965422006,"토익 기초부터 실전까지 한 권으로 끝낼 수 있도록 구성한 교재. 확실한 목표점수 달성을 위한 '기초다지기 & 영역별 기출 핵심 포인트'와 최신 신토익 유형을 완벽 반영한 풍부하고, 다양한 문제를 수록하였고, 상세한 강의식 해설을 담았다.",,16677,BOOK
큰별쌤 최태성의 별★별한국사 7일의 기적 한국사능력검정시험 심화(1.2.3급) - 7일 만에 끝내는 한능검 단기 학습서,최태성 (지은이),166525,"국내도서>수험서/자격증>한국사능력검정시험>심화(1,2,3급)",9791164428816,"7일 만에 한능검 합격 점수를 획득할 수 있도록 시험에 꼭 나오는 핵심 내용만을 압축하여 담았다. 20년 넘게 판서를 연구해 온 판서의 장인 큰별쌤이 핵심만을 모아 만들어낸 10개의 아트 판서를 수록하였고, 시험에 자주 나오는 기출 자료와 대표 기출문제를 선별하여 수록하였다.",,3843,BOOK
내러티브 앤 넘버스 - 숫자에 가치를 더하는 이야기의 힘,"애스워드 다모다란 (지은이), 조성숙 (옮긴이), 강병욱 (감수)",2173,국내도서>경제경영>기업 경영>경영전략/혁신,9791157843763,"재무학 교수이자 기업 가치평가의 최고권위자인 애스워드 다모다란은 스토리의 힘이 기업 가치를 끌어올리고 숫자에 의미를 더해 주며 심지어 의심 많은 투자자마저도 위험을 감수하게 만든다고 말한다. 이 책은 숫자 중심 내러티브의 장점과 도전, 함정은 무엇인지, 그리고 스토리가 타당성이라는 시험대를 통과하려면 어떻게 해야 하는지 알려준다.",,4607,BOOK
아주 작은 습관의 힘 - 최고의 변화는 어떻게 만들어지는가,"제임스 클리어 (지은이), 이한이 (옮긴이)",70216,국내도서>자기계발>성공>성공학,9791162540640,"저자의 생생한 경험과 생물학, 뇌과학, 심리학의 최신 연구 결과를 집약해서 습관 하나로 인생을 변화시킬 수 있는 노하우를 제시한다. 어떤 습관을 자신의 무기로 만들기 위해서는 딱 네 가지만 기억하면 된다. 바로 ‘행동 변화의 4가지 법칙’인데, 모든 습관은 분명하고(제1법칙), 매력적이고(제2법칙), 쉽고(제3법칙), 만족스러워야(제4법칙) 한다는 것이다.",,68961,BOOK
"현명한 투자자 - 벤저민 그레이엄 직접 쓴 마지막 개정판, 개정4판","벤저민 그레이엄 (지은이), 이건 (옮긴이), 신진오 (감수)",174,국내도서>경제경영>재테크/투자>주식/펀드,9788957821305,"초보 투자자도 건전한 투자 전략을 수립하고 실행할 수 있도록 안내하는 투자서다. 그래서 증권분석 기법은 많이 다루지 않고, 주로 투자 원칙과 투자 태도를 다루고 있다. 또한 투자자를 방어적 투자자와 공격적 투자자로 나누어 어떻게 투자를 해야 하는지 투자자의 성향과 기질에 맞는 투자 원칙을 설명하고 있다.",,27371,BOOK
책으로 시작하는 부동산 공부 - 부의 길로 가기 위한 첫걸음,레비앙 (지은이),175,국내도서>경제경영>재테크/투자>부동산/경매,9791161252629,"처음 부동산 공부를 시작하는 사람들을 위해 저자의 경험을 살려 400여권 중에서 엄선한 70권을 추천하고, 책 내용을 내 것으로 만드는 독서법과 정리법, 책을 활용해 더 깊이 공부하는 방법들을 자세하게 그리고 아낌없이 소개한다.",,2579,BOOK
4차 산업혁명 시대의 이산수학 - 개정판,김대수 (지은이),8324,국내도서>대학교재/전문서적>자연과학계열>수학,9788970509808,"미국과 국내에서 이산수학과 관련된 저자의 오랜 경험과 상당 기간의 준비 과정을 통하여, 많은 대학생들이 보다 쉽게 이산수학을 익히고 응용할 수 있도록 기초부터 차근차근 설명하였다.",,6540,BOOK
토크쇼로 배우는 영어대화기술,윤규철 (지은이),49849,국내도서>외국어>영어회화>생활영어,9791196618353,KOCW 대학 공개 강의 서비스(kocw.net)에서 제공되는 같은 이름의 강의 교재로 사용되고 있는 책이다. 또한 대학에서 학부생들을 대상으로 한 인기 있는 인터넷 강의 교재로 제공되고 있다.,,6253,BOOK
악몽을 먹고 자란 소년 - 고문영 동화,"조용 (지은이), 잠산 (그림)",50993,국내도서>소설/시/희곡>한국소설>2000년대 이후 한국소설,9791190908153,서로 다른 세 사람이 만나 상처를 보듬고 치유해 가는 조금은 이상한 로맨틱 코미디 [사이코지만 괜찮아]. 드라마 속 사랑을 모르는 유명 동화 작가 문영이 쓰고 그린 동화들을 책으로 만나는 '사이코지만 괜찮아 특별 동화' 시리즈가 위즈덤하우스에서 출간된다.,,7021,BOOK
멋진 신세계,"올더스 헉슬리 (지은이), 안정효 (옮긴이)",89481,국내도서>소설/시/희곡>과학소설(SF)>외국 과학소설,9788973814725,"올더스 헉슬리는 명문 집안 출신의 영국 작가로서 광범위한 지식뿐 아니라 예리한 지성과 우아한 문체, 그리고 때로는 냉소적인 유머 감각으로 유명하다. 그가 1932년에 발표한 작품 &lt;멋진 신세계&gt;는 금세기에 미래를 가장 깊이 있고 날카롭게 파헤친 작품 중의 하나로 평가받는다.",,42868,BOOK
공부는 절대 나를 배신하지 않는다 - 전교 꼴찌 영준이는 어떻게 수능 만점을 받았을까?,송영준 (지은이),4621,국내도서>청소년>학습법,9791190538183,"전교 꼴찌로 고등학교에 입학해 수능 만점을 받고 서울대 자유전공학부에 합격, 전국적으로 화제를 모은 송영준 군의 공부 비법을 공개한 책. 어려운 집안 형편으로 학원이나 과외 같은 사교육의 도움 없이 오로지 학교 공부만으로 이루어 낸 결과라 전 언론의 주목을 받았다.",,2330,BOOK
기억 1,"베르나르 베르베르 (지은이), 전미연 (옮긴이)",89481,국내도서>소설/시/희곡>과학소설(SF)>외국 과학소설,9788932920337,"베르나르 베르베르의 신작 장편소설. 고등학교 교사인 주인공 르네 톨레다노는 센강 유람선 공연장에 갔다가 퇴행 최면의 대상자로 선택당한다. 최면에 성공해 무의식의 복도에 늘어선 기억의 문을 열 수 있게 된 르네. 문 너머에서 엿본 기억은, 제1차 세계 대전의 전장에서 목숨을 잃은 그의 전생이었다.",,10274,BOOK
왜 세계의 절반은 굶주리는가? - 개정증보판,"장 지글러 (지은이), 유영미 (옮긴이), 주경복, 우석훈 (해제)",51073,국내도서>사회과학>사회문제>빈곤/불평등문제,9791187038030,2000년부터 유엔 인권위원회의 식량특별조사관으로 활동하고 있는 장 지글러가 기아의 실태와 그 배후의 원인들을 대화 형식으로 알기 쉽게 조목조목 설명해놓고 있는 책.,,38709,BOOK
컴퓨터구조론 (김종현) - 개정5판,김종현 (지은이),8488,국내도서>대학교재/전문서적>공학계열>컴퓨터공학>컴퓨터 구조,9788970509693,"컴퓨터 하드웨어의 기본 원리와 핵심 기술들을 이해하기 쉽도록 간결하게 설명하였으며, 최근에 새로이 개발된 멀티-코어 프로세서, GPU, DDR SDRAM 및 SSD를 포함한 각종 보조저장장치를 비롯한 첨단 컴퓨터 기술들에 대하여 전반적으로 소개하고 있다.",,6914,BOOK
극주부도 1,오노 코스케 (지은이),3742,국내도서>만화>순정만화>레이디스 코믹,9791134838508,"뒷세계에 수많은 전설을 남기며 ‘불사신 타츠’라는 이명으로 불렸던 남자. 하지만 그가 야쿠자를 은퇴하고 선택한 길은 「전업주부」였다. 도시락 싸기, 청소하기, 장보기 등등 부인의 뒷바라지를 성심성의껏 하는 타츠의 소소하고 따끈따끈한 일상 이야기.",,1617,BOOK
미안함에 대하여 - 홍세화 사회비평에세이,홍세화 (지은이),51059,국내도서>사회과학>비평/칼럼>한국사회비평/칼럼,9791160404197,"홍세화는 부의 대물림이 아니라 가난의 대물림을 본다. 그는 우리에게 요청한다. 가난이 죄가 되는 사회에서 가난한 사람들이 스스로 발언할 수 없을 때, 부러움 때문이든 시기 때문이든 부의 대물림을 보는 대신 대물림되는 가난을 보자고 말이다.",,1815,BOOK
"룬샷 - 전쟁, 질병, 불황의 위기를 승리로 이끄는 설계의 힘","사피 바칼 (지은이), 이지연 (옮긴이)",282,국내도서>경제경영>기업 경영>조직/인력/성과관리,9788965963790,"물리학자, 바이오테크 기업 창업자이자 최고경영자인 사피 바칼은 이 책에서 ‘미친’ 아이디어라고 손가락질 받던 ‘룬샷’이 어떻게 전쟁, 질병, 비즈니스의 위기를 승리로 이끌었는지 과학자와 경영자의 눈으로 탐구한다.",,9315,BOOK
공간이 만든 공간 - 새로운 생각은 어떻게 만들어지는가,유현준 (지은이),51378,국내도서>인문학>교양 인문학,9788932474274,"지역 간 문화의 교류로 새로운 생각과 문화가 만들어지고, 분야 간 융합으로 새로운 문화가 탄생하는 문화 유전자의 진화와 계보를 공간을 중심으로 살펴본 책이다.",,13718,BOOK
