title,author,genre_id,genre,ISBN,description_aladin,description_naver,salesPoint,mallType상담심리학의 이론과 실제 (천성문 외) - 3판,"박명숙, 함경애, 이영순, 이동훈, 천성문 (지은이)",8328,국내도서>대학교재/전문서적>인문계열>심리학,9788999706127,"상담 입문서로, 상담에 대한 기초를 다지는 데 도움을 주고자 노력하였다. 특히 상담의 이론을 익히는 것뿐만 아니라 상담의 실제에 도움을 줄 수 있도록 사례를 들어 구체적인 설명을 덧붙임으로써 상담이론과 실제를 겸비할 수 있다.",,2665,BOOK
명품 JAVA Essential - 개정판,황기태 (지은이),2502,국내도서>컴퓨터/모바일>프로그래밍 언어>자바,9788970509563,"한 학기에 자바의 기초를 습득할 수 있도록 작성되었다. 자바 언어에 대한 쉬운 설명과 의미 있는 예제를 도입하여 이론이 프로그래밍으로 이어지게 하고, 이해도 높은 삽화와 그림으로 본문에 쉽게 몰입할 수 있도록 하였다.",,3184,BOOK
심리평가의 최신 흐름 - 2판,"이우경, 이원혜 (지은이)",8328,국내도서>대학교재/전문서적>인문계열>심리학,9788999718878,,,9140,BOOK
나미야 잡화점의 기적 (양장),"히가시노 게이고 (지은이), 양윤옥 (옮긴이)",50998,국내도서>소설/시/희곡>일본소설>1950년대 이후 일본소설,9788972756194,히가시노 게이고 소설. 총 5장으로 구성된 &lt;나미야 잡화점의 기적&gt;은 시공간을 초월하여 편지를 주고받는다는 설정 때문에 판타지 색채가 두드러져 보일 수 있지만 이는 각각의 이야기와 등장인물을 하나의 연결 고리로 모으는 주요 장치로 작용한다.,,110433,BOOK
"총 균 쇠 (양장) - 무기.병균.금속은 인류의 운명을 어떻게 바꿨는가, 개정증보판","재레드 다이아몬드 (지은이), 김진준 (옮긴이)",51378,국내도서>인문학>교양 인문학,9788970128856,"왜 원주민들은 유라시아인들에 의해 도태되고 말았는가? 왜 각 대륙들마다 문명의 발달 속도에 차이가 생겨났는가? 인간 사회의 다양한 문명은 어디에서 비롯되었는가? 1998년 퓰리처 상을 수상한 <총, 균, 쇠>는 이런 의문을 명쾌하게 분석한 명저이다.",,22572,BOOK
나는 말하듯이 쓴다 - 강원국의 말 잘하고 글 잘 쓰는 법,강원국 (지은이),51538,국내도서>인문학>책읽기/글쓰기>글쓰기,9791190786867,"김우중 회장, 김대중 대통령, 노무현 대통령의 연설문을 써온 강원국의 &lt;나는 말하듯이 쓴다&gt;. 회장님이나 대통령은 아니더라도 누구나 어떤 상황에서든 바로 써먹을 수 있는 말하기, 글쓰기 방법을 알려준다.",,4434,BOOK
넌 나의 우주야,"앤서니 브라운 (지은이), 공경희 (옮긴이)",35137,국내도서>유아>그림책>나라별 그림책>유럽,9788901240879,"웅진 세계그림책 210권. 부모와 자식과의 관계를 바라보며, 동시에 세상의 모든 작은 존재들을 응원하는 마음을 담았다. 예측할 수 없는 수많은 모습을 가진 우리 아이. 네가 어떤 모습을 해도, 그 모습 그대로의 널 사랑한다는 부모의 애정 듬뿍 넘치는 사랑을 담은 이야기다.",,3378,BOOK
"빌 캠벨, 실리콘밸리의 위대한 코치","에릭 슈미트, 조너선 로젠버그, 앨런 이글 (지은이), 김민주, 이엽 (옮긴이)",852,국내도서>경제경영>기업/경영자 스토리>국외 기업/경영자,9788934903338,"15년 동안 일주일에 한 번씩 빌의 코칭을 받은 에릭 슈미트는 그의 가르침을 미래 세대에 전수하기 위해 『빌 캠벨, 실리콘밸리의 위대한 코치』를 출간했다. 빌과 함께 일한 80여 명과의 인터뷰를 바탕으로, 베일에 싸여 있던 빌 캠벨의 삶과 리더십 원칙을 최초 공개한다.",,3606,BOOK
다시 춤추기 시작할 때까지 - 코로나 시대 성경이 펼치는 예언자적 상상력,"월터 브루그만 (지은이), 신지철 (옮긴이)",51601,국내도서>종교/역학>기독교(개신교)>기독교(개신교) 신앙생활>신앙생활일반,9788932817651,"졸업식이 취소되고 결혼식이 연기된다. 예배는 온라인으로 전환된다. 바이러스 확산 방지를 위해 일상 모임이 금지된다. 사회적 시스템이 전부 무너져 내렸다. 그러나 이 당혹스러운 슬픔, 상실, 불확실성의 시대는 유례없는 사건이 아니다.",,1883,BOOK
아동권리와 복지 (임경옥 외),"임경옥, 홍나미, 손경숙 (지은이)",8340,국내도서>대학교재/전문서적>사회과학계열>사회복지학,9791161052250,,,720,BOOK
2020 장정훈의 품격있는 모의고사 경찰학개론 (8절) - 기정판,장정훈 (지은이),140201,국내도서>수험서/자격증>공무원 수험서>경찰공무원(승진)>경찰학개론,9791163482130,,,193,BOOK
인간 실격,"다자이 오사무 (지은이), 김춘미 (옮긴이)",50996,국내도서>소설/시/희곡>일본소설>1950년대 이전 일본소설,9788937461033,"자살 미수와 약물 중독, 39세의 젊은 나이에 자살로 생을 마감한 다자이 오사무의 작품 <인간 실격>이 출간됐다. 오직 순수함만을 갈망하는 한 젊은이가 파멸해가는 과정이 그려진다. 뉴욕 타임스는 '인간의 나약함을 드러내는 데 있어 다자이보다 뛰어난 작가는 드물다'고 평했다.",,81987,BOOK
역사란 무엇인가 - 독점계약 번역 개정판,"에드워드 H. 카 (지은이), 김택현 (옮긴이)",1438,국내도서>역사>역사학>역사학 일반,9788972915812,E. H. 카의 &lt;역사란 무엇인가&gt; 독점계약 번역 개정판. 이 책을 이해하는 데 핵심이 되는 E. H. 카의 '제2판 서문'과 R. W. 데이비스의 논문이 수록되었다.,,18197,BOOK
집단상담의 실제 - 3판,강진령 (지은이),8328,국내도서>대학교재/전문서적>인문계열>심리학,9788999717611,본서는 지침이나 체크리스트 형식을 빌려서 글상자로 요약 정리하였다. 이론적인 내용이나 개념을 집단의 실제에 어떻게 적용하는가에 대한 이해를 돕기 위해 대화상자를 활용하여 집단상담자와 집단원들 간의 대화의 형식으로 제시한다.,,7478,BOOK
기본 유기화학 (McMurry) - 제7판,"John E. Mcmurry, Eric E. Simanek (지은이), 김경태 (옮긴이)",8338,국내도서>대학교재/전문서적>자연과학계열>화학,9788962181616,,,2561,BOOK
이해하기 쉬운 인체생리학 - 개정판,"구재옥, 이연숙, 권종숙, 임현숙, 강영희 (지은이)",54888,국내도서>대학교재/전문서적>의약학간호계열>기초의학>생리학,9788981603069,"총 12장으로 구성되어 있다. 각 장마다 핵심용어 풀이를 여백에 배치하여 본문을 이해하기 쉽도록 하였으며, 본문에서 다루지 못했지만 임상적으로 중요한 의미를 갖는 몇가지 상식을‘알아두기’란에 제공하였다.",,2351,BOOK
Ross의 재무관리 - 제12판,"Stephen A. Ross (지은이), 박원규 (옮긴이)",8564,국내도서>대학교재/전문서적>경상계열>재무/금융,9791132101758,,,799,BOOK
유체역학 - 제9판,"Robert W. Fox (지은이), 서상호 (옮긴이)",8489,국내도서>대학교재/전문서적>공학계열>기계공학>기초역학/열역학/역학일반,9788993543674,,,555,BOOK
놀이중심 영유아 동작교육 - 2019 개정 누리과정 연계,오연주 (지은이),8435,국내도서>대학교재/전문서적>사범계열>유아교육학,9788942612826,,,919,BOOK
지구에서 한아뿐,정세랑 (지은이),50993,국내도서>소설/시/희곡>한국소설>2000년대 이후 한국소설,9791188862290,"창비장편소설상, 한국일보문학상 수상 작가 정세랑의 두번째 장편소설. 우주 가장자리에서 일어나 모두가 기억하게 된, 외계인 경민과 지구인 한아의 아주 희귀한 종류의 사랑 이야기이다.",,19996,BOOK
위험한 과학책 (리커버 에디션) - 지구 생활자들의 엉뚱한 질문에 대한 과학적 답변,"랜들 먼로 (지은이), 이지연 (옮긴이), 이명현 (감수)",51002,국내도서>과학>기초과학/교양과학,9788952773326,"출간 즉시 아마존, 뉴욕타임스 30주 연속 베스트셀러! 미국 최고의 사이언스 웹툰 ‘xkcd’의 작가 랜들 먼로는 정말 궁금했지만 그 누구도 대답해 주지 않았던 이 기상천외한 질문들에 대한 해답을 찾기 위해 온갖 방법을 총동원한다.",,26833,BOOK
마법천자문 48 - 늘 생각하다! 생각 념(念)!,"김현수 (지은이), 홍거북 (그림), 김창환 (감수)",48941,국내도서>어린이>어린이 한자>학습만화,9788950987749,손오공의 모험 이야기를 따라가면서 쓰기보다 뜻과 소리를 먼저 읽고 그림으로 한자를 보면서 학습할 수 있도록 한 한자학습만화다. 마법의 주문으로 음과 훈을 읽기 때문에 재미있게 한자를 배울 수 있다.,,5133,BOOK
Go Go 카카오프렌즈 15 : 브라질 - 세계 역사 문화 체험 학습만화,"김미영 (지은이), 김정한 (그림)",48905,국내도서>어린이>사회/역사/철학>세계사,9788950989064,카카오프렌즈가 시간여행의 주인공이 되어 펼쳐지는 이야기로 독자들은 카카오프렌즈의 재기발랄한 여행을 통해 세계 곳곳의 다양한 역사와 문화를 경험한다. 이번 책에서 카카오프렌즈가 새롭게 방문하는 나라는 지구의 허파라 불리는 아마존이 위치한 브라질이다.,,3921,BOOK
N잡하는 허대리의 월급 독립 스쿨 - 돈 버는 재미를 잃어버린 직장인을 위한,사업하는 허대리(N잡하는 허대리) (지은이),2225,국내도서>경제경영>재테크/투자>재테크/투자 일반,9791158511807,"평범한 직장인에서 월급 외 수익 1,000만 원을 달성한 동시에 ‘N잡하는 허대리’로 13만 유튜브 팔로워들의 사랑을 받고 있는 저자가 PDF 전자책, 블로그, 온라인 강의, 유튜브 등 다양한 머니 파이프라인을 개척해 내가 좋아하는 일로 월급 외 수익을 창출하고 경제적 자유에 한 걸음 다가가는 노하우를 알려준다.",,2090,BOOK
"월급쟁이 재테크 상식사전 - 예·적금, 펀드, 주식, 부동산, P2P, 앱테크까지 꼼꼼하게 모으고 안전하게 불리는 비법 152",우용표 (지은이),2225,국내도서>경제경영>재테크/투자>재테크/투자 일반,9791160508079,"재테크를 시작하려는 사회초년생에게 꼭 필요한 정보를 모두 담은 《월급쟁이 재테크 상식사전》최신개정판. 월급쟁이가 할 수 있는 재테크 방법을 모두 다루고 있으며, 최신 자료와 그래프로 왕초보도 술술 읽을 수 있도록 구성되어 있다.",,3666,BOOK
매머드 사이언스 - DK 그림으로 만나는 재미있는 과학책,"데이비드 맥컬레이 (지은이), 이한음 (옮긴이)",48869,국내도서>어린이>과학/수학/컴퓨터>생물과 생명,9791188413102,칼데콧상 연속 수상자인 데이비드 맥컬레이에게는 좋은 벗이 있다. 바로 &lt;도구와 기계의 원리&gt;의 매머드다. 매머드는 다소 딱딱할 수 있는 지식들 틈에서 독자들의 흥미를 북돋아주며 호기심을 건드려주는 역할을 톡톡히 했다. 이번에는 매머드가 주인공이다.,,1391,BOOK
"2021 에듀윌 KBS한국어능력시험 한권끝장 - 빈출이론편+기출변형 문제편, 휴대용 기출 어휘/어법 암기카드, 한달 고등급 & 2주 초단기 플래너","송주연, 김지학, 황혜림 (지은이)",34895,국내도서>수험서/자격증>한국어능력검정시험,9791136005656,기출패턴을 철저히 분석해 KBS한국어능력시험 기본 다지기부터 고등급 합격까지 이끄는 교재이다. KBS한국어능력시험과 오랜 세월을 함께한 에듀윌의 전문가들이 고등급을 취득할 수 있는 공부 비법과 시간 대비 효율성 높은 학습 방법을 알려 준다.,,1836,BOOK
임상심리검사의 이해 - 2판,김재환 (지은이),8328,국내도서>대학교재/전문서적>인문계열>심리학,9788999703720,,,7129,BOOK
몸에 밴 어린시절,"W. 휴 미실다인 (지은이), 이석규, 이종범 (옮긴이)",51514,국내도서>인문학>심리학/정신분석학>교양 심리학,9791197031700,과거에 거쳐 온 어린 시절에 대한 새로운 시선을 담은 책이다. 초판 출간 이래로 약 15년간 많은 사랑을 받아 온 스테디셀러다. 이번 개정판에서는 자연스럽게 읽히는 데 중점을 두고 독자들이 읽기 편하도록 표현을 다듬었다.,,2199,BOOK
창의적 사고와 소통,"이연도, 최윤경 (지은이)",16034,국내도서>대학교재/전문서적>인문계열>인문학 일반,9788972078531,,,3449,BOOK
교육평가의 기초 - 3판,성태제 (지은이),8414,국내도서>대학교재/전문서적>사범계열>교육과정/교육평가,9788999718649,,,4016,BOOK
음식에 대한 거의 모든 생각 - 이제부터 당신 메뉴에 '아무거나'는 없다,"마틴 코언 (지은이), 안진이 (옮긴이)",51381,국내도서>인문학>인문 에세이,9788960518049,"음식의 역사, 경제, 정치, 윤리, 환경, 영양, 다이어트, 레시피 등 인간의 먹는 행위와 관련한 다양한 읽을거리를 제공한다. 이를 통해 독자들은 우리가 까맣게 모르고 있었던, 하지만 우리의 식생활에 매우 중요하고 우리가 꼭 알아야 하는 사실들을 알게 될 것이다.",,1018,BOOK
유아교사를 위한 교직실무,정미라 (지은이),8435,국내도서>대학교재/전문서적>사범계열>유아교육학,9788999408861,,,228,BOOK
기본 재무관리 - 제4판,"Jonathan Berk (지은이), 선정훈 (옮긴이)",8564,국내도서>대학교재/전문서적>경상계열>재무/금융,9788942009138,,,762,BOOK
더 위험한 과학책 - 지구인이라면 반드시 봐야 할 허를 찌르는 일상 속 과학 원리들,"랜들 먼로 (지은이), 이강환 (옮긴이)",51002,국내도서>과학>기초과학/교양과학,9788952751546,"아마존, 뉴욕타임스 30주 연속 베스트셀러 《위험한 과학책》의 후속작. 어디서부터 어떻게 손을 대야 할지 알 수 없을 정도로 황당무계하고 곤란한 질문들에 대해 랜들 먼로가 답변을 찾아나가는 과정은 그 자체로 무척 흥미롭다.",,13314,BOOK
사람에 대한 예의,권석천 (지은이),51381,국내도서>인문학>인문 에세이,9791190030519,"민주주의, 산업화, 공정, 정의, 복지, 기본소득에 이르기까지, ‘사람 살기 좋은 세상’을 위한 변화는 계속되는데 왜 사람의 가치는 점점 떨어지는 걸까. 우린 왜 사람을 종종 잊고 마는 걸까.",,4674,BOOK
무슨 심부름을 가는 길이니,김행숙 (지은이),51167,국내도서>소설/시/희곡>시>한국시,9788932037547,"2020년 올해로 데뷔 21년 차를 맞는 김행숙의 여섯번째 시집. 온전히 완성될 수도, 완벽히 새로울 수도 없는 불가능한 글쓰기의 숙명을 마주한 채 '진정한 말의 가능성'을 끈질기게 모색해온 시인은 이번 시집에서 '심부름꾼 k가 내놓은 이야기들'로 자신의 고민을 구체화해낸다.",,2233,BOOK
장애아동의 이해,고주연 (지은이),8437,국내도서>대학교재/전문서적>사범계열>특수교육학,9788960698024,,,998,BOOK
마리 앙투아네트의 테이블 - 21세기에 만나는 프랑스 왕실 요리,"미셸 빌뮈르 (지은이), 오경희 (옮긴이)",53494,국내도서>요리/살림>나라별 요리>프랑스 요리,9788969521019,프랑스혁명 당시 국왕 루이 16세와 함께 단두대의 이슬로 사라진 ‘비운의 왕비’ 마리 앙투아네트는 250여 년이 지난 지금에도 사람들의 관심을 끄는 인물이다. 오스트리아의 황녀 마리 앙투아네트는 19살 때 루이 16세와 결혼해 프랑스 왕비가 되었다.,,908,BOOK
단골이라 미안합니다 - 커피 생활자의 카페 감별기,이기준 (지은이),51371,국내도서>에세이>한국에세이,9791190999007,시간의흐름에서 펴내는 4부작 시리즈 '카페 소사이어티' 두 번째 이야기. '카페 없이는 단 하루도 살 수 없는' 그래픽 디자이너 이기준이 그만의 '이상하고 매력적인' 카페 취향을 풀어놓는다.,,883,BOOK
단체급식 (양일선 외) - 제4판,양일선 (지은이),8408,국내도서>대학교재/전문서적>생활환경계열>식품영양학/조리,9788936317331,"2013년에 출간되었던 3판을 전면 수정한 것으로, 새로운 정보를 충실히 담아낸 결과물이다. 각 장의 유기적 구성을 통해 급식관리업무의 흐름을 따라가도록 내용의 순서를 다듬고, 급식관리자가 알아야 할 지식 및 실무기술을 모두 담고자 신경 썼다.",,869,BOOK
글쓰기 책,중앙대학교 글쓰기 교재 편찬위원회 (지은이),51538,국내도서>인문학>책읽기/글쓰기>글쓰기,9788972079309,,,1490,BOOK
세계정치론 - 제7판,"존 베일리스, 스티브 스미스, 퍼트리샤 오언스 (지은이), 하영선 (옮긴이)",51233,국내도서>사회과학>정치학/외교학/행정학>정치학 일반,9788932473949,"세계 최고의 판매 부수를 자랑하는 국제정치학의 바이블『세계정치론』 제7판. 이번 제7판에는 국제정세의 흐름과 국제관계학의 최신 연구 성과를 반영하여 「페미니즘」, 「세계정치에서 인종의 문제」 등의 장이 신설되었고, 학습 기능 면에서도 ‘찬반 의견’ 등이 추가되었다.",,876,BOOK
학교 생활지도와 상담,김은하 (지은이),8416,국내도서>대학교재/전문서적>사범계열>교육사회/심리학,9788999713729,,,1717,BOOK
쉽게 배우는 JSP 웹 프로그래밍,송미영 (지은이),7397,국내도서>컴퓨터/모바일>프로그래밍 언어>JSP,9791156643388,단계별로 쇼핑몰을 구현하며 배우는JSP 웹 프로그래밍 학습서. JSP의 이론적 개념 → 기본 실습 → 응용 실습 순의 단계별 학습이 가능하다. 응용 실습이 합쳐져 최종적으로 쇼핑몰 하나를 완성하는 구성이라 배운 내용이 어디에 어떻게 적용되는지 알 수 있다.,,1038,BOOK
스크래치로 배우는 컴퓨팅 사고와 문제해결,"천인국, 이화민 (지은이)",3023,국내도서>컴퓨터/모바일>PC/게임/디지털 카메라>초보자를 위한 컴퓨터 책,9791185578422,"컴퓨팅 사고를 처음 접하는 독자들도 따라올 수 있도록 컴퓨팅 사고의 기본 개념인 “분해”, “패턴인식”, “추상화”, “알고리즘”을 자세히 설명하였다. 적절한 그림을 가능한 많이 사용하여 보다 친숙하고, 지루하지 않으며, 이해하기 쉬울 것이다.",,345,BOOK
중국어뱅크 집중 중국어 STEP 2 - 중국어 4단계 집중훈련,"안영희, 김태순 (지은이), 주샤오찌엔, 리따쑤이 (감수), 동양북스 교재개발연구소 (기획)",49915,국내도서>외국어>중국어>중국어 회화,9791157682669,중국어의 기초 내용을 학습하고 필수 어법 설명으로 충분한 이해를 도와 연습문제와 워크북으로 복습하는 4단계 과정으로 구성된 책이다. 일상회화를 충분히 구사할 수 있도록 일상에서 자주 쓰이는 내용을 선정 및 수록했다.,,1140,BOOK
다락원 일본어 독해 중급,"코가 마키코, 아오키 유코 (지은이)",49887,국내도서>외국어>일본어>일본어 독해/작문/쓰기,9788927710554,"다락원 일본어 시리즈의 독해 버전 개념으로 새롭게 출간되는 독해 일본어 시리즈. 대학이나 학원 등에서 강의 교재로 쓸 수 있으며, 어휘력이나 문장 독해력을 기르기 위한 독학 학습자에게도 최적의 교재다. 도입부(과의 표제·설명·주요문형), 본문, 독해문제, 본문안의 단어나 표현 일람, 문형노트(설명·예문·단어나 표현), 문법 연습문제, 회화문(청해문제)으로 구성되어 있다.",,1897,BOOK
놀이지도 - 2019개정 누리과정에 기초한 영유아 놀이지원,"박찬옥, 정남미, 곽현주 (지은이)",8435,국내도서>대학교재/전문서적>사범계열>유아교육학,9791161262604,,,777,BOOK
일의 기쁨과 슬픔 - 장류진 소설집,장류진 (지은이),50993,국내도서>소설/시/희곡>한국소설>2000년대 이후 한국소설,9788936438036,"2018년 창비신인소설상으로 등단한 이후 단숨에 수많은 독자와 문단의 관심을 한몸에 받으며 센세이션을 일으킨 장류진 작가의 첫번째 소설집. 8편의 소설이 수록되었으며, 주로 이삼십대 젊은 직장인들의 이야기를 다룬다.",,17257,BOOK
정재승의 인간 탐구 보고서 1 : 인간은 외모에 집착한다 (50만 부 기념 리커버 에디션) - 어린이를 위한 뇌과학 프로젝트,"정재은, 이고은 (글), 김현민 (그림), 정재승 (기획)",49609,국내도서>어린이>과학/수학/컴퓨터>우리 몸,9788950983079,"정재승 교수의 아주 특별한 뇌과학 프로젝트. 아이들한테 뇌과학을 일찍부터 가르쳐 주면 자기 감정도 잘 다스릴 수 있고, 친구들이 왜 저렇게 행동하는지 이해심도 깊어질 것이다. 아이들이 너무나도 흥미로워할 내용이기도 한 외모를 1권의 주제로 삼았다.",,11205,BOOK
파스타 마스터 클래스,"백지혜 (지은이), 김보령 (사진)",53493,국내도서>요리/살림>나라별 요리>이탈리아 요리,9791190403641,쿠킹 클래스 열풍의 시초인 연남동 ‘제리코 레시피’의 간판 수업을 책으로 담은 쿡북. 연일 마감 행진을 기록했던 인기 특강 ‘파스타 마스터 클래스’에서 가장 많이 사랑받고 연신 후기가 쏟아진 파스타를 계절별로 8가지씩 모아 총 32종의 다채로운 파스타 레시피를 엄선했다.,,3892,BOOK
해커스 GSAT 삼성직무적성검사 최신기출유형 + 온라인 시험 대비 - 수리/추리 실전모의고사 제공 / 온라인 모의고사 응시권 + 인강 2만원 할인쿠폰 / GSAT 핵심정리 핸드북 제공,해커스 취업교육연구소 (지은이),36025,국내도서>수험서/자격증>취업/상식/적성>기업 적성검사>GSAT(SSAT),9788969651778,"2020년 5월에 치러진 상반기 GSAT 출제경향을 완벽히 반영한 수험서다. GSAT 최신기출유형 공략부터 실전까지, 전략적인 5일 완성 플랜으로 단기 합격이 가능하도록 구성하였다. 체계적인 4단계 학습 시스템으로 GSAT를 완전 정복할 수 있다.",,980,BOOK
나는 배당 투자로 한 달에 두 번 월급 받는다 - 하루 30분 투자로 세상에서 가장 확실한 수익을 얻는 법,곽병열 (지은이),174,국내도서>경제경영>재테크/투자>주식/펀드,9791160075052,‘배당의 한 수’라는 리포트로 증권사 애널리스트 사이에서 배당 초고수로 이름을 휘날린 곽병열 애널리스트가 신작 《나는 배당 투자로 한 달에 두 번 월급 받는다》를 들고 왔다. 이미 배당 전문가들 사이에서 전설로 통하고 있는 곽병열 저자는 이번 책에서 ‘배당’이란 주제를 처음 접하는 독자들이 책을 읽고 ‘배당 투자’를 완벽히 이해할 수 있도록 심혈을 기울였다.,,4328,BOOK
2020 하반기 에듀윌 국민건강보험공단 NCS 봉투모의고사 4 + 2회 - 행정직 / 건강직 / 기술직 / 요양직 대비,에듀윌 공기업취업연구소 (지은이),35645,국내도서>수험서/자격증>취업/상식/적성>공사 공단 수험서>국민건강보험공단,9791136006509,2020년 5월 시행된 상반기 국민건강보험공단 필기시험 출제 유형을 완벽 분석하여 반영하였다. 수험생이 2020년 하반기 시험 대비 꼭 풀어야 할 문제들로 구성하여 효율적으로 학습할 수 있도록 NCS 직업기초능력평가 2회분+온라인모의고사 1회로 구성하였다.,,396,BOOK
초급 스페인어 1,"신자영, 이만기, 김은영, 라이몬 블랑카포르트 (지은이)",13660,국내도서>대학교재/전문서적>어문학계열>유럽어문학,9788952114877,"10여 종의 교재를 철저하게 분석하여 그 장단점을 취합하여 개발한 교재. 유럽공통참조기준 초급1(A1) 레벨 기준에 따랐으며, 대화 및 문화 섹션의 녹음 파일(MP3 파일 제공)과 함께 그림, 사진을 첨가하여 지루하지 않게 초급 단계 학습에 맞게 구성하였다.",,2974,BOOK
전당포 시노부의 보석상자 10,니노미야 토모코 (지은이),3743,국내도서>만화>순정만화>틴에이지 순정,9791136240903,그는 우리 가게의 저당품이다. 고등학교 2학년 시노부의 집은 도쿄 번화가의 전당포 쿠라타야. 시노부는 어린 나이에도 가게에 나가 천부적인 재능(?)으로 보석 감정을 하고 있다. 그런데 남친도 없는 그녀에게는 할아버지가 멋대로 정한 약혼자가 있었으니.,,627,BOOK
