title,author,genre_id,genre,ISBN,description_aladin,description_naver,salesPoint,mallType아가미,구병모 (지은이),50993,국내도서>소설/시/희곡>한국소설>2000년대 이후 한국소설,9791162203392,소설가 구병모의 대표작 &lt;아가미&gt;가 돌아왔다. 수많은 마니아 독자들 사이에서 재출간 요구가 속출했던 바로 그 작품이 예쁘게 새옷을 갈아입고 세상에 새로이 선을 보인다. &lt;아가미&gt;는 죽음의 문턱에서 아가미를 갖게 된 소년의 슬픈 운명을 그려낸 아름다운 잔혹동화이다.,,15600,BOOK
JLPT 일본어능력시험 한권으로 끝내기 N2 (교재 + 실전모의테스트 + 스피드 체크북 + MP3 CD 1장) - 최신 개정판,"이치우, 기타지마 치즈코 (지은이)",49894,국내도서>외국어>일본어>JLPT>N2,9788927711346,"2010년부터 2015년까지 실제 시험에서 출제된 어휘와 문법을 연도별로 실었으며, 문제 유형을 철저히 분석.반영하여 'JLPT(일본어능력시험) N1'의 문자·어휘, 문법, 독해, 청해 각 파트를 종합적으로 마스터할 수 있도록 하였다.",,8923,BOOK
해커스 토익 실전 1200제 RC Reading (리딩) [문제집+해설집] - 실제 토익시험 리딩 난이도 완벽 반영ㅣ실전 모의고사 12회분 [취약 유형 심층 분석 무료 제공],해커스어학연구소 (지은이),49854,국내도서>외국어>토익>Reading,9788965423737,"종잡을 수 없이 들쑥날쑥 하게 출제되는 토익 시험의 난이도를 철저히 분석하여, 최근 12개월간 출제된 모든 시험의 난이도를 문제에 완벽 반영하였다. 또한, 12회분의 테스트 안에서도 파트마다 난이도가 다르게 출제되는 경향까지 완벽하게 반영하여 실전 시험과 똑같은 난이도의 문제로 대비할 수 있다.",,9523,BOOK
뉴타입의 시대 - 예측 불가능한 미래를 돌파하는 24가지 생각의 프레임,"야마구치 슈 (지은이), 김윤경 (옮긴이)",263,국내도서>경제경영>트렌드/미래전망>트렌드/미래전망 일반,9791189995638,"《철학은 어떻게 삶의 무기가 되는가》로 2019년 국내 종합 베스트셀러 1위에 오른 저자 야마구치 슈의 신작으로, 새로운 시대에 필요한 생각의 프레임, 의미와 가치를 발견하는 비즈니스 전략, 지식 습득의 방법론 등을 ‘올드타입’과 ‘뉴타입’의 대조를 통해 단 한 권으로 명쾌하게 제시하는 책이다.",,3431,BOOK
미시경제학 - 제7판,이준구 (지은이),8560,국내도서>대학교재/전문서적>경상계열>경제학,9791185994598,&lt;미시경제학&gt; 7판. 이번 개정에서 새로운 장이 추가되거나 하는 정도의 큰 변화가 일어난 것은 없다. 그러나 책 전체를 새로 다듬는 과정에서 보이지 않게 개선된 부분이 많다. 어떻게 하면 독자들이 경제학의 어려운 개념들과 이론들을 쉽게 배울 수 있는지를 고심하여 개정되었다.,,4006,BOOK
"어느 채식의사의 고백 - 녹말음식은 어떻게 살을 빼고 병을 고치나, 개정증보판","존 A. 맥두걸 (지은이), 강신원 (옮긴이)",53514,국내도서>건강/취미>다이어트,9791187330035,"전세계적으로 150만부 넘게 판매된 스테디셀러 &lt;어느 채식의사의 고백&gt; 개정증보판이다. 녹말음식이 어떻게 살을 빼고 병을 고치는가에 대한 이유를 진화론적으로 접근한다. 우유와 생선에 대한 허구, 단백질과 영양제에 대한 오해, 채식주의자이면서 뚱뚱한 사람들의 이유 등 우리가 의아해하면서 궁금했던 통념의 오류도 밝히고 있다.",,2868,BOOK
Do it! 자바스크립트 + 제이쿼리 입문 - 전면 개정판,정인용 (지은이),6355,국내도서>컴퓨터/모바일>웹디자인/홈페이지>HTML/JavaScript,9791163030034,"4년 연속 베스트셀러, Do it! 자바스크립트 + 제이쿼리 입문의 전면 개정판으로, 자바스크립트, 제이쿼리의 기본부터 실전에 필요한 핵심까지 모두 담았다. 프런트엔드 실무 교육 경력 10년 강사가 엄선한 155개의 예제로 기본부터 실무 활용까지 완벽하게 대비할 수 있다.",,2471,BOOK
2021 문동균 한국사 최신 기출 총정리,문동균 (지은이),34631,국내도서>수험서/자격증>공무원 수험서>7/9급 공무원>한국사>기출/문제집/모의고사,9791196304447,"2019년 하반기부터 2020년 상반기까지 실시된 주요 시험들의 기출 문제와 해설을 담아낸 책이다, 최신 출제 경향 파악에 도움이 될 뿐만 아니라 경찰.소방.국회직 등 다양한 직렬의 문제가 포함되어 있어 일반 행정직이 아닌 다른 시험을 준비하는 수험생들에게도 적합한 교재이다.",,684,BOOK
융합적 사고와 글쓰기,숙명여자대학교 기초교양학부 (지은이),16034,국내도서>대학교재/전문서적>인문계열>인문학 일반,9791162441299,정확하게 현실적 조건들을 분석하면서도 다른 한 편으로 새로운 시선에서 현재와 미래를 가늠해 보는 일이야말로 우리 시대의 젊은 지성들에게 요구되는 지적 역량이다. &lt;융합적 사고와 글쓰기&gt;는 이러한 지적 역량을 이해하고 연습하는 수업이다.,,1157,BOOK
"범죄, 그 심리를 말하다 - 범죄심리 해부하기, 제2판",오윤성 (지은이),13658,국내도서>대학교재/전문서적>사회과학계열>행정학,9791130303505,행동은 의식으로부터 비롯되며 의식은 재차 행동으로부터 영향을 받는 순환적 과정으로 범죄행동에서도 예외는 아니다. 왜 그런 행동을 했을까? 꼭 그렇게까지 해야만 했을까? 이 책에서는 범죄 행동의 순환적 과정인 심리적 동인(動因)을 다룬다.,,2940,BOOK
엑셀과 파워포인트 2016 - 탄탄한 기본기로 실무 능력을 키우는,김지연 (지은이),2602,국내도서>컴퓨터/모바일>오피스(엑셀/파워포인트)>엑셀,9791156643760,146개의 실습 예제를 통해 엑셀과 파워포인트의 핵심 기능부터 오피스 2016에 추가된 새로운 기능까지 빠짐없이 배울 수 있다. 또한  다양한 활용 방법을 소개하는 요약 예제와 실무 활용 팁으로 응용 능력도 키울 수 있다.,,1524,BOOK
신공략 중국어 2 - 최신개정,"Ma Jianfei, Su Yingxia, Die Yan (지은이), 변형우, 주성일, 여승환, 배은한 (옮긴이)",49915,국내도서>외국어>중국어>중국어 회화,9788927722434,《&#27721;&#35821;口&#35821;速成》이라는 제목으로 중국에서 발간된 중국어 회화 교재의 한국어판이다. 중국어를 처음 접하는 학생들이 최단 기간 효율적으로 중국어 의사소통 능력을 향상시킬 수 있도록 돕기 위해 개발되었다.,,3076,BOOK
New 공중보건학 - 개정 제8판,임국환 (지은이),55045,국내도서>대학교재/전문서적>의약학간호계열>간호학>보건학,9788970068077,"공중보건의 최신 정보와 폭넓은 자료를 정리, 핵심 내용을 이해하기 쉽게 수록하여, 보건의료 분야 실무자들은 물론, 보건직 공무원, 간호사, 보건교육사, 병원행정사, 의료기사, 영양사 등 국가면허 시험준비서로도 적합하도록 구성하였다.",,424,BOOK
정신건강사회복지론,"권진숙, 김정진, 전석균, 성준모 (지은이)",8340,국내도서>대학교재/전문서적>사회과학계열>사회복지학,9791161051598,,,740,BOOK
거시경제학 해법 - 제10판,"그레고리 맨큐 (지은이), 이병락 (옮긴이)",8560,국내도서>대학교재/전문서적>경상계열>경제학,9791162262559,"세계적으로 널리 사용되는 거시경제학 교과서인 N. Gregory Mankiw의 &lt;Macroeconomics&gt;(제9판)를 번역한 책으로, 전문교재이면서도 교양서 수준의 가독성을 가지고 있다. 특히 현란한 수식이나 도표를 몰라도 일반인이 거시경제에 대해 충분히 이해할 수 있게 잘 기술되어 있다.",,1252,BOOK
White의 유체역학 - 제8판,"Fred M. White (지은이), 유정열 (옮긴이)",8489,국내도서>대학교재/전문서적>공학계열>기계공학>기초역학/열역학/역학일반,9791132101017,,,701,BOOK
학교사회복지론 (주석진 외) - 제3판,주석진 (지은이),8340,국내도서>대학교재/전문서적>사회과학계열>사회복지학,9788999409745,,,1343,BOOK
4차 산업 미국 주식에 투자하라 - 해외 주식투자로 부를 축적하는 가장 확실한 방법,조용준 (지은이),174,국내도서>경제경영>재테크/투자>주식/펀드,9791160075199,국내 최고의 투자 전문가인 저자가 방대한 데이터 분석을 기반으로 정리한 4차 산업 1등 주식 투자 가이드북이다. 진정한 가치투자를 원하는 이들에게 소중한 인사이트를 선사할 것이다.,,313,BOOK
특수교육학개론 (강영심 외) - 다양한 학습자와 함께하는 통합교육,강영심 (지은이),8437,국내도서>대학교재/전문서적>사범계열>특수교육학,9788999719035,,,1101,BOOK
예비 영유아교사를 위한 놀이지도 - 개정판,"남효순, 신지혜, 전선영 (지은이)",8435,국내도서>대학교재/전문서적>사범계열>유아교육학,9791187971979,놀이하는 인간으로서의 삶은 영유아기뿐만이 아닌 전 생애에 걸쳐서 중요하다고 할 수 있다. 함께 놀이하는 즐거움을 느낄 수 있게 해 주는 것은 우리 아이들의 밝고 건전한 미래사회를 위해 반드시 필요하다.,,411,BOOK
유아문학교육 (강재희 외),"강재희, 길효정, 장민영 (지은이)",8435,국내도서>대학교재/전문서적>사범계열>유아교육학,9791161055107,,,437,BOOK
슈퍼 토끼,유설화 (지은이),35134,국내도서>유아>그림책>나라별 그림책>한국 그림책,9791158361839,그림책이 참 좋아 68권. 그림책 &lt;슈퍼 거북&gt;을 읽은 어린이들이 가장 많이 하는 질문 중 하나가 바로 “그럼 토끼는 어떻게 됐어요?”라고 한다. 유설화 작가의 &lt;슈퍼 토끼&gt;는 그 질문에 답하는 그림책이다.,,8903,BOOK
"신기하게 영어 뇌가 만들어지는 영문법 - 12만 유튜버 지후쌤의, 원어민의 머릿속을 다 보여드립니다",주지후 (지은이),49834,국내도서>외국어>영문법,9788962818444,"원어민들이 어떻게 영어의 원리를 이해하고 사용하는지 그들의 시각에서 본 영어의 '결'을 쉽게 풀어놓았다. '원래 그래서 그런거야' 라는 책임감 없는 교육이 아닌, 원어민들만 이해할 수 있는 미묘하고 디테일한 영어의 원리를 완전히 해부해준다.",,6306,BOOK
혼자 공부하는 자바 - JAVA 8 & 11 지원 / 무료 동영상 강의 제공,신용권 (지은이),2502,국내도서>컴퓨터/모바일>프로그래밍 언어>자바,9791162241875,"독학으로 자바를 배우는 입문자가 ‘꼭 필요한 내용을 제대로’ 학습할 수 있도록 구성했다. ‘무엇을’ ‘어떻게’ 학습해야 할지 조차 모르는 입문자의 막연한 마음을 살펴, 과외 선생님이 알려주듯 친절하게, 그러나 핵심적인 내용만 콕콕 집어준다.",,4267,BOOK
날씨의 아이 2 - 코믹스,"신카이 마코토 (원작), 쿠보타 와타루 (만화)",3743,국내도서>만화>순정만화>틴에이지 순정,9791136242303,"고등학교 1학년 여름. 섬에서 가출을 해 도쿄로 나온 소년, 호다카는 의지할 사람도 없이 소모되는 듯한 나날을 보내고 있었다. 어느 날, 지친 상태로 들어간 패스트푸드점에서 한 명의 소녀, 히나를 만난다. 신비한 능력을 가진 히나를 만난 호다카의 생활은 급변한다.",,1017,BOOK
2021 해커스공무원 이중석 맵핑 한국사 올인원 블랭크노트 - 9급ㅣ경찰ㅣ소방 시험 대비ㅣ공무원 한국사 무료 동영상강의.학습자료.폰 안에 쏙! 블랭크노트 정답 제공,"이중석, 해커스 공무원시험연구소 (지은이)",34630,국내도서>수험서/자격증>공무원 수험서>7/9급 공무원>한국사>강의노트/기타,9791164544820,"해커스공무원 한국사 1위, 이중석 선생님의 맵핑 한국사 ALL-IN-ONE 이론 수업을 모두 담았다. '맵핑 학습법'으로 시대/사건에 대한 쉽고 빠른 이해와 한국사 전체 흐름의 '구조화/도식화'가 가능하며, 빈칸 구성을 통해 핵심 내용을 효과적으로 암기하고, 학습한 내용을 꼼꼼하게 확인할 수 있다.",,2057,BOOK
킹덤 Kingdom 58,하라 야스히사 (지은이),3751,국내도서>만화>대하/서사만화,9791136241542,춘추전국시대라는 혼란기를 배경으로 비천한 고아 소년이 진시황을 이용하여 권력을 잡게 되는 과정이 독자들의 흥미를 불러 일으키는 작품이다.,,797,BOOK
여주인공의 오빠를 지키는 방법 1~4 세트 - 전4권 - 완결,킨 (지은이),51125,국내도서>소설/시/희곡>로맨스소설>한국 로맨스소설,9791165094126,"킨 장편소설. 어쩌다 보니 19금 역하렘 피폐 소설에 빙의했다. 문제는 악역 서브남의 누나, 록사나 아그리체가 되었다는 건데…… 망할 아버지가 기어이 여주인공의 오빠를 납치해 왔다.",,484,BOOK
New 다락원 다이나믹 일본어 Step 1 (책 + QR코드 다운로드) - 일본어 기초 다지기,"오현정, 하스이케 이즈미, 박행자, 아이자와 유카, 박준효 (지은이), 전형식 (감수)",49890,국내도서>외국어>일본어>일본어 회화,9788927710400,"2006년 출간된 강의용 교재 「다이나믹 일본어 시리즈(4권 구성)」의 개정판 「New 다이나믹 일본어 시리즈」 1단계 도서. Step 1, 2에는 별도로 교사용 지도서도 제작하여 강의에 도움이 되도록 하였다. 총 16과로 구성된 이 책의 1~2과는 일본어 문자와 발음이, 3~16과는 입문자가 알아야 할 기초 문법과 문형으로 구성된 회화 학습이 담겨 있다. 학습 포인트, 회화 1~2, 새로 나온 단어, 문법 알기, 구문 연습, 회화 연습, 둘러보기로 구성되어 있다.",,8105,BOOK
심리검사의 이해 - 제3판,최정윤 (지은이),8328,국내도서>대학교재/전문서적>인문계열>심리학,9788968666957,"임상심리학의 핵심을 이루고 있는 심리검사에 대한 전반적인 이해와 함께, 임상현장에서의 실제적인 적용에 초점을 두고 쓰여졌다. 실제 임상 현장에서 쓰이고 있는 검사 총집(Battery)을 중심으로, 역사 및 이론적 배경, 실시, 해석에 관한 실용적인 자료들을 제시하고 있는 것이 특징이다.",,8383,BOOK
독서교육론 - 2015 개정 교육과정을 담은,"김주환, 서혁, 박영민, 최숙기, 이순영 (지은이)",8420,국내도서>대학교재/전문서적>사범계열>교육공학/수업설계,9791185617558,"사회평론 교육 총서 15권. 변화하는 문식 환경에 조응하는 독서교육 개론서이다. 독서를 지도하거나 독서교육에 관심이 있는 이들이 적절한 지식을 습득하고 교육 실행을 준비할 수 있도록 기획되었으며, 학부 학생들도 쉽게 이해할 수 있도록 집필되었다.",,4368,BOOK
교육의 사회학적 이해 - 5판,김천기 (지은이),8416,국내도서>대학교재/전문서적>사범계열>교육사회/심리학,9788999716553,,,856,BOOK
"사고와 표현 - 생각의 힘, 표현의 즐거움","김중철, 서정미, 이승규, 한명숙 (지은이)",8291,국내도서>대학교재/전문서적>어문학계열>국어국문학>국어학개론/정서법,9788968176050,인간이 기본적으로 갖추어야 하는 사고와 표현의 소양에 관한 것이다. 특히 대학생들이 사고력과 표현력을 익힐 수 있도록 하는 데 도움을 주고자 하였다. 특정한 전공을 넘어서 교양인으로서 대학생이라면 갖추고 있어야 하는 사고의 힘과 표현의 능력을 함양할 수 있도록 하는 데 목적을 두었다.,,387,BOOK
"컴퓨터 활용과 실습 2016 - 컴퓨터 기초, 한글 2018, 엑셀 2016, 파워포인트 2016",김주영 (지은이),2608,국내도서>컴퓨터/모바일>오피스(엑셀/파워포인트)>한글(한글과컴퓨터),9791156644507,"컴퓨터 일반과 윈도우 10, 한글 2018, 엑셀 2016, 파워포인트 2016으로 구성되어 있다. 쉽고 다양한 예제, 학습한 내용을 정리하고 부가 기능까지 실습할 수 있는 종합예제와 연습문제로 컴퓨터 활용 기본기를 다질 수 있다.",,993,BOOK
초역 다빈치 노트 - 역사상 가장 비범한 인간의 7가지 생각 도구,"사쿠라가와 다빈치 (지은이), 김윤경 (옮긴이)",70216,국내도서>자기계발>성공>성공학,9788947546225,"레오나르도가 남긴 노트에서 저자가 가려 뽑은 71가지 글귀들을 중심으로 현대인의 성장에 필요한 다양한 조언을 건넨다. 평범함에서 벗어나 내 안의 숨겨진 특별함을 발견하고 싶다면, 이 책에 담긴 다빈치의 조언과 메시지가 그 가이드가 되어줄 것이다.",,420,BOOK
교양 노동법 - 제2판,한국노동법학회 (지은이),48219,국내도서>대학교재/전문서적>법학계열>노동법,9791185994543,"2015년 12월 한국노동법학회를 중심으로 『교양노동법』을 출간하였다. 그 사이 근로기준법 등 노동관계 법령들의 개정이 있었고, 새로운 판례들도 많이 나왔다. 이번 개정판에서는 새로운 법령과 판례를 반영하고, 강의를 하면서 메모해 두었던 개선사항들을 반영하였다.",,694,BOOK
Mano의 컴퓨터시스템구조 - 3판,"M.Morris Mano (지은이), 김종상 (옮긴이)",2721,국내도서>컴퓨터/모바일>컴퓨터 공학>컴퓨터공학/전산학 개론,9791195444977,,,1674,BOOK
인간행동과 사회환경 (손병덕 외) - 2판,"손병덕, 백은령, 최인화, 성문주, 이은미, 정정호, 송현아 (지은이)",8340,국내도서>대학교재/전문서적>사회과학계열>사회복지학,9788999713279,,,774,BOOK
하루 한 장 아이패드 드로잉 - 일러스트레이터 보담의 디지털 감성 드로잉 클래스,보담(김보람) (지은이),50987,국내도서>예술/대중문화>미술>미술 실기,9791158463366,"다음웹툰에 ‘옥탑빵’을 연재하며 몽글몽글하고 따뜻한 삽화로 우리에게 친숙한 인기 작가 보담의 아이패드 드로잉북이다. 고민 끝에 산 소중한 물건, 재방문하고 싶은 여행지 등 다채로운 그림을 그릴 수 있게 돕는다.",,1280,BOOK
마르크스의 생명정치학 - 푸코와 함께 마르크스를,"자크 비데 (지은이), 배세진 (옮긴이)",51456,국내도서>인문학>서양철학>마르크스주의,9791190422390,2016년 프랑스에서 전개된 ‘노동법 개악 투쟁’이라는 정세 속에서 마치 팸플릿처럼 간결하고 신속하게 집필되었다. 이 책의 강력한 참조점이 된 노동법을 둘러싼 일련의 투쟁은 프랑스 좌파 정치세력이 신자유주의의 원리를 본격적으로 채택하기 시작한 맥락과 밀접한 연관을 맺고 있다.,,773,BOOK
마이너리티 이재명 - 당연한 게 당연하지 않습니다,김용민 (지은이),51233,국내도서>사회과학>정치학/외교학/행정학>정치학 일반,9791190927468,김용민이 왜 이재명 대통령 시대를 갈망하는지를 다룬 책이다. 이재명에 대한 호불호에서 판단이 멈춰 있는 이들에게 그를 더 세밀하고 객관적으로 볼 수 있는 작은 관문이 되기를 바란다.,,553,BOOK
보육과정 (장현주 외) - 제4판,장현주 (지은이),8435,국내도서>대학교재/전문서적>사범계열>유아교육학,9791161055435,,,150,BOOK
사료로 읽는 우리 역사,홍성화 (지은이),8521,국내도서>대학교재/전문서적>인문계열>언어학,9788971077528,,,423,BOOK
"유닉스 이론과 실습 - 기본 기능부터 명령어 사용법까지, 3판","이종원, 윤소정 (지은이)",2766,국내도서>컴퓨터/모바일>OS/Networking>유닉스,9791156644637,"유닉스나 리눅스에 대한 기본 지식을 배우고자 하는 컴퓨터 관련 학과의 학부생을 대상으로 집필된 교재다. 유닉스 입문에 꼭 필요한 기본 기능과 명령의 사용 방법을 예제와 함께 자세히 설명하기 때문에 유닉스 강의 교재로 적합하며, 독학용으로도 활용할 수 있다.",,1374,BOOK
"건축구조학 - 디자인에서 시공까지, 제3판",고만영 (지은이),8495,국내도서>대학교재/전문서적>공학계열>건축공학>건축설계,9788982255076,,,271,BOOK
싫은 채로 있게 해줘 2 - 뉴 루비코믹스 2505,히지키 (지은이),6130,국내도서>만화>순정만화>그 남자들의 사랑,9788927084761,"오메가라서 다행이야, 오메가라서 지금이 행복해. 귀여운 딸 시즈쿠에 이어 둘째 미나토가 태어나 가족과 다름없이 살아가는 나오토와 하즈키. 과거의 상처를 포용해준 상대와의 짝 관계에 행복을 느끼는 나오토였지만, 트라우마의 원흉이었던 알파와의 재회가 평온한 생활에 그림자를 드리운다.",,641,BOOK
세계사를 바꾼 15번의 무역전쟁 - 춘추전국시대부터 팍스 아메리카나까지,"자오타오, 류후이 (지은이), 박찬철 (옮긴이)",169,국내도서>역사>세계사 일반,9791190908719,"춘추전국시대 제나라 환공을 패자로 만든 관중의 화폐전쟁, 대항해시대의 막을 연 유럽 국가들의 향료전쟁, 20세기 세계대전의 방아쇠를 당긴 관세전쟁, 21세기 전 세계의 공장을 멈추게 한 미국과 유럽의 철강전쟁 등을 흥미진진하게 설명한다.",,1172,BOOK
서찰을 전하는 아이,"한윤섭 (지은이), 백대승 (그림), 전국초등사회교과모임 (감수)",48874,국내도서>어린이>동화/명작/고전>국내창작동화,9788971846643,"푸른숲 역사 동화 시리즈. &lt;봉주르, 뚜르&gt;로 문학동네어린이문학상을 수상한 작가 한윤섭의 첫 역사 동화. 동학 농민 운동으로 온 나라가 시끌시끌했던 1894년, 중요하고 비밀스러운 서찰을 전하기 위해 홀로 길을 떠난 열세 살 아이의 이야기를 담고 있다. 탄탄한 구성, 간결하고도 세련된 문체, 오묘한 분위기를 자아내는 장면 묘사로 어린이들의 시선을 강렬하게 잡아끈다.",,30704,BOOK
"아무튼, 여름 - 내가 그리워한 건 여름이 아니라 여름의 나였다",김신회 (지은이),51371,국내도서>에세이>한국에세이,9791188343317,"&lt;보노보노처럼 살다니 다행이야&gt; &lt;아무것도 안 해도 아무렇지 않구나&gt; 등으로 많은 독자의 공감을 불러일으킨 김신회 작가의 신작으로, 1년 내내 여름만 기다리며 사는 그가 마치 여름에게 보내는 러브레터처럼 때로는 수줍게 때로는 뜨겁게 써내려간 스물두 편의 에세이가 실려 있다.",,11580,BOOK
세계를 건너 너에게 갈게 - 제8회 문학동네청소년문학상 대상 수상작,이꽃님 (지은이),50759,국내도서>청소년>청소년 문학>청소년 소설,9788954650212,"제8회 문학동네청소년문학상 대상 수상작. 서로 다른 시간을 살아가는 두 은유가 편지를 주고받으면서 벌어지는 이야기로, 2016년의 은유가 1년을 살아가는 동안 1982년의 은유는 20년의 세월을 살아간다.",,60776,BOOK
부의 본능 - 슈퍼리치가 되는 9가지 방법,브라운스톤 (지은이),2225,국내도서>경제경영>재테크/투자>재테크/투자 일반,9791187444282,"우리 안에는 부자 되는 걸 방해하는 아홉 가지 심리적 장해물이 있다. 무리 짓는 본능, 영토 본능, 쾌락 본능, 근시안적 본능, 손실공포 본능, 과시 본능, 도사 환상, 마녀 환상, 인식체계의 오류 등 원시시대부터 유전자에 식재되어 있는 본능이 그 원흉이다. 이 책은 그 아홉 가지 내면의 장해물의 속성과 이를 극복하는 실전 투자법을 제시한다.",,5486,BOOK
어쩌다 정신과 의사 - 뇌부자들 김지용의 은밀하고 솔직한 진짜 정신과 이야기,김지용 (지은이),51514,국내도서>인문학>심리학/정신분석학>교양 심리학,9791156758334,"뇌부자들을 탄생시킨 정신과 전문의 김지용이 그동안 베일에 쌓여 있던 진짜 정신과 이야기를 들려준다. 공부는 잘하지만 뭘 해야 할지 막막했던 청년이, 진짜 정신과 의사가 되기까지 10년간 겪은 좌충우돌 이야기가 촘촘하게 실려 있다.",,2101,BOOK
이제 아픈 구두는 신지 않는다,"마스다 미리 (지은이), 오연정 (옮긴이)",51373,국내도서>에세이>외국에세이,9791190582339,"마스다 미리는 평범한 일상을 정중하게 그리는 작가이다. 과장도 허세도 없이, 있는 그대로의 품성을 드러내는 '어른'이다. 그런 마스다 미리가 이번 에세이 &lt;이제 아픈 구두는 신지 않는다&gt;에서 40대의 일상과 마음을 솔직담백하게 이야기한다.",,1124,BOOK
국어사개설 - 신정판,이기문 (지은이),8292,국내도서>대학교재/전문서적>어문학계열>국어국문학>국어사/방언론,9788976263728,"국어의 계통과 형성, 문자체계를 먼저 살피고 이어 고대국어, 전기 중세국어와 후기 중세국어, 근대국어, 현대국어에 이르기까지 국어의 역사를 시대별로 나눠 설명한 개론서이다.",,5758,BOOK
