title,author,genre_id,genre,ISBN,description_aladin,description_naver,salesPoint,mallType
"2019 에듀윌 공인중개사 부동산공법 체계도 (스프링) - 2019 공인중개사 2차 시험, 제30회 공인중개사 시험, 부동산공법 체계도, 공인중개사 판매 1위",김희상 (지은이),34692,국내도서>수험서/자격증>공인중개사/주택관리사>공인중개사 2차,9791159499050,"시험에 자주 출제되는 이론 위주로 정리하고, [파트 1] 이해편의 체계도 -&gt; 핵심정리 / [파트 2] 암기편의 빈칸체계도 -&gt; 기출ox 문제 -&gt; 마무리 암기노트로 이어지는 구성을 통해 공법 이론을 완벽 정리할 수 있도록 하였다.",,1517,BOOK
지금까지 산 것처럼 앞으로도 살 건가요? - 내 인생의 판을 바꿀 질문,김창옥 (지은이),70216,국내도서>자기계발>성공>성공학,9791196588502,대한민국 대표강사 김창옥의 셀프 혁명 지침서. 이 책은 삶을 진단하는 명료한 질문 하나로 시작한다. “지금까지 산 것처럼 앞으로도 살 건가요?” 저자가 자문하며 얻은 삶의 통찰과 스스로 변화를 위해 시도했던 다양한 삶의 기술을 전한다.,"나다운 삶을 살고자 분투하는 이들에게 전하는 인생의 길잡이!

유튜브 누적뷰 8천만 기록, tvN 《어쩌다 어른》, CBS 《세상을 바꾸는 시간, 15분》 등을 통해 많은 이를 긍정적 변화로 이끈 힐링 퍼포먼스의 일인자 김창옥의 핵심 강의 『지금까지 산 것처럼 앞으로도 살 건가요?』. 그동안 변화와 소통을 주제로 강연하며 변화의 메시지를 전달해온 저자는 이 책을 통해 인생의 돌부리에 걸려 자꾸 넘어지는 것 같은 이들에게, 주체적으로 삶을 살고자 하는 이들에게, 참된 나를 찾길 원하는 이들에게 인생의 새로운 페이지를 열어준다.

이 책에서 우리는 삶의 중심을 나로 세우는 4단계 셀프 혁명을 만나볼 수 있다. 내면의 목소리에 귀 기울이는 ‘셀프텔러’, 나 자신을 먼저 돌보는 ‘셀프케어’, 있는 그대로의 나를 존중하고 사랑하는 ‘셀프이스팀’, 진정한 어른으로 성장하는 ‘셀프디벨롭먼트’까지 4단계로 나누어진 삶의 변화를 살펴볼 수 있다.

각 에피소드에는 삶의 변화와 성장을 더 확실하게 이끌어주는 ‘변화를 위한 작은 제안’이 담겨있다. 가치우선순위표 작성, 산책의 효과와 방법, 심신을 안정시키는 심리요법, 번아웃 증후군 체크리스트, 안티 대처법, 가볍게 시도해볼 수 있는 취미 목록 등 독자가 직접 적용하고 시도해볼 수 있는 삶의 기술들을 전수해 나를 인지하고, 인정하고, 사랑하고, 성숙하는 단계를 차례차례 경험하며 좋은 삶의 기준을 다시 세워갈 수 있도록 도와준다.",3845,BOOK
"초등 3학년 늘어난 교과 공부, 어휘력으로 잡아라 - 두 배로 늘어난 교과서, 어휘 충격에 빠진 아이를 위한 과목별 공부법!",송재환 (지은이),51764,국내도서>좋은부모>초등 자녀,9791189125493,"초등 3학년부터는 아이가 공부해야 할 교과가 1, 2학년 때에 비해 두 배로 늘어난다. 그렇다면 늘어난 교과를 공부할 때 아이에게 가장 필요한 것은 무엇일까? 저자는 3학년 공부법의 핵심은 ‘어휘력’에 있다고 말한다. 이 책은 3학년 교과 과정을 꼼꼼하게 분석하면서, 공부 실력을 키우기 위한 어휘력 향상의 구체적인 노하우를 알려준다.","교과 양이 폭발적으로 증가하는 초등 3학년 
“공부력의 차이는 초등 3학년 때 다진 어휘력에서 결정된다!”

초등 3학년부터는 아이가 공부해야 할 교과가 1, 2학년 때에 비해 두 배로 늘어난다. 이에 부모들은 ‘늘어난 교과 과목을 우리 아이가 잘 따라갈 수 있을까?’ 하는 불안감이 생기게 된다. 그렇다면 늘어난 교과를 공부할 때 아이에게 가장 필요한 것은 무엇일까? 베스트셀러 저자이자 수많은 학부모들의 뜨거운 지지를 받고 있는 초등공부법의 대가, 송재환 선생님은 3학년 공부법의 핵심은 ‘어휘력’에 있다고 말한다. 이 책은 3학년 교과 과정을 꼼꼼하게 분석하면서, 공부 실력을 키우기 위한 어휘력 향상의 구체적인 노하우를 알려줄 것이다.",1223,BOOK
손가락 문어,"구세 사나에 (지은이), 이기웅 (옮긴이)",35139,국내도서>유아>그림책>나라별 그림책>일본,9788955822892,손가락 빠는 버릇이 있는 아이가 손가락 문어가 나타나자 자신의 의지로 습관을 고치는 이야기를 담은 그림책이다. 흔히 있는 습관을 고치는 과정에서 자존감이 높아지는 아이의 모습을 잘 보여주는 작품이다.,"『손가락 문어』는 손가락 빠는 버릇이 있는 아이가 손가락 문어가 나타나자 자신의 의지로 습관을 고치는 이야기입니다. 손가락을 자꾸 빨면, 손가락 문어가 점점 커질 거고, 엄청나게 커진 손가락 문어 때문에 집 밖으로 나갈 수 없을 것이라는 생각에 아이는 손가락을 빨지 않습니다. 이 책을 통해 스스로 무언가를 해낸 아이는 자존감이 높아지고, 경험이 쌓이면서 어떤 일에든 자신감이 생길 수 있음을 자연스럽게 느낍니다.",7868,BOOK
카구야 님은 고백받고 싶어 1 - ~ 천재들의 연애 두뇌전 ~,아카사카 아카 (지은이),3742,국내도서>만화>순정만화>레이디스 코믹,9791125668909,"똑똑한데다 외모 또한 발군인 두 명의 고등학생 남녀가 있다. 둘은 서로를 좋아하지만 자존심이 드높은 탓에, 먼저 고백받기 위한 두뇌 싸움을 벌이기 시작한다. 하지만 허점투성이의 그들은 매번 삽질만 하고. 과연, 이 밀당 싸움의 최종 승자는 누구인가?","""연애는 먼저 고백하는 사람이 지는 게임이다!""
집안도 성품도 좋다! 장래가 촉망되는 수재들이 모이는 슈치인 학원!! 그 학생회에서 만난 부회장 시노미야 카구야와 회장 시로가네 미유키는 서로가 서로에게 끌리면서도 아무 일도 없이 반년이 경과!! 드높은 자존심 탓에 솔직해지지 못하는 두 사람은 골치 아프게도 '어떻게 상대가 고백하게 만드냐'만 생각하게 되어 버렸다?! 연애는 청취할 때까지가 즐거운 법!! 
신감각 천재들의 고백받기 '두뇌전'러브코미디,개전!!",1719,BOOK
"영어의 힘 - 수많은 경쟁과 위협, 몰락의 순간에서 세계 최고의 히트상품이 되기까지","멜빈 브래그 (지은이), 김명숙, 문안나 (옮긴이)",51542,국내도서>인문학>기호학/언어학>언어학/언어사,9788993178869,영국 BBC 방송국에서 30년 이상 프로듀서로 일하면서 영어에 관한 다양한 교양 프로그램을 제작해온 저자가 겨우 15만 명이 쓰던 게르만어의 방언에 불과했던 영어가 어떻게 세계를 정복해 현재 가장 막강한 영향력을 발휘하는 세계어로 성장할 수 있었는지 그 이유를 추적한 책이다.,"전 세계를 누빈 영어의 파란만장 일대기!

겨우 15만 명이 쓰던 게르만어의 방언에 불과했던 영어가 어떻게 세계를 정복해 현재 가장 막강한 영향력을 발휘하는 세계어로 성장할 수 있었는지 그 이유를 추적한 『영어의 힘』. 영국 BBC 방송국에서 30년 이상 프로듀서로 일하면서 영어에 관한 다양한 교양 프로그램을 제작해온 저자가 5세기부터 21세기 현재까지 세계사의 흐름과 함께 영어라는 언어가 헤쳐 온 길을 모험과 성장 스토리 구조로 설명하면서 영어의 힘은 과연 어디서 나오는지 살펴본다.  

영어의 고향인 잉글랜드에서 시작해 영국, 스코틀랜드, 미국의 동부, 서부, 남부, 오스트레일리아, 인도, 싱가포르, 서인도제도까지 영어를 모국어 또는 제2외국어로 사용하는 방대한 지역을 다루면서, 영어가 어떻게 경제와 시장의 언어로 발전해 왔는지, 흑인영어는 어떻게 젊은이들을 사로잡았는지, 왜 지금의 세대는 I LOVE YOU 대신 i luv u를 더 선호하는지 등 1,500년에 걸친 방대한 세계사 속에서 영어가 겪어온 변천과 발전과정을 자세하게 정리했다.",1243,BOOK
로호의 배경 일러스트 메이킹 - 영화/게임/웹툰/애니메이션의 컨셉 아트를 위한,고아라 (지은이),2756,국내도서>컴퓨터/모바일>프로그래밍 개발/방법론>게임 프로그래밍,9788956748252,"영화, 게임, 웹툰, 만화, 애니메이션 등을 완성하기 위해 없어서는 안 될 배경 일러스트만을 다룬다. 프로 디자이너들이 하는 작업 방식 그대로 구성하여 실무 배경 일러스트에 필요한 기획, 구상, 구도, 드로잉, 색감 등을 맛볼 수 있다.","배경 일러스트레이터로서의 시작.
 프로페셔널 컨셉 아트 디자이너로 가는 길,
『로호의 배경 일러스트 메이킹』이 쉽게 알려드립니다!!

영화, 게임, 웹툰, 만화, 애니메이션 등을 완성하기 위해 없어서는 안 될 배경 일러스트만을 다룬 책입니다. 이 책은 오랜 시간 연구와 노력으로 배경 일러스트레이터를 꿈꾸는 디자이너들에게 자기주도 학습이 가능하도록 만들었습니다. 또한, 단순히 작가의 작품을 감상하는 것에 그치지 않고 초보 디자이너들에게 필요한 사물을 제대로 그리는 방법부터 시작하여 배경 전체의 구도, 구성, 색감을 선정하는 방법 및 작품을 완성해 나가는 방법을 담았습니다.",5201,BOOK
2019 Minto 경찰학개론 핵심요약집 - 수정판,김민철 (지은이),140201,국내도서>수험서/자격증>공무원 수험서>경찰공무원(승진)>경찰학개론,9791155026380,"최신 개정법령을 모두 반영한 교재다. 최근 기출경향을 완벽 분석하여 출제 파트에 집중하여 핵심정리를 실었다. 출제 유형과 가장 유사한 지문으로 핵심정리를 하였고, 출제 가능성 높은 핵심법령을 수록하였다. 최소의 양으로 최대의 효과를 위해 분량을 최적화하였다.",,483,BOOK
"직장이 없는 시대가 온다 - 경제적 자유인가, 아니면 불안한 미래인가","새라 케슬러 (지은이), 김고명 (옮긴이)",3060,국내도서>경제경영>경제학/경제일반>경제사/경제전망>세계 경제사/경제전망,9791160507171,"우버 택시운전사 겸 웨이터, 뉴욕에서 정규직장을 그만두고 긱스터에 합류한 잘나가는 프로그래머, 아마존이 만든 인력중개 플랫폼을 통해 소득을 버는 캐나다의 워킹맘 등 다양한 인물들을 좇으며 이미 우리 앞에 펼쳐진 미래를 세밀하게 그려낸다.","직장이 없어지는 시대, 실리콘밸리가 새롭게 만들어낸 ‘긱 경제’를 선택한 사람들의 이야기!

프리랜서, 독립계약자, 임시직 등의 대안적 근로 형태를 일컫는 ‘긱 경제(gig economy)’의  가능성과 위험성을 동시에 조망하는 『직장이 없는 시대가 온다』. 일의 의미와 형태가 변화하면서 정규직과 풀타임 일자리가 점점 사라져 가는 지금 미국 노동자 3명 중 1명은 프리랜서로 살아가고 있다. 이에 발맞춰 긱 경제 역시 가파르게 성장하고 있는데, 이 같은 변화가 노동시장과 자본시장에 끼치는 영향은 무엇이고, 각계각층의 노동자와 구직자가 직면한 도전은 무엇일까?

전 세계에서 가장 주목받는 미디어 스타트업인 ‘쿼츠(Quartz)’의 부편집장으로, 오랫동안 일의 미래를 파헤쳐온 저자는 실제로 긱 경제를 체험하고 있는 다섯 명의 이야기를 우리에게 들려준다. 캔자스시티의 우버 택시운전사 겸 웨이터, 뉴욕에서 정직원 생활을 그만두고 긱스터에 합류한 잘나가는 프로그래머, 메커니컬터크를 통해 소득을 벌어들이는 캐나다의 워킹맘, 프리랜서로 지역 경제를 되살리겠다는 아칸소주 자선활동가 등 다양한 인물들의 발자취를 좇으며 이미 우리 앞에 펼쳐진 미래를 세밀하게 그려간다. 

긱 경제는 많은 사람의 삶에 영향을 미쳤다. 그중에는 부유한 사람도 있고 가난한 사람도 있었고, 힘 있는 사람도 있고 힘없는 사람도 있었다. 또 이것은 누군가에겐 자유와 유연성, 경제적 이익이 보장되는 삶이었고, 누군가에게는 실업에 대한 차악의 선택일 뿐이었다. 저자는 긱 경제를 체험 중인 사람들이 일하는 현장과 경제 전문가들을 취재하며 지금 우리가 맞닥뜨린 중대한 질문에 대한 답을 찾아나가고, 직업의 종말과 일의 미래에 대해 함께 생각해본다.",2970,BOOK
행정법 핸드북 - 제8판,정선균 (지은이),34791,국내도서>수험서/자격증>인문/사회/법(고등고시)>변호사시험>행정법,9791161800950,"내용이 새롭게 추가된 부분은 다음과 같다. [이른바 이중배상의 금지, 법인과 외국인의 원고적격, 감사원, 공무원의 재산상 권리], 내용이 변경되거나 보완된 부분은 다음과 같다. [행정제재사유의 승계, 구성요건적 효력과 선결문제, 하자의 승계, 이행강제금 등]",,838,BOOK
"괴롭히지 말아요, 나가토로 양 1 - S코믹스","나나시 (지은이), 김현주 (옮긴이)",3742,국내도서>만화>순정만화>레이디스 코믹,9791163893592,"어느 날 방과 후, 가끔씩 들르는 도서실에서 슈퍼 “사디스트”인 후배에게 눈에 띄어버렸다! 선배를 건드리고, 괴롭히고, 즐기는 그녀의 이름은 『나가토로 양』! 밉지만 사랑스럽다. 괴롭지만 곁에 있고 싶다. 당신 속에 잠들어 있는 무언가가 각성하는 “사디스트 데레 소녀”의 이야기.","[최강인 “사디스트 데레 소녀”가 나타나다!!!] 괴롭히고, 당황하고, 또 괴롭힌다! “후배 여자애 때문에 울었어……!!” 어느 날 방과 후, 가끔씩 들르는 도서실에서 슈퍼 “사디스트”인 후배에게 눈에 띄어버렸다! 선배를 건드리고, 괴롭히고, 즐기는 그녀의 이름은 『나가토로 양』! 밉지만 사랑스럽다. 괴롭지만 곁에 있고 싶다. 당신 속에 잠들어 있는 무언가가 각성하는 “사디스트 데레 소녀”의 이야기.",1332,BOOK
을들의 당나귀 귀 - 페미니스트를 위한 대중문화 실전 가이드,"손희정, 최지은, 허윤, 심혜경, 오수경, 오혜진, 김주희, 조혜영, 최태섭 (지은이), 한국여성노동자회, 손희정, 임윤옥, 김지혜 (기획)",51330,국내도서>사회과학>여성학/젠더>여성문화,9788964373224,"TV 예능, 드라마, 케이팝, 영화, 소설, 게임, 인터넷 커뮤니티 등의 다종다양한 분야를 가로지르며, 최근 우리의 ‘귀’를 쫑긋거리게 한 미디어와 대중문화 속 ‘성평등’ 이슈를 관통하는 중요한 메커니즘을 캐낸다. 
","한국여성노동자회(한국여노)의 임윤옥, 김지혜 활동가와 페미니스트 문화연구자 손희정이 여러 대중문화 연구자들을 만나 대담한 동명의 팟캐스트를 바탕으로 만들어졌다. TV 예능, 드라마, 케이팝, 영화, 소설, 게임, 인터넷 커뮤니티 등의 다종다양한 분야를 가로지르며, 최근 우리의 ‘귀’를 쫑긋거리게 한 미디어와 대중문화 속 ‘성평등’ 이슈를 관통하는 중요한 메커니즘을 캐낸다.",891,BOOK
금융일반상식,서울커리어아카데미SCA 취달청 (지은이),52279,국내도서>수험서/자격증>취업/상식/적성>공사 공단 수험서>기타,9788940635803,"금융회사와 금융공기업에 입사하기를 희망하는 취업준비생들에게 도움을 주고자 발간되었다. 금융 상식과 다양한 정책 이슈 중에서 핵심적인 주제를 다루었다. 상식시험, 논술 약술 시험과 면접 준비에 필요한 개념 정리로 활용될 수 있도록 정리하였다.",,1075,BOOK
"2019 퍼펙트 무역영어 1급 - 개정 14판, 무역영어 2급 동시 대비, 이론 + 기출문제,
        최신기출해설 6회분과 적중모의고사 2회분 수록, 파트별 체크포인트와 오답노트",김현수 (지은이),35977,국내도서>수험서/자격증>무역영어/관세사/국제무역사>무역영어,9791159792625,"변화된 무역영어시험의 출제패턴을 완벽하게 반영하여 단기간에 시험준비를 할 수 있도록 구성되었다. 무역의 단계별, 조건별로 충분한 해설과 예상문제를 제시하여 시험에 대비할 수 있도록 하였다.",,702,BOOK
2019 시나공 Summary 정보처리산업기사 필기 - 핵심요약 + 기출문제 15회 + '기억상자' 프로그램 + 기출CBT + 동영상 강의,"길벗 R&D, 강윤석, 김용갑, 김우경, 김종일 (지은이)",7014,국내도서>컴퓨터/모바일>활용능력>정보처리산업기사,9791160505429,"합격에 꼭 필요한 핵심 개념 233개와 이론이 어떻게 문제로 출제되는지 확인할 수 있도록 ‘핵심’과 관련하여 출제된 모든 문제를 단답형 또는 O, X 등으로 변형하여 수록하였다.",,458,BOOK
교사119 이럴 땐 이렇게 - 교사에 의한 교사를 위한 교사 생존술,"송형호, 왕건환 (지은이)",51121,국내도서>사회과학>교육학>교육 일반,9791164250196,학교 현장에서 벌어지는 다양한 상황에서 교사가 당황하지 않고 대처할 수 있는 가이드를 주제별로 정리한 교사에 의한 교사를 위한 교사 생존술을 담은 책이다.,"위기의 교사 한 명 한 명을 일일이 구한다!
 위기의 교육현장을 구하는 집단지성의 적정기술

학교 현장에서 벌어지는 다양한 상황에서 교사가 당황하지 않고 대처할 수 있는 가이드를 주제별로 정리한 교사에 의한 교사를 위한 교사 생존술 『교사119 이럴 땐 이렇게』가 ㈜에듀니티에서 출간되었다. 송형호(교사컨설턴트, 전 영어 교사)와 왕건환(서울 경기고등학교 국어 교사)가 네이버 카페 을 통해 공유된 교직 노하우 10년의 이야기를 모아 50여 명의 편집진과 함께 정리했다. 처음 교단에 서는 신규교사에게 전하는 선배교사의 따뜻한 조언, 교육 현장에서 벌어지는 여러 위기 상황에서 교사가 당황하지 않고 교육적으로 풀어갈 수 있는 노하우를 상황별로 친절하게 안내한다. 출결 처리, NEIS 기록 등 교직 실무에서부터 학부모나 교사 간 소통법뿐만 아니라 학교폭력, 성 문제 등 민감한 사안까지 교사 입장에서 현실적인 타계책을 제시하면서 학교 현장의 중심에 선 교사의 다양한 목소리가 어우러지는 토론의 장이 활발해질 때 교육이 바로 설 수 있다는 메시지를 전하고 있다.",2355,BOOK
을의 철학 - 2019 청소년 교양도서 선정,송수진 (지은이),51440,국내도서>인문학>철학 일반>교양 철학,9791157843190,"힘내라는 위로보다, 좋은 사람이 되라는 자기계발서보다 나를 살게 했던 힘은 철학이다. 책에 등장하는 모든 사례는 저자의 실제 경험담이다.","나를 삶 앞으로 이끄는 철학의 힘!

2019 청소년 교양도서 선정

진짜 적은 따로 있는데 정작 서로를 견제하고 다툼에서 헤어나지 못하는 우리를 세상은 ‘을’이라 부른다. 알바에서 시작해 비정규직을 전전하는 삶, 식품 판촉 사원으로 길거리에서 시음을 권하고, 본사(갑)에서 파견한 영업 사원으로 점주(병)에게 밀어내기를 강권하고, 다니던 회사에서 푼푼이 모은 돈을 금융사기로 날려버린 을의 삶을 산 사람이 있다. 바로 저자의 이야기이다.

늘 답답한 가슴을 부여잡고 20대를 살았고, 30대가 되어서도 괴로운 일상을 보내야 했던 저자는 조용히 머물 곳이 필요해 막연하게 도서관을 찾았고, 그곳에서 철학과 만났다. 니체, 마르크스, 스피노자, 비트겐슈타인…. 그들이 겪은 고뇌를 온몸으로 체험하면서 어제와는 다른 삶이 있다는 것을 알아가게 됐고, 세상을 보는 나만의 관점을 가질 수 있었다. 

저자는 밥을 먹고 물을 마셔야 살 수 있는 것처럼 도서관에 박혀 마르크스를, 니체를, 알튀세르를, 들뢰즈를 읽어나갔다고 말하며, 그렇게 철학을 통해 느낀 해방감을 이야기한다. 스스로를 향한 검열과 증오를 멈추게 하는 것도, 나를 둘러싼 세상을 해석하고 나를 이해할 수 있게 하는 것도 결국 나의 철학이라는 것을 깨달은 저자는 독자들 역시 나를 나에게 이끄는 철학의 힘을 느낄 수 있기를 바라고 있다.",730,BOOK
너와 나의 1cm - 너를 안으며 나를 안는 방법에 관하여,"김은주 (지은이), 양현정 (그림)",51376,국내도서>에세이>사진/그림 에세이,9791189938635,사랑만큼 세계가 1cm 확장되는 경험이 있을까. 매일 1cm 더 행복해지는 마법 같은 순간들은 '너와 나의 1cm' 덕분에 가능해진다. 7개국 80만 독자들의 마음을 어루만졌던 '1cm' 시리즈의 김은주 작가가 4년 만에 허깅(Hugging) 에세이 &lt;너와 나의 1cm&gt;로 돌아왔다.,"매일 1cm 더 행복해지는 마법 같은 순간들!

7개국 80만 독자들의 마음을 어루만졌던 「1cm 시리즈」의 김은주 작가가 4년 만에 펴낸 허깅 에세이 『너와 나의 1cm』. 기존 「1cm 시리즈」가 무심코 지나칠 수 있는 일상 속에서 독자들의 생각이 1cm 더 깊어질 수 있도록 안내했다면, 이번 책은 더 나아가 인생과 사랑에 대한 한층 더 깊고 따뜻한 시선을 담아 1cm 더 사랑하는 만큼 1cm 더 행복해질 수 있는 방법들을 안내 한다.

저자는 행복이 가장 싫어하는 세 가지 단어가 ‘지금 말고 그때’, ‘이곳 말고 거기’, ‘당신 말고 그 사람’이라고 이야기하면서 현재 나를 둘러싼 상황 속에서 내 곁에 있는 사람과의 소중한 순간들을 놓치지 않는 일이 가장 중요하다고 이야기한다. 그러면서 사랑을 통해 자기 자신과 자신을 둘러싼 세상의 여러 가지 면을 이해하게 되고, 관계 속에서 어떻게 함께 해야 하는지, 어떻게 홀로 보내야 하는지 배워나가고 매일 1cm 더 행복해지는 순간들을 만들어갈 수 있다는 깨달음을 전한다.",587,BOOK
아무도 기억하지 못하는 장면들로 만들어진 필름,백은선 (지은이),51167,국내도서>소설/시/희곡>시>한국시,9788972759645,문학을 잇고 문학을 조명하는 &lt;현대문학 핀 시리즈&gt; 한국 시 문학의 절정을 보여줄 세 번째 컬렉션. 작품을 통해 작가를 충분히 조명한다는 취지로 월간 『현대문학』 2018년 7월호부터 12월호까지 작가 특집란을 통해 수록된 바 있는 여섯 시인의 시와 에세이를 여섯 권 소시집으로 묶었다.,"당대 한국 문학의 가장 현대적이면서도 첨예한 작가들과 함께하는
 시인선 VOL. Ⅲ 출간!

문학을 잇고 문학을 조명하는 
한국 시 문학의 절정을 보여줄 세 번째 컬렉션!

PIN 013 이제니 『있지도 않은 문장은 아름답고』
PIN 014 황유원 『이 왕관이 나는 마음에 드네』
PIN 015 안희연 『밤이라고 부르는 것들 속에는』
PIN 016 김상혁 『슬픔 비슷한 것은 눈물이 되지 않는 시간』
PIN 017 백은선 『아무도 기억하지 못하는 장면들로 만들어진 필름』
PIN 018 신용목 『나의 끝 거창』

현대문학의 새로운 한국 문학 시리즈인  시인선이 출범한 지 1년 만에 세 번째 컬렉션 『현대문학 핀 시리즈 VOL. Ⅲ』를 출간한다. 작품을 통해 작가를 충분히 조명한다는 취지로 월간 『현대문학』 2018년 7월호부터 12월호까지 작가 특집란을 통해 수록된 바 있는 여섯 시인―이제니, 황유원, 안희연, 김상혁, 백은선, 신용목―의 시와 에세이를 여섯 권 소시집으로 묶었다.

문학의 정곡을 찌르면서 동시에 문학과 독자를 이어주는 ‘핀’으로 자리매김한 새로운 형태의 소시집  시인선. 그 세 번째 컬렉션은 지금, 여기 한국 시 문학의 한복판에서 누구보다도 빛나는 존재감을 드러내고 있는 여섯 시인으로 꾸려졌다. 젊은 에너지와 각자의 개성을 무기로 한국 시 문학의 중심으로 진입하여 그 절정기를 이끌어가고 있는 선두주자들로서, 그들의 빼어난 저력을 확인해볼 수 있다는 점에서 더욱 특별한 컬렉션이다.

아티스트와의 컬래버레이션이라는 특색을 갖춰 이목을 집중시키는 핀 시리즈 시인선의 이번 시집의 표지 작품은 설치와 조각을 주로 하는 구현모 작가의 매혹적인 드로잉 작품들로 이루어졌다. 자연과 인공의 경계를 허물고 흐트러뜨린 아티스트의 작품세계를 엿볼 수 있는 아이디어 스케치들이 각각의 시집과 어우러져 독자들에게 끝없는 영감을 불러일으킨다.",2039,BOOK
