title,author,genre_id,genre,ISBN,description_aladin,description_naver,salesPoint,mallType
보통의 존재,이석원 (지은이),51371,국내도서>에세이>한국에세이,9788993928037,"이석원 산문집. 서른여덟, 무명의 작가 이석원이 마치 현미경을 통해 들여다보듯 정밀하게 잡아낸 보통 사람의 내면과 일상의 풍경을 가득 담았다. 작고 사소한 것에서부터 인생에 있어서 거대하면서도 상투적인 주제들까지 하나도 지나치지 않고 내밀하게 파고들어가 아름답고 처연한 단상들을 만들어 냈다.","세상에서 가장 찬란했던 감정의 입자들
숨이 멎는 듯한 내밀한 이야기

인생에 있어 하고 싶은 일이나 애착 같은 것 없이 그저 되는 대로 살아오던 그는 서른여덟이 되던 해 어느 날, 사랑과 건강을 한꺼번에 잃고 비로소 삶의 의미에 대한 탐구를 시작하게 된다. 그 방편으로 택한 것이 글쓰기였다. 그는 삶의 내밀한 부분들을 마치 현미경처럼 정밀히 포착해 낸 이 책을 통해 사람과 사랑, 그리고 삶에 대해 진한 경의와 애정을 표하고 있으며 책을 쓰는 동안 글쓰기는 이제 그에게 하나의 꿈으로 자리잡게 되었다. 
『보통의 존재』는 서른여덟. 무명의 작가 이석원이 마치 현미경을 통해 들여다보듯 정밀하게 잡아낸 보통 사람의 내면과 일상의 풍경이 가득한 산문집이다. 작고 사소한 것에서부터 인생과 관련된 거대하면서도 상투적인 주제들까지 하나도 지나치지 않고 내밀하게 파고들어가 아름답고 처연한 단상들을 만들어냈다.

그에게는 무슨 일이 있었던 것일까?
그건 결국 우리 모두가 겪어온 일들이 아닐까?

많은 사람들이 기다렸던 책이다. 아무리 궁금해해도 알 수 없었던 그의 속마음에 대한 이야기가 고스란히 담긴 책. 이석원이 아무렇지 않은 듯 술술 풀어낸 언어의 강물 위에는 말하고 싶어도 너무나 내밀해서 함부로 꺼낼 수 없거나 말하지 않아도 된다고 생각해왔던 이야기들이 흐른다. 독자들은 그의 이야기 앞에서 큰 숨을 들이쉬며 멈칫하는 순간을 맞이할 것이다. 깊은 심연으로 가라앉게 될지도. 
하지만 곧 참을 수 없는 호기심에 침을 꿀꺽 삼키고는 숨을 고르며 다시 그의 이야기들을 읽어 내려갈 것이다. 그 안에서 이석원은 말한다.
“우리가 아무리 사랑한다 해도 결국에는 보통의 존재로밖엔 기억되지 않을 것이다.”
어쩌면 그 사실은 쓸쓸한 오늘을 살아가는 우리에게 가장 필요한 위안인지도 모른다.",22165,BOOK
"오버로드 10 - 모략의 통치자, Novel Engine","마루야마 쿠가네 (지은이), so-bin (그림), 김완 (옮긴이)",54719,국내도서>소설/시/희곡>라이트 노벨>노블엔진(Novel Engine),9791131949245,"왕이 된 아인즈는 통치할 마도국을 이상향으로 삼고자 결의한다. 영원히 번영하고, 다수의 종족이 아인즈에게 무릎을 꿇는 세계. 그 첫걸음으로 모험자 조합을 강화하고 모험자를 육성하고자, 아인즈는 제국으로 향한다. 그런 한편, 느닷없이 생겨난 마도국에 당황하는 뭇 나라들의 지배자들 또한 저마다 대항책을 강구하고 있었다.","가공할 마도왕의 심연이 드러난다!

『오버로드』 제10권 《모략의 통치자》. 왕이 된 아인즈는 통치할 마도국을 이상향으로 삼고자 결의한다. 영원히 번영하고, 다수의 종족이 아인즈에게 무릎을 꿇는 세계. 그 첫걸음으로 모험자 조합을 강화하고 모험자를 육성하고자, 아인즈는 제국으로 향한다. 그런 한편, 느닷없이 생겨난 마도국에 당황하는 뭇 나라들의 지배자들 또한 저마다 대항책을 강구하고 있었다. 불멸의 나라에 군림하는 왕이 되고자 행동을 개시한 아인즈의 첫 수가 끼친 영향이란….",4821,BOOK
청춘의 독서 - 세상을 바꾼 위험하고 위대한 생각들,유시민 (지은이),51537,국내도서>인문학>책읽기/글쓰기>책읽기,9788901101569,"우리 시대를 대표하는 지식인 유시민. 그가 청춘의 시절에 품었던 의문들, 그리고 지금 고민하는 젊은이들이 가지고 있는 뜨거운 질문에 '세상을 바꾼 한 권의 책'으로 답한다. 유시민이 뜨거운 청춘의 시절에 함께 했던 책들을 다시 집어 든 것이다. 삶에서 이정표가 되었던 책들, 갈림길과 장애물이 나타날 때마다 도움을 받았던 ‘낡은 지도'를 다시 꺼내들었다.","세상이 두려울 때마다 그들에게 길을 물었다. 유시민이 전하는 지혜의 목록

우리 시대를 대표하는 지식인 유시민이 들려주는 이야기『청춘의 독서』. 이 책은 저자가 청춘 시절에 품었던 의문들과 젊은이들이 가지고 있는 고민들에 대해 ‘세상을 바꾼 한 권의 책’으로 답한다. 한번쯤 해답 없는 질문들을 들고 방황할 때가 있다. 내가 어떻게 살아야 하는지, 왜 세상은 이해할 수 없는 일들로 가득한지. 이제, 유시민과 함께 품고 있던 질문들을 해결해보자. 
 
유시민이 뜨거운 청춘의 시절에 함께 했던 책들을 다시 집어 들었다. 삶에서 이정표가 되었던 책들은 무엇일까. 아버지의 서재에서 발견했던 , 지하서클 선배들이 던져놓고 갔던 불온서적  등 그때는 알지 못했던 깨달음을 안겨준다. 유시민이 집어든 14권의 책은 비단 한 개인의 추억이 아니다. 그 옛날 19세기 러시아의 가난한 대학생들이 읽었고, 끝나지 않을 것 같은 독재의 시절에 맞선 한국의 청년들이 읽었던 책들이다. 

왜 우리는 지금 그 책들을 다시 꺼내 읽어야 하는가. 하나의 책을 다시 읽고 또 읽는다는 것은 우리에게 어떤 통찰을 던져주는가. 우연히 읽었던 낡은 문고본 하나가 실마리를 제공하기도 하고, 낯선 제목의 소설이 아픈 가슴을 위로하기도 하며, 때로는 뜻도 모르고 읽은 철학서 한 권이 인생을 바꾸기도 한다. 한 시대를 흔들고, 한 사회를 무너뜨리기도 했던 한 권의 책, 그 뒤에 있는 평범한 사람들의 ‘읽는 힘'을 만난다.",17796,BOOK
원펀맨 One Punch Man 11 - 대괴충,"ONE (지은이), 무라타 유스케 (그림)",4133,국내도서>만화>본격장르만화>판타지>액션 판타지,9791133424481,"괴수들이 출몰하는 현대 도시. 취미로 히어로 일을 하는 사나이가 나타났다. 반짝이는 대머리에 맹한 얼굴, 다소 촌스러운 복장을 한 사이타마는 아무리 봐도 유약한 소시민처럼 보이지만 사실은 혹독한 훈련을 거쳐 비현실적인 힘을 손에 넣은 인물이다.","『원펀맨』제11권. 재해 레벨 '용(龍)'급 지네 장로 출현! 금속 배트가 응전하지만, 그 거대함에 크게 고전한다. 그리고 멀리 날아간 금속 배트 앞에 '히어로 사냥꾼' 가로우가 나타나 또 다시 새로운 싸움이 발발하는데! 한편, 격투기 대회에 참가한 사이타마는…?!",4256,BOOK
천공의 벌,"히가시노 게이고 (지은이), 김난주 (옮긴이)",51058,국내도서>소설/시/희곡>추리/미스터리소설>일본 추리/미스터리소설,9788990982667,국민을 볼모로 원전 파괴를 요구하는 헬기 납치범과 일본 당국 간에 벌어지는 피 말리는 심리전을 그린 히가시노 게이고의 장편소설. 헬기 탈취부터 사건 종료까지의 10시간에 걸친 숨 막히는 드라마를 676쪽 분량의 장편으로 형상화했다.,"'침묵하는 군중'을 고발한 히가시노 게이고의 문제작!

히가시노 게이고의 장편소설 『천공의 벌』. 국민을 볼모로 원전 파괴를 요구하는 헬기 납치범과 일본 당국 간에 벌어지는 피 말리는 심리전을 그린 서스펜스다. 헬기 탈취부터 사건 종료까지의 10시간에 걸친 숨 막히는 드라마를 그린 소설의 전반부는 헬기 납치와 범인의 협박, 그리고 정부 당국의 대처를 속도감 있게 묘사하고 있다. 이후 범인과 당국의 밀고 당기는 심리전으로 전개된다. 발표 당시 요시카와 에이지 문학 신인상 후보에 올라, 서스펜스 소설로서는 드물게 오락성과 함께 문학성도 인정받기도 했다.

일본 자위대에 납품할 최신예 거대 전투 헬기 ‘빅 B’가 최종 시험 비행을 앞두고 피랍된다. ‘빅 B’는 대량의 폭발물을 실은 채 ‘천공의 벌’을 자처하는 범인의 무선 원격 조종에 의해 후쿠이 현 쓰루가 시의 고속 증식 원형로 ‘신양’ 상공으로 이동한다. 원전 바로 위 800미터 상공을 선회하는 헬기. 범인은 정부에 메시지를 보내 “일본 전역의 원전을 모두 폐기하지 않으면 헬기를 원전에 추락 시키겠다”고 협박한다. 그리고 자신의 요구 사항과 현장 상황을 TV를 통해 전국에 생중계할 것을 요구한다. 

남은 시간은 8시간. 일본 열도는 순식간에 일촉즉발의 공포에 휩싸이고, 정부와 지방 자치 단체, 자위대, 경찰, 소방 당국, 원전 관계자들이 우왕좌왕하며 범인의 요구에 대책 없이 끌려 다닌다. 헬기의 연료는 시시각각으로 소진되어 가고, 원전 주변 주민들이 탈출하는 가운데, ‘빅 B’ 안에 헬기 개발에 참여한 연구원의 아들이 홀로 타고 있다는, 범인조차 몰랐던 뜻밖의 사실이 알려지는데…….

이 작품은 히가시노 게이고의 다른 작품과 달리 소설 중반부쯤에 이르러 범인 중 한 명이 일찌감치 모습을 드러낸다. 범인의 은밀한 동선을 따라가며 묘한 스릴을 만끽하게 되고, 경찰 수사망이 좁혀지면서 공범들의 실체와 범행 동기가 하나씩 드러나는 재미까지 느낄 수 있다. 더불어 저자는 이 작품을 통해 명확한 근거 없이 원전의 안전 신화를 만들어낸 정부에 일침을 가하고, 원전의 필요성은 인정하지만 가까이 있는 것은 두렵다는 이율배반 속에서 눈앞의 이익을 좇아 현실에 눈감는 ‘침묵하는 군중’을 향해 엄중한 메시지를 던진다.",2906,BOOK
지적 리딩을 위한 필수 영단어 1100 WORDS you need to know - 우리 시대 지성들이 사용하는 바로 그 단어,"멜빈 고든, 머레이 브룸버그 (지은이), 박상준 (옮긴이)",49838,국내도서>외국어>영어어휘,9791155810774,"미국에서 현재 개정 6판까지 출간된 &lt;1100 워드&gt;는, 출간된 지 45년이 지났지만 현재도 여전히 미국 아마존 베스트셀러(VOCA 부문)이자, 일본 아마존 베스트셀러(VOCA 부문) 1위를 고수하고 있다.","우리 시대 지성인들을 위한 핵심 어휘 학습서

『1100 Words(1100 워드)』는 고급 시사 인문학 독해를 위한 920개의 필수 단어와 미국인들이 자주 사용하지만 외국인은 알기 어려운 180개의 핵심 관용어를 담고 있는 어휘책이다. 단어의 정의만 외우는 기존의 다른 어휘책과 달리 문장 속 활용을 통해 습득, 실전에 적용할 수 있도록 하여 오래 기억할 수 있도록 하였다.

본서는 미국 대학생 수준의 문장 독해를 위해 꼭 필요한 1100개의 핵심 어휘를 TV, 신문, 소설, 연극, 시에서 선별한 수준 높은 영단어만을 모았다. 퀴즈를 통해 재미있게 복습할 수 있는 구조로 총 48주간의 학습을 통해 필수 어휘력을 갖추도 다양한 생생한 예문을 통해 실생활에서 즉시 통용되는 교양을 쌓을 수 있다. 또한 이번 최신 개정6판에서는 새롭게 추가된 원문을 수록한 영어판으로 핵심 단어를 총정리하며 원서 전문을 모두 볼 수 있다.",4721,BOOK
큰별샘 최태성의 한국사 1500제 전근대편 - 구석기 ~ 조선 후기,"최태성, 정흥태 (지은이)",34631,국내도서>수험서/자격증>공무원 수험서>7/9급 공무원>한국사>기출/문제집/모의고사,9791170060741,"한국사 문제집의 바이블, 7년간 한결같은 사랑을 받으며 장수해 온 1500제가 새로운 모습으로 출간되었다. “글씨가 너무 희미해요.”, “최신 경향의 문제는 언제 들어오나요?”, “전 문항 해설은 언제 되나요?” 등의 독자들의 소중한 의견을 모두 모아 반영하였다.","300만 수험생이 선택한 스타강사!
큰별샘 최태성의 1500제가 새롭게 단장하였다.

한국사 문제집의 바이블, 7년간 한결같은 사랑을 받으며 장수해 온 1500제가 새로운 모습으로 출간되었다. “글씨가 너무 희미해요.”, “최신 경향의 문제는 언제 들어오나요?”, “전 문항 해설은 언제 되나요?” 등의 독자들의 소중한 의견을 모두 모아 반영하였다. 7년간 장수했던, 그리고 앞으로 더 장수할 1500제의 매력은 무엇일까요? 그것은 바로 단원별, 개념별로 문항들을 묶어 놓았다는 것입니다. 개념공부를 하긴 했지만 도대체 뭐가 중요한지, 어떻게 접근해야 하는지에 대한 ‘감’이 없으신 분들을 위해서 《큰별샘 최태성의 1500제》가 탄생하였다. 스타강사 최태성 선생님이 직접 정리하고 엄선한 양질의 문제들을 담은 《큰별샘 최태성의 1500제》가 여러분이 원하는 꿈과 목표 달성에 조금이라도 도움이 되기를 바란다.",4651,BOOK
유시민의 공감필법,유시민 (지은이),51378,국내도서>인문학>교양 인문학,9788936472979,"창비 50주년 특별기획 ‘공부의 시대’에 참여한 우리 시대 지성들은 입을 모아 지금이야말로 공부를 해야 할 때라고 말한다. 각 분야에서 자신만의 길을 만들어온 강만길, 김영란, 유시민, 정혜신, 진중권 다섯명의 지식인들이 ‘나’와 ‘세상’에 대해 묻고, 고민하고, 손 내미는 ‘진짜’ 공부를 말한다.","먹고살기도 바쁜 시대, 지금이야말로 공부가 필요하다!

살아남기만도 벅찬 시대라고 한다. 그러나 사람들의 ‘공부’에 대한 열망은 그 어느 때보다도 크다. 《창작과비평》 창간 50주년 기념으로 개최한 강연 ‘공부의 시대’에 참여한 다섯 명의 지식인ㅡ강만길, 김영란, 유시민, 정혜신, 진중권 역시 입을 모아 지금이야말로 공부를 해야 할 때라고 말한다. ‘나’와 ‘세상’에 대해 묻고, 고민하고, 손 내미는 ‘진짜’ 공부를. 

『공부의 시대』는 강좌의 내용을 바탕으로 더 알차게 보충한 책이다. 원로 역사학자 강만길은 새로운 시대에 필요한 역사의식을 말하고, 전 대법관 김영란은 자신을 만든 독서에 대해 이야기한다. 작가 유시민은 글쓰기를 통해 세상을 이해하는 방법을, ‘거리의 의사’ 정혜신은 사람에게서 얻을 수 있는 배움을, 미학자 진중권은 디지털 시대에 인문학이 가야 할 방향을 제시한다.

‘공부’와 ‘시대’는 밀접하게 상호작용한다. 일제강점기 소학교에서 일본어를 배워야 했던 역사학자, 부정한 시대와 누구보다 치열하게 맞부딪친 대법관, 지식을 통해 현실 정치에서의 변화를 열렬히 모색했던 전 정치인, 부정의와 참사 앞에서 진료실을 떠나 거리로 나간 정신의학전문의, 미디어의 세계로 인문학의 방향을 전환한 미학자. 그들의 이야기는 시대를 이해하는 길이기도 하다.",4696,BOOK
1만 시간의 재발견 - 노력은 왜 우리를 배신하는가,"안데르스 에릭슨, 로버트 풀 (지은이), 강혜정 (옮긴이)",70216,국내도서>자기계발>성공>성공학,9791186805282,"안데르스 에릭슨 박사는 ‘1만 시간의 법칙’의 핵심은 ‘얼마나 오래’가 아니라 ‘얼마나 올바른 방법’인지에 달려 있다고 강조한다. 즉, 1만 시간의 핵심은 ‘무턱대고 열심히 하기’가 아닌 ‘다르게 열심히 하기’라고 말이다.","당신이 알고 있던 ‘1만 시간’은 방법이 틀렸다!

세계적인 심리학자 안데르스 에릭슨 박사는 자기 분야에서 최정상에 오른 사람들을 연구하며 그들의 놀라운 성공 뒤에는 타고난 재능이 아닌 아주 오랜 기간의 노력이 있었다는 논문을 발표했었다. 이 논문의 내용은 ‘1만 시간의 법칙’이라는 이름을 통해 말콤 글래드웰의 《아웃라이어》에 인용되며 한국에 소개되었고, 폭발적인 반응을 보였다. 그러나 누군가에게는 노력하면 최고가 될 수 있다는 의욕을 불태우기도, 누군가에게는 기나긴 시간의 이유로 조롱의 대상이 되며 찬사와 논쟁의 한가운데 놓인 주제가 되어버렸다. 여기서 저자는 그동안 자신의 연구 내용에 대해 독자들이 잘못 이해하고 있다고 말하며 이 책 『1만 시간의 재발견』을 통해 오해를 바로잡고 인간의 적응력과 성취에 대한 새로운 사고방식을 제시하고자 하였다. 

1만 시간의 법칙이 한국 독자들에게 사랑을 받은 이유는 ‘무조건 열심히 하면 된다’라는 식의 생각이 자리 잡고 있었기 때문일 것이다. 그러나 책상에 오래 앉아 있는다고 1등이 되는 것이 아닌 것처럼 1만 시간의 법칙의 핵심은 ‘얼마나 오래’가 아니라 ‘얼마나 올바른 방법’인지에 달려있다고 강조한다. 무턱대고 오랜 시간을 열심히 하는 것이 아닌, 다르게 열심히 하기가 더 중요한 것이다. 시간만큼 중요한 것은 그 시간을 보내는 방법과 질이다. 저자가 말하는 노력의 올바른 방법은 집중, 피드백, 수정하기로 요약되는 의식적인 연습이다. 책은 의식적인 연습이 구체적으로 무엇인지, 정상에 오른 사람들이 보낸 시간에는 어떤 차이가 있는지, 어떻게 해야 이런 연습을 통해 우리의 능력을 더 발전시키고 최고의 자리에 오를 수 있는지 지난 30년간의 과학 연구를 토대로 상세히 알려준다.",7502,BOOK
지하 100층짜리 집 (양장),"이와이 도시오 (지은이), 김숙 (옮긴이)",35139,국내도서>유아>그림책>나라별 그림책>일본,9788989863915,"기발한 상상력이 돋보이는 색다른 감각의 숫자 그림책. 각기 다른 동물들이 살고 있는 지하 10층, 20층, 30층… 이렇게 10층씩을 내려가는 사이 저절로 1에서 100까지 쉽게 익힐 수 있는 그림책이다. 등장하는 동물들의 특징을 기발한 상상력으로 그려내 읽는 재미를 한층 더 느끼게 해 준다. 또한, 그림을 통해 각 동물들의 생태까지 상세하게 알 수 있다.","우리 집 지하 100층에서 잔치가 열려. 놀러 오지 않을래?

미디어 아티스트 이와이 도시오의『지하 100층짜리 집』. 신선한 상상력이 살아 숨쉬는 새로운 감각의 숫자 그림책이다. 목욕을 좋아하는 '쿠'라는 소녀가 땅 아래로 아래로 깊이 내려가는 이상하고 아름다운 지하 100층짜리 집에 초대받으면서 벌어지는 모험 속으로 아이들을 안내한다. 어느 날 쿠는 자신을 지하 100층짜리 집에 초대한다는 목소리를 듣는다. 누구인지는 모르겠지만 지하 100층짜리 집에 가기로 결심하고 땅 아래 100층짜리 집으로 들어간다. 지하 1층부터 10층까지는 토끼들이 살고 있다. 쿠는 11층부터 21층까지는 누가 살고 있을지 궁금한데….",20646,BOOK
할로우 시티 - &lt;페러그린과 이상한 아이들의 집&gt; 두 번째 이야기,"랜섬 릭스 (지은이), 이진 (옮긴이)",51120,국내도서>소설/시/희곡>판타지/환상문학>외국판타지/환상소설,9788993094916,"랜섬 릭스의 '페러그린 시리즈' 제2편. 무시무시한 괴물 할로우의 추격을 피해 달아나는 이상한 아이들. 런던으로 향하는 제이콥과 친구들 앞에 나타나는 새로운 위험, 더 '이상한' 인물들의 등장. 와이트들의 음모가 서서히 밝혀진다.","기괴한 흑백 사진에서 시작된 환상적인 이야기!

환상적인 모험담을 빛바랜 옛날 사진들과 엮어낸 소설 《페러그린과 이상한 아이들의 집》의 두 번째 이야기 『할로우 시티』. 전편에서 할아버지의 죽음과 유언에 얽힌 비밀을 풀기 위해 외딴섬에 갔다가 할아버지가 들려준 이야기 속의 ‘이상한’ 아이들을 만난 제이콥은 자신의 능력을 깨닫고 그들과 함께하게 된다. 이번 책에서 아이들은 살인을 일삼는 괴물 할로우와 그 추종자 와이트들을 피해 섬에서 탈출해 폭풍을 헤치고 웨일스 본토에 도착하지만, 페러그린과 아이들을 노리는 적들의 추격은 멈추지 않는다.

폭격으로 폐허가 된 섬을 떠난 제이콥과 아이들은 무서운 괴물 할로우와 할로우를 돕는 와이트들의 추격에서 도망친다. 그 과정에서 자신들처럼 특별한 능력을 지닌 동물들을 만나고, 새의 몸에 갇힌 페러그린을 인간으로 되돌리는 방법을 알아내 런던으로 향한다. 끊임없이 쫓아오는 적들을 피해 달아나 페러그린을 회복시켜 예전의 안정된 삶을 찾는 것만이 아이들의 희망이다. 이미 시간을 조종할 수 있는 초능력자인 임브라인들을 납치하고, 정해진 하루가 매일 반복되는 공간인 루프를 정복한 와이트와 할로우들에게서 살아남는 것만으로도 벅차지만, 아이들은 죽음의 공포와 자신들의 무력함을 느끼면서도 용감하게, 또는 무모하게 위험을 무릅쓰고 페러그린 회복 작전에 뛰어드는데…….",2699,BOOK
부모공부 - '모든 부모'를 위한 종합 양육 교양서,고영성 (지은이),73196,국내도서>좋은부모>부모교육,9791185541389,"우리 아이 잘 키우고 있는 것일까? 『부모공부』는 이런 고민으로 마음이 무거운 부모들을 위한 책이다. 아이의 미래, 성장, 행복을 위해 모든 부모가 꼭 알아야 할 과학적 사실 22가지를 실험과 사례 중심으로 알기 쉽게 종합했다.","아이를 키우는 당신에게 권하는 양육서

아이를 어떻게 키워야 하는 것일까? 대부분의 부모들은 그런 고민에 마음이 무거워질 것이다. 『부모공부』는 아이를 키우는 것이 걱정인 대한민국 부모들에게 권하는 양육 교양서로, 과학적 사실 22가지를 실험과 사례 중심으로 알기 쉽게 종합했다. 아이의 미래, 성장, 행복을 위한 부모 교육을 강조하면서도 결코 ‘양육 완벽주의’에 갇히지 말라는 응원의 메시지도 함께 전달한다. 영유아를 키우는 부모, 아이의 인지발달이 궁금한 부모, 아이의 창의성을 키우고 싶어 하는 부모, 올바른 양육방식에 대해 고민하는 부모에게 최고의 양육 교양 지침서가 될 것이다.

아이 양육과 관련된 22가지 세부 분야, 즉 아이큐, 뇌 발달, 언어발달, 독서, 자기개념, 사고방식부터 호기심, 창의성, 감정, 성격, 스트레스, 애착, 스크린, 남아와 여아, 형제, 월령효과, 사회성, 공격성, 놀이, 양육의 당사자인 부모, 양육방식, 행복까지 폭넓게 다룸으로써 그동안 잘 몰랐던 세세한 부분까지 알려준다.",3115,BOOK
이게 정말 나일까?,"요시타케 신스케 (지은이), 김소연 (옮긴이)",48824,국내도서>어린이>초등1~2학년>그림책,9788934971634,초등 저학년을 위한 그림동화 시리즈 6권. &lt;이게 정말 사과일까?&gt;의 저자 요시타케 신스케가 자기소개를 색다르게 하는 법을 알려주는 책이다. 저자는 ‘가짜 나 만들기 작전’이라는 이야기를 통해 아이들에게 자존감의 중요성을 멋지게 풀어내고 있다.,"과연 로봇은 지후의 존재를 대신할 수 있을까요?

‘사과’라는 사물에 대한 고정 관념에서 벗어나 아이들이 마음껏 상상해볼 수 있었던 그림책 《이게 정말 사과일까?》의 저자 요시타케 신스케의 신작이 나왔습니다! 『이게 정말 나일까?』는 자신을 대신할 ‘가짜 나 만들기’를 통해 ‘나는 누구인지’ 돌아볼 수 있도록 안내한 그림책입니다. 자기가 누구인지 다른 사람에게 전달하는 일은 어른들에게도 꽤나 어려운 일인데요. 이 책을 통해 타인에게 자신을 재미있게 소개하는 방법도 배울 수 있습니다.

아이는 숙제, 심부름 등이 귀찮아 자기를 대신할 로봇을 삽니다. 그런데 로봇은 자기가 가짜 역할을 하려면 주인이 어떤 사람인지 알려 줘야 한다고 합니다. 아이는 이름, 가족관계, 겉모습, 취미, 기호 등을 넘어서, 로봇이 원하는 더 많은 정보를 쥐어짜듯 생각하고 생각해서 로봇에게 알려 줍니다. 로봇은 과연 가짜 나 역할을 성공적으로 해낼 수 있을까요?",18784,BOOK
