title,author,genre_id,genre,ISBN,description_aladin,description_naver,salesPoint,mallType
"마사코의 질문 - 개정판, 6학년 2학기 읽기 수록도서","손연자 (지은이), 김재홍 (그림)",48874,국내도서>어린이>동화/명작/고전>국내창작동화,9788957981856,"일제 식민 시대 억압받던 우리민족의 이야기를 생생하게 그린 동화집. 어린이들에게 역사의 진실을 바르고 생생하게 일깨워 주는 책이다. 수록 작품 중 '꽃잎으로 쓴 글자'와 '방구 아저씨' 2편이 초등학교 국어 교과서에 수록되었으며, 제33회 세종아동문학상 수상작이다.
","일제 강점기, 가슴 아픈 역사의 증언

『마사코의 질문』은 일제 강점기에 고난을 겪었던 우리 겨레의 삶을 다룬 동화 9편을 담은 책입니다. 일본인 소녀의 입으로 일본의 죄를 묻는 표제작 「마사코의 질문」을 비롯해 '생체 실험', '관동대지진', '정신대 문제' 등과 같이 일제 강점기에 우리 민족이 겪었던 온갖 수난들을 생생하고 절실하게 그려낸 작품들이 실려 있습니다.

마사코는 할머니와 함께 히로시마의 평화 기념 공원에 갔습니다. 할머니의 엄마는 히로시마에 떨어진 원자 폭탄에 의해 시름시름 앓다가 돌아가셨습니다. 마사코는 할머니에게 원자 폭탄 '꼬마'가 아주 무서운 존재라고 이야기 했습니다. 그런데 마사코는 궁금한 점이 생겼습니다. 도대체 미국은 왜 일본에 원자 폭탄을 떨어트린 걸까요?",12866,BOOK
2019 신용한 Compass 행정학 합격노트 이론편,신용한 (지은이),34637,국내도서>수험서/자격증>공무원 수험서>7/9급 공무원>행정학>강의노트/기타,9791189345181,반드시 출제될 내용만을 쉽게 정리한 요약정리집이다. 합격노트는 핵심내용만을 정리한 요약집이므로 관련 내용의 추가적인 이해와 도움이 필요할 수 있다. 적시된 COMPASS 기본서 페이지는 여러분에게 완벽한 정리집을 만들 수 있도록 도움을 줄 것이다.,,2268,BOOK
2019 민준호 사회 필기노트 - 공무원 사회 압축 필기노트,민준호 (지은이),80109,국내도서>수험서/자격증>공무원 수험서>7/9급 공무원>사회>7/9급 기본서 및 부교재,9791161319520,"9급 공무원 사회 이론의 주요 포인트를 효과적으로 정리할 수 있는 압축 필기노트다. 이론 학습 후에 효율적으로 복습하며 정리할 수 있도록 압축 정리하였으며, 문제를 풀이하면서 이론을 단권화하거나 시험 직전에 학습한 내용을 정리하기에도 알맞게 구성하였다.",,2328,BOOK
종이 동물원,"켄 리우 (지은이), 장성주 (옮긴이)",89481,국내도서>소설/시/희곡>과학소설(SF)>외국 과학소설,9791158884680,"동시대 가장 주목받는 SF 환상문학 작가 켄 리우의 대표 단편 선집. 권위의 휴고 상, 네뷸러 상, 세계환상문학상을 40년만에 첫 동시 수상한 대표작 「종이 동물원」을 비롯하여 SF에서부터 환상문학, 하드보일드, 대체 역사, 전기(傳奇)소설에 이르기까지 한 권에 담았다.","동양과 서양의 SF 교류 역할을 하고 있는 켄 리우의 대표 단편 선집!

SF에서부터 환상문학, 하드보일드, 대체 역사, 전기 소설에 이르기까지 켄 리우의 작품 세계를 한 눈에 볼 수 있는 작품집 『종이 동물원』. 총 14편의 중단편 소설로 구성된 이 책은 2017년 로커스 상 최우수 선집상을 수상하였다. 독특한 소재를 다루고 있음에도, 일반 대중이 누구나 실생활에서 생각해 볼 만한 소재들로 구성되어 있다.

미국인 아버지가 결혼 정보 카탈로그를 보고 선택한 여성이었던 잭의 어머니. 영어를 할 줄 아는 홍콩 출신이라고 했지만, 사실 모두 거짓이었다. 하지만 그녀에게는 특별한 한 가지가 있었다. 종이를 접어 동물을 만들고, 숨을 불어넣으면 살아움직였다. 어린시절의 잭은 어머니가 만들어준 종이 동물들, 특히 종이 호랑이를 무척 아꼈다. 

성장하며 동양인의 눈을 가진 자신이 백인 아이들과 다르다는 걸 알면서부터 어머니와 닮은 모든 것이 싫었던 잭은 어머니가 만들어준 동물은 모두 상자에 넣어 치웠고, 영어로 말하지 않는 어머니에겐 대꾸조차 하지 않았다. 그리고 그렇게 성년이 될 때까지 어머니를 외면하며 자랐고, 그녀가 암으로 사망한 지 얼마 지나지 않아 종이 호랑이가 잭 앞에 다시 나타났다. 그리고 접힌 종이 호랑이에 적혀 있는 어머니의 편지엔, 그녀가 들려주고 싶어하던 오랜 이야기가 또박또박 적혀 있는데…….

어린시절, 선물 포장지를 사용해 종이 동물을 만들고 생명을 불어넣어주던 중국인 어머니와 그 아들에 관한 이야기를 통해 짧지만 가슴 찡한 감동을 전하며 저자를 베스트셀러 작가 반열에 올린 표제작 《종이 동물원》, 일본군의 731부대의 잔학성을 다큐 형식으로 그려낸 《역사에 종지부를 찍는 사람들》 등 중국계 미국인인 저자의 시선에서 바라보느 동북아시아의 역사적 굵직한 사건들을 SF 환상문학 장르에 녹여낸 작품들과, 장르적 재미와 완성도를 모두 갖춘 수작들까지 모두 만나볼 수 있다.",11228,BOOK
2주 만에 끝내는 해커스 토익 스피킹 Start - 스피킹 초보를 위한 필수 학습서 | 토스 실제 시험과 동일한 출제유형 반영!,David Cho (지은이),49859,국내도서>외국어>토익>토익 Speaking,9788965422662,최근 3년간의 출제 경향을 철저히 분석 후 실제 시험과 동일한 난이도 및 유형 완벽 반영하였다. 1주/2주/4주 학습기간 및 학습방법을 선택해 자신에게 최적화된 맞춤형 학습이 가능하다. 스피킹에 필요한 기초 학습부터 실전을 위한 모의고사까지 2주 만에 충분히 시험 준비할 수 있다.,,5385,BOOK
2019 시나공 컴퓨터활용능력 1급 실기 - 컴활 함수 사전 + 자동채점프로그램 + 최신기출문제,"길벗 R&D, 강윤석, 김우경, 김용갑, 김종일 (지은이)",7007,국내도서>컴퓨터/모바일>활용능력>컴퓨터활용능력>컴퓨터활용능력 실기,9791160505825,"엑셀, 액세스의 방대한 기능 중 시험에 꼭 나오는 기능을 26개 섹션으로 압축하고, 쉽게 익힐 수 있도록 따라하기 형식으로 구성하였다. 각 섹션마다 출제된 비율에 따라 A, B, C, D 등급을 지정하여 중요한 내용을 먼저 볼 수 있다.",,2970,BOOK
"비폭력 대화 - 일상에서 쓰는 평화의 언어 삶의 언어, 개정증보판","마셜 B. 로젠버그 (지은이), 캐서린 한 (옮긴이)",51515,국내도서>인문학>심리학/정신분석학>심리치료,9791185121147,"우리가 의식적이든 무의식적이든 일상적으로 사용하고 있는 폭력적인 대화를 극복하는 방법에 대해 이야기한다. 우리가 얼마나 폭력적인 대화방법을 스스럼없이 사용하고 있는지를 밝히면서, 비폭력 대화가 우리 사회와 각 개인을 어떻게 바꿀 수 있는지 이야기한다.","『비폭력대화』는 비폭력대화(NVC)의 기본 개념, NVC 모델, 모델 적용 과정 등을 자세히 다루는 기본 텍스트이다. 다시 말해, 이론과 실천에 관한 구체적인 설명과 지침을 제공하는 NVC 교과서라고 할 수 있다. 특히 실천 방법을 구체적 사례를 통해 제시하고 있는 것이야말로 이 책의 장점이다. ‘백문이 불여일견이고 백견이 불여일행’이라고 했다. 책에 제시된 모델을 일상생활에서 실천해 보라. 갈등이 누그러지고 유대가 자라나는 것을 실감하게 될 터이다. 2004년 출간된 이래 지금도 해마다 1만 명 이상의 독자가 꾸준히 이 책을 찾는 것도, 인간관계에 실제로 변화를 가져오는 비폭력대화의 그런 힘 때문일 것이다.",20909,BOOK
시간 가게 - 제13회 문학동네어린이문학상 수상작,"이나영 (지은이), 윤정주 (그림)",48874,국내도서>어린이>동화/명작/고전>국내창작동화,9788954620260,제13회 문학동네어린이문학상 수상작. 입시라는 미래의 목표를 위해 ‘지금’의 삶을 유예시킨 이 시대의 초등학생들과 그 가족들의 모습을 정면으로 응시하며 ‘아이들은 과연 이대로 행복한가?’라는 깊이 있는 질문을 건네는 작품이다.,"미래의 행복을 위해 지금의 삶을 유예시키다.

우리 역사와 정서를 담아낸 「보름달문고」 제53권 『시간 가게』. 오랫동안 아이들과 함께 책을 읽고 글을 쓰는 일을 해온 동화 작가 이나영의 첫 번째 장편동화입니다. 오직 1등이 되기 위해 날마다 10분의 시간을 사는 대신 과거의 행복한 기억을 잃어 정체성 혼란에 시달리는 소녀 '윤아'의 이야기를 속도감과 긴장감 넘치게 담아냈습니다. 그림 작가 윤정주의 매력과 개성 넘치는 그림을 함께 실었습니다. 

초등학교 5학년인 윤아는 엄마가 짜 놓은 계획표에 따라 하루 종일 학원을 다녀요. 전교 2등의 실력이지만 과외도 하고 있어요. 엄마는 먼저 세상을 뜬 아빠에게 떳떳하기 위해 윤아를 좋은 대학에 보내야 한다는 일념으로 밤낮없이 돈을 버느라 바빠요. 윤아는 엄마를 기쁘게 하고 싶어 힘들고 벅차도 꾹 참으며 공부해요. 어느 날 윤아는 우연히 '시간 가게'에 들러 하루에 한 번 행복한 기억 한 가지를 팔면 오직 자신만 쓸 수 있는 10분의 시간이 생기는 거래를 제안받는데…….",15762,BOOK
소설 보다 : 봄-여름 2018,"김봉곤, 조남주, 김혜진, 정지돈 (지은이)",50993,국내도서>소설/시/희곡>한국소설>2000년대 이후 한국소설,9788932034652,"&lt;소설 보다&gt;는 문학과지성사가 분기마다 ‘이 계절의 소설’을 선정, 홈페이지에 그 결과를 공개하고 이를 문지문학상 후보로 삼았던 방식을 유지하되, 선정작들을 수상작품집으로 묶지 않고 계절마다 앤솔러지로 엮어 1년에 4권씩 출간하는 단행본 시리즈이다.","계절마다 만나는 젊은 작가의 엄선된 신작!

『소설 보다』 2018년 《봄-여름》 편. 2011년부터 해마다 간행된 도서 《문지문학상 수상작품집》을 새롭게 개편한 것으로, 문학과지성사가 분기마다 ‘이 계절의 소설’을 선정해 홈페이지에 그 결과를 공개하고 이를 문지문학상 후보로 삼았던 방식을 유지하되, 선정작들을 수상작품집으로 묶지 않고 계절마다 앤솔러지로 엮어 출간한다.

이번 《봄-여름》은 2018년 두 계절의 선정작들을 담은 합본이다. 봄 선정작인, 보편과 특수 사이에서 진동하는 세련된 사랑의 서사를 담은 김봉곤의 《시절과 기분》, 72세의 아버지가 갑작스레 선택한 가출이 야기하는 가족 구성원들의 변화 혹은 성장을 보여주는 조남주의 《가출》과 한 대학 신문사의 주간 교수를 둘러싼 학내 분쟁을 다룬 여름 선정작인 김혜진의 《다른 기억》, 1960년대 후반에 상상되던 미래에 동아시아적 현실과 역사적 성찰을 시도하는 정지돈의 《빛은 어디에서나 온다》까지 총 4편의 단편소설과 작가 인터뷰를 담았다.",1953,BOOK
"2019 에듀윌 공인중개사 1차 단원별 기출문제집 - 2019 공인중개사, 제30회 공인중개사 대비, 부동산학개론, 민법 및 민사특별법, 빈출지문 정리노트","이영방, 심정욱 (지은이)",34691,국내도서>수험서/자격증>공인중개사/주택관리사>공인중개사 1차,9791159499593,"실제 공인중개사 시험을 경험하고자 하는 수험생, 중간 점검이 필요한 수험생, 마무리 확인이 필요한 수험생을 위한 필수교재 공인중개사 기출문제집이다. 부록으로 제공되는 '빈출지문 정리노트'를 활용하여 기출문제의 핵심만을 빠르게 정리할 수 있도록 하였다.",,1260,BOOK
프로야구 스카우팅 리포트 2019 - 2019시즌 최종판,"유효상, 이성훈, 이용균, 최민규 (지은이), 최훈 (그림)",54710,국내도서>건강/취미>구기>야구,9791164123780,"2019년 프로야구 스카우팅 리포트. LG와 롯데, KIA는 KBO리그의 흥행을 책임지는 3팀이다. 매년 꾸는 꿈이지만 올 시즌이야말로 엘-롯-기의 동반 가을야구가 가능할까. 잠실과 사직과 광주가 들썩이는 시즌이 된다면 KBO리그의 새로운 이야기가 쌓인다.","프로야구 스카우팅 리포트 10주년 
최훈 캐릭터 경기일정 캘린더 + 스티커

는 2010년 첫 책이 출간됐다. 처음 기획이 시작된 건 2008년이었고 2009년 첫 책을 낼 예정이었지만 당시 필진들은 한국에서 프로야구 프리뷰북이 정말 출간될 수 있는 것인지, 팬들의 사랑을 받을 수 있을지 자신감을 갖지 못했다. 그렇게 한 해를 보낸 후 처음 구상했던 필진에 변화가 생겼다. 책임감이 철저한 이용균 기자가 참가했다. 그가 모든 원고를 마감했음을 필진들에게 알리면서, 비로소 모든 필진들이 책이 나올 거라는 것을 실감했다. 

그렇게 시작한 시리즈가 10주년을 맞았다. 꽤 이름 있는 정기간행물도 슬그머니 사라지거나 존재감이 희미해지는 도서시장에서, 매년 딱 한 권을 출간하며 10년을 이어왔다. 팬들의 믿음과 사랑 없이는 불가능한 일이었다. 그만큼 KBO리그 프로야구는 대한민국에서 절대적인 사랑을 받는다. 자, 2019년에도 프로야구 스카우팅 리포트는 출간된다. 이번 스카우팅 리포트는 모든 독자들에게 탁상용 경기일정 스케줄러와 최훈 KBO리그 캐릭터 스티커를 특별부록으로 제공한다. 팬들이 한 시즌 내내 계속 펴놓으며, 특별한 인상을 남긴 경기를 표시해둘 수 있을 것이다.",524,BOOK
"아빠 놀이 백과사전 - 하루 1분, 아빠랑 아이의 행복한 시간","조준휴, 장기도 (지은이), 정재희 (감수)",51792,국내도서>좋은부모>교육/학습>놀이/체험학습,9791160507041,"소중한 자녀와 함께 놀아주고 싶지만, 하루 일과를 마치고 집에 돌아오면 코앞의 놀이터에 나가기도 어려운 보통 아빠들을 위한 놀이 가이드북이다. 퇴근 후 늦은 시간에 아이와 놀아주는 아빠를 위해 지금 당장 할 수 있는 쉬운 놀이, 특별한 재료가 필요 없는 놀이, 그러면서도 아이의 웃음이 끊이지 않는 놀이들을 담았다.","크라우드 펀딩의 대표 사이트인 와디즈에서 정식 펀딩에 이어 두 차례의 앵콜 펀딩까지 진행, 펀딩 목표 총 8345%를 달성한 인기 콘텐츠 『아빠 놀이 백과사전』이 정식 출간되었다. 『아빠 놀이 백과사전』은 소중한 자녀와 함께 놀아주고 싶지만, 하루 일과를 마치고 집에 돌아오면 코앞의 놀이터에 나가기도 어려운 보통 아빠들을 위한 놀이 가이드북이다. 퇴근 후 늦은 시간에 아이와 놀아주는 아빠를 위해 『아빠 놀이 백과사전』에는 지금 당장 할 수 있는 쉬운 놀이, 특별한 재료가 필요 없는 놀이, 그러면서도 아이의 웃음이 끊이지 않는 놀이들을 담았다.",1351,BOOK
"부동산 상식사전 - 전.월세, 내집, 상가, 토지, 경매까지 처음 만나는 부동산의 모든 것, 개정판",백영록 (지은이),175,국내도서>경제경영>재테크/투자>부동산/경매,9791160507119,"왕초보 딱지를 떼는 핵심 부동산 강의로 시작해 전?월세부터 내집, 상가, 토지, 경매까지 국내 최초로 부동산 전 분야를 체계적으로 정리한 책이다. 저자는 각 부동산의 거래 절차와 방법을 상세히 설명하고, 물건을 볼 때 조심해야 할 부분과 계약할 때 놓치기 쉬운 부분을 수없이 반복해 알려준다.","처음 만나는 부동산의 모든 것!

부동산 시장의 변화와 함께 법 개정 정보까지 꼼꼼하게 반영한 『부동산 상식사전』. 왕초보 딱지를 떼는 핵심 부동산 강의로 시작해 전·월세부터 내 집, 상가, 토지, 경매까지 국내 최초로 부동산 전 분야를 체계적으로 정리했다. 각 부동산의 거래 절차와 방법을 상세히 설명하고, 물건을 볼 때 조심해야 할 부분과 계약할 때 놓치기 쉬운 부분을 잊지 않도록 반복해 알려준다.

특히 이번 개정판에는 정부의 부동산 규제 정책에 따른 ‘대출 규제에 따라 강화된 대출조건’, ‘변화된 조정대상지역, 투기과열지구, 투기지구’, ‘신혼부부를 위한 임대주택 및 공공주택’, ‘양도소득세 세율 변화와 종합부동산세 강화’ 등을 담았다. 변화된 시장에 발맞춰 ‘P2P 투자와 리츠’, ‘갭투자’, ‘재건축 재개발 투자 요령’ 등 최신 부동산 정보를 함께 정리했다",3454,BOOK
2019 태종국어 국가직대비 봉투모의고사,"이태종, 태종 국어연구소 (지은이)",34613,국내도서>수험서/자격증>공무원 수험서>7/9급 공무원>국어>기출/문제집/모의고사,9791186449820,2019 공무원 시험을 대비한 실전 모의고사 문제집이다. 실제 시험과 가장 유사한 유형과 난이도를 제공한다.,,275,BOOK
"20세기 기술의 문화사 - 핵, 우주, 인공지능, 생명공학으로 본 야누스의 과학기술",김명진 (지은이),51095,국내도서>과학>과학의 이해>과학사/기술사,9788958205210,"지난 백여 년 동안 새롭게 등장한 대표적인 과학기술이 정치경제, 대중문화와 뒤얽히며 어떻게 변화, 발전해 나갔는지를 추적한 연대기를 통해 독자들은 기술과 사회의 관계에 대한 적절한 길을 모색할 수 있다.","지나치게 과장되거나 과하게 낙관적인…
 새로운 기술을 대하는 우리들의 자세를 묻는다
 기술에 대한 열광과 비관을 넘어서

우리는 새로운 기술의 부상을 어떻게 바라보고 있는가? 현재 한국 사회에서 활발하게 논의 중인 미래기술(사물인터넷, 인공지능, 로봇…)은 우리에게 풍요롭고 편리한 생활은 물론 전례 없는 경제도약을 약속할 것처럼 그려진다. 다른 한편에서는 이러한 기술들이 인간의 자리를 빼앗는 어두운 미래를 예상한다. 미래기술의 논의들은 엄청나게 긍정적이거나, 엄청나게 부정적인, 양 극단으로 제시되곤 한다. 이러한 미래 예측은 누가, 어떤 이유에서 내놓는 것일까? 우리는 새로운 기술에 대해 어떤 태도를 취해야 할까? 그것이 현재 던져주는 함의는 무엇일까?

이 책은 2차대전 이후 새롭게 등장해 오늘날까지도 영향력을 발휘하고 있는 네 가지 기술―핵, 우주개발, 로봇/인공지능, 생명공학―의 사례연구를 통해 이러한 질문에 답해보려 한다. 지난 백여 년 동안 새롭게 등장한 대표적인 과학기술이 정치경제, 대중문화와 뒤얽히며 어떻게 변화, 발전해 나갔는지를 추적한 연대기를 통해 독자들은 기술과 사회의 관계에 대한 적절한 길을 모색할 수 있을 것이다.",2311,BOOK
"어째서 내 세계를 아무도 기억하지 못하는가? 2 - 타천의 날개, Novel Engine","사자네 케이 (지은이), neco (그림), 이경인 (옮긴이)",54719,국내도서>소설/시/희곡>라이트 노벨>노블엔진(Novel Engine),9791131995587,세계는 인류가 5종족 대전에서 패한 역사로 ‘덮어쓰기’ 당했다. 강대한 이종족이 지배하는 지상에서 유일하게 인간이 승리한 역사를 아는 소년 카이는 모든 인류에게 잊힌 존재가 되었음에도 영웅 시드의 검과 무술을 계승하여 ‘진정한 세계를 되찾겠다’고 결의하는데….,"악마족을 격파하고 이제 만신족의 영토로!
빠르게도 대히트! 압도적 반향을 불러일으킨 대작 판타지, 제2탄!

세계는 인류가 5종족 대전에서 패한 역사로 ‘덮어쓰기’ 당했다. 강대한 이종족이 지배하는 지상에서 유일하게 인간이 승리한 역사를 아는 소년 카이는 모든 인류에게 잊힌 존재가 되었음에도 영웅 시드의 검과 무술을 계승하여 ‘진정한 세계를 되찾겠다’고 결의한다. 
운명의 소녀 린네와 함께 악마의 영웅 바네사를 격파하고, 인류를 악마족에게서 해방하는 데 성공. 그리고 영광의 기사 잔과 함께 만신족의 영토 이오 연방으로 향한다. 천사나 엘프, 드워프들의 지배자에게서 카이가 본 것은, 만신족의 영웅 주천 알프레이야의 변모였다. 
“주천님께서는…… 변하셨다. 모든 건 그때부터…….”",337,BOOK
다시 쓸 수 있을까 - 77세에 글을 잃어버린 작가 테오도르,"테오도르 칼리파티데스 (지은이), 신견식 (옮긴이)",51373,국내도서>에세이>외국에세이,9791196587376,스웨덴 일간지 Svenska Dagladets No.1 베스트셀러. 문학적 위기를 마주한 스웨덴 현대문학 거장 테오도르 칼리파티데스의 지적이고 유머러스하며 철학적인 은퇴 번복 에세이다.,"스웨덴 일간지 Svenska Dagladets No.1 베스트셀러. 문학적 위기를 마주한 스웨덴 현대문학 거장 테오도르 칼리파티데스의 지적이고 유머러스하며 철학적인 은퇴 번복 에세이다. 뮤즈(시와 음악의 신)로부터 버림받은 기분을 느끼고 칼리파티데스는 이렇게 쓴다. 



“일을 하지 않으면 쓸모없는 존재가 된다.” 칼리파티데스에게 모든 책은 다음 책으로 가는 다리와 같았다. 마치 하나의 연애가 또 다른 연애로 이어지는 것처럼. 그랬기에 더욱더, 자기 정체성과 삶의 목적이 글쓰기와 불가분의 관계에 있는 작가에게 이 사태는 매우 치명적이며 중대한 사건으로 찾아왔다. 



다행히 그는 이 문제를 해결한 게 분명하다. 왜냐고? 우리가 들고 있는 바로 이 책이 그가 뮤즈에게 버림받은 이후 나온 책이기 때문이다. 《다시 쓸 수 있을까》는 이 사건 이후 칼리파티데스가 새로운 목표를 추구하면서 과거와 현재의 그를 만든 정신적, 물리적 세계를 거슬러 탐색하는 일종의 여행기다.",803,BOOK
"Re : 제로부터 시작하는 이세계 생활 제3장 5 - Truth of Zero, 노엔 코믹스","마츠세 다이치 (지은이), 나가츠키 탓페이 (원작), 오츠카 신이치로 (그림), 정홍식 (옮긴이)",4134,국내도서>만화>본격장르만화>판타지>드라마틱 판타지,9791131997819,"로즈월 저택을 노리는 마녀교를 타도하고자 용차를 타고 떠난 스바루. 하지만 그 도중에 백경이 나타나 렘이 희생되고 만다. 가까스로 저택에 돌아온 스바루는 에밀리아마저 잃고, 다시금 죽음의 루프에 돌입하는데…….","여기서부터 시작하자.
‘제로’부터 시작하는 이세계 생활을.

로즈월 저택을 노리는 마녀교를 타도하고자 용차를 타고 떠난 스바루.
하지만 그 도중에 백경이 나타나 렘이 희생되고 만다.
가까스로 저택에 돌아온 스바루는 에밀리아마저 잃고, 다시금 죽음의 루프에 돌입하는데…….
벗어날 수 없는 죽음의 루프. 집요한 마녀교의 악의.
어둠만이 스바루의 마음속을 지배하는 가운데, 그 마음을 비추는 한 줄기 빛이란──?

‘리제로’ 제3장. 제로부터 다시 시작하는 제5권.",394,BOOK
