title,author,genre_id,genre,ISBN,description_aladin,description_naver,salesPoint,mallType
그리고 아무도 없었다,"애거사 크리스티 (지은이), 이가형 (옮긴이)",51062,국내도서>소설/시/희곡>추리/미스터리소설>영미 추리/미스터리소설,9788938201010,"'열 개의 인디언 인형'이란 제목으로도 유명하다. 이미 잘 알려져 있는대로 떳떳하지 못한 과거를 지닌 열 명의 인물들이, 의문의 초대장을 받고 한 섬에 모여들면서 이야기가 시작된다.","크리스티의 작품 중 가장 뛰어나다고 평가받는 걸작!

추리소설의 여왕 애거서 크리스티 장편소설. 크리스티의 전작품 중에서 스릴과 서스펜스가 가장 뛰어나다고 인정받는 걸작이다. 이 작품은 영국에서는 《열 개의 인디언 인형》으로 발표되었다. 

인디언 섬이라는 무인도에 여덟 명의 남녀가 정체 불명의 사람에게 초대받는다. 여덟 명의 손님이 섬에 와 보니 초대한 사람은 없고, 하인 부부만이 그들을 기다리고 있다. 뒤이어 섬에 모인 열 사람이 차례로 죽어간다. 한 사람이 죽자, 식탁 위에 있던 열 개의 인디언 인형 중에서 한 개가 없어진다. 인디언 동요의 가사에 맞춰 무인도에 갇힌 열 사람은 모두 죽고 한 사람도 살아 남지 못한다. 인디언 섬에는 이들 열 명 외엔 아무도 없다. 섬에 갇힌 사람이 모두 살해되었으니 범인은 도대체 누구일까?

열 명의 기억 속에 묻혀 있는 범죄의 그림자, 또 그들의 다양한 직업과 성격. 애거서 크리스티는 이러한 배경을 하나도 놓치지 않고 치밀하게 연결시켜서 열 명의 죽음을 교묘하게 이끌어 나간다. 크리스티 특유의 섬세하고 치밀한 구성력과 대담한 문체가 돋보이며, 마지막 몇 장을 넘길 때까지 긴장을 늦출 수 없는 기교 또한 독자들에게 놀라움을 전해 준다. 처음부터 끝까지 사건을 쫓아가다가 범인을 알게 되는 순간 독자들은 피가 얼어붙는 듯한 느낌을 받게 될 것이다.",28690,BOOK
연금술사,"파울로 코엘료 (지은이), 최정수 (옮긴이)",50920,국내도서>소설/시/희곡>스페인/중남미소설,9788982814471,"세상을 두루두루 여행하기 위해 양치기가 된 청년 산티아고의 '자아의 신화' 찾기 여행담. 자칫 딱딱하게 보일 수 있는 제목과는 달리 간결하고 경쾌한 언어들로 쓰여 있어서, 물이 흘러가듯 수월하게 읽히는 작품이다.","삶에 대한 깊은 통찰을 담은 현대의 고전!

1987년 출간이후 전세계 120여 개국에서 변역되어 2,000만 부가 넘는 판매량을 기록한 파울로 코엘료의 『연금술사』. 청년 산티아고가 만물에 깃들인 영혼의 언어들을 하나하나 배워가는 과정을 그리고 있다. 마음의 목소리에 귀를 기울이는 것이 얼마나 중요한지를 증언하고, 진정 자기 자신의 꿈과 대면하고자 하는 모든 이들을 축복하는 희망과 환희의 메시지를 담은 작품이다. 

신부가 되기 위해 라틴어, 스페인어, 신학을 공부한 산티아고는 어느 날 부모님의 기대를 저버리고 떠돌아다니기 위해 양치기가 되어 길을 떠난다. 그의 인생을 살맛나게 해주는 건 ‘꿈이 실현되리라고 믿는 것’. 언제나 자신이 원하는 게 무엇인지 알고 있어야 한다는 늙은 왕의 말과 그가 건네준 두 개의 보석을 표지로 삼아 기약없는 여정에 뛰어든 그는 집시여인, 늙은 왕, 도둑, 화학자, 낙타몰이꾼, 아름다운 연인 파티마, 절대적인 사막의 침묵과 죽음의 위협 그리고 마침내 연금술사를 만나 자신의 보물을 찾게 되는데…….",82666,BOOK
마법의 설탕 두 조각,"미하엘 엔데 (지은이), 유혜자 (옮긴이)",48877,국내도서>어린이>동화/명작/고전>외국창작동화,9788935652792,"렝켄은 엄마 아빠가 자기 뜻을 전혀 존중해 주지 않는 것 같아 고민스럽다. 그 고민을 들은 요정은 렝켄에게 마법의 설탕 두 조각을 준다. 그걸 몰래 엄마, 아빠의 찻잔 속에 타 먹이면 엄마, 아빠가 렝켄의 말을 들어주지 않을 때마다 키가 반으로 줄어든다는 것이다.","엄마와 아빠를 어떻게 해야 좋을지 모르겠어요!

『마법의 설탕 두 조각』은 와 로 잘 알려져 있는 미카엘 엔데의 동화입니다. 엄마한테 신발 좀 빨아 달랬더니, 세상에, 다 컸다고 스스로 빨아 신으래요. 아빠한테 아이스크림 좀 사달랬더니, 많이 먹으면 배 아파서 안 된데요. 더할 나위 없이 온순한 아이 렝켄의 깜찍한 응징 작전이 시작됩니다. 빗물 거리의 요정을 찾아가서 마법의 각설탕 두 조각을 얻어 오면서부터, 렝켄의 엄마, 아빠에게는 황당한 일이 벌어집니다. 엄마, 아빠를 골탕먹인다고 정말로 렝켄이 행복해질 수 있을까요?",69875,BOOK
모모,"미하엘 엔데 (지은이), 한미희 (옮긴이)",48875,국내도서>어린이>동화/명작/고전>세계명작,9788949190020,"사람들에게서 행복과 풍요로움을 주는 시간을 빼앗아간 회색 신사들과 여자 아이 모모, 호라 박사 등이 벌이는 모험을 다룬 소설. 꿈 속에서 벌어질 법한 갖은 이야기들이 줄줄이 펼쳐진다.","시간은 삶이며, 삶은 우리 마음 속에 있다!

시간 도둑들과 도둑맞은 시간을 인간에게 찾아주는 어린 소녀 모모에 대한 이상하고도 흥미진진한 이야기. 독일의 문학작가, 미하엘 엔데의 작품으로, 현실과 꿈이 시처럼 어우러진 환상의 세계를 그려내고 있다. 

이탈리아의 어느 한 도시, 회색 사나이들이 지배하는 이 도시에 어디에서 왔는지 알 수 없는 '모모'라는 이상한 아이가 나타난다. 모모는 다른 사람의 이야기를 잠자코 들어줌으로써 인간에게 주어지는 시간의 풍요와 아름다움을 깨닫게 하는데…. 이 책을 통해 작가는 바쁘기 짝이 없고, 마음 놓고 쉴 수조차 없는 현대인들에게 '시간은 삶이고, 삶은 우리 마음속에 깃들어 있다'는 메시지를 전해준다.",75672,BOOK
2016 전효진 행정법총론 - 전2권,전효진 (지은이),34632,국내도서>수험서/자격증>공무원 수험서>7/9급 공무원>행정법>7/9급 교재,9791156173854,"이론과 필수적인 조문, 판례를 효과적으로 배치함으로써, 학습의 집중도를 더욱 향상 시킬 수 있을 것이다. 불필요하게 어려운 용어를 최대한 배제하고, 가급적 쉬운 말로 뜻이 정확히 전달될 수 있도록 하는데 노력을 기울였다.",,2221,BOOK
헌터x헌터 HunterXHunter 신장판 17,토가시 요시히로 (지은이),3724,국내도서>만화>소년만화>액션,9791125636724,"전작 「유유백서」로 90년대 메가 히트 작가로 등극한 토가시 요시히로의 또 하나의 히트 만화 [헌터×헌터]가 신장판으로 재탄생된다!! 연재를 시작한지 10년이 넘은 작품이지만 현재 단행본이 30권까지 나오며, 국내에서도 그 인기가 하늘 높은 줄 모르는 작품이다.",Yoshihiro Togashi 만화 『헌터x헌터』제17권. 처음엔 주먹! 가위!! 바위!! 보ㅡ!!!!「한 명의 해안선」을 차지하기 위한 피구 대결은 종반전에 돌입한다.힘의 차이를 과시하며 가차없는 공격을 쏟아내는 레이저에게 곤의 분노의 필살기가 작렬한다!!,642,BOOK
중국어 동요 - EBS 송지현 교수가 뽑은,송지현 (엮은이),70395,국내도서>유아>놀이책>CD북,9788937891564,"예쁜 그림책을 보면서 음악까지 즐길 수 있어 아이들이 참 좋아하는 음반 그림책 시리즈이다. 동요를 듣고 부르는 것은 유아의 음악 발달은 물론 언어 발달과 정서 발달, 심미적은 발달에 큰 도움이 된다.","솜사탕 CD북은 예쁜 그림책을 보면서 음악까지 즐길 수 있어 아이들이 참 좋아하는 음반 그림책 시리즈입니다. 동요를 듣고 부르는 것은 유아의 음악 발달은 물론 언어 발달과 정서 발달, 심미적은 발달에 큰 도움이 되지요. 아이세움의 솜사탕 CD북 [중국어 동요]는 중국어 동요를 따라 부르며 쉽고 재미있게 중국어를 익힐 수 있도록 만들었습니다. 우리 아이들이 살아갈 세상에서 중국어는 필수입니다.",724,BOOK
나와 그들과 그녀의 이야기 - 완결,"토지츠키 하지메 (지은이), 이정원 (옮긴이)",4134,국내도서>만화>본격장르만화>판타지>드라마틱 판타지,9788959197217,코마치 엄마를 환생시키려는 시도 이후 잠잠히 지내던 스즈키 선생의 집에 모인 네 사람. 여름밤에 걸맞은 기담 모임을 행하던 이들 앞에 오래 전 사라졌던 스즈키의 선배 나카무라 칸의 나타난다. 과연 그는 어디로 사라졌던 걸까…?,"생과 사의 경계를 넘나드는 현대판 환상 기담,  「나와 그녀와 시리즈」 그 마지막 이야기!

토지츠키 하지메의 매력적인 현대판 환상 기담『나와 그녀와 시리즈』의 마지막 편이 찾아왔다.『나와 그녀와 시리즈』는 생과 사의 경계를 넘나드는 이들의 이야기로, 2012년 시리즈의 앞선 이야기인『나와 그녀와 선생의 이야기』『나와 그녀와 선배의 이야기』가 출간된 바 있다.

『나와 그들과 그녀의 이야기』에서는 전 권의 등장 인물 이외에 새로운 인물들이 등장하며 또다른 이야기를 선사한다. 『나와 그녀와 선생의 이야기』『나와 그녀와 선배의 이야기』가 ‘선생(스즈키 카즈오)’를 중심으로 각각 켄신과 코마치, 나카무라 선배와 메이사라는 인물에게 일어난 주술과 환생의 이야기를 다루었다면, 『나와 그들과 그녀의 이야기』는 닐과 이라이자 남매라는 새 인물이 가세하며 보다 젊고 유쾌한 학원 기담을 들려준다.",102,BOOK
아따맘마 20,케라 에이코 (지은이),2552,국내도서>만화>코믹/명랑만화,9791157548002,,"Eiko Kera 만화 『아따맘마』제20권. 귀여운 2등신 캐릭터로 이루어진 언제나 정겨운 아리네 가족의 일상 속 소소한 사건·사고으로 안내하는 4컷 만화다. 슈퍼맘 엄마를 중심으로 귀여운 아리와 동동, 그리고 느긋한 아빠의 이야기가 흥미진진하게 펼쳐진다.",192,BOOK
알랭 바디우의 영화 - 영화에 대한 철학적 사유란 무엇인가?,"알랭 바디우 (지은이), 김길훈, 김건, 진영민, 이상훈 (옮긴이)",51042,국내도서>예술/대중문화>영화/드라마>영화이야기,9788968172373,"영화와 철학 간의 사유의 문제를 다룬 책이다. 1950년대부터 최근에 이르기까지의 글 모음집으로, 철학이 발견하려고 노력하는 본질의 보편적 가치가 영화 속에서 어떻게 종합되는지 잘 보여주며, 순수하지 못한 예술인 영화의 사유방식을 제안한다.","1950년대부터 최근에 이르기까지의 글 모음집인 이 책은 철학이 발견하려고 노력하는 본질의 보편적 가치가 영화 속에서 어떻게 종합되는지 잘 보여주며, 순수하지 못한 예술인 영화의 사유방식을 제안한다. 특히 바디유는 “철학의 작업은 단절이 있는 곳에서 개념의 종합을 만드는 것이고, 영화는 세계의 가장 진부한 갈등에서 순수함을 만드는 것이며, 이것이 바로 영화와 철학 간의 진정한 암묵적 동의이고, 영화와 철학이 상호 공유하는 지점이다”라고 단언한다.",472,BOOK
엄마는 예쁘다 - 육아의 블랙홀에 빠진 엄마들을 위한 힐링 에세이,김미나 (지은이),51790,국내도서>좋은부모>육아/교육 에세이,9788952773937,"두 아이의 엄마로, 자신의 육아 일상을 비범한 ‘글발’로 써내려가 많은 이들에게 폭풍 공감을 얻고 있는 블로거 알음알음(김미나). 외고, 명문대, 공기업… 소위 대한민국 엘리트 코스를 밟아온 그녀 역시 ‘엄마’라는 이름을 달고부터는 24시간을 끊임없는 돌봄 노동에 허덕이는 육아 노동자가 되었다.","두 아이의 엄마로, 자신의 육아 일상을 비범한 ‘글발’로 써내려가 많은 이들에게 폭풍 공감을 얻고 있는 블로거 알음알음(김미나). 외고, 명문대, 공기업… 소위 대한민국 엘리트 코스를 밟아온 그녀 역시 ‘엄마’라는 이름을 달고부터는 24시간을 끊임없는 돌봄 노동에 허덕이는 육아 노동자가 되었다. 



결혼 전 막연히 생각했던 엄마의 삶과 현실은 너무도 달랐다. 아이를 키우는 과정은, 삶을 하나부터 열까지 직접 만들어가는 일이었고, 자신의 유년시절을 되짚어보는 시간이기도 했다. 또한 절대 보고 싶지 않았던 내면의 밑바닥을 대면하는 일이기도 했다. 동시에 사랑의 원천을 엿보는 나날이기도 했다. 대신 아파해주고 싶은 마음이 무엇인지, 마음 속 가장 깊은 곳의 두려움이 무엇인지, 또 그것을 상쇄하는 기쁨과 감사가 무엇인지를 깨달으며 한 걸음 성숙해가는 과정이기도 했다.



저자는 이 책에서 대한민국 30~40대 여자들이라면 누구나 고민하는 문제들에 대한 ‘뜨거운 넋두리’를 풀어낸다. 몸부림친다고 해서 반드시 내 욕심만큼의 결과가 나오지 않는 육아의 수로고움, 자유로운 청년이었던 남녀가 부모가 되어가며 겪는 성장통, 가족과 가정의 진정한 의미, 아이를 키우는 과정을 통해 변화된 것들에 대한 이야기들은‘엄마’라는 이름으로 살아가는 모든 이들의 마음을 어루만지고 보듬어줄 것이다.",312,BOOK
로맨틱 블라썸,박윤애 (지은이),51125,국내도서>소설/시/희곡>로맨스소설>한국 로맨스소설,9791132221869,"박윤애의 로맨스 소설. 한 달에 한 번 꽃을 사던, 수상한 단골손님 유지한. 남자는 왜, 꽃을 한 달에 한 번씩, 사기 시작했을까. 남자의 꽃을 받는 여자는 누구일까. 수요일 오후 3시, 그와 그녀가 특별해지는 시간.","박윤애의 로맨스 소설. 한 달에 한 번 꽃을 사던, 수상한 단골손님 유지한. ""미니 클래스 반, 신청하려고 합니다만."" 조금 난감하다는 듯, 다가와 말을 건네는 남자. ""미니 클래스 반이요?"" 단번에 알아듣지 못할 만큼 의아해하는, 블라썸 플로리스트 이상하. 남자는 꽃을 사는 것도 모자라 이제는 꽃 포장을 배우겠다고 한다. 이상하고도 수상한, 그러나 결코 이상하지도, 수상할 것도 없는 남자.



남자는 왜, 꽃을 한 달에 한 번씩, 사기 시작했을까. 남자의 꽃을 받는 여자는 누구일까. 호기심이 호감으로 변하고, 높았던 경계심이 스르륵 무너지는 시간. 수요일 오후 3시, 그와 그녀가 특별해지는 시간.",73,BOOK
오늘은 회사 쉬겠습니다 8,후지무라 마리 (지은이),2552,국내도서>만화>코믹/명랑만화,9791157547937,하나에는 33세 생일을 솔로 경력 33년 & 처녀 경력 33년으로 맞이하게 됐다. 대학교 1학년 때 딱 한 번 있었던 기회를 놓친 것을 아직도 후회하고 있는 그녀. 이제는 처녀인 것은 빈티지라고 할 만큼 속이 배배 꼬인 그녀에게 생일의 기적이 일어나는데…,"Mari Fujimura 만화 『오늘은 회사 쉬겠습니다』제8권. 타노쿠라와 결혼하기로 결정, 행복감으로 가득한 하나에. 그러나 회사가 합병되고  사무직은 정리해고 당할지도 모른다는  히토미의 말에 갑작스레  초초함에 휩싸이기 시작한다.  타노구라에게도 보고하려 하지만,  입사 합숙연수에 가서 부재 중.  큰맘 먹고 아사오에게 상담을 하는데….",297,BOOK
중국의 장사꾼들 - 세계 최고 장사꾼은 무엇이 다른가,"양훙젠 (지은이), 정세경 (옮긴이)",70215,국내도서>자기계발>성공>성공담,9791185952147,"중국 비즈니스계의 슈퍼맨이라 불리는 리자청을 비롯해 샤오미와 알리바바를 제치고 중국에서 기업브랜드 가치 1위를 차지한 QQ메신저의 텐센트, 유럽 최대의 화교 기업 천씨 형제 회사의 천케웨이 등 50명이 넘는 중국 기업인들의 흥미로운 기업스토리가 가득하다.","중국 장사꾼의 10가지 성공 법칙!

2014년 중국의 GDP는 미국에 이어 두 번째로 높으며 경제성장률은 7%대를 유지하고 있다. 그 배경에는 아랍인, 유대인과 함께 세계의 3대 상인으로 일컫는 중국의 장사꾼이 있다. 그들은 중국 본토에서만이 아니라 세계 각지에서 엄청난 생명력과 경쟁력을 보여준다. 『중국의 장사꾼들』은 업종을 넘나드는 중국 장사꾼들의 수많은 사례를 통해 장사불변의 법칙을 찾아낸다. 

신용, 기회, 행동, 예상, 협력, 처세, 투자, 전략, 연마, 관리라는 10가지 법칙에 현대를 움직이는 중국 상인의 사례가 흥미진진하게 펼쳐진다. 중국 비즈니스계의 슈퍼맨이라 불리는 중국 최대의 부자 리자청을 비롯해 샤오미와 알리바바를 제치고 중국에서 기업브랜드 가치 1위를 차지한 QQ메신저의 텐센트, 유럽 최대의 화교 기업 천씨 형제 회사의 천케웨이 등 50명이 넘는 중국 기업인들의 성공 스토리가 가득하다. 생생한 사례와 흥미로운 뒷이야기로 그들만의 독특한 상술을 배울 수 있을 것이다.",216,BOOK
부자는 모두 사모펀드로 돈을 번다 - 1000만 원으로 100억 부자 된 사람들,김태희 (지은이),174,국내도서>경제경영>재테크/투자>주식/펀드,9791155321713,현직 투자 큐레이터인 김태희 저자가 사모펀드에 대한 모든 것을 알려주는 책을 펴냈다. 저자는 자신처럼 투자를 통해 인생을 바꾸고 싶지만 투자는 너무 어렵다는 생각에 시도조차 못 하는 사람들을 위해 이 책을 썼다.,"사모펀드, 초저금리 시대의 마지막 투자처!

1% 초저금리 시대, 더이상 절약과 저축만으로는 종잣돈을 모으고 불리기는 쉽지 않다. 이에 지난 20여 년간 전 세계적으로 평균 11%가 넘는 수익률을 기록하고 있는 사모펀드 투자에 대한 관심이 높아지고 있다. 그동안 최소투자금이 워낙 커서 부자나 기관의 전유물로 여겨졌지만 이제는 백만 원에서 천만 원대로 투자 가능한 상품들이 늘어나고 있다. 

『부자는 모두 사모펀드로 돈을 번다』는 사모펀드 투자회사에서 투자 큐레이터로 활동 중인 저자 김태희가 소액투자자가 쉽게 따라 할 수 있는 사모펀드 투자 방법을 안내한 책이다. 믿을 만한 투자회사와 상담사를 고르는 법부터 장ㆍ단기 자금 계획에 따른 투자 방법, 실제 사모펀드 투자로 성공한 사례들까지, 개인투자자가 사모펀드 투자에 대해 알아야 할 모든 것이 담겨 있다.",606,BOOK
그레인 브레인 - 탄수화물이 뇌에 미치는 파괴적인 영향을 폭로한다!,"데이비드 펄머터 (지은이), 이문영, 김선하 (옮긴이), 윤승일 (감수)",53556,국내도서>건강/취미>건강정보>음식과 건강,9788952773715,"미국의 저명한 신경과 의사인 데이비드 펄머터는 탄수화물이 어떤 과정을 통해 뇌에 악영향을 미치는지에 대해 자세히 밝히고 있다. 통곡물마저도 치매, ADHD, 간질, 불안, 만성 두통, 우울증, 성욕 저하를 비롯해 매우 많은 질환을 유발할 수 있다고 한다.","미국의 저명한 신경과 의사인 데이비드 펄머터는 이 책을 통해 탄수화물이 어떤 과정을 통해 뇌에 악영향을 미치는지에 대해 자세히 밝히고 있다. 저자에 따르면 사람들이 흔히 몸에 좋은 탄수화물로 알고 있는 통곡물마저도 치매, ADHD, 간질, 불안, 만성 두통, 우울증, 성욕 저하를 비롯해 매우 많은 질환을 유발할 수 있다고 한다. 



《그레인 브레인》은 뇌 건강을 좌지우지하는 것은 유전자가 아니라 우리가 먹는 ‘음식’에 있다고 경고한다. 대부분의 사람들이 통곡물, 과일 등을 ‘좋은 탄수화물’로 오해하고 많이 먹으려 하는 반면, ‘지방’은 건강이나 다이어트의 적으로 보고 적게 먹는 실수를 저지르고 있다. 저자는 우리가 매일 먹는 밥, 빵, 과일과 같은 흔한 음식이 뇌에 어떤 영향을 미치는지, 좋은 지방이 많은 식단이 왜 이상적인지, 나이와 상관없이 어떻게 하면 새로운 뇌세포의 성장을 촉진할 수 있는지에 대해 설명한다.



이 책을 읽은 사람들만이 그동안 자신이 자잘하게 앓아 왔던 두통이나 잔병의 원인을 찾아낼 수 있고 나아가 ‘사람들이 가장 걸리기 싫어하는 병 1위’인 치매를 비롯한 무시무시한 뇌 질환을 예방할 수 있는 행운권을 획득할 수 있다.",1967,BOOK
차일드 44 - 3 - 에이전트 6,"톰 롭 스미스 (지은이), 박산호 (옮긴이)",107436,국내도서>소설/시/희곡>액션/스릴러소설>외국 액션/스릴러소설,9788901204079,"전 세계 36개국 출간, 400만 부가 넘게 팔린 &lt;차일드 44&gt; 3부작. 철저한 감시가 지배하는 사회에서 벌어진 44명의 연쇄 살인 사건을 파헤치게 된 한 남자의 길고 외로운 싸움을 담은 작품으로, 출간 즉시 베스트셀러에 오르며 CWA 대거 상 수상, 맨 부커 상 후보 등 7개의 국제 문학상을 수상했다.","세계를 뒤흔든 전설의 미스터리 스릴러!

리들리 스콧 제작, 톰 하디, 게리 올드만 주연의 영화 《차일드 44》의 원작 소설. 철저한 감시가 지배하는 사회에서 벌어진 44명의 연쇄 살인 사건을 파헤치게 된 한 남자의 길고 외로운 싸움을 담은 작품이다. 출간 즉시 베스트셀러에 오르며 CWA 대거 상 수상, 맨 부커 상 후보 등 7개의 국제 문학상을 수상한 이 작품은 총 3부작으로 구성되어 있다. 

팽팽한 긴장감 속에서 긴박하게 진행되는 스릴러의 묘미와 함께, 평생을 분투하며 싸우는 한 남자의 진실한 인간애가 돋보이는 『차일드 44』 시리즈의 세 번째 작품 《에이전트 6》는 모든 걸 잃고도 끝까지 진실을 쫓는 국가 요원 레오 데미도프의 치열한 사투를 담고 있다.

냉전의 갈등과 긴장이 누그러졌다고 생각할 무렵, 뉴욕에서 미국인과 소련인이 살해당하는 사건이 발생한다. 단순 치정에 의한 살인이라고 보도된 이 사건은, 은퇴 후 평범한 일상을 보내던 전 국가 요원 레오 데미도프의 삶을 송두리째 흔든다. 그는 이 배후에 ‘에이전트 6’라는 의문의 인물이 있다는 걸 알게 되는데…….",567,BOOK
"가라, 흩어진 너희 몸들로","필립 호세 파머 (지은이), 안태민 (옮긴이)",89481,국내도서>소설/시/희곡>과학소설(SF)>외국 과학소설,9791186294055,1972년 휴고상 장편 부문 수상작. 어디서부터 시작되었으며 어디에서 끝나는지 도무지 알 수 없는 거대한 강이 흘러가는 낯선 행성. 아라비안나이트를 영어로 번역하기도 했던 언어의 대가이자 탐험가였던 리처드 프랜시스 버턴은 미지의 그곳에서 눈을 뜬다.,,539,BOOK
파고다 끝토익 적중 실전 1000제 LC 1,파고다교육그룹 언어교육연구소 (지은이),49855,국내도서>외국어>토익>Listening,9788962816563,끊임없이 변화하는 토익 트렌드에 기민하게 대처하기 위해 적중률 높은 문제만 엄선해 만든 토익 실전서. 파고다의 토익 강사진이 최신 기출문제와 토익 응시자 DB 분석을 바탕으로 최신 경향 핵심 빈출 유형을 골라 10회분 모의고사로 구성했다.,,469,BOOK
2015 전효진 행정법각론 핵심정리,전효진 (지은이),34634,국내도서>수험서/자격증>공무원 수험서>7/9급 공무원>행정법>조문/판례/법령/기타,9791156173274,기본적으로 행정법각론 학습에 필요한 모든 부분을 주제 단위로 엮어 구성하였다. 본 교재는 기존의 획일적인 편-장-절 구성의 공식에서 벗어나 행정법각론의 핵심을 내용 단위로 학습의 흐름에 맞게 구성하여 학습자의 전체적인 이해를 도울 수 있도록 하였다.,,242,BOOK
