title,author,genre_id,genre,ISBN,description_aladin,description_naver,salesPoint,mallType
마흔 식사법 - 영양은 올리고 체중은 줄이는 식사의 10가지 법칙,"모리 다쿠로 (지은이), 박재현 (옮긴이)",53562,국내도서>건강/취미>건강정보>건강에세이/건강정보,9791185435930,"나이가 들어서는 ‘물질대사를 높여 주는 식사’를 하는 데 초점을 맞출 필요가 있다. 근육의 재료가 되는 단백질과 지방의 연소를 촉진하는 양질의 지방, 물질대사에 사용되는 비타민과 미네랄이 풍부하게 들어 있는 식품을 충분히 잘 먹는 것이다.","나이가 들어서는 ‘물질대사를 높여 주는 식사’를 하는 데 초점을 맞출 필요가 있다. 근육의 재료가 되는 단백질과 지방의 연소를 촉진하는 양질의 지방, 물질대사에 사용되는 비타민과 미네랄이 풍부하게 들어 있는 식품을 충분히 잘 먹는 것이다. 그리고 영양소가 적고 대사이상의 원인이 되는 당을 과다 섭취하거나 식물성 지방 같은 조악한 기름을 사용한 식품을 먹지 않는 것이다.



마흔이 넘어서 체중조절을 할 때 가장 염두에 두어야 할 것은 ‘제대로 된 영양 섭취’다. 나이를 먹으면 필연적으로 소화흡수 능력이 떨어지기 때문에 20대와 같은 양의 단백질을 섭취해도 동일한 양의 근육이 생기지 않는다. 게다가 생명유지와 관련된 지방의 흡수력은 쇠퇴하지 않고 오히려 더 쉽게 축적된다. 그래서 40대에는 20대 시절과 똑같이 먹어도 살이 찌고, 남녀를 가리지 않고 모두 몸매가 둥글둥글해지는 것이다.



그렇다면 어떻게 체중조절을 하면서 건강도 해치지 않을 수 있을까? ‘닥치고 단백질 섭취’다. 단백질은 근육을 비롯해 피부, 머리카락, 뼈, 혈액, 내장 등 우리 몸의 모든 구성요소를 만드는 데 필요한 기본 영양소이므로 열량을 줄이는 방편으로 단백질 섭취를 줄여서는 절대로 안 된다. 또 날렵한 몸매에 필요한 근육을 증가시키기 위해서도 운동보다 충분한 단백질 섭취가 훨씬 효율적이다.",761,BOOK
초판본 데미안 (양장) - 1919년 오리지널 초판본 표지디자인,"헤르만 헤세 (지은이), 이순학 (옮긴이)",50922,국내도서>소설/시/희곡>독일소설,9791159031076,"헤르만 헤세의 &lt;데미안&gt;은 1차, 2차 세계 대전 이후 현대 독일 문학에서 ‘전쟁’과 ‘개인’의 관계를 치밀하게 제시한 선구적인 작품이다. 이 책은 1919년 헤르만 헤세가 ‘에밀 싱클레어’라는 이름으로 출판한 초판본 표지 디자인을 그대로 따르고 있다.","헤르만 헤세가 1919년 ‘에밀 싱클레어’라는 가명으로 출판한 소설『데미안』을 오리지널 초판본 표지 디자인으로 만날 수 있다. 이 작품은 1차 세계대전이 끝난 후 재출발을 다짐한 헤르만 헤세 제2의 데뷔작이다. 자아 찾기를 삶의 목표로 삼고 내면의 길을 지향하며, 현실과 대결하는 영혼의 모습을 치밀하게 그린다. 즉, 유년 시절 수채화처럼 펼쳐진 헤세의 치열한 성장 기록이라 할 수 있다. 《데미안》을 통해 세상의 수많은 ‘에밀 싱클레어’들이 자기 탐구를 거쳐 삶의 근원적인 힘을 깨닫길 바란다. 그때 비로소 내면에서 울려 퍼지는 운명의 목소리를 듣게 될 것이다.",7449,BOOK
플루언트 - 영어 유창성의 비밀,조승연 (지은이),51542,국내도서>인문학>기호학/언어학>언어학/언어사,9788937846243,21세기에는 감정과 숨겨진 뉘앙스를 꿰뚫어 볼 수 있는 새로운 영어 공부법이 필요하다. 조승연 저자는 이 책에서 우리가 영어를 배울 때 꼭 필요한 사고 도구가 필요함을 강조하면서 외국인과 감정 코드까지 소통할 수 있는 영어 유창성의 비밀을 공개한다.,"외국어를 배운다는 것은 인간의 뇌리에 깊숙이 박힌 선입견을 송두리째 뽑아내고 사고 체계를 완전히 뒤집는 훈련을 통해 타 문화에 대한 호기심을 탐구의 대상으로 보고 몸으로 직접 받아들이는 일이다. 문화와 지식 체계가 전혀 다른 외국인의 언어를 배우려면 그들 언어 이면에 담긴 인문학 지식과 역사적 배경, 우리와 다른 사고방식의 차이부터 숙지해야만 한다.



‘영어 유창성’은 타 문화를 능동적이고 진취적인 태도로 바라보고 이해하는 데서 시작된다. 글로벌 시대인 지금, 영어는 내가 세계 속의 수많은 사람들과 소통할 수 있게 해주는 필수 도구이다. 이 책은 영어가 왜 절실히 필요하며 어떻게 해야 영어 고민에서 해방될 수 있는지 친절하게 안내해준다.



조승연 저자는 고등학교 유학 시절 영어 시 낭독의 중요성을 배우면서 영어를 비롯한 외국어의 ‘감’을 제대로 알았다. 또한 인문학 고전 작품을 통해서 그들의 공통 문화 지식에 눈을 뜨고 합리적 사유의 바탕이 되는 서양 철학의 흐름을 이해하면서 우리(동양인)와는 다른 그들의 눈을 통해 시간과 공간을 나누는 기준을 파악했다.



중세 유럽인들이 '라틴 문명기'에 살았다면 우리가 살고 있는 21세기는 ‘영어 문명기’다. 영어는 지금도 실시간으로 그 모습이 조금씩 변하고 있다. 제대로 된 영어공부는 전 세계 10억 명의 눈으로 세상을 바라볼 수 있는 기회다. 지금까지 우리가 고집해온 방식을 과감하게 버리고 영어를 대하는 마음의 자세를 바꾼다면 올바른 영어 공부 방법은 저절로 따라올 것이다.",4228,BOOK
2017 선재국어 수비니겨 날로쓰는 어법과 국어 규범 - 전3권,이선재 (지은이),34612,국내도서>수험서/자격증>공무원 수험서>7/9급 공무원>국어>7/9급 기본서 및 부교재,9791156177722,"‘수비니겨 국어 문법’은 문법 이론을 장면별로 풀어 써서 국어 문법에 보다 쉽게 접근할 수 있으며,  ‘수비니겨 국어 규범’은 어문 규정의 전체 내용을 이론별로 정리한 뒤에 문제로 확인할 수 있도록 하였다. ‘날로쓰는 실전 문제’는 객관식과 주관식을 병행하여 암기까지 책임질 수 있도록 구성하였다.",,1330,BOOK
코믹 메이플 스토리 오프라인 RPG 87,"송도수 (지은이), 서정은 (그림)",49995,국내도서>어린이>TV/만화/영화>만화 일반,9788926385524,"2004년 4월에 1권을 출간하여 지금까지, '8년 연속 초특급 베스트셀러', '1200만부 돌파'를 기록하며 독자들의 꾸준한 사랑을 받고 있는 아동 만화책이다. 개성만점의 주인공들, 3D그래픽을 사용한 입체적이고 풍부한 색감의 그림이 돋보인다.","어휘력, 이해력, 상상력 UP!

『코믹 메이플스토리』는 2004년 4월에 1권을 출간하여 지금까지, ‘13년 연속 초특급 베스트셀러’,‘1800만 부 돌파’, ‘대한민국 아동만화 최초 중국 제 8회 금룡상 최고해외작품상 수상’ 등을 기록하며 독자들의 꾸준한 사랑을 받고 있는 아동만화책입니다. 번뜩이는 상상력으로 가득한 이야기, 3D그래픽을 사용한 입체적이고 풍부한 색감의 그림, 우정과 용기로 성장해가는 주인공들을 통해 어린이 독자들의 마음을 사로잡으며, 매권 출간 때마다 아동만화부문에서 폭발적인 인기를 얻고 있습니다. 

만화 장르의 흥미진진한 재미와 더불어 어린이들의 정서에도 유익함을 전달하고자 기획된 『코믹 메이플스토리』는 ‘오락’과 ‘교육’이 어우러져 특히 어린이들의 긍정적인 가치관 함양에 도움을 줍니다.",738,BOOK
너무 시끄러운 고독,"보후밀 흐라발 (지은이), 이창실 (옮긴이)",51036,국내도서>소설/시/희곡>세계의 소설>동유럽소설,9788954641548,"체코의 국민작가 보후밀 흐라발의 대표작. 흐라발 본인이 '나는 이 작품을 쓰기 위해 세상에 나왔다'고 선언할 만큼 그의 정수가 담긴 작품이며, 필생의 역작이라 불릴 만한 강렬한 소설로 많은 독자와 평단의 사랑과 주목을 받았다.","한 세계의 종말을 목격하는 늙은 몽상가의 긴 명상!

현대 체코 문학의 거장 보후밀 흐라발의 장편소설 『너무 시끄러운 고독』. 저자 본인이 ‘나는 이 작품을 쓰기 위해 세상에 나왔다’고 선언할 만큼 그의 정수가 담긴 작품이며 필생의 역작이라 불릴 만한 강렬한 소설로, 많은 독자와 평단의 사랑을 받았다. 삼십오 년간 폐지 압축공으로 일해온 한탸라는 한 늙은 남자의 생애를 통해 책이 그저 종이쪼가리로 취급받게 된 냉혹한 사회에서 살아가는 한 인간의 정신 상태를 섬세한 문체로 그려내고 있다. 끊임없이 노동해야 하는 인간, 그리고 노동자를 대신하는 기계의 등장 이후 인간 삶의 방식의 변화, 인간성과 실존에 대한 고뇌 등에 대한 깊이 있는 통찰을 보여주는 작품이다.

소설의 화자인 한탸는 어두침침하고 더러운 지하실에서 맨손으로 압축기를 다루며 끊임없이 쏟아져들어오는 폐지를 압축한다. 천장에는 뚜껑문이 있고 그곳에서는 매일 인류가 쌓은 지식과 교양이 가득 담긴 책들이 쏟아져내린다. 니체와 괴테, 실러와 횔덜린 등의 빛나는 문학작품들은 물론, 미로슬라프 루테나 카렐 엥겔뮐러가 쓴 극평들이 들어 있는 잡지들까지. 한탸의 임무는 그것들을 신속히 파쇄해서 압축하는 일이지만 그는 파괴될 운명인 폐지 더미의 매력에 이끌린다. 

그는 쏟아지는 책들을 읽고 또 읽으며 ‘뜻하지 않게’ 교양을 쌓게 된다. 한탸는 마치 알코올처럼 폐지 속에 담긴 지식들을 빨아들인다. 귀한 책들은 따로 모으다보니 그의 아파트는 수톤의 책으로 가득차 있다. 여차하면 무너질 듯이 아슬아슬하게 쌓인 책들은 그의 고독한 삶에서 나름의 행복을 느끼게 해주는 유일한 즐거움이다. 마치 시시포스의 신화처럼 끊임없이 노동을 지속해나간다. 그 일을 견디려면 매일 수리터의 맥주를 마셔야 할 정도로 고되지만, 그는 삼십오 년간 그 일을 해왔으며, 퇴직하게 된다 해도 압축기를 구입해 죽는 그 순간까지도 그 일을 하기를 꿈꾼다.",16035,BOOK
"신동엽, 성시경은 오늘 뭐 먹지? - 매일 집밥 솔루션","O'live &lt;신동엽, 성시경은 오늘 뭐 먹지?&gt; 제작팀 (엮은이)",53472,국내도서>요리/살림>생활요리,9788927808138,"신&성 두 남자의 고군분투 가정 요리 정복기가 118개의 메뉴와 함께 리얼하게 담겨 있다. 특히 한식, 중식, 일식, 유럽식, 미국식 등 요리 카테고리별 시청률 Top 10 메뉴를 정렬, 높은 시청률을 기록한 메뉴 중심으로 구성한 것에 주목할 만하다.","그나저나... 오늘 뭐 먹지?

매일 뭘 해 먹어야 할지 고민하는 이들에게 집 안에 있는 재료로 누구나 손쉽게 만들 수 있는 레시피를 소개하는 방송 프로그램이다. 2014년 9월 22일, O’live 채널에서 야심차게 기획한 가정식 레시피쇼로, 첫 회부터 지금까지 신동엽&성시경의 환상 케미 덕에 꾸준한 인기를 얻고 있다.

매주 월요일은 두 MC가 오늘 뭘 먹을지에 대한 리얼한 고민으로 시작, 좌충우돌 실패를 거듭하고 성공을 만끽하며 집밥을 완성하는 《오늘 뭐 먹지?》 코너가 진행된다. 신동엽의 두부조림, 꽈리고추베이컨말이, 닭 한마리, 월남쌈, 에그인헬 등이 이곳에서 탄생했고, 성시경의 베를린김밥, 차박된장찌개, 파채양념삼겹, 마파두부, 봉골레파스타 또한 이 코너를 통해 히트작이 되었다. 그리고 두 사람의 합작품, 밀푀유나베는 지금껏 회자되는 최고의 메뉴가 되었다. 

그런가 하면 매주 목요일은 요리 대가를 초청해 제대로 배워보는 시간, 《배워봅시다》 코너가 이어진다. 홍쌍리 대가의 매실청, 양희은 대가의 무수분 된장찜, 김소희 대가의 굴묵은지달걀찜, 강순의 대가의 삼색전, 이연복 대가의 사천짬뽕, 샘 킴 대가의 알리오올리오, 최현석 대가의 전복들기름파스타, 김훈이 대가의 버팔로윙 등이 화제작이며 이 책 안에 실린 메뉴들이기도 하다. 

그렇게 2년 넘게 이어진 신&성 두 남자의 고군분투 가정요리 정복기가 118개 메뉴로 엄선되어 이 책 안에 담겼다. 각 카테고리별 시청률순으로 메뉴를 선정한 것 또한 주목할 만하다. 요리 초짜를 위한 상세 레시피는 물론 미방본 깨알 쿠킹 팁과 방송 비하인드 스토리까지 한눈에 확인할 수 있다.",1637,BOOK
이토록 어여쁜 그림책 - 어느날 문득 어른이 된 당신께 드리는 그림책 마흔네 권,"김지은, 한미화, 최현미, 이상희 (지은이)",51380,국내도서>에세이>독서에세이,9791186195901,"네 명의 그림책 전문가가 건네는 책이라는 따뜻한 위로. 이 책은 오늘 현재, 이 땅을 고군분투 살아가고 있는 이들에게 그림책이라는 단순하고 어여쁜 세상, 무해하고 선한 공간에서 잠시 쉬며 힘을 얻으라고 그림책 전문가들이 건네는 따뜻한 위로이자 응원이다.","복잡한 세상을 사는 어른에게 건네는 '그림책'이라는 위로.

관계는 늘 상처를 동반하고, 일에는 늘 평가가 따라붙게 되어 있으며, 심지어 자기 자신마저 좌절과 극복, 용서와 화해의 대상이 되곤 하는 지금. 온갖 의미와 해석이 난무하는 시대라는 복잡함 속에서 유해함은 없어선 안 될 존재다. 어른이 된다는 건 이 복잡함과 유해함의 줄타기를 얼마나 능숙하게 타고 넘어 안전하게 땅에 발을 딛느냐의 과정일지도 모른다. 오늘 안전하다고 해서, 내일도 모레도 안전하리라고 누구도 보장 받지 못한다. 언제나 불안하며 이로 인한 스트레스는 해소될 길이 없다. 

『이토록 어여쁜 그림책』은 시인이자 그림책 작가인 이상희, 일간지 기자 최현미, 출판평론가 한미화, 동화작가이자 아동문학평론가인 김지은 네 사람이 ‘그림책’을 통해 어른들에게 따뜻한 위로를 건네는 책이다. 그림책은 어린이들만 보는 것이라고 생각하는 어른들에게  어여쁘고 다정한 세계로 들어올 것을 권하고, 그림책을 읽고 싶지만, 어떤 것부터 읽어야 할지 망설이는 어른들에게 어떤 책을 언제 읽으면 좋은지를 말해준다.",2032,BOOK
종이접기 인형놀이 집 - 입체 플레이 하우스 보드 북과 종이접기 책으로 구성된 창의력 토이 북,"후이 보운 리 (지은이), 박상은 (옮긴이)",35113,국내도서>유아>놀이책>유아 만들기/접기,9791157529209,"창의력 발달에 좋은 놀이 아이템인 인형의 집, 종이접기 책, 패턴 색종이를 한 세트로 구성해서 만든 창의력 놀이 세트이다. 놀이를 통해 소근육 발달은 물론 색감과 창의력 발달, 정리정돈 습관까지 기를 수 있다.","창의력 발달에 좋은 놀이 아이템인 인형의 집·종이접기 책·패턴 색종이를 한 세트로 구성해서 만든 창의력 놀이 세트예요. 놀이를 통해 소근육 발달은 물론 색감과 창의력 발달, 정리정돈 습관까지 기를 수 있어요. “엄마 놀아 줘!”라는 말에 스마트폰을 켜는 부모, 놀이와 학습이 결합된 교구를 찾는 선생님, 종이접기와 소꿉놀이를 좋아하는 아이에게 좋아요. 고급스럽고 예쁜 세트로 구성되어 선물용으로도 좋아요.",364,BOOK
죽여 마땅한 사람들,"피터 스완슨 (지은이), 노진선 (옮긴이)",107436,국내도서>소설/시/희곡>액션/스릴러소설>외국 액션/스릴러소설,9791156756552,"""메스처럼 예리한 문체로 냉정한 악의 본질을 탐구하는 작가 &lt;퍼블리셔스 위클리&gt;""라는 극찬과 함께 단숨에 길리언 플린 같은 스릴러 소설의 거장과 대등한 반열에 올라선 피터 스완슨 소설. 낯선 공간에서 우연히 만난 두 남녀가 서로 내밀한 사생활을 털어놓으며 이야기가 시작된다.","차분하고 치밀하게 자신만의 방식으로 심판에 나서는 한 여자의 이야기!

낯선 공간에서 우연히 만난 두 남녀가 서로 내밀한 사생활을 털어놓으며 이야기가 시작되는 소설 『죽여 마땅한 사람들』. 저자는 이 작품에서 피가 흘러넘치는 잔혹함도 누가 봐도 나쁘다고 손가락질할 사람이 아닌 우리 주변에 하나쯤 있을 만한 사람들을 모아서 그들 사이에 일어날 수 있는 일, 그들이 증오를 처리하는 방식을 제시한다. 작품 속 인물들은 용서할 수 없기에 복수를 계획하고 실행한다, 비록 살인일지라도.

히스로 공항 라운지 바에서 우연히 마주친 두 남녀. 사업에 성공한 결혼 3년차의 테드는 빨간 머리에 깡마르고 바닷물처럼 투명하고 초록빛이 도는 푸른 눈동자를 지닌 릴리를 만난다. 마침 비행기가 지연되었기에, 테드는 언제든 반대 방향으로 갈라설 수 있는 공항의 법칙에 입각해 그녀에게 일주일 전 이야기를 털어놓는다. 우연히 아내가 바람을 피운다는 것을 눈치 챘고, 마침내 현장을 목격했다고. 그래서 출장 내내 고통스러웠다며 릴리에게 쏟아내듯 속마음을 말했다. “이제 어떻게 할 거예요?”라고 묻는 릴리에게 “아내를 죽이고 싶어요. 그게 내가 정말로 원하는 거죠” 하며 테드는 농담이라는 신호로 윙크를 해보인다. 하지만 “나도 당신과 같은 생각이에요”라고 말하는 릴리의 눈빛은 너무나도 진지한데…….

릴리는 어릴 때부터 예술가, 작가, 엄마아빠의 새 애인과 전 애인이 뒤섞여 섹스 파티를 기묘한 상황에 노출되어 있었다. 그러던 어느 날, 릴리는 기르던 고양이를 괴롭히는 길고양이를 죽여 버리고, 이것이 그녀만의 완벽한 문제 해결 방식으로 자리 잡는다. 얼핏 고요해 보이는 일상이지만 그녀는 여전히 자신에게 상처를 주는 사람들을 쓰레기를 치우듯 차례차례 죽여 나간다. 살인은 분명 나쁜 짓이지만, 저자는 뛰어난 구성과 매력적인 캐릭터로 살인의 당위를 만들어낸다. 다시는 전과 같은 인생을 살 수 없게끔 만든 사람이 있다면, 내가 그 사람을 죽일 자신이 있다면, 시체도 완벽히 숨길 수 있다면, 당신은 어떤 선택을 할 것인가. 이 질문에 머뭇거릴 수밖에 없는 마음이 우리가 릴리를 비난만 할 수 없는 이유가 된다.",11675,BOOK
2017 Smart 2400제 기출문제 선행정학,김중규 (엮은이),34636,국내도서>수험서/자격증>공무원 수험서>7/9급 공무원>행정학>기출/문제집/모의고사,9791195643677,"최신 기출문제와 단원별 기출문제를 완벽하게 정리하고 정답이 논란되었던 문제들도 모두 포함하였으며, 최대한 간결하고 명쾌한 해설과 더불어 정리가 필요한 부분은 도표로 깔끔하게 정리하였다.",,2739,BOOK
나는 세상을 리셋하고 싶습니다,엄기호 (지은이),51059,국내도서>사회과학>비평/칼럼>한국사회비평/칼럼,9788936486082,"저자 엄기호는 과격화된 세계와 개인을 가장 깊숙한 곳에서부터 파헤친다. 혐오와 리셋의 감정이 어디에서부터 비롯되는지, 그리고 그 끝은 무엇인지, 그럼에도 우리 사회는 어떤 희망을 가질 수 있는지를 날카롭게 분석하고 있다.","혐오와 리셋의 감정 속, 한국 사회는 어떤 희망을 가질 수 있는가?

세월호 이후 변하지 않는 국가, 당리당략에 목숨을 건 정치인들, 제 자신의 안위만을 챙기는 기득권자들, 자그마한 권력이라도 쥐었다 하면 ‘갑질’을 행사하는 사람들에게 분노한 이들의 마음속에는 “싸그리 망해버려라” 하는 ‘리셋’의 감정이 자라나는 중이다. 변화의 갈망과 파괴의 감정이 동시에 터져 나오는 이 시점, 그 근원을 캐묻고 다시 역사로 귀환하는 방법을 찾기 위해 손꼽히는 파워라이터인 엄기호가 신작을 들고 돌아왔다. 

『나는 세상을 리셋하고 싶습니다』는 저자 엄기호가 과격화된 세계와 개인을 가장 깊숙한 곳에서부터 파헤친 책으로 혐오와 리셋의 감정이 어디에서부터 비롯되는지, 그리고 그 끝은 무엇인지, 그럼에도 우리 사회는 어떤 희망을 가질 수 있는지를 날카롭게 분석한다. 거꾸로 가는 한국 민주주의의 과거와 현재를 깊이 있게 분석하고 미래를 위한 제안을 담은 이 책은 망가져가는 한국 사회에 대한 진단서이자, 우리 사회를 복원하기 위한 처방전인 셈이다.",1117,BOOK
"2017 시나공 컴퓨터활용능력 1급 실기 (엑셀, 액세스 2007 사용자용) - 엑셀 함수 사전 + 자동 채점 프로그램","길벗 R&D, 강윤석, 김우경, 김용갑, 김종일 (지은이)",35799,국내도서>수험서/자격증>컴퓨터 활용능력>컴퓨터활용능력>컴퓨터활용능력 실기,9791160500042,"엑셀, 액세스의 방대한 기능 중 시험에 꼭 나오는 기능만 25가지로 압축하여 따라하기 형식으로 구성하였고, '기출 문제'를 넣어 앞에서 배운 기능이 시험에는 어떠한 형태로 출제되는지 확인하고 풀어 볼 수 있도록 했다.",,1578,BOOK
쿠베라 8,카레곰 (지은이),7443,국내도서>만화>인터넷 연재 만화,9791160850147,"인도 신화의 이름을 빌린 거대하면서도 독창적인 정교한 세계관을 가진 판타지 웹툰 쿠베라. 신, 인간, 수라, 세 종족 사이에서 벌어지는 사랑, 음모, 복수의 대서사시가 주인공인 쿠베라를 통해서 그 타래가 풀어진다. 영원한 수명과 거대한 힘을 가진 신과 수라 사이에서 미약한 존재에 불과한 16세 소녀에게 주어진 운명은 과연 세계의 구원인가, 아니면 파멸의 시작인가.","『쿠베라』는 판타지 웹툰의 전설 ‘쿠베라’ 를 단행본으로 만나볼 수 있는 책이다. 인도 신화의 이름을 빌린 거대하면서도 독창적인 정교한 세계관을 가진 판타지 웹툰 쿠베라. 신, 인간, 수라, 세 종족 사이에서 벌어지는 사랑, 음모, 복수의 대서사시가 주인공인 쿠베라를 통해서 그 타래가 풀어진다. 영원한 수명과 거대한 힘을 가진 신과 수라 사이에서 미약한 존재에 불과한 16세 소녀에게 주어진 운명은 과연 세계의 구원인가, 아니면 파멸의 시작인가. 신관을 사랑한 불의 신 아그니, 종족의 운명보다 딸의 안위가 더 소중한 상급수라 간다르바, 주인공과 이름이 같은 의문의 신 쿠베라, 인간계 최고의 재능을 가진 마법사 아샤 등 엄청난 캐릭터들이 신과 같은 이름을 가진 소녀를 중심으로 숨겨진 비밀의 베일을 풀어나가며 운명에 도전한다.",960,BOOK
하이큐!! 컴플리트 가이드북 배구본,후루다테 하루이치 (지은이),2561,국내도서>만화>스포츠만화,9791133430758,,"하이큐, 첫 공식 가이드북!

하루다테 하루이치 만화 『하이큐』컴플리트 가이드북. 100명 이상의 캐릭터 데이터 그리고 새로운 정보를 추가한 가이드북이다. 원작자 후루다테 하루이치 선생의 스페셜 인터뷰를 포함하여 연습시합을 포함한 작품 내 모든 경기 완벽 정리했다. 또한 단행본 최초로 공개되는 단편 '하이큐!'를 수록하여 하이큐 팬들을 즐겁게 해줄 볼거리를 가득 담아냈다.",7252,BOOK
"해커스 토익 실전 1000제. 2 Listening (리스닝) 문제집 (신토익 Edition) - 신토익 출제유형 100%반영, 최신 토익 문제로 실전 완벽 마무리, 신토익 온라인 실전모의고사 제공",해커스어학연구소 (지은이),49858,국내도서>외국어>토익>실전,9788965421948,"신토익 경향 및 유형, 난이도를 완벽 반영한 신토익 대비서. 신토익 유형 및 난이도 완벽 반영한 실전모의고사 10회분을 수록하였고, 자신의 수준에 맞춰 공부할 수 있는 ""수준별 학습 플랜""을 제공한다.",,6530,BOOK
2017 해동 한국사 기출정해 - 전3권,신영식 (지은이),34631,국내도서>수험서/자격증>공무원 수험서>7/9급 공무원>한국사>기출/문제집/모의고사,9791156178040,모든 문제마다 정성스러운 해설을 달아 이론에 대한 공부가 부족한 학생들도 기출문제를 완벽히 이해할 수 있도록 하였다. 또한 2007년 이후 기출문제뿐만 아니라 2007년 이전 문제 중에서도 다시 출제될 가능성이 높은 문제는 수록하여 실제 시험에서 구멍이 나지 않도록 하였다.,,1750,BOOK
