title,author,genre_id,genre,ISBN,description_aladin,description_naver,salesPoint,mallType
"벚꽃, 다시 벚꽃","미야베 미유키 (지은이), 권영주 (옮긴이)",51058,국내도서>소설/시/희곡>추리/미스터리소설>일본 추리/미스터리소설,9791185014876,"데뷔 27년, 출간작 60여 종, 수상 및 노미네이트 27건, 미스터리차트 28회 랭크인. 발표하는 작품마다 베스트셀러에 올리며 굵직한 상을 휩쓸어온 희대의 이야기꾼 미야베 미유키가 가족과 인연의 의미를 되새기는 기념비적인 작품을 펴냈다.","벚꽃이 처연히 흩날리는 봄의 에도, ‘가족’의 재건을 꿈꾸는 한 남자의 이야기!

일본 추리소설의 여왕 미야베 미유키의 소설 『벚꽃, 다시 벚꽃』은 천태만상 속 인간의 심연을 집요하게 파고들며 가족의 의미를 되새기는 미스터리다. 2014년 1월 1일, 타마키 히로시 주연의 일본 NHK 특집드라마로 방영되기도 했다. ‘가족이 만능의 묘약일까?’라는 질문에서 출발한 이 작품은 네 편의 이야기 속에 천태만상의 다양한 인간군상을 담았다.

소설은 ‘후루하시’ 가문의 비극에서 시작된다. 사무라이이자 도가네 번의 시종관(주군의 의복과 일용품을 관리하는 직책)이던 소자에몬의 뇌물 수취증서가 발견된다. 개 한 마리 베지 못하는 유약한 성격의 소자에몬은 기억에도 없는, 그러나 자신의 글씨를 완전 빼닮은 수취증서 앞에 끝내 할복하고 만다. 아버지의 결백을 믿었던 둘째 쇼노스케는 에도의 쪽방촌으로 올라와 수취증서의 배후를 찾아 진실에 조금씩 다가가는데…….",1934,BOOK
국경시장,김성중 (지은이),50993,국내도서>소설/시/희곡>한국소설>2000년대 이후 한국소설,9788954635257,"유려한 상상력으로 새로운 감각을 촘촘하게 풀어놓는 소설가 김성중의 두번째 소설집. &lt;개그맨&gt; 이후 사 년 만에 펴내는 이번 소설집은, 그간 그가 보여준 자유롭고 개성적인 상상력이라는 강점을 유지하되 그 위치를 좀더 현실 쪽으로 옮겨와 서사에 둔중함을 더한다.","상상이 가진 진정한 힘을 맛보게 해주는 김성중의 이야기!

김성중의 소설집 『국경시장』. 《개그맨》 이후 4년 만에 펴내는 두 번째 소설집으로 꾸준히 주목받으며 자신만의 소설세계를 구축해온 저자가 들려주는 이야기의 힘을 느낄 수 있다. 그동안 보여준 자유롭고 개성적인 상상력을 현실로 가까이 옮겨와 환상과 실재의 오묘한 뒤섞임을 느끼게 해준다. 욕망으로 뒤범벅된 인물들과 그 세계를 내세운 여덟 편의 단편에서 현실과 상상, 고통과 환희를 오가며 저자가 들려주고자 하는 이야기를 들어볼 수 있다.

물건을 사기 위해 자신의 기억을 파는 《국경시장》, 천재적 재능을 얻는 대신 짧고 고통스러운 인생을 택해야 하는 병에 대한 이야기 《쿠문'》, 촉망받던 모델이었으나 교통사고로 삶의 빛을 잃어가는 에바와 분쟁 지역을 서슴지 않고 다니는 보도사진가 아그네스라는 두 친구의 욕망과 이야기를 역행적 구성으로 촘촘하게 그려낸 《에바와 아그네스》등의 작품이 수록되어 있다.",3130,BOOK
일빵빵 입에 달고 사는 기초영어 3 : 전치사.시제 편,서장혁 (지은이),49849,국내도서>외국어>영어회화>생활영어,9791185419060,"‘by’, ‘for’, ‘to’ 등 여러 가지 뜻을 가진 전치사와, ‘현재 완료’, ‘과거 완료’와 같이 아무리 공부해도 이해하기 어려웠던 영어의 시제들을 쉽게 익힐 수 있도록 다양한 예문과 어디서도 볼 수 없는 ‘일빵빵’만의 영어 공식으로 설명한다.","일빵빵이 알려주는 전치사ㆍ시제!

『입에 달고 사는 일빵빵 기초영어』 제3권 《전치사 시제 편》. 한국인들이 특히 어려워하는 영어의 전치사와 시제를 완벽하게 이해할 수 있도록 비법을 담았다.‘by’, ‘for’, ‘to’ 등 여러 가지 뜻을 가진 전치사와, ‘현재 완료’, ‘과거 완료’와 같이 아무리 공부해도 이해하기 어려웠던 영어의 시제들을 쉽게 익힐 수 있도록 다양한 예문과 어디서도 볼 수 없는 ‘일빵빵’만의 영어 공식으로 설명한다.",14578,BOOK
소리도 없이,나스라 (지은이),51125,국내도서>소설/시/희곡>로맨스소설>한국 로맨스소설,9791156304241,,"나스라의 로맨스 소설 『소리도 없이』. 진수인, 일생일대에 가장 중요한 날이 될지도 모를 최종 면접일. 하늘도 무심하시지, 가벼운 접촉사고도 모자라 하고많은 훈남들 놔두고 까탈스런 한 남자를 만났다. 그런데 이 남자, 면접관으로 한자리 차지하신 공동대표 강세현 박사라니!! 사사건건 태클부터 걸고 보는 까칠한 강 박사님과 그라면 일단 피하고 보는 수인의 연애세포는 과연 깨어날 수 있을까?",118,BOOK
스노우캣 박스 세트 - 전4권,스노우캣(권윤주) (지은이),52906,국내도서>에세이>명사에세이>기타 명사에세이,9791155350539,한국 일러스트 에세이의 고전 '스노우캣' 시리즈가 그의 첫 책 &lt;스노우캣의 혼자 놀기&gt;가 출간된 지 15년 만에 4권 한정판 세트로 재출간되었다. '스노우캣' 시리즈는 고양이의 독립적인 자아를 적절하게 현대인의 고독에 대입시켜 풀어 내었다.,한국 일러스트 에세이의 고전 『스노우캣』 시리즈가 그의 첫 책 『스노우캣의 혼자 놀기』가 출간된 지 15년 만에 4권 한정판 세트로 재출간되었다. 고양이의 《독립적인 자아》를 적절하게 현대인의 고독에 대입시켜 이야기를 풀어 갔던 『스노우캣』 시리즈는 최근 기하급수적으로 늘어나는 애묘인들에게 큰 호응을 얻을 것으로 예상된다. 《나홀로족》이 주요 시류인 지금의 사회에서는 다소 생소했던 《스노우캣》의 나홀로 행보가 익숙하고 친근하게 느껴진다.,101,BOOK
여자 없는 남자들,"무라카미 하루키 (지은이), 양윤옥 (옮긴이)",50998,국내도서>소설/시/희곡>일본소설>1950년대 이후 일본소설,9788954625586,"일본 출간 당시 예약판매로만 30만 부의 판매고를 올린 무라카미 하루키의 신작 소설집. '여자 없는 남자들'이라는 하나의 주제 아래 써내려간 여섯 편의 작품과 함께, 프란츠 카프카의 걸작 &lt;변신&gt;의 독특한 오마주이자 해외 판본에만 특별히 수록되는 단편 '사랑하는 잠자'를 가장 먼저 만나볼 수 있다.","아주 작은 예고나 예감, 징조도 없이 어느 날 갑자기, 당신은 여자 없는 남자들이 된다.

『여자 없는 남자들』은 무라카미 하루키가 《도쿄 기담집》 이후 9년 만에 펴낸 단편집으로 일본 출간 당시 예약판매로만 30만 부의 판매고를 올린 화제의 책이다. 그간 장편소설 집필에 몰두해왔던 저자가 2013년 말부터 이듬해 봄에 걸쳐 발표한 다섯 편의 단편과 단행본 출간에 맞춰 새로 쓴 표제작 ‘여자 없는 남자들’, 저자가 직접 선별한 영미권 단편소설 모음집 《그리워서》에 수록된 ‘사랑하는 잠자’까지 만나볼 수 있다.

병으로 인해 사별한 가후쿠와 그의 전속 운전 기사 미사키의 이야기를 그린 ‘드라이브 마이 카’, 쉰두 살이지만 그때까지 결혼한 적이 없고 성형외과 의사로 높은 수입을 올리고 있지만 대개 유부녀나 진짜 연인이 있는 여자들과 만나던 도이카가 뜻하지 않게 깊은 사랑에 빠진 후 느낀 감정에 대해 서술한 ‘독립기관’, 카운터 제일 안쪽 항상 같은 자리에 앉던 남자‘가미타’를 떠올리는 기노의 사연을 담은 ‘기노’ 등의 소설이 수록되어 있다.

저자는 제목과 같이 여자 없는 남자들을 모티프로 삼아 여러 가지 사정으로 여자를 떠나보낸 남자들, 혹은 떠나보내려 하는 남자들을 이야기한다. 연인이나 아내로서의 여성성이 부재하거나 상실이 된 주인공들을 등장시켜 남녀를 비롯한 인간관계의 깊은 지점을 적나라하게 묘사하고 있다. 그동안 《1Q84》 《중국행 슬로보트》 등을 옮겨온 전문번역가 양윤옥이 저자의 작품세계 속의 레퍼런스와 각 단편의 고유한 개성까지 모두 담아냈다.",20790,BOOK
살인자의 기억법,김영하 (지은이),50993,국내도서>소설/시/희곡>한국소설>2000년대 이후 한국소설,9788954622035,"김영하 장편소설. 알츠하이머에 걸린 은퇴한 연쇄살인범이 점점 사라져가는 기억과 사투를 벌이며 딸을 구하기 위한 마지막 살인을 계획한다. 정교하고 치밀하게 설계된 이번 소설에서 김영하는 삶과 죽음, 시간과 악에 대한 깊은 통찰을 풀어놓는다.","정교하게 다듬어진 공포의 기록!

김영하의 장편소설 『살인자의 기억법』. 《너의 목소리가 들려》 이후 일 년 반 만에 펴낸 장편소설로 알츠하이머에 걸려 점점 사라져가는 기억과 사투를 벌이는 은퇴한 연쇄살인범의 이야기를 담고 있다. 올해로 데뷔한 지 19년, 독보적인 스타일로 여전히 가장 젊은 작가라 불리는 저자의 이번 소설에서 아무렇지 않게 툭툭 던지는 잠언들, 돌발적인 유머와 위트, 마지막 결말의 반전까지 정교하고 치밀하게 설계된 모든 것들을 만나볼 수 있다.

30년 동안 꾸준히 살인을 해오다 25년 전에 은퇴한 연쇄살인범 김병수. 알츠하이머에 걸린 70세의 그가 벌이는 고독한 싸움을 통해 세계가 무너져 내리는 공포 체험에 대한 기록과 함께 인생이 던진 농담에 맞서는 모습을 담아냈다. 잔잔한 일상에 파격과 도발을 불어넣어 딸을 구하기 위한 마지막 살인을 계획하는 그의 이야기를 그려내며 삶과 죽음, 시간과 악에 대한 깊은 통찰을 풀어놓는다.",32085,BOOK
"해커스 텝스 Reading (최신개정판) - 최신 기출 경향 반영 실전모의고사 수록, 단어암기자료(PDF) 제공",David Cho (지은이),49861,국내도서>외국어>텝스>Reading,9788965421016,"최신 텝스 경향을 철저히 분석하여, 교재 내 모든 내용과 문제에 반영하였으며, 이에 맞는 효과적인 문제풀이 전략을 제시하였다. 문법, 어휘, 독해에 대한 핵심 이론을 단계에 따라 체계적으로 학습할 수 있도록 정리하였으며, 방대한 양의 실전 문제 또한 수록하고 있다.",,14423,BOOK
상상력 스케치 노트,김충원 창의력 발전소 (지은이),51820,국내도서>어린이>문화/예술/인물>음악/미술/예체능,9788972219040,"어린이 스케치 노트 시리즈. 미술 교육의 대가, 김충원 선생님이 지난 10년간 대학 강단에서 강의하며 연구한 상상력에 대한 고민과 노하우를 하나로 모아, 아이들의 눈높이로 논리적 상상력에 대해 새롭게 구성한 책이다.","어린이 스케치 노트 시리즈. 미술 교육의 대가, 김충원 선생님이 지난 10년간 대학 강단에서 강의하며 연구한 상상력에 대한 고민과 노하우를 하나로 모아, 아이들의 눈높이로 논리적 상상력에 대해 새롭게 구성한 책이다. 아이의 놀라운 사고를 직접 그림으로 그려 봄으로서 아이의 상상력을 더욱 구체화시키고 더 나아가 생각의 폭을 넓히는 다양한 활동을 가득 담았다.



그림을 따라 그리고, 응용해서 그리고, 새롭게 그리는 ‘따라하기-응용하기-상상하기’의 3스텝 과정을 통해 아이는 막연하던 상상을 눈에 보이듯 그리며 자신의 생각을 구체화시키는 연습을 한다. 아이의 호기심을 자극하는 다양한 질문을 통해 아이는 논리적인 상상력을 펼치게 될 것이다.



또한 상상력 퀴즈로 아이들이 활동에 지루해 하지 않고 남과는 다른 새로운 생각을 하는 힘을 기르도록 도와준다. 거기에 평소 쓰지 않던 손으로 스케치를 하는 ‘거울 스케치’를 통해 아이의 두뇌를 자극하고, ‘세상을 다르게 보는 10가지 방법’과 하나의 상황을 끊임없이 상상해 연결해 가는 ‘상상 놀이’ 등을 배우며 평소에도 스스로 상상력을 키우는 활동을 즐길 수 있다.",1073,BOOK
뇌가 섹시해지는 책 - 도미니크 오브라이언의 기억력 연습 노트,"도미니크 오브라이언 (지은이), 김지원 (옮긴이)",70223,국내도서>자기계발>창의적사고/두뇌계발,9788963220819,‘세계 기억력 챔피언십(World Memory Championship)’에서 여덟 번 우승한 도미니크 오브라이언의 책. 이 책에서는 저자가 '세계 기억력 챔피언십'에서 여덟 번이나 우승할 수 있었던 실제 기억 훈련법을 소개한다.,"자신만의 ‘기억의 궁전’을 만들어 섹시한 뇌로 거듭나다!

영국 드라마 《셜록》에서 여주인공이 셜록에게 한 말이 있다. “Brainy is the new sexy(지성이 섹시함의 새 척도가 됐다)"" 어느 순간부터 우리는 ”뇌가 섹시하다“라는 말을 자주 사용하고 있다. 『뇌가 섹시해지는 책』은 각종 프로그램과 언론을 통해 뇌가 섹시한 사람이 대세로 거듭나고 있는 이 때, 세계 기억력 챔피언십에서 여덟 번이나 우승한 도미니크 오브라이언이 자신만의 기억 훈련법을 소개하는 두뇌 트레이닝 도서이다. 

태어날 때부터 학습 능력이 뛰어난 사람과 그렇지 않은 사람이 정해져 있는 줄만 알았던 저자는 어느 날, 텔레비전에서 당시 기억의 달인 크레이튼 카벨로가 카드 암기를 선보이는 장면을 보고 훈련을 시작했다고 한다. 평범한 두뇌를 가진 사람도 기억 훈련을 통해 얼마든지 좋아질 수 있다는 것을 이 책을 통해 말하고 있다. 

저자는 기억력을 향상시키는 기술을 초급, 중급, 고급의 52단계로 나누어 설명하는데, 연상법, 상상법, 링크법 등 기억력을 높이는 기본 기술부터 저자만의 독특한 핵심 기술 ‘도미니크 기억법’을 소개한다. 도미니크 기억법이란 00부터 99까지 숫자에 인물과 소품을 부여해 엄청난 암기가 가능하도록 한 방법이다. 이 시대의 진정한 뇌섹남 도미니크 브라이언이 제시하는 기억법으로 우리의 뇌도 섹시하게 만들어 보자.",2009,BOOK
아메리칸 타블로이드,"제임스 엘로이 (지은이), 조영학 (옮긴이)",107436,국내도서>소설/시/희곡>액션/스릴러소설>외국 액션/스릴러소설,9788925556680,"제임스 엘로이 소설. FBI 특수요원 켐퍼 보이드, 경찰 출신의 건달 피터 본듀런트, FBI 도청 전문가 워드 리텔 세 남자를 중심으로 1950년대 말 존 F. 케네디가 다음 대통령으로 부상하기 시작하면서 암살당하기까지 FBI, CIA, 재계, 정계, 연예계, 마피아까지 얽힌 거대한 음모를 다룬다.","FBI, CIA, 제계, 정계, 연예계, 마피아까지 얽힌 거대한 음모가 시작된다!

1950년대 후반부터 존 F. 케네디가 암살당하기까지 미국 지하세계의 비밀 역사를 그린 제임스 엘로이의 소설 『아메리칸 타블로이드』. 소설보다 더 소설 같은 경험을 한 《L.A. 컨피덴셜》의 저자 제임스 엘로이. 20세기 중반 미국의 비밀 역사에 저자만의 스타일을 더한 「언더월드USA」 3부작 가운데 첫 번째 작품이다. 

FBI 특수요원 켐퍼 보이드, 경찰 출신의 건달 피터 본듀런트, FBI 도청 전문가 워드 리텔 세 남자를 중심으로 1950년대 말 존 F. 케네디가 다음 대통령으로 부상하기 시작하면서 암살당하기까지 FBI, CIA, 재계, 정계, 연예계, 마피아까지 얽힌 거대한 음모를 다룬 이 작품은 제임스 프랑코 연출, 주연으로 영화화가 예정되어 있다. 

FBI 특수요원 켐퍼 보이드는 FBI 국장 에드거 후버의 지시로 케네디 진영으로 들어가 케네디의 신임을 얻고 정보를 빼내 에드거 후버에게 전달하는 임무를 맡게 된다. 켐퍼 보이드는 친구인 FBI 도청 전문가 워드 리텔을 이 일에 끌어들이고 CIA, 피터 본듀런트와 손을 잡으며 국장의 지시와는 별개로 자신의 이익을 위해 움직이기 시작한다. 쿠바와의 관계를 이용하고 마피아 세력에게까지 접근한 켐퍼 보이드는 케네디와의 관계를 위해 결혼까지 생각했던 여자를 냉정하게 버리고 철저하게 이익을 위해 움직이는데…….",405,BOOK
마스다 미리 베스트 컬렉션 문고판 세트 - 전5권,"마스다 미리 (지은이), 박정임 (옮긴이)",4671,국내도서>만화>교양만화>실용만화,9791186195208,"마스다 미리의 만화 중에서도 가장 큰 사람을 받아온 스테디셀러 &lt;수짱 시리즈&gt;와 &lt;주말엔 숲으로&gt;를 문고판 사이즈로 담은 '마스다 미리 베스트 컬렉션'. 조금 작아진 수준이 아니라, 거의 일본의 문고판만 한 크기의 책으로 줄어들었다. 가격과 사이즈는 줄어들고 단행본의 내용은 그대로 옮겨진 한정 문고판이다.","마스다 미리의 만화 중에서도 가장 큰 사람을 받아온 스테디셀러 《수짱 시리즈》와 《주말엔 숲으로》를 문고판 사이즈로 담은 『마스다 미리 베스트 컬렉션』이 출간되었다. 조금 작아진 수준이 아니라, 거의 일본의 문고판만 한 크기의 책으로 줄어들었다. 게다가 새롭게 바뀐 두 종의 표지까지. 마스다 미리와 그녀의 ‘수짱’을 사랑하는 팬들에게 예쁜 선물을 마련해드리고, 그 감동과 재미를 더 많은 사람들과 함께 나누기 위한 취지다. 이미 마스다 미리의 만화에 익숙한 독자에게나 아직 접해본 적 없는 사람들에게나, 손안에 쏘옥 들어오는 크기의 이 문고판은 큰 소장가치를 안겨줄 것이다.",2688,BOOK
"영단기 토익 LC - 최신 유형, 학습 전략, 문제풀이를 한 권으로 끝내는 기본서",유수연 (지은이),49855,국내도서>외국어>토익>Listening,9791156172581,"각 파트별로 가장 최적화된 문제풀이 방법에 따른 유형 설명과 학습 방법, 그리고 이를 적용해 볼 수 있는 연습 문제들로 구성되어 있으며, 최신 문제 유형과 오답의 특성들도 빠짐없이 실어 두었다.","최신 토익 경향 반영한 LC 기본서

『영단기 토익 LC』 는  각 파트별로 가장 최적화된 문제풀이 방법에 따른 유형 설명과 학습 방법, 그리고 이를 적용해 볼 수 있는 연습 문제들로 구성되어 있으며, 최신 문제 유형과 오답의 특성들도 빠짐없이 실어 두었습니다. 교재의 페이지를 한 장씩 넘겨가며 표현을 익히는 학습을 하고 각 파트의 문제 유형과 답변을 찾는 패턴을 연습하는 과정을 따르다 보면 이 책을 통한 학습을 마칠 때쯤 여러분은 두 세 단계 토익 LC 문제를 풀이하는 능력이 향상되어 있음을 자연스럽게 느낄 수 있을 것입니다.",3212,BOOK
당신의 이름을 지어다가 며칠은 먹었다,박준 (지은이),51167,국내도서>소설/시/희곡>시>한국시,9788954619578,"2008년 '젊은 시의 언어적 감수성과 현실적 확산 능력을 함께 갖췄다'는 평을 받으며 실천문학으로 등단한 박준 시인의 첫 시집. 작고 소외된 것들에 끝없이 관심을 두고 탐구해온 지난 4년, 이제 막 삼십대에 접어든 이 젊은 시인의 성장이 궁금하다.","박준 시인이 전하는 떨림의 간곡함!

한국시의 새로운 패러다임을 제시하는 「문학동네시인선」 제32권 『당신의 이름을 지어다가 며칠은 먹었다』. 2008년 《실천문학》으로 등단, 2017 오늘의 젊은 예술가상을 수상한 저자의 이번 시집은 전통적인 의미에서의 ‘서정(Lyric)’을 담은 시편들로 구성되어 있다. 작고 소외된 것들에 끝없이 관심을 두고 지난 4년간 탐구해온 저자는 이 세계를 받아들이고 산다는 것, 그리고 그 안에서 마주하는 죽음의 순간들에 대한 짙은 사유를 우리에게 들려준다. ‘인천 발달’, ‘지금은 우리가’, ‘미인처럼 잠드는 봄날’ 등의 시편들과 함께 저자의 시집을 열렬히 동반하며 그가 시를 쓰던 몇몇 순간을 호명한 허수경 시인의 발문이 수록되어 있다.",30056,BOOK
금각사,"미시마 유키오 (지은이), 허호 (옮긴이)",50998,국내도서>소설/시/희곡>일본소설>1950년대 이후 일본소설,9788901039879,,,3515,BOOK
"정리하는 뇌 - 디지털 시대, 정보와 선택 과부하로 뒤엉킨 머릿속과 일상을 정리하는 기술","대니얼 J. 레비틴 (지은이), 김성훈 (옮긴이)",51520,국내도서>인문학>심리학/정신분석학>뇌과학/인지심리학,9788937837654,"레비틴 교수는 말콤 글래드웰의 책 &lt;아웃라이어&gt;에서 언급되어 세계적으로 화제를 모은 ‘1만 시간의 법칙’을 과학적으로 규명한 장본인이며, 뉴욕타임스 베스트셀러 1위를 15주간 기록한 &lt;뇌의 왈츠&gt; 등 뇌과학 관련 저서로 유명하다.","정보, 생각, 삶을 정리정돈하는 기술!

우리의 뇌는 고도로 발달했음에도 불구하고, 이 시대의 정보와 물건, 의사결정 과잉 상황에 버거워 한다. 이런 인지 과부하 증상은 우리의 머릿속도 주변 환경도 산만해지는 결과로 이어진다. 이에 말콤 글래드웰의 《아웃라이어》에서 언급되어 세계적으로 화제를 모은 바 있는 ‘1만 시간의 법칙’을 과학적으로 규명한 신경과학자이자 인지심리학자인 대니얼 레비틴 맥길대학 교수가 정보 시대의 인지 과부하 문제의 규명과 처방을 위해 나섰다. 

그는 인지 과부하 시대에 정보와 생각과 주변환경을 정리하고, 효율적으로 의사결정할 수 있는 관건은 바로 뇌의 작동방식을 이해하고 그에 맞춰 정리하는 습관임을 강조한다. 뇌 신경과학, 인지심리학, 행동경제학 등 다양한 분야의 최신 연구들을 토대로 일상의 온갖 것들을 잃어버리지 않게끔 체계적으로 정리하는 법을 비롯해 인간관계를 더 창의적이고 생산적으로 정리하는 법 등 디지털 시대에 필요한 정리정돈을 알려준다.",23806,BOOK
이상한 나라의 뇌과학,김대식 (지은이),51194,국내도서>과학>뇌과학>뇌과학 일반,9788954636667,카이스트 김대식 교수가 뇌과학이란 프레임을 통해 사람과 세상을 재해석하는 인문교양서다. ‘도대체 세상이 어떻게 돌아가는 걸까? 요즘 사람들은 무슨 생각을 하고 사는 걸까? 왜 그렇게 행동하는 걸까?’,"뇌과학, 비상식적인 세상에서 상식적으로 살기 위한 안내자가 되다!

과학의 두드러진 특징은 ‘정확성’과 ‘명료함’에 있다. 그렇다면 과학을 통해 세상을 바라본다면, 복잡하고 종잡을 수 없는 세상이 조금은 단순하고 명쾌하게 정리되지 않을까? 카이스트의 김대식 교수가 쓴 『이상한 나라의 뇌과학』은 우리가 함께 고민하고 생각해봐야 할 문제들에 대해 과학자의 시선으로 재해석한다. 

한때 인터넷을 뜨겁게 달궜던 ‘드레스 색깔 논란’과 관련해서는 “같은 드레스가 다르게 보이는 게 신기한 것이 아니라, 다르게 보는 세상을 같다고 착각하는 우리가 더 신기하다”는 견해를 보인다. 이 외에도 ‘아이스 버킷 챌린지’, ‘세월호’, ‘무인 자동차’ 등 최근 우리 사회를 관통하고 있는 이슈들을 흥미롭게 풀어낸다.

하지만 엄밀히 말해 이 책이 뇌과학만을 다루고 있는 것은 아니다. 저자는 과학뿐 아니라 문학, 철학, 신학을 아우른다. 가령 인간이 고향에서도 이방인으로 살아야 하는 ‘존재적 외로움’을 겪는 이유에 대해서는, 단테의 《신곡》과 ‘결정적 시기’라는 뇌과학 이론, 제임스 조이스의 《율리시스》를 엮어냄으로써 세상을 깊고 넓게 보는 눈을 제시한다.",1458,BOOK
