title,author,genre_id,genre,ISBN,description_aladin,description_naver,salesPoint,mallType
키크니의 무엇이든 그려드립니닷! - 일러스트레이터미네이터 키크니의 주문제작 만화,키크니 (지은이),51376,국내도서>에세이>사진/그림 에세이,9788950980276,SNS 화제작 &lt;키크니의 무엇이든 그려드립니닷!&gt;이 단행본으로 출간되었다. 이 책은 최초의 '댓글 주문형' 개그 만화다. 별칭 '일러스트레이터미네이터' 키크니가 네티즌들의 요청 댓글을 받아 한 컷의 만화로 답한 것이다.,"SNS 20만 팔로워를 사로잡은 화제작!
드립력 만렙 ‘일러스트레이터미네이터’가 온다!

SNS 최고의 화제작 『키크니의 무엇이든 그려드립니닷!』이 아르테에서 단행본으로 출간되었다. 이 책은 최초의 ‘댓글 주문형’ 개그 만화다. 별칭 ‘일러스트레이터미네이터’ 키크니가 네티즌들의 요청 댓글을 받아 한 컷의 만화로 답한 것이다. 20만 팔로워들과 댓글로 소통하며, 일상 속 크고 작은 바람과 상상들을 한 컷의 만화로 유쾌하게 그려내 뜨거운 반응을 얻었다. 댓글을 확인한 후, 페이지를 넘기면 허를 찌르는 반전 개그의 묘미를 느낄 수 있다. 무엇보다 이 만화가 특별한 이유는 다름 아닌 바로 우리의 바람과 고민, 사연들을 담고 있기 때문일 것이다.",1160,BOOK
꼭두각시 서커스 완전판 1,후지타 카즈히로 (지은이),4133,국내도서>만화>본격장르만화>판타지>액션 판타지,9791134811037,"200여 년 전, 한 소녀를 사랑했던 연금술사 바이 진은 연금술을 이용해 이름과 육체를 바꾸어 가며 그녀를 닮은 여성을 찾아 헤맸다. 이윽고 페이스리스라고 이름을 바꾼 바이 진은 엘레오놀이라는 여성을 점찍었다.","200여 년 전, 한 소녀를 사랑했던 연금술사 바이 진은 연금술을 이용해 이름과 육체를 바꾸어 가며 그녀를 닮은 여성을 찾아 헤맸다.
이윽고 페이스리스라고 이름을 바꾼 바이 진은 엘레오놀이라는 여성을 점찍었다.
그녀가 수호하는 소년 사이가 마사루의 몸에 자기 의식을 옮긴 다음 함께 영원히
살아가려는 계획을 실행에 옮기려는 것이다. 페이스리는 방해자를 제거하기 위해
전세계에 조나하 병원체를 퍼뜨리고 부하 자동인형을 풀어 엘레오놀을 납치한다.
한편 마사루는 엘레오놀을 되찾기 위해 혼자 페이스리스가 있는 프랑스의 몽생미셸에 잠입한다. 뒤쫓는 마사루의 친구들까지 휘말려 200여년의 인연을 넘은 처절한 전투의 막이 열린다….",932,BOOK
주문은 토끼입니까? 7 한정판 (마우스패드 + 클리어카드 포함),Koi (지은이),3742,국내도서>만화>순정만화>레이디스 코믹,9791164122189,"래빗 하우스에서 먹고 자고 일하는, 밝고 명랑하고 살짝 허당인 코코아. 그곳 사장님의 손녀딸로, 말투는 공손하지만 태도는 더없이 쿨∼한 치노 등, 사랑스러운 친구들이 그려가는 카페스러운 일상을 그렸다.","첫 번째, 
 애니메이션 3기 제작이 결정!
짝짝짝짝짝짝짝!!

그리고 두 번째, 
6권에 이어 스페셜 에디션 제2탄,
 7권 한정판이 발매된다는 사실!!

●2019년 3월,  7권 한정판
마우스패드&클리어 카드 합본 세트 대발매!!  
1년 만의 단행권 발매 및 애니메이션 3기 제작결정을 기념하여, 정식 한국어판만의 특전이 무려 2개나 포함된 스페셜 에디션 한정판으로 돌아왔습니다!!
이 기회를 놓치지 말고 꼭 집에  7권 한정판을 들이세요♥",623,BOOK
EBS 왕초보 영어 (2019 상편) - 하루 30분 ４줄 대화로 왕초보는 이제 남 얘기 EBS 왕초보영어 워크북,"마스터유진 (지은이), EBS 미디어 (기획)",49849,국내도서>외국어>영어회화>생활영어,9788926366318,"영어울렁증에 시달리고 있는 대한민국의 모든 영어학습자에게 초간단 4 Step을 통해 효율적인 공부법을 제시하는 책이다. 영어회화 왕초보자를 위해 기본기부터 차근차근 공부법을 알려주는 가이드 책으로, 왕초보자의 눈높이에 맞춰 재미있는 에피소드를 곁들어 중도에 포기하지 않도록 독려한다.","영어울렁증에 시달리고 있는 대한민국의 모든 영어학습자에게 초간단 4 Step을 통해 효율적인 공부법을 제시하는 책이다. 영어회화 왕초보자를 위해 기본기부터 차근차근 공부법을 알려주는 가이드 책으로, 왕초보자의 눈높이에 맞춰 재미있는 에피소드를 곁들어 중도에 포기하지 않도록 독려한다. 



2019년 2월25일부터 2019년 8월23일까지 방송될 Day1(833회)∼Day130(962회), 총 130개 토픽으로, 쉽고 간단하면서도 실생활에서 당장 활용할 수 있는 내용으로만 구성되어 있다. 또한 우리 생활과 밀접한 가정, 일상, 쇼핑, 식당, 여행 등 총 5개의 주제로 토픽을 만들어 흥미를 유발하고 자발적으로 학습할 수 있도록 돕는다.",1815,BOOK
2019 위포트 KEPCO 한국전력공사 직무능력검사 NCS 실전 모의고사 (봉투형),위포트 연구소 (지은이),142101,국내도서>수험서/자격증>취업/상식/적성>공사 공단 수험서>한국전력공사,9791161980584,"2019 상반기 대비 출제 유형 및 소재를 완벽 반영한 FINAL 모의고사 3회로 한국전력공사 직무능력검사 최종 점검이 가능하도록 하였고, 실제 시험과 동일한 구성의 분야별(전기.ICT) 전공 모의고사를 수록하였다.",,852,BOOK
죽고 싶지만 떡볶이는 먹고 싶어,백세희 (지은이),51371,국내도서>에세이>한국에세이,9791196394509,"기분부전장애(가벼운 우울 증상이 지속되는 상태)를 가진 저자와 정신과 전문의와의 12주간의 대화를 엮은 책이다. 겉보기에는 멀쩡하지만 속은 곪아 있는, 지독히 우울하지도 행복하지도 않은 사람들을 위한 책이며, 타인의 시선으로부터 자유롭지 못하고, 불완전하고, 구질구질한 우리 모두의 이야기다.","★★★25개국 출간 ★★★ 
★★★정신과 전문의 추천★★★
★★★드라마화 확정★★★
★★★전 세계 100만 부 판매★★★

“참신한 방식으로 한 개인의 가장 취약한 순간을 바라보는 놀라운 관점” 
-코스모폴리탄

“성실하고 영리하다. 몇 달에 걸친 치료 과정의 실제 녹취록을 사용하여 자신의 우울과 불안감을 탐색함으로써 자기인식을 향해 조심스럽게 다가간다.”
-시카고트리뷴

“마음의 아픔에 관한 대화를 자연스러운 것으로 만들려는 작가의 노력은 감탄을 자아낸다.”
-퍼블리셔스 위클리 

“진솔하다. 우울과 불안감에 고통받는 젊은이들의 자아발견을 위한 진정성 있는 시도”
-라이브러리 저널

“이 책은 개인적이지만 또한 보편적이며 의식의 이해, 지혜로 가는 길을 찾아낸다.”
- 커커스 리뷰

“자기가 지금 힘든 줄도 모르고 사는 사람이 많아요.
이유 없는 허전함에 시달리면서.”

많은 이들이 멋지고 밝은 모습을 보여주는 것엔 익숙하지만, 찌질하고 어두운 모습은 감추려 한다. 그러나 당신이 행복해지기 위해 알아야 할 한 가지는, 당신의 마음 한 켠의 우울을 못 본 척해서는 절대로 행복해질 수 없다는 사실이다. 우리는 이제 말해야 한다. 별일 없이 사는데도 채워지지 않는 마음의 빈 공간에 대해서, 친구들과 웃고 떠드는 동안에도 울적한 마음 한구석에 대해서.

“우리는 울지 않는 사람이 아니라
울고 싶을 때 울 수 있는 사람이어야 한다.

이 책은 기분부전장애(가벼운 우울 증상이 지속되는 상태)를 가진 저자와 정신과 전문의와의  대화를 엮은 책이다. 겉보기에는 멀쩡하지만 속은 곪아 있는, 지독히 우울하지도 행복하지도 않은 사람들을 위한 책이며, 타인의 시선으로부터 자유롭지 못하고, 불완전하고, 구질구질한 우리 모두의 이야기다. 이 책이 당신의 슬픔을 모두 가져가주지는 못하겠지만, 적어도 울지 않는 사람이 아니라 울고 싶을 때 울 수 있는 사람이 되도록 도와줄 것이다.",28208,BOOK
초정리 편지,"배유안 (지은이), 홍선주 (그림)",48874,국내도서>어린이>동화/명작/고전>국내창작동화,9788936461447,창비아동문고 대표동화 시리즈 24권. 제10회 창비 ‘좋은 어린이책’ 원고 공모 창작 부문 대상작 &lt;초정리 편지&gt;를 새롭게 편집했다. 심사위원들로부터 “역사의식과 이야기의 재미가 함께 어우러진 역작”이라는 격찬을 받은 작품이다.,"우리 어린이책의 든든한 버팀목이 되어온 「창비아동문고」의 대표동화를 새롭게 읽어요!

1977년부터 35년간 우리 창작동화의 시대를 본격적으로 열어 어린이책의 역사를 새로 써온 「창비아동문고 대표동화」 제24권 『초정리 편지』. 이 시리즈는 세대를 넘어 고전의 반열에 오를 창작동화를 꾸준히 담아오면서 우리 아동문학의 중심을 잡아온 「창비아동문고」 270권 중 대표로 내세울 만한 35권을 뽑아 새로운 편집과 그림으로 엮었습니다. 아동문학평론가가 뽑은 동화집 10권에다가, 35년간 가장 풍부한 사랑을 받은 장편동화 25권을 만납니다. 

「창비아동문고」 중에서 창비 좋은 어린이책 수상작뿐 아니라, 다양한 기관ㆍ단체에서 선정한 추천도서와 권장도서로 꾸려진 이 책은, 동화 작가 배유안의 장편동화를 수록하고 있습니다. 소년 '장운'이 고난 속에서도 석수장이로 성장해나가는 과정을 따라갑니다. 세종 대왕의 일화에서 건져 낸 역사적 상상력으로 하층민의 삶으로 파고들어 한글 창제의 참된 뜻을 일과 생활 속에 새겨 넣었습니다. 그림 작가 홍선주의 개성이 넘치는 그림을 함께 담아 읽는 재미를 북돋습니다. 

▶ 이 책은 2006년에 출간된 《초정리 편지》(창비)를 재출간한 것입니다.",14111,BOOK
빈센트 나의 빈센트 - 정여울의 반 고흐 에세이,"정여울 (지은이), 이승원 (사진)",51371,국내도서>에세이>한국에세이,9788950980337,"&lt;내가 사랑한 유럽 top 10&gt;의 작가 정여울이 지난 10년간 빈센트가 머물었던 네덜란드, 벨기에, 프랑스 도시 곳곳을 찾아다니며 기록한 그의 흔적과 풍경을 책에 담았다. 작가는 자신의 꿈을 찾기 위해 고민하던 20대 시절 빈센트의 그림을 만나 구원과 같은 위로를 받고 그의 강인함을 느낄 수 있었다.","평생 단 한 점의 그림밖에 팔지 못했지만, 예술로 사람의 마음을 어루만진 빈센트 반 고흐의 삶을 기억하다!

살아 있을 때 단 한 번도 인정받지 못한 안타까운 삶을 살았던 빈센트 반 고흐. 꿈을 찾기 위해 고민하던 20대 시절 빈센트의 그림을 만나 구원과 같은 위로를 받고 그의 강인함을 느꼈던 저자 정여울이 지난 10년간 빈센트의 길을 걸으며 만난 그의 모든 것을 『빈센트 나의 빈센트』에 담아냈다. 그가 머물었던 네덜란드, 벨기에, 프랑스 도시 곳곳을 찾아다니며 기록한 그의 흔적과 풍경들을 만나볼 수 있다.

세상은 방랑자, 외톨이, 괴짜와 다름없던 빈센트를 인정하지 않았고, 그를 오해하고 외면했다. 그럼에도 가장 나다운 것, 자기만의 색깔을 찾기 위해 고군분투했던 그는 치열하게 살아가며 결국 자신의 것을 만들어냈다. 반짝이는 별, 눈부신 꽃, 보랏빛 안개 속에 소용돌이치는 그의 그림이 바로 그가 만들어낸 그의 세상이다. 불안으로 방황하는 시기, 빈센트의 그림을 만난 후 인생에서 무엇이 진짜 중요한지 깨달은 저자는 작가는 예술로 사람의 마음을 어루만지길 원했던 빈센트의 삶 속으로 더욱 깊이 발을 내디뎠다.

트라우마와 아픔에 맞서기 위한 빈센트의 용기가 결국 빈센트적인 것을 탄생시켰다고 강조하면서, 그의 이야기가 불가능할 것으로 보였던 모든 세계를, 우리에게 허락되지 않는 모든 세계를 감히 꿈꾸는 용기를 준다고 이야기한다. 가혹한 불운에 대한 가장 멋진 복수는 예술의 창조임을 보여주며 예술로 사람의 마음을 어루만지는 그의 삶을 되새기면서, 누구나 한번은 인생에서 빈센트를 만나 자기답게 사는 길을 꿈꿀 수 있도록 이끌어준다.",2167,BOOK
나만의 기본 - 의식주 그리고 일에서 발견한 단단한 삶의 태도,"마쓰우라 야타로 (지은이), 최윤영 (옮긴이)",51373,국내도서>에세이>외국에세이,9791159350474,일본 젊은 직장인들이 닮고 싶어 하는 마쓰우라 야타로가 일상생활을 하는 데 가장 가까이에 있는 것들을 중심으로 자신만의 기본을 이야기하는 책이다. 자신을 예로 들어 독자들에게 생활 속에서 어떤 방식으로 나만의 기본을 찾아가면 되는지 있는 그대로 보여준다.,"매일의 사소한 선택들이 모여 나라는 사람이 된다!

일본 셀렉트 서점의 시작으로 평가받으며 책을 사랑하는 여행자들이 찾아가는 명소가 된 카우북스의 대표이자 41세의 젊은 나이에 잡지 《생활의 수첩》의 편집장에 취임하는 등 자신만의 길을 만들어온 프로패셔널 마쓰우라 야타로. 일본 젊은 직장인들이 닮고 싶어 하는 마쓰우라 야타로가 일상생활을 하는 데 가장 가까이에 있는 것들을 중심으로 자신만의 기본을 이야기하는 『나만의 기본』.

자신이 입고 먹는 것, 생활하는 공간, 사용하는 물건, 직장에서 일을 처리하는 방식 등을 통해 나다움이 무엇인지 발견할 수 있다고 생각하는 저자는 이 책을 통해 생활 속에서 어떤 방식으로 나만의 기본을 찾아갈 수 있는 지 보여준다. 저자는 생활 속에서 자신이 무엇을 좋아하고 싫어하는지, 어떤 면에 서툰지 어떤 일에서 능력을 발휘하는 제대로 알아야 비로소 나다운 생활을 시작할 수 있다고 이야기한다. 

자신이 어떤 옷을 좋아하고 어떤 소재를 입었을 때 편안함을 느끼는지, 어떤 물건을 오래 사용하고 있는지, 집 안의 공간에서 가장 중요하게 생각하는 곳은 어디인지, 그곳을 어떤 분위기의 공간으로 만들고 싶은지, 일을 하며 어떤 것을 가장 중요하게 생각하는지, 일을 하며 사용하는 도구는 어떤 기준으로 선택하는지, 스스로에 대해 사소한 것까지 관찰하고 자신에게 맞는 것을 선택하는 과정이 삶을 단단하게 만들어주는 튼튼한 기본이 된다는 깨달음을 전한다.",795,BOOK
2019 심우철 실전동형 모의고사 Season 2 - 9급.7급.경찰.소방 공무원 시험대비 실전동형 모의고사,심우철 (지은이),34628,국내도서>수험서/자격증>공무원 수험서>7/9급 공무원>영어>기출/문제/모의고사,9791162050439,"2015년 ~ 2018년까지 최근 4개년의 국가직.지방직 기출을 완벽하게 재현했다. 각 문항에 실제 시험과 동일한 유형을 배치하고, 최근 기출의 난이도를 고려하여 문제를 제작하였다. 지문의 길이와 문항의 난도 또한 실제 시험과 최대한 동일하게 구성하였다.",,805,BOOK
2019 에듀윌 GSAT 삼성직무적성검사 기출분석집 - 삼성 인적성 GSAT 무료특강 + 기출분석집,에듀윌 취업연구소 (지은이),36025,국내도서>수험서/자격증>취업/상식/적성>기업 적성검사>GSAT(SSAT),9791159499074,"GSAT 빈출 유형을 47개로 세분화하여 정밀 분석한 교재다. 각 유형에 맞춰 풀이시간을 확 줄일 수 있는 71가지 실전스킬을 수록하였다. 또한 GSAT 유형에 최적화된 모의고사 4회를 새롭게 구성하였고, 시험장풀이를 제시한 실전풀이집을 제공한다.",,679,BOOK
포노 사피엔스 - 스마트폰이 낳은 신인류,최재붕 (지은이),263,국내도서>경제경영>트렌드/미래전망>트렌드/미래전망 일반,9788965707691,"인문과 공학을 아우르는 통찰과 체계적인 데이터 분석으로 지난 10년간 발생한 급격한 시장 변화를 ‘포노 사피엔스’라는 신인류를 중심으로 풀어냈다. 신인류의 등장과 특징과 그들이 ‘축’이 된 새로운 문명의 실체, 산업군별 시장 변화와 소비행동의 변화, 포노 사피엔스 시대의 성공 전략과 새 시대의 인재상에 대해 진지하게 성찰하고 있다.","포노 사피엔스 문명을 이해하느냐 그렇지 않느냐에, 살아남을 수 있느냐 없느냐의 명운이 달려있다!

인문과 공학을 아우르는 통찰과 체계적인 데이터 분석으로 지난 10년간 발생한 급격한 시장 변화를 ‘포노 사피엔스’라는 신인류를 중심으로 풀어낸 문명을 읽는 공학자, 최재붕 교수의 『포노 사피엔스』. 문명의 교체가 일어나는 바야흐로 혁명의 시대. 누구도 강요하지 않았는데 사람들은 TV와 신문을 끊고 스마트폰을 미디어와 정보의 창구로 선택했고, 누구도 강요하지 않았는데 은행지점에 발길을 끊고 온라인 뱅킹을 선택했다. 그리고 이 선택은 상상을 초월할 정도의 빠른 속도로 확산되고 있다. 

이러한 일상의 변화를 만든 근본 원인은 권력이나 자본과 같은 특정세력이 아니라 ‘포노 사피엔스’라는 신인류의 자발적 선택이다. 인류의 자발적 선택에 따른 이러한 변화를 우리는 진화라고 한다. 우리는 원하든, 원치 않든 돌이킬 수 없는 문명의 대전환기를 살고 있다. 막아서느냐, 받아들이느냐의 선택은 우리의 몫이지만 새로운 문명의 도래는 이미 정해진 인류의 미래라는 뜻이기도 하다.

이 책은 이처럼 제4차 산업혁명의 출발을 인류의 변화에서 풀어낸 것으로, 신인류의 등장과 특징과 그들이 축이 된 새로운 문명의 실체, 산업군별 시장 변화와 소비행동의 변화, 포노 사피엔스 시대의 성공 전략과 새 시대의 인재상에 대해 진지하게 성찰하고 있다. 이를 통해 우리가 포노 사피엔스의 시각으로 세상으로 바라볼 수 있도록, 혁명의 시대 속에 위기보다는 기회를 볼 수 있도록, 혼란스러움보다는 현명함을 지닌 채 헤쳐 나갈 수 있도록 도와준다.",12739,BOOK
과학은 선악을 다룰 수 있는가 - 한국 스켑틱 Skeptic 2019 Vol.17,스켑틱 협회 편집부 (지은이),51002,국내도서>과학>기초과학/교양과학,9772383984000,과연 과학은 선과 악을 다룰 수 있을까? 악에 대한 과학적 이해는 인간의 죄에 대한 관용을 증가시킬 것인가? 과학적 사고들은 어떻게 선을 증진해왔는가? 가치의 문제로 알려진 선과 악의 문제를 과학의 관점에서 고찰한 스켑틱 17호.,,1227,BOOK
쿵후보이 친미 레전드 25,마에카와 타케시 (지은이),3724,국내도서>만화>소년만화>액션,9791164125395,,"수령은 생명의 초월자! 
‘비약의 힘’을 받아들여 줄곧 지배해온 160년. 
그가 원한 결말은 ‘목숨을 갖고 노는 실험’이었다. 
국군을 끌어들여 요새와 함께 파멸로 이끌 대량의 화약, 
그 점화까지 남은 시간은 불과 몇 분! 
식인곰 ‘산신’의 발톱과 엄니를 물리치고 수령을 뒤쫓는 친미. 
그러나 그 앞을 막아선 것은 최강의 적수 스이세이였다―!",460,BOOK
쾌락독서 - 개인주의자 문유석의 유쾌한 책 읽기,문유석 (지은이),51381,국내도서>인문학>인문 에세이,9788954653848,"『개인주의자 선언』 『미스 함무라비』 문유석 판사의 신작. 글쓰는 판사, 소문난 다독가로 알려진 작가의 독서 에세이로, 어린 시절부터 지금까지 책 중독자로 살아온 이야기를 유쾌하게 담았다.","책 중독자로 살아온 문유석 판사의 즐거운 독서 놀이!

글 쓰는 판사, 소문난 다독가로 알려진 《개인주의자 선언》, 《미스 함무라비》의 저자 문유석의 독서 에세이 『쾌락독서』. 초등학생 시절부터 책 읽기에 빠져 성인용 책은 물론, 신문의 광고와 부고까지 읽는 책 중독자였던 저자가 어린 시절부터 지금까지 자신에게 어떻게든 영향을 주었던 책에 대해 이야기하는 책이다. 

어린 시절 친구 집에 놀러가도 책장에 꽂힌 책들을 구경하고 읽어대느라 나가서 놀자는 친구와 실랑이를 벌이기 일쑤였던 저자는 사춘기 시절 야한 장면을 찾아 읽다가 한국문학전집을 샅샅이 읽게 되었고, 《유리가면》으로 순정만화 세계에 입문하기도 했다. 전혀 관심도 없는 불교 책, 한자투성이 옛날 책, 심지어 요리백과사전까지 읽었던 저자는 어른이 된 지금도 자신만의 책 고르는 방법인 ‘짜샤이 이론’에 따라 재미있어 보이는 책을 우선으로 읽고 있다.

중식당의 기본 밑반찬인 짜샤이가 맛있는 집은 음식도 맛있었다는 경험에 빗댄 방법으로, 처음 30페이지를 먼저 읽어보고 내 취향의 책이다 싶으면 끝까지 읽어나가는 책 읽기다. 내가 재미있고 내가 즐거우면 그것으로 만족하는 저자는 고시생 시절 《슬램덩크》가 안겨준 뭉클함, 김용과 무라카미 하루키 전작을 탐독한 이유 등 책과 함께 가슴 설레고 즐거웠던 책 덕후 인생을 솔직하게 펼쳐 보이며 책과 함께 노는 즐거움의 특별함, 책에 대한 애정을 드러낸다.",7851,BOOK
신헌의 PSAT for NCS 수리.자료해석 핵심 기본서 - 공기업 NCS 및 대기업 인적성 대비,"신헌, 위포트 연구소 (지은이)",34912,국내도서>수험서/자격증>PSAT (행정고시)>자료해석,9791161980454,"주요 공기업 필기시험에 출제된 PSAT형 문제 완벽 대비를 위한 자료해석 전문가 신헌의 수리.자료해석 핵심 기본서 개정판이다. 공기업 NCS 필기시험에 출제된 PSAT형 자료해석 적중 문제를 수록하였고, 신헌 선생님만의 문제 풀이 팁과 접근법을 제시한다.",,4121,BOOK
약속의 네버랜드 10,"시라이 카이우 (지은이), 데미즈 포스카 (그림)",4134,국내도서>만화>본격장르만화>판타지>드라마틱 판타지,9791134815257,"탈옥을 알리는 경보가 울리고 귀신의 추적이 벌어지는 가운데, 작은 단서에 의지해 도주를 시작한 엠마 일행. 거짓 평온을 버리고 자유를 찾아나선 그들이 본 것은?! 영원의 아이들이여, 절망에 맞서라! 충격의 탈옥 판타지!!","시작된 인간들의 반란. 일어선 GP 아이들이 한 걸음씩 귀신을 몰아간다. 전투가 이어지는 가운데 엠마는 눈앞의 강적 레우위스와 조용히 말을 나누는데…?! 영원의 아이들이여, 절망에 맞서라! 충격의 탈옥 판타지!",2086,BOOK
