title,author,genre_id,genre,ISBN,description_aladin,description_naver,salesPoint,mallType
하우스 오브 카드,"마이클 돕스 (지은이), 김시현 (옮긴이)",50919,국내도서>소설/시/희곡>영미소설,9791156756040,"오바마, 시진핑, 힐러리가 열렬한 팬임을 자처한 정치스릴러 드라마 [하우스 오브 카드]의 원작. 마가렛 대처 정부의 실세이자 '아기 얼굴을 한 암살자'라 불리던 정치가 마이클 돕스가 정계에서 밀려난 후 1989년부터 1994년까지 집필한 '하우스 오브 카드' 삼부작의 첫 번째 책이다.","오바마, 시진핑, 힐러리 등 전 세계 정치인들이 열광한 미드 《하우스 오브 카드》의 원작!

마가렛 대처 정부의 실세이자 ‘아기 얼굴을 한 암살자’라고 불리던 정치인 마이클 돕스가 정계에서 밀려난 후 집필한 소설 「하우스 오브 카드」 시리즈의 첫 번째 작품. TV 드라마의 역사를 새로 썼다는 평을 받으며 대성공을 거둔 데이빗 핀처 감독, 케빈 스페이시 주연의 정치스릴러 《하우스 오브 카드》의 원작이다. 드라마의 성공에 힘입어 1989년부터 1994년까지 집필했던 작품의 표현과 맥락을 2014년 정치 상황과 바뀐 현실을 반영해 수정, 보완해 새롭게 선보인다.

장기 집권 중인 당의 궂은일을 도맡아 해오던 원내총무 프랜시스 어카트, 상대를 무너뜨리며 당을 지켜온 그는 이번 선거만 성공적으로 마무리되면 자신에게도 당연히 더 높은 자리가 주어질 것이라 기대하지만 달라진 건 아무 것도 없다. 결국 그는 스스로 총리가 되기 위해 그동안 쌓아둔 비밀을 이용해 본격적으로 정치수완을 발휘하기로 한다. 한편 젊고 야망이 넘치는 정치부 기자 매티 스토린은 총리의 가족이 저지른 충격적 금융 부패 사건에 의혹을 품고 진실을 파고들며 점점 더 정계의 깊숙한 곳으로 접근한다. 이를 위해 그녀는 모든 것을 걸고, 심지어 자기 내면의 악마와도 맞서 싸워야만 하는 상황에 놓이는데…….",498,BOOK
"어린이 과학 형사대 CSI 28 - CSI, 함께 성장하다!, CSI 시즌 3","고희정 (지은이), 서용남 (그림), 곽영직 (감수)",48867,국내도서>어린이>과학/수학/컴퓨터>과학 일반,9788957367117,"어린이 형사들이 교과서에 배우는 과학 원리를 이용하여 사건을 해결하는 과정을 흥미진진하게 그려냈다. 28권은 CSI 아이들이 뇌와 기억, 석회암과 석회 동굴, 물의 압력과 힘, 액체의 성질 등 교과서 과학 원리를 이용하여 다양한 사건을 해결하는 과정을 담고 있다.","과학과 추리를 결합한 『어린이 과학 형사대 CSI』 제28권 《CSI, 함께 성장하다!》. 과학 지식이 뛰어난 어린이 형사 학교 학생들이 다양한 사건·사고를 교과서 속 과학 원리를 이용하여 해결하는 과정을 담았습니다. 따라서 책을 읽으면 저절로 초등학교와 중학교에서 배우는 과학 원리와 관찰력·추리력·통합적 사고력 등을 배울 수 있습니다. 뿐만 아니라 어린이들이 공감할 수 있는 사랑·우정·희망 등의 이야기를 담아, 어린이들의 마음을 어루만져 주는 유쾌한 성장 동화입니다.",943,BOOK
노빈손과 위험한 기생충 연구소,"서민 (지은이), 이우일 (그림)",51822,국내도서>어린이>문화/예술/인물>직업의 세계,9788958075790,"노빈손이 알려 주는 전문가의 세계 시리즈 1권. 서민 박사가 기생충과 기생충 학자에 대해 들려준다. 이 책은 아이들에게 ‘기생충학’이라는 색다르고 특이한 전문 분야를 소개하여, 미래의 꿈을 확장시켜주고, 꿈을 펼칠 수 있는 새로운 선택지를 제안한다.","서민 박사가 들려주는 사랑스러운 기생충의 세계!

「 노빈손이 알려 주는 전문가의 세계」는 전문가가 직접, 자신의 분야를 ‘모험 이야기’를 통해 재미있게 들려주는 시리즈이다. 전문 지식을 비롯하여 전문가가 어떤 일을 하는지, 전문가가 하는 일이 사회에 어떤 공헌을 하는지, 어떻게 하면 그 분야의 전문가가 될 수 있는지를 알려 주는 진로탐색 시리즈이기도 하다. 첫 번째 권인 『노빈손과 위험한 기생충 연구소』에서는 서민 박사가 기생충과 기생충 학자에 대해 들려준다. 

책에는 3년간 숨소리조차 내지 않고 사람 몸속에 조용히 들어앉아 있다가 죽는 편충, 우리 몸속 안 다니는 데 없이 다 돌아다니는 기생충의 왕 회충, 몸속의 피를 빨아먹는 십이지장충, 엉덩이를 가렵게 하는 요충 등 한 번은 들어 봤을 법한 친숙한 기생충들뿐 아니라, 개미를 조종하는 창형흡충, 곤충을 물속으로 투신하게 만드는 연가시, 개구리 다리를 여섯 개로 만드는 리베이로이아흡충 등 놀랍고도 영악한 기생충까지, 기상천외하고 매력적인 기생충들이 노빈손과 함께 모험을 펼친다.

이 책을 읽고 나면 징그럽고 혐오스럽게만 생각했던 기생충에 대한 편견이 싹 사라지고, 이 놀라운 생명체에 대한 과학적인 호기심이 샘솟을 것이다. 어쩌면 몸속에 기생충을 한 마리 키워 보고 싶어질지도 모른다.",920,BOOK
내 아이의 자신감 자존감 - 아이의 미래는 자신감이 만든다!,허영림 (지은이),51795,국내도서>좋은부모>육아>자녀 심리,9788998482442,부모라면 누구나 아이의 자신감과 자존감을 키워주고 싶어 한다. 그러나 실패하지 않고 내내 행복하기를 바라는 마음과 자녀 스스로 한다는 게 아직은 미덥지 않고 불안한 마음에서 ‘자녀 관리’를 한다.,"《내 아이의 자신감 자존감》의 저자 허영림 교수는 “아이 스스로 잘 성장해 가기를 바라는 부모라면 뭔가를 자율적으로 하도록 환경을 만들어주고 지켜봐주면서 때때로 칭찬과 격려만 잘해도 된다”고 강조한다. 부모로부터 “넌 뭐든 해낼 수 있어”라는 암시 어린 말을 듣고 자란 아이는 능력 있고 자신감 넘치는 청년으로 자라고, “네가 문제가 있는 건 너도 알지?”라는 말을 듣고 자란 아이는 정말로 문제 있는 청년으로 자라게 된다.",528,BOOK
고려사의 재발견 - 한반도 역사상 가장 개방적이고 역동적인 500년 고려 역사를 만나다,박종기 (지은이),113,국내도서>역사>한국고대~고려시대>고려시대,9788958628002,"한반도 역사상 가장 개방적이고 역동적인 500년 고려 역사를 만날 수 있는 책. 그간 특정 시대와 영역에 편중되어 있던 한국사 이해의 편식증을 극복하고, 한국사 이해의 영역을 고려로 확장함으로써 고려사에 대한 일반인의 관심을 환기시킨다.","다원 사회였던 고려사를 재발견하다!

고구려, 백제, 신라는 700여 년간, 고려와 조선은 500여 년간을 존속한 나라였다. 그중에서도 고려왕조는 한반도 역사상 가장 진취적이고 개방적이며 다양한 사상이 공존한 다원 사회였지만 한국인의 역사 관심은 그중에서도 고대 또는 조선시대에 편중되어 있어 500년간 지속된 고려왕조에 대한 역사 이해는 그리 높지 않은 실정이다.

『고려사의 재발견』은 문화와 사상 면에서의 다양성과 통일성, 정치와 사회면에서 개방성과 역동성을 지닌 고려의 수많은 인물과 사건을 통해 구체적인 모습을 담아낸 책이다. 스토리텔링을 살린 본연의 역사 서술에 집중해 고려인, 고려문화, 고려를 뒤흔든 수많은 사건으로 고려 왕조의 내면과 속살을 고스란히 드러내 독자로 하여금 고려사를 읽는 즐거움을 선사한다. 

 이 책은 역사 본연의 스토리텔링을 살림으로써 독자로 하여금 고려사를 좀 더 흥미롭게 이해할 수 있도록 구성했다. 《고려사》,《삼국사기》,《삼국유사》등 풍부한 사료와 수많은 자료를 근거로 고려 역사를 면밀히 재구성했다. 또한 이들 사료를 통해 고려 다원사회의 특징을 가감 없이 드러내 그간 잘 알려지지 않았거나 잘못 알려진 역사적 사실을 바로잡고자 했다.",1258,BOOK
유아 식판식 - 편식 걱정 없이 혼자서도 잘 먹는,김주연 (지은이),53475,국내도서>요리/살림>전문가/연예인/블로거 요리,9788952772978,"이 책의 식단은 매일 1만여 명의 사람들이 다녀가는 저자의 블로그에서 엄마들이 좋아했던 레시피들만을 엄선해 구성되었다. 아침, 점심, 저녁 세 끼는 물론 반찬 가짓수 걱정을 줄이면서 영양도 골고루 담은 일품요리, 엄마가 직접 만들어주는 건강한 간식까지 실었다.","우리 아이 입맛을 되돌리는 63가지 식판식, 104가지 레시피!

아이는 특정 시기, 특히 이유식 시기를 지나 점차 다양한 음식을 접하게 되는 15~60개월 사이에 편식을 하거나 먹는 것에 대한 흥미를 잃어버리는 경우가 많다. 밥을 다 먹을 때까지 1시간이든 2시간이든 입에다 떠 먹여주거나 얼러도 보고 혼내도 본다. 하지만 밥을 억지로 먹이는 것은 아이에게 스트레스를 줄 뿐만 아니라 밥상머리 교육에도 좋지 않다.

『유아 식판식』의 저자 또한 밥 안 먹는 아이를 둔 엄마로서 수많은 날을 속상함과 눈물바람으로 지냈다. 하지만 내 아이의 건강한 성장 발육을 위해서라면 뭐든지 해야 한다는 굳은 마음가짐으로 매일같이 새로운 식재료와 조리법을 시도하며 고군분투했다. 라면 물 맞추는 것도 어려워했던 저자였지만 이것저것 시도해보며 결국에는 아이의 입맛을 사로잡을 수 있었다. 

이 책의 식단은 매일 1만여 명의 사람들이 다녀가는 저자의 블로그에서 엄마들이 좋아했던 레시피들만을 엄선해 구성되었다. 아침, 점심, 저녁 세 끼는 물론 반찬 가짓수 걱정을 줄이면서 영양도 골고루 담은 일품요리, 엄마가 직접 만들어주는 건강한 간식까지 실었다. 또한 매일같이 아이에게 뭘 먹일지 고민하는 엄마들을 위해 균형 잡힌 식단을 직접 짜줌으로써 육아로 바쁜 엄마들의 수고를 덜어주고자 하였다.",4862,BOOK
병속에 담긴 사계절 - 1년 12달 제철 재료로 만드는 홈메이드 저장식 99가지,방영아 (지은이),53472,국내도서>요리/살림>생활요리,9791185473048,"지난 1년간 식재료가 가장 맛있을 계절에 맞춰 가정에서 만들기 좋은 다양한 홈메이드 저장식을 개발하고, 만들어지는 과정을 관찰해 이 한 권에 담았다. 친정어머니에게 물려 받은 노하우와 자신의 20년 요리 인생에서 터득한 지식을 한 병, 한 병 홈메이드 저장식마다 고스란히 담아냈다.","제철 식재료로 실패없는 홈메이드 저장식을 만든다!

제철을 맞이한 식재료만큼 건강에 좋고 맛있는 것이 있을까? 건강한 제철 재료를 사계절 내내 먹을 수 있다면 얼마나 좋을까? 『병 속에 담긴 사계절』은 이런 생각을 바탕으로 지난 1년간 식재료가 가장 맛있을 계절에 맞춰 가정에서 만들기 좋은 다양한 홈메이드 저장식을 개발하고, 만들어지는 과정을 관찰하여 담은 책이다. 이 책의 저자 방영아 요리연구가는 친정어머니에게 물려 받은 노하우와 자신의 20년 요리 인생에서 터득한 지식을 한 병, 한 병 홈메이드 저장식마다 고스란히 담아냈다.

이 책은 잼, 청, 차, 피클, 장아찌, 젓갈, 발효액(효소), 식초, 술, 게다가 소스와 조미료까지 웬만한 병에 담는 홈메이드 저장식 99개를 두루두루 소개했다. 특히 신경쓴 것은 더욱 건강하게 만들기 위해 최소한의 설탕과 소금을 사용한 것. 시간과 돈, 정성을 들여서 저장식을 만드는 가장 큰 이유는 바로 시판 제품보다 더 건강하게, 그리고 덜 달게, 덜 짜게 먹을 수 있도록 도왔다. 더불어 이 책에서는 저장식을 다양하게 활용하는 방법을 소개해 더욱 실용적으로 사용할 수 있도록 소개하고 있으며, 재료 고르는 법부터 밑준비, 만들기, 발효와 숙성 관리, 활용법까지 꼼꼼히 알려주어 누구나 실패 없이 홈메이드 저장식을 따라 할 수 있다.",1757,BOOK
시간여행은 가능한가 - 한국 스켑틱 Skeptic 2015 Vol.1,스켑틱 협회 편집부 (엮은이),51002,국내도서>과학>기초과학/교양과학,9772383984000,"대중을 위한 새로운 교양 과학 잡지 &lt;스켑틱&gt;에서는 물리학자들이 시간 여행의 실현가능성을 타진해본 시간 여행 특집 기사, 다중우주를 둘러싼 논쟁을 소개한 포커스 섹션을 만나볼 수 있다.",,3868,BOOK
일빵빵 입에 달고 사는 기초영어 4 : 접속사.길게 말하기 편,서장혁 (지은이),49849,국내도서>외국어>영어회화>생활영어,9791185419084,"단어와 단어, 문장과 문장을 이어 주는 ‘and’, ‘so’, ‘because’ 등의 접속사들을 예문과 함께 정리해 보며, 다양하고 풍부한 뜻을 지닌 회화 문장을 연습해 본다.","4권에서는 단어와 단어, 문장과 문장을 이어 주는 ‘and’, ‘so’, ‘because’ 등의 접속사들을 예문과 함께 정리해 보며, 다양하고 풍부한 뜻을 지닌 회화 문장을 연습해 본다. 또한 지금까지 잘못 알고 있었던 접속사들의 개념을 다잡아주어, 보다 정확하고 실질적인 회화 문장을 표현할 수 있도록 한다. 연습 문장 역시 일상생활에서 자주 쓰이는 문장들을 중심으로 구성하였다. 책을 끝까지 따라가다 보면, 어느새 영어 말문이 ‘빵’ 터져 있는 자신을 발견하게 될 것이다.",9193,BOOK
던전에서 만남을 추구하면 안 되는 걸까 5 - S Novel,"오모리 후지노 (지은이), 야스다 스즈히토 (그림), 김완 (옮긴이)",89167,국내도서>소설/시/희곡>라이트 노벨>S 노벨,9791157100545,몬스터들과 힘겹게 싸우면서도 여유를 잃지 않던 벨 일행. 그러나 다른 파티가 벨 일행에게 몬스터를 붙이고 가면서 벨 일행은 위험에 처하게 된다. 설상가상으로 천장이 무너지면서 벨 일행은 던전에 고립되게 되는데…….,"[던전에서 만남을 추구하면 안 되는 걸까] 제5권. 지난 4권에서 스미스인 벨프를 파티에 추가하면서 더욱 힘을 얻게 된 벨은 릴리와 함께 세 명이서 중층 탐색에 나선다. 몬스터들과 힘겹게 싸우면서도 여유를 잃지 않던 벨 일행. 그러나 다른 파티가 벨 일행에게 몬스터를 붙이고 가면서 벨 일행은 위험에 처하게 된다. 설상가상으로 천장이 무너지면서 벨 일행은 던전에 고립되게 되는데……. 한편 벨이 던전에서 돌아오지 않자 헤스티아는 벨을 구하기 위해 퀘스트를 의뢰하고, 그녀를 도와줄 사람들을 모아 벨을 구하러 던전으로 향하게 되는데…….",4226,BOOK
일빵빵 스토리가 있는 영어회화 3,서장혁 (지은이),49849,국내도서>외국어>영어회화>생활영어,9788996895176,"미국인들의 일상에 등장하는 회화 표현을  어렵지 않게, 학습하기 쉽게 정리해 놓은 영어 회화 책 '일빵빵' 시리즈 3권. 원어민들이 가장 많이 사용하는 ‘동사’를 이용한 회화 패턴과 원어민의 음성으로 들려주는 대본으로 살아 있는 리스닝의 요령을 익힐 수 있다.","스토리가 있는 『일빵빵 영어회화』 제3권. 원어민들이 가장 많이 사용하는 ‘동사’를 이용한 회화 패턴과 원어민의 음성으로 들려주는 대본으로 살아 있는 리스닝의 요령을 익힐 수 있다. 회화의 기초부터 심화까지 단계적으로 이어지는 ‘일빵빵’ 방송을 차근차근 따라가다 보면, 어느새 입이 터지고, 귀가 열리는 영어의 기적을 체험하게 된다.",9754,BOOK
살육에 이르는 병,"아비코 다케마루 (지은이), 권일영 (옮긴이)",51058,국내도서>소설/시/희곡>추리/미스터리소설>일본 추리/미스터리소설,9788952748126,"아비코 다케마루는 이른 바 수수께끼와 트릭에 집중하는 추리소설의 한 경향을 이르는 1세대 신본격 작가로, <점성술 살인사건>의 시마다 소지가 적극적으로 추천했던 작가들(우타노 쇼고, 노리즈키 린타로, 아야츠지 유키토)과 같은 시기에 작품 활동을 시작했다. <살육에 이르는 병>은  아비코 다케마루의 최고작을 넘어 신본격 추리소설의 걸작으로 평가받는 작품.",,3059,BOOK
달님 안녕 시리즈 보드북 세트 - 전4권,하야시 아키코 (지은이),35096,국내도서>유아>0~3세>그림책,9788970944746,"<달님 안녕>을 비롯한 하야시 아키코의 그림책들이 보드북으로 새롭게 나왔다. 아이들이 너무나 사랑하는 <달님 안녕>, <싹싹싹>, <구두구두 걸어라>, <손이 나왔네>의 네 권으로 구성된, 오직 세트로만 판매되는 한정 상품이다.","일본 태생의 그림책 작가 하야시 아키코의 『달님 안녕 세트』 전4권. 2006년에 출간된 후, 베스트셀러로 오래도록 굳건하게 사랑받고 있는 뿐 아니라, , , 그리고  등 유아에게 오랫동안 사랑받아온 4권의 그림책을 보드북으로 재구성하여 묶었습니다. 단단한 보드북이므로 유아들이 혼자서도 쉽게 페이지를 넘기면서 즐겁게 볼 수 있습니다. 

은 밤을 환하게 밝히는 달님을 마치 사람처럼 그려낸 그림책입니다. 쉬운 언어로 이루어진 짧은 이야기가 단순하면서도 감성적인 그림과 어우러져 아름답게 펼쳐집니다. 유아들이 가지고 있을 밤에 대한 공포심과 두려움을 잠재워줍니다. 는 유아들에게 옷을 입는 순서를 가르쳐주는 그림책입니다. 몸의 구조도 자연스럽게 일깨워주고 있습니다. 혼자 옷을 입는 아기의 생동감 넘치는 표정을 통해 성취감을 맛보게 해줍니다. 

는 처음 걸음마를 하게 된 유아들을 위한 그림책입니다. 노란색 리본을 단 하얀색 구두를 등장시켜 유아들의 서툰 걸음을 그대로 그려냈습니다. 끝으로 은 혼자서 음식을 떠먹을 수 있게 된 유아들의 모습을 반영한 그림책입니다. 생쥐와 토끼, 그리고 곰을 등장시킴으로써 관심을 이끕니다. 유아들이 혼자 음식을 떠먹는 행동을 통해 자립심을 기를 수 있도록 인도해줍니다. 전4권. 보드북.",14811,BOOK
발자크와 바느질하는 중국소녀,"다이 시지에 (지은이), 이원희 (옮긴이)",50921,국내도서>소설/시/희곡>프랑스소설,9788972753162,"2000년 <소설 속으로 사라진 여자>라는 제목으로 출간된 다이 시지에의 첫 장편소설이 재출간되었다. 중국의 문화혁명 기간 중 '부르주아 지식인'으로 분류되어 농촌으로 재교육을 받으러 간 두 소년과, 농촌에서 만난 바느질하는 소녀와의 낭만적인 사랑을 그린 작품. 영화로 만들어져 2002년 칸 영화제에서 상영되기도 했다.","2000년 라는 제목으로 출간된 다이 시지에의 첫 장편소설이 재출간되었다. 중국의 문화혁명 기간 중 '부르주아 지식인'으로 분류되어 농촌으로 재교육을 받으러 간 두 소년과, 농촌에서 만난 바느질하는 소녀와의 낭만적인 사랑을 그린 작품. 영화로 만들어져 2002년 칸 영화제에서 상영되기도 했다.



2003년 &lt;D 콤플렉스>로 페미나상을 수상한 다이 시지에는, 프랑스에서 영화감독과 소설가로 활동 중인 중국 태생의 작가. 중국인의 정체성 문제를 특유의 해학과 유머로 그려내며 주목 받아왔다. 소설 는 직접 문화대혁명을 겪은 작가 자신의 체험을 바탕으로 쓴 작품이다.



고등학교를 졸업한 젊은 지식인들은 모두 농촌으로 보내져 재교육을 받아야만 했던 시절,  부르주아계급 의사를 부모로 둔 두 소년이 첩첩산골로 보내진다. 이들의 재교육이란 것은 소위 똥지게를 지고 나르거나 탄광에서 석탄을 캐는 일. 그러던 어느 날 이들에게 중요한 사건이 일어난다. 하나는 금지된 서양문학과의 만남이고, 다른 하나는 바느질하는 소녀와의 첫사랑이다.



마오쩌둥의 '붉은 어록' 이외에는 거의 모든 책이 금서로 통했던 때, 소년들은 발자크와 플로베르, 도스토예프스키, 스탕달, 톨스토이, 빅토르 위고 등의 작품들을 읽으며 새로운 세계에 눈뜨게 된다. 바느질 소녀 역시 두 소년이 읽어준 발자크의 소설에 매료된다.



작가 다이 시지에는 섬세하고 위트 있는 문체로, 자신의 인생을 바꾸어준 서양의 스승들 발자크, 플로베르, 도스토예프스키 등에게 찬사를 표한다. 작가가 한 인터뷰에서 밝혔듯, 는 책이 인생이 바꿀 수 있다고 진지하게 생각한 세대의 '책에 대한 동경과 찬사'를 담은 소설이라 할 수 있다.",3825,BOOK
무진기행,김승옥 (지은이),50994,국내도서>소설/시/희곡>한국소설>2000년대 이전 한국소설,9788982818677,'무진기행'과 제1회 이상문학상을 수상한 '서울의 달빛 0章'을 비롯한 열다섯 편의 단편소설을 담았다. '서울의 달빛 0章'을 집필하게 된 동기는 자신의 친구가 초혼에 실패하게 된 이야기를 들려준 것이었다고 한다.,"한국 현대문학 사상 가장 탁월한 단편소설!

작가 김승옥의 작품집『무진기행』은 한국 현대문학 사상 가장 탁월한 단편소설로 꼽힌다. 이 작품은 1960년대 산업화가 급격히 진전되면서 비롯된 여러 사회 병리적 현상들, 즉 배금주의, 출세주의, 도시지향성 등을 안개 자욱한 무진을 배경으로 하여 주인공의 허무주의적인 시각과 함께 그리고 있다. 

주인공인 윤희중은 일상을 벗어나고 싶으면서도 용기를 내지 못하고 일상으로 회귀하는 소유자로 일상으로 돌아갈 것인가에 대해 갈등하는 그의 모습이 잘 묘사된 작품이다. 이 작품집에는 그의 문단 데뷔작인 62년작 '생명연습'부터 '누이를 이해하기 위하여', '우리들의 낮은 울타리', '차나 한잔'등의 작품이 실려 있는데 '감수성의 혁명' 김승옥의 작품세계는 주로 자기 존재이유의 확인을 통해 지적 패배주의나 윤리적인 자기도피를 극복해 보려는 작가 의식을 보이고 있다.",11152,BOOK
돼지책 (100쇄 기념판),"앤서니 브라운 (지은이), 허은미 (옮긴이)",35137,국내도서>유아>그림책>나라별 그림책>유럽,9788901033518,웅진 세계그림책 제1권. 가정 내에서 여성이 혼자서 짊어지고 있는 가사노동의 문제에 대해 이야기하고 있다. 어린이책에서는 보기 드물게 페미니즘의 입장에서 여성 문제와 가족 문제를 다루고 있는 것이다.,"그림책의 거장, 앤서니 브라운의 대표작 『돼지책』
국내 출간 20주년 기념 리커버 한정판 출간!

진지한 메시지와 유머러스한 표현으로 그림책의 고전 반열에 오른 『돼지책』이 국내 출간 20주년을 맞아 리커버 한정판으로 찾아왔다. 『돼지책』은 2001년 국내 출간 당시 어린이책에서는 보기 드물었던 페미니즘의 시각에서 가사 노동 문제, 성 고정관념 문제를 다루어 평단과 독자들의 주목을 받았다. 군더더기 없는 글, 치밀하게 계산된 화면 구성, 작품 전반에 흐르는 유머와 위트는 진지한 주제를 설득력 있고 쉽게 전달한다. 20주년 기념 리커버 판은 아버지 피곳 씨와 두 아들이 앞치마를 두르고 냄비를 든 채 활짝 웃는 모습을 담았다. 『돼지책』이 영국에서 처음 출간된 지 36년, 국내에 소개된 지는 20년이 지난 오늘날, 우리 사회의 모습은 얼마나 바뀌었을까? 『돼지책』은 독자들에게 여전히 날카로운 질문을 던진다.",46053,BOOK
