title,author,genre_id,genre,ISBN,description_aladin,description_naver,salesPoint,mallType
"에듀윌 한국사 능력 검정시험 2주끝장 중급 (3.4급) - 한능검 기출끝장 핵심정리 72주제(연표추가), 출모의고사 2회 제공(PMR포함), 최신기출문제 해설 무료특강 [별책부록: D-1 빈출 키워드노트]",한국사기출연구회 (엮은이),166524,"국내도서>수험서/자격증>한국사능력검정시험>기본(4,5,6급)",9791159491047,"최근 3년간 출제된 기출문제(600문항)의 모든 것을 분석하고 정리하였다. 600문항의 출제주제와 유형, 600개의 출제자료, 600개의 정답 선택지와 2400개의 오답 선택지를 모조리 분석하였고, 이 모든 요소를 모아 주제별로 재배열하여 '기출Report'에 담았다.",,870,BOOK
2017 기출이 답이다 9급 공무원 7개년 기출문제집 (국어.영어.한국사) 공통과목 (2016~2010) - 국가직 / 지방직 / 서울시,SD 공무원시험연구소 (엮은이),34613,국내도서>수험서/자격증>공무원 수험서>7/9급 공무원>국어>기출/문제집/모의고사,9791125425571,"독학으로도 학습이 가능하게 해설을 상세하게 풀어 쓰고, 오답 체크를 통해 문제 전체를 확실히 마스터할 수 있도록 하였고 마지막으로 연계 이론과 함정으로 자주 파는 이론을 수록하여 생각을 확장시킬 수 있도록 하였다.",,1492,BOOK
2017 이코노미스트 세계경제대전망,"이코노미스트 (지은이), 현대경제연구원 (감수)",3060,국내도서>경제경영>경제학/경제일반>경제사/경제전망>세계 경제사/경제전망,9788947541633,"이코노미스트 지의 저자들 외에 세계 유수 언론 매체의 편집자들과 정치인, 학자, CEO를 비롯한 세계 유명 인사들이 필진으로 참여한 이번 책은 2017년도에도 구체적이고 소신 있는 의견으로 세계 경제와 금융, 비즈니스의 흐름을 전망하는 데 큰 도움을 줄 것이다.","2017년 세계경제 및 글로벌 트렌드를 꿰뚫는 이코노미스트의 심층 진단!

『2017 세계경제대전망』은 세계 각국의 정치, 경제, 문화를 심층 분석하여 미래 예측과 트렌드 분석에 있어 최고의 미래전망서로 손꼽히는 《이코노미스트 2017 세계경제대전망》의 한국어판이다. 책에는 이코노미스트 지의 저자들 외에도 세계 여러 나라, 각 분야의 최고 전문가와 학자, 정치인 등 유명 인사들이 대거 필진으로 참여해 대륙별, 국가별 정치, 경제, 사회, 문화 등의 흐름을 일목요연하게 정리한다. 분야를 망라한 폭넓은 정보는 독자들에게 2017년에 펼쳐질 세계에 대한 큰 그림을 그릴 수 있도록 도와줄 것이다. 

이코노미스트는 2016년을 자유주의자들에게 있어 가장 암울한 해였다고 자평한다. 서구 사회를 휩쓴 포퓰리스트들의 분노가 영국인들로 하여금 유럽연합 탈퇴에 표를 던지게 했고, 미국인들로 하여금 정치 경험 한번 없는 재계의 큰손인 트럼프가 차기 대통령으로 선출하게 했기 때문이다. 2017년은 러시아 볼셰비키 혁명이 일어난 지 100주년이 되는 해이자, 칼 마르크스의 《자본론》1권 출간 150주년, 체 게바라 사망 50주년, 마르틴 루터의 95개조 반박문이 나온 지 500년이 되는 해이다. 이코노미스트는 과거 격변의 상황과 지금의 저항적인 분위기의 유사점을 발견하기 어렵지 않을 것이며, 2017년은 이러한 흐름이 세계의 자유주의 질서에 가져온 타격이 얼마나 큰지 실감할 수 있는 해가 될 것이라고 전망하였다. 

또한, 세계 경제의 저금리ㆍ저성장화에 따른 문제와 해법을 다루고, 2017년 금융과 비즈니스에서 주목할 만한 이슈 전망을 다루고 있다. 금융투자자들은 미국의 새로운 정부가 어떤 의미를가질지, 유럽에서 브렉시트가 시장에 어떤 영향을 미칠지 등에 관한 문제를 풀어야 하는 난감한 상황에 처함으로서 정치적 불확실성과 이에 따른 중앙은행의 정책변화가 투자자들이 직면한 가장 큰 이슈가 될 전망이라고 밝혔다. 

이코노미스트는 대한민국의 대선에도 주목하였다. 박근혜 정권 말기 대중의 분노가 부채질되고 있는 지금, 현재 대한민국의 가장 시급한 문제인 은퇴자들이 빈곤에서 벗어나도록, 많은 젊은층이 취업을 못하고 있는 심각한 실업 현황에서 벗어나도록 어떻게 도울 것인지 살펴본다. 끝으로 20-30대 밀레니얼 세대 중 떠오르는 예술가, 활동가, 창업자, 혁신가 등을 초대해 2017년의 전망과 예측을 들어보는 특별 섹션을 마련했다.",532,BOOK
2017 시나공 컴퓨터활용능력 2급 필기 + 별책부록(기출문제집),"길벗 R&D, 강윤석, 김우경, 김용갑, 김종일, 김선길 (지은이)",7006,국내도서>컴퓨터/모바일>활용능력>컴퓨터활용능력>컴퓨터활용능력 필기,9791160500318,"지금까지 출제된 모든 기출문제를 통계적으로 분석하여 시험에 나오는 것만 골라 99개의 섹션, 338개의 필드로 정리하였다. 섹션에는 시험에 출제된 비율에 따라 A, B, C, D 등급을 지정하고, 각 필드에는 시험에 나온 출제 년도를 표기하여 수험생이 보다 효율적으로 공부할 수 있도록 하였다.",,1691,BOOK
심심한 칠드런 2,와카바야시 토시야 (지은이),3743,국내도서>만화>순정만화>틴에이지 순정,9791125658528,,"『심심한 칠드런』제2권. 어느 고등학교를 무대로 여러 명의 주인공들이 여러 가지 사랑을 보여주는 옴니버스식 4컷 만화. 달달함. 답답함, 오해와 알 수 없는 설레임이 난무하는 중독성 있는 고교 러브 코미디로, 많은 팬들을 확보할 인기작으로 예상된다.",490,BOOK
싸이보그지만 괜찮아 각본 - 싸이보그지만 괜찮아,"박찬욱, 정서경 (지은이)",51054,국내도서>예술/대중문화>영화/드라마>시나리오/시나리오작법,9788994040981,박찬욱 감독의 영화 [싸이보그지만 괜찮아] 각본을 책으로 엮었다. 영화 [싸이보그지만 괜찮아]는 스스로를 싸이보그라 믿는 영군(임수정 분)이 신세계 정신병원에 입원하며 펼쳐지는 일들을 그린다.,"자기에 대한 다른 사람의 ‘몰이해’로 탄생된 싸이보그!

박찬욱 감독의 영화 〈싸이보그지만 괜찮아〉 각본을 책으로 엮었다. 정서경 작가와 박찬욱 감독은 〈친절한 금자씨〉 각본을 시작으로 〈싸이보그지만 괜찮아〉, 〈박쥐〉, 〈아가씨〉 각본을 공동 집필해왔다. 그중 『친절한 금자씨 각본』, 『싸이보그지만 괜찮아 각본』, 『박쥐 각본』이 동시 출간된다.

뜨거운 심장을 가진 사랑스러운 싸이보그 영군 캐릭터는 단연 이 영화의 백미다. 〈싸이보그지만 괜찮아〉 각본은 제40회 시체스국제판타스틱영화제 최우수 각본상을 수상하기도 했다. ‘박찬욱 복수 3부작’ 이후 밝고 따뜻한 세계를 그려낸 감독의 새로운 시도이자, 독특한 화면 연출과 세계관을 펼쳐낸 영화인 만큼 『싸이보그지만 괜찮아 각본』이 많은 이들에게 읽히고 사랑받을 수 있기를 기대해본다. 각본과 영화를 견주는 시간은 독자를 영화 속으로 깊숙이 밀어 넣고, 영화를 새로이 발견하게 도울 것이다.

영화 〈싸이보그지만 괜찮아〉는 자신을 살갑게 키워준 외할머니가 치매로 요양원에 간 후부터 자신을 싸이보그라 믿게 된 영군을 통해, 거대한 상실감과 슬픔과 분노를 이겨내는 시간을 따뜻한 시선으로 그려냈다.",940,BOOK
앵무새 죽이기,"하퍼 리 (지은이), 김욱동 (옮긴이)",50919,국내도서>소설/시/희곡>영미소설,9788932917207,"성경 다음으로 가장 영향력 있는 책 1위, 미국 작가 하퍼 리의 &lt;앵무새 죽이기&gt;가 번역을 다듬고 새로운 디자인으로 2015년 열린책들에서 출간되었다. 하퍼 리의 &lt;앵무새 죽이기&gt;는 1960년 출간 직후 미국 전역에서 선풍적인 인기를 끌면서 그 이듬해 하퍼 리에게 퓰리처상의 영예를 안겨 준 작품이다.","반세기 넘도록 전 세계에서 끊임없이 읽히고 사랑받는 하퍼 리의 수작!

성경 다음으로 가장 영향력 있는 책으로 꼽히는 하퍼 리의 소설 『앵무새 죽이기』를 예스러운 표현을 오늘날에 맞게 다듬고 재정비한 번역과 새로운 디자인으로 만나본다. 1960년 출간 직후 미국 전역에서 선풍적인 인기를 끌면서 그 이듬해 하퍼 리에게 퓰리처상의 영예를 안겨 준 작품으로, 대한민국에서도 2003년 정식 발매 이후 독자들에게 꾸준히 읽히며 30만 부 이상의 판매를 기록했다.

이 작품은 미국에서 인종차별이 가장 심했던 주 가운데 하나인 남부 앨라바마 주에서 실제로 있었던 일을 토대로 젊은 백인 여성을 성폭행했다는 누명을 쓴 한 흑인 청년을 백인 변호사가 법정에서 변호하는 이야기를 담고 있다. 소설 속 화자인 6살 소녀 스카웃의 눈으로 작품의 핵심이 되는 사건을 관찰하며 1930년대 대공황의 여파로 피폐해진 미국의 모습과 사회계층 간, 인종 간의 첨예한 대립을 그리고 있다. 

억울한 누명을 썼지만 단지 흑인이라는 이유로 유죄가 되는 미국 남부 사회 어른들의 편견에 대한 비판과 타자와의 대화 가능성을 아이의 순수한 눈을 통해 감동적으로 그려내며 정의와 양심, 용기와 신념이 무엇인지, 더 나아가 사회로 하여금 스스로를 돌아볼 기회를 제공한다.",32646,BOOK
남자들은 자꾸 나를 가르치려 든다,"리베카 솔닛 (지은이), 김명남 (옮긴이)",51326,국내도서>사회과학>여성학/젠더>여성문제,9788936472634,섬세하고 날카로운 통찰과 재치 넘치는 글쓰기를 선보여 환영받아온 리베카 솔닛의 신작 산문집이 출간되었다. 전세계에서 공감과 화제를 불러일으킨 신조어 ‘맨스플레인’의 발단이 된 글 「남자들은 자꾸 나를 가르치려 든다」를 비롯해 9편의 산문을 묶었다.,"뭐든지 설명하고 가르치려 드는 남자들에게 보내는 통쾌한 한방!

2010년 《뉴욕 타임스》가 꼽은 ‘올해의 단어’로 선정된 바 있는 ‘맨스플레인(mansplain, man+explain)’은 위키피디아에 따르면 ‘누군가에게 무언가를, 특히 남성이 여성에게 거들먹거리거나 잘난 체하는 태도로 설명하는 것’을 가리키는 합성어이다. 『남자들은 자꾸 나를 가르치려 든다』는 전세계에서 공감과 화제를 불러일으킨 신조어 ‘맨스플레인’의 발단이 된 글 《남자들은 자꾸 나를 가르치려 든다》를 비롯해 여성의 존재를 침묵시키려는 힘을 고찰한 9편의 산문을 묶은 책이다.

이 책의 저자이자 환경·반핵·인권운동에 열렬히 동참한 현장운동가 리베카 솔닛은 잘난 척하며 가르치기를 일삼는 일부 남성들의 우스꽝스런 일화에서 출발해 다양한 사건들을 통해 성별, 경제, 인종, 권력으로 양분된 세계의 모습을 단숨에 그려낸다. 그럼으로써 우리가 일상에서 늘 마주하는 작은 폭력이 실은 이 양분된 세계의 거대한 구조적 폭력의 씨앗임을 예리하고 생생하게 보여준다. 여성에 대한 이야기로 시작해서 여성과 남성의 세계의 화해와 대화의 희망까지 이야기하는 대담함과 날카로움이 엿보인다.",9121,BOOK
모든 것을 기억하는 남자,"데이비드 발다치 (지은이), 황소연 (옮긴이)",107436,국내도서>소설/시/희곡>액션/스릴러소설>외국 액션/스릴러소설,9791158790493,"전 세계 80개국 45개 언어로 출간되어 1억 1천만 부라는 어마어마한 판매고를 올린 작가, 출간 수익을 기준으로 명실공히 세계에서 가장 성공적인 범죄소설 작가 데이비드 발다치의 장편소설. 과잉기억증후군을 앓고 있는 경찰이 가족의 죽음을 목도하고 살인자를 추적해나가는 이야기를 담은 미스터리 스릴러이다.","완벽한 기억력이 간과한 단 하나의 사실, 기억하지 못하는 단 한 사람은 누구인가!

데이비드 발다치 장편소설 『모든 것을 기억하는 남자』. 과잉기억증후군을 앓고 있는 한 남자가 가족의 죽음을 목도하고 살인자를 추적해나가는 이야기를 담은 미스터리 스릴러이다. 2미터에 달하는 키에 100킬로그램이 한참 넘는 몸무게, 지저분한 행색에 무성한 수염을 하고 좁은 여관방에서 하루하루 죽지 못해 사는 남자 에이머스 데커. 한때는 그에게도 집이 있었고 직업이 있었고 사랑하는 가족이 있었다. 오랜 잠복근무를 마치고 돌아온 그날, 처참히 살해된 가족의 모습을 발견하기 전까지는.

데커는 누구보다 뛰어난 형사였지만 결국 범인은 흔적조차 찾을 수 없었고, 자책감에 시달리며 괴로워하다 집과 직업을 잃고 노숙자나 다름없는 신세로 전락한다. 그러나 2년 뒤, 약에 취한 것 같은 세바스찬 레오폴드라는 남자가 경찰서로 걸어 들어와 범행을 자백하면서 모든 것은 달라진다. 그는 데커가 세븐일레븐에서 자신을 무시했기 때문에 그의 가족을 죽여버렸다고 자백한다. 그러나 데커는 그가 진범일 리가 없다고 생각한다. 그의 기억에 세바스찬 레오폴드라는 사람은 없고, 데커는 과잉기억증후군, 즉 모든 것을 기억하는 사람이기 때문이다. 

한편, 데커가 졸업한 맨스필드 고등학교에서 총기 난사 사건이 발생해 학생 네 명과 교직원 세 명이 희생당한다. 범인이 마법처럼 사라진 가운데, 이 사건과 데커 가족의 살인사건이 연관되어 있다는 사실이 드러나면서 사건은 전혀 다른 국면을 맞게 되는데……. 이제 영리한 데다 잔인하기 짝이 없는 범인을 잡기 위해서는 저주 같던 그 능력을 십분 발휘해야만 한다!",5059,BOOK
접어 만들기 : 카카오프렌즈 라이언,삼성출판사 편집부 (엮은이),35113,국내도서>유아>놀이책>유아 만들기/접기,8809256424705,"종이를 뜯어낸 후, 접고, 붙이면 카카오 프렌즈 페이퍼 토이가 완성된다. 만드는 방법을 따라 접기만 하면 남녀노소 누구나 쉽게 카카오 프렌즈를 만들 수 있다. 완성한 페이퍼 토이는 인테리어 소품으로도 그만이다.","종이를 뜯고 접어 붙이면 카카오 프렌즈 완성!

나왔다 하면 완판! 명실상부 국민 캐릭터로 자리매김하고 있는 [카카오 프렌즈]를 접어 만들기로 만날 수 있습니다. 종이를 뜯어낸 후, 접고, 붙이면 카카오 프렌즈 페이퍼 토이가 완성됩니다. 만드는 방법을 따라 접기만 하면 남녀노소 누구나 쉽게 카카오 프렌즈를 만들 수 있어요. 완성한 페이퍼 토이는 인테리어 소품으로도 그만이지요! 내가 좋아하는 카카오 프렌즈를 모두 만나요!",2434,BOOK
일빵빵 스토리가 있는 영어회화 3,서장혁 (지은이),49849,국내도서>외국어>영어회화>생활영어,9788996895176,"미국인들의 일상에 등장하는 회화 표현을  어렵지 않게, 학습하기 쉽게 정리해 놓은 영어 회화 책 '일빵빵' 시리즈 3권. 원어민들이 가장 많이 사용하는 ‘동사’를 이용한 회화 패턴과 원어민의 음성으로 들려주는 대본으로 살아 있는 리스닝의 요령을 익힐 수 있다.","스토리가 있는 『일빵빵 영어회화』 제3권. 원어민들이 가장 많이 사용하는 ‘동사’를 이용한 회화 패턴과 원어민의 음성으로 들려주는 대본으로 살아 있는 리스닝의 요령을 익힐 수 있다. 회화의 기초부터 심화까지 단계적으로 이어지는 ‘일빵빵’ 방송을 차근차근 따라가다 보면, 어느새 입이 터지고, 귀가 열리는 영어의 기적을 체험하게 된다.",9754,BOOK
현자의 제자를 자칭하는 현자 3 - S Novel+,"류센 히로츠구 (지은이), 후지 초코 (그림), 정대식 (옮긴이)",89167,국내도서>소설/시/희곡>라이트 노벨>S 노벨,9791157105533,아홉 현자의 일원인 소울하울을 찾는 일에 약간의 단서를 찾기는 했으나 헛걸음에 그쳤다. 남겨져 있던 자료를 들고 루나틱레이크로 귀환한 미라는 맹우 솔로몬에게 자료의 분석을 맡긴 동안 심심풀이 삼아 알카이트 학원을 방문하는데….,"『현자의 제자를 자칭하는 현자』 제3권. 아홉 현자의 일원인 소울하울을 찾는 일에 약간의 단서를 찾기는 했으나 헛걸음에 그쳤다. 남겨져 있던 자료를 들고 루나틱레이크로 귀환한 미라는 맹우 솔로몬에게 자료의 분석을 맡긴 동안 심심풀이 삼아 알카이트 학원을 방문한다. 그곳에서 이루어진 심사회에서 어째서인지 소환사 대표로 술법을 선보이게 된 미라는, 이왕 하는 거 쇠락한 소환술을 부흥시키기 위해 최고의 술법으로 임하게 되는데…….",1567,BOOK
"김상욱의 과학공부 - 철학하는 과학자, 시를 품은 물리학",김상욱 (지은이),51301,국내도서>과학>물리학>물리학 일반,9788962621488,"철학하는 과학자, 양자역학 시인 김상욱 교수의 “과학 인문학”. 이 책의 의도와 목적은 우리에게 필요한 과학이라는 ‘시스템’을 포괄적으로 이해하는 것, 즉 ‘과학적 사고방식’이다. 그리고 ‘과학적 사고방식’은 곧 철학이고 인문학이다.","인문 교양에 뿌리내린 비판적 지성. '물리학자'김상욱 교수의 과학 공부란?

21세기 과학기술의 발전은 상상을 초월하고 있다. 이는 인간과 세계에 대한 우리의 인식은 큰 변화를 요구하고 있다. 그러나 과학기술에 대한 지식이 부족하고 오랫동안 인문학 중심의 태도를 가져왔던 우리에겐 생소한 상황이다. 인공지능 관련 이슈, 생명 윤리의 문제, 환경 파괴에 대한 논란등 21세기를 살아가며 과학적 사고를 배제하는 것은 불가능하다. 즉, 과학은 상식이 된 것이다.

『김상욱의 과학공부』은 과학 지식을 심층적으로 습득하기 위해 ‘공식들’과 ‘법칙들’을 외워야하는 것이 아닌 우리에게 필요한 과학이라는 ‘시스템’을 포괄적으로 이해하는 것, 바로 ‘과학적 사고방식’을 이해하고자 한다. ‘과학적 사고방식’은 철학이고 인문학이다. 과학적 영감에서 철학적 통찰을 이끌어내고, 과학에서 삶의 해답을 찾는 것. 우리가 사는 세상과 맞닿아 있는 과학을 가까이하는 것. 과학과 인문학이 소통하는 것. 이것이 앞으로의 인문학이자, 과학을 포함한 진정한 인문학이 될 것이다.

총 4장으로 구성된 이 책은 1장 ‘과학으로 낯설게 하기’에서 세상을 낯설게 보고 다르게 보는 방법을 훈련하여 과학적 사고방식으로 첫걸음을 내딛게 한다. 2장 ‘대한민국 방정식’에서는 한국 사회에 존재하는 신화와 공포를 파헤치며 제3장 ‘나는 과학자다’에서 과학적 사고방식을 통해 어떻게 세상을 보는지 살펴본다. 마지막 4장 ‘물리의 인문학’에서 저자는 ‘어떻게 살 것인가’라는 인류의 본질적 질문에 우주로 답한다.",6364,BOOK
영단기 신토익 VOCA - 최신 기출 단어.출제 포인트 완벽 반영 토익 단어 30일 완성,"홍진걸, 권오경 (지은이)",49857,국내도서>외국어>토익>Vocabulary,9791156177272,"영단기 신토익 시리즈. 토익 단어 데이터로 집합, 단어 엄선을 위한 끝장 토의, 빈출도 및 중요도 순으로 단어 선정하였다. 그리고, 연결 암기를 위한 주제별로 구성하였다.",,1430,BOOK
아이네 클라이네 나흐트무지크,"이사카 고타로 (지은이), 최고은 (옮긴이)",50998,국내도서>소설/시/희곡>일본소설>1950년대 이후 일본소설,9788972757993,"문학과 음악의 앙상블이 돋보이는 이사카 고타로의 이색적인 작품집. 단편보다 장편을 즐겨 쓰고 연애소설에는 관심이 없다고 공언해 온 이사카 고타로가 발표한 연작 단편 형식의 연애소설로, 2015년 일본의 전국 서점 직원이 고른 '가장 팔고 싶은 책'인 서점대상 최고작 10위권에 선정되었다.","이사카 고타로의 연작소설 『아이네 클라이네 나흐트무지크』. 기존 소설의 형식에 얽매이지 않는 다양한 실험을 통해 아름다운 가사와 잔잔한 선율처럼 흐르는 플롯이 한데 어우러지는 이색적인 작품집을 내놓았던 이사카 고타로가 발표한 연작 단편 형식의 연애소설로, 단편보다 장편을 즐겨 쓰고 연애소설에는 관심이 없다고 공언해 온 이사카 고타로의 실험적 도전을 엿볼 수 있다. 그의 소설에 거의 대부분 등장하는 영웅이나 초능력자, 강도 같은 인물과 기상천외한 설정이 없고, 대신‘작은 밤의 음악’이라는 뜻의 제목처럼 보통 사람들이 일상 속에서 엮어 가는 만남과 그에 따른 크고 작은 에피소드를 영롱하게 빚어냈다.",669,BOOK
Why? 기후 변화,"강주현 (글), 이준희 (그림), 기후변화센터 (감수)",49224,국내도서>어린이>초등 전학년>학습만화,9788930206808,"Why? 초등과학학습만화 71권. 기후 변화의 원인을 자연적인 것과 인위적인 것으로 나누어 설명하고, 현재 기후 변화의 직접적인 원인이 되는 온실 기체에 관해 이야기한다. 지구 곳곳에서 일어나는 홍수, 가뭄, 집중 호우, 슈퍼 태풍 등 기후 변화의 현장도 담았다.","지구가 아프다는 비명, 기후 변화

최근 지구는 온난화로 인해 몸살을 앓고 있다. 세계 곳곳에서 폭설과 한파가 불어 닥치고, 적도 부근 지역은 가뭄과 사막화가 날로 심해지고 있다. 만약 지구가 아프다는 신호를 우리가 계속해서 모른 척한다면 앞으로의 지구는 어떻게 될까? 『Why? 기후 변화』를 통해 기후 변화란 무엇이고, 왜 일어나는지, 기후 변화를 막기 위해 무엇을 해야 하는지 알아보자.",544,BOOK
마음을 흔드는 글쓰기 - 위대한 작가들이 간직해온 소설 쓰기의 비밀,"프리츠 게징 (지은이), 이미옥 (옮긴이)",51538,국내도서>인문학>책읽기/글쓰기>글쓰기,9788965962021,"어떻게 하면 독자들을 매료시키는 글을 쓸 수 있을까? 이 모든 소설 쓰기의 방법론이 이 책 한 권에 담겼다. &lt;마음을 흔드는 글쓰기&gt;는 1994년 초판이 나온 후 2002년, 2004년, 2010년 개정을 거듭하며 독일에서 '글쓰기의 표준'으로 자리 잡았다.","“독자의 마음을 사로잡는 글에는 흔들리지 않는 규칙이 있다!”

어떻게 하면 독자들을 매료시키는 글을 쓸 수 있을까? 이 모든 소설 쓰기의 방법론이 이 책 한 권에 담겼다. 『마음을 흔드는 글쓰기』는 1994년 초판이 나온 후 2002년, 2004년, 2010년 개정을 거듭하며 독일에서 “글쓰기의 표준”으로 자리 잡았다. 저자 프리츠 게징은 여덟 권의 소설을 쓴 작가이자 독일 최고의 글쓰기 전문가로서 초보자와 프로 작가를 아우르는 “소설 쓰기의 비법”을 공개한다. 

삶이 이야기가 되는 순간부터, 스토리와 캐릭터, 이야기의 플롯, 화자와 서술 시점, 구성과 줄거리 모델, 공간, 언어, 수정과 퇴고까지 소설 쓰기에 필요한 모든 이론을 꼼꼼히 일러준다. 또한 마거릿 미첼, 표도르 도스토옙스키, 버지니아 울프, 밀란 쿤데라, 제인 오스틴, 폴 오스터 등 세기를 빛낸 작가들과 작품을 짚어가며 독자의 마음을 사로잡는 “이야기의 비밀”과 “조건”을 알아본다.",1035,BOOK
서울대 텝스 관리위원회 텝스 최신기출 1200제 해설집 3 - 독점 최신 기출 문제,"서울대학교 TEPS 관리위원회, 넥서스 TEPS 연구소 (지은이)",50044,국내도서>외국어>텝스>종합,9791157529728,2017년 유일하게 서울대학교 TEPS관리위원회가 독점으로 공개하고 공급한 텝스 기출 문제를 수록하였다. 텝스 해설 강의를 듣는 것 같은 상세하고도 정확한 해설을 통해 오답과 함정을 말끔하게 해결할 수 있다.,"- 독자대상 : 텝스 준비생 
- 구성 및 특징 : 
① 2017년 대비 서울대 텝스관리위원회 최신기출 1,200문항 수록
② 정기 TEPS 시험에서 듣던 원어민 목소리와 생생한 고사장 분위기 체험 
③ 청해-문법-어휘-독해 4영역 13개 파트에 대한 TEPS 출제 경향 및 고득점 대비 전략",1828,BOOK
