title,author,genre_id,genre,ISBN,description_aladin,description_naver,salesPoint,mallType
완벽하게 사랑하는 너에게 : 뻔하지만 이 말밖엔,그림에다 (지은이),51376,국내도서>에세이>사진/그림 에세이,9791162205808,"완벽하고 싶지만, 아직은 완벽하지 않은 보통의 가족 이야기. 그림에다는 아이의 마음을 섬세하게 바라보고, 아내만의 시간을 만들어 주고, 아내의 이야기를 경청해 주는 역할을 하고 있다. 아이를 돌보는 서툰 아빠의 시선뿐만 아니라, 아내와 가족을 바라보는 아빠의 따뜻한 시선이 담겨 있는 책이다.","따뜻한 시선과 섬세한 관찰로
SNS 수십만 부모들의 공감! 감동! 위로!
그림에다 감성 가족 에세이

아빠가 육아에 참여하면 어떤 점이 좋을까? 그림에다는 아이의 마음을 섬세하게 바라보고, 아내만의 시간을 만들어 주고, 아내의 이야기를 경청해 주는 역할을 하고 있다. 아이를 돌보는 서툰 아빠의 시선뿐만 아니라, 아내와 가족을 바라보는 아빠의 따뜻한 시선이 담겨 있다.
“이 책은 무엇이 정답인지 알 수 없는 부모의 성장기이자, 가족으로 다듬어져 가는 과정을 그린 가족의 이야기이다. 엄마라 불리고 아빠라 불리는 삶을 살고 있는 보통의 부모에게 위로와 응원을 전한다.”",1762,BOOK
꽃을 보듯 너를 본다,나태주 (지은이),51167,국내도서>소설/시/희곡>시>한국시,9791157280292,J.H Classic 2권. 나태주 시집. 나태주 시인의 작품 가운데에서 인터넷의 블로그나 트위터에 자주 오르내리는 시들만 모았다.,"만인의 심금을 울릴 수 있는 서정시의 진수

블랙핑크(BLACKPINK)의 지수와 세계적인 보컬 그룹인 방탄소년단(BTS)의 RM, 송혜교와 박보검 등은 물론 전국민의 애송시인 [풀꽃]이 수록되어있는 나태주 시집 [꽃을 보듯 너를 본다]. “자세히 보아야/ 예쁘다//오래 보아야/사랑스럽다//너도 그렇다.” 나태주 시인의 [풀꽃]은 전국민의 애송시라고 해도 과언이 아니다. 순수하고 꾸밈없는 시어들은 풀꽃의 시처럼 독자들에게 꾸준히 읽히면 더 큰 사랑을 받게 됐다. 평범한 것에 아름다움을 보는 눈, 별 볼일 없다고 생각했던 무언가를 다시보게 하는 힘이 이 시집에 있다.",64531,BOOK
"검사내전 - 생활형 검사의 사람 공부, 세상 공부",김웅 (지은이),51348,국내도서>사회과학>법과 생활>법률이야기/법조인이야기,9788960516175,저자 김웅은 2000년 사법연수원을 수료한 이래 18년간 검사 일을 해왔다. 그런데 굳이 스스로를 '생활형 검사'라고 지칭한다. 검사란 이 사회에서 권력의 중심에 있는 힘 있는 자들이라고 생각하는 사람들로서는 고개를 갸웃거릴 대목이다.,"드라마가 아닌 현실을 살아가는 검사의 이야기!

2000년 사법연수원을 수료한 이래 18년간 검사 일을 해오며 스스로를 ‘생활형 검사’라고 지칭하는 김웅이 검찰 안에서 경험한 이야기이자, 검사라는 직업 덕분에 알게 된 세상살이, 사람살이를 둘러싼 속마음에 대한 이야기를 들려주는 『검사내전』. 어려서부터 검사를 꿈꿔본 적이 단 한 번도 없었고 엉겁결에, 어쩌다 보니 검사가 된 저자가 다른 데 욕심내기보다 검사라는 직분으로 치열하게 살아온 기록을 담고 있다. 

저자는 끊임없이 거짓과 싸워야 하는 검사 일을 하다 보니 한때는 사람 말을 믿지 않게 되었을 뿐 아니라 그들을 만나는 게 지겨워지기 시작했지만 다른 인생의 찢어진 틈을 들여다보고 그것을 꿰매주어야 할 때가 많기에 다시 일의 보람을 느끼게 되었다고 고백한다. 사건 피의자들과 피해자들을 만나며, 범죄 자체가 내뿜는 악에 집중하기보다 사람들이 갖고 있는 욕망과 그로 인해 드리워진 삶의 그림자들에 더 관심을 기울이는 저자는 자신이 비록 죄를 다루는 검사라 하더라도 세상사를 단편적으로 이해하지 않으려 노력한다.

검사실에서 마주하는 인생의 파열들이 직선적이고 단편적일 것이라고 생각할지 모르지만 사실 들여다볼수록 다양하고 모순적이기에, 세상의 일들을 직선적으로 추정하지 않고 이야기의 뒷면과 진짜 사연을 이해하고자 노력하며 성실하게 살아가는 세상의 약자들에게 힘이 되어주고 싶다는 저자의 이야기를 통해 인간과 법, 그리고 두렵고 원시적인 존엄함에 대한 생각들을 마주하게 된다.",9983,BOOK
악스,"이사카 고타로 (지은이), 김해용 (옮긴이)",50998,국내도서>소설/시/희곡>일본소설>1950년대 이후 일본소설,9788925563718,"이사카 고타로 소설. 겉으로는 평범한 회사원이지만 사실은 알아주는 킬러인 풍뎅이. 킬러 업계에서는 전설적인 존재이지만, 지독한 공처가다. 풍뎅이가 가장 원하는 건 업계에서 은퇴하는 것. 하지만 잘못하면 가족이 위험해질 수도 있다. 그는 가족을 지키고 은퇴의 꿈을 이룰 수 있을까?","가족을 위해 싸우는 인간적인 킬러, 풍뎅이!

《골든 슬럼버》, 《사신 치바》 등 다수의 흥행작을 탄생시키며 미스터리 소설 독자뿐만 아니라 일반 독자들까지 사로잡은 작가 이사카 고타로가 《그래스호퍼》, 《마리아비틀》 이후 7년 만에 선보이는 「킬러 시리즈」의 신작 『악스(Ax)』. 겉으로는 평범한 회사원이자 가장, 지독한 공처가이기까지 하지만 사실은 업계에서 알아주는 베테랑 킬러 풍뎅이의 이야기를 담은 작품이다. 시리즈 가운데서도 모순된 설정과 유머, 개성 있는 인물들이 보여주는 재미가 단연 돋보이는 소설로, 가장이자 회사원으로서의 일상과 킬러의 일상이 뒤섞인 흥미로운 세계로 독자를 끌어들인다. 

킬러 업계에서 완벽한 일 처리를 자랑하는 전설적인 존재, 풍뎅이. 살인 지령을 내리는 안드로이드 같은 의사의 의뢰를 처리하고 밤늦게 집에 들어가는 날이면, 아내가 깰까 봐 소리가 덜 나는 어육 소시지를 먹으며 허기를 달래는 것이 일상인 지독한 공처가다. 고등학생 아들 가쓰미는 그런 아버지가 때론 조금 한심해 보인다. 

물론 풍뎅이의 본업은 가족에겐 비밀이다. 그가 지금 가장 원하는 건 업계에서 은퇴하는 것. 하지만 일을 그만두려면 돈이 더 필요하다는 의사의 말에 풍뎅이는 아이러니하게도 살인을 계속하는 처지가 된다. 그리고 얼마 뒤 풍뎅이는 예상치 못한 곳에서 누군가로부터 습격을 받고, 위험한 사건들에 휘말린다. 그는 과연 가족을 지키고 은퇴의 꿈을 이룰 수 있을까?",1183,BOOK
드래곤 빌리지 27 - 판타지 모험 RPG 게임코믹,"김언정 (지은이), 김찬 (그림)",139408,국내도서>어린이>게임 만화/캐릭터도감,9791162877692,가온과 친구들은 가슴 벅찬 새 모험을 떠나기 위해 엘피스로 향한다. 그런데 이카루스를 찾기 위해 떠난 카이가 현상수배범?! 그리고 카이를 쫓는 나루하루 백작. 그에게는 어떤 비밀이 숨겨져 있는 것일까?,"1000만 이상의 유저들에게 사랑받는 
최강의 게임 드래곤 빌리지 게임만화 27권 대발행!!

새롭게 펼쳐지는 유타칸의 세계!
진실을 쫓기 위한 가온과 드래곤들의 모험이 다시 시작된다!

꿈의 보석의 힘으로 역사 속으로 사라진 크레바스…
그리고 찾아온 평온함… 변화…!!
유타칸에 새로운 세계가 펼쳐졌다!
가온과 친구들은 가슴 벅찬 새 모험을 
떠나기 위해 엘피스로 향한다! 그런데…
이카루스를 찾기 위해 떠난 카이가 현상수배범?!
그리고 카이를 쫓는 나루하루 백작!! 그에게는 어떤 비밀이
숨겨져 있는 것일까? 
카이의 진실을 쫓기 위한 
가온과 친구들의 새로운 이야기가 시작된다!",572,BOOK
고양이는 안는 것,"오야마 준코 (지은이), 정경진 (옮긴이)",50998,국내도서>소설/시/희곡>일본소설>1950년대 이후 일본소설,9791160072693,"[조제, 호랑이 그리고 물고기들], [메종 드 히미코] 이누도 잇신 감독의 영화 원작소설. 하나의 이야기를 고양이의 시선과 인간의 시선에서 그리고 있는 5편의 연작 소설로, 고양이와 인간이 엮어가는 감동적이고 따뜻한 인연이야기이다.","""고양이는 그리는 것이 아니야. 안는 거야.""



고단한 하루를 보낸 당신에게 '작지만 확실한 행복'을 가져다줄 소설

한밤중 네코스테 다리의 고양이 집회로 당신을 초대합니다



[조제, 호랑이, 그리고 물고기들] [메종 드 히미코]의 이누도 잇신 감독, [1리터의 눈물]의 사와지리 에리카 주연 힐링 판타지 영화 [고양이는 안는 것] 개봉을 맞아 동명의 원작 소설이 발간된다. 『하루 100엔 보관가게』로 한국 독자들에게 가슴 따뜻한 감동을 전한 바 있는 저자 오야마 준코는 ‘고양이’와 ‘힐링’을 환상적으로 결합, 외로운 고양이와 인간이 서로 애정을 주고받으며 저마다의 행복을 찾아가는 이야기를 간결하지만 여운이 오래가는 문장들로 아름답게 풀어낸다.",2275,BOOK
"해커스 토익 실전 1000제 3 RC 리딩 문제집 (Hackers TOEIC Reading 신토익 Edition) - 토익시험에 나올 토익모의고사 10회분,최신 토익기출 반영,토익 RC 리딩 만점 대비 무료학습자료 8종 제공(온라인 토익모의고사 + 단어암기장 등)",해커스어학연구소 (지은이),49858,국내도서>외국어>토익>실전,9788965422167,"토익 최신 출제경향을 완벽 반영한 실전서이다. Part 5 에서 문제풀이 시간이 줄어든 Part5 신토익 경향 반영하였고 Part 6 에서는 신유형인 '알맞은 문장 고르기' 문제를 반영, Part 7에서는 3개 지문을 읽고 푸는 신유형 '삼중 지문' 문제를 반영하였다.","최신 토익 문제로 실전 마무리!

『해커스 신토익 실전 1000제. 3 Reading(문제집)』은 신토익 최신 출제경향을 완벽 반영한 실전서이다. Part 5 에서 문제풀이 시간이 줄어든 Part5 신토익 경향 반영하였고  Part 6 에서는 신유형인 '알맞은 문장 고르기' 문제를 반영,  Part 7에서는 3개 지문을 읽고 푸는 신유형 '삼중 지문' 문제를 반영하였다. 

또한 신토익 유형 및 난이도를 완벽 반영한 실전모의고사 10회분 수록되어 있으며 자신의 수준에 맞춰 공부할 수 있는 ""수준별 학습 플랜"" 제공한다. 스스로 동기를 부여해 끝까지 학습할 수 있는 ""토익 Reading 목표 달성기""와 자신의 문제 풀이 방식을 점검 및 보완하는 ""Self 체크 리스트"" 가 수록되어 있다.",10478,BOOK
악의,"히가시노 게이고 (지은이), 양윤옥 (옮긴이)",51058,국내도서>소설/시/희곡>추리/미스터리소설>일본 추리/미스터리소설,9788972754190,"&lt;용의자 X의 헌신&gt;의 히가시노 게이고의 추리소설. 한 인기 작가의 죽음을 둘러싸고 쫓고 쫓기는 두뇌 게임이 펼쳐진다. 작가의 죽음에 얽힌 기나긴 악의의 여정을 탐구하며 '왜, 어떻게 범죄를 저질렀는가'에 초점이 맞춰져 있다. 살인사건을 둘러싼 관계자, 수사관의 수기, 주변인의 증언과 회상, 그리고 해명으로 이루어진 특이한 구성으로 인간의 내면 심리에 적재된 악을 파헤쳐가는 인간적인 방법을 보여준다.","잠재되어 있는 악의가 이길 때, 사람은 사람이 아니게 된다!

일본 미스터리계의 거장으로 꼽히는 작가 히가시노 게이고의 장편소설『악의』. 제134회 나오키상 수상작 으로 널리 알려진 히가시노 게이고의 이번 작품은 '왜, 어째서' 죽였는지 살인의 동기를 묻는 가해자에 대한 작가 특유의 성찰과 화법이 돋보인다. 등장인물들의 기록을 통해 사건을 전개하면서, 인간의 내면에 잠재된 악의를 파헤친다.

베스트셀러 작가인 히다카가 자신의 작업실에서 살해된 채 발견된다. 사체를 발견한 사람은 히다카의 젊은 아내와, 친구이자 아동문학작가인 노노구치. 한때 노노구치와 같은 직장에서 근무한 인연이 있는 가가 교이치로 형사가 사건을 맡게 되고, 사건에 대한 노노구치의 수기를 토대로 수사를 하던 중 노노구치가 범인임을 밝혀낸다. 하지만 노노구치는 체포된 뒤에도 왜 친구를 살해했는지에 대해서는 침묵을 지키는데…. 

이 소설은 자기 연민에 빠진 범인 노노구치의 글과, 감정이 배제된 가가 형사의 기록을 번갈아 보여준다. 일찌감치 범인을 알려주는 작가는 범인의 정체보다는 살인의 동기와 범죄의 과정에 더 집중하고 있다. 살인의 동기, 그 이면에 숨겨져 있는 인간의 악의, 허를 찌르는 반전과 인간에 대한 통찰이 어우러지며 흥미진진하게 펼쳐진다. [양장본]",10287,BOOK
혼자가 좋다 - 온전히 나에게 집중하는 삶,"프란치스카 무리 (지은이), 유영미 (옮긴이)",51381,국내도서>인문학>인문 에세이,9791186757253,"혼자 산다는 것의 의미와 가치, 현실적 어려움과 장단점, 혼자 있는 시간의 활용법 등 우리가 몰랐거나 미처 발견하지 못한 혼자 사는 즐거움과 혼자 있는 시간의 여러 측면을 조명함으로써 혼자서도 잘 지내는 법을 알려준다.","홀로 있음의 가치를 일깨우다!

『혼자가 좋다』는 왜 혼자냐고 묻는 이들에게 답하는 책으로, 갈수록 더 많은 사람들이 혼자 살기를 선호하고, 혼자 있는 시간의 중요성을 강조하면서도 막상 혼자, 특히 여성이 산다고 하면 어딘가 문제가 있는 사람이나 사회성이 부족한 사람으로 보는 시선에 이의를 제기한다. 저자는 혼자 사는 삶도 충분히 의미있고 아름다울 수 있음을 다양한 측면에서 보여주며 싱글에 대한 잘못된 인식, 시대착오적 관성을 바로잡아줘 혼자 산다는 이유로 고통을 당하거나 원치 않는 방향으로 떠밀려간 이들의 삶을 단단하게 붙잡아준다.

저자는 홀로 있음이 좋고 나쁨의 문제가 아니라 그냥 맞닥뜨린 현실일 뿐이라며 그럴수록 혼자 있는 힘을 키우라고 강조한다. 혼자 살아도 괜찮다는 위안에 그치지 않고 혼자여서 더 행복한 이유와 방법을 구체적으로 알려준다. 누구에게도 휘둘리지 않으면서, 불필요한 일에 에너지를 쏟지 않고, 원치 않았던 것들에서 해방되어, 진짜 내가 원하고 재미있어 하는 것들로 일상을 가득 채울 21가지 즐거운 방법이 페이지마다 넘쳐난다. 외롭거나 힘들다고 느낄 때 위로가 되는 경험들과 자신의 감정을 파악할 수 있는 도구를 마련해놓음으로써 혼자라는 막연한 두려움과 맞설 수 있게 돕는다.",1439,BOOK
ETS 신토익 공식입문서 LC (리스닝) 출제기관 독점 공개 - 교재 + 해설집 + 무료 동영상 강의 + ETS 성우 MP3 무료 제공,ETS (지은이),49855,국내도서>외국어>토익>Listening,9788917224719,ETS가 제시하는 토익 입문자용 맞춤 학습서. 토익 출제기관 ETS에서 개발한 입문자용 맞춤 문항에서부터 정기시험과 동일한 유형과 난이도의 실전형 문항까지 다양한 ETS 문항들이 수록되어 있다.,,3280,BOOK
ETS 신토익 공식입문서 RC (리딩) 출제기관 독점 공개 - 교재 + 해설집 + 무료 동영상 강의 + 필수 어휘 무료 MP3,ETS (지은이),49854,국내도서>외국어>토익>Reading,9788917224726,"토익 출제기관인 ETS에서 제시하는 토익 입문자용 맞춤 학습서. 신유형을 완벽 반영한 ETS 개발 문제로 이루어져 있으며, 신토익 문제 유형을 철저히 분석하여 반영한 해결 전략도 제시한다. 특히 토익을 처음 접하는 초보자들이 학습에 어려움을 느끼지 않도록 수준별, 단계별 학습으로 제공하고 있다.",,3057,BOOK
버핏클럽 issue 1 - Becoming Warren Buffett,"김철광, 김태석, 박성진, 백우진, 서준식, 숙향, 심혜섭, 염지현, 이건, 이기원, 이상건, 이은원, 장홍래, 홍춘욱, systrader79 (지은이)",174,국내도서>경제경영>재테크/투자>주식/펀드,9791187691150,"워런 버핏의 투자 철학과 방법을 좇는 투자자를 위한 가치투자 전문 무크 &lt;버핏클럽&gt;이 창간됐다. 창간호의 모토는 ‘Becoming Warren Buffett’. 버핏처럼 투자해 성과를 낸 ‘한국형 버핏톨로지’를 나누기 위해 국내에서 내로라하는 버핏 전문가, 가치투자 고수들이 모였다. 쟁쟁한 가치투자자들이 내공이 담긴 경험과 투자법을 공개한다.","국내에서 내로라하는 버핏 전문가, 가치투자 고수들이 모였다!

워런 버핏의 투자 철학과 방법을 실전에 적용할 수 있도록 쟁쟁한 고수들과 일반 투자자를 이어주는 가치투자 전문 무크 『버핏클럽(Buffett Club)』 제1권. 워런 버핏처럼 투자해 성과를 낸 한국형 버핏톨로지(Buffettology)를 나누기 위해 올해 버크셔 주주총회의 Q&A부터 리틀 버핏으로 불려도 손색이 없는 최준철 VIP투자자문 공동대표의 투자 철학과 성공 스토리, 버핏처럼 부동산 투자하기, 직장인에게 알맞은 투자법 등의 내용을 다각도에서 알차게 담아냈다.

올해 열린 버크셔 해서웨이 주주총회 질의·응답 내용은 투자 분야 전문 번역가인 이건이 전한다. 주주총회에 참석한 펀드매니저 이기원과 가치투자연구소 설립자 김태석, 두 가치투자자의 참관기도 생생하다. 펀드매니저로 활동했고 《워런 버핏처럼 적정주가 구하는 법》을 쓴 이은원은 주주서한을 정밀하게 분석했다. 이와 더불어 쟁쟁한 가치투자자들이 내공이 담긴 경험과 투자법이 담겨 있다.

자산운용업계에서 투자책임자로 활약 중인 서준식, 박성진, 장홍래 등 세 고수가 들려주는 가치투자 방법론, 키움증권 이코노미스트 홍춘욱, 주주행동주의 전문가 심혜섭 변호사 등도 고견을 더해 읽을거리, 생각할 거리를 더욱 풍부하게 만들었다.",725,BOOK
어른이 되면 - 발달장애인 동생과 함께 보낸 시설 밖 400일의 일상,장혜영 (지은이),51074,국내도서>사회과학>사회문제>인권문제,9791196243265,유명 유튜버이며 다큐멘터리 감독이기도 한 장혜영 작가가 18년간 시설에서 살았던 발달장애인 동생을 데리고 나와 함께 살면서 겪은 평범하지만 특별한 일상 이야기를 담은 책이다.,"장애인과 비장애인, 우리 모두는 스스로의 노력만이 아닌 주변의 도움으로 삶을 영위할 수 있다!

중증 발달장애인 동생과의 시설 밖 생존일기 『어른이 되면』. 유명 유튜버이며 다큐멘터리 감독이기도 한 장혜영이 18년간 시설에서 살았던 발달장애인 동생을 시설 밖으로 데리고 나와 함께 살면서 겪은, 평범하지만 특별한 400일 간의 이야기를 담은 책이다. 중증 장애인은 사람들과 함께 살아가는 것이 아니라 사회에서 격리하고, 사람들 사이에서 배제하는 것이 당연하다는 편견의 울타리를 뛰어넘지 못한 채, 열세 살 되던 날부터 18년 동안을 시설에서 살게 된 저자의 한 살 어린 여동생 혜정.

어느 순간 동생이 자신의 삶을 한 번도 스스로 선택한 적이 없다는 사실을 깨달은 저자는 그때부터 동생이 시설에서 사는 것에 의문을 갖기 시작했고, 시설에서 느끼고 경험한 부조리한 상황이 쌓여갈 즈음 동생을 시설에서 데리고 나오기로 결심했다. 동생과 함께 지내는 동안 저자는 동생에게 많은 사람을 만나게 해주어 관계를 맺게 하고 그 과정에서 실제로 동생의 친구가 된 사람들이 생기기 시작했다.

이처럼 책에는 발달장애로 차별을 당했던 동생 혜정씨의 어린 시절부터 그녀가 시설에서 나와 함께 살게 된 과정, 함께 살며 겪는 좌충우돌 동거 이야기, 사회로 나온 혜정 씨의 일상 적응기 등이 담겨있다. 더불어 이 사회에 여전히 만연해 있는 차별, 사회복지서비스의 문제점, 친절한 차별주의자 이야기, 돌봄이란 무엇인가 등에 관한 묵직하고 불편한 내용을 통해 지금 이 사회와 내가 알게 모르게 저지르고 있는 차별의 언어와 행동을 되돌아보게 한다.",1802,BOOK
이갈리아의 딸들,"게르드 브란튼베르그 (지은이), 히스테리아 (옮긴이)",51032,국내도서>소설/시/희곡>세계의 소설>북유럽소설,9788982730009,"상상력과 재치가 넘치는 페미니즘과 유토피아 소설. 현재 우리 사회의 여성과 남성의 성역할 체계가 완전히 바뀐 `이갈리아`라는 가상 공간이 소설의 무대. 생물학적인 차이로 의심의 여지를 두지 않았던 월경, 임신, 출산도 가치체계에 따라 완전히 다른 경험이 될 수 있듯 뒤집힌 사회를 통해 가부장제 사회의 모순을 잘 보여준다.","남성과 여성의 위치가 반대로 뒤바뀐 가상의 세계 이갈리아!

노르웨이 작가 게르드 브란튼베르그의 장편『이갈리아의 딸들』. 남성과 여성의 위치가 정반대로 뒤바뀐 가상의 세계 이갈리아. 이곳에서는 남성이 가정을 지키고 모든 사회활동은 여성이 책임지고 있다. 현실 세계에서는 아이를 낳는 것이 사회생활을 하며 불리한 요인이 되기도 하지만, 이 세계에서는 오히려 아이를 낳지 못하는 사람이 불완전한 것으로 인식되어 중요한 직책을 맡지 못하고, 여성들은 가슴을 그대로 드러내놓고 다니지만 반대로 남성들은 성기를 반드시 가리고 다녀야 한다. 

영어로 번역되었을 당시 큰 논쟁을 불러일으켰으며 유럽에서는 연극으로 공연되기도 했던 이 소설은 남녀의 성역할 체계를 뒤집어 바라보면서 성과 계급 문제, 동성애를 둘러싼 논의 등을 새롭게 바라보는 시각을 갖게 한다. 또한 이 책은 한국에서도 도서명을 딴 웹사이트 '메갈리아'로 사회적 논쟁이 일기도 했다.",19296,BOOK
인간 실격,"다자이 오사무 (지은이), 김춘미 (옮긴이)",50996,국내도서>소설/시/희곡>일본소설>1950년대 이전 일본소설,9788937461033,"자살 미수와 약물 중독, 39세의 젊은 나이에 자살로 생을 마감한 다자이 오사무의 작품 <인간 실격>이 출간됐다. 오직 순수함만을 갈망하는 한 젊은이가 파멸해가는 과정이 그려진다. 뉴욕 타임스는 '인간의 나약함을 드러내는 데 있어 다자이보다 뛰어난 작가는 드물다'고 평했다.","청춘의 한 시기를 통과 의례처럼 거쳐야 하는 일본 데카당스 문학의 대표작

오직 순수함만을 갈망하던 여린 심성의 한 젊은이가 인간들의 위선과 잔인함에 의해 파멸되어 가는 과정을 그린 소설.1948년 서른아홉의 나이로 요절하여 일본 사회에 큰 파장을 남긴 일본 현대 문학의 대표적 작가 다자이 오사무의 작품이다. 어떻게든 사회에 융화되고자 애쓰고, 순수한 것, 더럽혀지지 않은 것에 꿈을 의탁하고, 인간에 대한 구애를 시도하던 주인공이 결국 모든 것에 배반당하고 인간 실격자가 되어가는 패배의 기록을 통해 현대 사회를 예리한 고발하고 있다. 함께 실린 '직소'에서는 유다의 인간적인 측면을 저자만의 독특한 시선으로 새로이 조명하고 있다.",81987,BOOK
