title,author,genre_id,genre,ISBN,description_aladin,description_naver,salesPoint,mallType
학교에 페미니즘을,초등성평등연구회 (지은이),51338,국내도서>사회과학>여성학/젠더>여성학이론,9791186000625,"페미니즘 교육에 대한 관심만큼이나 다른 한편 우려가 있는 것이 사실이다. 남자아이가 기를 못 펴게 되지는 않을까, 혹시라도 평가에 나쁜 영향을 미치지 않을까 하는 분위기가 학교 안팎에 분명 있다. 하지만 교실에서 남자아이와 여자아이는 서로 대립하는 상대가 아니며, 가해자와 피해자도 아니다.","페미니즘 교육에 대한 관심만큼이나 다른 한편 우려가 있는 것이 사실이다. 남자아이가 기를 못 펴게 되지는 않을까, 혹시라도 평가에 나쁜 영향을 미치지 않을까 하는 분위기가 학교 안팎에 분명 있다. 하지만 교실에서 남자아이와 여자아이는 서로 대립하는 상대가 아니며, 가해자와 피해자도 아니다. 이 책을 쓴 페미니스트 교사들은 페미니즘 교육이란 남자아이와 여자아이를 구별해서 미리 판단하지 않는 것에서 시작하는 성평등 교육이라고 말한다.",1373,BOOK
숲은 생각한다 - 숲의 눈으로 인간을 보다,"에두아르도 콘 (지은이), 차은정 (옮긴이)",51381,국내도서>인문학>인문 에세이,9788997186730,"캐나다의 인류학 교수이자 코스타리카에서 생태학을 공부한 저자 에두아르도 콘이 아마존 숲 속의 생활상을 4년간 관찰, 사색한 결과물을 고스란히 담아낸 책이다. 재규어에서부터 개미핥기, 대벌레와 솔개, 선인장과 고무나무에 이르기까지 숲 속 생물들의 흥미진진한 삶을 풀어낸다.","종을 횡단하는 소통 방식을 이해할 수 있는 새로운 패러다임을 제시하다!

캐나다의 인류학 교수이자 코스타리카에서 장기간 생태학을 연구한 저자 에두아르도 콘이 아마존 숲속의 생활상을 4년간 관찰, 사색한 결과물을 고스란히 담아낸 『숲은 생각한다』. 인간 중심의 기존 인식론적 견해를 넘어서 어떻게 문명과 야생 사이에 소통이 가능한가를 묻는 이 책은 미국인류학회에서 수여하는 저명한 학술상인 그레고리 베이트슨 상을 수상했을 뿐 아니라 최근 인문학계의 새로운 이론적 흐름인 존재론적 전회를 이끄는 대표적인 저서로 평가되고 있다.

숲이 생각한다는 말은 비유가 아니다. 나무와 동물은 정말로 생각하고 감정을 느낀다. 다만 우리가 그동안 가져온 사고와 감정에 대한 이해의 폭이 너무나 협소했던 것이다. 저자는 언어가 없는 숲의 생물들도 생각하고 세상을 표상하며 그들만의 의미를 만들어낸다고 이야기하면서 재규어에서부터 개미핥기, 대벌레와 솔개, 선인장과 고무나무에 이르기까지 숲속 생물들의 흥미진진한 삶과 생존 전략이 인간들의 역사와 얽히고설키는 풍경을 색다른 시각으로 풀어낸다.",3019,BOOK
"무직전생 14 - 이세계에 갔으면 최선을 다한다, Premium Extreme Novel","리후진 나 마고노테 (지은이), 시로타카 (그림), 한신남 (옮긴이)",51070,국내도서>소설/시/희곡>라이트 노벨>익스트림(Extreme) 노벨,9791162873663,"오랫동안 남아 있던 사라에 대한 감정을 정리한 루데우스. 그런 루데우스와 친구들은 갑룡왕 페르기우스가 사는 공중성채를 방문하게 된다. 성내에서 새로운 지식을 습득하거나 신기한 경험을 하는 등 귀중한 시간을 보내는 매일. 한편, 그냥 감기인 줄만 알았던 나나호시의 상태가 갑자기 악화된다!","일본 현지 누계부수 100만부 돌파!! ‘소설가가 되자’ 사이트 부동의 종합 랭킹 1위 작품!! 인신편 시작!! 낯선 노인에게서 내 모습이 보인다...? 그 노인이 전한 인신의 정체는? 

오랫동안 남아 있던 사라에 대한 감정을 정리한 루데우스. 그런 루데우스와 친구들은 갑룡왕 페르기우스가 사는 공중성채를 방문하게 된다. 성내에서 새로운 지식을 습득하거나 신기한 경험을 하는 등 귀중한 시간을 보내는 매일. 한편, 그냥 감기인 줄만 알았던 나나호시의 상태가 갑자기 악화된다! 
“저를 마대륙으로 보내 주실 수 있겠습니까?”
나나호시를 치료할 방법을 찾기 위해 행동하기 시작하는 루데우스 일행.",2616,BOOK
정해진 미래 시장의 기회 - 인구변동에서 기회를 발굴하는 미래예측법,조영태 (지은이),3058,국내도서>경제경영>경제학/경제일반>경제사/경제전망>한국 경제사/경제전망,9791187289340,"전작 &lt;정해진 미래&gt;로 인구학적 관점을 알기 쉽게 소개한 바 있는 조영태 교수는, 이번 책에서 인구학적 전망을 토대로 어떻게 시장의 기회를 찾아낼 수 있는지 설명한다. 전문가가 아니더라도 쉽고도 입체적으로 소비시장의 변화를 조망할 수 있는 방법을 소개한다.","인구변동의 정해진 미래 속에서 기업은 어떤 전략을 세워야 할까?

《정해진 미래》를 통해 인구학적 관점을 알기 쉽게 소개한 바 있는 서울대학교 조영태 교수가 인구학적 전망을 토대로 어떻게 시장의 기회를 찾아낼 수 있는지 설명하는 『정해진 미래, 시장의 기회』. 미래에는 기존에 존재하지 않았던 새로운 인구집단이 생겨나고, 이들은 새로운 시장을 만들 것이다. 이처럼 급격한 인구변동의 소용돌이 속에서 기회를 잡으려면 저자가 제시하는 인구학적 관점을 알아야 한다. 

이 책은 전문가가 아니더라도 쉽고도 입체적으로 소비시장의 변화를 조망할 수 있는 방법을 소개하고, 우리나라 소비시장의 미래에 특히 큰 영향을 미칠 인구변동의 8가지 포인트를 제시한다. 이와 더불어 각 산업별로 주목해야 할 인구현상을 분석하고 전망과 기회에 대해 소개한다. 이를 통해 개인 사업이든, 기업이든 남들보다 기회를 먼저 포착해 인구변동에서 새로운 시장이 찾아낼 수 있도록 돕는다.",1712,BOOK
해커스 토플 스피킹 인터미디엇 (Hackers TOEFL Speaking Intermediate) (3rd iBT Edition) - 중급 학습자를 위한 토플 스피킹 학습서,David Cho (지은이),49871,국내도서>외국어>토플>Speaking,9788965421870,중급 학습자를 위한 토플 스피킹 학습서. 최근 증가하고 있는 '3가지 중 선택하기 유형 및 생물학/심리학 주제 문제' 를 풍부하게 수록하는 등 iBT 토플 스피킹 최신 경향을 철저히 반영하였다.,,1904,BOOK
"2018 EBS 우정사업본부 9급 계리직 공무원 기출문제집 - 2018년 학습자료 완벽 반영, 동영상 강의, 2016~2008년 기출문제, 최종모의고사, 상용한자 수록",JH공무원시험연구소 (엮은이),123344,국내도서>수험서/자격증>공무원 수험서>기능직>계리직,9788961295949,우정사업본부에서 시행하는 9급 우정서기보(계리직) 공무원을 위한 수험서이다. 2008년부터 2016년까지 8년간 5번에 걸쳐 시행된 계리직 기출문제를 모두 수록하고 해설을 달았다. 또한 법령 개정 및 금융상품 변경으로 의미가 없어진 문제들은 교체 혹은 수정하여 수록하였다.,,500,BOOK
35세 인서울 청약의 법칙 - 청약.분양권 전문가가 알려주는 아파트 청약 당첨 전략,박지민 (지은이),175,국내도서>경제경영>재테크/투자>부동산/경매,9791155428498,"분양 아파트를 노리는 사람이라면 알아야 할 실전 청약 노하우부터 유망지역 핀셋 분석까지, 청약에 관한 모든 것을 다룬 책. 청약은 전략이다. 더 알아보고 더 분석해서 면밀한 전략을 짠 만큼 당첨확률은 크게 솟구친다. 가점이 낮아 시도할 엄두조차 안 난다는 젊은 실수요자들 역시 마찬가지다. 포기할 부분은 포기하고, 강점인 부분은 집중공략해서 치밀하게 계획하면 누구라도 이길 수 있다.","‘부러진 사다리를 뛰어넘는 내 집 마련 최상의 전략’
필수 청약 노하우부터 유망지역 핀셋 분석까지!

서울 주변에서 벗어날 수 없는 실수요자 위한
필수 청약 정보만 꾹꾹 눌러 담았다!

· 새 부동산 정책, 실수요자에게 온 절호의 기회
· 청약 경쟁률 속 숨은 비밀을 파헤쳐라
· 당첨 커트라인을 미리 예상하는 방법은?
· 타워형과 판상형의 선호도 차이를 이용하라
· 개포 디에이치자이, 최저가점 커트라인으로 당첨된 비법
· 바뀐 특별공급 자격기준, 나에게 해당될까?
· 이미 오른 지역, 오르고 있는 지역, 앞으로 오를 지역
· 기대수익률 제대로 분석하면 인기지역만 몰빵할 이유가 없다!
· 2018년 기대할 만한 청약 예정지는?
· 비강남 알짜 분양권만 골라내도 수익률 대폭발!
· 적정 프리미엄(기대이익) 산출해내는 공식 공개
· 수도권 비조정지역에 숨어 있는 알짜 아파트 2순위 공략하기",1033,BOOK
담벼락 헌책방,물빛항해 (지은이),51125,국내도서>소설/시/희곡>로맨스소설>한국 로맨스소설,9791129477385,"물빛항해 장편소설. 할아버지의 갑작스러운 여행으로 헌책방을 맡게 된 오담희. 그날 밤 인기척도 없이 나타난 책방 단골, 현채운과 만난다. 세상과 동떨어진 듯 무심한 눈빛의 남자와.","할아버지의 갑작스러운 여행으로 헌책방을 맡게 된 오담희.
그날 밤 인기척도 없이 나타난 책방 단골, 현채운과 만난다.
세상과 동떨어진 듯 무심한 눈빛의 남자와.

""그저 간식거리들입니다. 아무리 생각해도 다른 핑곗거리가 없어서.""
""무슨 핑곗거리요?""
""책방에 책 대신 담희 씨를 보러 올 핑곗거리.""

하지만 이상하게 그와 자주 마주치면서 알게 됐다.
그가 사실 재미있고, 그녀를 따뜻한 눈으로 볼 수 있는 사람이라는 것을.
그에게…… 뭔가 비밀이 있다는 것을.

""나랑 정식으로 만나요. 사귀자고요. 나랑.""
""나…… 좋아해요?""
""담희 씨 웃는거 보면 같이 웃고 싶어집니다.
담희 씨랑 이야기하다 보면 내가 가진 문제 같은 거, 다 무시하고 싶어집니다.
담희 씨랑 같이 있으면 그냥…… 즐겁고, 좋습니다.""

비밀은 답답하고, 오래오래 행복하지 못한 결말은 싫었다.
그러니 알아야겠다.
세상에 의미 없는 우연은 없으니까.",444,BOOK
2018 이기적in 컴퓨터활용능력 2급 실기 기본서,"영진정보연구소, 박윤정 (지은이)",7007,국내도서>컴퓨터/모바일>활용능력>컴퓨터활용능력>컴퓨터활용능력 실기,9788931455694,컴퓨터활용능력 2급 실기 응시자들에게 적합하도록 시험에 나오는 이론만을 수록하여 짧은 시간에 자격증 대비가 가능하도록 했다. 어려워지고 있는 기출 경향을 적극 반영하고 있다.,,547,BOOK
남자에겐 보이지 않아 - 함께하고 싶지만 어쩐지 불편한 심리 탐구,박선화 (지은이),51514,국내도서>인문학>심리학/정신분석학>교양 심리학,9791157061228,"차이를 넘어 여자와 남자 서로 간에 이해의 실마리를 제공하는 책이다. 일터에서, 학교에서, 가정에서 남자와 여자는 같은 공간, 두 가지 시선으로 살아가고 있다. 대개는 함께하고 싶지만, 어쩐지 불편한 관계라는 게 딱 알맞은 표현이다.","차별과 차단의 ‘펜스 룰’ 넘어 
‘공존의 룰’ 찾는 첫 시도!

『남자에겐 보이지 않아』는 차이를 넘어 여자와 남자 서로 간에 이해의 실마리를 제공하는 책이다. 일터에서, 학교에서, 가정에서 남자와 여자는 같은 공간, 두 가지 시선으로 살아가고 있다. 대개는 함께하고 싶지만, 어쩐지 불편한 관계라는 게 딱 알맞은 표현이다. 일부 남자들은 아예 여성 동료와 얽히지 않겠다며 ‘펜스 룰’을 꺼내기도 한다. 

저자 박선화는 모든 갈등 뒤에 숨어 있는 편견과 무의식에 주목해왔다.  
“나는 오랫동안 다양한 편견과 그것을 깨기 위한 소통에 관심을 가져왔다. 그리고 그 소통의 하나로 이 책에서 남자와 여자의 이야기를 먼저 꺼내어 들여다보려고 한다. … 이 책의 목적은 여성들이 겪는 육체적ㆍ심리적 고통을 사례로 다루며 실상을 알리려는 것은 아니다. 그보다는 사회 속에서 남자가 여자를 보는 편협한 인식과 여자들 스스로 내면화되어버린 일상의 무의식적 습관을 짚어보려는 데 있다.”

우리가 늘 겪는 문제부터 영화와 역사까지, 『남자에겐 보이지 않아』는 저자의 경험과 인간에 대한 애정 그리고 심리학 연구가 어우러졌다. 유명인들의 페이스북 스타인 저자의 장점은, 어떤 갈등 사안도 선명하게 초점을 맞춰준다는 것이다. 사회학자 노명우와 정신과 전문의 정혜신이 극찬하고, 뇌과학자 송민령과  LG CNS 김흥식 인사총괄전무도 적극 추천하는 책이다.",424,BOOK
"2018 전효진 헌법 전범위 모의고사 - 공무원 7급, 법원.국회직, 5급 공채, 입시.변호사",전효진 (지은이),34617,국내도서>수험서/자격증>공무원 수험서>7/9급 공무원>법학>헌법,9791161316604,실전보다 더 실전 같은 모의고사 문제집이다. 공무원 시험뿐만 아니라 헌법 과목이 포함되는 모든 시험을 철저히 분석하여 출제 트렌드를 파악하고 최신 판례와 최신 개정법령의 중요 내용을 반영하여 모의고사 문항을 출제하였다.,,467,BOOK
페이트 / 그랜드 오더 코믹 아라카르트 4 - 노엔 코믹스,"콤프에이스 편집부 (지은이), 타입 문 (원작), 김민준 (옮긴이)",4133,국내도서>만화>본격장르만화>판타지>액션 판타지,9791131982525,"대인기 스마트폰 게임, Fate/Grand Order의 공식 앤솔로지! 선배와 더 친해지기 위해 노력하는 마슈의 이야기를 그린 '메이브와 마슈의 인연 레슨' 어벤저 전대의 이야기를 그린 'EX전대 고룰러벤저' 칼데아 서번트들의 짝을 찾아보는 '제1회 칼데아 서번트 미팅'.","대인기 스마트폰 게임, 국내 절찬 서비스중!!
공식 앤솔로지
개막! 게임 참가 크리에이터의 작품도 기고!

대인기 스마트폰 게임, Fate/Grand Order의 공식 앤솔로지!
선배와 더 친해지기 위해 노력하는 마슈의 이야기를 그린 ‘메이브와 마슈의 인연 레슨’
어벤저 전대의 이야기를 그린 ‘EX전대 고룰러벤저’
칼데아 서번트들의 짝을 찾아보는 ‘제1회 칼데아 서번트 미팅’
다양한 왕도적 이야기가 가득한 공식 앤솔로지 제 4 탄!!",543,BOOK
W31 : 성경대로 세상살기,하형록 (지은이),51596,국내도서>종교/역학>기독교(개신교)>기독교(개신교) 신앙생활>간증/영적성장,9788953131644,"베스트셀러 &lt;P31&gt;로 성경대로 비즈니스할 수 있다고 크리스천 비즈니스맨들에게 도전장을 내밀었던 하형록 회장이, 이번에는 성경대로 세상을 살 수 있다고 도전한다. 하형록 회장은 심장이식을 기다리면서 성경 말씀을 많이 읽었고, 특히 잠언을 수없이 읽으면서, 그 말씀을 먹고 자신화했다.","이제 성경대로 살 수 없다 말하지 마라
31가지 성경의 지혜로 당당히 세상을 이기라
그 어떤 것을 희생하고서라도 지혜를 얻어라
지혜가 바로 예수님이시다

성경대로 세상살기가 가능한가? 
가능하다!! 
성령으로 충만하다면! 
예수님을 진정으로 믿는다면! 
성경말씀의 능력을 확실히 경험했다면! 
베스트셀러 《P31》로 성경대로 비즈니스할 수 있다고 크리스천 비즈니스맨들에게 도전장을 내밀었던 하형록 회장이, 이번에는 성경대로 세상을 살 수 있다고 도전한다. 
하형록 회장은 심장이식을 기다리면서 성경 말씀을 많이 읽었고, 특히 잠언을 수없이 읽으면서, 그 말씀을 먹고 자신화했다. 이 책은 그때부터 깨달은 잠언의 지혜를 바탕으로, 지혜이신 예수님을 어떤 값을 치르더라도 나의 것으로 살 때, 예수님으로 세상을 이길 수 있음을 말하고 있다. 하형록 회장은 예수님을 얻은 후, 어떻게 성경대로 다르게 보고, 다르게 생각하고, 다르게 행동할 수 있는지 배웠다. 그 지혜를 이 책에서 나누고자 한다. 크리스천이지만 주변의 불신자들에게 크리스천이라고 밝히지도 못하고 주눅들어 있지는 않았는가, 말씀의 능력을 한 번도 경험하지 못하고 불신자처럼 살고 있지는 않은가, 예수 믿는다는 것의 당당함을 맛보지 못했는가? 이 책을 통해 지혜를 얻어라. 지혜자이신 예수님을 만나라. 당당히 세상 앞에 빛과 소금으로 드러나라.",1378,BOOK
조그맣게 살 거야 - 군더더기를 빼고 본질에 집중하는 삶,진민영 (지은이),51371,국내도서>에세이>한국에세이,9791186274330,외형적 단순함을 넘어 내면까지 비우는 삶을 사는 미니멀리스트의 미니멀 라이프 예찬론. 저자는 3년 간의 다운사이징 경험을 통해 진정한 미니멀리즘이란 외형을 넘어 행복의 본질에 다가가는 강력한 생활의 도구임을 발견한다.,"흔히 사람들은 감각적이고 티 없이 완벽한 인테리어 사진으로 미니멀 라이프를 소개하지만 『조그맣게 살 거야』에는 사진 한 장 없다. 색감이 다소 촌스럽고 통일감이 없어도 꼭 필요한 세간살이를 가진 사람이라면 그는 명백한 미니멀리스트이다. 자신에게 가치로운 것이라면 그 소유물의 양을 두고 판단하지도 않는다. 뿐만 아니라 공간적인 영역에 국한하지 않고 시간, 관계, 일, 정보, 돈, 에너지, 디지털 디톡스에 이르기까지 ‘나 자신’과 연관된 모든 영역으로 확장하여 군더더기를 빼고, 본질에 집중하는 것이 진정한 미니멀 라이프라고 전한다.",1226,BOOK
편머리 문법 심화편 - 편입의 첫머리를 여는 책,김영편입 컨텐츠평가연구소 (엮은이),34896,국내도서>수험서/자격증>편입/검정고시/독학사>대학편입,9788965120360,"기본편에서 개념과 문제유형을 익히는 데 초점을 맞췄다면, 심화편에서는 그것들을 실전형 문제에 적용하는 훈련이 강도 높게 진행된다. 문제는 다양한 유형을 랜덤하게 섞어 실전에 가까운 형식으로 구성했다.",,770,BOOK
"안녕, 나는 서울이야 - 어린이 서울 가이드북",이나영 (지은이),89740,국내도서>어린이>사회/역사/철학>사회 일반,9791188408023,"서울의 역사와 문화, 음식의 유래 등을 서울이 직접 설명해주는 어린이 가이드북이다. 놓치기 쉬운 서울의 자연과 서울의 사계절까지… 우리가 알지 못했던 서울의 다른 면들을 아기자기한 그림과 쉬운 설명으로 만나볼 수 있다.","우리가 흔히 알던 그런 서울, 
우리가 알지 못했던 그런 서울. 
서울의 역사, 서울의 자연, 서울의 먹거리까지!

오랫동안 우리나라의 중심이었던 수도 서울. 그만큼 수많은 역사가 살아 숨 쉬는 곳이지만 아이들 눈높이에 맞춰 설명하기는 참 어렵습니다. 오랜 역사를 자랑하는 5대 궁궐은 물론 청와대, 국회의사당, 한국은행 등 주요 기관들이 모여있어 역사, 사회, 문화의 중심지이지요. 산으로 둘러싸여 있어 다양한 숲과 계곡도 많은 서울. 「안녕 나는 서울이야」 에서는 서울의 역사, 서울의 자연, 서울의 먹거리까지 모두 서울이 친절하게 안내해줍니다.",970,BOOK
신의 물방울 최종장 마리아주 2,"아기 타다시 (지은이), 오키모토 슈 (그림)",3313,국내도서>만화>본격장르만화>프로의 세계,9791125692775,와인 만화의 결정판 &lt;신의 물방울&gt; 최종장 드디어 개막! 전 44권으로 완결된 &lt;신의 물방울&gt;에 이어 이번에는 와인뿐만 아니라 와인과 찰떡같이 어울리는 음식을 '마리아주'하는 것에 도전한다.,"점점 확대되는 와인의 세계로 다시 한 번 빠져보는 기회. 
스피오프작〈괴도 르 뱅〉(전2권)과 동시 발행 

와인 만화의 결정판 「신의 물방울」최종장 드디어 개막!! 전 44권으로 완결된 ‘신의 물방울’에 이어 이번에는 와인뿐만 아니라 와인과 찰떡같이 어울리는 음식을 ‘마리아주’하는 것에 도전한다! 향과 맛, 눈으로 보는 모양까지 모두 완벽하게 어울린다는 음식과 와인의 ‘마리아주’. ‘신의 물방울’ 시간대로부터 1년이 지난 후 , 주인공 시즈쿠가 내놓은 수행의 결과는? 또 지난 시즌에서 밝혀지지 않았던 환상의 와인 ‘신의 물방울’은!? 

오랜 세월에 걸친 여행이 드디어 종막을 향한다…. 세계적 와인 평론가 칸자키 유타카가 남긴 한 마디가 ‘천상의 와인, 신의 물방울’에 도달하는 이정표가 된다! 와인 수행을 거듭하여 성장한 시즈쿠가 요리와 와인의 ‘마리아주’에 도전. 그리고 ‘신의 물방울’을 둘러싼 잇세와의 최종결전 또한 시작된다! 눈을 뗄 수 없는 와인 만화의 결정판을 만나다-.",357,BOOK
기사단장 죽이기 2 - 전이하는 메타포,"무라카미 하루키 (지은이), 홍은주 (옮긴이)",50998,국내도서>소설/시/희곡>일본소설>1950년대 이후 일본소설,9788954646130,"모차르트 오페라 <돈 조반니>의 등장인물을 일본 아스카 시대로 옮겨놓은 듯한 그 그림을 가지고 내려온 뒤로, ‘나’의 주위에서 기이한 일들이 잇달아 일어난다. 『태엽 감는 새』 『1Q84』 등 기존의 본격 장편소설 세계관을 잇는, 현실과 비현실이 절묘하게 융합된 하루키 월드의 결정판이다.","밤의 어둠 속에서 들려오는 방울소리, 그 어둠 속에서 모습을 드러낸 기사단장!

무라카미 하루키가 7년 만에 선보인 본격 장편소설 『기사단장 죽이기』제2권. ‘이것이 하루키다!’라고 말할 수 있는 요소가 전부 담겨 있다는 평을 들으며 일본 출간 당시 130만 부 제작 발행으로 화제가 되었던 작품이다. 저자가 지금까지 구축해온 작품세계를 다양하게 변주하며 현세대 독자에게 던지는 메시지이자 한 사람의 예술가로서 내면 깊은 곳까지 내려가 농축한 결과물이다. 

저자가 작가생활 초기에 주로 썼던 일인칭 시점으로 돌아와 그 매력이 한층 짙게 느껴지는 이 소설은 현실과 비현실이 절묘하게 융합된 하루키 월드의 결정판으로도 볼 수 있다. 오페라, 클래식, 재즈, 올드 팝까지 여러 장르의 음악을 적재적소에 배치해 인물의 심상을 대변하고, 인물간의 관계는 저자가 가장 좋아하는 영문학 작품으로 꼽았으며 직접 번역까지 한 스콧 피츠제럴드의 《위대한 개츠비》의 오마주로도 읽히고, 저자가 오랫동안 이 이야기를 모티프로 한 소설을 쓰고 싶었다고 밝혔던 작품인 에도시대 작가 우에다 아키나리가 쓴 괴이담 《하루사메 이야기》가 직접 인용되는 등 저자의 문학세계 속 독자적인 요소들이 집대성되어 있는 소설이다. 

아내의 갑작스러운 이혼 통보 후 집을 나오게 된 삼십대 중반의 초상화가 ‘나’. 친구 아마다 마사히코의 도움으로 그의 아버지이자 저명한 일본화가 아마다 도모히코가 살던 산속 아틀리에에서 지내게 된다. 어느 날 ‘나’는 아틀리에 천장 위에서 아마다 도모히코의 어느 화집에도 수록되지 않았던 그의 미발표작 ‘기사단장 죽이기’를 발견하게 된다. 모차르트 오페라 《돈 조반니》의 등장인물을 일본 아스카 시대로 옮겨놓은 듯한 그 한 폭의 그림은 ‘나’를 둘러싼 주위 상황을 완전히 뒤바꿔놓는다.

골짜기 맞은편 호화로운 저택에 사는 백발의 신사 멘시키 와타루가 거액을 제시하며 초상화를 의뢰하고, 한밤중에 들리는 정체 모를 소리를 따라 집 뒤편의 사당으로 가보니 돌무덤 아래에서 방울소리가 들려온다. 멘시키의 도움으로 돌무덤을 파헤쳐보니 누군가가 의도적으로 지어놓은 듯한 원형의 석실이 드러나고, 얼마 후 ‘나’의 앞에 아마다 도모히코의 그림 속 기사단장과 똑같은 모습을 한 ‘기사단장’이 나타나는데…….",25718,BOOK
