title,author,genre_id,genre,ISBN,description_aladin,description_naver,salesPoint,mallType
2018 제8회 문지문학상 수상작품집,"백수린, 김효나, 임솔아, 김금희, 박민정, 허희정, 박상영, 오한기, 이주란, 손보미, 정영수 (지은이)",50993,국내도서>소설/시/희곡>한국소설>2000년대 이후 한국소설,9788932031088,문학과지성사가 2010년부터 제정.운영해오고 있는 '문지문학상(구 웹진문지문학상)'이 2018년 올해로 8회를 맞이했다. &lt;제8회 문지문학상 수상작품집&gt;에는 수상작 백수린의 '여름의 빌라'를 포함해 총 열한 명의 소설이 실렸다.,"새로운 계절을 여는 한국 문학의 현재
기존의 경계를 흩뜨리는 젊은 작가의 소설 열한 편! 

문학과지성사가 2010년부터 제정 ? 운영해오고 있는 ‘문지문학상(구 웹진문지문학상)’이 올해로 8회를 맞이했다. 『제8회 문지문학상 수상작품집』(문학과지성사, 2018)에는 수상작 백수린의 「여름의 빌라」를 포함해 총 열한 명(김효나, 임솔아, 김금희, 박민정, 허희정, 박상영, 오한기, 이주란, 손보미, 정영수)의 소설이 실렸다. 

[이 달의 소설]이란 이름 아래 매달 작품을 선정하였던 기존의 방식을 개편하여, 2017년부터는 계절마다 한 차례 [이 계절의 소설]을 선정, 홈페이지에 그 결과를 공개하고 이를 문지문학상의 후보작으로 하였다. 문지문학상 수상 작가에게는 1천만 원의 상금이 주어지며, 시상식은 12월 초에 있을 예정이다.",702,BOOK
나를 더 사랑해야 한다 당신을 덜 사랑해야 한다,손현녕 (지은이),51371,국내도서>에세이>한국에세이,9791188545209,&lt;순간의 나와 영원의 당신&gt;의 작가 손현녕의 두 번째 책. 사람들에게 상처받은 날들의 이야기를 모아 한 권의 책으로 묶었다. 관계에서 방향을 잃고 사람에 대한 환멸로 허우적거릴 때마다 작가는 쓰고 또 썼다. 그런 작가의 이야기는 2만 명이 넘는 이들의 마음에 가 닿았다.,"타인의 시선에서 자유로울 나를 위하여

『순간의 나와 영원의 당신』의 작가 손현녕의 두 번째 책. 사람들에게 상처받은 날들의 이야기를 모아 한 권의 책으로 묶었다. 관계에서 방향을 잃고 사람에 대한 환멸로 허우적거릴 때마다 작가는 쓰고 또 썼다. 그런 작가의 이야기는 2만 명이 넘는 이들의 마음에 가 닿았다. 작가와 같은 고민으로 힘들어하는 사람들부터 작가를 응원하는 사람들, 작가의 글에 작은 위로를 받은 사람들까지. 사람 때문에 힘든 이들은, 관계에 의연해지고 담대해지기 위해 노력하는 작가의 모습을 보면서 작은 용기를 얻는다. 나를 탓하지 말자고, 나를 더 아끼자고, 나를 더 사랑하자고 되뇌이면서.",685,BOOK
좀비고등학교 코믹스 6,"배아이 (지은이), 라임스튜디오 (그림)",49995,국내도서>어린이>TV/만화/영화>만화 일반,9791188380206,"자신을 제로라 소개하는 전학생. 현지는 어쩔 수 없이 길안내를 위해 학교로 돌아가고 그사이 나래의 간호로 눈을 뜨게 된 동석은 기억을 잃은 채로 사라진다. 한편, 가람과 준형은 별관 안 창고에서 원단을 꺼내 나르던 도중, 또 다른 소문을 듣게 되어 조사에 들어가는데….","800만 다운로드를 돌파한, 청소년이 사랑하는 게임 ‘좀비고등학교’가 코믹스로 탄생!

좀비고등학교 게임 마니아 한가람을 중심으로 사건사고가 벌어지는 『좀비고등학교 코믹스』. 추리작가가 되는 것이 꿈인 평범한 초등학생이었으나 우연히 게임 속의 모습과 비슷한 학교를 발견하면서 예기치 않은 상황 속에 빠지게 된 한가람. 거기에 누구에게나 친절해 인기가 많은 모범생 소녀 이유리, 과묵해보이지만 사실은 말하는 것조차 귀찮을 만큼 게으른 성격을 가진 같은 반 친구 김준호, 혼란에 빠진 가람을 도와주는 남동진, 사랑스러운 모습의 반전으로 뛰어난 운동신경을 가진 정예슬 등 개성만점 캐릭터들이 모두 모여 보는 재미를 더해준다. 

자신을 제로라 소개하는 전학생. 현지는 어쩔 수 없이 길안내를 위해 학교로 돌아가고 그사이 나래의 간호로 눈을 뜨게 된 동석은 기억을 잃은 채로 사라진다. 한편, 패션 동아리부에 들어간 가람과 준형은 별관 안 창고에서 원단을 꺼내 나르던 도중, 또 다른 소문을 듣게 되어 조사에 들어가는데….",7209,BOOK
"설민석의 한국사 대모험 2 - 설쌤의 라이벌, 황대감의 등장!","설민석, 스토리박스 (지은이), 정현희 (그림), 태건 역사 연구소 (감수)",48904,국내도서>어린이>초등 한국사,9791196025809,"국민 역사 강사 설민석의 첫 한국사 학습만화 시리즈로, 한국사 지식을 기본적으로 다루고 있다. 2권에서는 삼국 통일과 몽골의 침입, 조선 건국, 3.1 운동, 독도 등 굵직한 한국사 사건을 공부하고, 어린이들이 한국사 지식과 함께 키워야할 덕목에 대해서 이야기한다.","우리 아이의 ‘지’와 ‘덕’을 책임질 첫 역사책!

어느 날 설쌤 앞에 라이벌 황대감이 나타납니다. 공주의 신랑감이 정해졌다는 소식에 신랑감을 보러왔다고 하지만, 사실 단점을 찾아내어 왕에게 아뢰고, 자신이 밀고 있는 후보 공길을 평강의 신랑으로 만들려는 속셈이죠. 황대감의 갑작스런 테스트에 온달은 간신히 위기를 넘기지만, 설쌤과 평강은 온달이 역사에 무지한 사실이 들킬까 조마조마합니다. 이에 설쌤과 평강은 온달을 역사 천재로 만들고, 듬직한 신랑감이 될 수 있도록 또 다시 시간여행을 떠나는데….

『설민석의 한국사 대모험』은 설민석 선생님과 태건 역사 연구소가 철저하게 고증하여 정확한 역사 지식을 어린이들에게 쉽고, 재미있게 알려주는 책입니다. 어린이들이 일상에서 고민할 수 있는 문제들을 역사 속 인물을 통해 같이 생각하고 해결해보세요. 삼국 통일의 밑거름이 된 화랑, 3.1 운동의 실제 주인공인 학생들, 세계 최강 몽고와 맞서 싸운 일반 백성들 등 한국사의 굵직한 사건들을 만나게 됩니다.",16960,BOOK
"설민석의 한국사 대모험 3 - 온달, 왕의 시험에 대비하라!","설민석, 스토리박스 (지은이), 정현희 (그림), 태건 역사 연구소 (감수)",48904,국내도서>어린이>초등 한국사,9791196025847,"국민 역사 강사 설민석의 첫 한국사 학습만화 시리즈로, 3권 ‘문화유산 편’에서는 선조들이 남긴 훌륭한 문화유산에 대한 이야기를 하고 있다. 아울러 문화유산을 대하는 우리의 태도에 대해서도 설쌤과 온달, 평강의 여행을 통해서 어린이들이 배울 수 있다.","우리 아이의 ‘지’와 ‘덕’을 책임질 첫 역사책!

황 대감은 온달의 생활통지표를 평강의 아버지인 왕에게 전달합니다. 온달의 생활통지표를 본 왕은 온달의 부마로서의 자질을 의심하고, 온달을 만나보기로 하죠. 어명을 전달 받은 설쌤과 평강은 온달을 테스트에 통과시키기 위해서 족집게 역사 여행을 시작하는데…. 과연 온달은 무사히 왕과의 만남을 마치고 평강의 신랑감으로 인정받을 수 있을까요?

『설민석의 한국사 대모험』은 설민석 선생님과 태건 역사 연구소가 철저하게 고증하여 정확한 역사 지식을 어린이들에게 쉽고, 재미있게 알려주는 책입니다. 어린이들이 일상에서 고민할 수 있는 문제들을 역사 속 인물을 통해 같이 생각하고 해결해보세요. 우리가 매일 쓰고 있는 한글을 만든 세종대왕, 수원화성에 담긴 정조의 마음, 조선왕조실록의 의미 등 한국의 문화유산에 대해 만나게 됩니다.",14296,BOOK
2018 선재국어 기출실록 - 전3권,이선재 (지은이),34613,국내도서>수험서/자격증>공무원 수험서>7/9급 공무원>국어>기출/문제집/모의고사,9791161313429,"수험생 편의를 위해 문제와 해설로 분권화하여 약점 체크용, 이론 정리 회독용으로 활용할 수 있는 기출문제집이다. ‘주관식 내용 정리-기본 문제-심화 문제’의 3단계 구성을 통해 수험생들이 실전에 전략적으로 대비할 수 있게 하고, 단원별 분류 후 다시 주제별로 분류하여 보다 쉽게 유사 유형을 파악할 수 있게 하였다.",,6916,BOOK
타이탄의 도구들 - 1만 시간의 법칙을 깬 거인들의 61가지 전략,"팀 페리스 (지은이), 박선령, 정지현 (옮긴이)",70216,국내도서>자기계발>성공>성공학,9791158510619,"2017년 아마존 종합 베스트셀러 1위. 세계적인 석학, 작가, 혁신기업을 세운 창업가와 CEO, 크리에이티브 디렉터, 협상가, 슈퍼리치, 아티스트, 전문직 종사자까지 자기 분야에서 정상에 오른 사람들의 독창적인 성공 노하우가 낱낱이 담겨 있다.","세계 최정상에 오른 ‘타이탄’이 밝힌 놀라운 생각, 기적의 습관, 압도적인 성공의 비밀!

프린스턴 대학교에서 ‘기업가정신’을 강의하는 팀 페리스는 글로벌 CEO, 석학, 언론들에게서 ‘이 시대 가장 혁신적인 아이콘’으로 평가받고 있다. 그는 18세 이후 자신의 모든 것을 기록으로 남겨왔을 정도로 강박적인 노트 수집가다. 이 책 『타이탄의 도구들』은 그런 그가 모은 노트들 가운데 가장 빛나는 보물이라고 자신하는 책이다. 

이 노트를 남기기 위해 저자는 지난 몇 년간 ‘세상에서 가장 지혜롭고, 가장 부유하고, 가장 건강한 사람’이라고 평가받는 인물들을 만났다. 그리고 이 책에 그들과 벌였던 열띤 토론, 그들이 더 큰 결과를 얻기 위해 매일 실천하고 있는 것들에 대한 저자의 성공적인 벤치마킹 경험, 그들의 놀라운 아이디어와 전략, 창의적인 습관, 세계 최고 수준의 성과 창출법 등을 두루 담아낼 수 있었다. 저자는 자신의 분야에서 최정상에 오른 그들을 거인이라는 뜻의 ‘타이탄’이라 부르기로 했다. 

책에는 알랭 드 보통, 세스 고딘, 말콤 글래드웰, 파울로 코엘료, 피터 틸, 에드 캣멀 등 세계적인 석학과 작가부터 최고의 혁신기업을 세운 창업가와 CEO, 크리에이티브 디렉터, 협상가, 슈퍼리치, 아티스트, 전문직 종사자까지 자기 분야에서 정상에 오른 사람들의 독창적인 성공 노하우가 낱낱이 담겨 있다. 이 책에 담긴 그들의 압도적인 성공은 우리가 어떤 목표에 어떤 방법으로 접근해야 할지에 대한 가장 지혜로운 길라잡이가 되어줄 것이다.",11109,BOOK
푸른 사자 와니니,"이현 (지은이), 오윤화 (그림)",48874,국내도서>어린이>동화/명작/고전>국내창작동화,9788936442804,"창비아동문고 시리즈 280권. &lt;짜장면 불어요!&gt;, &lt;로봇의 별&gt;의 작가 이현의 장편동화. 쓸모없다는 이유로 무리에서 쫓겨난 사자 와니니가 초원을 떠돌며 겪는 일들을 그린 동화로, 아프리카의 광활한 초원에서 펼쳐지는 모험을 사실적이고 감동적으로 담아냈다.","서로 다른 모습 그대로, 초원을 달린다!

《짜장면 불어요!》《장수 만세!》《로봇의 별》과 같은 새로운 이야기로 한국 아동문학의 외연을 넓혀 온 작가 이현의 신작 장편동화 『푸른 사자 와니니』. 쓸모없다는 이유로 무리에서 쫓겨난 사자 와니니가 초원을 떠돌며 겪는 일들을 그린 동화로, 아프리카의 광활한 초원에서 펼쳐지는 모험을 사실적이고 감동적으로 담아냈다. 사자뿐만 아니라 혹멧돼지, 하이에나, 누, 버펄로, 개코원숭이, 하마 등 저마다의 방식으로 살아가는 여러 동물이 등장한다. 작가는 다양한 동물들의 삶을 생생하게 보여 주면서, 그들이 어우러져서 살아가는 세렝게티 초원의 조화로운 모습까지 담아낸다. 낯선 공간에서 전개되는 흥미진진한 이야기가 독자들에게 새로운 세계에 대한 동경을 심어 줄 것이다.

한 살짜리 어린 사자 와니니는 몸집도 작고 사냥 실력도 뛰어나지 못해 무리에서 쫓겨난다. 떠돌이가 된 와니니는 살아갈 희망을 잃지만, 그동안 자기가 하찮게 여겼던 것들의 도움을 받으며 간신히 살아남는다. 와니니는 풀과 나무를 씹으며 배고픔을 이겨 내고, 얕잡아보던 떠돌이 사자들과 친구가 되는데…….",54521,BOOK
ETS TOEIC Test 공식문제집 RC (문제집 + 해설집 + ETS 빈출어휘 PDF 파일) - 출제기관 미공개 2017 최신 실전문항 독점 공개,ETS (지은이),49854,국내도서>외국어>토익>Reading,9788917228076,"ETS가 최신 신유형 경향을 반영한 실전문제 5세트를 개발, 독점 제공한다. 이 책의 모든 문항은 토익 출제기관인 ETS가 정기시험과 동일한 유형 및 난이도로 개발하여 정기시험과 100% 동일한 문제 퀄리티와 난이도를 자랑한다.","『ETS TOEIC Test 공식문제집 RC』는 출제기관 ETS가 개발한 최신 토익 실전문제로만 구성된 RC 교재이다. ETS가 최신 신유형 경향을 반영한 실전문제 5세트를 개발, 독점 제공했다. 모든 문제에 대해 답이 되는 이유뿐만 아니라 오답 보기까지 분석한 해설을 덧붙이고, ETS의 엄격한 검수 시스템을 통과했다.",6308,BOOK
마법사 똥맨,"송언 (지은이), 김유대 (그림)",48874,국내도서>어린이>동화/명작/고전>국내창작동화,9788936451158,"경쟁과 바쁜 일상에 쫓기는 아이들의 무거운 현실을 '학교에서 똥 누기'라는 가벼운 소재로 풀어낸 저학년동화. 초등학교 교사인 송언 작가가 실제 가르쳤던 개구쟁이 제자 '똥맨'을 주인공으로 쓴 이야기다. ‘학교에서 똥 누기’에 대한 서로 상반된 태도를 보여주는 '똥수'와 '똥맨'을 통해, 아이들을 짓누르는 일상을 바꿀 수 있는 힘은 아이들 스스로의 마음속에 있다는 사실을 일깨운다.","아이들 고민을 시원하게 해결하는 상쾌한 동화

초등 1·2·3학년을 위한 신나는 책읽기 15 〈마법사 똥맨〉. 『마법사 똥맨』은 초등학교 교사로 재직 중인 작가 송언이 실제 가르쳤던 개구쟁이 제자 '똥맨'을 주인공으로 쓴 작품이다. 경쟁과 바쁜 일상에 쫓기는 아이들의 무거운 현실을 '학교에서 똥 누기'라는 가벼운 소재로 풀어냈다. '학교에서 똥 누기'에 대한 서로 상반된 태도를 보여주는 '똥수'와 '똥맨'을 통해, 아이들을 짓누르는 일상을 바꿀 수 있는 힘은 아이들 스스로의 마음속에 있다는 사실을 일깨운다. 

주인공 '나(박동수)'는 2학년 때 학교 화장실에서 똥을 누다가 반 아이들에게 놀림 받고 물벼락을 받는 등 봉변을 당하고, '똥수'라는 끔찍한 별명을 얻게 된다. 그 뒤부터 '똥수'는 학교 화장실에서 절대로 똥을 누지 않는다. 3학년이 되고 얼마 지나지 않은 학기 초. '똥수'는 등굣길에서부터 배 속이 부글거리기 시작한다. 그렇지만 학교에서 똥을 눌 수 없는 '똥수'는 집에도 돌아가지 못하고 교실로 향하는데….",11087,BOOK
오늘은 잘 모르겠어,심보선 (지은이),51167,국내도서>소설/시/희곡>시>한국시,9788932030265,심보선의 세번째 시집. 첫 시집 &lt;슬픔이 없는 십오 초&gt;와 두번째 시집 &lt;눈앞에 없는 사람&gt;으로 대중과 문단의 주목을 한 번에 모아온 시인이 6년 만에 묶은 새 시집이다. 평론가의 해설을 덧붙이는 대신 시인이 선별한 에세이 「당나귀문학론」을 덧붙였다.,"시 언어로 지은 유예의 공간!

사회학자이자 시인인 심보선의 세 번째 시집 『오늘은 잘 모르겠어』. 《슬픔이 없는 십오 초》와 《눈앞에 없는 사람》으로 대중과 문단의 주목을 한 번에 모아온 저자가 6년 만에 묶어낸 시집이다. 평론가의 해설을 덧붙이는 대신 저자가 선별한 에세이 《당나귀문학론》을 덧붙였다. 그동안 갈등이 첨예하게 대립하는 사회 운동의 현장에 자주 모습을 드러내왔던 저자의 모습은 시집 속에도 고스란히 투영되곤 하는데, 구의역에서 스크린도어 정비 중 사망한 소년에 대한 시 《갈색 가방이 있던 역》, 쌍용차 해고 노동자 문제를 다룬 《스물세번째 인간》 등에서 잘 드러나 있다. 

끊이지 않는 삶의 슬픔과 고통, 어둠이 파노라마처럼 이어지는 가운데 저자는 슬픔 사이 찰나의 순간, 눈앞에 없는 것들의 존재를 포착해내고 불행한 현실을 부정하지 않으면서, 동시에 그 안에서 긍정적 결말을 끌어낼 수 있는 언어를 풀어놓는다. 불행이 꼬리를 물고 따라와도 우리가 서로에게 바통을 쥐여주듯 서로에게 가닿을 수 있다면 아주 작은 움직임으로 서로가 서로의 말에 닿을 수 있다면, 우리의 삶이 불행으로만 점철되지는 않을 수 있다는 어떤 가능성은 여전히 존재할 수 있음을, 저자는 자신의 시를 통해 전하고 있다.",4933,BOOK
"나혜석, 글 쓰는 여자의 탄생","나혜석 (지은이), 장영은 (엮은이)",50994,국내도서>소설/시/희곡>한국소설>2000년대 이전 한국소설,9788937436758,"한국 근대 페미니즘 작가 나혜석의 페미니즘 걸작선. 열일곱 편의 소설, 논설, 수필, 대담을 가려 뽑고 현대어로 순화한 이 책은 나혜석의 삶을 나혜석 자신의 글로 읽고자 하는 독자들에게 보다 나은 독서 경험을 제공할 것이다.","전통적인 여성관에 도전하며 불꽃같은 삶을 살다간 나혜석의 글과 삶!

한국 근대 페미니즘 작가 나혜석의 페미니즘 걸작선 『나혜석, 글 쓰는 여자의 탄생』. 이 책은 나혜석의 삶을 나혜석 자신의 글로 읽고자 하는 독자들을 위해 나혜석이 남긴 열일곱 편의 소설, 논설, 수필, 대담을 가려 뽑고 현대어로 순화하여 엮은 것으로, 근대 여성 지식인의 삶과 사상을 연구하고 있는 장영은 성균관대학교 한국학연계전공 초빙교수가 시대상을 생생하게 전하는 해설을 덧붙여 이해를 도왔다. 

모두 5부로 구성된 책의 1부에는 소설을, 나머지 부에는 논설, 수필, 인터뷰, 대담을 수록하였다. 1부에는 나혜석의 가장 대표적 단편 소설인 《경희》와 나혜석의 문학관을 파악하기에 유용한 단편 《어머니와 딸》을 담았다. 2부에는 나혜석이 여성의 연애와 결혼에 대해 쓴 글을, 3부에는 나혜석이 이혼 이후에 발표한 조선의 가부장제를 비판하는 《이혼고백장》과 여성에게만 정조를 강요하는 남성 이기주의를 고발하는 《신생활에 들면서》를 실었다. 

4부에는 나혜석의 페미니즘 육아관을 엿볼 수 있는 기존의 모성 통념에 반하는 글을 모았다. 마지막으로 5부에서는 나혜석의 정치의식을 담은 글과 근대 신여성의 직업관에 대한 글을 만나볼 수 있다. 각 부의 말미에는 나혜석과 함께 이광수, 김기진, 김억 등 네 명의 문인이 1930년대 당시 미혼 남녀들이 결혼을 늦게 하는 풍조를 비평하는 《만혼 타개 좌담회》를 부록으로 담았다.",3865,BOOK
행복의 기원 - 인간의 행복은 어디서 오는가,서은국 (지은이),51514,국내도서>인문학>심리학/정신분석학>교양 심리학,9788950955779,행복은 ‘생존과 번식’을 위한 진화의 산물이다. 행복 분야의 권위자 에드 디너 교수의 지도 아래 심리학 박사 학위를 받은 저자는 세계에서 가장 활발하게 인용되는 행복 심리학자 중 한 명이다.,"뇌 속에 설계된 행복의 진실!

행복을 해부한 과학적 보고서 『행복의 기원』. ‘행복은 모든 사람이 바라는 삶의 최종 목표’라는 것, 다시 말해 ‘인간은 행복하기 위해 산다’는 통념은 지금껏 누구도 의심하지 않았던 확고한 신념이었다. 하지만 세계에서 가장 활발하게 인용되는 행복 심리학자 중 한 명이자, 이 책의 저자인 서은국은 기존의 관점에 맞서며 ‘행복의 진실’에 대해 반기를 든다. 

저자는 ‘모든 것은 생존과 번식의 수단’이라는 다윈의 진화론을 근거로 삼아, 행복 역시 ‘생존과 번식’을 위한 진화의 산물이라고 말한다. 이 책에 따르면, 인간이 먹고 자고 사랑할 때 행복을 느끼는 이유 역시 생존을 위해서이다. 이 관점에서 보면 행복은 삶의 최종 이유도 목적도 아닌 생존을 위한 도구일 뿐인 것인데, 이는 ‘행복 테크닉’에 중독된 우리 사회에 일침을 가한다.",8075,BOOK
하버드 첫 강의 시간관리 수업 - 하버드 청춘들의 꿈을 이루는 시간,"쉬셴장 (지은이), 하정희 (옮긴이)",70221,국내도서>자기계발>시간관리/정보관리>시간관리,9788972773207,"시간의 선택과 집중, 효율적인 일 처리뿐 아니라 인생의 목표와 계획에 이르기까지 하버드 시간관리 프로젝트 연구원들이 하버드 출신들의 사례를 통해 일과 여유로운 삶의 균형을 이루고, 원하는 목표를 실현할 수 있는 비법을 선사한다.","하버드의 가장 큰 경쟁력은 1분이다

애플의 CEO 팀쿡은 새벽 4시면 일어나서 메일을 보내고 헬스장으로 나가 아침 운동을 시작한다. 테슬라 모터스의 CEO이자 미국 혁신의 아이콘인 엘론 머스크는 주 1백 시간 업무를 하면서도 육아에 소홀하지 않는다. 세계 최고의 부자 빌 게이츠는 분 단위로 시간 계획을 세우며 업무에 집중하는 반면 건강한 수면과 좋은 아이디어를 위한 장기간의 휴식을 취하는 데도 시간을 아끼지 않는다. 페이스북 CEO 마크 저커버그는 출퇴근에 허비하는 시간을 아끼기 위해 자신의 집을 회사 근처로 옮기고 일에 집중한다. 

성공한 CEO의 하루는 일종의 시간과의 전쟁이다. 수많은 업무 보고서와 이메일을 처리하고 가장 효과적인 의사 결정을 함과 동시에 가정과의 균형과 미래를 위한 아이디어를 얻기 위해서는 하루 24시간이 모자랄 듯하다. 그러나 그들은 마치 평범한 사람들이 3일을 살 듯 하루 24시간을 활용한다.",1871,BOOK
해커스 토플 라이팅 (Hackers TOEFL Writing) - 기본에서 실전까지 iBT 토플 라이팅 완벽 대비,David Cho (지은이),49870,국내도서>외국어>토플>Writing,9788965420873,"기본에서 실전까지 완벽 대비 가능한 ‘토플 라이팅 정규서’로, iBT 리스닝 최신 출제경향을 철저히 분석하여 반영한 방대한 양의 실전 문제를 수록하였다. 또한, 토플 라이팅 고득점 달성에 꼭 필요한 학습 전략과 에세이 필수 표현, 풍부한 모델 에세이를 제시한다.",,5857,BOOK
