title,author,genre_id,genre,ISBN,description_aladin,description_naver,salesPoint,mallType
인생 9단,양순자 (지은이),51371,국내도서>에세이>한국에세이,9788976772046,"도대체 어떻게 살아야 하는지 인생의 지혜를 공식화시켜 전해주는 책이다. 29년간 사형수 상담을 담당하면서 수많은 사람들에게 깨달음을 전해주었던 저자의 지혜가 녹아 있는, 제대로 실천하기만 한다면 사는 게 결코 힘겹지 않을, 그런 실제적인 공식들이다.",,940,BOOK
"야, 우리 기차에서 내려!","존 버닝햄 (지은이), 박상희 (옮긴이)",35137,국내도서>유아>그림책>나라별 그림책>유럽,9788949110080,"기차놀이를 좋아하는 아이는 꿈 속에서 장난감 강아지와 함께 기차를 타고 여행을 떠난다. 안개 속에서 유령놀이를 하고 오니까 코끼리가 기차에 타고 있다. `야,우리 기차에서 내려!`하고 말하지만 `사람들 때문에 살아남지 못할 거야` 하는 말에 태워준다. 브라질의 환경운동가 치코멘데스를 기려 만든 그림책이다.","기차놀이와 동물 인형을 좋아하는 남자 아이를 통해 환경문제를 제기한 책이다. 날씨와 계절이 바뀔때마다 생존을 위협당하는 동물들이 나타난다. 그 때마다 남자 아이는 ""야, 우리 기차에서 내려!""하고 말하는데, 동물들은 ""제발, 나도 기차에 태워 줘!""하고 부탁한다. 그러면서 세계 곳곳에서 벌어지고 있는 인간의 자연 파괴 상황을 고발한다.",13491,BOOK
이야기 세계사 1 - 개정신판,"김경묵, 우종익 (엮은이), 박진호 (그림)",169,국내도서>역사>세계사 일반,9788936800895,"이 책은 인류가 걸어온 세게 여러 나라의 발자취를 모두 수록하고 있는 세계사 교양서로, 선사시대부터 중세유럽을 다룬 1권과 근대 유럽부터 2차 세계대전까지를 다룬 2권으로 구성되어 있다.",,966,BOOK
미래로부터의 반란 - 김진경 교육 에세이,김진경 (지은이),51111,국내도서>사회과학>교육학>교육에세이,9788971844267,"교육운동가 김진경의 에세이. 1985년 「민중교육」사건으로 구속돼 수감 생활을 하고, 전교조 창립에도 관여했던 지은이가 2000년 교단 복직 후의 현장경험을 바탕으로 교육 문제의 원인을 진단하고 해결책을 제시한다.","이 책은 전교조 창단의 일등 공신이지 교육 운동가인 김진경 선생님이 현직 교사로 재직할 때의 경험과 노무현 정부 교육 혁신 위원회 활동을 하면서 겪었던 일들을 바탕으로 우리 교육이 처한 상황을 냉엄하게 지적하고, 아이들을 위해 우리 교육이 지향해야 할 바라를 '희망'이란 메시지에 담아 비춰 보입니다. 
교육 정책가들보다는 아이들 입장에서 교육을 바라보려는 저자의 넉넉하고 따뜻한 마음이 행간에 잘 녹아 흐르고 있으며, 요즘 아이들의 감성에 부합하는 교육 제도를 갖춰 주는 일이 시급함을 지적하고 여러 가지 대안들을...",550,BOOK
샬롯의 거미줄,"엘윈 브룩스 화이트 (지은이), 가스 윌리엄즈 (그림), 김화곤 (옮긴이)",48877,국내도서>어린이>동화/명작/고전>외국창작동화,9788952709530,"가스 윌리엄즈의 부드러운 연필화 그림이 포근하게 이야기를 감싸 안는다. <샬롯의 거미줄>은 1952년 발간 이래, 미국에서 꾸준히 학부모와 교사 그리고 아이들이 선택하는 좋은 책으로 선정되어 읽히고 있다. 아이들의 눈높이에 맞춰 경쾌하면서도 진지함을 잃지 않는 이야기가 매력적이다.","돼지와 거미의 우정 이야기!

읽는 재미로 가득한 초등학교 고학년 아이들을 대상의 「시공주니어 문고 독서 레벨 3」 제34권 『샬롯의 거미줄』. 20세기 미국 동화 작가 엘윈 브룩스 화이트가 1952년 출간한 후 세계적으로 4천 5백만 부 이상 판매된 아동문학의 고전이자 스테디셀러입니다. 1973년 애니메이션으로 만들어진 후 2006년 영화로도 만들어졌습니다. 아울러 교보문고와 함께하는 KBS 2TV 북 토크쇼 '달빛프린스'의 다섯 번째 선정도서입니다. 

함께 태어난 형제 중 가장 작다는 이유로 아기 돼지 '월버'에게 죽임을 당할 위기가 닥쳤어요. 농장 주인의 딸 '펀'은 아빠를 설득하여 월버를 구해내 정성껏 키웠어요. 새로 옮겨간 농장에서 월버가 만난 친구는 거미 '샬롯'이에요. 서로 다른 월버와 샬롯은 갈등을 겪지만 친구가 되는데는 문제가 없었어요. 어느 날 크리스마스에 월버가 햄으로 만들어 질 것이라는 소문이 돌았어요. 사려 깊은 침착한 샬롯은 윌버를 살려낼 묘안을 냈어요. 바로 거미줄에 윌버를 위한 문구를 짜 넣는 것인데…….",39004,BOOK
"노빈손, 피라미드의 비밀을 풀어라","한희정, 강영숙 (지은이), 이우일 (그림)",1140,국내도서>청소년>청소년 역사,9788958071907,과학 청년 노빈손이 드디어 세계로 진출했다! 역사가 고스란히 살아 숨쉬는 현장을 찾아다니며 생생한 역사와 문화를 배우게 된 것. 그 첫번째로 방문한 곳이 바로 4대 문명의 하나인 고대 이집트이다.,"'신나는 노빈손 세계 역사탐험' 시리즈, 제1권 『노빈손, 피라미드의 비밀을 풀어라』. 역사가 고스란히 살아숨쉬는 현장을 찾아다니는 '노빈손'의 세계 역사 탐험을 따라간다. '노빈손'과 함께 역사뿐 아니라, 문화 등을 배움으로써, 새로운 지식을 얻을 수 있다. 아울러 일러스트레이터 이우일의 그림을 담아 보는 재미도 선사한다. 

제1권에서 '노빈손'의 모험은 4대 문명 중 하나인 고대 이집트를 중심으로 펼쳐진다. 미라, 파라오, 피라미드 등 이집트의 고대 역사와 문화 등을 흥미롭게 전하면서, 그곳에 대한 궁금증도 해결 할 수 있도록 꾸몄다. 관련 사진도 풍부하게 수록하고 있다. 

부푼 꿈을 안고 세계 여행을 떠난 '노빈손'은 알 수 없는 모래 폭풍에 휘말려 고대 이집트로 떨어진다. 정신을 차려보니 '노빈손'은 미라처럼 온몸에 붕대를 감고 있었다. 어쩔 수 없이 죽음을 맞이해야 하는 상황에서 왕녀라고 주장하는 '크다만파트라'가 나타나 '노빈손'을 구해주는데……. 전체컬러.",7809,BOOK
남극의 마지막 영웅 섀클턴 - 우린 꼭 살아돌아간다,"두그루 (지은이), 양지훈 (그림)",48837,국내도서>어린이>초등3~4학년>동화/명작/고전,9788995710043,때로 실패가 성공보다 더 진한 감동을 줄 수 있다는 것을 알려주는 어니스트 섀클턴의 남극 탐험기를 담았다. 남극 대륙횡단을 하기 위해 남극으로 향했던 인듀어런스 호의 선원들은 남극 대륙에 발을 딛기도 전에 그만 웨들해의 부빙 사이에 갇혀 얼음 바다를 표류하는 신세가 된다.,"때로 실패가 성공보다 더 진한 감동을 줄 수 있다는 것을 알려주는 어니스트 섀클턴의 남극 탐험기를 담았다. 남극 대륙횡단을 하기 위해 남극으로 향했던 인듀어런스 호의 선원들은 남극 대륙에 발을 딛기도 전에 그만 웨들해의 부빙 사이에 갇혀 얼음 바다를 표류하는 신세가 된다.



일생을 건 모험이 실패로 돌아가는 시점에서도 섀클턴은 이렇게 말한다. ""예정대로라면 우리는 지금쯤 남극 대률을 신나게 달리고 있을 거야. 하지만 신께서 꿈에 나타나 이렇게 말하더군. '이봐 어니, 너무 서두르는 거 아냐?'""  하고 말이지. 여보게들, 우리가 그렇게 빨랐나?""



그후, 그는 인듀어런스 호에 탄 28명의 사람들의 생존을 최우선의 과제로 삼아 조직을 이끌어 나간다. 아무도 살아 돌아갈 것을 장담할 수 없는 극한의 상황에서도 섀클턴은 선원들에게 희망과 용기를 북돋아 주었으며, 항상 솔선수범하는 자세로 존경을 받았다.



새클턴과 27명의 선원은 무사히 탈출했다. 새클턴의 탐험에 참가했던 프랭크 헐리의 사진을 담은 의 사진을 책 뒤쪽에 실어, 힘들었지만 지혜롭게 위기를 이겨낸 그들의 모험을 생생하게 느끼도록 했다. 글과 만화, 일러스트, 퀴즈 등을 적절히 안배해 어린이들의 흥미를 유도한 구성도 돋보인다.",1402,BOOK
숲은 어떻게 만들어지는가?,"윌리엄 재스퍼슨 (지은이), 척 에카르트 (그림), 이은주 (옮긴이)",48877,국내도서>어린이>동화/명작/고전>외국창작동화,9788949160535,옛날 이야기인듯 숲의 인생을 재미있게 설명하는 이 책은 자연스럽게 자연사랑을 가르친다. 서울대에서 식물생태학을 가르치는 이은주씨가 읽기 쉽게 옮겼다. 가는 펜으로 정성들여 그린 삽화가 특색있다. 하지만 시원한 숲의 사진들이 더 좋을 뻔했다. ‘난 책읽기가 좋아’ 시리즈의 18번째 책. 초등학교 3~4학년용. -경향신문 송현숙 기자,"미국 북동부 매사추세츠 주의 숲을 무대로 하여 그 숲이 어떻게 이루어졌는가를 동화처럼 그려낸 책이다. 200년 전 한 농부가족이 버리고 간 땅이 처음 어떻게 싹을 틔웠는지, 동물들은 언제부터 거기에 와 살게 되었는지, 숲의 초기에는 어떤 나무들이 살다가 사라지고 지금은 어떤 나무들이 살고 있는지가 자세하게 이야기된다.



숲의 일생을 소개하는 글 옆에는 미국에서 활발하게 활동하고 있는 척 에카르트의 그림이 실려있다. 흑백의 세밀화로 정성스럽게 그린 그의 그림들은 화려하거나 눈에 확 띄는 것은 아니지만, 그림의 섬세한 선들을 따라가다보면 숲 곳곳에 숨어있는 조그마한 풀 한 포기, 열매를 주어먹고 있는 다람쥐에 이르기까지 숲을 차근차근히 둘러볼 수 있다. 그래서 숲이 정말 간단하고 쉽게 이루어지지 않았음을 알아차리고 소중하게 생각하는 마음이 들도록 했다. 



뒷장에는 숲에 대한 기본적인 생물상식들과 숲에 갈때 주의할 점들에 대해 이야기해놓았다.",7374,BOOK
황금빛 똥을 누는 아기 - 자연건강법으로 아이 낳고 키우기,최민희 (지은이),51789,국내도서>좋은부모>건강/환경,9788974781552,"자연건강법을 오랫동안 연구하고 강의했던 지은이가 임신, 태교, 출산, 육아까지 자연건강법에 따라 자신의 아이(마흔살에 낳은 늦둥이)를 키운 체험과 방법을 소개한다.",,7465,BOOK
물은 답을 알고 있다 - 물이 전하는 놀라운 메시지,"에모토 마사루 (지은이), 양억관 (옮긴이)",51002,국내도서>과학>기초과학/교양과학,9788988739235,"물 연구가 에모토 마사루의 이색 사진집 + 물 에세이집. 에모토 마사루는 물에게 말과 음악을 들려주고, 글을 보여주면서 물의 결정이 각각의 경우 어떻게 달라지는가를 사진에 담았다.",물은 생명의 기본 성분이다 바로 그러한 물이 말과 글씨 음악등에 따라 변화됨을 물결정 사진으로 보여주고 있는 이 책은 비물질이 물질에 영향을 줄 수 있음을 가시적 증거로 제시하고 있다 미래 심신의학 연구에도 큰밑거름이 될 것이다,8769,BOOK
강물아 강물아 이야기를 내놓아라 - 우리 강에 얽힌 옛이야기,"양태석 (지은이), 전병준 (그림)",48874,국내도서>어린이>동화/명작/고전>국내창작동화,9788991146006,"우리나라의 유명한 강 여덟 개에 얽힌 옛이야기를 실었다. 두만강, 압록강, 대동강, 임진강, 한강, 금강, 낙동강, 섬진강 등 한국의 대표적인 강의 기본적인 지리 정보를 파악한 뒤, 강에 얽힌 옛이야기를 읽게 된다. 또, 강 주변에 있는 역사 유적을 사진으로 만날 수 있다.",,2023,BOOK
누가 해도 참 맛있는 나물이네 밥상,김용환 (지은이),53472,국내도서>요리/살림>생활요리,9788959245840,<2000원으로 밥상 차리기>의 저자 나물이가 한층 업그레이드된 요리 실용서를 선보인다. 백수 총각으로 유명한 인터넷 요리작가 나물이는 그 후 2년 동안 다시 연구한 요리비법을 책에 고스란히 담았다.,"<2000원으로 밥상 차리기>의 저자 나물이가 내놓은 두 번째 요리책! 전작 이후 2년 여 간의 일상이 고스란히 담긴 책으로, 저렴한 식 재료로 맛깔스런 요리를 선보인다. 무엇보다도 그의 요리책은 계량법이 간편하다. 기존 요리책은 G, CC, 큰 술, 작은 술을 사용하지만 나물이는 손과 종이컵, 밥숟가락으로 계량법을 변형시킨다.
<BR>
<BR>저렴한 식재료로 선보이는 손쉬운 요리들은 무려 203가지나 소개되었다. 따라서, 일반 가정에서 해먹는 웬만한 요리는 전부 수록된 셈. 큼직한 완성 사진과 조리 과정 사진은 누구나 쉽게 따라할 수 있도록 돕는다. 요리 초보자들이 요리백과사전으로 삼아도 손색이 없을 정도로 알찬 요리 레시피가 담겨 있다(그의 요리가 궁금한 분들은 그의 사이트 WWW.NAMOOL.COM을 참조할 것).",10889,BOOK
삼국지 세트 - 전10권,"나관중 (지은이), 이문열 (엮은이)",51124,국내도서>소설/시/희곡>역사소설>외국 역사소설,9788937450501,"한국 출판사상 최고의 베스트셀러. 1988년에 발행된 초판, 1993년에 선보인 신조판에 이어 십여 년 만에 개정판이 나왔다. 제1권의 경우, 2002년 2월까지 초판 19쇄와 신조판 81쇄를 합하여 총 100쇄를 발간했을 정도.","동양인의 원초적 사고와 처세의 기본이 담겨있는 새로운 시각의 삼국지(개정판). 한나라 멸망 후 펼쳐지는 무수히 많은 영웅호걸들의 쟁투와 죽음, 전쟁, 음모와 지략을 들려주는 책. 유비, 관우, 장비의 도원결의부터 솥발처럼 셋으로 나누어진 촉, 오, 위 나라가 하나로 합쳐지기까지 조조, 손권, 제갈공명, 사마의, 조자룡 등 수많은 영웅호걸들이 펼치는 흥미진진한 역사적 내용을 풀어썼다.",17941,BOOK
"만화로 보는 그리스 로마 신화 18 - 오, 이타케, 이타케!","토마스 불핀치 (지은이), 이광진 (엮은이), 홍은영 (그림)",49224,국내도서>어린이>초등 전학년>학습만화,9788990103185,"바다에서 살아 남은 오디세우스는 어떤 섬에 도착해, 아테나 여신의 도움으로 궁전으로 초대된다. 궁전에서 열린 잔치에서 오디세우스의 신분이 밝혀지고, 사람들은 트로이 전쟁의 영웅 오디세우스가 무사히 고국으로 돌아갈 수 있도록 배와 선원들과 선물을 준비해 준다.","아름다운 여신과 뛰어난 영웅, 그리고 신비로운 일들로 가득한 그리스 로마 신화를 만화로 꾸민 책. 18편에서는 신의 저주를 받아 고향에 못 돌아가게 된 오디세우스의 기나긴 방랑과 모험 이야기를 담았습니다. 제우스, 헤라, 아폴론 등 올림포스의 신들과 뛰어난 영웅들, 수많은 왕, 그리고 메두사, 티폰 등 무시무시한 괴물들이 엮어가는 감동 깊은 이야기를 통해 서양 문화 ·세계 문화의 뿌리를 배울 수 있습니다. 
<BR>
<BR>원작자 <B>토머스 불핀치(THOMAS BULFINCH)</B>
<BR>토머스 불핀치는 미국의 하버드 대학을 졸업한 뒤 박물학 ·문학 ·교육 등에 관한 일을 했다. 그는 '그리스 로마 신화를 모르면 유럽 문화의 대부분을 이해할 수 없다'고 하며, 신화 ·민담 ·전설을 연구하여 『전설의 시대』 『기사도의 시대』『샤를마뉴의 전설』등의 책을 썼다. 
<BR>
<BR>그림 <B>홍은영</B>
<BR>고신대학에서 교육학을 공부하고, 만화 『은색의 대지』『눈물의 다이아몬드』와 '글 업는 그림책'시리즈의 『나무꾼과 선녀』『피노키오』 그리고 '켈리 영어 만화'시리즈의『인어 공주』『오즈의 마법사』『안네의 일기』『사운드 오브 뮤직』『키다리 아저씨』등 어린이를 위한 만화를 많이 그렸다.
<BR>",4331,BOOK
하늘을 감동시킨 효자이야기,우리누리 (지은이),48903,국내도서>어린이>문화/예술/인물>한국전통문화,9788959246847,,,1153,BOOK
쨩 글리쉬 - 전12권 - 하버드 생의 통쾌한 만화 영어,박주현 (지은이),49849,국내도서>외국어>영어회화>생활영어,9788995552551,,,100,BOOK
어린이 세계지도책,"DK 편집부 (엮은이), 브라이언 델프 (그림), 강미라 (옮긴이)",48911,국내도서>어린이>사회/역사/철학>지리/지도책,9788988879955,"드넓은 지구에 흩어져 사는 사람들. 각각 어떤 곳에서 무엇을 하며 살고 있을까? 어린이들이 가질 수 있는 타문화에 대한 호기심을 지도로 옮겨 놓았다. 북극과 남극에서 스칸디나비아 반도, 일본, 중국, 오스트레일리아까지 세계 여러나라의 자연 환경과 문화, 동식물, 주요 산업들이 실려 있다.",,12176,BOOK
핵전쟁 뒤의 최후의 아이들 - 좋은책문고 2,"구드룬 파우제방 (지은이), 김두남 (옮긴이)",48877,국내도서>어린이>동화/명작/고전>외국창작동화,9788972582328,"여름방학을 맞아 가족과 함께 시골에 있는 외할머니 댁에 가는 도중 롤란트는 핵폭탄이 떨어지는 장면을 목격한다. 엄청나게 밝은 빛과 폭풍이 몇 차례 휩쓸고 지나간 뒤, 무서울 정도로 고요한 정적이 찾아왔다. 그 후, 인류는 파멸의 길을 걷기 시작한다.","여름방학을 맞아 가족과 함께 시골에 있는 외할머니 댁에 가는 도중 롤란트는 핵폭탄이 떨어지는 장면을 목격한다. 엄청나게 밝은 빛과 폭풍이 몇 차례 휩쓸고 지나간 뒤, 무서울 정도로 고요한 정적이 찾아왔다. 그 후, 인류는 파멸의 길을 걷기 시작한다.<BR>
<BR>
온 유럽에 핵폭탄이 떨어져 피난갈 곳도 없고, 모든 땅은 폐허로 변해 나무도 풀도 자랄 수 없는 곳이 되어버린다. 게다가, 굶주림, 전염병, 원자병, 약탈, 추위... 계속해서 인류를 괴롭히는 문제가 앞을 가로막는다. 핵전쟁에서 살아남은 얼마되지 않은 사람들도 날이 갈수록 서서히 죽어간다.<BR>
<BR>
핵전쟁에서 살아남은 롤란트는 처절한 생존의 기록을 생생하게 남기면서, 읽고 계산하는 능력보다 인간에게 더 필요한 것은 서로를 소중히 여기고, 어려울 때 서로 도우며, 모두가 사랑하는 마음을 가지는 것임을 깨닫는다. 평화를 쟁취하기 위한 인류의 숭고한 노력을 가상의 전쟁을 통해 강조하고 있다.",857,BOOK
Human Body 인체의 신비展 카탈로그 - 완역본,,51017,국내도서>과학>인체의 이해,,,,124,BOOK
민중의 세계사,"크리스 하먼 (지은이), 천경록 (옮긴이)",169,국내도서>역사>세계사 일반,9788979660364,"마르크스주의 역사학의 입장에서 '민중의 세계사'를 본격적으로 다룬 세계통사. 선사시대부터 1999년까지의 역사를 계급의 구조와 충돌, 기술의 발전과 사회경제적 변화의 의미, 그 틈에서 역사의 현실에 저항한 민중의 모습 등에 중점을 두고 일관된 흐름으로 서술했다.","인류의 역사는 어떻게 변해왔고, 우리가 살고 있는 현재는 어떻게 만들어졌을까? 대부분의 역사는 이를 왕, 황제, 장군 등 위대한 인물을 중심으로 설명한다. 그리고 계급사회를 역사의 불가피한 귀결점으로, 이기심을 인간의 본성으로 그린다. 그래서 지배세력에 의해 씌어진 역사 속에는 세상을 바꿀 가능성이 존재하지 않는다.



그런데 지은이에 따르면 역사란 ""우리가 살고 있는 현재가 어떻게 만들었는지 밝혀주는 것, 이로부터 세상을 바꿀 가능성을 제시하는 것'이다.  역사를 민중의 투쟁사를 중심으로 바라보면, 고착화된 계급 구조와 사회질서를 변화시킬 잠재력이 보인다는 것이다.



책은 마르크스주의 역사학의 입장에서 '민중의 세계사'를 본격적으로 다룬 세계통사이다. 선사시대부터 1999년까지의 역사를 계급의 구조와 충돌, 기술의 발전과 사회경제적 변화의 의미, 그 틈에서 역사의 현실에 저항한 민중의 모습 등에 중점을 두고 일관된 흐름으로 서술했다.



인간본성의 문제, 성,인종 차별의 문제, 전쟁과 계급구조의 발생에 관한 설득력 있는 설명이 돋보인다. 뿐만 아니라, 중국, 인도, 아프리카의 역사를 비중있게 다루며 자본주의 발달의 역사를 밝혔다는 점에서도 눈에 띈다.",1850,BOOK
사무자동화산업기사 필기 스피드 총정리 - 2005,"영진정보연구소, 이동숙, 최재영, 박현미 (지은이)",35778,국내도서>수험서/자격증>컴퓨터 활용능력>사무자동화,9788931430806,"수험생들이 이론 공부 후 마무리 정리를 할 수 있도록 기획된 총정리 수험서. 최근의 출제 경향을 파악할 수 있도록 10회 분량의 최신 기출문제를 수록했고, 기출문제 유형에 맞춘 5회 분량의 모의고사를 수록하여 다양한 문제를 접해볼 수 있도록 구성했다.",,547,BOOK
"조화섭 교육학 - 상 - 2006 EBS 방송교재, 교원임용고시",조화섭 (지은이),17694,국내도서>대학교재/전문서적>교원임용고시 교재,9788956083568,"2004년에 출간됐던 EBS 조화섭 교육학의 개정판 성격을 가지는 책이다. 핵심 내용 중 출제 가능성이 많지 않은 부분은 대폭 조정하고, 2004년과 2005년 유/초등/중등 기출문제를 수록했다.",,356,BOOK
"여덟 살, 혼자 떠나는 여행","우 니엔쩐 (지은이), 관 위에수 (그림), 심봉희 (옮긴이)",35136,국내도서>유아>그림책>나라별 그림책>아시아,9788984883079,"타이완 문화건설위원회에서 선정한 최우수 그림책. 타이완 최고의 도서상인 금장상(그림책 부문)을 2004년에 받았다. 여행의 설레임과 추억, 그리고 타인과의 만남과 교류 속에서 성큼 자란 여덟 살 아이의 성장 이야기를 단아하게 그려냈다. 좀처럼 만나기 힘든 타이완의 그림책.","이 책은 타이완 최고의 도서상 금정상 2004년도 그림책부문 수상작이며 타이완 문화건설위원회 선정 최우수 그림책이다. 세상을 향해 조심스럽고도 힘찬 발걸음을 내딛느 여덟 살 소년의 여행 이야기를 담고 있다.

타이완의 한 시골 마을에서 막 여행을 떠나려는 여덟 살 소년. 더 씩씩하게 키우려는 아버지의 가르침에 따라 우산을 가지로 이모할머니 댁에 가는 기차안에서, 소년은 낯설 할머니를 만나게 된다. 처음에 두렵지만 그 할머니를 통해서, 그리고 차창 밖으로 보이는 풍경을 보면서 소년은 자신도 보르는 사이에 세상에 자?..",1926,BOOK
입이 큰 개구리,"키스 포크너 (지은이), 조나단 램버트 (그림), 정채민 (옮긴이)",35115,국내도서>유아>놀이책>팝업북/플랩북,9788980710713,등장하는 여러 동물들의 입이 튀어나오는 입체 그림책입니다. 책장을 넘길 때마다 불쑥불쑥 튀어나오는 그림들을 보면서 아이들이 좋아할 것 같아요. 마지막 장면에서 개구리가 연못으로 뛰어드는 모습은 또 얼마나 시원해 보이는지 모른답니다.,"유아를 위한 입체북. 책장을 넘길때 마다 동물들의 입모양이 입체로 솟아 오른다. 
입이 큰 개구리는 다른 동물들이 무얼 먹고 사는지 궁금했어요. 그래서 이 수다쟁이 개구리는 만나는 동물마다 어떤 먹이를 가장 좋아하는지 묻고 다녔어요. 그러다가 마침내 입이 큰개구리를 잡아먹기 좋아하는 동물을 만나게 되고...",20610,BOOK
수학이 수군수군,"샤르탄 포스키트 (지은이), 유광태 (옮긴이)",48871,국내도서>어린이>과학/수학/컴퓨터>초등 수학,9788934903925,"책장을 넘겨 보면 '뭐가 이리 쉬워?'하고 의아해 할 수도 있다. 이 책은 수학의 가장 기본적인 개념을 이해할 수 있도록 돕고 있다. 개념을 확실하게 이해해서 기초를 충실히 다져놓는 데서부터 실력을 기를 수 있다. 신나고, 재미있고, 무엇보다도 귀찮은 연습문제도, 지겨운 계산도 필요없는 새로운 수학.",,10035,BOOK
