title,author,genre_id,genre,ISBN,description_aladin,description_naver,salesPoint,mallType
내가 쓰고 싶은 말이 다 있는 영어일기 표현사전,"하명옥 (지은이), Merrilee Brinegar (감수)",49949,국내도서>외국어>영작문,9788982205903,영어일기 관련 네이버 검색 1위 사이트인  '하명옥의 영어일기'(http://hamo66.hihome.com) 의 자료를 한 권에 엮은 표현사전이다. 상황별로 분류된 단문 수준의 생생한 표현을 찾기 쉽게 정리해놓아 우리말로 바로바로 찾아쓸 수 있다.,,8644,BOOK
젊음이여 오래 거기 남아 있거라 - 시대의 격랑을 헤쳐나간 젊은 영혼들의 기록,황광우 (지은이),51277,국내도서>사회과학>한국정치사정/정치사>한국정치사정/정치사-일반,9788936482343,"6월 항쟁 20주년을 앞두고 지난 격변의 시대를 성찰해 보는 책. 광주항쟁 전후부터 6월 항쟁까지 시대의 거센 파고를 뚫고 나간 젊은 영혼들의 고난의 행로를 생생히 기록한 것이다. 지은이는 군사독재정권과 숨가쁘게 대결하던 격변기에, 학교와 감옥, 거리 등에서 민주화를 위해 어떻게 젊은 시절을 보냈는지 전해준다.","한국 현대사의 거친 파고를 헤쳐나간 젊은 영혼들의 기록

〈젊음이여, 오래 거기 남아 있거라〉는 6월 항쟁 20주년을 앞두고 지난 격변의 시대를 성찰하는 책이다. 1980년 광주항쟁 전후부터 1987년 6월 항쟁까지 시대의 격랑을 헤쳐나간 젊은 영혼들의 꿈과 고난의 행로를 생생하게 기록하였다. 저자는 군사독재정권과 대결하던 격변기에 학교, 공장, 감옥, 거리 등에서 우리 사회의 민주화를 위해 어떻게 젊음을 바쳤는지를 자신의 체험과 관련자들의 증언, 그리고 기록사진 등을 통해 들려주고 있다.

이 책의 이야기는 대학 입학 후 저자의 삶의 행로를 중심으로 전개된다. 신림동 단칸방에서 둘째형 황지우 시인과 함께 살던 이야기를 시작으로, 인천지역에서 노동운동가로 활동하며 5ㆍ3인천 항쟁을 거쳐 1987년 6월 항쟁에 이르는 과정을 긴장감 있게 서술하고 있다. 또한 저자는 자신의 체험적 진실을 서술하면서, 자신과 직간접적으로 인연을 맺어 시대의 파고를 헤쳐나간 사람들의 이야기와 그들의 증언, 재미있는 에피소드 등을 함께 소개한다. 

저자는 역사는 반동을 통과하며 전진되고, 이 과정에 때로는 인간의 머리로는 다 헤아릴 수 없는 많은 우연이 개입한다고 말한다. 그러면서, 너와 내가 인연을 맺고 그 인연이 또다른 인연을 만들어내면서 수만 명이 물결을 이루고 그것이 사회를 바꾸는 의미 있는 힘으로 작용한다는, 즉 역사에서의 '수'의 의미를 강조하고 있다.",534,BOOK
응급 처치,"야마다 마코토 (글), 야규 겐이치로 (그림), 고향옥 (옮긴이)",35108,국내도서>유아>그림책>교양/학습 그림책,9788949150796,"넘어지고, 코피가 나고, 화상을 입고, 가시에 찔리고, 칼에 베였을 때 어떻게 응급처치를 해야하는지, 전문적인 지식을 어린이의 눈높이에서 재미있게 전해진다. <a href=""/catalog/book.asp?ISBN=897094298X""><콧구멍 이야기></a>의 일러스트를 맡은 야규 겐이치로가 그림을 그렸고, 소아과 의사 야마다 마코토가 글을 썼다.","아이들은 서로 싸우고 다치면서 자란다고 합니다. 하지만 다친 부위를 잘 못 했다가는 아물지 않아 상처가 덧나게 되지요. 책 속에는 응급 처지에 대하여 재미있는 그림과 아이들의 머리 속에 오래 기억할 수 있도록 재미있고 자세하게 설명되어 있습니다. 어른들이 봐도 '아! 이럴때' 하고, 생각이 드는 응급 처치를 꼼꼼하게 알려주고 있으므로 아이들에게 큰 도움을 줄 수 있으며, 자신 스스로도 해결 할 수 있도록 해줍니다.",2663,BOOK
하드보일드 하드 럭,"요시모토 바나나 (지은이), 나라 요시토모 (그림), 김난주 (옮긴이)",50998,국내도서>소설/시/희곡>일본소설>1950년대 이후 일본소설,9788937403828,"죽음을 소재로 한 2편의 중편소설을 묶었다. 룸메이트였던 친구의 기일에 일어나는 묘한 일들을 풀어낸 '하드보일드', 뇌출혈로 식물인간이 된 언니를 안락사로 떠나보내는 과정을 그린 '하드 럭'. 얇고 가벼운 책이지만, 이 책이 던지는 파장은 길다.","저자의 실제있었던 이야기를 소설로 그린 책. 은 실제로 사랑하는 이를 잃고서 쓴 요시모토 바나나의 신작 소설집으로 상실의 아픔에서 삶을 이어갈 힘을 이끌어내는 2편의 중편소설이 실려 있다. 어느 날 영원히 잃어버린 그녀와 마주하게 된 여행중의 기이한 하룻밤 이야기 '하드보일드', 결혼을 앞두고 과로로 쓰러진 언니를 영원히 떠나보내게 되기까지의 이야기'하드 럭'. 저자는 어느 순간 다가온 사랑하는 이의 죽음으로 겪게 된 시린 아픔을 특유의 담담하면서도 시적인 문체로 애잔하게 그려내고 있다. 세계적으로 주목받는 미술가인 요시토모 나라가 소설을 읽고 그린 네 컷의 그림이 포함되어 작품의 분위기와 절묘하게 조화를 이룬다.",5003,BOOK
순종 - 하나님의 권위 아래서 누리는 보호와 자유,"존 비비어 (지은이), 윤종석 (옮긴이)",51601,국내도서>종교/역학>기독교(개신교)>기독교(개신교) 신앙생활>신앙생활일반,9788953101371,CBA 베스트 셀러 작가 존 비비어가 하나님의 보호 안에서 누리는 참 자유를 소개한다. 왜곡된 권위주의에 대한 피해의식을 가진 이들이 '권위'라는 말만 들어도 알레르기 반응을 보이며 참된 보호의 근원인 '하나님의 권위'에서 도망가려 한다고 지적한다.,"미국기독교출판협회 선정 베스트셀러 기독교 작가 존 비비어의 『순종』. 하나님의 공급하심과 보호하심 아래 살아가는 열쇠인 '순종'의 미덕을 설명하고 있다.

성경적인 복종과 순종을 통해 믿음이 자라는 여정과 하나님이 권위를 세우신 이유, 그리고 부당한 대우에 대응하여 극복하는 법 등을 알려준다. 그리스도인의 삶을 형통하게 바꿔주는 희망의 메시지를 담고 있다.",10849,BOOK
왜 공부하는가,"스즈키 코지 (지은이), 양억관 (옮긴이)",51794,국내도서>좋은부모>교육/학습>학교/학습법,9788959750795,"일본에서 '링' 시리즈로 800만 부의 밀리언셀러를 기록한 소설가 스즈키 코지가 풀어가는 '공부를 해야 하는 이유', 즉 공부에 있어서의 '동기 부여'에 관한 책이다. 작가가 되기 전 학원강사와 가정 교사 경험, 주부로서 두 딸을 키운 경험과 깊은 교양을 바탕으로 아이와 부모들의 '왜'라는 궁금증에 명확한 해답을 제시한다.","공부를 해야 하는 이유를 밝히다!<BR><BR>〈링〉 시리즈의 저자 스즈키 코지의 『왜 공부하는가』. 〈링〉 시리즈로 800만 부의 밀리언셀러를 기록한 저자가 '공부는 왜 해야 하는가?'라는 의문을 유쾌하게 풀어나가고 있다. <BR><BR>이 책은 부모를 위한 자녀교육 지침서이자 자녀를 위한 공부방법 지침서다. 저자는 자녀를 공부의 고통에서 해방시켜 줄 수 있는 길은 논리적으로 공부를 해야 하는 이유를 가르쳐주고 설득시키는 데 있다고 말하면서, 그것이 자녀가 스스로 공부의 동기를 만들어내도록 이끈다고 강조한다. <BR><BR>또한 공부는 미래에 유효한 능력인 이해력, 상상력, 표현력을 키워줌을 역설하고 있다. 아울러 그러한 능력을 갖추고 있으면 자녀가 성장해가면서 부딪히게 되는 여러 어려움을 쉽게 극복해낼 수 있음을 증명한다.",229,BOOK
육이 죽어 영이 산 사람 후쿠시게 다카시,김무정 (지은이),51596,국내도서>종교/역학>기독교(개신교)>기독교(개신교) 신앙생활>간증/영적성장,9788971542835,"밀리미터의 오차도 허용치 않으며 정확한 방정식만 신뢰하던 전자공학자이자 스스로 돈과 명예, 지위를 최고의 가치로 삼아다고 말하는 저자에게 예수는 죽음을 앞둔 저를 찾아와 따뜻한 손을 내밀었고, 다카시는 곧 세상을 바라보는 눈과 가치관이 순식간에 변했다. 예수를 통해 인생의 전환점을 찾은 다카시의 고백.",,1379,BOOK
푸앵카레의 추측 - 우주의 모양을 찾아서,"도널 오셔 (지은이), 전대호 (옮긴이)",51331,국내도서>과학>수학>수학자의 생애,9788972914259,"지은이 도널 오셔는 사라진 5,000여 년 전 바빌로니아의 필기사에서부터 푸앵카레의 유명한 정리가 탄생하는 데 기여한 우리 시대의 위대한 수학 개척자들까지 이어진 기하학 지식의 궤적을, 그리고 지난 한 세기 동안 푸앵카레의 추측을 풀기 위해 벌어진 흥미로운 경쟁을 설명해준다.",,240,BOOK
오소리네 집 꽃밭,"권정생 (글), 정승각 (그림)",35134,국내도서>유아>그림책>나라별 그림책>한국 그림책,9788986621334,"들판에 나뒹구는 하찮은 돌멩이 하나도 있는 그대로의 아름다움, 사람의 손길이 닿기 전의 아름다움을 간직하고 있다는 이야기를 담고 있다. 이 세상의 아름다움은 스스로 마음의 문을 열고 가까이 다가설 때만 느낄 수 있다는 나지막한 속삭임이 들려온다. - 동아일보",너무 흔해서 거들떠보지 않던 들꽃에서 새로운 아름다움을 발견한 오소리아줌마.이 책은 어린이들에게 우리나라 들꽃들의 아름다움을 발견하고 가슴깊이 느낄 수있게 해줍니다.,13140,BOOK
여행의 기술,"알랭 드 보통 (지은이), 정영목 (옮긴이)",51373,국내도서>에세이>외국에세이,9788957090268,"<왜 나는 너를 사랑하는가>로 국내에 알려진 작가, 알랭 드 보통의 여행서이다. 보들레르, 플로베르, 워즈워스, 고흐, 호퍼, 버크, 러스킨, 위스망스 등의 예술가들을 안내자로 삼아 '왜 여행을 떠나는가?'부터 '여행의 최종 목적지는 어디인가?'에 이르기까지, '여행'을 테마로 던질 수 있는 모든 질문들에 대한 성찰을 유도하고 그 해답을 제시하는 책이다.",,10118,BOOK
똑똑한 만화 교과서 고사성어편 - 초등학교 선생님이 직접 쓴,"고성욱 (지은이), 우지현 (그림)",48940,국내도서>어린이>어린이 한자>사자성어/고사성어,9788957591321,"바른 마음을 키우는 고사성어들, 노력의 가치를 일깨우고, 가족과 친구의 소중함을 일깨우는 고사성어들이 주제별로 정리된 어린이 학습서. 성어를 구성하고 있는 한자의 음과 뜻을 배울 수 있는 한자풀이, 상식 이야기, 함께 알아둘 고사성어, 숨은 그림 찾기 등 다양한 코너를 200여 개의 고사성어와 함께 담았다.",,7324,BOOK
데미안,"헤르만 헤세 (지은이), 전영애 (옮긴이)",50922,국내도서>소설/시/희곡>독일소설,9788937460449,2차 세계대전 중 많은 독일 젊은이들이 전장에 나가면서 군복 주머니 속에 품고 갔던 책. 어른이 되기 위해 보이지 않는 껍질을 깨고 고통스런 현실의 세계로 나서는 젊은이들을 그렸다. 지금까지도 젊은이들에게 '통과의례'처럼 읽히고 있는 명작을 새로 옮겼다.,"불안한 젊음에 바치는 헤르만 헤세의 영혼의 이야기!

현실에 대결하는 영혼의 발전을 담은 헤르만 헤세의 걸작 『데미안』. 독일 문학의 거장이자 노벨문학상 수상작가 헤르만 헤세의 자전적 소설이다. 1차 세계대전 직후인 1919년 에밀 싱클레어라는 가명으로 발표했던 작품으로, 열 살 소년이 스무 살 청년이 되기까지 고독하고 힘든 성장의 과정을 그리고 있다. 불안과 좌절에 사로잡힌 청춘의 내면을 다룬 이 작품은 지금까지 수많은 청년세대의 마음에 깊은 울림을 전하고 있다.

목사인 부친과 선교사의 딸인 모친 사이에서 태어난 헤르만 헤세는 회고적이며 서정성이 강한 신낭만주의적 경향의 작가로 출발했으며, 1차 세계대전을 거치면서 깊이있고 내면적인 사고를 갖게 돼 증오보다 사랑, 전쟁보다 평화가 더 아름다움을 강조했다. 이 작품에는 그가 평생에 걸쳐 추구해온 삶의 궁극적 의미가 담겨 있다. 낮과 밤, 의식과 무의식, 아폴로와 디오니소스, 지성과 관능, 각성과 도취 등 두 가지의 대립적인 세계 속에서 방황하는 싱클레어와 두 세계 중 어디에도 속해 있지 않고 다만 자기 자신에게 속해 있는 데미안의 이야기를 통해 자신의 세계를 잃어버린 인간의 고뇌, 고독하게 모색하고 지치도록 갈망하는 청춘의 고뇌를 그려보인다.",97746,BOOK
만희네 집,권윤덕 (지은이),35134,국내도서>유아>그림책>나라별 그림책>한국 그림책,9788986621105,한국화의 색감이 살아 있는 책이다. 좁은 연립 주택에서 살다가 할머니 댁으로 이사간 만희가 엿보는 집안 구석구석의 이야기들이 권윤덕 씨의 정성어린 그림과 색감 속에 살아 있다.,"만희를 따라 집 구석구석을 돌아다녀요

우리 집과 우리 집 주변의 모습을 살펴보는 『만희네 집』. 만희를 따라 집안 구석구석을 돌아다니면서 할머니 할아버지의 손때가 묻은 물건과 집안의 구석구석 쓰임새를 알아볼 수 있다. 안방, 부엌, 광, 장독대, 현관, 목욕통, 옥상 등을 하나하나 따라가다 보면 집 전체를 머리속에 그려볼 수도 있고, 만희네 가족 한 사람 한 사람의 생활도 알 수 있게 된다. 아이들이 우리의 색과 선을 살린 그림을 보면서 새로운 감성을 키울 수 있으며, 특히 집안 구석구석에 있는 물건들까지 세밀하게 그려내어, 아이들은 그림에 묻은 손때까지 느낄 수 있다. 또한, 그림을 넘길 때마다 다음 페이지에 나올 장소를 먹빛으로 칠해 다음을 짐작할 수 있도록 한 점도 재미있다.",19169,BOOK
"현명한 투자자 - 벤저민 그레이엄의, 완전개정판","벤저민 그레이엄 (지은이), 박진곤 (옮긴이), 제이슨 츠바이크",174,국내도서>경제경영>재테크/투자>주식/펀드,9788957820568,현대 증권투자이론의 아버지이자 가치투자의 태두로 불리는 벤저민 그레이엄의 <현명한 투자자>가 미국의 투자 저널리스트인 제이슨 츠바이크의 생생하고 풍부한 시장 사례와 분석과 함께 새롭게 출간되었다.,"시공을 초월한 투자의 고전, 벤저민 그레이엄의 역작!

『현명한 투자자』는 워렌 버펫이 최고의 투자서로 꼽은 미국 아마존의 스테디셀러이다. 현대 증권투자이론의 아버지이자 가치투자의 태두로 불리는 벤저민 그레이엄이 1949년에 집필한『The Intelligent Investor』을 투자 저널리스트인 제이슨 츠바이크가 원작에 최근의 사례와 분석을 곁들여 현대에 맞게 재구성한 책이다. 

초판 출간 이래로 세계투자자들의 사랑을 받아온 투자의 고전으로 자리잡은 이 책은 주식의 분석이나 매매 기법들보다는 올바른 투자원칙과 투자자의 마음자세 등에 초점을 맞추었다. 전체적인 구성은 벤저민 그레이엄이 말하는 주식 이야기를 그대로 소개한 다음, 각 장마다 해당 내용에 관한 논평을 바로 뒷부분에 덧붙였다.

본문은 먼저 투자와 투기에 관해 이야기한 다음, 투자자와 인플레이션, 지난 1세기의 주식시장 역사, 방어적인 투자자와 적극적인 투자자 각각에 맞는 포트폴리오와 주식 등을 자세히 설명한다. 특히 바람직한 종목'을 어떻게 선별, 투자자들이 저지를 수 있는 실수 등을 설명하면서 투자자들이 믿고 따를 수 있는 투자원칙을 담았다. [양장본]

☞ 이 책의 독서 포인트!
내재가치에 기준을 두고 위험을 줄이면서 만족할 만한 투자 수익을 올리는 그레이엄식 투자방법의 기본 원리를 알기 쉽게 풀어서 설명하였다.",4176,BOOK
엉뚱이 소피의 못 말리는 패션,"수지 모건스턴 (지은이), 최윤정 (옮긴이)",48877,국내도서>어린이>동화/명작/고전>외국창작동화,9788949160245,사람은 왜 똑같은 구두 한 짝을 신고 똑같은 양말 한 짝을 신어야 되는지 의문을 가진 사람은 거의 없다. 주인공 소피는 모두 똑같은 옷을 입는 사람이야말로 정말 이상하다고 본다. 획일적인 것만을 강요하는 우리 모습을 돌아보게 한다. '교육'이란 '창의성'을 맘껏 발휘할 수 있게 하는 것이라는 소피 부모님의 모습도 부럽다.,"소피는 반 아이들이 매일 똑같은 티 셔츠에 똑같은 청바지를 입고 오는 걸 이해하지 못합니다. 소피는 집에 있는 옷을 가지고 마치 시를 쓰는 것처럼 옷을 입고 다닙니다. 친구들은 이런 소피를 손가락질하며 '엉뚱이'라고 부르죠. 소피가 옷을 이상하게 입고 다니자, 담임 선생님과 교장 선생님은 소피의 부모님에게 경고성 편지를 쓰는데.....",12250,BOOK
맞벌이 부부 아이는 서울대에 못간다?,,51794,국내도서>좋은부모>교육/학습>학교/학습법,9788991684379,"회사에 매여 자녀를 제대로 돌보지 못했다는 자책감으로 벙어리 냉가슴만 앓고 있는 직장 맘들을 대상으로 한 책이다. 저자는 출퇴근 시간이 없는 것은 물론이고 야근에, 휴일도 없이 격무에 시달려야 하는 기자로 맞벌이를 하면서도 비교적 성공적인 자녀 뒷바라지를 해냈다. 그리고 일과 가정을 병행하는 치열한 삶의 주인공인 직장 맘들에게 자녀 입시의 성공적인 수행를 위한 개인적 견해를 피력했다.",,345,BOOK
"2007 시나공 Summary 워드프로세서 1급 필기 - 핵심 요약 157개 + 기출문제 15회, 시험에 나오는 것만 공부한다","강윤석, 길벗R&D, 김우경, 김용갑, 김유홍 (지은이)",35798,국내도서>수험서/자격증>컴퓨터 활용능력>워드프로세서>워드프로세서 필기,9788975605789,"'시나공 Summary 시리즈'는 공부할 시간이 부족한 학생, 최대한 빨리 공부해서 합격하고 싶은 수험생을 위해 핵심요약과 기출문제 위주로 구성한 초단기 합격 전략집이다. 합격에 꼭 필요한 핵심 개념 157개를 최근 4년간 출제된 최신 기출 문제 15회분과 함께 수록했다.",,409,BOOK
"너, 외롭구나 - 김형태의 청춘 카운슬링",김형태 (지은이),70241,국내도서>자기계발>20대의 자기계발,9788988902929,"황신혜밴드의 리더이자 미술, 연극 등 다양한 분야에서 활동하고 있는 김형태의 개인 홈페이지의 '카운슬링'  코너에 올랐던 상담 사례를 모은 책. 이 시대 젊은이들이 고민하는 꿈과 희망, 직업에 관한 50가지 이야기와 답변이 담겨 있다.",,4009,BOOK
삼월은 붉은 구렁을,"온다 리쿠 (지은이), 권영주 (옮긴이)",50998,국내도서>소설/시/희곡>일본소설>1950년대 이후 일본소설,9788937831232,"'책을 좋아하는 사람이라면 누구나 읽어보고 싶어하는 책'에 관한 이야기. 익명의 작가가 사본 200부를 제작해 배포했으나 곧바로 절반가량 회수했다는 수수께끼의 책, <삼월의 붉은 구렁을>을 둘러싼 미스터리를 그렸다. <밤의 피크닉>의 작가 온다 리쿠 문학의 원점이 되는 소설로, 총 4편의 연작으로 이루어져 있다.",,5089,BOOK
지구를 구한 꿈틀이사우루스,"캐런 트래포드 (지은이), 제이드 오클리 (그림), 이루리 (옮긴이)",48872,국내도서>어린이>과학/수학/컴퓨터>환경 이야기,9788932370019,"지렁이 역사학자 '꿈틀이사우루스 2세'와의 인터뷰 형식으로 꾸민 책. 꿈틀이사우루스 2세는 존경하는 조상님의 초상화를 쳐다보며 지렁이가 걸어온 흥망성쇠의 이야기를 기자에게 건낸다. 공룡 시대부터 현재까지, 모든 쓰레기를 정화해 온 지구의 수호천사 지렁이의 이야기가 유쾌하게 펼쳐진다.",'꿈틀이사우루스 2세'를 만나 인터뷰한 내용을 이야기 하고 있는 이 책은 미생물과 흙의 소중함을 어린이들에게 깨닫게 하는 환경동화입니다. 자신의 욕심만 채우려는 인간들과 한없이 주기만 하는 자연의 생태계를 지렁이를 통하여 재미있는 그림과 함께 이야기 해줍니다. 징그럽고 쓸모없는 동물이라고 생각하지만 지구를 살리기 위해서는 꼭 필요한 존재들이라는 것을 알게 될 것입니다. 지금까지의 환경동화와는 느낌이 다른 재미있고 기발한 상상력의 책을 만나보세요,10526,BOOK
두 얼굴의 나라 미국 이야기,"정범진, 허용우 (지은이), 정수연 (그림)",48900,국내도서>어린이>문화/예술/인물>세계문화,9788937814396,"어린이들이 미국을 이해하기 위해 꼭 알아야 하는 미국의 역사, 사회, 문화를 담았다. 미국은 서양 세력 중에서 조선과 최초로 조약을 맺은 나라로, 지금까지 긴밀한 관계를 맺고 있는 국가. 미국에 대한 환상이나 배척이 아니라, 서로를 존중하는 한미 관계를 만들도록 노력했다.",,5205,BOOK
무기 팔지 마세요!,"위기철 (지은이), 이희재 (그림)",48874,국내도서>어린이>동화/명작/고전>국내창작동화,9788972787044,"어느 날, 보미는 교실로 들어서다가 경민이가 쏜 플라스틱 비비탄을 얼굴에 맞는다. 보미는 화가 나서 경민이에게 따지지만, 경민이를 포함한 반 남자아이들은 보미의 말에 아랑곳하지 않고 장난감총으로 계속 장난을 친다. 그래서, 보미는 친구들과 '평화 모임'을 만들어 장난감 무기 수거운동을 벌인다.","고학년을 위한 동화『무기 팔지 마세요!』. 이 책은 평화를 바라는 어린이들의 목소리를 담고 있다. 장난감 권총으로 쏜 플라스틱 비비탄을 얼굴에 맞고 친구들과 '평화 모임'을 만든 보미의 이야기와, 무기 판매 금지를 전세계 사람들에게 알리는 제니의 이야기가 수록되어 있다.",14566,BOOK
모방범 1,"미야베 미유키 (지은이), 양억관 (옮긴이)",51058,국내도서>소설/시/희곡>추리/미스터리소설>일본 추리/미스터리소설,9788954601863,"<이유>, <이코>, <용은 잠들다>의 작가 미야베 미유키의 최고작이자 일본 추리소설계의 전설과도 같은 작품이다. 범죄를 둘러싼 사회적인 문제들을 전면에 내세웠던 전작들과 달리 <모방범>이 그리는 것은 원한이나 물욕과는 무관한, 말 그대로 '이유 없는 범죄'이다. 미야베 미유키는 사건과 연관된 모든 사람들을 치밀하게 묘사하며, 단순한 범죄극이 아닌 한 편의 거대한 인간 드라마를 만들어낸다.","<화차>, <이유>, <용은 잠들다>의 작가 미야베 미유키의 추리소설. 탄탄한 구성력과 날카로운 인간상의 표현력, 흡입력 있는 전개가 돋보이는 작품이다. 원한이나 물욕과는 무관한, '이유 없는 범죄'를 다루고 있으며, 2002년 일본에서 원작을 바탕으로 영화화되기도 했다. <BR><BR>도쿄의 한 공원에서 쓰레기통에 버려진 여자의 오른팔과 핸드백이 발견된다. 핸드백의 주인은 삼 개월 전에 실종된 후루카와 마리코라는 20세 여성. 그러나 범인은 오른팔과 핸드백의 주인이 각각 다른 사람이라는 사실을 텔레비전 방송국에 알려오고, 피해자의 외할아버지 아리마 요시오를 전화로 농락한다.<BR><BR>그는 있는 힘을 다해 범인에게 대항하지만, 끝내 범인에 의해 마리코의 유해가 세상에 공개된다. 방송을 통해 스스로의 범죄를 자랑하는 범인의 목소리에 전 일본은 경악을 금치 못하고, 경찰 수사는 난항을 거듭하는데…. <1권>",6920,BOOK
Why? 곤충,"이광웅 (지은이), 박종관 (그림), 최임순 (감수)",48869,국내도서>어린이>과학/수학/컴퓨터>생물과 생명,9788930205412,"지구상의 동물 중에서 가장 많은 것은 무엇일까? 바로 곤충이다. 대부분 몸집이 작고 1센티미터도 안 되는 것이 태반이지만 번식력이 강해서 알려진 것만 약 80만 종에 이른다. 곤충의 생김새, 곤충의 생장, 곤충의 생태로 나누어 곤충에 관한 갖가지 궁금증을 재밌는 만화와 생생한 사진으로 구성하였다.",,5133,BOOK
