title,author,genre_id,genre,ISBN,description_aladin,description_naver,salesPoint,mallType
피쉬 스토리,"이사카 고타로 (지은이), 김소영 (옮긴이)",50998,국내도서>소설/시/희곡>일본소설>1950년대 이후 일본소설,9788901066240,"<사신 치바>, <중력 삐에로>의 작가 이사카 고타로의 첫 소설집. 데뷔 직후에 쓴 단편에서 2007년 작까지, 총 네 편의 중단편 작품이 수록되었다. 주인공도 다르고 상황도 연결되지 않은, 완전히 독립된 이야기들이다. 이사카 고타로 소설 특유의 감각적인 대화와 애틋한 감정, 맑고 천진한 분위기를 느낄 수 있다.","'이사카 월드'의 마술같은 세계가 집약된 첫 단편집!

〈명랑한 갱이 지구를 돌린다〉의 작가, 이사카 코타로의 첫 단편집.  데뷔 직후에 쓴 단편 〈동물원의 엔지〉에서부터 2007년에 쓴 최신작 〈포테이토칩〉까지, 총 네 편의 중단편이 수록되어 있다. 작가 특유의 수수께끼를 해결하는 작품부터, 엉뚱한 캐릭터로 인생의 의미를 파헤치는 작품까지. 거의 6년 간에 걸쳐 써왔던 작품이 실려 있어 이사카 코타로의 궤적을 한눈에 파악할 수 있다.

전작인 〈사신 치바〉나 〈칠드런〉과는 달리 각각의 작품은 주인공도 다르고 상황도 연결되지 않은 독립된 형태를 보여준다. 표제작 〈피쉬스토리〉는 한 의문의 작가가 남긴 소설이 남긴 문장이 시공간을 넘어 변주되면서, 각각의 등장인물들의 인생에 개입한다. 만년에 폐가에 칩거했다는 한 소설가의 문장이, 무명의 록밴드가 남긴 마지막 노래의 가사가 되고, 그 연결고리들의 숨겨진 관계성 안에서 사람들의 꿈과 희망이 아름답게 그려진다.

이 밖에 매일 밤 동물원 바닥에 누워서 자는 수수께끼에 싸인 남자의 정체를 추적하는 〈동물원의 엔진〉, 행방불명된 남자를 찾는 사이 오래된 마을의 기묘한 풍습을 알게 되는 도둑의 이야기 〈새크리파이스〉, 빈집털이 남자와 그의 친구들이 등장, 후보선수로 전락한 야구선수를 구제하기 위해 분투하는 〈포테이토칩〉 등이 실려 작가 특유의 감각적인 대화와 애틋한 감정, 맑고 천진한 분위기를 느낄 수 있다. 〈양장제본〉",516,BOOK
사과가 쿵! (보드북),"다다 히로시 (지은이), 정근 (옮긴이)",35139,국내도서>유아>그림책>나라별 그림책>일본,9788943306090,"숲 속에 커다란 사과가 떨어지자 개미, 너구리, 사자와 같은 많은 동물들이 사과를 나눠 먹는다. 사각사각, 야금야금, 냠냠냠 등의 의성어를 다양하게 접할 수 있다. 아기들이 마음껏 봐도 찢어지거나 구겨지지 않고 책을 장난감처럼 다루는 아기들을 위해 둥근 모서리로 안전하게 제작한 그림책이다.","어느 날 커다란 사과가 '쿵' 떨어졌어요!

일본 태생의 다다 히로시의 『사과가 쿵!』. 1996년에 출간된 밀리언셀러 〈사과가 쿵!〉을 보드북으로 탄생했습니다. 유아가 바라는대로 마음껏 봐도 찢어지거나 구겨지지 않도록 안전하게 만들었습니다. 

개미, 두더지, 다람쥐, 토끼, 돼지, 여우, 너구리, 악어, 사자, 곰, 기린, 코끼리 등 유아가 좋아하는 동물들이 등장하여 커다란 사과를 갉아먹는 단순한 구조 속에 맛깔스러운 의성어와 의태어를 담아냈습니다. 유아의 호기심을 불러일으키면서 어휘력을 풍부하게 발달시켜줍니다.

어느 날 커다란 사과가 떨어졌어요. 가장 먼저 두더지가 사과를 갉아먹었어요. 토끼, 다람쥐, 돼지도 찾아와 사과를 갉아먹었지요. 악어, 사자, 기린, 그리고 코끼리도 와서 사과를 갉아먹었답니다. 그런데 갑자기 비가 내리는데……. 보드북.",44757,BOOK
늑대가 들려주는 아기돼지 삼형제 이야기 - 3~8세,"존 셰스카 (지은이), 레인 스미스 (그림)",35135,국내도서>유아>그림책>나라별 그림책>미국,9788943302245,잘 알려진 <아기돼지 삼형제>를 늑대의 시각에서 바라본 패러디 동화. 튼튼한 벽돌집을 지어 늑대의 침입을 물리침으로써 유비문환의 교훈을 가르쳐 주는 <아기돼지 삼형제>이야기를 늑대의 입장에서 바라본다면 어떻게 달라질까?,"옛이야기『아기 돼지 삼 형제』를 재미있게 패러디한 그림책!『늑대가 들려주는 아기돼지 삼형제』는 튼튼한 벽돌집을 지어 늑대의 침임을 물리친 아기 돼지 삼형제의 이야기를, 늑대의 입장에서 풀어갑니다. 어린이에게 성실함과 유비무환의 교훈을 가르쳤던 그림책은 늑대의 입장에서 보여줌으로써, 새로운 해석의 여지를 낳게 됩니다. 관점에 따라 이야기가 얼마나 달라질 수 있는지를 명확하게 보여주는 작품입니다.",19900,BOOK
스케치 쉽게 하기 - 풍경 드로잉 - 그림 그리는 즐거움을 배운다!,김충원 (지은이),50987,국내도서>예술/대중문화>미술>미술 실기,9788972215271,"구도와 비례부터 소재별 드로잉 기법까지, 풍경 드로잉에 필요한 기초 훈련 및 다양한 실전 테크닉을 담았다. '기초 드로잉', '인물 드로잉' 편에 이어, '스케치 쉽게 하기' 시리즈의 세 번째 책으로 출간되었다.  본문에서 배운 이론을 손에 익힐 수 있도록 구성한 '드로잉 연습장'이 함께 실려 있다.","세상을 표현하는 또 하나의 방법, 풍경 드로잉

김충원의『스케치 쉽게 하기』시리즈. 기초 드로잉부터 실용적인 테크닉까지 스케치의 다양한 노하우를 알려준다. 우리나라의 대표적인 미술 교육가이자 일러스트레이터인 저자가 오랜 기간 동안 사람들에게 미술을 지도하며 쌓아 온 노하우를 제시하고 있다. 사물을 인식하는 새로운 방법과 개성 있게 표현하는 능력을 키워주고, 생활 속에서 다양하게 활용되는 드로잉을 보여준다. 

〈풍경 드로잉〉 편에서는 현장에서 활용할 수 있는 테크닉을 위주로, 풍경 드로잉의 기초 지식을 전해준다. 풍경 드로잉에서 꼭 필요한 구도와 비례에 대해 알기 쉽게 설명하고, 드로잉 재료와 풍경의 소재에 따른 스케치 기법을 자세히 다루고 있다. 자연 풍경뿐만 아니라 창문 밖이나 거리의 모습, 벤치에 앉아 바라보는 공원 등 일상적인 풍경들에 그 순간의 특별한 분위기를 담아 스케치하는 방법을 알려준다. 

또한 흔히 사용되는 채색 재료인 색연필과 투명 수채 물감을 이용해 빠르고 간단하게 채색을 마무리할 수 있는 기법과 스케치 선의 본래 느낌을 살리며 채색하는 기법을 소개하고 있다. 아울러 직접 연습할 수 있도록 만든 실전 편 '풍경 드로잉 연습장'을 통해 그림이 완성되는 과정을 보여주고, 따라 그리기 쉽게 밑그림을 첨부하였다.",6576,BOOK
살아 있는 것은 다 행복하라 - 법정 잠언집,"법정(法頂) (지은이), 류시화 (엮은이)",51637,국내도서>종교/역학>불교>불교 문학,9788995757703,"2006년, 법정 스님의 출가 50년을 기념하여 출간된 잠언집. 무소유, 자유, 단순과 간소, 홀로 있음, 침묵, 진리에 이르는 길과 인간 존재에 대한 성찰을 담았다. 류시화 시인이 스님이 남긴 글과 법문들 중에서 130여 편을 선별하여 엮었다. 사진작가 마이클 케나가 찍은 사진이 글과 함께 어우러져 있다.",,21229,BOOK
설득의 심리학 - 사람의 마음을 사로잡는 6가지 불변의 법칙,"로버트 치알디니 (지은이), 이현우 (옮긴이)",70226,국내도서>자기계발>협상/설득/화술>설득,9788950905224,"다른 사람이 베푼 호의를 그대로 갚아야 한다는 강박관념이 작용하는 상호성의 법칙, 말이나 행동에 일관성을 보여야 한다는 부담을 느낀다는 일관성의 법칙, 예쁘면 모든 것이 용서된다는 호감의 법칙 등 인간심리를 여실히 보여준다.","이 책은 누군가를 설득하기 위해서 사람의 심리를 이용하는 방법을 담고 있다. 저자는 자신의 이론을 여러가지 사례와 재미있는 상황들로 증명하고 있다. 상호성의 법칙, 일관성의 법칙, 사회적 증거의 법칙, 호감의 법칙, 권위의 법칙, 희귀성의 법칙 등 사람의 마음을 사로잡는 6가지 불변의 법칙을 강조하고 있다.",45506,BOOK
연세 초등국어사전,연세대학교 언어정보개발연구원 (엮은이),48917,국내도서>어린이>어린이 사전/도감>국어사전,9788900104059,,,12119,BOOK
픽션들,"호르헤 루이스 보르헤스 (지은이), 황병하 (옮긴이)",50920,국내도서>소설/시/희곡>스페인/중남미소설,9788937401763,<픽션들>은 2백 페이지도 채 되지 않는 얇은 책이다. 그러나 그 속에는 엄청난 상상의 세계가 펼쳐져 있다. 그 상상은 심심풀이 환상이 아니라 삶과 세상의 미궁에 대한 깊은 통찰과 독창적인 사유로 이루어진 상상이다. <픽션들>은 20세기 문학에서 돋보이는 큰 별이다.,20세기 문학의 대명사 보르헤스의 문학적 본령이 본격적으로 드러나는 그의 두번째 소설집. 이 책을 통해 독자들은 전혀 접해 보지 못했던 경이롭고 충격적인 미학의 세계와 조우하게 된다.,6881,BOOK
깨진 유리창 법칙 - 사소하지만 치명적인 비즈니스의 허점,"마이클 레빈 (지은이), 김민주, 이영숙 (옮긴이)",1632,국내도서>경제경영>마케팅/세일즈>마케팅/브랜드,9788990872227,"똑같은 제품이나 서비스를 제공하는데 어떤 회사는 승승장구하고 어떤 회사는 실패하는가? 해답은 바로 '깨진 유리창'에 숨어 있다. '깨진 유리창 법칙'이란 고객이 겪은 한 번의 불쾌한 경험, 한 명의 불친절한 직원, 말뿐인 약속 등 기업의 사소한 실수가 결국은 기업의 앞날을 뒤흔든다는 것이다.","<b>사소하지만 치명적인 비즈니스의 허점, 깨진 유리창!</b>

오늘날 많은 기업들은 위기를 운운하며 분주히 변화를 꾀하고 있다. 그러나 미래의 경영 전략이나 원대한 비전에는 많은 노력과 시간을 투자하면서도 정작 현재 기업을 갉아먹고 있는 사소하나 치명적인 것, 즉 깨진 유리창들에는 눈을 돌리지 못하고 있다. 

《깨진 유리창 법칙》은 범죄학에 도입해 큰 성과를 거둔 '깨진 유리창 이론'을 비즈니스 세계에 접목한 신선하면서도 예리함이 돋보이는 책이다. 깨진 유리창 법칙이란 간단히 말해 고객이 겪은 한 번의 불쾌한 경험, 한 명의 불친절한 직원, 정리되지 않은 상품, 말뿐인 약속 등 기업의 사소한 실수가 결국은 기업의 앞날을 뒤흔든다는 법칙이다.

본문은 '깨진 유리창 이론'을 기업경영과 조직관리에 적용하는 방법을 제시한다. 즉 기업이나 조직에 깨진 유리창 문제는 어떻게 그리고 왜 발생하는지, 깨진 유리창은 어떻게 수리를 해야하는지, 깨진 유리창을 신속히 수리한 기업이 얼마나 큰 보상을 얻을 수 있는지에 대해 생생하게 보여주고 있다.",10782,BOOK
"공부의 달인, 호모 쿵푸스 - 공부하거나 존재하지 않거나!",고미숙 (지은이),51378,국내도서>인문학>교양 인문학,9788976828019,"인문학의 여러 분야를 각각 4권의 책에서 말하는 '인문학 인생역전 프로젝트!' 시리즈가 출간되었다. 인문학 분야의 재기발랄한 젊은 학자들이 모여 각각 예술과 학문, 글쓰기와 자기표현으로서의 '언어', 즐거움과 욕망, 삶의 여유를 반영하는 '놀이' 의 4가지 주제를  이야기하고 있다.","삶을 만난 공부, 호모 쿵푸스

〈공부의 달인, 호모 쿵푸스〉는 '공부'에 새로운 의미를 부여하는 책이다. 기존에 우리가 갖고 있던 공부에 대한 편견을 깨고 공부에 대한 새로운 의미를 정립하였으며, 새로운 공부 방법을 통해 인생역전할 수 있음을 주장하고 있다. 저자는 자신의 체험을 바탕으로, 이전과는 차별화된 공부의 의미와 실험적인 공부 방법을 제시한다. 

이 책은 근대 이후 축소된 공부의 의미에서 벗어나 '앎의 즐거움'과 '배움의 열정'에서 공부를 시작할 것을 주장하고 있다. 고전에서 배운 지혜와 고전을 응용한 공부법을 제시하여 근대적 공부를 넘어선 새로운 공부의 세계로 안내한다. 또한 여러 인물들의 일상생활 공부를 함께 살펴보며, 공부가 우리 삶에 기여하는 구체적인 현장을 보여준다.

이를 통해 저자는 수단으로서의 공부가 아니라 공부가 삶이 되는 공부를 이야기한다. 일상의 모든 순간을 앎의 자원으로 삼는, 즉 삶을 위한 공부가 진정한 공부라고 강조하고 있다. 지식의 사적 소유를 해체하고 배움과 가르침의 경계가 사라진 공부, 오직 배움의 열정만으로 공부해서 남에게 퍼주는 공부의 목적을 제시하는 책이다.

〈font color=""1e90ff""〉☞ 호모 쿵푸스(Homo Kungfus)〈/font〉
단순히 머리로만 하는 것이 아니라, 일상 전체를 온몸으로 공부한다는 의미에서 다시 정립된 '공부하는 인간'이다. 호모 쿵푸스에게 공부는 쿵푸(功夫)처럼 온몸으로 배우는 공부, 앎에 대한 열정과 배움의 기쁨으로 인생의 모든 순간을 학습하는 공부이다.",6585,BOOK
언젠가 너도,"앨리슨 맥기 (지은이), 피터 H. 레이놀즈 (그림), 김경연 (옮긴이)",35135,국내도서>유아>그림책>나라별 그림책>미국,9788954603294,"축복처럼 세상에 태어난 아이의 첫 순간부터, 아이가 자라나는 매 순간순간을 아름답게 그리는 그림책. ""나의 뼛속으로부터 우러나온 글""이라고 밝히는 저자의 말처럼, 세상 모든 어머니들이 공감할 수 있는 이야기를 담았다. 2007년 2월 미국에서 출간 이후 11주 동안 뉴욕 타임즈 베스트셀러를 기록했다.","모녀 관계를 따뜻하게 바라보는 그림책! 
세상 모든 엄마와 딸에게 바치는 가슴 뭉클한 송가

『언젠가 너도』는 갓 태어난 딸에게 앞으로 맞닥뜨리게 될 순간을 조근조근 들려주는 그림책입니다. 짧고 간결한 글은 기쁘고, 설레고, 아프고, 애틋한 순간을 가슴에 콕 와닿게 풀어냈습니다. 그에 걸맞는 그림은 사진첩을 보는 듯한 느낌을 전달합니다. 

어느 날, 새근새근 잠든 딸의 손가락을 세어 보던 엄마는 딸 앞에 펼쳐질 미래를 사진첩 넘기듯 한 장면 한 장면씩 떠올립니다. 거기에는 아기였던 아이가 성장하면서 겪게 될 순간들이 펼쳐집니다. 그 때마다 엄마는 옆에서 묵묵히 지켜보겠다고 말합니다. [양장본]",2800,BOOK
칼의 노래 1,김훈 (지은이),51123,국내도서>소설/시/희곡>역사소설>한국 역사소설,9788984982727,"2001년 동인문학상 수상작. 이견의 여지가 없는 신화, 이순신. 이순신은 헤아릴 수 없이 많은 적선들 앞에 초라한 숫자의 배를 몰고 나가 세계 해전사에 유례를 찾을 수 없는 대승을 거둔 명장이다. 한 국가의 운명을 단신의 몸으로 보전한 당대의 영웅이며, 정치 모략에 희생되고, 장렬히 전사한 인물로 알려져 있다.","2001년 동인문학상 수상작. 한 국가의 운명을 단신의 몸으로 보전한 당대의 영웅이자, 정치 모략에 희생되어 장렬히 전사한 명장 '이순신'의 생애를 다룬 소설이다. 저자는 당대의 사건들 속에서 '이순신'을 지극히 인간적인 존재로 표현해 내며, 사회 안에서 개인이 가질 수 있는 삶의 태도에 이야기한다. 또한 공동체와 역사에 책임을 져야 할 위치에 선 자들이 지녀야 할 윤리, 문(文)의 복잡함에 대별되는 무(武)의 단순미, 4백 년이라는 시간 속에서도 달라진 바 없는 한국 문화의 혼미한 정체성을 미학적으로 그려내고 있다.",6017,BOOK
누구나 10kg 뺄 수 있다,유태우 (지은이),53514,국내도서>건강/취미>다이어트,9788915049291,"약물이나 치료가 아닌, 자신의 의지로 체중을 줄이는 방법을 소개한다. 첫 3개월만에 6kg를 감량, 전체 6개월이 걸리는 프로젝트는 몸에 무리가 가지 않는 다이어트이다.","서울대학교병원 건강증진센터 비만 환자 치료법을 담고 있는『누구나 10KG 뺄 수 있다』. 이 책에는 지난 4~5년간 서울대학교병원 가정의학과 유태우 박사가 실제로 시행하고, 저자  스스로도 감량하기 위해 사용한 방법을 담고 있다. 체중감량을 위해서 적게 먹는 법, 이에 따른 몸의 변화와 그 대처법까지 상세하게 설명하고 있다.
<BR>
<BR>《누구나 10KG 뺄 수 있다》는 실패하는 다이어트법, 누구나 10KG는 뺄 수 있는 프로젝트법, 저자의 6개월 프로젝트 경험기, 특별한 사람을 위한 프로그램 등으로 구성되었다.",9755,BOOK
"2,000원으로 밥상차리기",김용환 (지은이),53472,국내도서>요리/살림>생활요리,9788931426243,"2000원으로 간단 밥상 차리기, 3000원으로 유명 맛집 흉내내기, 시간 날 때 만드는 밑반찬, 독신남의 요리 노트 등 적은 비용으로 간단하고 스피디하게 차릴 수 있는 메뉴를 소개한다.",-,28490,BOOK
첫 단추 - 내가 커서 어른이 되어도 변하지 않을 이야기,"고정욱 (지은이), 유준재 (그림)",48849,국내도서>어린이>초등5~6학년>자기계발,9788946416253,"작가 고정욱이 어른들의 세계, 성장의 문턱에서 우리 어린이들이 만나게 되는 삶의 비밀, 숙제들을 첫 단추를 제대로 끼워 마지막 단추까지 잘 채워나가듯 풀어나가길 바라는 마음에서 첫 단추처럼 소중한 이야기를 동서양의 위인 29명 속에서 찾아내어 소개하고 있다.
",,431,BOOK
코믹 메이플 스토리 오프라인 RPG 21,"송도수 (지은이), 서정은 (그림)",49995,국내도서>어린이>TV/만화/영화>만화 일반,9788953291409,,《코믹 메이플 스토리 오프라인 RPG》시리즈 제21권. 본 시리즈는 인기 온라인 게임 '메이플스토리'의 캐릭터와 함께 신나는 모험을 경험하는 코믹 만화책입니다. 도도 일행과 함께 끝나지 않을 것 같은 모험 속으로 떠나 보세요~!,2476,BOOK
앨빈 토플러 청소년 부의 미래,"앨빈 토플러, 하이디 토플러 (지은이), 이노을 (엮은이), 유남영 (그림), 김주현 (감수)",9671,국내도서>청소년>청소년 경제,9788935206902,"제4의 물결을 헤쳐 갈 미래의 주인공들을 위한, <부의 미래> 청소년 판. 중고등학교 사회 교과서에 수록되기도 한 <제3의 물결>에 이은 앨빈 토플러의 저작으로 과거와 현재, 미래의 문명과 역사를 아우르며 세계를 바라보는 넓고 깊은 시각을 제공한다. 사전 지식 없이도 막힘없이 읽고, 세계의 흐름을 한눈에 파악할 수 있도록 구성했다.","제4물결을 헤쳐 갈 미래의 주인공들을 위한 미래 교과서이자 지식 참고서!

『미래쇼크』『제3의 물결』을 통해 지식기반 사회의 도래를 예견했던 앨빈 토플러. 그가 15년 만에 내 놓은 또 하나의 대작『부의 미래』가 대한민국 청소년들을 위해 새롭게 태어났다.『청소년 부의 미래』는 다가오는 제4물결의 주인공이 될 청소년들에게 변화무쌍한 오늘의 세계와 예측불허의 미래를 흥미진진하게 펼쳐 보인다.

이 책에서 토플러는 미래의 부(富)가 어떻게 변화하고 우리의 삶에 어떤 영향을 미칠지, 새로운 부의 창출 시스템은 어떠한지를 예견한다. 단순히 경제학적 관점에서의 부가 아닌, 문화와 문명이라는 좀 더 커다란 구조 속에서 우리 생활 곳곳에 영향을 미치는 부가 어떻게 형성되고, 어떻게 변화하며, 또 어떻게 이동하는지 등을 제시한다.

그리고 우리 삶의 변화에 대한 예측에 그치지 않고 거대한 부의 혁명 안에서 우리가 살아 남기 위해 무엇을 해야 하는지도 조언해준다. 미래의 부정적 측면을 간과하지 않으면서도 희망적 메시지를 제시하는 이 책은 토플러의 해박한 지식과 통찰력으로 인한 깊이 있는 문장들로 청소년들의 지적 욕구를 한껏 채워줄 것이다.",6893,BOOK
펀드 투자로 행복한 미래를,강창희 (지은이),2225,국내도서>경제경영>재테크/투자>재테크/투자 일반,9788991874015,"미·일 선진국의 경험을 보더라도 개인 투자자들이 단기 시황 전망을 근거로 투자해서 성공한 사례는 많지 않다. 이 책은 이러한 선진 증시의 사례를 참고로 해서, 지금과 같은 저금리·고령화 시대에 어떻게 생애설계를 하고, 어떻게 그에 맞는 자산운용을 해나가야 하는가에 대해 주로 펀드 투자를 중심으로 소개한다.",,1010,BOOK
동유럽에서 보헤미안을 만나다 - 체코에서 루마니아까지 동유럽 일주 여행,이기중 (지은이),110289,국내도서>여행>동유럽여행>동유럽여행 에세이,9788992109093,동유럽을 40일동안 일주한 여행기이다. 저자는 템플대학에서 영상인류학과 영화를 전공하고 전남대 인류학과에서 교수로 재직 중이다.,,457,BOOK
AAT(American Accent Training) (본책(한국어판) 1권 + 본책(영문판) 1권 + Audio CD 5장) - 미국식 영어발음 집중훈련 워크북,"앤 쿡 (지은이), 전창훈 (옮긴이)",49837,국내도서>외국어>영어듣기/말하기,9788991141278,"현재 미국 아마존 발음청취 부문 베스트셀러 1위를 고수하고 있는 AAT는 미국에 유학 가면 가장 먼저 공부해야 하는 책으로 꼽힌다. 일본 아마존 원서 분야 최장기 베스트셀러이며 마이크로소프트, 델, GE 등 유수 기업들의 직원교육용 교재로도 꾸준히 채택되고 있는 발음 분야의 Grammar in Use 같은 책이다.",,5611,BOOK
선인장 호텔,"브렌다 기버슨 (지은이), 메건 로이드 (그림)",35135,국내도서>유아>그림책>나라별 그림책>미국,9788985675215,뜨겁고 메마른 사막에서 200년 이상을 살았던 사구아로 선인장의 일생을 그리고 있다. 선인장은 평생 동물들을 지켜주는 안식처의 역할을 담당한다. 자연 속에서 공생하는 모습을 통해 생태계의 순환을 아이들에게 쉽고 깊이 있게 이야기한다.,,14219,BOOK
뉴토익이 만만해지는 토마토 실전모의고사 (본책 + 오답꼭지책 + CD),"김지연, 이보영 (지은이)",49858,국내도서>외국어>토익>실전,9788959970513,"ETS에서 공개한 뉴토익 샘플을 철저히 분석, 뉴토익 경향에 꼭 맞춘 문제만으로 총 2회분을 수록했다. 또한 쉽고 자세한 해설도 함께 한다. 부록으로 중요 어휘 및 문법 부가 내용들이 담긴 '오답꼭지책'과 문제풀이용 테이프를 제공하며, 홈페이지를 통해 전 파트를 녹음한 MP3 파일을 무료로 다운 받을 수 있다.",,2481,BOOK
"PING 핑 - 열망하고, 움켜잡고, 유영하라!","스튜어트 에이버리 골드 (지은이), 유영만 (옮긴이)",70216,국내도서>자기계발>성공>성공학,9788901054698,"자신의 꿈을 실현시키기 위해 새로운 연못을 찾아 떠나는 개구리 '핑' 그의 파란만장한 여정을 통해 인생이란 무엇인가, 그리고 삶의 고비마다 우리는 어떤 선택을 하며 어떻게 살 것인가를 깊이 반추해 보게 하는 감동적인 책. '무언가가 되기(be) 위해서는, 반드시 무언가를 해야만(do) 한다.'",,12250,BOOK
똥벼락,"김회경 (글), 조혜란 (그림)",35134,국내도서>유아>그림책>나라별 그림책>한국 그림책,9788971967751,"'똥과 도깨비'라는 전래동화의 소재를 절묘하게 조화시킨 그림 동화집. 옛날 옛그림을 연상시키는 그림체가 화면을 가득 채우고, 단순하면서도 옛이야기 특유의 과장을 살린 글솜씨가 돋보이는 그림책이다.","30년 동안 머슴으로 일하고 풀 한 포기 자라지 않는 돌밭을 새경대신 받은 돌쇠 아버지는 손에 피가 나도록 돌을 골라내고 거름으로 쓸 똥도 모았습니다. 하루는 잔칫집에 갔다오다, 산 중턱에 이르러 참았던 똥을 눈다는 것이, 오줌까지 세차게 뻗쳐 나와 낮잠 자던 산도깨비 얼굴에 폭포처럼 쏟아지고 말았답니다. 다 뭉개진 똥을 너무 아까워하는 돌쇠 아버지를 보고 안되어 보였던 산도깨비는 중얼중얼 주문을 외기 시작하는데... 해학적이면서도 전통적인 그림이 인상적인 유아용 그림동화.",21535,BOOK
