title,author,genre_id,genre,ISBN,description_aladin,description_naver,salesPoint,mallType
동굴에서 살아남기,"문정후 (그림), 김인규, 우성진 (감수)",112080,국내도서>어린이>학습만화,9788937814181,"서바이벌 말화 과학상식 세번째 시리즈가 시작되었다. 3차 시리즈의 주인공은 지칠 줄 모르는 체력과 낙천적인 성격의 모모. 똑똑한 소녀 아리, 모모의 형인 준모, 음악을 전공한 미모의 대학생 아지가 모모의 '동굴탐험' 모험에 동참한다. 이번 권의 무대는 말레이시아 사라왕주의 물루 국립동원이다.",,5995,BOOK
난장이가 쏘아올린 작은 공 (200쇄 기념 한정판),조세희 (지은이),50993,국내도서>소설/시/희곡>한국소설>2000년대 이후 한국소설,,,,225,BOOK
똥떡,"이춘희 (글), 박지훈 (그림), 임재해 (감수)",35134,국내도서>유아>그림책>나라별 그림책>한국 그림책,9788955859355,"옛아이들이 겪었던 일들을 오늘날에 되살려 보여주는 그림책 시리즈 '국시꼬랭이 동네'의 첫번째 그림책은 똥통에 빠지면 똥떡을 해 뒷간 귀신에게 비는 풍습을 소재로, 옛아이들의 재미있는 일상을 보여준다. 뒷간에 사는 성질 나쁜 각시 귀신 때문에 똥통에 빠진 준호의 이야기를 수묵채색화풍의 그림을 통해 보여준다.",,10257,BOOK
바다에서 살아남기,"코믹컴 (글), 정준규 (그림)",112080,국내도서>어린이>학습만화,9788937812569,두리 일행은 지구에서 가장 깊은 바다인 마리아나 해구로 보트 여행을 떠난다. 기분 좋은 여행도 잠시 두리 일행은 보트가 침몰해서 바다에 표류하게 된다. 이들이 가지고 있는 식량은 바나나 두 덩이와 1.5 리터 물 두 통이 전부. 뜨거운 열대의 바다에서 어떻게 살아남아야 할까?,,7645,BOOK
노빈손의 시끌벅적 일본 원정기,"한희정 (지은이), 이우일 (그림)",1141,국내도서>청소년>청소년 문화/예술,9788958071938,"이집트, 중국, 로마에 이어 일본에서 또 실종된 노빈손의 시끌벅적한 모험담. 세계여행을 하던 노빈손은 독도가 일본 땅이라는 말을 듣고 혈압이 올라 뗏목을 타고 동해 바다를 건너 독도에 태극기를 꽂으러 간다. 그런데 거친 파도에 시달린 노빈손이 도착한 곳은 과거의 일본이다.","노빈손 세계 역사탐험 시리즈 네번째, '일본편'. 검은 쫄바지에 닌자로 돌아온 노빈손의 이번 임무는 사라진 아이들을 찾는 것. 전설 속 요괴 우무베의 짓일까? 아니면 숨겨진 음모라도? 화려한 가부키 공연장에서 우람한 선수들의 스모 경기장까지, 흥미로운 일본의 역사와 문화를 배경으로 펼쳐지는 노빈손의 시끌벅적 일본 원정기....",5717,BOOK
싹싹싹,"하야시 아키코 (지은이), 하야시 아키코 (그림)",35139,국내도서>유아>그림책>나라별 그림책>일본,9788970940557,"하야시 아키코 시리즈 5권. 숟가락질이 서투른 아기가 이유식을 혼자서 먹다가 자꾸 흘리고, 토끼 인형, 곰 인형이 흘린 수프는 아기가 싹싹 닦아주고, 아기의 입은 엄마가 싹싹싹 닦아준다. 어른들의 행동을 따라하며, 혼자서 먹어보려는 아기의 행동을 묘사한 그림책이다.","하야시 아키코 시리즈 5권. 숟가락질이 서투른 아기가 이유식을 혼자서 먹다가 자꾸 흘리고, 토끼 인형, 곰 인형이 흘린 수프는 아기가 싹싹 닦아주고, 아기의 입은 엄마가 싹싹싹 닦아준다. 어른들의 행동을 따라하며, 혼자서 먹어보려는 아기의 행동을 묘사한 그림책이다.",26503,BOOK
정재승의 과학 콘서트 - MBC 느낌표 선정도서,정재승 (지은이),51002,국내도서>과학>기초과학/교양과학,9788988165348,"이 책은 때론 '매우 빠르고 경쾌하게', 때론 '느리게' 펼쳐내는 과학의 교향곡이다. 4년 전 <물리학자는 영화에서 과학을 본다>를 통해 이미 과학과 인문학, 대중문화를 넘나드는 폭넓은 조예를 보여주었던 그가 이 책을 통해 다시 한번 글쟁이로서의 자질을 유감없이 발휘하고 있다.",,17724,BOOK
"조커, 학교 가기 싫을 때 쓰는 카드 - 2단계","수지 모건스턴 (지은이), 미레이유 달랑세 (그림), 김예령 (옮긴이)",48877,국내도서>어린이>동화/명작/고전>외국창작동화,9788932011974,"새로운 사람을 만나고, 뭔가 재미있는 일이 일어날 것만 같은 새학기 첫 날, 아이들은 주름투성이에다 배가 공만하고 흰머리가 사방으로 뻗쳐 있고, 코끝에는 조그만 안경까지 걸친 늙은 선생님을 담임선생님으로 맞아야 했다.","기발한 아이디어로 학교가는 것이 즐거워진다!

『조커: 학교가기 싫을 때 쓰는 카드』는 기발한 아이디어로 아이들에게 교과서에서는 결코 배울 수 없는 가르침을 주는 할아버지 선생님의 이야기를 담았다. 새 학기가 시작되어 기대와 두려움을 갖고 새로운 담임 선생님을 기다리는 아이들. 그러나 아이들 앞에 나타난 노엘 선생님은 그들의 기대를 여지없이 무너뜨린다. 주름투성이에다가 배가 공만하고 희머리가 사방으로 뻗친 할아버지 선생님이었다. 실망이 너무 커서 울 지경인 아이들에게 선생님은 아이들 한명 한명의 책상 위에 선물꾸러미를 올려놓는데…….",28070,BOOK
Why? 날씨,"이광웅 (지은이), 박종관 (그림)",48867,국내도서>어린이>과학/수학/컴퓨터>과학 일반,9788930205443,,,3451,BOOK
아마존에서 살아남기,"최덕희 (지은이), 강경효 (그림)",112080,국내도서>어린이>학습만화,9788937810787,,"사람들은 극한 상황에 처하게 되면 어떤 방법으로 생존해 나갈까요?
이 책은 힘들고 어려운 상황 속에서 그 과정을 설명하면서 그 안에 숨어 있는 과학적 원리들을 찾아냅니다.

아이들의 학습 효과를 극대화시킬 수 있도록 기획되었으며, 흥미로운 만화에 학습적인 요소를 넣어서 보다 재미있는 과학 정보를 전해 줍니다.",9142,BOOK
초등학교부터 시작하는 논술 오디세이 1 - 생각여행의 기초,어린이철학교육연구소 (엮은이),48945,국내도서>어린이>책읽기/글쓰기>논리/논술,9788935654444,미국 하버드대학 교수들이 중심이 되어 개발한 사고력 개발 프로그램. 초등학생을 대상으로 1단계부터 6단계까지 여섯권으로 나누어 난이도별로 프로그램을 적용할 수 있도록 했다. 초등학교 1학년부터 6학년까지 누구나 1단계에서 시작해 차례차례 가능한 단계까지 프로그램을 활용하면 된다.,"총 6단계로 새롭게 개정된 『오디세이』는 단계별로 되어 있어 학년이 적더라도 자신의 능력 것 도전할 수 있도록 재구성되었습니다. 재구성 된 이 시리즈는 지금까지의 실전 경험을 살려, 이 책을 공부하면서 어려웠던 점과 문제점을 보완하여 더욱 발전되 내용을 보여주고 있습니다. 미국 하버드대학 교수들이 중심이 되어 개발한 세계적인 사고력 개발 프로그램으로 체계적으로 사고하는 방법을 배우며 논술의 힘을 길러보세요.",16868,BOOK
눈 오는 날,"에즈라 잭 키츠 (지은이), 김소희 (옮긴이)",35135,국내도서>유아>그림책>나라별 그림책>미국,9788949110172,"1963년 칼데콧 상 수상 작품. 어느 겨울날 아침, 하얗게 쌓인 눈을 본 피터가 눈을 가지고 노는 모습을 통해 눈 오는 날 아이의 행동과 심리를 잘 보여 주는 책이다.","온 세상이 하얀 눈으로 덮인다면?

아침에 눈을 떴을 때 온 세상이 하얀 눈으로 덮여 있으면 얼마나 신날까? 피터는 얼른 뛰어나가 눈사람을 만들고 눈미끄럼을 탄다. 그러다가 내일 가지고 놀려고 눈뭉치를 주머니에 넣고 집에 들어온다. 눈이 내렸을 때 아이들이 느끼는 신비감을 묘사한 책.",13323,BOOK
오 자히르,"파울로 코엘료 (지은이), 최정수 (옮긴이)",50920,국내도서>소설/시/희곡>스페인/중남미소설,9788982819995,"<연금술사>, <베로니카 죽기로 결심하다>의 작가 파울로 코엘료의 2005년 최신작 <오 자히르>가 출간됐다. 이란에서 하루에 8만5천 부가 팔려나갔으며, 프랑스에서는 1주일 만에 베스트셀러 1위에 올랐고, 이탈리아에서 출간 1개월 만에 42만 부의 판매고를 기록한 화제작이다. '소유하고 싶고 자유롭고 싶다'-사랑의 두 얼굴을 빛나는 성찰로 그려낸 소설.","""호르헤 루이스 보르헤스에 따르면 '자히르'는 이슬람 전통에서 유래한 개념으로, 18세기경에 처음 등장한 것으로 추정된다. 아랍어로 자히르는, 눈에 보이며, 실제로 존재하고, 느낄 수 있는 어떤 것으로, 일단 그것과 접하게 되면 서서히 우리의 사고를 점령해나가 결국 다른 무엇에도 집중할 수 없게 만들어버리는 어떤 사물 혹은 사람을 말한다. 그것은 신성(神聖)일 수도, 광기일 수도 있다."" - 



, 의 작가 파울로 코엘료의 2005년 최신작 가 출간됐다. 이란에서 하루에 8만5천 부가 팔려나갔으며, 프랑스에서는 1주일 만에 베스트셀러 1위에 올랐고, 이탈리아에서 출간 1개월 만에 42만 부의 판매고를 기록한 화제작이다. 전세계 82개국에서 42개 언어로 번역될 예정이다.



코엘료는 보르헤스의 단편 '자히르'에서 영감을 받아 이 책을 구상했다고. 원제 'O Zahir'는 아랍어로, 어떤 대상에 대한 집념, 집착, 탐닉, 미치도록 빠져드는 상태 등을 가리킨다. 이는 부정적으로는 광기 어린 편집증일 수도 있고, 긍정적으로는 어떤 목표를 향해 끝까지 나아갈 수 있도록 하는 에너지원일 수 있다. 마치 신의 두 얼굴처럼 양면적인 힘이다.



사로잡힌다는 것. 그것은 매혹이자 열정으로 우리의 삶을 추동해가는 근본적 에너지이다. 무언가에 사로잡혔을 때, 배경으로만 존재하던 일상의 무수한 사물과 사건들은 전혀 새롭고 낯선 풍경이 된다. 작은 먼지 같던 존재가 빛 속으로 또렷하게 부상하는 것. 그러나 무언가에 사로잡힘으로써 우리는 사로잡힌 대상을 제외한 나머지 것들에 무감각해진다. 사로잡힌 대상만으로 세계가 가득 차고, 그것은 절대적이며 유일한 존재가 된다. 마치 신처럼.



코엘료는 작품 속에서 '자히르'의 상태에 빠진 이들의 모습을 세밀하게 묘사한다. 일에 중독된 사람, 사랑에 중독된 사람, 소유에 중독된 사람... 사실 무언가에 중독되지 않은 채 생의 비애와 현실을 정면으로 맞닥뜨린다는 건 쉬운 일이 아니다. 그래서 무언가를 원칙으로 정해놓고 무작정 따르는 것. 그것이 우리가 일상적인 자히르에 굴복하는 방식이다.



작가는 이처럼 정해진 원칙을 의문 없이 따르는 것이 얼마나 어리석은 일인가를 다양한 비유와 우화적 에피소드를 통해 말한다. 그리고 원칙이라 믿고 있던 것, 불변의 사실로 확신하던 것이 깨어질 때 비로소 우리는 자기 자신을 다시 발견하고 새로운 세계를 보게 된다고 역설한다.



이 책은 사랑의 결과 깊이에 대한 소설이다. 베스트셀러 작가인 주인공이 말없이 사라져버린 아내에 대해 갖는 집착과 혼돈은 가장 강력한 자히르의 상태를 설득력 있게 보여준다. 그가 사로잡힌 것으로부터 벗어나려 애쓰고, 무작정 걸어가던 걸음을 멈추고 자기 내부를 응시하는 과정을 지켜보면서 독자는 사랑의 깊이와 넓이가 얼마나 무한한가 느끼게 된다. '소유하고 싶고 자유롭고 싶다'-사랑의 두 얼굴을 빛나는 성찰로 그려낸 소설이다.",5632,BOOK
텔레비전 사피엔스 - 바보상자 패러독스 2,정백 (지은이),8334,국내도서>대학교재/전문서적>사회과학계열>언론정보학,9788995498156,"저자는 텔레비전 중심시대의 맹점과 책의 장점을 논하고, 이러한 시대일수록 책의 역할은 더욱 증대되어야 한다는 사회기본 발전 축에 대해 서술하고 있다. 또한 우리가 원하건 원하지 않건 우리를 둘러싸고 있는 환경 속에서 텔레비전 방송은 절대적인 영향력을 행사하고 있기 때문에 이에 대한 준비가 되어 있지 않으면 텔레비전의 해로운 영향에 피해를 입을 수 있다고 지적한다.",,925,BOOK
세밀화로 그린 보리 아기그림책 1 - 전3권,"이태수 (지은이), 보리 편집부 (엮은이)",35427,국내도서>유아>그림책>그림백과/세밀화,9788985494304,책둘레를 둥글게 깎아 아기들이 다치지 않도록 배려했으며 아기들이 물어뜯고 잡아뜯어도 잘 찢기지 않게 튼튼히 만들었다. 아기들의 행동·언어 발달과정에 따른 입말을 함께 실어 아기와 토박이 동·식물을 자연스럽게 인사시키고 있다.,,15658,BOOK
어린이 살아있는 한국사 교과서 - 전5권 세트,"윤종배, 이성호 (지은이), 이은홍 (그림), 전국역사교사모임",48904,국내도서>어린이>초등 한국사,9788958620419,"일선 교육 현장에 있는 선생님의 글, 전문 만화 작가의 그림, 다큐멘터리 전문 작가의 사진이 어우러진 한국 역사 만화책. <살아있는 한국사 교과서>를 토대로, 어렵고 지루하다고 느꼈던 우리 역사를 알기 쉽게 풀었다. 모두 다섯 권으로 구성되었다. <만화 살아있는 한국사 교과서>의 개정판.",,7739,BOOK
인생을 바꾸는 게임의 법칙 - 못말리는 하버드 박사 박찬희.한순구 교수의 또라이 게임이론,한순구 (지은이),8586,국내도서>경제경영>경제학/경제일반>경제이론/경제사상,9788942003501,"경쟁에서 이기는 방법, 현실을 이해하는 방법을 알고 싶다면? 게임이론과 전략이론을 공부하라. 그동안 수학적 이론의 난해함으로 쉽게 접근할 수 없었던 내용들을 영화 장면이나 대사, 역사적인 사건, 동물들 간의 생존경쟁 이야기를 통해 알기 쉽게 풀어낸다.",,1743,BOOK
이현세 만화 한국사 바로보기 1 - 선사 시대와 고조선,"이현세, 김미영 (지은이), 한국역사연구회 (감수)",48904,국내도서>어린이>초등 한국사,9788991481015,"우리 시대를 대표하는 만화가, 이현세 선생이 만화를 그리고,  한국역사연구회가 충실히 내용을 감수한 어린이를 위한 역사만화. 모두 열 권으로 구성되었다. 철저한 고증과 자료들을 통해 각 시대를 정밀하게 복원해 내어, 마치 영화를 보는 듯 책 속으로 빠져들게 한다.","우리 역사의 왜곡을 바로잡고자 만화가 이현세와 한국역사연구회가 철저하게 감수를 한 역사 만화책. 총 10권으로 만들어졌으며, 철저한 고증과 자료를 토대로 각 시대를 일상 생활을 생생하게 드러낸다. 자칫 어렵고 딱딱하게 여기기 쉬운 방대한 우리나라 역사를 이야기 들려주듯 쉽고 흥미진진하게 구성했다. 
　
제 1권에서는 까치와 엄지가 두산을 찾는 과정에서 고서점의 역사책을 발견하고 그 책을 열어본 순간, 고조선 시대로 빨려 들어간다. 그들이 도착한 곳은 한반도의 구석기 시대로 친구 두산이의 발자취를 따라 가면서 까치와 엄지는 구석기와 신석기 시대, 청동기 시대와 철기 문화 그리고 최초의 국가인 고조선이 생기기까지 지나간 우리 역사를 흥미진진하게 경험한다. 
　
재미있는 만화 이야기가 끝이 나면 맨 뒷장에 '역사 박물관'을 통해 지금까지 알게된 역사적 사실을 엣 유물 사진, 지도 및 도표로 생생하게 학습하도록 해 놓았다. 그리고, 아이들이 역사적 흐름을 한 눈에 알아볼 수 있도록 연표를 삽입해 놓았다. -선사시대편-",3420,BOOK
"나의 라임 오렌지나무 - MBC 느낌표 선정도서, 보급판","J.M. 바스콘셀로스 (지은이), 박동원 (옮긴이)",50920,국내도서>소설/시/희곡>스페인/중남미소설,9788972975236,"우리 나라 독자들에게 많은 사랑을 받아온 <나의 라임오렌지 나무>가 완역본 보급판으로 재출간됐다. 100여 곳이 넘는 기존 책의 오역을 바로잡았고, 공모를 통해 선정한 삽화가의 그림을 함께 실었다.",,16304,BOOK
요셉의 작고 낡은 오버코트가 - 베틀리딩클럽 취학전 그림책 1003,"심스 태백 (지은이), 김정희 (옮긴이)",35135,국내도서>유아>그림책>나라별 그림책>미국,9788984880078,"무엇보다도 재미있는 것은, 책에 구멍이 뚫려 있다는 것. 구멍들을 통해 코트가 변하는 과정을 눈으로 확인할 수 있다. 처음에 볼 때는 분명히 오버코트였는데, 다음 장의 구멍을 통해 보니까 재킷으로, 그 다음에는 조끼로... 이런 식으로 변하는 모습을 볼 수 있다.","오버코트는 결국 무엇이 되었을까요?

기발함과 유머로 아이들의 마음을 잡아 끄는 기발한 이야기 『요셉의 작고 낡은 오버코트가』. 낡은 오버코트 한벌이 단추가 되기까지, 그 알뜰한 역사를 통해 배우는 지혜 한 가지. 다 해어져 못입게 된 오버코트- 버릴까 말까 - 버리지 마, 날 조끼로 만들어 줘 - 다 해어져 못입게 된 조끼 - 버릴까 말까 - 아냐, 버리지 마- 날 목도리로 만들어 줘--- 그리하여 오버코트는 결국 무엇이 되었을까요?

이 이야기는 유대인들의 전통 민속 시가에서 따온 것으로 반복되는 이야기의 리듬감을 살려 노래로 부를 수 있습니다. 또한 삽화 안에 사용한 구멍을 통해 그림책의 평면성이 지닌 한계를 뛰어 넘었으며, 어린이는 매 장마다 이 구멍을 통해 오버코트가 차차 무엇으로 바뀔 것인지를 상상하고 추측하며 논리력을 키운다. 

재미난 이야기와 풍부한 세부 묘사 뒤에 은근슬쩍 절약과 검소함, 자신감의 철학과 교훈을 내비치고 있다. 시원스럽고 밝은 색상으로 세밀하게 구성된 삽화는 이것저것 찾아보는 재미가 있고, 그림책을 통해 어린이가 이스라엘 문화 체험을 할 수 있다.",12781,BOOK
해리 포터 시리즈 1~4편 세트 - 전10권,"조앤 K. 롤링 (지은이), 김혜원, 최인자 (옮긴이)",51120,국내도서>소설/시/희곡>판타지/환상문학>외국판타지/환상소설,9788983920676,"전세계적 초대형 베스트셀러 '해리 포터' 시리즈 4편을 세트로 묶었다. 구성은 1편 '마법사의 돌' 1, 2권, 2편 '비밀의 방' 1, 2권, 3편 '아즈카반의 죄수' 1, 2권, 그리고 4편 '불의 잔' 1, 2, 3, 4권으로 모두 10권이다.",,5787,BOOK
열두 살에 부자가 된 키라,"보도 섀퍼 (지은이), 신지원 (그림), 김준광 (옮긴이)",48909,국내도서>어린이>사회/역사/철학>정치/경제/법,9788950990015,주인공 키라는 자신의 개 머니가 말을 할 수 있을 뿐더러 부자가 되는 방법에 관한 한 빼어난 지식을 갖고 있다는 것을 알게 된다. 머니는 늘 모자란 용돈으로 좋아하는 CD를 사느라 고생하는 키라에게 돈 버는 방법을 강의하기 시작한다.,,22957,BOOK
내가 쓰고 싶은 말이 다 있는 영어일기 표현사전,"하명옥 (지은이), Merrilee Brinegar (감수)",49949,국내도서>외국어>영작문,9788982205903,영어일기 관련 네이버 검색 1위 사이트인  '하명옥의 영어일기'(http://hamo66.hihome.com) 의 자료를 한 권에 엮은 표현사전이다. 상황별로 분류된 단문 수준의 생생한 표현을 찾기 쉽게 정리해놓아 우리말로 바로바로 찾아쓸 수 있다.,,8644,BOOK
대한민국에서 아들 공부 시키기,김숙희 (지은이),51786,국내도서>좋은부모>육아>육아법/육아 일반,9788959862153,"왜 아들들은 딸들보다 공부를 못할까? 아들 공부 때문에 고민하는 엄마들을 위한 '아들 공부 시키기' 책이다. 7차교육과정 도입 이후 아들들과 딸들의 격차는 점차 벌어지고 있다. 교원의 여성비율, 수행평가를 통한 성적 산출까지, 어느 것 하나 아들에게 유리한 것 없는 상황에서 엄마가 함께 아들의 공부법을 찾는다.","'아들' 교육에 초점을 맞춘 자녀 교육서! 이 책의 저자는 한국의 보통 엄마의 입장에 서서, 이 땅의 아들을 둔 엄마들을 취재하고, 전문가를 통해 올바른 교육 방법을 발견했다. 더 나아가 21세기에 걸맞는 아들 교육법을 제시한다. 

이 책은 우선 아들을 생물학적인 남자로 인식하고, 아들의 관심사가 무엇인지 이해할 것을 요구한다. 이를 기반으로 아들과 친구가 된 후에야 아들에게 필요한 공부법을 제시할 수 있다고 주장한다. 

이 책은 딸과는 달리 '동기 부여'에 따라 학습 방향이 달라지는 아들의 성향을 바탕으로 성적을 향상시킬 수 있는 6가지 학습 기술을 알려준다. 이와 더불어 각 연령에 맞는 학습법과 과목별 지도법을 제시한다. 부록으로 '연령별 아들 키우기 특별 노하우'와 '아들 공부를 위한 체크 리스트 및 계획표'가 들어 있다.",446,BOOK
Why? 바다,이광웅 (지은이),48867,국내도서>어린이>과학/수학/컴퓨터>과학 일반,9788930205368,,,3984,BOOK
FAST SECOND - 신시장을 지배하는 재빠른 2등 전략,"콘스탄티노스 마르키데스, 폴 게로스키 (지은이), 김재문 (옮긴이)",2173,국내도서>경제경영>기업 경영>경영전략/혁신,9788901053868,빨리 움직이는 것이 중요한가? 적절한 시점에 움직이는 것이 중요한가? 블루오션(Blue Ocean)의 최종 승자가 되기 위해서는 새로운 틈새시장을 찾아내 대중시장으로 확대하기 위한 '재빠른 2등 전략'이 필요하다. 온라인 서점이라는 아이디어를 최초로 구현한 기업은 '아마존'이 아닌 '컴퓨터 리터러시 북스토어'였다.,"경쟁이 없는 새로운 시작, 즉 푸른 바다와 같은 신시장을 개척하자는 블루오션 전략이 많은 한국 기업과 경영자들에게 새로운 경영 전략의 패러다임으로 받아들여지면서 하나의 유행처럼 번져가고 있다. 위기에서 벗어나기 위한 돌파구와 새로운 미래 성장 동력을 찾고 있는 기업과 경영자들에게 블루오션 전략은 매력적이다. 하지만 블루오션을 찾아내는 것보다 중요한 것은 그 바다를 지배하는 방법을 아는 것이라고 할 수 있다.

전략경영의 세계적인 두 대가가 집필한 이 책은 바로 이러한 블루오션의 궁극적인 지배자가 되는 방법을 알려주는 책이다. 이 책에 따르면 새로운 시장을 지배하기 위한 핵심 성공 요인은 '빨리 움직이는 것'이 아니라 '적절한 시점에 움직이는 것'이다. 그리고 적절한 시점이 맨 먼저인 경우는 드물다. 결국 신시장에 들어가 실질적인 주도자, 즉 진정한 마켓 리더가 되기 위해서는 움직여야 할 최적의 타이밍을 찾아내야만 한다. 지은이들은 이것을 '재빠른 2등 전략'이라고 소개하고 있으며, 재빠른 2등 전략만이 신시장의 창조와 지배를 위한 최적의 전략이라고 강조하고 있다.

새로운 틈새시장을 찾아내 대중시장으로 확대하기 위한 재빠른 2등 전략과 그 시장을 지속적으로 확대하고 유지하기 위한 혁신 전략을 제시하고 있는 이 책은 치열한 경쟁과 불확실성의 시대에 생존을 위한 돌파구를 찾고 있는 기업과 경영자들이 반드시 읽어야 할 경영 전략의 필독서이다.",388,BOOK
사진과 그림으로 보는 한국사 편지 1 - 원시 사회부터 통일 신라와 발해까지,박은봉 (지은이),48904,국내도서>어린이>초등 한국사,9788901038025,"대중 역사서를 줄곧 써온 역사 연구가가 딸에게 들려주는 한국사 이야기. 생활사, 사회사, 문화사 등이 골고루 담겨져 있으며, 최근의 역사학계의 연구성과를 충실히 수용하여, 원시 사회부터, 통일 신라와 발해에 이르기까지 우리 조상들의 생활과 중요한 역사적 순간을 13통의 편지 속에 담았다.",,7865,BOOK
Try again! 중학교 교과서로 다시 시작하는 영어회화,이근철 (지은이),49849,국내도서>외국어>영어회화>생활영어,9788990279286,"EBS, KBS의 TV프로그램으로 친숙해진 저자가 밝히는 영어학습 노하우에 관한 책이다. 중학교 1학년 시절에 배운 단어와 문법만으로도 책의 내용을 충분히 소화할 수 있을 정도의 난이도. 토종 한국인이지만, 영어를 원어민에 가깝게 소화하는 저자는 꼭 알아야 할 50개의 문장과 어휘, 효율적인 학습방법을 알려준다.",,7820,BOOK
