title,author,genre_id,genre,ISBN,description_aladin,description_naver,salesPoint,mallType
"CEO 안철수, 지금 우리에게 필요한 것은",안철수 (지은이),70232,국내도서>자기계발>리더십>리더십,9788934917205,"&lt;CEO 안철수, 영혼이 있는 승부>를 통해 ""삶과 비즈니스도 결국은 긴 호흡과 영혼의 승부""임을 내보였던 우리 시대의 리더 안철수. 그가 지난 10년간의 소중한 경험을 바탕으로 우리가 '다음'을 준비하기 위해 지금 해야할 일들을 이야기한다. 원고지 3,000매 분량의 메모와 이메일, 일기에는 생생한 고민들과 속깊은 사유의 흔적들이 곳곳에 배어있다.","&lt;CEO 안철수, 영혼이 있는 승부>를 통해 ""삶과 비즈니스도 결국은 긴 호흡과 영혼의 승부""임을 내보였던 우리 시대의 리더 안철수. 그가 지난 10년간의 소중한 경험을 바탕으로 우리가 '다음'을 준비하기 위해 지금 해야할 일들을 이야기한다. 



그와 그의 조직은 그동안 규모도 더욱 커지고, 새롭게 합류한 여러 구성원들과 함께 일하고 고민하면서 배우는 시간을 가졌다. 처음으로 성장 정체의 위기에 빠지기도 했고, 이를 극복하고 다시 성장의 가닥을 잡아나가는 소중한 경험도 할 수 있었다. 



자연스레 혼자서는 할 수 없는 의미 있는 일을 여러 사람들이 모여 함께 이루어가기 위해서는 어떠한 마음가짐이 있어야 하는지, 각 개인들이 살아남기 위해서 그리고 그들이 속한 조직도 함께 발전하기 위해서는 어떤 생각을 가져야 하는지 생각하는 시간들을 가질 수 있었다.



그런 소중한 경험들과 우리 사회에 대한 근본적인 성찰 속에서, 저자는 지금 우리에게 필요한 것이 무엇인지에 대해 '안철수 방식'으로 말해준다. 급변하는 글로벌 시대에 개인과 조직이 경쟁력을 갖추기 위한 자세와 마인드는 어떠해야 하는지, 전문가와 조직 구성원이 가져야 할 자질과 커뮤니케이션의 방법, 업무방식은 어떠해야 하는지, 벤처위기의 해법은 어디에 있는지, 그리고 21세기 한국사회의 업그레이드를 위한 준비는 어떠해야 하는지 이야기한다.



원고지 3,000매 분량의 메모와 이메일, 일기에는 그가 지난 10년간 나누었던 생생한 고민들과 속깊은 사유의 흔적들이 곳곳에 배어있다.",16263,BOOK
난 토마토 절대 안 먹어,"로렌 차일드 (지은이), 조은수 (옮긴이)",35137,국내도서>유아>그림책>나라별 그림책>유럽,9788911020003,"편식하는 아이들을 위한 그림책. 당근이 '오렌지뽕가지뽕'으로, 으깬 감자가 '구름보푸라기'로, 토마토가 '달치익쏴아'로 변해 아이들에게 다가간다. 2000년 케이트 그린어웨이 상 수상작.","찰리에겐 룰라라는 여동생이 있어요. 가끔은 룰라에게 밥을 차려 줘야 하죠. 이건 꽤나 힘든 일이예요. 왜냐하면 룰라는 싫어하는 음식이 아주 많거든요. 이를테면 감자, 당근, 생선, 콩 그 중에서 토마토를 절대로 안 먹는대요. 그런 룰라를 위해 찰리는 색다른 식사법을 고안하게 되요. 그런데 이게 어떻게 된 일이지요? 룰라가 자진해서 싫어하는 음식을 아주 맛나게 먹는 거예요. 도대체 찰리는 룰라에게 뭐라고 했을까요? 요즘 인스턴트 음식이 길들어진 유아들이 정말 몸에 좋은 콩이나 토마토, 감자, 당근 등을 꺼린다고 합니다. 그런 유아를 위해 음식에 아주 특별한 이름을 붙여주세요. 그리고 상상의 날개를 달아주면 어느새 앞에 놓인 영양가 있는 음식을 맛나게 먹을 테니까요. 편식하는 유아를 위한 그림책.",24529,BOOK
꽝포 아니야요! 남북 공동 초등학교 - 문원 아이 시리즈 14,신천희 (지은이),48837,국내도서>어린이>초등3~4학년>동화/명작/고전,9788986396478,"비무장지대 안에 있는 자유의 마을에 세워진 남북 공동 초등학교는 통일을 대비해서 교육의 문제점을 찾기 위해 세워진 가상의 통일 시범 학교이다. 북한 아이들을 처음 만나는 날, 남한 아이들은 가슴이 설레기만 한다.",,2439,BOOK
수용소의 노래 - 북한 정치범수용소 체험수기,강철환 (지은이),51371,국내도서>에세이>한국에세이,9788990959140,2005년 현재 조선일보 기자로 일하고 있는 강철환 씨가 유년시절 북한의 함남 요덕 정치범수용소에서 보낸 10년을 기록한 책. 미국에서 <평양의 어항>(The Aquariums of Pyo ngyang)이란 제목으로 출간되어 타임지가 선정한 2002년 올해의 책 베스트 100에 선정된 바 있는 책이다.,,728,BOOK
미학 오디세이 세트 - 전3권,진중권 (지은이),50958,국내도서>예술/대중문화>예술/대중문화의 이해>미학/예술이론,9788989899716,"풀어 쓴 미학의 역사. 일반 독자들과 거리가 멀었던 미학을 대중과 친숙한 학문으로 인식시킨, 미학 입문서 분야의 스테디셀러다. 그간 저작권 문제 등 여러가지 사정으로 인해 여러 출판사에서 소개되었으나, 3권이 추가되며 휴머니스트 출판사에서 완간되었다.",,11411,BOOK
사무자동화산업기사 실기 특별대비 - 2005 확달라진,"공효석, 홍태성, 김진규 (지은이)",35778,국내도서>수험서/자격증>컴퓨터 활용능력>사무자동화,9788931430462,"2005년 최신 개정판 사무자동화산업기사 실기 대비 수험서. 과년도 기출문제 분석을 통해 이론을 강화하였으며, 최신 기출문제를 수록해 기출문제 중심으로 학습할 수 있도록 했다.",,606,BOOK
펄떡이는 물고기처럼,"스티븐 C. 런딘, 해리 폴, 존 크리스텐슨 (지은이), 유영만 (옮긴이)",282,국내도서>경제경영>기업 경영>조직/인력/성과관리,9788988798553,"주인공은 파이크 플레이스 어시장의 생선 상인들로부터 배운 단순한 교훈들을 독창적으로 실제 상황에 적용시킴으로써, 자신의 일터에 놀라운 변화를 일으킨다. 어떻게 직원들의 에너지를 충전시킬 수 있는지, 어떻게 일을 즐겁게 받아들이는지 그 해답을 발견한 것이다.",,9245,BOOK
한입에 덥석,"키소 히데오 (지은이), 한수연 (옮긴이)",35139,국내도서>유아>그림책>나라별 그림책>일본,9788952723789,"둥글고 커다란 수박 하나가 데굴데굴 데구구구 굴러온다. ""우아, 맛있겠다!"" 하고 군침을 꼴깍 삼키는 동물친구들. 뾰족뾰족 꼬리를 가진 악어가 쓱싹쓱싹 수박을 열조각으로 잘랐다. 자, 그럼 동물들은 수박을 어떻게 먹을까?",,2494,BOOK
연애 교과서 2,송창민 (지은이),3812,국내도서>자기계발>인간관계>남녀관계,9788975581649,저자가 약 10년 동안 경험한 연애노하우와 많은 사람들에게 연애에 관한 조언을 해주면서 꼭 필요하다 느꼈던 가장 현실적인 연애정보들을 총망라한 연애컨설팅 보고서. 1편에는 연애전략. 기술. 심리. 매너. 철학을 2편에는 남자와 여자가 처음 만나는 시점부터 생길 수 있는 모든 연애 과정에 대해 기발한 실전 코치를 담았다.,"『연애교과서』가 발간 즉시 전국에서 폭발적인 인기를 얻은 데 힘입어, 수많은 애독자들의 요청에 부응하여 새로이 『연애교과서 2』를 선보였다. 이 책은 『연애교과서』에서 지적되었던, 남자들을 위한 책이었다는 평을 탈피하기 위하여 새롭게 구성, 편집하여 남녀 공용으로 볼 수 있도록 꾸며졌으며, 1편에 비하여 디자인 측면을 줄이는 대신 내용 면에 더 충실히 보강하였다.

왜 『연애교과서』를 읽어야 하는가? 사랑에는 어째서 기술(技術)이 필요한가? 이성(異性)에게 어프로치하는 방법, 사랑을 얻지 못하는 원인은 무엇인가...",862,BOOK
"한글 2002 사용자를 위한 워드프로세서 1급 실기 특별대비 - 2005, 확달라진",늘푸른기획 (엮은이),35797,국내도서>수험서/자격증>컴퓨터 활용능력>워드프로세서>워드프로세서 실기,9788931429831,2005년 최신 출제 경향을 분석하여 구성한 워드프로세서 1급 실기 수험서. 시험에 나오는 유형을 파악하고 실제 시험문제와 유사한 문제를 여러 번 반복하여 풀어봄으로써 실전에 대비하는 능력을 키우는데 중점을 두었다.,,613,BOOK
가려 뽑은 우리 시조,"신연우 (지은이), 안재인 (사진)",7268,국내도서>청소년>청소년 고전,9788932312576,"고시조 99편은 자연, 사랑, 나라, 인생과 세상, 학문과 교훈 등 주제별로, 현대시조 28편은 작자별로 엮었다. 시조마다 원문의 말맛을 최대한 살린 현대어 시조와 원문을 함께 넣어 비교하면서 읽을 수 있다. 이해를 돕기 위해 지은이와 역사적 배경, 어려운 낱말과 고사 해설을 쉽게 풀어 넣었다.","선조들의 정서와 생활의 멋, 겨레의 얼이 고스란히 녹아있는 시조선집. 어투가 딱딱하고, 한자어가 많고, 내용이 구식이고, 교훈적인 말투가 고리타분하다는 이유로 외면 당해왔던 교과서 속 시조를 교실 밖으로 끌어낸 책이다. 중 · 고등학교 국어교과서와 문학교과서에 수록된 시조와 교과서에는 없지만 한국인이라면 꼭 알아야 할 시조를 엄선하여 시조 127편을 수록한 이 책은 청소년의 눈높이에 맞춰 원문의 말맛과 자유로운 음률을 최대한 살린 현대어 시조과 쉽고 흥미로운 시조 해설, 그리고 감흥을 불러일으키는 사진으로 구성하였다. 또한 현대어 시조의 아래에는 원문을 덧붙였으며, 시조 해설에서는 작가에 대한 설명과 역사적 배경을 첨가하였다.",390,BOOK
초대받은 아이들 - 웅진 푸른교실 3,"황선미 (지은이), 김진이 (그림)",48825,국내도서>어린이>초등1~2학년>동화/명작/고전,9788901033464,"친구 생일에 초대받지 못한 아이의 심리를 잘 표현한 동화. 실제로 작가의 둘째 아이를 모델로 삼은 이야기라, 작가는 그 어느 작품보다도 더욱 절실한 심정으로 집필할 수밖에 없었다고 털어놓기도 하였다고 한다.",,9906,BOOK
죽기 전에 꼭 가봐야 할 여행지 33 - 우리나라 100배 즐기기 시리즈 5,이두영 (지은이),50846,국내도서>여행>국내 여행가이드>전국여행 가이드북,9788983759320,300년쯤 후면 환경변화로 인해 자연스럽게 사라질 창녕의 우포늪은 현재도 육지화가 진행되고 있는 지역이다. 이 책은 이런저런 이유로 점차 파괴돼 가는 환경 혹은 자연스러운 퇴화 속에서 더 이상 늦기 전에 가봐야 할 우리나라의 수려한 자연환경 33곳을 담고 있는 책이다.,,2179,BOOK
코믹 크레이지레이싱 카트라이더 고대문명 역사 탐험기 3,"유경원 (글), 양선모 (그림)",49224,국내도서>어린이>초등 전학년>학습만화,9788953297494,"온라인 게임 '크레이지레이싱 카트라이더'를 만화로 엮었다. 크레이지 아케이드의 캐릭터로 먼저 만난 다오와 배찌를 비롯한 귀여운 캐릭터들이 카트를 타고 등장해 고대문명지에서 레이싱 대결을 벌인다. 만화를 읽으면서 메소포타미아, 이집트, 황하, 인도로 이어지는 고대 문명을 재미있게 배울 수 있다.","초절정 온라인 게임 <크레이지레이싱 카트라이더>를 코믹 만화로 꾸몄다. 단순히 재미를 주는 만화가 아닌 <고대 문명>을 탐험하는 이야기를 담아 고대 문명의 상식을 배울 수 있는 교양 만화책이다. 이집트를 시작으로 메소포타미아, 중국의 황하, 인도로 이어지는 고대 문명지에서, 기상천외한 카레이싱 대결이 펼쳐진다. 
　 
3권은 바벨탑 이야기를 중점으로 흥미진진한 카레이싱이 펼쳐진다. 카레이싱 경기 속에 담긴 재미난 고대 문명 이야기를 읽는 재미가 쏠쏠하다. 부족한 부분은 '다오와 배찌의 문명 탐험수첩'으로 추가 설명한다. <제3권>",614,BOOK
루이 브라이,"마가렛 데이비슨 (지은이), J. 컴페어 (그림), 이양숙 (옮긴이)",48899,국내도서>어린이>문화/예술/인물>세계인물,9788979380132,눈먼 사람들을 위해 점자를 발명한 루이 브라이에 대한 이야기. 자신이 눈먼 사람이면서도 좌절하지 않고 노력하여. 앞을 볼 수 있는 사람 이상으로 쓸모있는 사람임을 증명한 루이 브라이의 삶으로부터 깊은 감명과 함께 용기를 얻을 수 있다.,"점자를 처음으로 만들어낸 루이 브라이의 전기. 루이 브라이가 만든 점자는 전 세계에 알려져, 드디어는 모든 눈 먼 사람들을 지식의 세계로 안내하는 큰 빛이 되었다. 브라이가 태어난 프랑스의 꾸브레이 마을에 가면 '루이 브라이 광장' 과 그를 기념하여 만든 금속판이 있다. 



또한 이 책은 루이 브라이가 점자를 만들기 위해 헌신한 삶의 모습을 보여 준다. 쉽고 편리하게 쓸 수 있는 점자를 만들기 위하여 밤낮을 잊고 식사도 거른 채 연구에 몰두했다. 또 눈 먼 아이들을 가르치는 교사로서 학생들에게 자신의 모든 것을 다 내어 주는 모습도 볼 수 있다.",17765,BOOK
사람풍경 - 김형경 심리 여행 에세이,김형경 (지은이),52904,국내도서>에세이>명사에세이>문인에세이,9788959131648,"사랑과 성, 죽음 등의 주제를 형상화해 온 소설가 김형경의 에세이. 지은이가 세계 곳곳을 여행하면서 만난 많은 사람들과의 에피소드를 통해 인간의 내면에 내재한 감정과 근본에 대해 사색하는 심리.여행 에세이. 인간 심리에 대한 섬세한 관찰과 솔직한 분석, 삶과 사람을 바라보는 작가의 내밀한 시선을 엿볼 수 있다.",,14621,BOOK
만화 박정희 1,"백무현 (지은이), 박순찬 (그림), 민족문제연구소, 뉴스툰",51263,국내도서>사회과학>한국정치사정/정치사>제3공화국/제4공화국,9788959400010,"민족문제연구소가 기획하고, 서울신문사에 시사만평을 연재하고 있는 백무현 화백이 글을, 경향신문에 4컷 만화 '장도리'를 싣고 있는 박순찬 화백이 그림을 맡아 제작한 정치만화. 박정희의 친일 행적과 독재의 잔악상을 고발하는 데 중점을 두었다.",,1805,BOOK
"판타지 수학대전 5 - 신비의 수표, 마방진의 비밀",그림나무 (지은이),48871,국내도서>어린이>과학/수학/컴퓨터>초등 수학,9788995579787,분수의 개념과 연산 방법을 주인공들의 치열한 전투 속에서 배우고 그 원리와 응용을 콘텐츠 장에서 아기자기한 에피소드로 익힌다. 수학의 원리를 스스로 깨치는 판타지 수학대전 다섯번째 권!,"수학의 원리를 재미있는 만화를 통해 배울 수 있는 학습 만화책. 재미없어 하는 수학을 아이들이 쉽게 이해할 수 있도록 만화로 쉽게 설명하고, 가급적 아이들이 이해하지 못해 '왜'라고 반문하던 수학에 대해 배워야 하는 이유를 조목조목 친절하게 설명한 것이 특징이다. 
　 
명랑한 장난꾸러기 지수는 갑자기 나타난 수학 세계의 곱셈 마법사 미나에 의해 신비의 세계 아틀란티스로 가게 된다. 이번 권의 지수 일행은 분수 몬스터들의 습격을 이겨내고 지옥을 빠져나온다. 그리고, 자이나 왕국에서 승법도사에 맞서는 무시무시한 훈련 전투를 치르게 된다. 지수 일행이 혹독한 훈련을 받는 동안 아슈르는 제3의 봉인으로 성큼성큼 다가서고 있었는데…. 이번 권은 분수의 덧셈·뺄셈·곱셈·나눗셈에 대해서 배운다. 

이 책은 단편적인 수학적 지식을 나열하는 대신, 각 권마다 주제를 정한 뒤 아이들이 궁금해 할 만한 작은 주제들로 세분화 해 놓았다. 총 16권 중 다섯 번째 책이다.",1327,BOOK
토마토 Practice Tests - 실전모의고사 3회분 (문제집 + 해설집 + 나의 오답꼭지책 + 테이프 3개) - 토익점수 마구 올려주는 토익,김묘희 (지은이),49858,국내도서>외국어>토익>실전,9788971768686,"저자들의 실제토익 응시경험을 바탕으로 최신토익의 유형과 난이도를 그대로 적용했다. 총 300명에 달하는 수험생을 대상으로 실시한 테스트 자료를 근거로 하고 있어, 자신의 실제 토익점수와 비교해 정확히 정답률을 예상할 수 있다.",,715,BOOK
일본 100배 즐기기 2006~2007 - 세계를 간다 102,유재우 (지은이),50854,국내도서>여행>일본여행>일본여행 가이드북,9788983759382,"일본 여행 종합 안내서. 한국인에게 인기 높은 도꾜·오사까·교또·코베·나라 5개 도시를 집중 분석하고 있으며, 68개 도시를 완벽하게 가이드하고 있다. 2004년 3월 최신 개정판으로, 1600-6000엔 대의 초염가 숙소, 단돈 39만원의 단기일정과 같은 알찬 정보를 비롯하여 160개의 초정밀 지도와 약도를 수록했다.",,2008,BOOK
400만원으로 2억 만든 젊은 부자의 부동산 경매 투자일기,조상훈 (지은이),175,국내도서>경제경영>재테크/투자>부동산/경매,9788950906481,"26세에 800만원으로 주식과 채권, 부동산, 경매 등의 전방위 재테크를 통해 33세에 14억의 자산을 이룩했던 조상훈의 부동산 경매 성공 투자일기. 부동산 경매를 이용해 많지 않은 자금으로도 항상 높은 수익을 유지할 수 있는 전략을 하루하루를 성실히 살아가는 보통 사람들을 위한 지침서로 정리했다.",,5390,BOOK
작은 별 통신,"나라 요시토모 (지은이), 김난주 (옮긴이)",51376,국내도서>에세이>사진/그림 에세이,9788952742377,"나라 요시토모의 자서전인 <작은 별 통신>은 저자의 출생에서부터 현재까지 시기별로 나누어 아티스트로서의 변화와 성장 과정을 차근차근 보여준다. 그림과 사진, 직접 그린 작업실 평면도 등 213컷에 이르는 도판을 게재하여 읽는 즐거움뿐 아니라 보는 즐거움까지 누릴 수 있다.","의 표지 일러스트를 그린 작가로 잘 알려진 요시토모의 국내 첫 단행본. 그의 작품과 사진, 스케치 등을 통해 자신의 삶과 예술에 대한 고백을 담아낸 자서전이다. 국내에는 그의 저서가 출간된 바 없지만, 이미 많은 블로거들 사이에서 인기를 누리고 있는 그는 세계적인 아티스트로, 그가 그린 귀엽고 순진한 어린아이들의 허무하고 차가운 표정과 지독히 표독스러운 몸짓은 공포감과 함께 보는이로 하여금 신선함을 느끼게 하기에 충분하다.
　
이 책은 저자의 출생에서부터 아티스트로 성장한 현재까지의 시간을 차근차근 되짚는다. 겨우내 방 안에서 그림만 그리며 보냈던 어린시절과 보따리 짐을 싸들고 다녔던 대학 시절, 사람들을 만나고 그림에 대한 이상을 키워가던 유럽에서 보낸 시간들, 자신과의 치열한 대화를 통해 그림을 완성하고, 전시를 기획하고 성공리에 마치기까지의 고뇌, 락을 들으며 친구들과 감각을 나누던 행복한 순간들에 대한 이 기록은, 그 동안 신비에 싸여있던 '나라 요시토모'라는 화가를 보다 친근하게 느끼게 할 것이다.
　
그림과 사진, 직접 그린 작업실 평면도 등 213컷에 이르는 도판을 게재하여 보는 즐거움까지 제공하는 이 책을 통해 살아 있는 한 그림을 그리겠다는, 그림을 통해 타인에게 말을 거는 화가의 솔직한 내면과 그만의 진면목을 만나볼 수 있다.",1701,BOOK
까막눈 삼디기 - 웅진 푸른교실 2,"원유순 (글), 이현미 (그림)",48874,국내도서>어린이>동화/명작/고전>국내창작동화,9788901068602,할머니와 둘이서 사는 삼디기는 글을 읽지 못한다. 2학년이 되었는데도 글을 못 읽어 친구들로부터 놀림을 당한다. 하지만 열심히 노력해서 마침내 모든 친구들 앞에서 당당하게 글을 읽어내는 삼디기는 용기와 희망의 메시지를 전한다.-아이북랜드 도서선정팀,글 못 읽고 말 안 듣는 삼디기가 주위의 친구들로부터 놀림을 당하면서도 열심히 노력해서 마침내 모든 이들 앞에서 글을 읽어낸다는 내용의 책. 투박하지만 정감어린 그림과 큰 글자체가 저학년 어린이들의 시선을 붙들 뿐만 아니라 동감할 수 있는 내용을 담아내고 있다. 읽기의 즐거움을 안겨다주는 책.,28848,BOOK
짜장 짬뽕 탕수육,"김영주 (지은이), 고경숙 (그림)",48874,국내도서>어린이>동화/명작/고전>국내창작동화,9788986565522,중국 음식점 집 아이 종민이가 전학을 와서 친구들에게 왕따를 당하지만 놀이를 통해 따돌림을 극복하고 친구들과 잘 어울려 지낸다는 창작동화.,"왜 종민이는 거지라고 놀림을 받았을까?

아직은 글만 빼곡한 책이 지루한 초등학교 아이들에게 독서의 즐거움을 일깨워 주는 「학급문고」 제3권 『짜장 짬뽕 탕수육』. 1995년 문예지 '오늘의 문학' 동화부문 신인상을 수상하며 문단에 나온 동화 작가 김영주의 장편동화다. 1999년 처음 출간된 후 지금까지 변함없이 아이들에게 독서의 즐거움을 안겨주고 있습니다. 

종민이네 엄마 아빠는 도시로 이사온 후 중국 요리를 파는 장미반점을 운영해요. 종민이는 엄마가 싸주신 따뜻한 밥과 짜장이 들어 있는 도시락 가방을 어깨에 메고 학교로 가요. 하지만 교실에 들어서면 덩그렇게 자리만 지키고 있어요. 전학을 왔기 때문에 친한 친구들이 아직 없어요. 그런데 1교시 쉬는 시간에 화장실로 갔다가 종민이는 거지라는 놀림을 받는데…….",31761,BOOK
"이익훈 E-TOEIC R/C, L/C 세트 (단어장 포함)",이익훈 (지은이),50003,국내도서>외국어>토익>종합,9788982205385,기존 E-TOEIC에서 80% 이상 내용이 변화된 내용으로 채워진 2005년용 이익훈 토익학습서이다. 바뀌어가는 토익경향을 파악해 찍기와 요령이 아닌 탄탄한 기본기로 만점을 노릴 수 있도록 구성했다.,,327,BOOK
손 큰 할머니의 만두 만들기,"채인선 (지은이), 이억배 (그림)",14024,국내도서>유아>그림책>문화/예술/인물/역사 그림책,9788986565065,"어린 시절부터 설날이면 어김없이 밥상을 지키던 만두. 지금까지도 우리가 아끼는 민속음식으로 남아있는 만두를 소재로 한 담백하고 토속적인 동화. 무엇을 하든지 엄청 많이 해대는 '손 큰 할머니'는 옛날부터 여유롭게 음식을 만들어 이웃과 더불어 나누어 드시던 우리의 할머니, 어머니를 생각나게 한다.",무엇이든지 엄청 크게 하는 손 큰 할머니가 숲속 동물들과 함께 매년 새해에 먹을 엄청 많은 양의 만두를  만든다. 이번 해도 할머니는 며칠 밤을 새우며 동물들과 만두를 빚는데 좀체로 줄어들지 않자 동물들이 불 평을 하기 시작한다. 재미있는 내용의 유아그림책.,28660,BOOK
트리갭의 샘물,"나탈리 배비트 (지은이), 최순희 (옮긴이)",48837,국내도서>어린이>초등3~4학년>동화/명작/고전,9788939514324,"시간은 아이를 자라게 한다. 특히, 교육이라는 이름 아래 부과되는 의무들이 쌓여가는 10살 무렵의 아이들에게 매년 한 살씩 먹는 나이는 두렵기만 하다. 그런 아이 앞에 '영원히 아이로 살 수 있는 샘물'이 나타난다면 과연 어떻게 할까? 이 동화는 이 문제에 대한 이야기를 풀어나간다.",,2438,BOOK
마사코의 질문,"손연자 (지은이), 이은천 (그림)",48874,국내도서>어린이>동화/명작/고전>국내창작동화,9788957980484,"일제 식민 시대 억압받던 우리민족의 이야기를 생생하게 그린 동화집. 어린이들에게 역사의 진실을 바르고 생생하게 일깨워 주는 책이다. 초등학교 국어 교과서에 수록되었으며, 제33회 세종아동문학상 수상작이다.",,9073,BOOK
