title,author,genre_id,genre,ISBN,description_aladin,description_naver,salesPoint,mallType
교사와 학생 사이,"하임 G. 기너트 (지은이), 신홍민 (옮긴이)",51121,국내도서>사회과학>교육학>교육 일반,9788990220141,"교사나 부모들에게 먼저 아이들의 마음을 사로잡음으로써, 아이가 배움에 대해 마음을 열 수 있도록 도와주고, 거절의 언어가 아닌 인정의 언어를 통해 아이를 인격적으로 키울 수 있는 '특별한 기술'을 알려준다.","이 책이 전하는 바, 가르치는 것에도 특별한 기술이 필요하다는 것과, 아주 중요한 문제가 일어났을 때 이론은 문제가 되지 않는다는 것. 책은 아이들을 존중하면서도 학습을 끌어내는 접근 방법을 통해 교육의 질과 존엄성을 높이고자 한다. '좋은 교육'이 무엇인지 이론적으로는 모두 알고 있다. 다만 그것을 어떻게 전달하는가라는 문제가 남아있을 뿐이다. 이 책은 이러한 문제에 대해 좀 더 구체적이고 자세한 방법을 제시하고 있다.",9097,BOOK
국문학과 민족 그리고 근대,강명관 (지은이),51196,국내도서>소설/시/희곡>문학의 이해>일반문학론,9788956262550,,"'민족'과 '근대'가 국문학사에 미친 영향을 살펴본 책. 저자는 민족이 스스로 근대로 걸어갔다는 전제에 대해 본격적으로 생각한 결과 '민족'과 '근대' 두 어휘가 국문학사를 구성하고 있다는 것을 깨닫게 되었다고 말한다. 국문학이란 분야에서 민족주의와 '근대'가 국문학을 어떻게 구성하고 서술을 강제했는지를 다루고 있다. 이를 통해 우리 국문학사의 민족과 근대 찾기가 쓸모없을 뿐더러 유해하기까지 한 행위였다고 주장하며, 시대에 의해 자의적으로 해석된 국문학사를 비판한다. [양장본]",417,BOOK
바다의 성당 1,"일데폰소 팔꼬네스 (지은이), 정창 (옮긴이)",50920,국내도서>소설/시/희곡>스페인/중남미소설,9788957592540,"엄격한 가톨릭 윤리와 왕권이 아슬아슬하게 균형을 이루고 있던 14세기 스페인. 왕과 교회가 권위를 내세워 화려하고 웅장한 성당을 건축할 때, 민중들이 나서서 헌금 대신 노동력을 바쳐가며 정성 어린 그들만의 성당을 만들었다. 스페인의 현직 변호사 일데폰소 팔꼬네스가 이 성당을 소재로 장편소설을 썼다. <바다의 성당>. 거대한 역사의 소용돌이 속에 이름 없이 묵묵히 살아간 민중들의 삶을 그린 묵직한 휴먼 드라마다.",,272,BOOK
바람의 딸 걸어서 지구 세바퀴 반 1 - 아프리카 중동 중앙아시아,한비야 (지은이),50871,국내도서>여행>세계일주여행>세계일주여행 에세이,9788986903010,"오지 여행가로 유명한 저자가 아프리카, 중앙아시아, 중동 등지를 여행하며 남긴 기행문이다. 저자는 미국 유학 후 국제홍보회사의 중간간부로 있다가 사표를 내고 세계여행에 나선 특이한 경력을 갖고 있다. 가능하면 비행기를 타지 않고, 가능하면 현지인과 똑같이 생활하며 현지문화를 체험한다는 원칙 아래 `진짜백이 여행`을 다녀온 생생한 기록이 강한 여운을 남긴다.",,5847,BOOK
말들의 풍경 - 고종석의 한국어 산책,고종석 (지은이),51378,국내도서>인문학>교양 인문학,9788957690628,"「한국일보」객원 논설위원인 고종석이 2006년 3월 부터 2007년 2월까지 연재한 「말들의 풍경」에 실린 글들을 모아놓은 연재글 모음집. 1996에 출간된 <사랑의 말, 말들의 사랑>부터 시작된 지은이의 언어에 대한 관심의 연장선 아래 있으며, 넓은 의미의 비평 텍스트들도 들어있다.",,937,BOOK
북다트(50pcs-Tin) 책에 손상을 주지 않는 얇은 책갈피,,0,,,,,9733,GIFT
다시 찾는 우리역사 - 전면개정판,한영우 (지은이),8517,국내도서>대학교재/전문서적>인문계열>역사학,9788983410573,"<다시찾는 우리역사>는 서울대 한영우 명예교수의 역작으로, 1997년 초판이 나온 후 급격하게 바뀐 국내외 정세를 반영하여 새롭게 전면 개정판을 발간하게 되었다. 개정판에선 컬러화보를 대폭 늘리고 본문에 사용된 사진도 총 700여 컷으로 늘어났으며, 표지도 새로운 디자인으로 내놓았다.",,3411,BOOK
아메리카 자전거 여행,홍은택 (지은이),51371,국내도서>에세이>한국에세이,9788984311893,"언론인인 저자가 2005년 5월 26일부터 8월 13일까지 80일 동안 미국을 자전거로 횡단한 이야기이다. 미국의 동쪽 끝 버지니아주 요크타운부터 서쪽 끝 오리건주 플로렌스까지 40킬로그램의 짐을 싣고, 6400킬로미터의 '트랜스 아메리카 트레일'을 따라 달렸다.",,1364,BOOK
안녕 빠이빠이 창문,"노튼 저스터 (지은이), 크리스 라쉬카 (그림), 유혜자 (옮긴이)",35137,국내도서>유아>그림책>나라별 그림책>유럽,9788991770287,"할머니, 할아버지와 어린 손녀 사이의 정겨운 일상을 따뜻하게 그린 그림책. 2006년도 칼데콧 메달 최우수 수상작으로 '마치 어린아이의 스케치북을 보는 듯한 크리스 라쉬카의 천진한 붓놀림이 인상적이며, 아이의 세계를 표현하는 경쾌한 색채와 흰 여백의 공간이 놀랍도록 섬세하게 배치되어' 있다는 평을 받았다.",,436,BOOK
스밀라의 눈에 대한 감각,"페터 회 (지은이), 박현주 (옮긴이)",51067,국내도서>소설/시/희곡>추리/미스터리소설>기타국가 추리/미스터리소설,9788989351733,"<스밀라의 눈에 대한 감각>은 1992년 덴마크어로 출간된 이래 전세계 33개국에 번역되어 세계적인 반향을 불러일으킨 작품이다. 덴마크 올해의 작가상(1992), 덴마크 비평가상(1993), 전국 서점 협회 황금면류관상(1993), 전영 추리작가 협회 실버대거상(1994), 독일 추리 협회상(1995), 이탈리아 방카렐라상(1995) 등을 수상했으며 1993년에는 '타임'지 '올해의 책'으로 선정되기도 했다.","전통적 스릴러에 철학을 더한 전무후무의 미스터리!

1992년 덴마크어로 출간된 이래 전 세계 33개국에 번역되며 세계적인 반향을 불러 일으킨 화제의 추리소설. 출간 당시 《덴마크 올해의 작가상》, 《덴마크 비평가상》, 《전국 서점 협회 황금면류관상》, 《전영 추리작가 협회 실버대거상》등 다수의 문학상을 수상했으며 1997년에는 동명제목으로 영화화되기도 했다.

이 책은 차가운 미지의 땅을 배경으로 얼음과 숫자, 눈에 대한 통찰력을 가진 주인공과 함께 어린 소년의 죽음에 얽힌 미스터리를 풀어나가는 전통적인 추리소설의 플롯을 따르고 있다. 그러나 추리소설이라는 장르 안에 미스터리와 로맨스, 스릴러, 문명 비판, 철학적 통찰 등 각 장르적 요소들을 적재적소에 배치하고 있어 '하이브리드 소설'이라고 불러야 할 정도로 다채로운 면을 보여준다.

 또한 합리적인 표현력을 지닌 냉철한 성격의 소유자이지만 동시에 죽은 이웃집 아이에 대한 우정과 모성, 불의에 대한 분노 등 한없이 뜨거운 면모를 보여주는 여성 캐릭터가 매력을 더하며, 살인 스릴러물이면서도 철학적 치유를 끌어내는 균형감각은 이 소설의 여러 미덕 중 하나다.",8381,BOOK
"여자 몸 설명서 : 여자조차 모르는 - 남자는 죽었다 깨어나도 모르는, 아기를 잘 만드는 의사 이성구의 여자 이야기",이성구 (지은이),53557,국내도서>건강/취미>건강정보>여성건강,9788991055605,"산부인과 전문의 특유의 통찰과 경험을 바탕으로 남자도, 심지어 여자 자신도 모르고 있는 여자 몸에 대한 수수께끼를 풀어 썼다. 생식이라는 프리즘을 통해 본 여자의 신체, 마음, 섹스, 임신과 출산에 관한 이야기.",,327,BOOK
수레바퀴 아래서,"헤르만 헤세 (지은이), 김이섭 (옮긴이)",50922,국내도서>소설/시/희곡>독일소설,9788937460500,헤르만 헤세의 자전적 경험이 듬뿍 녹아들어간 성장소설. 신학교에서의 체험을 토대로 썼다. 소년 한스는 마을 사람들의 기대와 격려를 한 몸에 받으며 마울브론 신학교에 입학한다. 하지만 끊임없는 압박으로 다가오는 가족과 고루한 신학교의 종교적 엄숙주의 아래서 한스는 점점 마음이 병들어간다.,"고루하고 위선적인 권위에 맞서 싸우는 소년의 이야기!

노벨문학상을 수상한 헤르만 헤세의 자전소설 『수레바퀴 아래서』. 명예심과 규격화된 인물을 만들려는 교육제도에 의해 서서히 파괴되어 가는 한 인간의 모습을 신랄하게 보여준 작품이다. 슈바츠발트라는 작은 마을에 재능이 풍부한 한스 기벤라트와 헤세 자신의 모습이 담겨있는 하일러 두 소년의 이야기를 담고 있다. 저자는 상반된 성격의 두 인물을 통해 자신이 십대 시절 겪었던 내면의 갈등을 고스란히 보여준다.  ‘수레바퀴 아래서’라는 비유적 표현에서 우리는 한 개인의 내면과는 상관없이 강압적으로 돌아가는 물리적 세계의 톱니에 짓눌린 여린 영혼을 떠올릴 수 있다. 

민감하고 불안정한 소년 한스 기벤라트는 헤세의 분신이다. 한스가 엄격한 신학교의 규율을 이겨내지 못하고 신경쇠약에 걸려 학교에서 쫓겨난 것, 작은 고향 도시로 돌아와 공장의 견습공으로 새로운 삶을 열어 보려 한 것 등은 헤세의 우울한 청소년기와 겹치는 장면들이다. 다만 다른 점이 있다면 헤세가 세계와의 갈등을 극복하고 마침내 자아를 발견하여 자신의 고통스러운 체험을 예술로 승화한 반면 한스는 엄격하고 딱딱한 집안 분위기와 학교 교육 및 사회 전통과 권위에 눌려 파멸하고 만다는 것이다.",30168,BOOK
한권으로 읽는 조선왕조실록 - 개정증보판,박영규 (지은이),1955,국내도서>역사>조선사>조선시대 일반,9788901047546,1996년 출간된 이후 10년이 지난 지금까지 100만부 이상 판매되며 널리 읽혀온 <한권으로 읽는 조선왕조실록>의 개정증보판. 방대한 분량의 <조선왕조실록>을 쉽게 풀어 쓴 책으로 일반 독자들에게서 멀어진 역사를 생활 속으로 끌어들였다는 평가를 받은 바 있다.,"조선을 가장 정통한 역사 기록으로 서술한 책! 한 권으로 조선의 역사를 짚어본다!

『한 권으로 읽는 조선왕조실록』. 증보 개정판. 이상과 현실이 조화를 이룬 인본주의 나라, 조선. 가장 정통한 역사 기록인 을 한권으로 정리한 책이다. 과 왕실 족보인 , 그리고  등을 대조하여 왕들의 가족관계와 가계도를 수정 보완하였다.

이 책에는 조선 사람들의 경제생활과 각종 인구, 시장 정책 등을 시기에 맞게 정리하여 배치하고 있다. 또한 훈민정음 창제 과정과 그 내막에 얽힌 비밀들 그리고 '조사의의 난' 과 같은 꼭 알아야할 사건들을 첨가하는 등 정렬과 무게가 내제되어 있는 깊이 있는 세계인 조선왕조의 역사를 보여준다. 조선왕조의 세계도를 한 장에 담아 한 눈에 볼 수 있도록 하였다.",31126,BOOK
"동아 새국어사전 (색인) - 가죽, 5판, 2009",두산동아 사서편집국 (엮은이),4158,국내도서>외국어>어학사전>국어사전,9788900236224,,,6139,BOOK
무기 팔지 마세요!,"위기철 (지은이), 이희재 (그림)",48874,국내도서>어린이>동화/명작/고전>국내창작동화,9788972787044,"어느 날, 보미는 교실로 들어서다가 경민이가 쏜 플라스틱 비비탄을 얼굴에 맞는다. 보미는 화가 나서 경민이에게 따지지만, 경민이를 포함한 반 남자아이들은 보미의 말에 아랑곳하지 않고 장난감총으로 계속 장난을 친다. 그래서, 보미는 친구들과 '평화 모임'을 만들어 장난감 무기 수거운동을 벌인다.","고학년을 위한 동화『무기 팔지 마세요!』. 이 책은 평화를 바라는 어린이들의 목소리를 담고 있다. 장난감 권총으로 쏜 플라스틱 비비탄을 얼굴에 맞고 친구들과 '평화 모임'을 만든 보미의 이야기와, 무기 판매 금지를 전세계 사람들에게 알리는 제니의 이야기가 수록되어 있다.",14566,BOOK
최열 아저씨의 지구촌 환경 이야기 1 - 청년사어린이인문교양시리즈 1,"최열 (지은이), 노희성 (그림)",48872,국내도서>어린이>과학/수학/컴퓨터>환경 이야기,9788972787198,20여 년 동안 환경 일에 매진해 온 지은이의 절실한 외침이 배어있는 내용이다. 하지만 그 까닭을 들려주는 어조는 맞은 편에 앉은 아이에게 말을 건네듯 친근하다.,"초등학생을 위한 환경 이야기를 담은 책. 이 책에서는 전세계의 환경 문제를 짚어 보면서, 다른 나라 사람들은 환경 문제를 어떻게 해결하는지 이야기를 담고 있다. 또한 지구에 살고 있는 우리가 함께 노력해야 할 것은 무엇인지 살피며, 환경을 생각하고 적극적으로 실천하는 환경 운동에 대해서 알려준다.",12568,BOOK
비폭력 대화,"마셜 B. 로젠버그 (지은이), 캐서린 한 (옮긴이)",51515,국내도서>인문학>심리학/정신분석학>심리치료,9788991428003,"우리가 의식적이든 무의식적이든 일상적으로 사용하고 있는 폭력적인 대화를 극복하는 방법에 대해 이야기한다. 우리가 얼마나 폭력적인 대화방법을 스스럼없이 사용하고 있는지를 밝히면서, 비폭력 대화가 우리 사회와 각 개인을 어떻게 바꿀 수 있는지 이야기한다.","이 책에서는 우리가 얼마나 폭력적인 대화방법을 스스럼없이 사용하고 있는지 밝히면서, 비폭력 대화가 우리 사회와 각 개인을 어떻게 바꿀 수 있는지 이야기한다. 총 13개 장으로 구성되어 있으며, 각 장에서는 비폭력 대화의 개념을 쉽게 이해할 수 있는 설명과 함께 일상생활에서 활용할 수 있는 지침과 사례들이 상세하게 수록되어 있다. 
현재 세계 10여 개국에서 번역 출간되었으며, 분쟁과 갈등을 겪고 있는 전 세계 30여 개국에서 평화와 화해, 중재의 교과서로 사용되고 있다.",6110,BOOK
켄즈케 왕국,"마이클 모퍼고 (지은이), 김난령 (옮긴이)",48877,국내도서>어린이>동화/명작/고전>외국창작동화,9788974749194,"열두 살이 되기 하루 전날 밤, 마이클은 갑판에서 당직을 서다가, 같이 있던 개 스텔라와 함께 바다로 빠져 버린다. 마이클이 눈을 뜬 곳은 어딘지 모를 외딴 섬이었다. 그 곳에서 마이클은 따뜻하고 선량한 노인 켄즈케를 만난다.","마이클은 변함없고 단조롭지만 따사로운 하루하루를 보내던 평범한 소년으로, 평소에는 친구들과 축구경기를 하고, 주말에는 부모님들과 호수에서 보트를 타며 지낸다. 그러나 어느 날 도착한 뜻밖의 편지로 집안의 평화는 어이없이 무너진다. 아빠와 엄마가 함께 일하던 벽돌 공장이 문을 닫은 것이다.



실의의 나날을 보내던 마이클네 가족들은 요트를 사서 세계일주를 떠난다. 엄마는 선장이 되고, 아빠는 부선장 겸 잡역부가 되고, 마이클은 선원이 되어서 말이다. 영국해협을 지나, 아프리카에도 가고, 오스트레일리아에 이민 간 친척을 방문하기도 한다. 그 동안 마이클은 부모님과 함께 공부도 하고 항해일지를 쓰기도 하며 색다른 경험을 한다.



열두 살이 되기 하루 전날 밤, 마이클은 갑판에서 당직을 서다가, 같이 있던 개 스텔라와 함께 바다로 빠져 버린다. 마이클이 눈을 뜬 곳은 어딘지 모를 외딴 섬이었다. 그 곳에서 마이클은 따뜻하고 선량한 노인 켄즈케를 만난다.



켄즈케는 40여 년을 홀로 섬에서 살아온 사람으로, 이미 그 섬에 자신만의 세계를 탄탄하게 만들어 놓은 노인이다. 그러나 켄즈케의 세계는 닫힌 세계가 아니라 열린 세계였고, 마이클을 향해 문을 열어 주었다. 거기에서부터 켄즈케와 마이클 사이에 국적과 연령을 초월한 우정이 시작된다.



여러 작가에 의해 되풀이되고 있는 주제인 '외딴 섬에서의 생활'을 그리고 있다는 이유만으로 이 책을 진부하다 외면할 필요는 없다. 이 책의 중심추는 모든 어려움을 혼자서 극복하는 강인한 인간보다는, 외딴 섬에서 피어난 따뜻한 인간애에 놓여 있기 때문이다. 



은 따뜻한 이야기이다. 가족간의 사랑, 인간과 인간의 만남 그리고 인간과 자연과의 교감이 잔잔하게 때로는 애닯게 그려진다. 1인칭 화법으로 자신의 이야기를 들려주는 지은이의 목소리는 시종일관 낮고 담담하여 읽는 이들이 책 속에 몰입할 수 있게 한다. 



먼 곳으로 떠날 수 있는 용기, 마음과 마음을 열고 서로를 이해하고 신뢰하려 하는 인간으로서의 태도. 이런 가볍지 않은 주제를 한 편의 동화로 만나는 것은 커다란 즐거움이다.",2391,BOOK
"Harry Potter and the Sorcerer's Stone (Paperback, 미국판) - Harry Potter Series, Book 1",J.K. 롤링 (지은이),106216,외국도서>어린이>동화책>고전/명작,9780590353427,갖은 구박을 견디며 이모집에서 생활하던 해리. 해리는 거인 해그리드의 지시대로 호그와트로 떠난다. 런던의 킹스크로스 역에서 호그와트 특급열차를 탄 해리는 열차 안에서 같은 호그와트 마법학교 입학생인 헤르미온느 그레인저와 론 위즐리를 만나 친구가 된다.,"해리 포터와 친구들의 마법학교에서의 모험과 성장을 그린 베스트셀러 소설. 무서운 이모부부와 함께 계단 밑 작은 방에서 비참한 삶을 살던 해리는 부엉이 한 마리가 배달한 초대장에 인생이 바뀌기 시작한다. 새로운 친구와 온갖 마법을 배우며 해리는 어둠의 힘과 결투를 벌이는데....

<b>Harry Potter 시리즈 모두보기 -> Click!</b> 


Harry Potter has never been the star of a Quidditch team, scoring points while riding a broom far above the ground. He knows no spells, has never helped to hatch a dragon, and has never worn a cloak of invisibility. 
All he knows is a miserable life with the Dursleys, his horrible aunt and uncle, and their abominable son, Dudley - a great big swollen spoiled bully. Harry's room is a closet at the foot of the stairs, and he hasn't had a birthday party in eleven years. 

But all that is about to change when a mysterious letter arrives by owl messenger: a letter with an invitation to an incredible place that Harry - and anyone who reads about him - will find unforgettable. 

For it's there that he finds not only friends, aerial sports, and magic in everything from classes to meals, but a great destiny that's been waiting for him... if Harry can survive the encounter.


---From the Publisher",28647,FOREIGN
중앙성가 10,박신화 (지은이),51613,국내도서>종교/역학>기독교(개신교)>성경/찬송가>찬양,9788989926184,,,138,BOOK
이 고쳐 선생과 이빨투성이 괴물,"롭 루이스 (지은이), 김영진 (옮긴이)",48877,국내도서>어린이>동화/명작/고전>외국창작동화,9788972594987,"이고쳐 선생은 매우 유명한 치과 의사이지만 '안돼요'라는 말을 하지 못하는 병을 앓고 있다. 어느날 동물원 사육사 우리 씨가 치통을 앓고 있는 동물을 치료해 달라고 부탁한다. '안돼요'라고 말하지 못하는 이고쳐 선생은 치료해주겠다고 하는데, 알고보니 치료해야 할 동물의 이빨은 무려 만 개나 된다!!",,8209,BOOK
박시백의 조선왕조실록 10 - 선조실록 - 조선엔 이순신이 있었다,박시백 (지은이),117,국내도서>역사>조선사>조선중기(임진왜란~경종),9788958621829,역사교양만화로 만나는 &lt;조선왕조실록&gt;. 10권에서는 선조의 시대를 만난다. 열여섯에 임금이 된 선조. 새로운 세력으로 떠오른 사림은 노.소로 나뉘어 대립하고 또다시 동.서 붕당으로 나뉘어 격렬하게 대립한다. 선조는 붕당을 견제할 목적으로 이이를 등용한다. 열정적인 개혁정치가 이이는 퇴락해 가는 나라를 구하기 위해 경장을 외치지만 받아들여지지 않는데…,,1953,BOOK
유아종이 접기교실,노영혜 (지은이),35113,국내도서>유아>놀이책>유아 만들기/접기,9788976222176,,,12060,BOOK
써프라이즈 오딧셈의 수학대모험 3 - 방정식과 함수,"강상균 (지은이), 박철권 (그림), 안소정",48871,국내도서>어린이>과학/수학/컴퓨터>초등 수학,9788992010085,"무지막지단의 살벌한 추격을 피해 그리스와 이집트를 거쳐 오딧셈 일행이 도착한 곳은 바로 메소포타미아 지방의 중심 도시 바빌론. 그리스와 이집트에서 수와 도형으로 기본 수학을 마스터한 오딧셈이 바빌론에서는 대수와 기하를 통해 고급수학의 세계로 입문하게 된다. 방정식, 비와 비율, 소수, 함수, 좌표와 그래프, 도형의 대칭, 구의 부피 등을 다룬다.","수학에 대한 고정관념을 없애주는 초중생을 위한 수학소설!

『오딧셈의 수학대모험』시리즈 제3권. 본 시리즈는 순간순간 눈을 뗄 수 없는 긴박한 모험담 속에, 초등학교 3학년부터 중학교 1학년까지의 '수학' 교과서에 나오는 중요한 수학 개념과 원리들을 자연스럽게 녹아낸 수학소설입니다. 각 권별로 역사적으로 중요한 순간을 배경으로 삼고 있어, 수학 지식은 물론 역사 지식도 배울 수 있습니다. 

3권에서 오딧셈, 이프네, 막쇠무스는 바벨론으로 향합니다. 하지만 사막에서 모래바람을 만나 오딧셈과 막쇠무스는 이프네와 헤어지게 됩니다. 한편 이프네는 바벨론의 신전에 갇히게 됩니다. 이때 바벨론 신전에 도착한 오딧셈은 바벨론 밭의 수확량이 줄어드는 이유를 밝히는데….",2277,BOOK
경제 속에 숨은 광고 이야기,"프랑크 코쉠바 (지은이), 야요 가와루마 (그림), 강수돌 (옮긴이)",48909,국내도서>어린이>사회/역사/철학>정치/경제/법,9788992161046,"독일 광고업계의 전문가이자 두 아이의 아버지이기도 한 저자가 광고업계의 비밀을 낱낱이 털어놓는다. 텔레비전을 비롯해 인터넷, 휴대폰, 패스트푸드점, 십지어 학교 안에서도 이루어지는 광고가 어린이들의 의식과 행동에 어떤 영향을 주는지 많은 사례를 들어 설명한다. 그리하여 광고의 홍수 속에서 어린이들이 지혜로운 소비 생활을 할 수 있도록 도와주는 경제 교육서.",,1986,BOOK
외고 아이들,정우영 (지은이),1149,국내도서>청소년>청소년이 쓴 책,9788991010390,"공부 좀 한다하는 아이들이 모인다는 특목고. 특목고에 들어가기 위해서는 어떻게 준비해야 하고, 특목고에서 생활하는 아이들은 과연 어떤 모습으로 살아갈까? 그리고 그들은 어떤 방식으로 입시와 유학을 준비하는 것일까? 이 책은 9명의 특목고 아이들이 특목고 준비에서부터 특목고의 생활 전반, 미래에 대한 준비까지 그들의 생각과 경험을 솔직담백하게 고백한 책이다.",,1157,BOOK
박씨전 : 낭군 같은 남자들은 조금도 부럽지 않습니다,"장재화 (지은이), 김형연 (그림)",7268,국내도서>청소년>청소년 고전,9788987402475,"전국국어교사모임에서 기획한 '국어시간에 고전읽기' 시리즈의 네번째 권. 17세기 후반에 씌어진 것으로 짐작되는 <박씨전>을 담았다. 이 소설은 여성 영웅의 이야기를 다룬 고전 소설로, 억압당한 여성의 꿈과 희망, 그리고 병자호란이라는 치욕적 전쟁에 대한 당대 백성의 고통을 다루고 있다.",,7233,BOOK
