title,author,genre_id,genre,ISBN,description_aladin,description_naver,salesPoint,mallType
"마법천자문 10 - 강철의 주먹, 주먹 권拳","스튜디오 시리얼 (지은이), 김창환 (감수)",48941,국내도서>어린이>어린이 한자>학습만화,9788950936099,"이번 출간된 10권에는, 1~10권까지의 마법한자 200자를 총정리한 두 장의 브로마이드를 부록으로 증정한다. 그간 <마법천자문>으로 학습한 한자를 일목요연하게 정리한 브로마이드로, 벽에 걸어두고 공부하기에 좋다.",,20302,BOOK
지도 밖으로 행군하라,한비야 (지은이),51371,국내도서>에세이>한국에세이,9788971844427,"'바람의 딸' 한비야가 <한비야의 중국견문록> 이후 4년 만에 펴내는 책. 월드비전 긴급구호 팀장으로 지구촌 곳곳을 누비며 써내려간 5년 간의 기록이자, 자유롭고 거침없는 한비야의 삶에 관한 보고서이다.","바람의 딸, 한비야의 『지도 밖으로 행군하라』. '바람의 딸'로 불리며 유명인이 된 저자는 어느 날, 세계긴급구호 팀장이라는 낯선 직위를 얻고 세상 속으로 다시 뛰어들었다. 그리고 '재미있는 세계 여행이나 하지 왜 긴급구호를 하느냐'라는 물음을 뒤로 한 채 5년이 흘렀다. 

이 책은 저자가 5년간 세계긴급구호 팀장으로 활동한 보고서다. 아프가니스탄, 이라크, 네팔, 팔레스타인, 이스라엘, 그리고 북한 등 긴급구호가 필요한 나라를 떠돌아다니며 그곳에서 사랑과 도움을 펼치고 돌아온 저자의 이야기가 감동적으로 펼쳐진다. 아울러 세상은 먹거나 먹히는 정글의 법칙만으로는 돌아가지 않는다는 것을 깨닫게 해주면서, 에너지와 가능성을 선사하고 있다.",49694,BOOK
나니아 연대기,"C. S. 루이스 (지은이), 폴린 베인즈 (그림), 햇살과나무꾼 (옮긴이)",51120,국내도서>소설/시/희곡>판타지/환상문학>외국판타지/환상소설,9788952744852,출간 이후 29개 언어로 번역되어 9000만 부 이상 판매된 세계적인 베스트셀러이자 스테디셀러 <나니아 연대기>(전7권)가 한 권짜리 합본으로 출간됐다. '옷장 문을 열고 들어가면 나니아라는 마법의 세계가 있다'는 모티프에서 비롯된 이 모험담은 가상의 나라 '나니아'의 창조부터 멸망에 이르기까지의 이야기를 담고 있다.,,13538,BOOK
마시멜로 이야기,"호아킴 데 포사다, 엘렌 싱어 (지은이), 정지영, 김경환 (옮긴이)",70211,국내도서>자기계발>행복론,9788947525473,왜 나의 하루는 항상 똑같을까? 왜 나는 내일의 행복보다는 오늘의 달콤한 유혹 앞에 머뭇거리고 있을까? 이런 고민에 빠진 사람들을 위해 당대 최고의 동기부여가인 저자가 꿈과 용기의 시간으로 독자들을 초대한다.,120만 독자의 인생을 변화로 이끈 책! 삼성경제연구소와 대한민국 CEO들이 선정한 자기계발 필독서!! 왜 나의 하루는 똑같을까? 왜 나는 내일의 행복보다 오늘의 달콤한 유혹 앞에 머뭇거리고 있을까? 이런 고민에 빠진 사람들을 위해 당대 최고의 동기부여가인 저자가 꿈과 용기의 시간으로 독자들을 초대한다.,60566,BOOK
해리 포터와 혼혈왕자 세트 - 전4권 (무선),"J.K. 롤링 (지은이), 최인자 (옮긴이)",51120,국내도서>소설/시/희곡>판타지/환상문학>외국판타지/환상소설,9788983922007,"2년만에 해리 포터가 돌아왔다. 2005년 11월, 전4권으로 완간 예정. 'Half blood prince'는 용감하고 자격이 있는 왕자란 뜻의 'full blood prince'를 약간 비꼬는 말로, 대접받을 자격이 없거나 비겁한 왕자를 지칭할 때 주로 사용된다고. 이 제목은 원래 2편 <비밀의 방>에 쓰려고 했던 것이라고 하며, 여기서 말하는 'half blood prince'는 해리 포터도, 볼드모트도 아니라고 했다.",,13097,BOOK
모모,"미하엘 엔데 (지은이), 한미희 (옮긴이)",48875,국내도서>어린이>동화/명작/고전>세계명작,9788949190020,"사람들에게서 행복과 풍요로움을 주는 시간을 빼앗아간 회색 신사들과 여자 아이 모모, 호라 박사 등이 벌이는 모험을 다룬 소설. 꿈 속에서 벌어질 법한 갖은 이야기들이 줄줄이 펼쳐진다.","시간은 삶이며, 삶은 우리 마음 속에 있다!

시간 도둑들과 도둑맞은 시간을 인간에게 찾아주는 어린 소녀 모모에 대한 이상하고도 흥미진진한 이야기. 독일의 문학작가, 미하엘 엔데의 작품으로, 현실과 꿈이 시처럼 어우러진 환상의 세계를 그려내고 있다. 

이탈리아의 어느 한 도시, 회색 사나이들이 지배하는 이 도시에 어디에서 왔는지 알 수 없는 '모모'라는 이상한 아이가 나타난다. 모모는 다른 사람의 이야기를 잠자코 들어줌으로써 인간에게 주어지는 시간의 풍요와 아름다움을 깨닫게 하는데…. 이 책을 통해 작가는 바쁘기 짝이 없고, 마음 놓고 쉴 수조차 없는 현대인들에게 '시간은 삶이고, 삶은 우리 마음속에 깃들어 있다'는 메시지를 전해준다.",75672,BOOK
살아 있는 동안 꼭 해야 할 49가지,"탄줘잉 (엮은이), 김명은 (옮긴이)",70211,국내도서>자기계발>행복론,9788989313496,"'일기와 자서전 쓰기, 날마다 15분씩 책 읽기, 악기 하나 배워보기, 어려운 사람들을 위해 기부하기...' 우리가 살아 있는 동안 지금 바로 실행에 옮겨야 할 49가지를 감동적인 이야기와 그림으로 담아낸 따뜻한 에세이집이다.",,24579,BOOK
긍정의 힘 - 믿는 대로 된다,"조엘 오스틴 (지은이), 정성묵 (옮긴이)",51601,국내도서>종교/역학>기독교(개신교)>기독교(개신교) 신앙생활>신앙생활일반,9788996210429,"미국의 차세대 지도자로 급부상하고 있는 조엘 오스틴의 책. ""하나님이 주시는 긍정의 힘을 믿는다면 누구나 최고의 삶을 살 수 있다""라는 희망찬 메시지를 전한다.
미국에서는 출간 직후부터 화제가 되어 뉴욕타임즈 베스트셀러 1위, 아마존닷컴  베스트셀러 등에 올랐다.","믿는 대로 된다는 '긍정의 힘'을 강조하는 조엘 오스틴 목사의 『긍정의 힘』. 미국 차세대 리더로 급부상하고 있는 저자의 저서로, 최선의 삶을 위한 7단계를 안내하고 있다. 단계별로 실질적인 제안과 조언을 제공하며, 오늘을 온전히 살기 위한 구체적인 방법을 알려준다. 

이 책이 말하는 마음의 힘은 '하나님 안에서 품는 긍정의 힘'이다. 저자가 안내하는 7단계를 거침으로써 평범함을 넘어 잠재력을 끝까지 발휘할 뿐 아니라, 발목을 잡고 있는 부정적인 태도를 벗어던져 비전을 품을 수 있도록 인도한다.",34502,BOOK
설득의 심리학 - 사람의 마음을 사로잡는 6가지 불변의 법칙,"로버트 치알디니 (지은이), 이현우 (옮긴이)",70226,국내도서>자기계발>협상/설득/화술>설득,9788950905224,"다른 사람이 베푼 호의를 그대로 갚아야 한다는 강박관념이 작용하는 상호성의 법칙, 말이나 행동에 일관성을 보여야 한다는 부담을 느낀다는 일관성의 법칙, 예쁘면 모든 것이 용서된다는 호감의 법칙 등 인간심리를 여실히 보여준다.","이 책은 누군가를 설득하기 위해서 사람의 심리를 이용하는 방법을 담고 있다. 저자는 자신의 이론을 여러가지 사례와 재미있는 상황들로 증명하고 있다. 상호성의 법칙, 일관성의 법칙, 사회적 증거의 법칙, 호감의 법칙, 권위의 법칙, 희귀성의 법칙 등 사람의 마음을 사로잡는 6가지 불변의 법칙을 강조하고 있다.",45506,BOOK
끌리는 사람은 1%가 다르다,이민규 (지은이),70216,국내도서>자기계발>성공>성공학,9788984053229,"무슨 일이든 함께 하고 싶은 사람, 생각만 해도 기분이 좋아지는 사람은 분명 따로 있다. <1%만 바꿔도 인생이 달라진다>의 저자 이민규 심리학 박사가 새롭게 제안하는 행복과 성공을 위한 인간관계 리모델링 프로젝트. 직장동료와 고객, 상사 또는 친구, 가족 등 인간관계를 건강하게 만드는 25가지 비결을 제시한다. 인생의 성공 뒤에는 언제나 끌림이 있다.","매력적인 사람이 되는 비결은? 상대가 나한테 끌리게 만드는 1%의 차이!

『끌리는 사람은 1%가 다르다』는 행복한 인간관계를 위한 25가지의 셀프 리모델링을 제시한 책으로, 인간관계로 고민하는 사람들에게 유용한 해결의 실마리를 제공한다. 심리학자인 저자는 남들이 친해지고 싶은, 만나면 유쾌해지는, 그래서 다시 만나고 싶은 사람으로 거듭나는 방법을 알려준다. 

또한 인간관계 뒤에 숨은 심리를 명쾌하게 해명하여 인간관계와 비즈니스에서 원하는 바를 얻는 데 많은 도움이 될 것이다. 첫 만남, 관계의 발전, 지속되는 만남 등 3개 주제로 나누어 '다시 보고 싶은 인상을 남기는 방법, 상대방이 나를 계속 만나고 싶다고 느끼게 만드는 법칙, 효과적인 관계 유지 방안'을 설명한다.

특히 일상생활과 비즈니스 인간관계의 기본 원리가 너무 단순하다는 것, 실천은 어렵지만 그 결과는 인생을 유쾌하게 바꿔놓는다는 것을 재미있는 사례들로 인식시킨다. 아울러 책을 읽는 중간 중간 'Stop & Think'를 통해 자신의 행동을 돌아보고 다양한 대안들을 찾아 지금 당장 실천할 수 있는 기회를 제공한다.

☞ 이 책의 독서 포인트!
'이렇게 해야 한다', '이렇게 하라'고 강요하지 않고 일상생활에서 누구나 겪었을 듯한 사례들을 제시하여 자신의 행동을 되돌아보게 한다. 그리고 끌리는 사람과 다시는 보고 싶지 않은 사람의 차이를 자연스럽게 파악하도록 하였다.",35587,BOOK
잃어버린 여행가방 - 박완서 기행산문집,박완서 (지은이),52904,국내도서>에세이>명사에세이>문인에세이,9788939205314,"박완서 신작 기행 산문집. 그동안 써온 12편의 기행 산문을 모아 엮었다. 인간의 삶에 대한 깊은 통찰력을 지닌 작가는, 감칠맛 나는 문장을 생산하는 우리 시대 몇 안 되는 산문가이기도 하다. 이 책은 작가 박완서의 여행기록이면서, 동시에 인생이란 긴 여정에 대한 거장의 철학을 담고 있다. 감성을 자극하는 그만의 독특하고 즐거운 글맛과, 소박하지만 긴 여운을 전해주는 글이 미소를 머금게 한다.","박완서 신작 기행 산문집. 그동안 써온 12편의 기행 산문을 모아 엮었다. 인간의 삶에 대한 깊은 통찰력을 지닌 작가는, 감칠맛 나는 문장을 생산하는 우리 시대 몇 안 되는 산문가이기도 하다. 이 책은 작가 박완서의 여행기록이면서, 동시에 인생이란 긴 여정에 대한 거장의 철학을 담고 있다. 감성을 자극하는 그만의 독특하고 즐거운 글맛과, 소박하지만 긴 여운을 전해주는 글이 미소를 머금게 한다.



""이 나라의 자연처럼 아기자기하게 아름다운 자연은 지구상에 어디에도 없다. 신이 온갖 좋은 것을 다 모아다가 공들여 꾸민 정원 같다. 하나도 넘치게 준 게 없이 다만 조화롭게 주었을 뿐이다.""



1부에는 작가가 이렇듯 사랑하는 우리 나라를 여행하며 쓴 글을 담았다. 남도, 하회마을, 섬진강 벚꽃길과 쌍계사, 오대산 일대를 여행하며 쓴 글 속에는 아름다운 자연에 대한 경외와 그리움이 묻어난다. 이름 없이 살다 간 사람들이 사연 많은 삶을 읽어내고, 자연의 정기가 되어 자연을 빛나게 하는 위대한 영혼의 자취를 느낀다. '정기가 없는 자연은 경치에 불과하다'는 작가의 말처럼, 자연과 인간의 교감을 읽어내는 섬세한 눈길이 따뜻하면서도 애잔하다.



2부는 작가의 개인적 체험과 역사적 사연이 담긴 기행글들이 주로 실려 있다. '잃어버린 여행가방'은 오래전 여행가방을 잃어버린 경험을 떠올려 인생이란 긴 여행을 사색한 글이며, 교황 요한 바오로 2세의 장례식에 참석해 쓴 '그 자리에 있다는 감동-바티칸 기행', 역사학자 이이화.송우혜와 함께 중국과 백두산의 독립운동 유적지를 방문한 '아! 참 좋은 울음터로구나-중국.백두산 기행', 상해와의 특별한 인연을 다룬 '상해기행' 등이 실렸다.



3부 '그래도 삶은 계속된다'는 유니세프 친선대사로 활동하면서 기아와 가난으로 고통받고 있는 에티오피아와 쓰나미가 휩쓸고 간 인도네시아를 방문한 기록이다. 어른들의 잘못으로 죄 없는 아이들이 고통받는 현실은 외면하고 싶은 우리의 치부이지만, '그래도 삶을 계속해나가는' 인간의 위대한 생명력이 숙연한 감동을 느끼게 한다.



4부 '해오의 여정'은 초자연적인 외경의 마력 앞에서 자기 존재를 되묻는 아픈 해오(解悟) 속의 순례이다. 티베트와 네팔의 오염되지 않은 자연과 순연한 사람들, 정결한 생활모습, 쓰레기마저 완전 순환되는 땅을 통해 현대문명의 소용돌이에 빠진 우리들에게 삶의 본질적 조건을 질문한다.



오체투지로 설산과 자갈밭을 고행하는 사람들의 그 만행의 법열을 이방인이 해독한다는 것은 모독일 수 있지만, 전생의 인연 속에서 만났음직한 미치게 푸른 하늘과 뭉게구름, 정복되지 않은 대지와 순연한 사람들의 미소, 부처와 라마의 미라, 그리고 저 모래바람 속의 침묵까지 사유하여 회화적으로 결정지어 보여주는 티베트-네팔 기행기는, 탁월한 리얼리스트의 지안이 그려낸 성(聖)과 속(俗)에 대한 풍경이다. 1997년 출간된 의 내용과 일부 겹친다.



작가의 깊은 연륜이 더해져 같은 시대를 살아가는 모든 이들에게 소박한 감동을 건네는 기행산문집이다.",4898,BOOK
연금술사,"파울로 코엘료 (지은이), 최정수 (옮긴이)",50920,국내도서>소설/시/희곡>스페인/중남미소설,9788982814471,"세상을 두루두루 여행하기 위해 양치기가 된 청년 산티아고의 '자아의 신화' 찾기 여행담. 자칫 딱딱하게 보일 수 있는 제목과는 달리 간결하고 경쾌한 언어들로 쓰여 있어서, 물이 흘러가듯 수월하게 읽히는 작품이다.","삶에 대한 깊은 통찰을 담은 현대의 고전!

1987년 출간이후 전세계 120여 개국에서 변역되어 2,000만 부가 넘는 판매량을 기록한 파울로 코엘료의 『연금술사』. 청년 산티아고가 만물에 깃들인 영혼의 언어들을 하나하나 배워가는 과정을 그리고 있다. 마음의 목소리에 귀를 기울이는 것이 얼마나 중요한지를 증언하고, 진정 자기 자신의 꿈과 대면하고자 하는 모든 이들을 축복하는 희망과 환희의 메시지를 담은 작품이다. 

신부가 되기 위해 라틴어, 스페인어, 신학을 공부한 산티아고는 어느 날 부모님의 기대를 저버리고 떠돌아다니기 위해 양치기가 되어 길을 떠난다. 그의 인생을 살맛나게 해주는 건 ‘꿈이 실현되리라고 믿는 것’. 언제나 자신이 원하는 게 무엇인지 알고 있어야 한다는 늙은 왕의 말과 그가 건네준 두 개의 보석을 표지로 삼아 기약없는 여정에 뛰어든 그는 집시여인, 늙은 왕, 도둑, 화학자, 낙타몰이꾼, 아름다운 연인 파티마, 절대적인 사막의 침묵과 죽음의 위협 그리고 마침내 연금술사를 만나 자신의 보물을 찾게 되는데…….",82666,BOOK
코믹 메이플 스토리 오프라인 RPG 13,"송도수 (지은이), 서정은 (그림)",49995,국내도서>어린이>TV/만화/영화>만화 일반,9788953297609,,"인기 온라인 게임『메이플스토리』를 만화화한 ≪코믹 메이플스토리 오프라인 RPG≫ 시리즈 제13권.  안의 동쪽 구역을 살피던 델리키와 바우는 을 발견하고, 그곳에서 초키와 링, 그리고 준을 만나게 된다. 이 꼬마들의 정체를 단번에 알아차린 델리키는 가까이 하지 말라고 바우에게 충고하지만 바우는 그저 귀여운 동생들이라며 사랑스러워 어쩔 줄 몰라한다.
바우의 정성어린 보살핌에도 호시탐탐 해칠 기회만을 노리던 초키와 링, 준도 점차 마음이 흔들리게 된다. 급기야는 자신들의 정체를 고백하게 되는데…. 이 세상을 구할 위대한 전사 메이플 전사의 이야기를 담은 만화책.",2204,BOOK
마법천자문 9 - 믿는 마음! 믿을 신信,"스튜디오 시리얼 (지은이), 김창환 (감수)",48941,국내도서>어린이>어린이 한자>학습만화,9788950936082,"한자 학습만화 <마법천자문> 9권이 출간되었다. 9권에서는 확실한 한자 복습을 위해 교육페이지를 대폭 개편했다. 뜻과 소리를 외치는 마법 주문으로 한자를 외우고, 손으로는 획순대로 한자를 그려보는 구성이다. 본문에 등장하는 한자를 재미있는 게임과 퀴즈를 통해 복습할 수 있다.",,20778,BOOK
다 빈치 코드 1,"댄 브라운 (지은이), 양선아 (옮긴이), 이창식 (감수)",51062,국내도서>소설/시/희곡>추리/미스터리소설>영미 추리/미스터리소설,9788957590515,책은 루브르 박물관장 소니에르가 살해되는 장면으로 시작한다. 심야의 박물관 안에서 기묘한 포즈로 누워있는 시체. 하지만 관장은 그전에 종교기호학 교수 로버트 랭던과 암호전문가인 손녀 소피에게 암호화된 메시지를 남긴다.,,25516,BOOK
다 빈치 코드 2,"댄 브라운 (지은이), 양선아 (옮긴이)",51062,국내도서>소설/시/희곡>추리/미스터리소설>영미 추리/미스터리소설,9788957590522,"예기치 않게 거대한 사건에 휘말리게 된 랭던과 소피는 레오나르도 다 빈치의 그림에 담긴 단서들을 추적하며, 2천년 동안 숨겨져왔던 비밀을 파헤치게 되는데...",,25787,BOOK
마법천자문 7 - 쏘아라! 쏠 사射,"스튜디오 시리얼 (지은이), 김창환 (감수)",48941,국내도서>어린이>어린이 한자>학습만화,9788950936068,전국 초등학생들 사이에 한자 열풍을 일으킨 마법천자문 7권이 나왔다! 7권에는 마법에 걸린 삼장을 구할 열쇠를 가진 저팔계를 찾아간 손오공 일행의 흥미진진한 모험이 펼쳐진다.,"손오공의 한자 대탐험『마법천자문』제7권 . 스스로 시리즈를 반복해서 읽음으로써 한자를 저절로 익힐 수 있도록 안내한다. 한자카드로 게임을 하면서 한자의 모양과 뜻, 소리를 익힐 수 있고, 과 으로 본권에서 배운 한자를 공부할 수 있다. 단계별 연습 문제로 한자 학습을 완성할 수 있으며, 책에서 배운 한자를 일상생활에서 자연스럽게 사용할 수 있다.",22700,BOOK
책 먹는 여우 - 좋은아이책,"프란치스카 비어만 (지은이), 김경연 (옮긴이)",48877,국내도서>어린이>동화/명작/고전>외국창작동화,9788934908067,"'이솝 우화'를 우화의 전부로 아는 이들에게 선사하는 새로운 감각의 현대 우화이다. 책을 쓰는 인간보다 더 책을 사랑하는 여우(물론 그가 책을 사랑하는 방식은 좀 여우적(?)이기는 하다)를 통해, 책이 어떤 의미와 가치를 갖는가를 다소 희극적으로 재미있게 이야기한다.","여우 아저씨가 책을 먹어버린대!

책에 대한 사랑이 지나쳐 급기야는 책을 먹게 된 여우 이야기!『책 먹는 여우』는 책에 빠진 독자의 모습을 과장되었지만 일리있게 표현하고 있다. 여우 아저씨는 책을 너무나 좋아했다. 급기야는 책을 다 읽은 다음 소금 한 줌, 후추 조금을 뿌려 꿀꺽 먹었다. 하지만 책값이 워낙 비싼 탓에 마음껏 책을 읽고 먹을 수가 없었다. 결국 여우 아저씨는 도서관을 털기로 결심하는데…….",63670,BOOK
마법천자문 6 - 지어라! 이름 명名,"스튜디오 시리얼 (지은이), 김창환 (감수)",48941,국내도서>어린이>어린이 한자>학습만화,9788950936051,손오공의 모험 이야기를 따라가면서 한자를 익혀보는 한자학습만화. 한자 공부에 대한 부담감을 떨쳐버릴 수 있게끔 그림과 스토리에 코믹함을 대폭 가미했다.,,23810,BOOK
마법천자문 1 - 불어라! 바람 풍風,"스튜디오 시리얼 (지은이), 김창환 (감수)",48941,국내도서>어린이>어린이 한자>학습만화,9788950936006,"손오공의 모험 이야기를 따라가면서 한자를 익혀보는 한자학습만화. 그림과 스토리에 코믹함을 대폭 가미했으며, '마법천자문 카드'로 게임을 즐길 수도 있다. 손오공이 '바람 풍(風)'자를 쓰면 거센 바람이 휘몰아쳐 악당들을 사방팔방 날려버린다는 식의 설정이 흥미진진하다.","손오공의 한자 대탐험『마법천자문』제1권 . 스스로 시리즈를 반복해서 읽음으로써 한자를 저절로 익힐 수 있도록 안내한다. 한자카드로 게임을 하면서 한자의 모양과 뜻, 소리를 익힐 수 있고, 과 으로 본권에서 배운 한자를 공부할 수 있다. 단계별 연습 문제로 한자 학습을 완성할 수 있으며, 책에서 배운 한자를 일상생활에서 자연스럽게 사용할 수 있다.",32750,BOOK
선택,"스펜서 존슨 (지은이), 형선호 (옮긴이)",70216,국내도서>자기계발>성공>성공학,9788935206223,"베스트셀러 <누가 내 치즈를 옮겼을까?>, <선물>에 이은 최신작. 이번 신간은 우리의 삶을 만들어 주는 순간 순간의 선택에 대한 답을 담고 있다. 산행길에 우연히 만난 신사, 그리고 그가 들려주는 더 나은 결정을 위한 조건들. 단순한 진리로 인생의 핵심을 통찰하는 그의 능력이 유감없이 발휘된 책이다.",,6190,BOOK
곤충 세계에서 살아남기 2,"코믹컴 (지은이), 네모 (그림)",112080,국내도서>어린이>학습만화,9788937840524,평범하게 일상을 살아가던 주인공들이 갑자기 극한 상황에 처해 서바이벌 모험을 벌이면서 그에 필요한 각종 서바이벌 상식들과 자연과학 지식들을 배우게 되는 본격 에듀테인먼트 만화.,,8370,BOOK
사랑 후에 오는 것들 - 공지영,공지영 (지은이),50993,국내도서>소설/시/희곡>한국소설>2000년대 이후 한국소설,9788973818693,"2005년 5월 16일부터 12월 1일까지, 서울과 파리에 있는 두 작가가 서로 이메일을 주고받으며 '한겨레신문'에 '먼 하늘 가까운 바다'라는 제목으로 연재한 글을, 제목을 바꿔 단행본으로 펴냈다.",,9069,BOOK
마법천자문 5 - 열려라! 열 개開,"스튜디오 시리얼 (지은이), 김창환 (감수)",48941,국내도서>어린이>어린이 한자>학습만화,9788950936044,"마법천자문은 이미지 학습법을 통해 한자의 특징 있는 모양, 뜻과 음을 한꺼번에 기억하게 하고, 아이들 눈높이에 맞게 만화로 재미있게 구성했기 때문에 아이들이 보다 쉽게 한자를 배울 수 있습니다.",,26436,BOOK
강의 - 나의 동양고전 독법,신영복 (지은이),51378,국내도서>인문학>교양 인문학,9788971992029,"자본주의 체제가 양산하는 물질의 낭비와 인간의 소외, 그리고 인간관계의 황폐화를 보다 근본적인 시각으로 재조명하는 신영복 선생의 고전강의를 책으로 엮었다. <시경>, <서경>, <초사>, <주역>, <논어>, <맹자>, <노자>, <장자>, <묵자>, <순자>, <한비자>를 '관계론'의 관점으로 새롭게 읽고 있다.","우리 시대의 지성, 신영복의 동양고전 강의!

자본주의 체제의 물질 낭비와 인간의 소외, 황폐화된 인간관계를 근본적인 시각으로 재조명하는 신영복의 동양고전 강의. 성공회대학교에서 '고전 강독'이란 강좌명으로 진행되었던 신영복 교수의 강의 내용을 정리한 책이다. 저자는 고전 독법에서 과거에 대한 재조명이 가장 중요하다고 이야기하며, 당대 사회의 당면 과제에 대한 문제의식이 고전 독법의 전 과정에 관철되고 있어야 한다고 강조한다. 

이 책에서는 그런 저자의 관점이 반영된 고전 강독을 토대로 과거를 재조명하며 현재와 미래의 방향을 모색하고 있다. 시경, 서경, 초사, 주역, 논어, 맹자, 노자, 장자, 묵자, 순자, 한비자, 불교, 신유학, 대학, 중용, 양명학을 관계론의 관점으로 살펴보고 다양한 예시 문장을 통해 관계론적 사고를 재조명할 수 있도록 구성하였다.",28973,BOOK
