title,author,genre_id,genre,ISBN,description_aladin,description_naver,salesPoint,mallType
어제 뭐 먹었어? 1,요시나가 후미 (지은이),6130,국내도서>만화>순정만화>그 남자들의 사랑,9788954226752,"가정에서도 즉시 활용할 수 있는 생생한 레시피와 함께 소개되는 게이 커플 시로와 켄지, 그리고 주변 사람들과의 소소한 일상.",&lt;서양골동양과자점&gt;의 작가 요시나가 후미의 신작. 미중년 변호사가 선사하는 일본가정요리의 진수를 보여준다. 더불어 요시나가 후미의 스페셜 요리 팁이 함께 수록되어 있다.,1906,BOOK
2009 이철수 판화 달력 (벽걸이용 중형),이철수 (지은이),31307,국내도서>달력/기타>2009년 달력/가계부>2009년 달력,8809260370074,,,139,BOOK
사랑의 기술 - 출간 50주년 기념판,"에리히 프롬 (지은이), 황문수 (옮긴이)",51381,국내도서>인문학>인문 에세이,9788931001143,"정신분석학적 입장에서 사랑의 본질을 분석하고 사랑에 대한 기술을 논의한 책. 인류의 영원한 화두인 '사랑'에 대한 탁월한 통찰을 보여주는 저작으로, 1956년 처음 발표되어 고전으로 자리잡았다. 출간 50주년을 맞아 새롭게 출간된 기념판에는 프롬의 마지막 조수를 지낸 라이너 풍크 박사의 후기가 실려 있다.","사랑하는 사람들을 위한 필독서, 출간 50주년 기념판!

성숙한 사랑을 꿈꾸는 인류를 위한 현대의 고전, 에리히 프롬의 『사랑의 기술』 출간 50주년 기념판. 예리한 통찰로 사랑이 감정이나 느낌이 아니며, 의지이자 노력, 결의이자 판단, 그리고 약속임을 강조하는 책으로, 정신분석학적으로 사랑의 본질을 분석ㆍ해석하고, 사랑의 이론과 기술을 설명하고 있다. 

출간 50주년 기념판에서는 프롬과 마지막까지 함께한 라이터 풍크의 '에리히 프롬의 삶과 사랑'을 수록했다. 프롬의 생애를 담은 것은 물론, 프롬의 사랑에 대해 검토함으로써, 프롬이 이 책에서 이야기하고 있는 '사랑의 기술'을 실천하면서 살았는지 등에 대한 우리의 의문을 풀어준다. 관련 사진도 담아냈다.

*5판 출간예정",11293,BOOK
2009 키워드 경제사전 - 경제에 관한 모든 지식,곽해선 (지은이),8586,국내도서>경제경영>경제학/경제일반>경제이론/경제사상,9788925531137,"경제전문가가 직접 구성·집필한 경제용어사전. 현실경제에 비추어 시사성 높은 용어를 고르고, 그 중에서도 중요한 용어는 사례를 통해 설명했다. 금산분리, 키코사태, 공적자금, 서브프라임 모기지론 등 국내외 쟁점 사안에 대해서는 문제의 소재와 진행 과정에서 향후 전망까지 전문가적 시각에서 깊이 있게 다루었다.",,310,BOOK
얼굴 빨개지는 아이,"장자크 상페 (지은이), 김호영 (옮긴이)",51376,국내도서>에세이>사진/그림 에세이,9788932902456,"산뜻한 그림과 익살스런 유머, 간결한 글로 읽는이의 사랑을 받고 있는 상페의 그림 이야기. 시도 때도 없이 얼굴이 빨개지는 특이한 병때문에 따돌림받고 외로워하는 아이가, 역시 시도 때도 없이 재채기를 쏟아내는 아이를 만나면서 키워가는 우정을 이야기하고 있다.",,5262,BOOK
네 안에 잠든 거인을 깨워라 - 개정판,"앤서니 라빈스 (지은이), 조진형 (옮긴이)",70216,국내도서>자기계발>성공>성공학,9788956371344,"전 세계 천만 권 이상 팔린 베스트셀러 &lt;네 안에 잠든 거인을 깨워라&gt; 개정판. 거인이란 사람 안에 잠들어 있는 '잠재력'을 말한다. 저자는 거인을 깨우는 과정을 현대심리학의 신경언어 프로그래밍(Neuro Linguistic Programming), NLP 이론을 바탕으로 체계화하여 소개한다.","변화심리학의 권위자 앤서니 라빈스가 전해주는 '삶'에 대한 경이로운 발견!

내 안에 잠들어 있는 거인을 깨워라!『네 안에 잠든 거인을 깨워라』는 변화의 필요성을 역설하고, 변화하는 습관을 실제로 몸에 배게 하려면 어떻게 해야 하는지를 알려준다. 도전을 시도하게 하는 열정, 인간 심리와 행동의 연결 구조 등을 정확히 밝혀 실제적인 변화를 이끌어낸다.

이 책은 폭발적인 에너지와 설득력으로 지금까지 수많은 사람들의 삶을 변화시켜왔다. 이번 판은 저자의 강렬한 메시지를 더욱 선명히 하였다. 본문을 새롭게 번역하고 용어와 표현들도 세심하게 다듬었다. 세계적인 카운슬러이자 행동변화 전문가인 앤서니 라빈스는 ""거인이여 깨어나라!""는 강력한 메시지를 던지며 본문을 시작한다.

그리고 결단, 신념, 변화, 혁신, 비유, 집념 등의 키워드 아래 운명을 개척하는 잠재력에 대해 이야기한다. 그런 다음 우리의 운명을 결정하는 힘, 새로운 삶을 창조하는 7일 프로그램을 제시한다. 특히 인간 심리에 대한 해박한 지식과 사례를 들어 내용을 구체적으로 이해시킨다. (개정판)",5952,BOOK
"세계최고의 여행기, 열하일기 - 상","박지원 (지은이), 고미숙, 김풍기, 길진숙 (옮긴이)",4440,국내도서>고전>우리나라 옛글>산문,9788976821027,"조선 후기 실학자 연암 박지원의 '지식저장소'로 꼽히는 중국 기행집 &lt;열하일기&gt;를 재구성했다. 씌어진 지 200년을 훌쩍 넘긴, 읽기에 수월할 리만은 없는 책에 보다 쉽게 접근할 수 있는 판본을 만들고자 한 것. 새로운 구성과 시각적 요소에 큰 비중을 둔 편집으로, &lt;열하일기&gt;라는 '뜨겁고 생명력 넘치는' 텍스트에 진입하기 위한 문턱을 낮추었다.",,2880,BOOK
엽기 과학자 프래니 1 - 도시락 괴물이 나타났다,"짐 벤튼 (지은이), 박수현 (옮긴이)",48877,국내도서>어린이>동화/명작/고전>외국창작동화,9788955856231,큼직하고 화려하며 유머 가득한 그림들과 프래니의 엽기적인 행동들을 보면 키득키득 웃음이 난다. 하지만 프래니의 이야기를 끝까지 따라 읽고 책장을 덮으면 따뜻하고 훈훈하게 전해지는 감동이 전해진다.,"『엽기 과학자 프래니』시리즈 제1권 ≪도시락 괴물이 나타났다≫. 이 시리즈는 기발한 엽기 과학 소녀 '프래니'를 통해 우리 주변의 유쾌한 일상을 소개하고 있습니다. 엉뚱한 것을 발명하기 위해 몰두하지만 그 모습이 사랑스럽기만 합니다.

1권 에서 프래니는 엉뚱한 습관 때문에 친구가 없습니다. 이를 걱정한 선생님과의 대화를 통해 친구들을 관찰하기로 결심합니다. 프래니는 자신과는 다른 친구들의 습관을 하나, 둘 적어나가고, 대변신을 하게 됩니다. 이 때문에 친구는 많아졌지만 자신의 모습은 완전히 잃어버리게 되지요. 이때 며칠 전에 프래니가 버린 점심 도시락이 이상한 괴물로 변신해 교실을 엉망진창으로 만들어 버리는데…. 

☞ '프래니' 시리즈의 매력! 
프래니는 인형이나 꽃 대신 박쥐와 거미를 좋아하고, 과학에 반쯤 미쳐 있습니다. 악동 같은 눈망울과 장난기 가득한 미소로 친구들을 무섭게 만들기도 하지요. 하지만 프래니의 호기심 가득한 표정은 어린이라면 누구나 갖고 있을 만한 모습입니다. 친구를 사귀기 위해 노력하는 프래니의 매력에 빠져 보세요~!",3259,BOOK
How to TEPS 실전 800 - 독해편,한정림 (지은이),49861,국내도서>외국어>텝스>Reading,9788960002517,"Reading Strategy 10개(영문전략 7개 + 한글전략 3개)를 통해 TEPS 독해를 마스터할 수 있도록 구성한 교재. 최고 난이도 최대분량의 Actual Test 8회분(400문제)을 수록했다. TEPS 800점대 혹은 유사한 점수대의 수험생들, TEPS 독해점수가 잘 나오지 않는 학생들, 그리고 유사시험을 준비하는 편입준비생, 대학원 준비생 등을 대상으로 집필되었다.",,3404,BOOK
론리 플래닛 스토리 - 여행을 향한 열정이 세상을 바꾼 이야기,"모린 휠러, 토니 휠러 (지은이), 김정우 (옮긴이)",50871,국내도서>여행>세계일주여행>세계일주여행 에세이,9788970593494,평범한 일상을 버리고 훌쩍 세계여행을 떠났던 무일푼의 젊은 히피 부부가 여행자의 바이블로 불리는 세계 최고의 여행책 론리 플래닛을 만들기까지의 매혹적인 이야기를 들려준다. 개인적인 삶과 여행에 관한 이야기도 함께 하는 책이다. 6개월 뒤 지구를 반 바퀴 돌아 호주의 어느 해변에 도착했을 때 그들의 손에 남은 것은 단돈 27센트와 카메라뿐이었다.,,529,BOOK
톨스토이 단편선 1,"레프 니콜라예비치 톨스토이 (지은이), 이일선 (그림), 권희정, 김은경 (옮긴이)",52650,국내도서>소설/시/희곡>러시아소설,9788958560760,"러시아의 대문호 톨스토이의 단편집이 느낌표 열다섯 번째 도서로 선정됐다. 러시아 민화를 바탕으로 씌어졌으며, 소박하면서도 간결한 이야기 속에 삶에 대한 깊이있는 성찰이 담겨있다.",",  저자 톨스토이 단편선 개정판 제1권. 톨스토이의 작품 중 삶의 철학과 깨달음의 지혜가 담긴 12편의 작품을 선별해 수록했다. 여기에 파스텔 톤의 삽화를 작품 곳곳에 넣어 글의 감동을 더해주고 있다.",14972,BOOK
"Hello 베이비, Hi 맘 - 김린 · 서현주의 자신만만 유아영어","김린, 서현주 (지은이)",3390,국내도서>좋은부모>교육/학습>언어/외국어 교육,9788985777919,"갓난아기부터 5세 정도의 아이를 둔 엄마들이 아이에게 우리말과 영어를 동시에 사용할 수 있도록 일상생활 속에서 가장 많이 쓰는 상황별 생활영어를 담았다. 미국엄마 김린과 한국엄마 서현주가 만나 실제로 엄마가 아이들에게 건네는 가장 자연스럽고 살아 있는 말들을 엄선해 담았으며, 아이의 지적 발달을 돕고 정서를 풍부히 하는 교육적인 대화 내용을 간결하고 섬세한 화법으로 구사한다.","22년간 50만 부 팔린 엄마표 영어 스테디셀러
《Hello 베이비 Hi 맘》이 새로운 모습으로 돌아왔다!

미국 엄마 김린과 한국 엄마 서현주가 다시 만나 시대 흐름과 교육 방식 변화를 반영해 어휘를 솎아내고 표현을 다듬은 개정판.
실생활에서 엄마가 자주 사용하는 살아 있는 말로 대화문을 구성해 아이가 거부감 없이 영어를 접하고 자연스럽게 영어로 대화할 수 있게 도와준다. 미국 중산층 출신인 저자가 구사하는 클래식한 표현과 섬세한 화법이 고스란히 담겨있어 ‘엄마표 영어’의 정석이 무엇인지 보여주는 책이다.

* 저자의 목소리로 녹음한 MP3 파일 QR코드 제공
* 아이의 지적 발달과 정서적 발달을 고려한 대화문
* 저자가 직접 구성한 신나고 재미있는 Let’s Chant
* 하나의 문장을 다양하게 활용할 수 있는 Try It
* 핵심 표현만 뽑은 문장 카드는 보너스",7428,BOOK
부모와 아이 사이,"하임 G. 기너트, 앨리스 기너트, 월러스 고더드 (지은이), 신홍민 (옮긴이)",51786,국내도서>좋은부모>육아>육아법/육아 일반,9788990220127,지난 35년간 자녀 교육 지침서로 사랑받아온 부모 교육의 고전. 2003년 개정판에서는 1965년 판에서 다룬 부모 교육의 틀을 유지하고 있으나 대화법에 대해 특별히 보완했다. 또한 대화의 기술 이면에 흐르는 부모와 아이 사이의 심리의 흐름과 감정적 교감에 대해 자세히 다루고 있다.,"부모가 되면 가장 먼저 읽어야 할 책
   감정코치 교육의 기본개념을 담은책

휼륭한 부모가 되는 기술을 알려준다. 아이와 부모의 심리 치료 경험의 결과물로서 부모들에게 아이들과의 문제를 해결해줄 수 있는 실천적 안내서이다. 부모들이 매일 부딪히는 여러 가지 상황과 심리적인 문제를 처리하는 데 필요한 구체적인 방법과 바람직한 해결책을 제안한다. 아이들과 서로 존중하는 가운데 품위를 지키켜 살아가는 부모들에게 안내 역할을 해줄 기본적인 의사 소통 원칙에서 이끌어낸 특별한 충고를 제공한다.",28343,BOOK
이슬람의 세계사 2,"아이라 M. 라피두스 (지은이), 신연성 (옮긴이)",158,국내도서>역사>아시아사>서남아시아사,9788987608679,"지구상에 존재하는 거의 모든 이슬람 사회의 역사적 기원과 그 진화과정을 논리정연하게 정리하고 있는 책이다. 이 책의 저자 아이라 라피두스는 이슬람이란 종교, 제도, 문화, 사상, 법, 도덕, 생활양식 등을 모두 가리키는 문명의 총체라고 말한다. 아라비아 반도에서 처음 시작된 대화는 전 세계로 공간을 확장해가면서 현재까지 1,300년 넘게 지속되었다. 이 책은 그 과정을 역사적으로 설명해주는 책이다.","지구상에 존재하는 거의 모든 이슬람 사회의 역사적 기원과 그 진화과정을 논리정연하게 정리하고 있는 책이다. 이 책의 저자 는 이슬람이란 종교, 제도, 문화, 사상, 법, 도덕, 생활양식 등을 모두 가리키는 문명의 총체라고 말한다. 아라비아 반도에서 처음 시작된 대화는 전 세계로 공간을 확장해가면서 현재까지 1,300년 넘게 지속되었다. 이 책은 그 과정을 역사적으로 설명해주는 책이다.



이 책은 3부로 구성되어 있다. 1부와 2부는 1권에, 3부는 2권에 해당한다. 1부는 코란의 계시에서부터 13세기까지 이슬람 문명의 형성기를 다루고, 2부는 중동에서 생겨난 이슬람 사회의 전형이 세계 각지로 확산되는 과정을 살펴본다.



3부에서는 18세기 이래 오늘날까지 이슬람 제국의 붕괴, 경제적 쇠퇴, 이슬람 내부의 종교분쟁으로 인해, 그리고 유럽의 정치적·경제적·문화적 지배가 확립됨으로 인해 이슬람 사회가 얼마나 심각한 혼란에 빠져들었는지를 보게 된다.",473,BOOK
이문열 이희재 만화 삼국지 1~10 세트 - 전10권,"나관중 (지은이), 이문열 (옮긴이), 이희재 (작화)",49224,국내도서>어린이>초등 전학년>학습만화,9788937811401,"이문열.이희재의 만화 삼국지. 이문열의 삼국지를 판본으로 하여, 만화가 이희재가 작화했다. 전 10권을 묶은 세트이다.","어린이를 위한 삼국지. 천지가 요동해도 흔들림 없는 믿음의 관우와 감정에 충실한 용맹의 사나이 장비, 답답할 정도로 원칙을 지키며 어질기 그지 없는 유비, 이상을 품고 초막에 누워 있다 유비를 따라나선 풍운의 지략가 제갈공명 그리고 사람을 버리고 얻는 데 실리를 쫓으며 천하 제패에 다가서는 조조 등 실로 수백 수천의 영웅호걸들이 활개를 치는 시대. 어떤 이는 힘과 용기로, 또 어떤 이는 머리와 꾀로 밀고 당기고, 치고 빠지며 천하의 주인을 꿈꾸는데...",12929,BOOK
"과자, 내 아이를 해치는 달콤한 유혹",안병수 (지은이),51789,국내도서>좋은부모>건강/환경,9788974253998,"생활습관병을 부르는 가공식품의 실체를 밝힌다. 영양가는 없으면서 적은 양으로도 공복감이 해소되는 식품인 정크푸드가 하나같이 당 지수가 높으면서 각종 첨가물이 무차별 사용된 식품이라는 점을 비롯해, 설탕을 마약으로 치부하는 충격적인 내용들이 고스란히 담겨 있다.","정제당과 나쁜 지방, 식품첨가물이 첨가되어 생활습관병을 부르는 가공식품에 대해 파헤치고 있는 책. 영양가는 없으면서 적은 양으로도 공복감이 해소되는 식품인 정크푸드가 하나같이 당 지수가 높으면서 각종 첨가물이 무차별 사용된 식품이라는 점을 비롯해, 설탕을 마약으로 치부하는 충격적인 내용들이 고스란히 담겨 있다. 

특히, ‘제1장-위대한 파괴자들’에서는 우리가 흔히 먹는 초코파이를 비롯하여, 아이스크림, 각종 햄과 소시지, 껌, 청량음료 등에 대한 해부와 함께, ‘아메리칸 사료’라고 표현한 패스트푸드의 위험성을 방대한 자료와 연구 결과를 바탕으로 논리적으로 설명해준다.",16735,BOOK
다시 발전을 요구한다 - 장하준의 경제 정책 매뉴얼,"장하준, 아일린 그레이블 (지은이), 이종태, 황해선 (옮긴이)",88020,국내도서>경제경영>[경제경영 사상가 20인]>장하준,9788960510333,신자유주의 외에는 달리 대안이 없는 게 아니냐는 패배주의가 확산되는 데 대한 실증적 반박이다. 1부에서는 신자유주의의 근저에 똬리를 튼 여섯 가지 신화의 허구성을 이론적.역사적으로 들춘다. 이어서 2부에서는 오늘날 세계화라는 이름 아래 진되는 신자유주의적 경제 정책에 대한 대안을 제시한다.,"신자유주의 외에는 대안이 없는 게 아니냐는 패배주의 확산에 대한 장하준 교수의 실증적 반박!

이 책은 신자유주의에서 나타난 6가지 신화의 허구성을 정리하고, 오늘날 세계화라는 이름 아래 추진되고 있는 신자유주의적 경제 정책에 대한 대안을 구체적인 사례와 함께 제시한다. 신자유주의 정책에 맞서는 실현 가능한 대안들이 실제로 존재할뿐더러, 공정하고 안정적이며 지속 가능한 방법으로 경제 발전을 촉진하기까지 한다는 것을 논증한다.

1부에서는 서로 달라 보이지만 실제론 연관되어 있는 '경제 발전에 대한 그릇된 신화 6가지'를 제시한 뒤 이를 기각한다. 신화를 뒷받침하는 주장을 살펴보고 이 신화가 어떻게 그릇되었는지를 반박한다. 특히 이들이 지난 25년 동안 개발도상국에서 추진되어 재앙에 가까운 결과를 가져왔던 신자유주의 정책을 정당화하는 데 사용되어 왔음을 밝힌다.

2부에서는 경제 정책을 위한 매뉴얼을 제공한다. 무역과 산업 정책, 민영화와 지적재산권, 외국은행에서의 차입, 포트폴리오, 외국인 직접투자, 국내 금융 규제, 환율과 통화, 중앙은행과 통화 정책, 정부 수입과 지출 등의 분야에서 공정하고 지속 가능하면서도 신자유주의보다 경제 발전을 촉진시킬 수 있는 정책 대안들을 내 놓는다.",1308,BOOK
틀려도 괜찮아,"마키타 신지 (지은이), 하세가와 토모코 (그림), 유문조 (옮긴이)",48824,국내도서>어린이>초등1~2학년>그림책,9788990611260,"""아는 사람 손 들어봐"", ""할 수 있는 사람 나와 봐""로 시작하는 수업 시간에 잘 모르는 아이, 자신이 없는 아이의 가슴은 오그라든다. 망설이는 초등학교 신입생들에게 교실이 틀려도 괜찮은 곳, 틀리면서 정답을 찾아가는 곳이라는 것을 깨닫게 해주는 그림 동화책이다.","틀린다고 뭐가 이상해. 틀리는 건 당연하다고.

『틀려도 괜찮아』는 초등학교에 막 입학한 아이들에게 교실은 틀려도 괜찮은 곳, 틀리며서 정답을 찾아가는 곳이라고 가르쳐 줍니다. 특히 다정하게 말을 거는 문체는 학교 생활에 대한 두려움을 갖고 있는 어린이에게 자신감을 가지라고 조근조근 다독이고 있습니다. 어린이의 눈높이에 맞춘 귀엽고 익살맞은 그림이 사랑스럽습니다.",39337,BOOK
How to TEPS Starter (교재 + 별책 + MP3 CD 1장),성경준 (지은이),50044,국내도서>외국어>텝스>종합,9788960001909,TEPS 종합 입문서 How to TEPS Starter가 나왔다. TEPS를 처음 접하거나 TEPS가 어렵게 느껴지는 수험생들을 위해 영어의 기본기와 TEPS 실전 감각을 함께 익힐 수 있도록 마련한 책이다.,,2412,BOOK
칠판 앞에 나가기 싫어!,"다니엘 포세트 (지은이), 베로니크 보아리 (그림), 최윤정 (옮긴이)",48877,국내도서>어린이>동화/명작/고전>외국창작동화,9788949160368,소심한 마음을 극복하는 과정이 어떤 훈련이나 어른의 가르침을 통해서가 아니라 다른 사람을 도와 주고 싶은 마음에서 이루어진다는 이야기가 감동적이다.,목요일 아침이면 항상 그렇듯 에르반은 배가 아프다. '혹시 선생님이 나를 불러내서 구구단을 외어보라고  하면 어쩌나' 에르반은 칠판 앞에만 나가면 입도 달짝할 수가 없는데... 소심한 마음을 극복하는 과정은 다른 사람을 도와주고 싶은 마음에서 이루짐을 보여준다,30280,BOOK
Why? 독 있는 동식물,"정수은 (지은이), 송회석 (그림), 심재한 (감수)",48869,국내도서>어린이>과학/수학/컴퓨터>생물과 생명,9788930206457,"뱀, 복어, 독버섯 등 다양한 종류의 독 있는 동식물에 관해 소개한 학습 만화. 우리 주변에서 볼 수 있는 모든 것에 '왜?'라는 질문을 던져 해당 과학분야를 폭넓고도 쉽게 풀어내는 'Why?' 시리즈의 '독 있는 동식물' 편이다.",,8559,BOOK
내 맘대로 할래 - 황소고집 바로잡기,"이지현 (글), 이민혜 (그림)",35098,국내도서>유아>0~3세>유아교양,9788952753427,"내가 불필요한 고집을 자꾸 피울 때 엄마 아빠가 어떤 마음인지 아이 스스로 깨닫도록 돕는 책. 주인공 딱순이는 씻지 않겠다고, 자기가 입고 싶은 옷만 입겠다고 고집을 피운다. 친구들에게 창피 당하고, 더운 날씨에 땀을 뻘뻘 흘리면서도 말이다.","너도 황소고집을 갖고 있니?

'바른 습관 그림책' 시리즈, 제1권 『내 맘대로 할래 - 황소고집 바로 잡기』. 이 시리즈는 자아가 형성되는 3세부터 5세까지의 아이들에게 가장 가르치기 힘든 습관 교육을 도와주는 그림책으로 이루어져 있습니다. 악어, 달팽이, 여우 등 동물 친구들이 등장하는 흥미롭고 재미있는 이야기를 통해 아이들이 꼭 고쳐야 할 나쁜 버릇 5가지를 중점적으로 다룹니다. 

아이들의 일상생활 속에서 겪을 듯한 상황을 묘사함으로써, 공감대를 불러일으킵니다. 특히 교훈적 결말을 담아내 아이들이 자신의 나쁜 버릇을 되돌아보면서, 자연스럽게 바른 습관을 기를 수 있도록 인도합니다. 친구들 사이에서의 이해심과 배려심 등도 키워줍니다. 동물 친구들의 특징을 정확히 살려낸 여러 기법의 그림으로 아이들의 눈을 사로잡습니다. 

제1권에서는 황소고집을 가진 꼬마 악어 '딱순이'의 이야기를 담고 있습니다. 딱순이는 씩씩하고 멋지지만 가끔씩 고집쟁이가 된답니다. 딱순이가 고집을 부리면 아빠가 달래도 소용없어요. 그래서 딱순이는 세수도 하지 않고 유치원에 간대요. 딱순이가 고집을 부리면 엄마가 화를 내도 소용없어요. 그래서 딱순이는 더운 여름 날 털옷을 입고 놀이터에 간답니다. 딱순이가 고집을 부리지 않는 방법은 없을까요? 양장본.

〈font color=""1e90ff""〉☞〈/font〉 <b>부모님이나 선생님을 위한 Tip!</b>
『내 맘대로 할래 - 황소고집 바로 잡기』의 뒷부분에는 소아ㆍ청소년 정신과 전문의의 〈엄마랑 아빠랑〉을 담아냈습니다. 아이들의 심리를 이해하기 쉽게 설명하면서, 그것을 대처할 방안을 제시합니다. 솔직하고 구체적인 조언으로 아이들과 부모님 혹은 선생님 사이에 이해의 다리를 놓아줍니다.",620,BOOK
인터넷으로 배우는 초급 한국어 회화 1,나찬연 (지은이),49935,국내도서>외국어>외국인을 위한 한국어>한국어 회화,9788956685458,,,128,BOOK
가정교사 히트맨 리본! 21,아마노 아키라 (지은이),3724,국내도서>만화>소년만화>액션,9788925821597,,"츠나에게 미끼 역할을 맡긴 채, 첫 번째 표적인 희고 둥근 장치를 향해 가는 하야토 일행.그 도중에 있던 전시실에서 같은 밀피오레 동료를쓰러뜨리는 바이샤나와 조우, 자기 박스 병기를 위해 같은 편의 박스 병기마저 이용하는 바이샤나에게 료헤이가 도전한다!한편 츠나에게 스패너는 의외의 제안을 해오는데…?!",396,BOOK
하룻밤에 읽는 세계사,"미야자키 마사카츠 (지은이), 이영주 (옮긴이)",169,국내도서>역사>세계사 일반,9788983753984,세계사를 간결 명확하게 그리고 무엇보다 쉽게 설명하고 있는 역사서. 저자는 고등학교 교사의 경력을 지닌 역사학자(훗카이도 교육대학 교수)로 세계 역사 5천년의 흐름을 한 눈에 들어올 수 있도록 집필하였다.,,3471,BOOK
