title,author,genre_id,genre,ISBN,description_aladin,description_naver,salesPoint,mallType
성공하는 사람들의 7가지 습관,"스티븐 코비 (지은이), 김경섭 (옮긴이)",70216,국내도서>자기계발>성공>성공학,9788934913252,출간 10주년을 기념하여 양장으로 나온 개정증보판. 한국에서만 100만부가 넘게 팔린 이 책은 스티븐 코비의 대표적인 저작이다.,"<b>스티븐 코비가 전하는 7가지 성공습관!</b>
<b>내면으로부터 다시 변화하라!</b>

창의적이고 개방적인 사고, 적극적이고 긍정적인 마인드, 도전적이고 열정적인 태도는 성공한 사람들의 공통된 특징이다. 이러한 외적인 변화를 갖기 위한 다양한 테크닉과 처세술은 아무나 쉽게 따라할 수 있지만 누구나 오래가진 않는다. 이 책에서는 이러한 성공적인 변화를 위해서 원칙을 중심으로 성품에 바탕을 두고 내면에서부터 변화하는 새로운 패러다임 전환을 이야기하고 있다.

본문에서 소개하고 있는 7가지 습관은 개인이나 조직을 성공적으로 만드는 습관들로 의존적 단계에서 출발하여 독립적 단계 그리고 상호의존적 단계로 점진적으로 나아가게 한다. ‘자신의 삶을 주도하라’, ‘끝을 생각하며 시작하라’, ‘소중한 것을 먼저하라’의 습관 1, 2, 3은 자기완성을 위한 것으로 개인적 승리인 자신에 대한 리더십에 대해 통찰한다.

독립적 단계인 습관 1, 2, 3이 선행된 후에는 비로소 팀워크, 협동, 커뮤니케이션 등과 같은 상호의존적 단계인 습관 4, 5, 6을 다룬다. 여기에는 ‘승-승을 생각하라’, ‘먼저 이해하고 다음에 이해시켜라’, ‘시너지를 내라’가 해당된다. 끝으로 습관 7 ‘끊임없이 쇄신하라’는 재충전의 습관이다. 이는 지속적인 자기 개선을 위한 습관으로 다른 모든 습관들을 둘러싸고 보조해준다.

그전까지 외부에서부터 시작하여 내면을 변화시키는 접근방법들은 자신의 태도나 행동을 조절하거나 좋은 기법들을 사용하는 것으로 만성적이고 근원적인 문제는 그대로 남아 있었다. 하지만 이 책에서 제시한 7가지 습관들은 내면에서부터 변화하는 본질적인 패러다임으로 스스로를 검토하고  자신의 삶을 잘 관리하는 것으로 절대 변치않는 성공습관이다. [양장본]",16104,BOOK
해리 포터와 불사조 기사단 세트 - 전5권 (무선),"J.K. 롤링 (지은이), 최인자 (옮긴이)",51120,국내도서>소설/시/희곡>판타지/환상문학>외국판타지/환상소설,9788983921543,"설명이 필요없는 '해리 포터 시리즈' 다섯 번째 이야기가 출간됐다. 4권 <불의 잔> 말미에서 덤블도어 교수가 '우리는 어둠과 어려운 시기에 직면하고 있습니다'라고 경고한 것처럼, 전편에 비해 어둡고 깊이있는 내용의 이야기가 전개된다.","해리포터 시리즈 제 5편 세트(전5권). '세계에서 가장 빨리, 가장 많이 팔린 책'이라는 기록을 세우기도 한 <해리포터와 불사조 기사단>은 국내에서도 초판 100만부 발행이라는 초유의 기록을 수립하였다.<BR>주인공 해리는 15세에 접어든 청소년으로 등장하여 덤블도어 간의 갈등 증폭, 자기 존재에 대한 자각과 분노의 표출, 그리고 첫사랑 얘기가 흥미진진하게 펼쳐진다. 또한 볼드모트가 그와 그의 가족에게 집착하는 이유를 담은 고대 예언도 새롭게 등장하는 등, 제 5탄은 해리포터 시리즈의 기둥 역할을 하고 있다. <BR>제 5 탄 <해리포터와 불사조 기사단> 5권을 묶었다. 제 5 탄, 전 5 권.",9890,BOOK
주식투자의 정석 - 한 번 배워 평생 써먹는,스타키안 (지은이),174,국내도서>경제경영>재테크/투자>주식/펀드,9788960860124,이제 주식을 막 시작했거나 오랜 시간 주식을 했지만 아직까지 투자와 투기를 구분하지 못하는 개인투자자들을 위한 책이다. 워렌 버핏의 가치투자를 한국 주식시장에 접목하여 일목요연하고 체계적으로 정리한 가치투자 지침서의 완결판이라고도 할 수 있다.,,1106,BOOK
Shout! 자신감 - The Winner Takes It All,손용규 (지은이),70216,국내도서>자기계발>성공>성공학,9788995934838,우리가 숨 쉬고 있는 이 세상은 '서바이벌 게임'이나 '약육강식'이라는 표현을 가져다 붙여도 전혀 이상하지 않은 무한경쟁 시대다. 그리고 무한경쟁에서 살아남기 위해서는 스스로에게 동기와 에너지를 부여하는 자신감이 필요하다.,"상상을 현실로 만드는 자신감의 힘!

부유하게 살았던 우리의 주인공 '태산'. 그는 사장이었던 아버지 밑에서 남부러울 것 없이 자라왔다. 그러던 어느 날 아버지는 암으로 돌아가시고, 갑작스럽게 아버지의 사업을 맡은 태산은 결국 회사를 부도위기에까지 몰고 갔다. 좌절만 하고 있던 태산이 세일즈맨으로 새 인생을 시작한 순간, 그의 앞에는 특별한 교육이 기다리고 있는데…

『SHOUT! 자신감』은 큰 좌절을 맛본 주인공 '태산'이 성공을 이루어나가는 모습을 통해 '자신감'이 얼마나 소중하며 인생에 얼마나 큰 영향을 불러오는지를 이야기한다. '준비, 상상, 위기, 선행, 모델, 만남, 자극과 즐거움, 귀환' 등 8가지 주제로 나누어 8가지 이야기를 들려주고, 중간에 '뒷담화'와 '멘토'라는 또 다른 이야기를 들려준다.

여기 나온 '태산'은 저자와도 같다. 공업계고등학교를 졸업하였지만, 노력 하나로 자신만의 사업체를 꾸려나가게 된 저자가 수년간의 경험을 통해 얻은 자신감의 중요성이 고스란히 반영하였다. 특히 현재의 자신감이 미래의 꿈을 실현하는 지름길이라는 간단하지만 깊은 조언을 남기며 그 어떤 위기에서도 자신감을 잃지 말기를 강조한다. [양장본]",134,BOOK
이방인,"알베르 카뮈 (지은이), 김화영 (옮긴이)",50921,국내도서>소설/시/희곡>프랑스소설,9788970131092,"1942년 발표된 알베르 카뮈의 처녀작이자 출세작이며 1957년 노벨문학상 수상작. 그는 이 작품으로 세계적인 명성을 얻었다. 평범한 샐러리맨인 뫼르소는, 양로원에서 죽은 어머니의 장례를 치른 다음날 여자 친구인 마리와 해수욕을 하고 희극영화를 본다. 그리고 밤에는 마리와 정사(情事)를 가진다.",,4489,BOOK
하늘이 내린 시조 임금님들,우리누리 (지은이),48903,국내도서>어린이>문화/예술/인물>한국전통문화,9788959246830,우리 것에 대한 소중함과 자랑스러움을 일깨워주는 시리즈. 단군 왕검에서 이성계에 이르기까지 우리나라 시조 임금님 10명의 건국신화를 흥미진진하게 엮었다.,,4095,BOOK
Why? 로봇,조영선 (지은이),48867,국내도서>어린이>과학/수학/컴퓨터>과학 일반,9788930206419,사람만큼 다양한 모습을 가진 로봇의 세계를 그린 학습 만화. 'Why?' 시리즈의 로봇편이다.,,6300,BOOK
정재승의 과학 콘서트 - MBC 느낌표 선정도서,정재승 (지은이),51002,국내도서>과학>기초과학/교양과학,9788988165348,"이 책은 때론 '매우 빠르고 경쾌하게', 때론 '느리게' 펼쳐내는 과학의 교향곡이다. 4년 전 <물리학자는 영화에서 과학을 본다>를 통해 이미 과학과 인문학, 대중문화를 넘나드는 폭넓은 조예를 보여주었던 그가 이 책을 통해 다시 한번 글쟁이로서의 자질을 유감없이 발휘하고 있다.",,17724,BOOK
빛의 제국,"온다 리쿠 (지은이), 권영주 (옮긴이)",51120,국내도서>소설/시/희곡>판타지/환상문학>외국판타지/환상소설,9788974254858,"<밤의 피크닉>, <삼월은 붉은 구렁을>의 작가 온다 리쿠의 아름다운 판타지, '도코노' 연작의 첫 작품. 방대한 양의 서적을 암기하는 힘, 멀리서 생긴 일을 아는 힘, 가까운 미래를 예견하는 힘 등 여러 가지 특이하고 지적인 능력을 지닌  '도코노(常野)' 일족이 주인공으로 등장한다.","아름답고 따뜻한 판타지, 도코노 이야기

〈밤의 피크닉〉, 〈삼월은 붉은 구렁을〉, 〈굽이치는 강가에서〉의 작가, 온다 리쿠의 대표작. 1991년 제3회 일본 판타지 노벨대상 최종후보작으로 오른 〈여섯 번째 사요코〉로 등단해 미스터리, 판타지, SF, 호러 등의 분야를 중심으로 유연하고 독자적인 작품 세계를 선보이고 있다. 

이 책은 ［도코노 이야기］연작 중 첫 번째 소설이다. '도코노(常野)'란 늘(常) 재야(野)에 있으라는 의미로, 일본 도호쿠 지방에 있는 어떤 마을이자 그 마을에 사는 일족을 의미한다. 방대한 양의 서적을 암기하는 힘, 멀리서 생긴 일을 아는 힘, 가까운 미래를 예견하는 힘 등 여러 가지 특이하고 지적인 능력을 지닌 일족은 온후하고 예절을 중시하는 성품의 소유자들로, 권력을 지향하지 않는다.

작가는 때로는 안에서 때로는 밖에서 지켜본 이들 일족의 이야기를 들려줌으로써 아름답고 따뜻한 판타지의 세계로 안내한다. 한 사람의 몫을 해내고자 노력하는 하루타 기미코가 성장해서 활약하는 모습, 전쟁이라는 상황 속에서도 다시 만날 것을 약속했던 마사키가 두루미 선생 그리고 도코노와 재회한 모습 등을 그린 열 편의 단편 하나하나가 개성 있는 색을 내고, 각 단편의 주인공들이 다른 단편에 영향을 주면서 더욱 큰 감동을 선사한다.",1457,BOOK
모두가 네스터를 죽이고 싶어한다,"카르멘 포사다스 (지은이), 권도희 (옮긴이)",51067,국내도서>소설/시/희곡>추리/미스터리소설>기타국가 추리/미스터리소설,9788901066059,"1996년 소설가로의 첫 행보를 시작한 카르멘 포사다스는, 1998년 발표한 두 번째 소설 <모두가 네스터를 죽이고 싶어한다>로 스페인 플라네타상을 수상했다. 유쾌하고 능숙한 심리 서사, 신랄한 사회풍자가 돋보이는 이 추리소설은, '애거서 크리스티와 페드로 알모도바르의 완벽한 배합'이라는 평가와 함께, 20여 개국에 소개됐다.",,137,BOOK
천자문 명심보감,나준식 (엮은이),31575,국내도서>대학교재/전문서적>어문학계열>국어국문학>한문/한자,9788975930560,,조선 선조 때 명필 한호가 왕명을 받아 천자문을 썼는데 오늘날까지 전해 오는 '한석봉 천자문'이 바로 이 책이다. 독자들의 편의를 위해 우측 상단에 원 안에 현재 쓰이고 있는 한자 표기를 하였다. '천자문'과 '명심보감'을 공부하면서 기초 한자를 익히고 바른 생활의 가치관을 정립하는 데 많은 도움이 될 것이다.,109,BOOK
이랏샤이마세 도쿄 - 당그니의 일본 표류기 2,김현근 (지은이),50854,국내도서>여행>일본여행>일본여행 가이드북,9788989548645,"일본의 모습을 날 것 그대로, 있는 그대로 보여주되, '우리의 눈'으로 보여주는 책이다. 게다가 대중문화에 관한 한 최고의 수준에 올라 있다고 할 수 있는 일본의 모습을 가장 대중적인 언어인 만화와 그림, 그리고 사진과 함께 곁들여서 보여주는 생생한 문화교양서라고 할 수 있다.",,351,BOOK
수상한 요리책 - 들키고 싶은 그녀의 비밀 레시피,강선옥 (지은이),53472,국내도서>요리/살림>생활요리,9788970904566,,,112,BOOK
[CD] 명품가정 & 명품자녀 만들기 - 오디오 CD 1장 - 유대인의 교육방법,김영실 (지은이),6657,국내도서>달력/기타>오디오북>가정/실용 오디오북,9788992811439,,,113,BOOK
해커스 토플 스피킹 베이직 (Hackers TOEFL Speaking Basic) (iBT) (책 + CD 1장),David Cho (지은이),49871,국내도서>외국어>토플>Speaking,9788990700414,"iBT 토플 스피킹 영역의 기본서로, 말하기에 필요한 요소들을 단계별로 학습할 수 있도록 구성했다. 문장 만들기를 위한 필수 표현 연습에서부터, 이를 응용해 답안을 구성할 수 있는 훈련을 할 수 있으며, iBT TOEFL Speaking의 특징과 문제 유형을 분석하여, 이를 바탕으로 고득점을 위한 효과적인 전략을 제시하고 있다.",,4042,BOOK
세계공화국으로,"가라타니 고진 (지은이), 조영일 (옮긴이)",51154,국내도서>사회과학>사회사상/사회사상사>사회사상/사회사상사 일반,9788991706057,"<일본근대문학의 기원>, <트랜스크리틱>등의 저서로 일본을 대표하는 비평가이자 사상가로 알려져 있는 가라타니 고진의 세계공화국에 대한 모색을 담은 저작. 전작 <트랜스 크리틱>에서 칸트와 마르크스를 그만의 방식으로 비평하고 다시 성찰했다면, 이 책에서는 그 성찰을 바탕으로 또 다른 대안을 내놓는다.","일본을 대표하는 비평가이자 사상가인 가라타니 고진의 공산당 선언!

『세계공화국으로』는 〈자본주의=민족(네이션)=국가〉에 대한 비판과 극복이라는 실천적 통로를 찾고 있는 일본의 유명 사상가 가라타니 고진의 최신작이다. 2001년『트랜스크리틱』에서 칸트나 마르크스의 가능성을 그들의 텍스트 독해를 통해 제시하였던 그가 이번에는 그것을 비판적으로 넘어서려는 독창적 작업을 시도하였다.

저자는 마르크스주의의 소위 사적유물론을 의심하며 사회구성체의 역사를 생산양식이라는 관점 대신 교환양식이라는 관점에서 제시한다. 또 자본제 이전의 역사인 세계제국 체제를 '공동체와 국가, 화폐와 시장, 보편종교'로 나누어 살펴보고, 자본제 이후의 역사인 세계경제 체제를 '국가, 산업자본주의, 네이션, 어소시에이션이즘'으로 나누어 살펴본다.

아울러 국민국가 주권을 세계공화국으로 서서히 양도해야 한다는 주장을 아래로부터의 혁명과 최종적인 결합의 차원에서 설명한다. 특히 '국가' 분석을 문제의 중심에 놓고 국가적 교환양식에 관한 진지하게 비판하여 마르크스가 미처 쓰지 못한 ""국가론"", 또는 21세기에 다시 씌어진 ""공산당선언""이라 불릴만 하다. [양장본]

〈font color=""1e90ff""〉☞〈/font〉 <b>이 책의 독서 포인트!</b>
전작들보다 더 깊어진 사유의 진경을 느낄 수 있으며, 그의 사상의 한 기점을 이루고 있는 작품이라고 볼 수 있다. 오늘날의 세계가 어떤 것인지, 그리고 이 세계를 어떻게 발전시켜나가야 할지를 누구나 쉽게 이해할 수 있도록 간략히 풀어서 집필하였기 때문에 고등학생, 대학생들도 어렵지 않게 읽을 수 있다.",1235,BOOK
러시아에서 보물찾기,"곰돌이 co. (지은이), 강경효 (그림)",49224,국내도서>어린이>초등 전학년>학습만화,9788937840289,"가상의 보물을 찾아 전세계를 여행하면서 각 나라의 역사와 문화를 알아보는 학습 만화 '세계 탐험 만화 역사 상식' 시리즈의 아홉 번째 권이다. 세계에서 가장 큰 영토와 막대한 천연 자원, 그리고 다양한 전통 문화를 갖고 있는 다민족 국가 러시아의 생활과 문화상식을 담았다.","세계 역사를 담은 학습 만화『세계 탐험 만화 역사상식』시리즈 제9권 ≪러시아에서 보물찾기≫. 에서 팡이와 토리는 볼쇼이 발레단의 초청을 받아 러시아로 향합니다. 모두들 황실의 유물이 등장하는 화려한 공연에 넋을 잃지만, 팡이는 보석의 광채가 이상하다는 것을 알아차립니다. 결국 왕관이 모조품과 바뀌었다는 것을 알게 되고, 팡이 일행은 범인을 찾아 나서는데…. 

이 책은 '만화'라는 형식을 통해 러시아 역사 현장을 좀더 생생하게 전달하고 있습니다. 특히, 자칫 흥미 위주로 읽힐 수 있는 만화의 단점을 보완하고자 각 장마다 '러시아의 역사', '러시아의 국가 구성' 등과 같은 러시아에 관한 역사 상식을 소개하고 있습니다.",5442,BOOK
목돈만들기 적립식펀드가 최고다 - 2006 최신 개정판,"오재현, 정철진 (지은이)",174,국내도서>경제경영>재테크/투자>주식/펀드,9788959750429,기존의 펀드 관련 책들과 달리 적립식펀드만을 집중 분석하여 큰 호응과 사랑을 받았던 <목돈만들기 적립식펀드가 최고다>의 2006년 개정판이다. 적립식펀드에 대해 알아야 할 지식과 투자테크닉들을 펀드 가입 전과 후로 나누어 상세히 소개하고 있다.,,1549,BOOK
별똥별 아줌마가 들려주는 우주이야기,"이지유 (지은이), 이시우 (감수)",48834,국내도서>어린이>초등3~4학년>과학/수학/사회,9788983941466,"우리 생활과 밀접한 관련이 있는 천문학적 지식은 물론, 천문학사 속에 숨은 이야기들과 별과 우주에 얽힌 신화와 민담까지. 저자는 가벼운 흥미 위주에 치우치지도 않고, 어려운 개념을 무책임하게 쏟아내지도 않으면서 어린이들이 이해할 수 있는 수준의 천문학 이야기를 차근차근 풀어낸다.",,11885,BOOK
"스페인, 너는 자유다 - 모든 것을 훌훌 털어 버리고 떠난 낯선 땅에서 나를 다시 채우고 돌아오다, 개정판",손미나 (지은이),51371,국내도서>에세이>한국에세이,9788901059365,"2006년 처음 출간 당시 기존의 여행서에서는 없었던, '인생의 터닝 포인트로 여행'이 가진 매력을 전달하면서 센세이션을 불러일으켰던 &lt;스페인, 너는 자유다&gt;가 7년 만에 개정판으로 새 옷을 갈아입고 독자를 찾아간다.","대한민국 대표 아나운서에서 여행작가로 변신한 손미나가 스페인에서 보낸 1년의 기록. 2006년 처음 출간 당시 기존의 여행서에서는 없었던, '인생의 터닝 포인트로 여행'이 가진 매력을 전달하면서 센세이션을 불러일으켰던 &lt;스페인, 너는 자유다&gt;가 7년 만에 개정판으로 새 옷을 갈아입고 독자를 찾아간다.



당시 단정한 아나운서였던 손미나는 이 책을 내고 불과 1년 만에 새로운 삶을 위해 회사를 그만두었다. 이후 여행 작가로 데뷔한 그녀는 일본, 아르헨티나 탐험기를 냈으며, 2012년에는 로맨틱 소설 &lt;누가 미모자를 그렸나&gt;를 펴내며, 작가로 자리매김에 성공했다. 



대한민국 여성들을 '서른앓이'에 빠지게 했던 &lt;스페인, 너는 자유다&gt;는 출간 이래 30만 독자의 사랑을 꾸준히 받았다. 이번 개정판에는 출간 이후 손미나에게 일어났던 변화와 성장에 대한 고백, 책에 등장했던 절친들의 근황, 최근에 다시 찾은 스페인에서의 경험담들이 특별히 추가되었다. 



마음의 소리를 따라 자신의 삶을 개척하고 있는 자유의 아이콘 손미나가 외치는 ""지금이 아니면 안 될 때, 떠나야 한다""를 이 책을 통해서 만나보자.",9143,BOOK
손 큰 할머니의 만두 만들기,"채인선 (지은이), 이억배 (그림)",14024,국내도서>유아>그림책>문화/예술/인물/역사 그림책,9788986565065,"어린 시절부터 설날이면 어김없이 밥상을 지키던 만두. 지금까지도 우리가 아끼는 민속음식으로 남아있는 만두를 소재로 한 담백하고 토속적인 동화. 무엇을 하든지 엄청 많이 해대는 '손 큰 할머니'는 옛날부터 여유롭게 음식을 만들어 이웃과 더불어 나누어 드시던 우리의 할머니, 어머니를 생각나게 한다.",무엇이든지 엄청 크게 하는 손 큰 할머니가 숲속 동물들과 함께 매년 새해에 먹을 엄청 많은 양의 만두를  만든다. 이번 해도 할머니는 며칠 밤을 새우며 동물들과 만두를 빚는데 좀체로 줄어들지 않자 동물들이 불 평을 하기 시작한다. 재미있는 내용의 유아그림책.,28660,BOOK
아모스와 보리스,"윌리엄 스타이그 (지은이), 우미경 (옮긴이)",35135,국내도서>유아>그림책>나라별 그림책>미국,9788972593010,"육지 동물인 쥐와 바다 동물인 고래의 애절한 사랑과 우정 이야기. 어린이 그림책치고는 특이하게 차분한 분위기. 청회색빛 바다를 배경으로 서로를 아끼고 사랑하는 마음이 신비스럽게 전해진다. 곧 죽을지도 모르는 사랑하는 존재 앞에서 의연하게 대처하는 조그만 쥐의 의젓한 태도에서 삶과 죽음의 의미를, 사랑의 의미를 되새길 수 있다.",,3505,BOOK
개구리가 알을 낳았어,"이성실 (지은이), 이태수 (그림)",35108,국내도서>유아>그림책>교양/학습 그림책,9788974781767,"개구리에 관해 알고 싶은 모든 것,이라고 이름 붙여줄 만한 책. 맑은 수채화 그림과 친근감 있는 말투의 설명으로 알에서부터 개구리로 자라나는 과정과 그 개구리가 생활하는 모습을 알려준다.","유아를 위한 자연과학 그림책. 물렁물렁 미끌미끌, 개구리가 논물 속에 알을 낳았습니다. 까만 점이 박힌 알은 시간이 조금 지나면 올챙이가 되고, 올챙이에게는 금방 뒷다리, 앞다리가 생겨나요. 추운 겨울엔 몸이 꽁꽁 얼어버리기 전에 논둑이나 연못가 흙 속에 몸을 숨기고 잔뜩 움추린채 잠을 자야해요. 알에서 개구리가 되기까지의 과정을 예쁜 그림과 함께 재미있게 설명해줍니다.",11366,BOOK
타인의 얼굴,"아베 코보 (지은이), 이정희 (옮긴이)",50998,국내도서>소설/시/희곡>일본소설>1950년대 이후 일본소설,9788931005677,"""과연 '얼굴'을 '나와 타인을 연결하는 통로'라고 말할 수 있을까?"" 라는 의문에서 출발하는 이야기. 극히 일상적인 도시 생활 속에서 평범한 시민에게 스며드는 존재의 위태로움을 묘사하는 이 소설은,  <모래의 여자>, <불타버린 지도>와 함께 아베 코보의 '실종 3부작'이라 불린다.",,651,BOOK
위대한 기업에 투자하라,"필립 피셔 (지은이), 박정태 (옮긴이)",174,국내도서>경제경영>재테크/투자>주식/펀드,9788991378025,주식 투자 서적으로는 최초로 「뉴욕타임스」 베스트셀러에 오른 '영원한 투자의 고전'이다. '성장주'라는 개념을 제시하며 기존의 기술적 분석과 계량적 분석에 의존해왔던 주식 투자 기법에 일대 변혁을 가져왔다고 평가받는다.,"시중의 여타 주식 투자 이론서와 근본적으로 다르다. 이 책에는 다른 주식 투자 관련서에서 흔히 볼 수 있는 “신고가” 내지는 “손절매” 같은 용어가 단 한 번도 나오지 않는다. 오히려 제대로 투자 대상 기업을 선정해 주식을 매수했다면 영원히 매도할 기회가 오지 않을 것이라고 이야기한다. 심지어 위대한 기업의 주식이라면 주식시장의 조정기에 30~40% 떨어지더라도 다음 강세장에 그 어떤 종목보다도 크게 오를 것이며, 장기적으로 최소한 몇 배의 주가 상승이 기대되는데 매도할 이유가 없다고 지적한다.

대부분의 투자자들은 훌륭한 노사 관계로부터 나오는 이익에 대해 잘 알지 못할 것이다. 하지만 노사 관계가 좋지 않은 데서 오는 해악을 모르는 투자자들은 거의 없다. 잦은 파업과 장기 파업이 생산에 미치는 영향은 기업의 재무제표조차 대충 보고 넘어가는 투자자들에게도 피부에 와닿을 것이다. 노사관계는 투자기준에 없어서는 안 될 중요한 사항이다.",18147,BOOK
평화는 어디에서 오나요,"구드룬 파우제방 (지은이), 김중철 (옮긴이)",48877,국내도서>어린이>동화/명작/고전>외국창작동화,9788901056821,"말썽만 피우던 자샤와 눈먼 엘리자베트 할머니가 만나 엮어가는 따뜻한 우정, 골칫덩어리 반이 어느 날 전교에서 가장 착한 반이 되는 이야기, 수녀님과 함께 찾아간 마을에서 페터가 만난 가난하고 힘없는 사람들 등 재미와 감동이 가득한 이야기가 실려 있다.","재미와 감동이 가득한 평화 이야기 8편!

말썽만 피우던 자샤와 눈먼 엘리자베트 할머니가 만나 엮어 가는 따뜻한 우정, 골칫덩어리 반이 어느 날 전교에서 가장 착한 반이 되는 이야기, 수녀님과 함께 찾아간 마을에서 페터가 만난 가난하고 힘없는 사람들, 항상 친구들에게 놀림과 따돌림을 받는 디륵에게 일어난 일……. 우리 친구들이 생활 곳곳에서 겪는 갖가지 사건과 경험 속에 유쾌하고 따뜻한 이야기가 펼쳐집니다.  

* 어린이도서연구회 권장도서
* KBS ‘TV 책을 읽다’ 선정도서
...",5515,BOOK
