title,author,genre_id,genre,ISBN,description_aladin,description_naver,salesPoint,mallType
군주론 - 바티칸의 금서,"니콜로 마키아벨리 (지은이), 권혁 (옮긴이)",7268,국내도서>청소년>청소년 고전,9788988601631,"이제까지 출간된 <군주론>들에서 발견되는 불확실한 문장들을 쉽게 이해할 수 있도록 바로잡았다. 고전이 어렵다는 편견을 지울 수 있도록 옛날 이야기를 읽는 듯 편안한 문체로 번역한 것이 특징. 상세한 주석과 함께 15세기 이탈리아의 역사적 배경, 본문에 등장하는 인물들을 부록으로 수록했다.",,6102,BOOK
노빈손의 으랏차차 중국 대장정,"한희정, 강영숙 (지은이), 이우일 (그림)",1140,국내도서>청소년>청소년 역사,9788958071914,"<노빈손, 피라미드의 비밀을 풀어라>에 이은 '노빈손 세계 역사탐험' 시리즈 두 번째 책. 진시황 시절의 중국으로 훌쩍 날아간 노빈손이 고대중국의 역사와 문화를 낱낱이 파헤친다. 노빈손의 여정을 따라가면서 고대 중국인들의 삶 속에 숨겨진 다양한 문화들을 엿보는 재미가 쏠쏠하다.","역사가 고스란히 살아 숨쉬는 현장을 구석구석 찾아다니며, 생생한 역사와 문화를 경험하고 느끼며 배우는 '신나는 노빈손 세계 역사탐험' 시리즈 제2탄으로 노빈손이 고대 이집트에 이어 이번엔 고대 중국으로 여행을 떠났다.
영생불사를 꿈꾸며 기이한 행적을 남겼던 통일 중국의 첫 번째 황제 진시황과 세계8대 불가사의라 일컬어지는 ‘진시황의 병마용갱’들을 2000년의 세월을 건너 만나게 된다.",6993,BOOK
어린 왕자,"앙투안 드 생텍쥐페리 (지은이), 박성창 (옮긴이)",48863,국내도서>어린이>초등 전학년>동화/명작/고전,9788949190136,프랑스 소설가이자 시인인 생텍쥐페리의 탄생 100주년을 기념한 작품. <인간의 대지> <야간비행> 등을 쓴 비행기 조종사였던 그는 비행기를 사색과 발견의 도구로 삼았다.,생떽쥐페리 탄생 100주년 기념으로 출간된 책이다. 원본에 충실한 깔끔한 번역과 기존의 판형보다는 조금 넓어진 판형으로 읽기 편하게 편집되어 있다. 뒷편에는 생텍쥐페리에 관한 사진과 작품론을 수록하여 생텍쥐페리에 대한 폭넓은 이해를 할 수 있도록 배려하였다.,19532,BOOK
모네의 정원에서,"크리스티나 비외르크 (지은이), 레나 안데르손 (그림), 김석희 (옮긴이)",49223,국내도서>어린이>동화/명작/고전>학습동화,9788970876009,"'모네의 꽃' 그림을 좋아하는 리네아는 블룸 할아버지와 함께 파리에 있는 클로드 모네 기념관으로 여행을 간다. 모네가 태어난 집에도 가보고, 모네의 그림에 나오는 곳에도 간다. 리네아는 여행을 통해 모네의 일생과 인상파 그림의 특징을 알게 된다. 모네의 그림을 찍은 사진과 파리를 여행할 때 필요한 것들도 실려 있다.","감수성이 풍부한 소녀 리네아의 파리 여행기. 꽃을 좋아하는 리네아가 화가 클로드 모네의 정원을 찾아 파리로 갔다. 리네아는 파리에서 모네의 진짜 그림들을 많이 보았고, '인상파 미술'의 뜻이 무엇인지 이해하게 되고, 여덟 명의 아이들과 함께 살았던 모네의 생애에 대해서도 알게 된다는 내용의 책이다.",16044,BOOK
예랑의 키다리 아저씨,"예랑 (지은이), 권신아 (그림)",50993,국내도서>소설/시/희곡>한국소설>2000년대 이후 한국소설,9788991684164,"인기 드라마 ' 천생연분', '마지막 전쟁', '결혼합시다'의 작가 예랑의 소설 에세이. 구체적 스토리가 있는 감동을 담고 있으며, 톡톡 튀는 감각적 언어가 눈에 띈다. 자신만의 독특한 작품세계로 큰 호응을 얻고 있는 일러스트 작가 권신아의 몽환적이고 아름다운 그림이 글과 조화를 이룬다.",,415,BOOK
나는 싸기대장의 형님,"조성자 (글), 김병하 (그림)",48874,국내도서>어린이>동화/명작/고전>국내창작동화,9788952709479,'엄마와 아빠가 변했다.'로 시작하는 이야기의 주인공은 초등학교 1학년인 기훈이. 기훈이에게는 얼마전 태어난 동생 기영이가 있다. '싸기 대장'은 걸핏하면 똥과 오줌을 잘 싼다고 해서 기훈이가 붙여준 별명.,"동생이 생기자, 늘 귀염을 독차지했던 기훈에 대한 부모님과 할머니의 관심이 시들해졌어요. 싸기 대장, 기영이에게만 예쁘다고, 늘 웃으면서 토닥거려주고, 안아주고 그러는거예요. 하루는 청거북을 만진 손으로 우유를 먹였다가, 기영이가 체하는 바람에 엄마에게 호되게 혼도 났어요. 그래서 할머니 집에 청거북을 데려다 주려고 집을 나섰다가 그만 집을 잃고 마는데. 동생을 둔 사내아이 기훈이의 섭섭한 기분을 솔직담백하게 잘 표현한 초등학교 저학년을 위한 그림동화.",8232,BOOK
과학과 종교 사이에서 - 과학인 김용준의 연구 노트,김용준 (지은이),51098,국내도서>과학>과학의 이해>과학사상,9788971992081,"인문학과 자연과학의 소통과 통합을 모색해온 원로 학자인 저자가 '종교와 과학'의 문제에 천착한 글들을 묶었다. 현대과학의 결실에 대한 주요한 논쟁점들을 아우르고, 과학.종교.철학.윤리학이 연관된 총체적 질문들을 던지며 새로운 사유의 실마리를 찾고자 하는 의도에서 쓰여졌다.",,394,BOOK
세밀화로 그린 보리 아기그림책 4 - 전3권,보리 편집부 (엮은이),35427,국내도서>유아>그림책>그림백과/세밀화,9788985494427,책 제목에 출판사 실명제를 도입했을 만큼 보리출판사가 정성들인 작품. 95년 한국어린이도서상(문화체육부장관상)을 받는 등 호평을 받았다.,,6284,BOOK
문제아,"박기범 (지은이), 박경진 (그림)",48874,국내도서>어린이>동화/명작/고전>국내창작동화,9788936441753,"이 책에 실린 열 편의 단편들의 소재는 소떼 방북, 결손가정, 아빠의 손가락 무덤, 정리해고 등으로 하나같이 기왕의 어린이 문학 작가들이 다루기 꺼려하고 피해갔던 것들이다. 그러나 지은이는 이러한 사회적인 주제와 소재를 다루면서도 어린이 눈높이에서 대상과 공감을 나누게 한다.","어린이들의 현실적인 삶이 다루어진 동화
무엇이 우리 아이들을 문제아로 만들까요?

『문제아』는 창비에서 주관하는 제 3회 좋은 어린이 책 창작부문 대상을 수여한 책입니다. 어린이들에게 환상을 심어주는 책이 아닌, 우리 어린이들이 당면하고 있는 현실적 문제를 그대로 나타낸 동화입니다. 자유로운 상상력을 키우고 바른 가치관을 얻기 위해서는 어린이 자신들의 현실적인 삶이 다루어져야 한다는 지은이의 생각이 그대로 담겨있습니다. 〈손가락 무덤〉, 〈독후감 숙제〉, 〈김미선 선생님〉, 〈문제아〉 등 동화 10편을 삽화와 함께 실었습니다.

〈font color=""ff8c00""〉☞〈/font〉 <b>이런 점이 좋습니다!</b> 
『문제아』는 여러 편의 단편 동화로 이루어져 있습니다. 〈문제아〉에 실려있는 동화는 모두 우리 어린이들이 처한 현실적인 문제, 어린이를 향한 어른의 시선과 평가, 사회적 모순 속에서 우리 아이들이 어떻게 자신들의 사회와 삶을 살아가는지 그대로 보여주고 있습니다. 어린이에게는 공감대 형성을 통한 위로를, 어른에게는 그 동안 잊고 있었던 것에 대한 깨달음을 얻을 수 있습니다",15130,BOOK
우등생 해법 예체능 3-1 - 2006,,0,,9788942726813,,,389,BOOK
"바람의 딸, 우리 땅에 서다 - 개정판",한비야 (지은이),50827,국내도서>여행>국내 여행에세이,9788971844755,"한비야의 <바람의 딸, 우리 땅에 서다>가 7년 만에 새로운 모습으로 출간되었다. 이 책은 7년간 현대문명의 손길이 닿지 않는 전 세계 65개국의 오지를 찾아다녔던 한비야가 전라남도 해남 땅끝마을에서 강원도 통일전망대까지 800km(2,000리)에 이르는 우리 땅을 49일간 두 발로 걸으며 쓴 국토종단기이다.","땅끝마을부터 통일전망대까지 한비야가 만난 우리 땅, 우리 사람들!

7년 만에 새롭게 출간한 『바람의 딸, 우리 땅에 서다』. 7년간 현대 문명이 닿지 않은 전 세계 65개국의 오지를 찾아다닌 저자가 전라남도 해남군 땅끝마을부터 강원도 고성군 통일전망대까지 800km, 즉 2,000리에 이르는 우리 땅을 49일간 두 발로 걸으며 쓴 국토종단기로, 7년 만에 재출간했다. 

저자는 7년간의 변화를 직접 확인하기 위해 이번에는 차를 이용하여 7년 전의 그 길을 다시 한 번 걸었다. 개정판에서는 변화된 삶을 살고 있는 저자의 모습만큼 과거와 다른 모습을 보이고 있는 우리 땅과 우리 사람들에 대한 이야기를 덧붙여 7년간의 변화를 확인해 볼 수 있다. 또한 저자의 그림을 수록하여 때로는 유쾌하게, 때로는 따뜻하게, 그녀가 전해주는 우리 땅, 우리 사람들의 이야기를 더욱 실감나게 보여준다. 

변함없이 '한 걸음의 힘'을 믿고 따르는 저자의 글은 늘 다른 사람과 비교하며 바쁘게 살아가는 우리에게 자신만의 속도로 목표를 향해 정진하는 노력과 인내, 그리고 좌절에 굴하지 않는 내면적 힘의 중요성을 느끼게 해준다. 권말부록에는 도보 여행 정보를 수록했다.",11321,BOOK
천하무적 잡학사전 - 세상의 모든 지식을 삼켜버린다!,"엔사이클로넷 (지은이), 이강훈 (그림), 이규원 (옮긴이)",53577,국내도서>건강/취미>취미기타>상식,9788986429954,"누구나 한 번쯤 가져보았을 만한 재기발랄한 궁금증과 그에 대한 명쾌하고 재미있는 해답을 제시하는 책이다. 한 꼭지 한 꼭지가 흥미진진하면서도 유익한 내용으로 이루어져 있고, 100여 컷의 컬러 삽화는 읽는 재미를 더해준다.",,1807,BOOK
"철학, 역사를 만나다 - 세계사에서 포착한 철학의 명장면",안광복 (지은이),51440,국내도서>인문학>철학 일반>교양 철학,9788901054230,"플라톤의 이상 국가와 '제자백가의 시대'로 불리던 춘추 전국 시대부터 프랑스 혁명과 마르크스의 시대를 거쳐 니체의 초인 사상과 비트겐슈타인의 '그림 이론'에 이르기까지, 2000여 년에 걸친 철학의 주요 장면을 세계사와 함께 읽는다.",,6285,BOOK
김대균 TOEIC 최신기출 플러스 알파 모의고사 6 (문제집 + 해설집 + 부록집 + 테이프 2개),김대균 (지은이),49858,국내도서>외국어>토익>실전,9788917927849,,,490,BOOK
십자군 이야기 2 - 돌아온 악몽,김태권 (지은이),2031,국내도서>역사>서양사>서양중세사,9788990230850,"2권 '돌아온 악몽'에서는 본격적으로 십자군 원정이 시작되는 순간을 그리며 기사들로 구성된 십자군 본대가 동로마 제국에 도착하여 '국익을 위해' 십자군 전쟁을 지원하라고 반강제하는 모습이나, 자신들의 이익을 지키기에 급급한 동로마의 기득권 세력, 명분 없이 각자 실리를 챙기느라 분열하는 십자군 지휘관들 등 주요 인물들의 부침과 영욕 등이 흥미롭게 펼쳐진다.",,2666,BOOK
인생의 참고서 - 선택의 순간에 나를 돕는,안상헌 (지은이),70216,국내도서>자기계발>성공>성공학,9788991120068,"<어느 독서광의 생산적 책읽기 50>로 유명한 열혈다독가 안상헌의 책. 수많은 선택 앞에서 좀더 나은 쪽으로 가려면 어떻게 해야 하는지에 대한 조언을 담고 있다. 저자 자신의 경험과 사색의 결과를 집약하여 생활 속의 문제 상황을 짚어내고, 실질적인 조언과 함께 마음의 치료를 이끄는 솔루션을 제시하고 있다.","매일 수만 번씩 크고 작은 선택의 순간에 직면하게 되는 사람들, 그때마다 어떤 선택을 하느냐에 따라 인생의 모습이 달라진다. 미운 사람을 만났을 때, 일이 하기 싫을 때, 고객에게 화를 내고 싶을 때 등 그 순간에 어떤 결정을 해서 어떻게 행동하느냐에 따라 삶이 달라지는 것이다.



, 로 유명한 열혈다독가 안상헌의 책. 수많은 선택 앞에서 좀더 나은 쪽으로 가려면 어떻게 해야 하는지에 대한 조언을 담고 있다. 저자 자신의 경험과 사색의 결과를 집약하여 생활 속의 문제 상황을 짚어내고, 실질적인 조언과 함께 마음의 치료를 이끄는 솔루션을 제시하고 있다.",378,BOOK
스텔라 거리 45+47번지에서 생긴 일 1,"엘리자베스 허니 (지은이), 햇살과나무꾼 (옮긴이)",48846,국내도서>어린이>초등5~6학년>동화/명작/고전,9788945117199,"오스트레일리아 어린이책 위원회 선정 올해의 어린이책 우수상, 페스티벌 문학상 선정 오스트레일리어 어린이책 우수상, 이탈리아 프레미오 센토 어린이 문학상 최우수작을 수상한 오스트레일리아 창작동화. 담 하나를 사이에 두고 물러설 수 없는 싸움을 벌이는 45번지 사기꾼 부부와 47번지 롭 아저씨네 식구들, 그리고 스텔라 거리의 아이들의 이야기가 흥미롭게 그려진다.",,277,BOOK
5백년 명문가의 자녀교육,최효찬 (지은이),7257,국내도서>좋은부모>교육/학습>창의 교육,9788959131105,인성교육과 생활교육을 중요시했던 역사 속 위인들의 자녀교육 방식을 소개하는 책이다. 가족이란 틀 안에서 행해졌던 종가의 교육법을 통해 현대의 부모들에게 귀감이 될 만한 지침들을 조목조목 일러준다. 자녀를 경쟁력 있는 인재로 키워내기 위한 해법도 함께 제시한다.,"인성교육과 생활교육을 중요시했던 역사 속 위인들의 자녀교육 방식을 소개하는 책이다. 서애 류성룡 종가, 퇴계 이황 종가, 다산 정약용가, 경주 최부잣집 등 지조와 자긍심을 대대로 지켜오며 자녀교육의 모범을 실천해 온 대한민국 대표 명문가들의 노하우와 저력을 보여준다. 지은이가 직접 종가와 고택을 찾아다니며 생생한 증언과 모습들을 담아냈다.



500년을 이어오는 명문가들의 공통점은 자녀교육에 대한 열정과 헌신, 그리고 자식들에게 암묵적으로 영향을 끼친 아버지의 역할이다. 지은이는 가족이란 틀 안에서 행해졌던 종가의 교육법을 통해 현대의 부모들에게 귀감이 될 만한 지침들을 조목조목 일러준다. 자녀를 경쟁력 있는 인재로 키워내기 위한 해법도 함께 제시한다.",3656,BOOK
2006 컴퓨터활용능력 1급 필기 (2.3급 포함) - 시험에 나오는 것만 공부한다,"김종숙, 강윤석, 길벗R&D, 김선애 (지은이)",73270,국내도서>컴퓨터/모바일>중고매입용컴퓨터,9788975603686,"최근 4년간 출제된 720 개의 기출문제를 통계적으로 분석하여 시험에 나오는 것만 골라 158개의 섹션, 521개의 필드로 정리하였습니다. 섹션에는 시험에 출제된 비율에 따라 A, B, C, D 등급을 지정하고, 각 필드에는 시험에 나온 출제 년도를 표기하여 수험생이 보다 효율적으로 공부할 수 있도록 했다.",,429,BOOK
디 그레이 맨 6,호시노 카츠라 (지은이),3724,국내도서>만화>소년만화>액션,9788925225074,"일본으로 간 크로스 원수를 쫓아 중국을 떠나려는 찰나, 알렌 일행에게 상상을 초월하는 숫자의 악마 대군이 몰려온다! 한편, 무수한 악마를 삽시간에 파괴하는 기묘한 물체를 보고 알렌과 리나리는?","일본으로 간 크로스 원수를 쫓아 중국을 떠나려는 찰나, 알렌 일행에게 상상을 초월하는 숫자의 악마 대군이 몰려온다! 한편, 무수한 악마를 삽시간에 파괴하는 기묘한 물체를 보고 알렌과 리나리는...?!",590,BOOK
바람의 딸 걸어서 지구 세바퀴 반 1 - 아프리카 중동 중앙아시아,한비야 (지은이),50871,국내도서>여행>세계일주여행>세계일주여행 에세이,9788986903010,"오지 여행가로 유명한 저자가 아프리카, 중앙아시아, 중동 등지를 여행하며 남긴 기행문이다. 저자는 미국 유학 후 국제홍보회사의 중간간부로 있다가 사표를 내고 세계여행에 나선 특이한 경력을 갖고 있다. 가능하면 비행기를 타지 않고, 가능하면 현지인과 똑같이 생활하며 현지문화를 체험한다는 원칙 아래 `진짜백이 여행`을 다녀온 생생한 기록이 강한 여운을 남긴다.",,5847,BOOK
2006 신영복 서화달력 - 탁상용,신영복 (지은이),11121,국내도서>달력/기타>2009년 달력/다이어리>2009년 달력,,,,162,BOOK
티핑 포인트 - 작은 아이디어를 빅트렌드로 만드는,"말콤 글래드웰 (지은이), 임옥희 (옮긴이)",88002,국내도서>경제경영>[경제경영 사상가 20인]>말콤 글래드웰,9788950906436,"'티핑 포인트(Tipping Point)'는 어떤 아이디어나 경향, 사회적 행동이 들불처럼 번지는 마법의 순간을 가리킨다. 마치 독감 바이러스처럼 한꺼번에 퍼져 모든 이들을 꼼짝 못하게 만드는 제품과 이이디어에는 어떤 비밀이 있는가? 저자는 티핑 포인트의 모든 것을 파헤침으로써, 작은 아이디어가 큰 트렌드로 바뀌는 놀라운 과정을 보여준다.",,6213,BOOK
일본어 무작정 따라하기 (책 + 테이프 4개) - 듣기만 해도 말이 나오는,후지이 아사리 (지은이),49885,국내도서>외국어>일본어>일본어 첫걸음,9788990279354,"저자는 서울대 언어교육원에서 10년간 한국학생에게 일본어를 가르쳐온 입소문난 명강사. 그녀가 주장하는 최고의 학습법은 '글자부터 공부하지 말고 귀로 공부하는 것'이다. 이 책 또한 히라가나 등의 글자를 외우는 데에 급급하지 말고, 소리부터 익히도록 구성되어 있다.",,7375,BOOK
21세기 먼나라 이웃나라 2 - 프랑스,이원복 (지은이),48905,국내도서>어린이>사회/역사/철학>세계사,9788934913856,"헉명의 나라 프랑스의 역사와 문화를 담았다. 프랑스 혁명을 통해 전세계에 자유, 평등, 박애의 정신을 퍼뜨렸던 나라, 문화를 사랑하는 나라의 모습과 함께, 먹을 것을 좋아하며 어쩌면 오만하게 보이는 '프랑스 지상주의', 영국과 앙숙이 된 역사적 배경까지 함께 이야기한다.","수천년 인류의 문명과 지혜를 명쾌하게 짚어내는 교양만화,『먼나라 이웃나라』의 21세기 올컬러판. 달라진 세계와 유럽의 모습을 빠짐없이 반영, 내용과 구성을 대폭 개정하였고, 각 권마다 고운 색깔을 넣어서 만화 보는 재미를 한층 높였다. 제2권에서는 자유 ·평등 ·박애의 정신을 가진 낭만과 예술의 나라 프랑스를 소개한다. 프랑스의 수도 파리에 가면 세상의 멋쟁이란 멋쟁이는 다 볼 수 있다. 게다가 에펠탑, 개선문, 루브르 박물관까지 오랜 전통과 문화를 자랑하는 프랑스에는 볼 것도 많고 배울 것도 많다.",2888,BOOK
희소 전공음악 (이미정),이미정 (지은이),51006,국내도서>예술/대중문화>음악>음악이론/음악사,9788957180396,,,115,BOOK
김영모의 빵 케이크 쿠키,김영모 (지은이),53481,국내도서>요리/살림>제과제빵,9788970902906,"33년 전 주방 보조에서 시작, 전통적인 도제식 수련을 쌓아 자신의 이름을 업계 최고의 브랜드로 키운 김영모가 자신의 제과인생 30년을 결산하는 책을 냈다.",,4578,BOOK
미국에서 보물찾기,"곰돌이 co. (글), 강경효 (그림)",49224,국내도서>어린이>초등 전학년>학습만화,9788937840258,"CIA는 지구본 교수와 도토란 박사를 콜럼버스의 일기장에 기록된 아메리칸 인디어의 사라진 황금을 찾고, 테러에 대비해 자유의 여신상을 복제하기 위해 비밀리에 초청한다. 팡이는 비자 심사에 탈락해 미국행이 좌절되고, 팡이의 라이벌 토리와 CIA 요원 봉자바가 인디언의 보물을 찾기 위해 미국을 누빈다.","미국의 역사를 담은 학습 만화책. 세계 최대 강국인 미국은 1492년 콜럼버스의 발견으로 세상에 알려졌다. 이 책의 지 교수와 도 박사는 콜럼버스의 찢어진 일기장에 숨겨진 비밀, 인디언의 황금을 찾기 위해 미국에 초청된다. 지팡이가 비자를 받지 못해 미국에 가지 못하자, 라이벌 도토리가 미국을 누비게 되고, 드디어 보물이 있는 곳을 찾게 되는데…. 
　
이 책은 마치 애니메이션을 보듯 생생하게 그 이야기를 전한다. 특히, 자칫 흥미 위주로 읽힐 수 있는 만화의 단점을 보완하고자 '미국의 이념', '미국의 역사' 등과 같은 역사 상식을 각 장마다 소개해 놓았다. 만화를 통해 미국에 대한 모든 것을 배울 수 있도록 구성해 놓았다.",6551,BOOK
설득을 위한 대화의 기술,"토니 알레산드라 (지은이), 정봉원, 최경희 (옮긴이)",2952,국내도서>자기계발>인간관계>인간관계,9788947524261,"동료와 직원들, 상사들, 친구들, 가족 또는 연인과 잘 지내고 싶다면 자신의 선천적 성향과 상대의 유형을 인식해야 한다. 이 책에서는 핵심 행동 양식에 따라 사람들을 ① 지배적 지시형, ② 상호적 사교형, ③ 안정적 관계형, ④ 신중한 사교형 등 네 가지 유형으로 분류하고, 각각의 사람들에게 맞는 10가지 대화 법칙을 알려준다.",,213,BOOK
Hackers Writing Start (해커스 라이팅 스타트) (책 + 185 topics 완벽대비 포켓북) - 토플.영어논술.특목고.IELTS.토익,David Cho (지은이),49870,국내도서>외국어>토플>Writing,9788990700001,에세이 작성에 유용하게 활용할 수 있는 185가지 TWE 토픽에 대한 1000여 개의 필수 표현과 585개의 문장 쓰기 연습을 담았다. 특히 테스트 코너를 통해 TWE 토픽과 관련된 문장 쓰기를 연습함으로써 실제 시험에서 응용 가능하도록 하였다. 한 달 만에 책을 끝낼 수 있도록 4개의 chapter가 각 6일 학습 분량으로 구성되어 있다.,,8472,BOOK
말이 트이는 한국어 3 StudentBook,이화여자대학교 언어교육원 (지은이),49935,국내도서>외국어>외국인을 위한 한국어>한국어 회화,9788973004232,"올컬러의 사진과 그림으로 알기 쉽게 한글을 배울 수 있도록 꾸민 한글 교재.  간단한 문법설명, 회화, 읽기 예문들이 적절하게 조화된 구성이 돋보인다. 1권이 가나다라 한글 글자와 발음에서부터 시작하긴 하지만 1권에서부터 영어없이 한글로만 쓰여있다.",,202,BOOK
초등학교부터 시작하는 논술 오디세이 2 - 분류와 추론,어린이철학교육연구소 (엮은이),48945,국내도서>어린이>책읽기/글쓰기>논리/논술,9788935654451,,"미국 하버드대학 교수들이 중심이 되어 개발한 사고력 개발 프로그램. 초등학생을 대상으로 1단계부터 6단계까지 여섯권으로 나누어 난이도별로 프로그램을 적용할 수 있도록 했다. 초등학교 1학년부터 6학년까지 누구나 1단계에서 시작해 차례차례 가능한 단계까지 프로그램을 활용하면 된다.



1권(1단계)에서는 프로그램의 출발점이 되는 학습을 시작한다. 사물의 중요한 특징을 파악하는 관찰, 공통적인 특징에 따라 나누는 분류, 그리고 일정한 규칙을 찾아내는 순서 정하기를 학습한다. 2권(2단계)에서는 1권에서 배운 내용을 심화해 분류한 것을 다시 분류하고, 유비추론의 구조와 논리를 터득하며, 칠교놀이를 이용해 공간적 추론의 원리와 방법을 익히게 된다.



3권(3단계)에서는 간단한 문제에서 복잡한 문제까지 문제의 의도를 정확하게 파악하고 성공적으로 해결하는 방법을 공부하게 된다. 그림이나 기호, 표, 흐름도를 이용한 문제 해결 방법이 수록되었다. 4권(4단계)에서는 낱말이 가지고 있는 미묘한 의미 차이와 낱말이 서로 연관되는 방식, 글의 구조을 배운다.



5권(5단계)에서는 4권에서 학습한 내용을 바탕으로 글쓴이의 목적, 글쓴이의 관점, 그리고 주제를 파악하는 정보의 해석을 배운다 또, 자잘한 생활용품에 깃튼 창의적인 발상에 대해서도 함께 생각해 본다. 6권(6단계)에서는 바람직한 대안의 선택, 의사 결정의 심화, 어려운 문제 해결을 익힌다.",8543,BOOK
