title,author,genre_id,genre,ISBN,description_aladin,description_naver,salesPoint,mallType
1984,"조지 오웰 (지은이), 정회성 (옮긴이)",50919,국내도서>소설/시/희곡>영미소설,9788937460777,"민음사에서 조지 오웰 탄생 100주년을 맞아 그의 대표작 <1984>를 새롭게 펴냈다. <1984>는 널리 알려진 바와 같이 전체주의를 비판하는 디스토피아 소설로, 날카로운 풍자와 정치적 함의로 유명하다. '절대 권력은 절대 부패한다'는 명언을 탁월하게 형상화한 작품.","과거를 지배하는 자는 미래를 지배하고, 현재를 지배하는 자는 과거를 지배한다!

『1984』는 예리한 사회의식과 냉소적 풍자정신이 빛나는 조지 오웰의 대표적인 소설로, 현재사회에도 유의미하다. 1947년에 쓴 미래소설이지만 당시보다도 정보 기술의 발달로 개개인의 사생활과 신상정보가 쉽게 노출될 수 있는 오늘날, 오웰의 작품이 보내는 경고는 더욱 심각하게 받아들여진다. 이 책은 언어와 역사가 철저히 통제되고 성본능은 오직 당에 충성할 자녀를 생산하는 수단으로 억압되며, 획일화와 집단 히스테리가 난무하는 인간의 존엄상과 자유가 박탈된 전체주의 사회를 그리고 있다. 전체주의라는 거대한 지배 시스템 앞에 놓인 개인이 어떻게 저항하고 파멸해 가는가를 적나라하게 보여준다. 

1984년, 세계는 오세아니아, 유라시아, 동아시아라는 삼 대 전체주의 국가에 의해서 지배되고 있다. 이 삼 대 강국은 서로 끊임없이 전쟁을 벌인다. 하지만 그것은 국경 부근에서의 소규모 분쟁일 뿐이고, 이는 국내의 지배 체제를 강화하기 위한 수단에 지나지 않는데…….",65406,BOOK
해커스 리딩 인트로 (Hackers Reading Intro) - 영어독해의 시작ㅣ토플.IELTS.텝스.특목고.수능.편입,해커스어학연구소 (지은이),49835,국내도서>외국어>영어독해,9788990700506,"해커스 어학연구소가 영어 입문 학습자들을 위하여 오랜 기간 연구를 거쳐 탄생시킨 영어 독해 시작서. 기초 실력을 쌓을 수 있는 단계별 학습 프로그램을 적용, 교재 전체를 3단계로 구성하였으며 핵심이 되는 2단계에서는 영어시험들에 실제 출제될 만한 '독해문제유형'을 체계적인 학습 흐름의 구조로 전개하였다.","<b>독해 입문 학습자를 위한 영어 독해의 시작서</b> 

《해커스 리딩 인트로》는 해커스 어학연구소가 영어 입문 학습자들을 위하여 오랜 기간 연구를 거쳐 탄생시킨 '영어 독해 시작서'로, 기초 실력을 쌓을 수 있는 단계별 학습 프로그램을 적용, 교재 전체를 3단계로 구성하였으며 핵심이 되는 2단계에서는 영어시험들에 실제 출제될 만한 '독해문제유형'을 체계적인 학습 흐름의 구조로 전개하였다.

또한, 시험에 자주 출제되는 독해유형을 선별.gohackers.com"" target=""_blank"">www.goHackers.com) 에서 학습 내용의 궁금증을 나누고, 다양한 무료 영어 학습 자료를 함께 이용할 것을 권장합니다.

▶ 함께 제공합니다. 
1) 무료 지문 녹음 MP3 (www.ChampSt하여 각 유형에 맞는 핵심 전략을 제시하고, 그 전략에 비추어 정답과 오답의 당위성을 따져봄으로써 모든 독해시험 유형에 대처할 수 있는 논리력을 배양할 수 있다.

[<b>알아두기</b>] 
《해커스 리딩 인트로》의 학습효과를 극대화하기 위해 토플*IELTS 웹사이트()
2) 무료 단어 암기 MP3 (www.ChampStudy.com)",11463,BOOK
천년의 그림여행 - 특별 보급판,"스테파노 추피 (지은이), 이화진, 서현주, 주은정 (옮긴이)",50978,국내도서>예술/대중문화>미술>미술 이야기,9788970842530,"서양 미술사에서 중요하게 자주 꼽히는 800여 점의 그림 안내서. 지은이는 지난 천 년간 서양회화의 변천사와 작가, 작품, 각 지역 미술의 특징을 두루 짚으며, 서양 미술사 전반을 돌아본다. 시대를 초월하는 35점의 걸작은 더 자세하게 소개하며, 부록으로 연표, 찾아보기를 함께 실었다.",,2902,BOOK
가로세로 세계사 3 : 중동 - 화려한 이슬람 세계를 찾아서,이원복 (지은이),48905,국내도서>어린이>사회/역사/철학>세계사,9788934924685,"총소리가 그치지 않는 화약고, 중동을 찾아간다. 세계문명의 발상지로 수많은 문화유산을 간직한 축복받은 땅이자 세계의 중심에 우뚝 섰던 이슬람제국, 유럽의 르네상스를 이끈 예술과 자연과학의 성과들, 그리고 성경과 코란의 충돌까지, 모든 오해와 편견을 걷어내고 중동 역사의 진실과 만난다.","중동, 축복의 땅인가? 버림받은 땅인가? 오해와 편견없이 추적한 중동역사의 진실!

『가로세로 세계사』시리즈 제3권《중동 화려한 이슬람세계를 찾아서》. 본 시리즈는 스테디셀러『먼나라 이웃나라』의 저자 이원복 교수가 새롭게 선보이는 교양만화로, 세계사에서 크게 거론되지 않는 나라에 대해 짚어줍니다. 

3권 〈중동 화려한 이슬람세계를 찾아서〉에서는 이스라엘과 팔레스타인의 분쟁이 끊이지 않는 중동에 대해 살펴봅니다. 중동은 세계문명의 발상지로 수많은 문화유산을 간직한 축복의 땅이지만, 현재는 서로 다른 종교 문제(유대교, 기독교, 이슬람교)로 서로에게 총을 겨누고 있습니다. 그 실타래처럼 엉킨 문제를 역사를 통해 핵심을 짚어주고 있습니다. 
 
〈font color=""ff8c00""〉☞〈/font〉 <b>이런 점이 좋습니다!</b> 
『먼나라 이웃나라』가 미국, 일본, 유럽 등에 치우친 강대국의 세계사였다면,『가로세로 세계사』는 나머지 반쪽, 아시아와 아프리카 등 세계사에서 잃어버린 나라의 역사와 문화를 여행합니다. 이 책은 서양과 동양, 진보와 보수를 아우르며, 우리가 미처 알지 못했던 세계사의 반쪽을 찾아 지구촌을 앞뒤, 좌우, 위아래로 훑고 있습니다.",6188,BOOK
황금 물고기,"J.M.G. 르 클레지오 (지은이), 최수철 (옮긴이)",50921,국내도서>소설/시/희곡>프랑스소설,9788982810893,프랑스 문단의 살아 있는 신화로 불리는 르 클레지오의 역작을 중견 소설가 최수철씨가 옮겼다. 예닐곱살 때 유아 인신매매단에 납치되어 프랑스로 팔려간 한 아프리카 소녀의 인생역정을 다루었다.,,5620,BOOK
폴 크루그먼의 경제학의 향연 - 경제 위기의 시대에 경제학이 갖는 의미와 무의미,"폴 크루그먼 (지은이), 김이수, 오승훈 (옮긴이)",88012,국내도서>경제경영>[경제경영 사상가 20인]>폴 크루그먼,9788985989169,"현대의 경제학 이론이 현실 경제 및 정치권력과 상호 작용하는 과정을 소개하면서, 경기 순환·통화·성장·생산성·조세·예산 적자·산업 정책·무역 등 경제학의 기본 개념을 적절한 사례와 사고 실험을 통해 명쾌하게 설명한다.","현대의 경제학 이론이 현실경제 및 정치권력과 상호  작용하는 과정을 소개하면서 경기순환, 고용, 통화,  무역 등 경제학의 기본 개념들을 설명하고 이 개념이 경제이론 및 정책에 바녕되는 과정이 어떻게 왜곡되는지를 분석한 이론서.  흥미진진한 사례를 이용했다.",3715,BOOK
인턴일기 - 초보의사의 서울대병원 생존기,홍순범 (지은이),51371,국내도서>에세이>한국에세이,9788954607339,"새내기 의사가 대학병원의 각 과를 두루 거치며 틈틈이 기록한 15권의 수첩을 바탕으로 한 1년간의 인턴 수련기록을 책으로 엮어냈다. 질병과 생명, 의사와 환자, 병원과 간호사와 환자가족에 이르기까지 의사의 길을 시작하는 인턴이 몸으로 부딪치며 깨달아가는 현장기록을 담았다.","사람의 생명을 다루는 의사는 어떻게 만들어 지는가
인턴의 비밀수첩에 날것으로 담긴 종합병원과 의사들의 자화상

『인턴일기: 초보의사의 서울대병원 생존기』는 새내기 의사가 대학병원의 각 과를 두루 거치며 틈틈이 기록한 15권의 수첩을 바탕으로 한 1년간의 인턴 수련기록이다. 저자 홍순범은 인턴 수련을 받는 1년 내내 수첩을 항상 가지고 다니면서 인상깊은 사건이나 상념과 마주하게 되면 시간이 생길 때마다 짬짬이 메모를 했다.

『인턴일기』는 새내기 인턴의 좌충우돌 성장기로, 1년간 병원에서 지내면서 직접 겪은 인턴 생활과 인턴의 속내를 관찰해 그 결과를 정리한 책이다. 질병과 생명, 의사와 환자, 병원과 간호사와 환자가족에 이르기까지 인턴으로 현장에서 부딪히며 깨달았던 성장기록이다.

자신이 의사고시를 치렀던 날부터 이야기를 시작해서 인턴의사로 생활했던 전 과정이 숨김없이 기록되어 있으며 진짜 의사로 성장해가는 과정에 생생하게 묘사되어 있다. 의사로서, 인간으로서 점차 성숙해가는 초짜 의사의 솔직한 이야기는 의료에 대한 공감적인 소통의 기회가 될 것이다.

저자는 자신이 의사고시를 치렀던 날부터 이야기를 시작해서, 인턴시험과 의사고시의 관계, 인턴 오리엔테이션의 경과, 인턴일정 추첨의 극적인 긴장감, 매달 근무지를 옮겨 다닐 때마다 이뤄지는 업무인수인계와 일과, 적응의 어려움과 업무의 보람, 각과 의사들의 특징, 인턴이 맞닥뜨리는 힘든 과제 등을 이야기하고 있습니다.",1536,BOOK
사람을 얻는 기술,"레일 라운즈 (지은이), 임정재 (옮긴이)",2952,국내도서>자기계발>인간관계>인간관계,9788992060233,성공적인 삶을 살아가는 사람들을 주의 깊게 살펴보라. 그들의 주변은 늘 '사람들'로 북적인다. 그들이 성공했기 때문에 사람들이 몰려온 것일까? 아니다. 성공에 필요한 사람들을 끊임없이 불러 모았기 때문에 그들은 성공할 수 있었다.,"성공과 행복의 등불이 되어 줄 '내 사람' 만드는 매력적인 방법과 기술!

세상은 혼자 살 수 없다. 더군다나 성공하려면 수많은 사람들을 내 편으로 만들어야 한다. 실제로 성공한 사람들 주위는 늘 사람들로 북적거린다. 그들이 성공했기 때문에 사람들이 몰려온 것이 아니라 성공에 필요한 사람들을 끊임없이 불러 모은 것이다. 나를 받쳐 줄 후원자, 나를 이끌어 줄 스승, 함께 갈 동료 등 '내 사람'없이는 성공할 수 없다.

『사람을 얻는 기술』은 어떤 상대도 내 사람으로 만들어 버리는 82가지 지혜를 수록하였다. 〈포춘〉 500대 기업의 커뮤니케이션 전문가로 세계적 명성을 쌓은 저자는 '성공적인 인생에 꼭 필요한 사람을 얻는 지혜'를 흥미진진한 사례를 곁들여 누구나 쉽게 이해할 수 있도록 소개하였다.

무엇보다 인생의 성공과 실패는 '사람' 하나 차이라고 강조한다. 그리고 어떻게 행동해야 사람을 얻을 수 있는지 '실수를 보지도 듣지도 마라, 귀신처럼 행동하라, 절친한 감정을 실어 보내라, 주목 받으며 입장하라, 가장 먼저 박수 쳐라' 등 82가지 방법으로 정리하여 생활 속에서 바로 실천할 수 있도록 하였다.

☞ 이 책의 독서 포인트!
""사람을 얻는 자는 성공하고, 사람을 잃는 자는 실패한다""는 진리를 감동적인 사례와 함께 이야기한다. 자신이 가진 장점, 매력, 호감을 상대에게 효과적으로 전달하는 방법, 상대의 뛰어난 재능을 발굴하는 방법, 사람들이 자신에게 언제나 우호적이고 열광하도록 만드는 처방전 등을 아낌없이 제공한다.",8137,BOOK
"ENGLISH ICEBREAK ADVANCED - 회화, 20시간만 들으면 되고 영어, 생각대로 하면 되고","Ramiro Garcia, 제임스 J. 애셔, BaEsic Contents House (지은이)",49849,국내도서>외국어>영어회화>생활영어,9788970636146,"막연히 영어가 어렵다고 생각하는 학습자를 위해 만들어진 책. 전체가 그림으로 표현된 영어 책이다. 그림이 주는 효과는 크게 두 가지인데, 하나는 보는 즉시  내용을 알게 해준다는 것과 또 하나는 우뇌를 자극해 기억을 쉽게 해주는 것이다. 또한 망각 곡선에 근거한 자연스런 반복법을 채택하고 있다.",,1607,BOOK
강아지똥,"권정생 (글), 정승각 (그림)",35134,국내도서>유아>그림책>나라별 그림책>한국 그림책,9788986621136,"이 책은 가장 낮은 곳으로부터의 아름다움을 감격스럽게 그린 어린이 그림책이다. 아무도 거들떠 보지 않고 쓸모없는 것으로 치부해 버리는 강아지똥, 그 똥이 민들레 꽃으로 다시 태어나는 과정을 통해 어린이들에게 자연의 감동스럽고 신비스러운 이치를 자연스럽게 보여 준다.","""쓸모없는 것은 없단다.""

『강아지똥』은 아동작가 권정생의 대표작으로, 아무도 거들떠 보지 않는 세상에서 가장 버림받는 존재인 '강아지똥'도 알고 보면 정말 소중한 존재라는 사실을 일러주는 그림책입니다. 아무짝에도 쓸모없는 것처럼 여겨지는 강아지똥이라는 한낱 미물이 민들레 꽃을 피워내는 데 소중한 거름이 된다는 이야기가 펼쳐집니다. 화가 정승각의 그림은 의인화된 강아지똥과 강아지똥이 만나는 주변 친구들의 모습을 감동적으로 그려냈습니다.",70800,BOOK
내 이름은 나답게,"김향이 (지은이), 김종도 (그림)",48874,국내도서>어린이>동화/명작/고전>국내창작동화,9788971965887,"다섯 살때 교통사고로 엄마를 잃고 아빠, 외할아버지, 외할머니, 고모네 식구들과 아기자기하게 살아가고 있는 주인공 나답게는 밝고 천진난만한 여느 꼬마아이와 다름없이 살아간다. 비록 엄마는 없지만 그 빈자리를 대가족과 자연이 넓은 가슴으로 채워주기에 외롭지도 슬프지도 않다.","'나답게' 살라고 아빠가 지어준 이름, 나답게.<BR>
<BR>
다섯 살때 교통사고로 엄마를 잃고 아빠, 외할아버지, 외할머니, 고모네 식구들과 아기자기하게 살아가고 있는 주인공 나답게는 밝고 천진난만한 여느 꼬마아이와 다름없이 살아간다. 비록 엄마는 없지만 그 빈자리를 대가족과 자연이 넓은 가슴으로 채워주기에 외롭지도 슬프지도 않다.<BR>
<BR>
때로 갑작스런 말과 행동으로 어른들을 놀라게 하는 주인공의 티없이 맑은 모습, 등장하는 아동들이 보여주는 요즘 아이같지 않은 순진무구한 행동들은 어린 시절 함께 치고 받으며 자란 형제와 친구들을 생각나게 한다. <BR>
<BR>
처마에 얼어붙은 고드름을 보며, 맨발로 눈위를 걷는 참새를 보며, 심지어는 차가운 눈에 뒤집어 씌인 풀잎을 보면서까지 사고의 폭을 넓혀가며 인생을 배우는 주인공의 모습을 보고 있노라면, 어린이는 어른의 아버지라는 말이 틀리지 않다는 생각이 든다. <BR>
<BR>
특히 핵가족 사회에서 살아가는 아동들이 맛보기 힘든 다정다감한 가족애와 사는 재미가 어린 나답게의 입말체로 표현되어 독자들에게 친근함과 공감을 불러일으킨다.<BR>
<BR>
밝고 천진난만한 행동과 구김살없는 모습, 화목한 가족들의 사랑이 아이들에게 가족의 소중함을 일깨워 주고, 특히 엄마나 아빠가 없는 결손 가정의 아이들에게 용기와 희망을 가져다 줄 수 있는 성장동화이다.",13818,BOOK
"어린이를 위한 배려 - 어린이 자기계발 동화 01, 엄마와 아이가 함께 감동한 베스트셀러 의 아동판","한상복 (지은이), 전지은 (글), 김성신 (그림)",48849,국내도서>어린이>초등5~6학년>자기계발,9788989313847,베스트셀러 <배려>의 아동판. 학교와 가정 등 초등학교 어린이들 주위에서 흔히 일어날 수 있는 이야기를 소재로 <배려>에 담긴 나누며 베푸는 성공에 대한 메시지를 전달한다.,,12634,BOOK
"시나공 TOEIC Reading - 전3권 (68,000원 동영상 수강권, 빈출표현 암기장 제공)","안광모, 정상토익연구회, 정상 (지은이)",49854,국내도서>외국어>토익>Reading,9788960470675,"최근 5년간의 기출문제를 화제의 만점 강사, 정상 선생과 분석의 대가, 안광모 선생이 시험에 나오는 모든 테마를 31가지 법칙으로 정리한 책이다.",,3442,BOOK
열일곱 살의 털,김해원 (지은이),50759,국내도서>청소년>청소년 문학>청소년 소설,9788958283065,제6회 사계절문학상 대상 수상작. 주인공 일호는 너무나 평범하다. 작품은 일호가 할아버지의 이발소 의자에서 열일곱 살 생일을 맞는 장면으로 시작하면서 앞으로 머리카락과 관련하여 유구한 사건들이 벌어질 것임을 예고한다.,"대한민국 열일곱 살들의 털을 사수하라!

제6회 사계절문학상 대상을 수상한 김해원의 작품『열일곱 살의 털』. 평범한 모범생 일호의 '나'를 찾아가는 여정을 머리카락에 얽힌 사건들을 통해 그리고 있다. 처음으로 세상에 맞서게 된 열일곱 살 일호의 이야기 속에 학교 두발 문제와 관련된 청소년 인권 문제, 주인공 일호의 가족사, 우리 사회와 역사를 담아내었다. 

매년 생일을 할아버지가 해주는 이발로 맞이하는 주인공 일호. 태어나기 전 아버지가 집을 나갔다는 점 말고는, 일호는 평범한 모범생이다. '범생이 1호'로 통하던 일호는 어느 날, 체육 선생이 두발 규정을 어긴 아이의 머리에 라이터를 들이대는 것을 보고 이성을 잃는다. 대한민국 열일곱 살들의 머리털을 위해 일호가 두발 규제를 반대하는 1인 시위를 시작한 그 때, 일호처럼 한 번도 싸워보지 않았던 이발사 할아버지도 재개발 문제로 시위에 나서는데….  

'나는 너무 물컹하거나 단단하다'라고 생각했던 일호는 자신의 신념을 지켜내며 점점 단단해져간다. 작가는 일호의 아버지가 오랫동안 여행을 떠났다고 설정함으로써 아버지와 아들의 심리적 거리감을 상징적으로 보여주었다. 하지만 일호는 일반적인 아버지상과 다른 모습을 보여주는 아버지를 마음으로 받아들이면서 자기 자신의 모습 또한 사랑하게 된다.",7559,BOOK
괭이부리말 아이들 - MBC 느낌표 선정도서. 양장본,"김중미 (지은이), 송진헌 (그림)",48874,국내도서>어린이>동화/명작/고전>국내창작동화,9788936433444,2000년 7월 두 권으로 선보였던 <괭이부리말 아이들>의 양장본. 제4회 '좋은 어린이책' 원고공모 창작부문 대상 수상작이었던 이 작품은 2001년 11월 방송된 TV 오락프로그램에서 국민필독서로 선정되면서 한 권으로 묶여 다시 선보이게 되었다.,"2000년 7월 두 권으로 선보였던 의 양장본. 제4회 '좋은 어린이책' 원고공모 창작부문 대상 수상작이었던 이 작품은 2001년 11월 방송된 TV 오락프로그램에서 국민필독서로 선정되면서 한 권으로 묶여 다시 선보이게 되었다.



창작과비평사에서는 MBC와 독서캠페인을 벌임으로써 얻어지는 이 책의 수익금 전액을 불우어린이 돕기와 독서진흥운동에 쓸 예정이라고 한다.



한 권으로 묶였을 뿐 내용은 기존의 책과 같다. 인천 만석동 달동네의 별칭인 괭이부리말을 배경으로 서로 위로하고 의지하며 꿋꿋하게 성장해나가는 아이들의 모습을 그려진다. 괭이부리말은 6·25 전쟁 직후 가난한 피난민들이 모여 살면서 만들어진 이 동네는 인천에서 가장 오래된 빈민 지역이다.



지은이 김중미는 1987년부터 괭이부리말에서 살며 지역운동을 해왔고, 지금도 그곳에서 공부방을 운영하고 있다. 지은이는 자신의 경험을 생생하게 살려, 초등학교 5학년인 숙희와 숙자 쌍둥이 자매를 중심으로 가난한 달동네의 구석구석을 착실하게 그려 나간다.",24732,BOOK
피타고라스 구출작전 - 수학도서관 6,"김성수 (지은이), 최영란 (그림)",48871,국내도서>어린이>과학/수학/컴퓨터>초등 수학,9788934916468,"혜지와 세민, 주철은 타임머신을 타고 2,500년 전의 고대 그리스로 날아간다. 하지만 아이들은 피타고라스의 제자가 되고 싶다는 말 한마디에 다짜고짜 지하 감옥에 갇힌다. 어렵게 만난 피타고라스는 누군가에게 쫒기고 있었고, 어느 새 세 아이도 피타고라스를 돕느라 수많은 위험에 빠지고 만다.","그때마다 세 아이 앞에는 어려운 수학 문제가 놓인다. 아이들은 수학 문제를 풀면서, 우정, 용기, 지혜가 발휘되고, 그 과정 속에서 조금씩 성숙해간다. 아이들에게 읽기 능력을 강화하면서 당면한 수학 문제에 대해 논리적인 사고를 펼 수 있도록 돕는 수학동화. 역사 속의 실제 인물들을 만나면서 수학이라는 학문 자체가 인류의 조상들이 이룩해낸 빛나는 연구의 성과라는 것을 몸소 체험하면서 수학에 대한 거리감을 좁힐 수 있다는 데도 매력이 있다.

기초 수학과 철학의 선구자, 피타고라스를 이야기의 모태로 삼고, 아이들 스스로 수학 문제를 풀면서 우정, 용기, 지혜를 발휘하도록 이야기를 꾸몄다. 동시에 아이들에게 부족한 읽기 능력을 강하면서 당면 문제에 대한 논리적인 사고를 펼칠 수 있도록 돕고 있다. 특히, 역사 속의 실제 인물을 직접 만나면서 그들의 빛나는 연구 성과를 몸소 체험하도록 한 것이 그 어느 책보다 매력적으로 다가온다.",9649,BOOK
한국 단편소설 베스트 30 - 중.고생이 꼭 읽어야 할,김동인 (지은이),50759,국내도서>청소년>청소년 문학>청소년 소설,9788976700377,"2005년도 서울시 교육청 국어과 추천도서, 전국 초중고교 독서지도교사 모임 (사)전국독서새물결모임 추천도서로 선정된 책이다.",,4868,BOOK
국어시간에 논리읽기 1단계,전국국어교사모임 (엮은이),1147,국내도서>청소년>논술참고도서,9788987402819,"논리적 언어 사용 능력을 기르기 위해 만든 수준별, 단계별 논리 학습 교재. 지식과 정보를 습득하고 논리적인 판단 능력을 기를 수 있도록 다양한 글을 실었다. 현직 국어 선생님들이 학생들이 접하는 일상생활과 사회, 학문 영역에서 고루 주제를 뽑아 각 분야의 기본적인 지식과 정보를 얻을 수 있도록 편성한 것. 또한 교과서에 쉽게 싣기 어려운 다양한 관점의 글을 통해 논리적인 사고 능력을 기를 수 있도록 했다.",,1087,BOOK
감옥으로부터의 사색 - 신영복 옥중서간,신영복 (지은이),51371,국내도서>에세이>한국에세이,9788971991060,1988년 첫 출간된 이래 지금까지 수많은 사람들의 가슴에 깊은 감동을 남기며 이 시대의 고전으로 기록된 <감옥으로부터의 사색>의 증보판. 저자의 출소 이후 발견된 메모노트와 기존 책에 누락된 편지글들을 완벽하게 되살려냈다.,"출소 이후 발견된 메모노트와 누락된 편지글을 완벽하게 되살려낸 증보판!

1988년 첫 출간된 이래 지금까지 10년 동안 수많은 사람들의 가슴에 깊은 감동을 남기며 이 시대의 고전으로 기록된 책 『감옥으로부터의 사색』. 출간 10년, 그리고 저자의 출소 10년이 되는 해에 보다 새로워진 형식과 내용으로 재출간 된 증보판이다. 저자의 출소 이후에 발견된 메모노트와 기존 책에 누락된 편지글들을 완벽하게 되살려냈으며 기존 책에는 없는 1969년 남한산성 육군교도소에서 기록한 글들과 1970년대 초반 안양 대전 교도소에서 쓴 편지들이 빠짐없이 완전한 모습으로 담겨 있어 저자 20대의 사색 편린들과 어려웠던 징역 초년의 면모까지 살펴볼 수 있다.

또한 저자가 감옥에서 그린 그림, 하루 두 장씩 지급되는 휴지와 비좁은 봉함엽서 등에 철필로 깨알같이 박아 쓴 일부 편지의 원문을 그대로 살려, 글의 내용에 못지 않은 진한 감동을 느낄 수 있다. 뿐만 아니라 기존의 책이 수신자별로 구성되었던 데 비해 이 책은 시기별로 구성되어 있어 발신자인 저자의 입장이 보다 잘 드러난다. 영어의 몸으로 겪어낸 20년 20일간의 옥중 삶의 흐름이 저자의 고뇌 어린 사색의 결정과 함께 잔잔히 펼쳐지는 이 책은, 현재의 삶을 돌아보는 자기성찰의 맑은 거울이자 한 시대의 반듯한 초상이며, 우리 민족의 아름다운 고전이다.",22118,BOOK
