title,author,genre_id,genre,ISBN,description_aladin,description_naver,salesPoint,mallType
관계를 깨뜨리지 않고 유쾌하게 이기는 법 68,이정숙 (지은이),2952,국내도서>자기계발>인간관계>인간관계,9788959371020,"부모님이 내 연인을 헐뜯을 때, 형제가 일방적으로 경제적인 도움을 요청할 때, 부하 직원이 사적인 일로 업무 시간을 낭비할 때 등 말하기 애매한 상황에서 갈등을 유쾌하게 해소하고, 관계를 깨뜨리지 않으면서, 서로 상처받지 않고 유쾌하게 이기는 방법 68가지를 소개한다.","바쁜 현대인들이 언제 어디서나 읽고 곧바로 참고하고, 응용할 수 있도록 쉽고 간결하게 구성되어 있는 이 책은 관계 속에서 살아가는 모든 사람들에게 꼭 필요한 상황을 예시하고 슬기롭게 대처할 수 있는 방법을 제시하고 있으며, 책 중간 중간 재미있는 카툰을 통해 독자들이 쉽게 이해하도록 도와준다. 어떤 유형의 인간이, 어떤 말로, 그 어떤 갈등을 일으키더라도 스트레스받지 않고 후유증 없이 이기는 방법을 제시해, 인간관계를 해치지 않고도 갈등을 해소하는 방법을 찾고 싶은 분들에게 유쾌한 해답을 제시해줄 것이다....",4065,BOOK
블루 오션 전략,"김위찬, 르네 마보안 (지은이), 강혜구 (옮긴이)",2173,국내도서>경제경영>기업 경영>경영전략/혁신,9788970856575,"치열한 경쟁으로 이윤이 점점 희박해지는 '레드 오션(Red Ocean)'에서 벗어나, 새로운 수요를 창출해 경쟁을 무의미하게 만드는 '블루 오션(Blue Ocean)'으로 나아가라. 하버드 경영대학원 역사상 최다 언어 번역 기록을 세운 책으로, 중앙일보, 한겨레신문, 동아일보 선정 올해의 책이다.","삼성경제연구소 2005년 최고의 히트상품
LG경제연구소 2005년 ""경영키워드""
TV책을 말하다 2005년 ""올해의 책""
네이버-교보문고 공동 ""올해의 책""
예스24 ""올해의 책""
한경 비즈니스 경제경영 1위 선정
한국출판인회의 선정 2005 최고의 번역출판물 선정
2005년 프랑크프루트도서전 ""최고의 경영도서"" 선정
아마존 ""2005년 10대 경영도서"" 선정
미국도서 유통업체 800-CEO READ ""2005년 최고의 책"" 선정

경쟁이 치열한 산업사회에서 대부분의 기업들은 시장점유율을 넓히기 위해 전략을 수립하고, 차별화를 위해 투쟁하며, 경쟁우위를 확보하기 위해서 머리를 싸맨다. 하지만 애초에 경쟁자가 없는 시장공간을 창출하면 어떨까? 이 책은 전략적인 성공을 거두기 위한 필수조건들에 대하여 새로운 방법론을 제안한다.

레드오션에서 기업들은 오로지 현재 존재하는 시장에서 수요자를 찾는 데서만 성장을 국한시킨다. 그 대신, 그들은 시장 바깥에 있는 비고객들에게로 눈을 돌려야 한다. 그래서 블루 오션처럼 거대하고 무한한 새로운 시장공간을 창출할 수 있어야 한다. 캘러웨이 골프에서 도전적인 스포츠에 겁먹은 비골퍼들을 위해 새로운 블루오션을 열었다. 골프채의 헤드가 크게 디자인된 '빅버타'라는 골프용품에 대한 새로운 요구의 블루 오션을 창출한 것이다. 

레드오션에서는 고객들이 동종 산업 안에서 타 경쟁자들과의 사이에서 어떻게 선택을 하느냐에 대해서만 질문한다. 그렇지만 블루오션을 창출한 기업들은, 소비자들이 의사결정하는데 산업간 경계를 넘어서까지 바라본다는 사실을 이해하고 있다. 이렇듯 블루오션 전략은 치밀한 방법론을 제시하며, 거대 신시장을 창출할 수 있게 해주는, 다음 세대를 위한 희망의 전략이라 할 수 있다.",15383,BOOK
어둠의 저편,"무라카미 하루키 (지은이), 임홍빈 (옮긴이)",50998,국내도서>소설/시/희곡>일본소설>1950년대 이후 일본소설,9788970126685,"무라카미 하루키의 최신작 <어둠의 저편>이 출간됐다. <해변의 카프카> 이후 2년 만에 발표한 장편소설로, 데뷔 25주년을 기념하는 뜻깊은 작품이다. 기존 작품들과는 크게 다른 소설적 구조와 주제, 분위기를 보여주어, 하루키 문학의 전환점이 되는 작품이라 평가받는다.","2002년 『해변의 카프카』이후 2년 만에 발표된 무라카미 하루키의 장편 신작. 하루키의 데뷔 25주년을 기념하는 작품이기도 하며, 일본에서는 출간되자마자 베스트셀러에 올랐다. 이 책은 하루키의 종전 작품들과는 크게 다른 소설적 구조와 주제를 보여주며, 두드러지게 참신한 작품 분위기와 표현 기법을 보여주고 있어 하루키 문학의 새로운 전환을 알리는 획기적인 작품이 되리라고 평가받고 있다. 

대략 밤 12시부터 다음 날 아침 7시까지, 백설공주 같은 미모의 언니와, 머리는 뛰어나지만 외모에 콤플렉스를 느끼는 동생이 중심이 되어 인간과 사회의 축소판과 같이 펼쳐지는 하룻밤 동안의 이야기로 구성되어 있다. 젊은 남녀, 자매 형제, 부부, 샐러리맨에서부터 암흑세계의 사람 등 갖가지 인간 군상이 등장하는 가운데 폭력의 공포가 도사리고 부조리가 휩쓸고 정이 메말라가는 현대사회를 집요하게 그리며 희망의 가능성을 묻는다. 제임스 조이스, 알렉산드르 솔제니친이 그린 하루 낮에 일어난 이야기 대신 하룻밤에 일어난 이야기로 명작들에 비견되는 작품으로 평가받고 있기도 하다.",4632,BOOK
내 이름은 김삼순,지수현 (지은이),51125,국내도서>소설/시/희곡>로맨스소설>한국 로맨스소설,9788957512074,나이 서른 먹은 여자는 연애하기가 원자폭탄 맞는 것보다 어렵다고 어제 본 독일 영화의 여주인공이 그러더군. 웃기지 마! 나이 서른이 넘고 몸무게가 60Kg이 넘는 여자는 여자도 아니란 말이야? 인정 못해! 승복할 수 없어! 난 기필코 근사한 늑대 한 마리를 분양받아서 나의 운명의 그이와 잘 먹고 잘살 거야!,,2317,BOOK
코믹 메이플 스토리 오프라인 RPG 10,"송도수 (지은이), 서정은 (그림)",49995,국내도서>어린이>TV/만화/영화>만화 일반,9788953297425,,"인기 온라인 게임 메이플스토리를 만화화한 시리즈 , 제10권. 주카의 아빠 와일드 카코 킹은 주카의 엄마가 메이플 아일랜드에서 죽임 당한 것을 알고 분노를 폭발한다. 하지만 주카의 충격적인 선언으로 도도 일행은 가까스로 목숨을 구하게 되고, 모험을 떠나기 전 주카는 아빠로부터 위기에 처했을 때 대처하는 방법을 듣게 된다. 그러나, 막상 위기의 상황에 닥치자 주카는 눈물만 흘릴 뿐인데…. 이 세상을 구할 위대한 전사 메이플 전사의 이야기를 담은 만화책.",2095,BOOK
아이 안에 숨어 있는 두뇌의 힘을 키워라,이승헌 (지은이),7257,국내도서>좋은부모>교육/학습>창의 교육,9788956990286,'평범한 뇌'를 '비범한 뇌'로 만드는 자녀교육의 7가지 원칙. 지은이의 체험을 바탕으로 부모와 아이에게 두뇌의 힘을 키울 수 있는 7가지 원칙을 제시하며 구체적인 두뇌 개발법으로 집중력 트레이닝인 HSP뇌호흡을 소개한다.,"'평범한 뇌'를 '비범한 뇌'로 만드는 자녀교육의 7가지 원칙. 지은이의 체험을 바탕으로 부모와 아이에게 두뇌의 힘을 키울 수 있는 7가지 원칙을 제시하며 구체적인 두뇌 개발법으로 집중력 트레이닝인 HSP뇌호흡을 소개한다. HSP는 한국뇌과학연구원에서 이십 년간 뇌 생리학, 뇌 심리학, 뇌 기반교육을 토대로 연구.개발한 프로그램.



97년부터 각급 학교에 보급되기 시작한 뇌호흡은 아이들의 두뇌 스피드를 존중하는 뇌 기반 교육의 하나로 미국, 유럽, 일본 등에서 현 교육의 대안으로 떠오르고 있다. 책은 뇌를 개발하기 위한 목적과 방향에 대한 중요성을 강조하며, 현장에서 적용한 성과들을 토대로 했다. 아이와 정서적으로 일체감을 느끼며 뇌를 개발할 수 있는 다양한 방법들이 소개된다.",6095,BOOK
디지털 포트리스 1,"댄 브라운 (지은이), 이창식 (옮긴이)",51062,국내도서>소설/시/희곡>추리/미스터리소설>영미 추리/미스터리소설,9788957591239,"<다 빈치 코드>, <천사와 악마>의 작가 댄 브라운의 데뷔작. 치밀한 복선과 구성, 긴박하게 전개되는 이야기와 반전이 눈에 띈다. 소설은 스페인의 세비야에서 불구의 한 남자가 심장마비로 갑자기 죽음을 맞는 장면으로 시작한다.",,2834,BOOK
카스테라,박민규 (지은이),50993,국내도서>소설/시/희곡>한국소설>2000년대 이후 한국소설,9788982819926,"2003년 여름, 단 두 권의 소설(<지구영웅전설>, <삼미 슈퍼스타즈의 마지막 팬클럽>)로 한국 소설계에 새로운 바람을 몰고 온 소설가 박민규가 등단 2년 만에 첫 작품집 <카스테라>를 펴냈다. 2003년 여름부터 2005년 봄까지 여러 문예지에 발표한 단편 10편이 수록된 책으로, 작가 특유의 유쾌하고 독특한 글쓰기가 돋보인다.","2003년 여름, 단 두 권의 소설(, )로 한국 소설계에 새로운 바람을 몰고 온 소설가 박민규가 등단 2년 만에 첫 작품집 를 펴냈다. 2003년 여름부터 2005년 봄까지 여러 문예지에 발표한 단편 10편이 수록된 책으로, 작가 특유의 유쾌하고 독특한 글쓰기가 돋보인다.



(연합뉴스와의 인터뷰에 의하면, ""7년 간 길렀던 긴 머리를 잘라 노랗게 염색한 데다 히피들이 즐겨썼던 독특한 선글라스를 끼고 나타난 그는 '어릴 때부터 좋아했던 지미 핸드릭스의 타입으로 (머리모양 등을) 해봤다'면서 '그동안 써놓은 30편의 단편 가운데 10편을 추려 이번 작품집에 실었다. 10편을 수록한 것은 추앙하는 지미 핸드릭스의 데뷔앨범에도 10곡이 실렸기 때문'""이라고 설명했다 한다.)



자유분방한 상상력으로 빚어낸 특이한 상황과 인물 설정, 감각적이고 신선한 문체 등 자신만의 스타일을 발전시키고 있는 작가 박민규의 모습을 엿볼 수 있다. 전생에 훌리건이 아니었을까 싶을 만큼 시끄러운 냉장고와 동거하는 자취생('카스테라'), 링고 스타와 함께 버스를 타고 떠나는 우주여행('몰라 몰라, 개복치라니'), 집안이 어려워 돈을 벌기 위해 지하철의 '푸시맨'이 된 고등학생('그렇습니까? 기린입니다') 등, 제목과 설정 하나하나가 독특하고 톡톡 튄다.



밑바닥 삶에 대한 애정과 자본주의에 대한 비판, 지구 밖으로 뻗어가는 파격적 상상력, 이를 아우르는 스타일리시한 문체와 유머 등, 박민규라는 작가의 개성을 마음껏 만끽할 수 있는 단편집이다.",10411,BOOK
해커스 토익 Reading (온라인 무료 동영상 강의 제공) (Hackers TOEIC Reading) - 해설서 포함,David Cho (지은이),49854,국내도서>외국어>토익>Reading,9788990700124,"한 권으로 문법, 어휘, 독해를 기본부터 실전까지 끝낼 수 있도록 구성된 해커스의 토익 Reading 교재이다. 학습자의 요구를 수렴해 최신경향의 문제를 풍부하게 담고 있어 토익에 대한 자신감을 높일 수 있다.",,7532,BOOK
사랑하라 한번도 상처받지 않은 것처럼,류시화 (엮은이),51168,국내도서>소설/시/희곡>시>외국시,9788995501474,"류시화 시인이 잠언 시집 <지금 알고 있는 걸 그때도 알았더라면> 이후 '치유와 깨달음'이라는 주제 하에 8년 동안 모은 시를 책으로 펴냈다. 메리 올리버, 비슬라바 쉼보르스카, 옥타비오 빠스, 잘랄루딘 루미, 오마르 카이얌, 이누이트 족 인디언들, 티베트의 현자 등이 쓴 시 77편이 실려있다.","‘치유의 시’를 주제로 한 한 권의 시집!

《그대가 곁에 있어도 나는 그대가 그립다》 《외눈박이 물고기의 사랑》의 저자이며 잠언 시집 《지금 알고 있는 걸 그때도 알았더라면》을 소개해 ‘엮은 시집’이라는 새로운 지평을 연 류시화 시인이 이번에는 힐링 포엠을 주제로 한 권의 시집을 엮어 출간했다.  

시집 『사랑하라 한번도 상처받지 않은 것처럼』은 고대 이집트 파피루스 서기관에서부터 노벨 문학상 수상자에 이르기까지 41세기에 걸쳐 시대를 넘나드는 유명, 무명 시인들의 시를 수록한 책이다.  잠언 시집 《지금 알고 있는 걸 그때도 알았더라면》 이후 8년에 걸쳐 모은 이 시들은 치유와 깨달음이 그 주제다. 

메리 올리버, 비슬라바 쉼보르스카, 장 루슬로, 옥타비오 빠스, 이시카와 다쿠보쿠 등 현대를 대표하는 시인들, 잘랄루딘 루미, 까비르, 오마르 카이얌 등의 아랍과 인도의 중세 시인들, 그리고 이누이트 족 인디언들, 일본의 나막신 직공, 티베트의 현자 등의 시 77편이 실려 있다.",40428,BOOK
살아 있는 동안 꼭 해야 할 49가지,"탄줘잉 (엮은이), 김명은 (옮긴이)",70211,국내도서>자기계발>행복론,9788989313496,"'일기와 자서전 쓰기, 날마다 15분씩 책 읽기, 악기 하나 배워보기, 어려운 사람들을 위해 기부하기...' 우리가 살아 있는 동안 지금 바로 실행에 옮겨야 할 49가지를 감동적인 이야기와 그림으로 담아낸 따뜻한 에세이집이다.",,24579,BOOK
연금술사,"파울로 코엘료 (지은이), 최정수 (옮긴이)",50920,국내도서>소설/시/희곡>스페인/중남미소설,9788982814471,"세상을 두루두루 여행하기 위해 양치기가 된 청년 산티아고의 '자아의 신화' 찾기 여행담. 자칫 딱딱하게 보일 수 있는 제목과는 달리 간결하고 경쾌한 언어들로 쓰여 있어서, 물이 흘러가듯 수월하게 읽히는 작품이다.","삶에 대한 깊은 통찰을 담은 현대의 고전!

1987년 출간이후 전세계 120여 개국에서 변역되어 2,000만 부가 넘는 판매량을 기록한 파울로 코엘료의 『연금술사』. 청년 산티아고가 만물에 깃들인 영혼의 언어들을 하나하나 배워가는 과정을 그리고 있다. 마음의 목소리에 귀를 기울이는 것이 얼마나 중요한지를 증언하고, 진정 자기 자신의 꿈과 대면하고자 하는 모든 이들을 축복하는 희망과 환희의 메시지를 담은 작품이다. 

신부가 되기 위해 라틴어, 스페인어, 신학을 공부한 산티아고는 어느 날 부모님의 기대를 저버리고 떠돌아다니기 위해 양치기가 되어 길을 떠난다. 그의 인생을 살맛나게 해주는 건 ‘꿈이 실현되리라고 믿는 것’. 언제나 자신이 원하는 게 무엇인지 알고 있어야 한다는 늙은 왕의 말과 그가 건네준 두 개의 보석을 표지로 삼아 기약없는 여정에 뛰어든 그는 집시여인, 늙은 왕, 도둑, 화학자, 낙타몰이꾼, 아름다운 연인 파티마, 절대적인 사막의 침묵과 죽음의 위협 그리고 마침내 연금술사를 만나 자신의 보물을 찾게 되는데…….",82666,BOOK
우리들의 행복한 시간,공지영 (지은이),50993,국내도서>소설/시/희곡>한국소설>2000년대 이후 한국소설,9788971844298,"<봉순이 언니> 이후 7년, 공지영의 신작 장편소설이 출간됐다. 작가는 이 소설을 쓰는 내내 이런 생각을 했다고 한다. ""'생명'이란 살아 있으라는 명령""이며, ""때론 살아서 이 생을 견디는 것이 죽음보다 괴로울 수도 있겠지만, 어떠한 목숨이라도 분명 유지할 가치는 충분하다.""",,30113,BOOK
디지털 포트리스 2,"댄 브라운 (지은이), 이창식 (옮긴이)",51062,국내도서>소설/시/희곡>추리/미스터리소설>영미 추리/미스터리소설,9788957591246,소설은 스페인의 세비야에서 불구의 한 남자가 심장마비로 갑자기 죽음을 맞는 장면으로 시작한다. 그는 컴퓨터 프로그래밍의 천재로 IBM을 거쳐 미국 국가안보국(NSA)에 특채되어 NSA의 암호해독 컴퓨터 트랜슬터(TRANSLTR) 개발에 참여한 프로그래머 엔세이 탄카도. 그는 개인의 이메일까지 감시하는 NSA의 태도에 분노를 느껴 이를 알리려다 파면당한 인물이다.,,2804,BOOK
"과자, 내 아이를 해치는 달콤한 유혹",안병수 (지은이),51789,국내도서>좋은부모>건강/환경,9788974253998,"생활습관병을 부르는 가공식품의 실체를 밝힌다. 영양가는 없으면서 적은 양으로도 공복감이 해소되는 식품인 정크푸드가 하나같이 당 지수가 높으면서 각종 첨가물이 무차별 사용된 식품이라는 점을 비롯해, 설탕을 마약으로 치부하는 충격적인 내용들이 고스란히 담겨 있다.","정제당과 나쁜 지방, 식품첨가물이 첨가되어 생활습관병을 부르는 가공식품에 대해 파헤치고 있는 책. 영양가는 없으면서 적은 양으로도 공복감이 해소되는 식품인 정크푸드가 하나같이 당 지수가 높으면서 각종 첨가물이 무차별 사용된 식품이라는 점을 비롯해, 설탕을 마약으로 치부하는 충격적인 내용들이 고스란히 담겨 있다. 

특히, ‘제1장-위대한 파괴자들’에서는 우리가 흔히 먹는 초코파이를 비롯하여, 아이스크림, 각종 햄과 소시지, 껌, 청량음료 등에 대한 해부와 함께, ‘아메리칸 사료’라고 표현한 패스트푸드의 위험성을 방대한 자료와 연구 결과를 바탕으로 논리적으로 설명해준다.",16735,BOOK
"2,000원으로 밥상차리기",김용환 (지은이),53472,국내도서>요리/살림>생활요리,9788931426243,"2000원으로 간단 밥상 차리기, 3000원으로 유명 맛집 흉내내기, 시간 날 때 만드는 밑반찬, 독신남의 요리 노트 등 적은 비용으로 간단하고 스피디하게 차릴 수 있는 메뉴를 소개한다.",-,28490,BOOK
마법천자문 8 - 타올라라! 불꽃 염炎,"스튜디오 시리얼 (지은이), 김창환 (감수)",48941,국내도서>어린이>어린이 한자>학습만화,9788950936075,손오공을 대신해 마귀 마(魔) 마법에 걸린 삼장을 위해 오공 일행은 세상에 흩어져 있는 마법천자패를 모으기 위한 모험을 떠난다. 이번 권에서는 꾀 많은 토생원이 외치는 불꽃 염(炎)을 불러오는 불꽃 바람을 만난다.,"손오공의 한자 대탐험『마법천자문』제8권 . 스스로 시리즈를 반복해서 읽음으로써 한자를 저절로 익힐 수 있도록 안내한다. 한자카드로 게임을 하면서 한자의 모양과 뜻, 소리를 익힐 수 있고, 과 으로 본권에서 배운 한자를 공부할 수 있다. 단계별 연습 문제로 한자 학습을 완성할 수 있으며, 책에서 배운 한자를 일상생활에서 자연스럽게 사용할 수 있다.",21229,BOOK
"한국전쟁 - 끝나지 않은 전쟁, 끝나야 할 전쟁",박태균 (지은이),1753,국내도서>역사>한국근현대사>해방전후사/한국전쟁,9788991221109,"책은 지은이가 수년간 한국전쟁을 주제로 강의하면서 전후 세대 학생들과 피드백을 나누며 '지금 우리에게 한국전쟁이란 과연 어떤 의미인가'에 대해 고민해온 노력의 결실이다. 한국 사람들에게 이 전쟁이 무엇이며, 우리 역사상 얼마나 중요한 사건이었는지, 그리고 그 현재적 의미는 무엇인지를 전체적으로 살펴본다.","한국전쟁은 세계사를 다시 쓸 정도로 역사적으로 중요한 전쟁이었고 한국인이라면 누구나 꼭 알아야만 하는 사건임에도 불구하고, 지금까지 한국 현대사 전공자가 이 전쟁에 대해 일반인들도 쉽게 접근 가능하도록 서술한 책은 없었다. 브루스 커밍스의 , 김동춘의  등이 널리 읽혔지만 두 책 모두 한국전쟁을 A부터 Z까지 전체적으로 정리해주는 것은 아니었다.



이 책은 한국 현대사 전공자가 일반인을 위해 정리한 최초의 한국전쟁 관련서라는 점에서 의의를 갖는다. 서울대 국제대학원의 박태균 교수가 수년간 한국전쟁을 주제로 강의하면서 전후 세대 학생들과 피드백을 나누며 '지금 우리에게 한국전쟁이란 과연 어떤 의미인가'에 대해 고민해온 노력의 결실이다.



책은 이 전쟁을 6.25가 아닌 '한국전쟁'으로 불러야 하는 이유를 설명하는 것으로 시작해, 전쟁의 기원부터 분단까지 순차적으로 짚어나간다. 한국전쟁에 대해 이제까지 권력이 이야기해온 이데올로기와 편견을 걷어내고 사실적으로 바라보고자한 시각이 돋보인다.



한국 사람들에게 이 전쟁이 무엇이며, 우리 역사상 얼마나 중요한 사건이었는지, 그리고 그 현재적 의미는 무엇인지를 전체적으로 살펴보게 하는 책이다. 일반인들이 말로만 듣고 실체는 보지 못했던 '정전협정'문을 비롯한 총 68개의 사료들과 60여 컷에 이르는 전쟁 당시의 사진, 각종 지도 및 꼼꼼하게 정리된 전쟁일지 등이 이해를 돕는다.



* 책에서 다루고 잇는 주요 쟁점은 다음과 같다.

북침인가? 남침인가?

하필 왜 1950년 6월 25일에 전쟁이 시작되었는가?

북한군이 서울에서 3일을 머문 이유는?

인천상륙작전, 성공인가 실패인가?

인해전술은 정말 존재했는가?

미국이 두 번이나 이승만 제거 계획을 세운 이유는?

전쟁은 왜 2년이나 더 계속되었는가?

남한에 핵무기가 배치되었다?

미국의 세균전 감행은 진실인가?

북한 정권이 무너진다면 휴전선 이북 지역의 통제권은 남한에 있다?",4035,BOOK
모모,"미하엘 엔데 (지은이), 한미희 (옮긴이)",48875,국내도서>어린이>동화/명작/고전>세계명작,9788949190020,"사람들에게서 행복과 풍요로움을 주는 시간을 빼앗아간 회색 신사들과 여자 아이 모모, 호라 박사 등이 벌이는 모험을 다룬 소설. 꿈 속에서 벌어질 법한 갖은 이야기들이 줄줄이 펼쳐진다.","시간은 삶이며, 삶은 우리 마음 속에 있다!

시간 도둑들과 도둑맞은 시간을 인간에게 찾아주는 어린 소녀 모모에 대한 이상하고도 흥미진진한 이야기. 독일의 문학작가, 미하엘 엔데의 작품으로, 현실과 꿈이 시처럼 어우러진 환상의 세계를 그려내고 있다. 

이탈리아의 어느 한 도시, 회색 사나이들이 지배하는 이 도시에 어디에서 왔는지 알 수 없는 '모모'라는 이상한 아이가 나타난다. 모모는 다른 사람의 이야기를 잠자코 들어줌으로써 인간에게 주어지는 시간의 풍요와 아름다움을 깨닫게 하는데…. 이 책을 통해 작가는 바쁘기 짝이 없고, 마음 놓고 쉴 수조차 없는 현대인들에게 '시간은 삶이고, 삶은 우리 마음속에 깃들어 있다'는 메시지를 전해준다.",75672,BOOK
왜 나는 너를 사랑하는가 (반양장),"알랭 드 보통 (지은이), 정영목 (옮긴이)",50919,국내도서>소설/시/희곡>영미소설,9788986836080,"이 책은 자기 스스로는 특별하다고 생각하지만, 실제로는 남들과 전혀 다르지 않은 '사랑'의 과정에 대한 이야기이다. <드 보통의 삶의 철학산책> 등을 통해 철학의 대중화를 위해 애써온 지은이는, '사랑'이라는 감정을 분석적이고 철학적인 시선으로 응시한다.",,11972,BOOK
다 빈치 코드 2,"댄 브라운 (지은이), 양선아 (옮긴이)",51062,국내도서>소설/시/희곡>추리/미스터리소설>영미 추리/미스터리소설,9788957590522,"예기치 않게 거대한 사건에 휘말리게 된 랭던과 소피는 레오나르도 다 빈치의 그림에 담긴 단서들을 추적하며, 2천년 동안 숨겨져왔던 비밀을 파헤치게 되는데...",,25787,BOOK
해커스 토익 Listening (테이프 별매) (Hackers TOEIC Listening),David Cho (지은이),49855,국내도서>외국어>토익>Listening,9788990700148,"해커스 토익 리스닝의 가장 큰 특징을 꼽자면, 독학학습자들에게 다소 어렵게 느껴지는 리스닝 학습에 대해 구체적인 전략을 제시해준다는 점이다. 이 책은 토익 출제 경향을 철저하게 비교, 분석하여 이를 토대로 내용을 구성했으며, 실전 대비에 가장 중요한 기출 유형의 문제에 익숙해지도록 2회분의 실전문제 연습페이지를 충분히 두었다.",,4805,BOOK
