title,author,genre_id,genre,ISBN,description_aladin,description_naver,salesPoint,mallType
달만큼 큰 미소,"마이클 커제스 (지은이), 조혜진 (옮긴이)",51373,국내도서>에세이>외국에세이,9788970650678,"미국 고등학교 최고 영재들만 참가하는 NASA 주최 과학경시대회, '스페이스 캠프'에 도전한 학습장애아들의 이야기. 인간애로 무장한 한 교사의 교육 수기이자, 세상의 주변부에 방치된 채 소외를 강요당했던 학습장애들이 그들 스스로의 힘으로 일어서는 과정을 보여주는 실화이다.",,1302,BOOK
시골의사의 아름다운 동행 - 전2권 세트,박경철 (지은이),52906,국내도서>에세이>명사에세이>기타 명사에세이,9788901051642,한 시골 외과의사가 병원이라는 풍경을 통해 바라본 인생이야기. 경북 안동에서 병원을 운영하고 있는 지은이가 각양각색의 인생에서 건져올린 희망의 메시지를 들려준다. 시골의사의 눈을 통해 바라본 우리네 삶의 단면들을 진솔하게 그려냈다.,,4524,BOOK
노부영 Go Away Big Green Monster! (Hardcover + CD 1) - 노래부르는 영어동화,에드 엠벌리 (지은이),106336,외국도서>어린이>그림책>시리즈별>노부영,8809448440612,"얼굴이 초록색인 커다란 괴물이 스스륵 나타났다 스르륵 없어지는 그림책. 무섭게 생긴 괴물이지만, '저리 가!'하고 주문을 외우면 오라고 말할 때까지 다시 돌아오지 않는다. 검정색 바탕에 선명한 원색의 노란 색 눈, 녹색 빛의 코, 빨간 입 등이 나타나면서 아이들의 호기심을 자극한다.",,7922,FOREIGN
교양 있는 우리 아이를 위한 세계역사 이야기 5 - 현대편 - 하,"수잔 와이즈 바우어 (지은이), 정병수 (그림), 보라 (옮긴이)",48905,국내도서>어린이>사회/역사/철학>세계사,9788931380255,"시리즈를 마감하는 마지막5권. 극적인 사건이 연속적으로 일어난 현대의 이야기를 재미있게 들려준다. 대공황, 제2차 세계대전과 그 종결, 인도의 분할 독립, 중화인민공화국 탄생 등의 이야기를 수록했다.","《교양 있는 우리 아이를 위한 세계 역사 이야기》시리즈의 마지막 편인 의 하권입니다. 세계 각 대륙에서 있었던 식민지 강대국의 억압에서 벗어나기 위한 투쟁, 세계 대전의 후유증으로 싹터서 다시 세계 대전을 일으키는 나치즘과 파시즘, 공산주의와 자본주의의 차가운 대립, 인종 차별과 이에 대한 투쟁, 암살과 테러 등 현대 역사의 중요한 사건들을 정의(正義), 자유, 평등, 독립, 자주 등의 잣대로써 그 흐름과 의미를 재어 들려주고 있습니다. 

 은 20세기인 1994년(만델라의 남아프리카 대통령 당선까지)?..",3965,BOOK
꼭 읽어야 할 한국단편 35선,현진건 (지은이),7268,국내도서>청소년>청소년 고전,9788985431057,,,1485,BOOK
그리기로 배우는 초등1학년 교과서 - 국어.바른생활.슬기로운 생활 편,초등교과서연구모임 (지은이),51815,국내도서>어린이>초등 전학년>학습일반,9788989548423,만 3세에서 7세까지 유아들의 초등학교 입학을 그리기와 함께 미리 준비하는 놀이학습서. 귀로 듣거나 눈으로 보는 수동적 상태를 벗어나 직접 그림을 그려가며 교과서 내용을 익힐 수 있게 했다.,,942,BOOK
부루퉁한 스핑키,"윌리엄 스타이그 (지은이), 조은수 (옮긴이)",35135,국내도서>유아>그림책>나라별 그림책>미국,9788949110042,"아이들의 심리가 잘 드러나 있으며, 부루퉁한 스핑키를 풀어주려는 가족들의 노력과 사랑이 담겨 있는 그림책이다. 특히 스핑키의 표정과 행동이 재미있게 그려져 있고 화해의 장면도 인상적이다. - 아이북랜드",외톨이라는 느낌을 가진 막내 스핑키가 식구들 모두에게 화가나 말을 않자 식구들이 다 스핑키의 비위를 맞추고자 노력한다. 결구 스핑키는 화를 풀지만 쑥스러 워 어쩔 줄 모른다. 아이의 심정을 익살스럽게 표현한동화.,5765,BOOK
고슴도치 아이,"카타지나 코토프스카 (지은이), 최성은 (옮긴이)",48877,국내도서>어린이>동화/명작/고전>외국창작동화,9788943305765,한 부부가 고슴도치 아이를 입양하고 사랑을 나누어주는 과정을 그려낸 그림 동화. 사랑의 힘으로 상처입고 가시돋힌 아이의 마음을 열게 하는 애틋한 과정이 담겼다.,,2018,BOOK
아무도 내 이름을 안 불러 줘,"한국글쓰기연구회 (지은이), 한국글쓰기연구회 (엮은이)",48865,국내도서>어린이>초등 전학년>어린이가 쓴 책,9788985494892,물질의 풍요와 넘치는 정보로 이제 아이들도 아이들다운 것들을 잃어버렸다고 하지만 여전히 아이들은 소박하고 가장 믿을 수 있는 우리의 미래일 수밖에 없다. 호미를 들던 아이들이 이제는 롤러 블레이드나 자전거를 타고 등장을 한다. 하지만 아이들 스스로 기쁘고 슬프고 짜증나는 하루하루를 붙잡아 쓴 글을 읽노라면 생전 알지 못했 ...,"초등 1~2학년 아이들이 쓴 글모음. 더러 농촌지역 아이들의 글도 섞였지만 주로 90년 이후 도시 아이들이 쓴 글을 추렸다. “자다가 엄마 젖꼭지를 만졌는데 누구 손이 있었다. 그래서 내가 `도둑이야.` 아빠도 `도둑이야.` 엄마가 웃으며 `둘 다 도둑이야.` 그러니까 할머니가 `도둑이 어디, 어디있어.`” 아이들이 일상 속에서 겪은 일을 꾸밈없이 표현한 까닭에 웃음과 감동을 준다.

물질의 풍요와 넘치는 정보로 이제 아이들도 아이들다운 것들을 잃어버렸다고 하지만 여전히 아이들은 소박하고 가장 믿을 수 있는 우리의 미래일 수밖에 없다. 호미를 들던 아이들이 이제는 롤러 블레이드나 자전거를 타고 등장을 한다. 하지만 아이들 스스로 기쁘고 슬프고 짜증나는 하루하루를 붙잡아 쓴 글을 읽노라면 생전 알지 못했던 아이들의 온갖 모습이 보인다.



억지로 쓴 글이 아니라 즐거워서 하고 싶은 얘기가 많아서 쓴 글들이라 재미있다. 글을 쓴 아이들이 1,2학년 아이들이라 자의식 없이 솔직하게 털어놓아 저절로 웃음이 나온다. 아스팔트 틈에 낀 10원 짜리 동전에 눈이 동그래지기도 하고 일을 못해 집에서 담배만 피우고 있는 아버지를 걱정하기도 하고 돌아가신 부모님을 걱정하기도 한다.



무릇 좋은 글이란 사람이 보여야 한다고 한다. 글을 쓴 사람의 이름을 지우고 읽어도 누구의 글인지 알 수 있는 글, 글을 쓴 사람의 삶과 마음이 환하게 보이는 글을 우리는 좋은 글이라고 한다. 책 속에 아이들의 얼굴이 환하게 떠오른다.",5464,BOOK
가장 행복한 공부 - 청화스님 말씀,청화스님 (지은이),51637,국내도서>종교/역학>불교>불교 문학,9788952731326,"24세에 출가, 득도한 이후 사십여 년을 하루에 한끼만 먹고 낮이나 밤이나 등을 바닥에 대지 않고 앉아서 정진하는 장좌불와(長坐不臥)의 수행을 하다 2003년 11월 입적하신 청화스님의 말씀을 모은 책.",,1103,BOOK
시골의사의 아름다운 동행 2,박경철 (지은이),52906,국내도서>에세이>명사에세이>기타 명사에세이,9788901051635,"<시골의사의 아름다운 동행>의 두 번째 이야기로, 전편에 이어 이웃들의 따뜻한 사랑을 전한다. 1권이 병원에서 일어난 일들이 주로 다루었다면, 2권은 친구들과 선후배 등 지은이가 의사라는 삶을 선택하면서 알게 된 소중한 인연들에 대한 이야기를 들려준다.",,4409,BOOK
전태일 평전 - 개정판,조영래 (지은이),65238,국내도서>사회과학>사회운동>사회운동가/혁명가,9788971991343,불꽃 같은 삶을 살다간 노동자 전태일의 일대기. 변호사 조영래가 썼다. 이 책을 보고 노동운동이나 학생운동에 뛰어들었던 젊은이들이 부지기수였을 정도로 '의식화'의 제1 교재였다. 이제는 세월이 많이 흘렀으나 여전히 글은 심금을 울리고 참으로 인간적인 세상을 꿈꿨던 전태일의 순수한 마음이 가슴을 친다.,,6077,BOOK
생각하는 힘을 키워주는 역사논술 - 아이 워크북 시리즈  1,정성현 (지은이),1140,국내도서>청소년>청소년 역사,9788989968054,"역사를 소재로 한 다양한 글쓰기를 통해 논리적이고 창의적인 글쓰기를 배우고, 지금까지 알고 있던 역사를 새롭게 생각해 볼 수 있는 논술 워크북. 낱낱이 흩어진 역사적 사실을 체계적으로 파악하여, 주체적으로 이해하며, 자신의 생각을 글로 옮길 수 있도록 도와준다.",,2386,BOOK
국가공인 한자 자격시험 3급 - 교과서 낱말 뜻 공부를 겸한,국제 어문능력 개발원 (지은이),48489,국내도서>수험서/자격증>한자시험>한자능력검정시험,9788995542361,"(사)한자교육진흥회가 시행하는 한자자격시험 3급을 대비한 수험교재이다. 한자평가원의 3급 한자 1800자를 주제별로 배치하였으며 선정한자 익히기, 교과서 한자어 자세히 알기, 꼭 알아야할 고사성어, 한자성어, 단원 마무리 연습문제로 구성되어있다.","(사)한자교육진흥회가 시행하는 한자자격시험 3급을 대비한 수험교재이다. 한자평가원의 3급 한자 1800자를 주제별로 배치하였으며 선정한자 익히기, 교과서 한자어 자세히 알기, 꼭 알아야할 고사성어, 한자성어, 단원 마무리 연습문제로 구성되어있다.",5747,BOOK
너는 누구니?,"키스 포크너 (지은이), 박현영 (옮긴이)",35096,국내도서>유아>0~3세>그림책,9788980710744,"느림보 애벌레, 못난이 아기 새, 부끄럼장이 아기 동물, 헤엄둥이 올챙이 모두 어른이 되면 하늘을 훨훨 날아다니는 나비로, 눈부시게 아름다운 백조로, 껑충껑충 뛰어다니는 캥거루로, 폴짝폴짝 뛰어다니는 개구리로 멋지게 변신한다.","유아를 위한 그림 동화책. 작은 올챙이, 못생긴 아기새, 느림보 애벌레가 어른이 되면 무엇이 될까요? 입체 그림책 속에 자연의 신비스러움을 담았다. 평범하고 조그만 아기 동물들의 변신을 재미있게 엮었다.",9404,BOOK
고우영 십팔사략 세트 - 전10권,고우영 (지은이),4670,국내도서>만화>교양만화>역사만화,9788989749899,"일반인들의 사랑을 많이 받았던 '십팔사략'에 고우영 특유의 해학과 유머를 보태어 이해하기 쉽게 꾸린 만화이다. 사마천의 '사기'를 필두로 중국 각 시대의 정사로 꼽히는 18가지의 역사서를 간추려 편집해, 일반인들이 중국역사를 이해하기에 좋다.",,4172,BOOK
칠칠단의 비밀 - 방정환의 탐정소설,"방정환 (지은이), 김병하 (그림)",48874,국내도서>어린이>동화/명작/고전>국내창작동화,9788971967652,소파 방정환 선생이 쓴 탐정소설. 방정환 탄생 100돌을 맞아 출간한 이 책은 중편 「동생을 찾으러」와 장편「칠칠단의 비밀」로 구성되었다. 두 편 모두 납치 당한 여동생을 찾아 나선 오빠가 일본인의 음모에 맞서 싸우는 과정을 흥미진진하게 그렸다.,소파 방정환 선생이 쓴 탐정소설 [칠칠단의 비밀]. 방정환 탄생 100돌을 맞아 출간한 이 책은 중편 「동생을 찾으러」와 장편「칠칠단의 비밀」로 구성되었다. 두 편 모두 납치 당한 여동생을 찾아 나선 오빠가 일본인의 음모에 맞서 싸우는 과정을 흥미진진하게 그렸다.,5962,BOOK
2006 정보처리기사 필기 특별대비 - 지존 2006,고건 (지은이),35786,국내도서>수험서/자격증>컴퓨터 활용능력>정보처리>정보처리기사,9788931432763,"최신 출제 경향을 반영한 2006년판 정보처리기사 필기 대비 수험서. 수년간의 정보처리기사 기출문제들을 총 망라하여 출제기준으로 제시된 각 분야별로 분류한 후 그에 맞춘 핵심 이론들을 서술했고, 최근의 출제 경향을 파악할 수 있도록 최신 기출문제를 제공한다.",,399,BOOK
"야, 우리 기차에서 내려!","존 버닝햄 (지은이), 박상희 (옮긴이)",35137,국내도서>유아>그림책>나라별 그림책>유럽,9788949110080,"기차놀이를 좋아하는 아이는 꿈 속에서 장난감 강아지와 함께 기차를 타고 여행을 떠난다. 안개 속에서 유령놀이를 하고 오니까 코끼리가 기차에 타고 있다. `야,우리 기차에서 내려!`하고 말하지만 `사람들 때문에 살아남지 못할 거야` 하는 말에 태워준다. 브라질의 환경운동가 치코멘데스를 기려 만든 그림책이다.","기차놀이와 동물 인형을 좋아하는 남자 아이를 통해 환경문제를 제기한 책이다. 날씨와 계절이 바뀔때마다 생존을 위협당하는 동물들이 나타난다. 그 때마다 남자 아이는 ""야, 우리 기차에서 내려!""하고 말하는데, 동물들은 ""제발, 나도 기차에 태워 줘!""하고 부탁한다. 그러면서 세계 곳곳에서 벌어지고 있는 인간의 자연 파괴 상황을 고발한다.",13491,BOOK
그런데 임금님이 꿈쩍도 안 해요! - 1986년 칼데콧 아너상 수상작,"오드리 우드 (글), 돈 우드 (그림), 조은수 (옮긴이)",35135,국내도서>유아>그림책>나라별 그림책>미국,9788943305109,"반복되는 형식 속의 리듬감 넘치는 문장, 동작과 표정이 과장된 유머러스한 그림, 화려한 색감과 섬세한 묘사, 귀엽기 짝이 없는 임금님과 등장인물들까지! 나무랄 곳 없는 그림책이다. 갖가지 놀이터로 변신하는 목욕탕의 모습은 상상력을 자극하는데다 이야깃 거리도 풍성하다.","오드리 우드가 쓰고 돈 우드가 그린 『그런데 임금님이 꿈쩍도 안해요』, 어느날 임금님이 목욕통 안에서는 꿈쩍도 하지 않아요. 기사가 나서서 전쟁터에 가자고 하면 목욕탕에서 전쟁을 하고, 왕비가 점심을 먹자고 하니 목욕탕에서 점심을 먹네요. 

신하들이 우르르 나서기도 했지만 임금님은 꿈쩍도 안해요. 어떻게 하면 임금님이 목욕통에서 나오게 할 수 있을까요?

★ <b>수상!</b> ★
칼데콧 상.",1703,BOOK
해리 포터와 아즈카반의 죄수 1 (무선),"J.K. 롤링 (지은이), 김혜원 (옮긴이)",51120,국내도서>소설/시/희곡>판타지/환상문학>외국판타지/환상소설,9788983920720,1999년 영국의 우수도서상을 수상한 작품. 고아소년 해리 포터가 친척집에 맡겨져 천대받다가 마법 학교에 입학하면서 마법사 세계의 영웅이 된다는 줄거리이다. 꼬마 마법사 해리포터와 아즈카반 죄수들과의 흥미있는 이야기가 펼쳐진다.,,16176,BOOK
이글루를 만들자,"울리 쉬텔처 (지은이), 곽성화 (옮긴이)",35108,국내도서>유아>그림책>교양/학습 그림책,9788949151298,"세계적인 다큐사진작가 울리 쉬텔처가 이누이트 족이 어떻게 이글루를 짓는지, 간결하고 알기 쉽게 설명해 준다. 눈덩이를 벽돌 모양으로 자르고, 칼날로 눈벽돌을 다듬어 둥그렇게 쌓아올리고, 마지막으로 출입구와 굴뚝과 창을 만드는 일련의 과정들이 눈앞에서 보는 것처럼 생생하게 펼쳐진다.","세계적인 다큐사진작가 울리 쉬텔처가 이누이트 족(에스키모 족)이 어떻게 이글루를 짓는지, 간결하고 알기 쉽게 설명해 준다. 세상의 변방을 찾아다니며 현지인들의 생활상을 생생하게 포착하는 데에 주력해 온 작가는, 이 책 한 권을 만들기 위해 2년여 동안 이누이트 족과 함께 생활했다고 한다.



그간의 땀방울이 고스란히 배어 있는 이 책 속에는 이글루를 짓는 과정을 찍은 흑백사진과 정갈하기 이를 데 없는 글이 함께 담겨 있다. 눈덩이를 벽돌 모양으로 자르고, 눈벽돌을 칼날로 다듬어 가면서 둥그렇게 쌓아올리고, 마지막으로 출입구와 굴뚝과 창을 만드는 일련의 과정들이 눈앞에서 보는 것처럼 생생하게 펼쳐진다.



이글루 안에서 촬영한 사진과 그에 딸린 글이 실려 있는 마지막 페이지는, 이 책이 이누이트 족의 신기한 생활습관을 그저 보여주는 데에 머무르지 않고 있다는 것을 증명한다. ""저녁입니다. 투킬키 아저씨와 조피는 이글루 안에 편하게 앉아서 얼어붙은 바다를 바라봅니다. 내일은 사냥을 나가는 날입니다.""



이누이트족의 이글루 역시 우리가 사는 집처럼 따뜻하고 평안한 생활의 터전이라는 사실을 나지막하게 일깨워주는 결말이다.",1784,BOOK
토익 900 뽀개기 Part 5.6 실전연습,강지완 (지은이),49858,국내도서>외국어>토익>실전,9788972558675,"'토익뽀개기'시리즈의 한 권으로, 문법파트인 Part 5,6을 다룬 실전문제집이다. 기본서인 <a href=""/catalog/book.asp?ISBN=8972558664""><토익 Part 5.6 뽀개기></a>에서 다루었던 개념들을 실전문제를 통해 보다 확고하게 자신의 것으로 소화할 수 있데 구성했다.",,969,BOOK
수레바퀴 아래서,"헤르만 헤세 (지은이), 김이섭 (옮긴이)",50922,국내도서>소설/시/희곡>독일소설,9788937460500,헤르만 헤세의 자전적 경험이 듬뿍 녹아들어간 성장소설. 신학교에서의 체험을 토대로 썼다. 소년 한스는 마을 사람들의 기대와 격려를 한 몸에 받으며 마울브론 신학교에 입학한다. 하지만 끊임없는 압박으로 다가오는 가족과 고루한 신학교의 종교적 엄숙주의 아래서 한스는 점점 마음이 병들어간다.,"고루하고 위선적인 권위에 맞서 싸우는 소년의 이야기!

노벨문학상을 수상한 헤르만 헤세의 자전소설 『수레바퀴 아래서』. 명예심과 규격화된 인물을 만들려는 교육제도에 의해 서서히 파괴되어 가는 한 인간의 모습을 신랄하게 보여준 작품이다. 슈바츠발트라는 작은 마을에 재능이 풍부한 한스 기벤라트와 헤세 자신의 모습이 담겨있는 하일러 두 소년의 이야기를 담고 있다. 저자는 상반된 성격의 두 인물을 통해 자신이 십대 시절 겪었던 내면의 갈등을 고스란히 보여준다.  ‘수레바퀴 아래서’라는 비유적 표현에서 우리는 한 개인의 내면과는 상관없이 강압적으로 돌아가는 물리적 세계의 톱니에 짓눌린 여린 영혼을 떠올릴 수 있다. 

민감하고 불안정한 소년 한스 기벤라트는 헤세의 분신이다. 한스가 엄격한 신학교의 규율을 이겨내지 못하고 신경쇠약에 걸려 학교에서 쫓겨난 것, 작은 고향 도시로 돌아와 공장의 견습공으로 새로운 삶을 열어 보려 한 것 등은 헤세의 우울한 청소년기와 겹치는 장면들이다. 다만 다른 점이 있다면 헤세가 세계와의 갈등을 극복하고 마침내 자아를 발견하여 자신의 고통스러운 체험을 예술로 승화한 반면 한스는 엄격하고 딱딱한 집안 분위기와 학교 교육 및 사회 전통과 권위에 눌려 파멸하고 만다는 것이다.",30168,BOOK
해커스 리딩 (Hackers Reading) - 토플ㆍIELTSㆍ편입ㆍ공무원ㆍ대학원,David Cho (지은이),49866,국내도서>외국어>토플>Reading,9788995151730,"현행 토플 시험에서 출제되는 모든 패턴을 분석 정리하여, 실전과 유사한 형태로 접근한 리딩 학습서이다. 문제 유형 뿐 아니라, 지문 선정에 있어서도, 최근 출제 경향을 꼼꼼하게 반영하였다.","토플 시험에서 출제되는 다양한 패턴을 분석 정리해, 실전과 가장 유사한 형태로 접근한 리딩 학습서. 문제 유형뿐 아니라, 지문 선정에 있어서도, 최근 출제 경향을 꼼꼼하게 반영하였다. 지문과 문제가 중급과 고급자 수준으로 맞춰졌지만, 철저한 전략 분석과, 단어, 해석 등의 보조자료를 실어 초보자도 쉽게 학습할 수 있도록 엮었다. 

www.gohackers.com를 통하여 다양한 연습문제를 제공할 뿐 아니라, 해커스토플 리딩 Q&A 게시판란을 마련하여 신속한 답변을 통해 여러분들의 학습을 돕고 건의사항을 수용할 수 있도록 하였다.",9655,BOOK
임신 출산 육아 백과,중앙M&B 편집부 (엮은이),51762,국내도서>좋은부모>임신/출산,9788990627902,"계획임신부터 출산일까지 안심하고 아이를 낳을 수 있도록 주단위로 구성된 총 40주 임신프로그램과 건강하게 몸매 회복을 할 수 있도록 안내하는 6주 산후 프로그램, 신생아부터 첫돌까지 육아 12개월 프로그램 등 총 3파트로 구성되어 있다.
","이 책은 임산부가 궁금해 하는 내용들을 임신 기간 40주로 나누어 주별 프로그램으로 소개했다. 각 주별 프로그램에서는 태아의 성장 발달과 임산부의 신체 변화를 알아보고, 임산부의 건강 관리를 위한 다양한 정보를 담았다. 
또 임신 초기와 중기, 후기에 전반적으로 알아야 할 추가 정보는 각 분기가 끝나는 부분에 궁금증 베스트 10으로 모아 자세히 소개했다.",4571,BOOK
밤하늘 별 이야기,"세키구치 슈운 (지은이), 김창원, 정혜선 (옮긴이)",48870,국내도서>어린이>과학/수학/컴퓨터>지구와 우주,9788972212423,"시골산으로 별을 보러 떠난 할아버지와 아이들이 밤하늘을 올려다보며 주고 받는 이야기를 담은 컬러만화. 점성학 연구가인 지은이가 페르세우스,헤라클레스,오리온 등 별자리 이야기들도 흥미진진하게 전개했다. -대한매일신문",별들을 보면서 천문학이 밝힌 우주의 구조를  머리속에 그려 보거나 신화에 얽힌 이야기들을 생각해 보는 것을 정말 즐거운 일이다. 이 책은 어린이들이 밤하늘 여행을 하는데 유익한 길잡이가 될 것이다.,5837,BOOK
고치고 더한 수필로 배우는 글읽기,최시한 (지은이),1142,국내도서>청소년>청소년 인문/사회,9788932012322,청소년들이 글읽기의 기본원리를 세우며 고급 사고력과 이해력을 기를 수 있도록 도와주는 독서교재.,"수필을 통해 읽기의 원리와 방법을 제시한 책. , ,  등 수필 자료들을 훈련 과정과 읽는 능력의 단계에 맞추어 뽑아 배열하고 읽기의 원리와 방법을 제시하면서 연습문제를 수록하여 배운 내용을 정리하고 스스로 평가할 수 있도록 구성했다.",1632,BOOK
옛날 사람들은 어떻게 공부했을까?,"햇살과나무꾼 (지은이), 한창수 (그림)",49223,국내도서>어린이>동화/명작/고전>학습동화,9788952978110,"머리를 묶어 천장에 매달고, 바늘로 무릎을 찔러 졸음을 쫓으며 열심히 공부한 최치원, 주위의 비웃음에도 아랑곳하지 않고 책을 한 자 한 자 베껴가며 공부한 안향 등 열심히 공부하여 그 이름을 남기게 된 위인들의 일화를 담았다.","손에 잡히는 옛 사람들의 지혜 2. 우리 조상들의 별난 공부 이야기를 담았습니다. 책벌레 세종 대왕의 어린 시절, 말썽꾸러기 이항복이 공부에 빠져들게 된 사연, 12세 나이로 중국으로 유학간 최치원의 고달픈 유학 생활과 책도 선생님도 없이 혼자 힘으로 화약을 연구한 최무선의 발명 이야기 등 공부에 얽힌 우리 조상들의 변난 이야기 15가지를 담았습니다.",1598,BOOK
국어시간에 소설읽기 2,성하성 (엮은이),1147,국내도서>청소년>논술참고도서,9788987402178,"우리의 이웃들은 어떻게 살고 있는지, 이 세상에는 얼마나 다양한 삶의 모습들이 존재하는지, 그 다양함 속에서 어떤 생각을 가지고 살아야 할 것인지 열한 편의 소설들에 걸쳐 이야기된다.",,8333,BOOK
회계원리 - 제8판,송상엽 (지은이),35976,국내도서>수험서/자격증>경제/금융/회계>공인회계사/세무사>세무사,9788995338957,2006년초까지 발표된 기업회계기준서와 기업회계기준 등에 관한 해석의 내용을 충실히 반영한 책이다. 각장마다 익힘문제와 연습문제 및 해답을 수록하여 독자 스스로 공부할 수 있다.,,2120,BOOK
