title,author,genre_id,genre,ISBN,description_aladin,description_naver,salesPoint,mallType
타라 덩컨 4 - 상 - 드래곤의 배반,"소피 오두인 마미코니안 (지은이), 이원희 (옮긴이)",51120,국내도서>소설/시/희곡>판타지/환상문학>외국판타지/환상소설,9788973819089,"아더월드 오무아 제국의 실험실에서 드래곤과 유전학자가 맞선다. 이 싸움의 결과에 지구의 미래와 어린 마법사들의 운명이 달려 있다. 그러나 학자가 사망하면서 사건은 미궁에 빠진다. 한편 아더월드를 몰래 빠져나온 타라는, 초능력이 있는 지구소년을 구하기 위해 영국 스톤헨지 유적지로 향하는데...","'치마 입은 해리포터'라는 수식어가 붙을 정도로 출간과 동시에 유럽 대륙을 새로운 마법 열풍으로 사로잡은 판타지 소설. 작가는 15년 간의 준비기간을 거쳐 하루가 스물 여섯 시간이고 일 년이 454일에 일곱 계절이 존재하는 '아더월드'라는 마법의 행성과 작가의 두딸의 성격을 합해서 만들어 낸 '타라 덩컨'이라는 캐릭터를 창조했다. 

마법의 세계 아더월드에서 모험을 경험한 타라 덩컨은 자신이 강력한 마법사라는 사실을 알게 된다. 흥미진진한 모험을 하고 지구로 돌아온 타라는 살인죄로 고소된 친구 칼을 돕기 위해 다시 아더월드로 돌아가는데…. 

아르메니아 왕위 계승자이기도 한 작가는 이번 작품에 개인적인 신분을 살려 궁정의 공식의례에 관해 상세히 묘사하고 있다. 톡톡 튀는 문장과 탄탄한 구성, 교묘한 복선이 돋보이는 작품으로, 2013년 전10권 완간예정이다. <4권 상>",1053,BOOK
"돌도끼에서 우리별 3호까지 - 아이세움 배움터 1, 우리 과학 이야기","전상운 (지은이), 이상규 (그림)",48867,국내도서>어린이>과학/수학/컴퓨터>과학 일반,9788937811180,"선사 시대에서부터 삼국 시대, 고려, 조선 시대를 거쳐 1999년 순수 우리 기술로 만든 인공 위성 우리별 3호를 쏘아올리기까지 우리 나라 과학의 역사를 담았다. 40여년 동안 한국 과학사와 과학 문화재를 연구한 전상운 박사가 지었으며, 어린이들을 위한 한국 과학사 책으로는 처음 출간된 책이라고 한다.",,6636,BOOK
해커스 토익 실전 Reading (문제집 + 해설집 + 어휘정리),해커스어학연구소 편집부 (엮은이),49854,국내도서>외국어>토익>Reading,9788990700360,뉴토익 최신 경향과 난이도를 반영한 실전서. 2006년 5월부터 개정된 뉴토익의 문제를 완전히 분석하여 출제 경향과 난이도를 그대로 반영한 문제들로만 구성되었다. 토익 수험생들은 이 교재 한 권으로 뉴토익의 문제들을 풀어보면서 실력을 향상시킬 수 있을 것이다.,,6352,BOOK
입이 큰 개구리,"키스 포크너 (지은이), 조나단 램버트 (그림), 정채민 (옮긴이)",35115,국내도서>유아>놀이책>팝업북/플랩북,9788980710713,등장하는 여러 동물들의 입이 튀어나오는 입체 그림책입니다. 책장을 넘길 때마다 불쑥불쑥 튀어나오는 그림들을 보면서 아이들이 좋아할 것 같아요. 마지막 장면에서 개구리가 연못으로 뛰어드는 모습은 또 얼마나 시원해 보이는지 모른답니다.,"유아를 위한 입체북. 책장을 넘길때 마다 동물들의 입모양이 입체로 솟아 오른다. 
입이 큰 개구리는 다른 동물들이 무얼 먹고 사는지 궁금했어요. 그래서 이 수다쟁이 개구리는 만나는 동물마다 어떤 먹이를 가장 좋아하는지 묻고 다녔어요. 그러다가 마침내 입이 큰개구리를 잡아먹기 좋아하는 동물을 만나게 되고...",20610,BOOK
칠판 앞에 나가기 싫어!,"다니엘 포세트 (지은이), 베로니크 보아리 (그림), 최윤정 (옮긴이)",48877,국내도서>어린이>동화/명작/고전>외국창작동화,9788949160368,소심한 마음을 극복하는 과정이 어떤 훈련이나 어른의 가르침을 통해서가 아니라 다른 사람을 도와 주고 싶은 마음에서 이루어진다는 이야기가 감동적이다.,목요일 아침이면 항상 그렇듯 에르반은 배가 아프다. '혹시 선생님이 나를 불러내서 구구단을 외어보라고  하면 어쩌나' 에르반은 칠판 앞에만 나가면 입도 달짝할 수가 없는데... 소심한 마음을 극복하는 과정은 다른 사람을 도와주고 싶은 마음에서 이루짐을 보여준다,30280,BOOK
조선 왕 독살사건 - 조선 왕 독살설을 둘러싼 수많은 의혹과 수수께끼,이덕일 (지은이),117,국내도서>역사>조선사>조선중기(임진왜란~경종),9788991147300,"500여 년 역사를 자랑하는 조선 왕조. 이 기간 동안 조선은 27명의 왕을 배출한다. 그중에서는 갑작스런 죽음 탓에 독살설에 휘말린 왕들이 몇몇 있다. 인종, 선조, 효종, 현종, 경종, 정조, 고종이 그들. 여기에 살아서 왕위에만 올랐다면 조선 역사의 흐름을 바꾸었을 거라고 평가받는 소현세자까지 포함하면 무려 8명, 즉 조선 왕 4명 가운데 1명이 독살설에 시달리고 있는 셈이다.",,10159,BOOK
호밀밭의 파수꾼,"제롬 데이비드 샐린저 (지은이), 공경희 (옮긴이)",50919,국내도서>소설/시/희곡>영미소설,9788937460470,1951년 처음 발표된 이래 가장 사랑받는(특히 젊은이들로부터) 고전의 자리를 놓치지 않아온 J.D. 샐린저의 장편소설을 번역가 공경희씨가 다시 옮겼다. 마침 2001년은 <호밀밭의 파수꾼>이 발표된지 꼭 50년이 되는 해이다. 이 책은 지금도 여전히 매년 약 30만 부가 팔려나간다.,"▶ 랜덤하우스 선정 20세기 100대 영문학 작품
▶ 미국 도서관 최다 대출을 기록한 베스트셀러
▶ “현대 문학의 최고 경지에 이른 작품.” - 윌리엄 포크너(노벨 문학상 수상 작가)

2023년 새로 출간하는 『호밀밭의 파수꾼』은 옮긴이 정영목 교수가 주인공 홀든 콜필드의 개성을 한층 더 생생히 표현하기 위해 원작의 문체와 문형에 가장 가까운 한국어 문장을 고심하며 저작권자의 자문과 검수를 거쳐 완성한 텍스트이다. 뿐만 아니라, 2020년대 한국 독자들의 생생한 문화적 문학적 감수성에도 부합하는 동시에 원작의 문장들이 갖는 리듬과 호흡, 맥락과 의미까지 고스란히 살리기 위한 어휘의 선별은 물론, 쉼표와 말줄임표 등 문장 부호의 쓰임에 이르기까지 세심히 검토하여 우리말로 옮겼다.",55865,BOOK
한자야 미안해 &quot;너무 재밌어서&quot; - 어휘편,하영삼 (지은이),49926,국내도서>외국어>한자>한자일반,9788925511801,"부수편과 어휘편, 두 권으로 구성된 이 책은 더 이상 한문선생님을 만날 수 없는 대학생과 직장인, 취업준비생은 물론, 한자에 흥미를 붙인 청소년들까지 쉽게 읽고 이해할 수 있도록 꾸며진 한자책이다. 一, 木, 水, 金 등 누구에게나 익숙한 214개 부수를 그림으로 그리고 왜 그러한 모양이 되었는지를 설명하는 한편, 각각의 부수와 같은 의미 또는 같은 소리를 가진 파생한자들을 꼬리에 꼬리를 무는 형식으로 소개한다.",,501,BOOK
마음력 - 마음의 힘을 길러주는 멘탈 피트니스,우종민 (지은이),70211,국내도서>자기계발>행복론,9788960860315,"서울백병원 신경정신과 의사가 쓴 책으로 마음이 가진 영향력과 그동안 어디에서도 배우지 못했던 '마음의 힘'을 키우는 방법을 알려준다. 책을 통해 마음의 운동으로 마음력을 기르고, 자기 삶을 주도하며 삶을 살아가는 방법을 배울 수 있다.","스트레스가 많은 비즈니스맨들을 위한 색다른 건강 운동 '멘탈 피트니스'!

『마음력』은 재충전이 필요한 직장인을 위해 '마음력 강화 프로그램 12단계'를 제시한다. 신경정신과 의사인 저자는 마음에 힘이 생기면 모든 일이 잘 풀린다고 말하며 행복한 마음을 위한 멘탈 피트니스를 소개한다. 과학적 이론에 근거를 두고 저자가 직접 효과를 확인한 방법을 소개하였다. 

무엇보다 멘탈 피트니스는 자연스럽게 몸에 배야 하는 습관임을 강조하며 '마음의 좌표찾기, 뇌를 말랑말랑하게 만들기, 멋지게 화내고 제대로 말하기, 뇌의 마이너스 회로 없애기, 뒤끝 없이 거절하고 세련되게 칭찬하기, 감정으로 소통하기' 등 12단계에 걸쳐 체계적으로 익혀 나갈 수 있도록 하였다.

☞ 이 책의 독서 포인트!
멘탈 피트니스의 달인이 되기 위한 12단계 프로젝트를 매뉴얼로 요약·정리하였고, 또한 책 곳곳에 '1분 충전법, 뇌 이완법, 자기 최면 연습, 사고 중단법' 등 생활 속의 멘탈 피트니스를 제공하여 누구나 쉽게 따라 할 수 있도록 하였다.",553,BOOK
"우리가 몰랐던 동아시아 - 근대 망령으로부터의 탈주, 동아시아의 멋진 반란을 위해",박노자 (지은이),36868,국내도서>역사>아시아사>동아시아/극동아시아사,9788984312241,"<당신들의 대한민국 1,2>, <좌우는 있어도 위 아래는 없다> 등 책들로 독자들에게 널리 알려져있는 박노자 오슬로 국립대학 교수의 동아시아 역사 이야기. 기존의 동아시아 담론과는 다른 동아시아 전통들을 끄집어내 선보이고 있다.",,2378,BOOK
누가 내 머리에 똥 쌌어?,"베르너 홀츠바르트 (글), 볼프 에를브루흐 (그림)",35137,국내도서>유아>그림책>나라별 그림책>유럽,9788971968413,"이 그림책은 유아들에게 관찰하고 탐구하는 태도와 힘을 길러준다. 두더지의 추적을 따라가다 보면 동물들의 이름과 모양새가 짝지어 나오고, 똥의 모양과 느낌에 대한 다양한 표현이 나와 사물의 느낌과 상태, 말 표현들을 익히게 되는 것이다.","아이들의 상상력을 키워줄 그림책!

'독일 그림책' 시리즈, 『누가 내 머리에 똥 쌌어?』. 100만 명의 어린이들에게 독서의 즐거움을 안겨준 베스트셀러입니다. '똥'에 대한 유아들의 호기심을 충족시켜줍니다. '철퍼덕!', '쿠당탕탕!', '쫘르륵!', 그리고 '철썩!' 등의 맛깔스러운 의성어와 의태어는 유아들의 귀를 사로잡으면서 말의 재미에 빠져들게 합니다. 

땅 속에 사는 두더지는 아침마다 해가 떴나, 안 떴나를 보기 위해 땅 위로 얼굴을 쑥 내민답니다. 그러던 어느 날, 이상한 일이 벌어졌어요. 두더지의 머리 위로 누가 쌌는지 모를 똥이 떨어졌지 뭐에요. 그러나 눈이 나쁜 두더지는 누가 쌌는지 볼 수 없었어요. 두더지는 잔뜩 화가 났어요. 그리고 자신의 머리에 똥을 싼 누군가를 찾아 떠나는데…….",59640,BOOK
양파의 왕따 일기,"문선이 (지은이), 박철민 (그림)",48874,국내도서>어린이>동화/명작/고전>국내창작동화,9788970572529,"우연한 기회에 양파에 들게 된 정화는 너무나 기쁘고 신이 나지만, 양파 친구들이 반 아이들을 따돌리고 있음을 알게 된다. 정화는 옳지 못하다고 생각하지만, 어찌할 바를 몰라 괴롭기만 하다.",,23272,BOOK
내 영혼의 선생님,린다 A. 앤더슨 (지은이),51574,국내도서>종교/역학>기독교(개신교)>기독교 문학,9788989399193,"교회학교 선생님들의 아름다운 헌신과 섬김에 대해 언급한 책은 전무한 형편이다. 사실, 이것이 교회학교 선생님들에 대한 우리 인식의 현주소이다. 이 책은, 빛도 없이 값도 없이 어린 영혼을 책임져온, 앞으로도 책임질 그들에게 용기를 줄 것이다.",,243,BOOK
부모를 용서하기 나를 용서하기 - 용서를 통한 역기능 가정의 성인아이 치유,"데이빗 스툽, 제임스 매스텔러 (지은이), 정성준 (옮긴이)",51596,국내도서>종교/역학>기독교(개신교)>기독교(개신교) 신앙생활>간증/영적성장,9788955361063,,"우리들 대부분은, 변화되고 싶어하면서도 자기 자신과 사랑하는 사람들에게 계속적으로 상처를 주는 사람들이다. 그러한 연약함 가운데 우리를 묶어두는 것은 도대체 무엇인가? 진정한 치유와 해방이란 가능한 것일까? 저자는 용서야말로 과거의 고통을 해결하는 열쇠라고 주장하면서, 회복을 위해 필수적인 첫 단계는 자신이 자라온 가정에서 역기능을 부추기는 가족 패턴...",1757,BOOK
여우의 전화박스,"도다 가즈요 (글), 다카스 가즈미 (그림), 햇살과나무꾼 (옮긴이)",48877,국내도서>어린이>동화/명작/고전>외국창작동화,9788988674475,아기를 잃은 여우의 슬픈 마음을 아름다운 그림으로 나타내고 있는 그림책이다. 전화를 걸고 있는 인간 아이를 바라보는 엄마 여우의 눈과 아기 여우를 다시 만나고픈 간절한 마음이 따뜻하게 그려져 있다.,"아기 여우를 추억하는 엄마 여우의 슬픈 이야기

일본 동화 작가 도다 가즈요의 『여우의 전화박스』. 아기 여우가 병에 걸려 죽자 이별의 슬픔에 빠져버린 엄마 여우가, 산 근처의 전화박스로 찾아와 멀리 떨어져 사는 아픈 엄마와 사랑스러운 목소리로 통화를 하는 소년을 만나면서 벌어지는 환상적 이야기를 담은 장편동화다. 엄마 여우가 되새기는 아기 여우와의 행복한 추억 속으로 아이들을 안내한다. 아이들을 위한 엄마의 뭉클한 사랑을 고스란히 옮겨 놓았다.

고요하고 한적한 어느 산기슭에 아주아주 오래된 전화 박스 하나가 있었습니다. 지나다니는 사람이 별로 없었기 때문에 전화 박스는 늘 비어 있었습니다.이 산속에는 엄마 여우랑 아기 여우가 살고 있었습니다. 그러던 어느날, 아기 여우가 시름시름 앓기 시작했는데…….",12934,BOOK
열살전에 사람됨을 가르쳐라,문용린 (지은이),51795,국내도서>좋은부모>육아>자녀 심리,9788901069647,"이 시대의 진정한 리더, 행복과 성공을 거머쥔 인재로 거듭나기 위해 우리 아이들에게 진정 필요한 것은 '도덕성'이다. 책은 '도덕지능'을 집중적으로 다루며 철저한 실험과 논증된 자료를 토대로 바른 부모상을 제시한다.
",,1513,BOOK
일 분 후의 삶,권기태 (지은이),51371,국내도서>에세이>한국에세이,9788925510125,"하늘에서, 바다에서, 산 위에서, 땅속에서 불시에 닥친 죽음의 위기를 넘어 인생으로 다시금 초대받은 사람들이 있다. 열두 명의 생존자들은 '1분 후에도 내가 여전히 살아 있을 수만 있다면' 하고 간절히 바랐던 체험을 공유한다. 그들이 극한의 순간에 피부로 느꼈던 생의 감각을, 기자 출신의 소설가 권기태가 기록했다.","일 분 후에도 나는 살고 싶다!

죽음의 위기와 맞닥뜨린 사람들이 들려주는 생존 기록, 『일 분 후의 삶』. 평범하게 살아오다가 불시에 찾아온 죽음의 위기를 극복한 열두 사람의 감동적인 생존 기록을 담은 논픽션이다. 생의 끝에 다다른 순간, 그들은 자신이 일 분 후에도 살아있기를 간절히 바랐다. 그들에게는 어떤 일이 일어났던 것일까?

이 책은 오랫동안 신문사에서 문학ㆍ영화 분야의 담당 기자로 일해온 저자의 저서로, 짧은 기사 속에 전부 담아내지 못한 삶과 죽음에 대한 이야기를 펼치고 있다. 고속버스 운전기사, 실습 항해사, 보험 세일즈맨 등으로 평범하게 살아가다가, 죽음의 위기 속에서 삶을 향한 강렬한 의지로 생존자가 된 열두 사람의 이야기는, 평범한 일상을 살아가는 우리에게 치열한 생의 감각을 다시 한번 깨닫게 해준다. 

바다에 빠졌다가 거북이의 도움으로 살아돌아온 사람, 2만 2천 9백 볼트에 감전되어 팔을 잃고 살아난 사람, 그리고 비행기 추락 사고로 고통을 겪으면서도 뱃속의 아기를 지켜낸 사람 등 생과 사를 오가다가 결국 생의 손을 잡은 열두 사람의 긴장감 넘치는 이야기를 읽을 수 있다. 아울러 인터뷰를 바탕으로 한 그들의 이야기를 통해 존재의 의미를 되새기게 된다.",2369,BOOK
뿌리 깊은 나무 2,이정명 (지은이),51123,국내도서>소설/시/희곡>역사소설>한국 역사소설,9788991643161,"세종 시대를 배경으로, 놀라운 속도감과 재미 그리고 뜨거운 시대의식과 해박한 지적 탐구가 돋보이는 본격 한국형 팩션. 출간 당시 각종 언론과 독자들의 찬사를 받으며 베스트셀러로 떠오른 후, 2011년 한석규, 장혁, 신세경 주연의 명품 드라마로 방영되어 다시 한번 독자들을 사로잡았다.","집현전 학사들의 연쇄살인과 목숨을 건 비밀 프로젝트!

세종 시대를 배경으로, 놀라운 속도감과 재미 그리고 뜨거운 시대의식과 해박한 지적 탐구가 돋보이는 본격 한국형 팩션. 출간 당시 각종 언론과 독자들의 찬사를 받으며 베스트셀러로 떠오른 후, 2011년 한석규ㆍ장혁ㆍ신세경 주연의 명품 드라마로 방영되어 다시 한번 독자들을 사로잡았다.

『뿌리 깊은 나무』는 한반도 역사상 가장 융성했던 세종 시대, 훈민정음 반포 전 7일간 경복궁에서 벌어지는 집현전 학사 연쇄살인사건을 다루며, 모두가 안다고 생각하는 세종의 치세를 누구도 상상하지 못했던 방법으로 그려낸다. 연쇄살인의 이면에는 뛰어난 천재 집단이 목숨을 걸고 추진하는 비밀 프로젝트가 있고 그것을 방해하려는 세력의 거대한 음모가 숨어 있다.",14939,BOOK
눈물 1,"쑤퉁 (지은이), 김은신 (옮긴이)",50923,국내도서>소설/시/희곡>중국소설,9788954603683,"'중국 제3세대문학의 대표적 작가'로 꼽히는 쑤퉁이 중국 4대 민간설화 중 하나인 맹강녀 이야기를 소재로 쓴 장편소설. 31개국 33개 출판사가 참여하는 출판 프로젝트, <세계신화총서>의 중국 대표작가로 선정되어 집필했다. 재산도 권력도 가지지 못한 민초들이 유일하게 가질 수 있었던 눈물의 힘을 긍정함으로써 현대인에게 진실하고 순수한 가치에 대한 질문을 던지는 작품이다.","'중국 제3세대문학의 대표적 작가'로 꼽히는 쑤퉁이 중국 4대 민간설화 중 하나인 맹강녀 이야기를 소재로 쓴 장편소설. 31개국 33개 출판사가 참여하는 출판 프로젝트, 의 중국 대표작가로 선정되어 집필했다. 재산도 권력도 가지지 못한 민초들이 유일하게 가질 수 있었던 눈물의 힘을 긍정함으로써 현대인에게 진실하고 순수한 가치에 대한 질문을 던지는 작품이다.



진나라 말, 북산에 유배 온 황제의 숙부의 억울한 죽음을 애도하며 눈물을 흘렸다는 이유로 마을사람 삼백여 명이 죽임을 당한다. 몇 십 년 후, 여전히 마음대로 울 수 없었던 북산의 마을 여인들은 눈을 제외한 신체의 다른 부위로 몰래 우는 방법을 터득한다. 머리카락으로 우는 법을 배우던 비누는 어머니가 일찍 죽는 바람에 그 비법을 제대로 전수받지 못해 울면서도 그 눈물을 감추지 못한다.



가난하지만 성실한 고아 청년 완치량과 혼인하고 한창 달콤한 신혼을 즐기던 어느 날, 남편 치량이 옷도 제대로 갖춰 입지 못한 채 만리장성 노역으로 끌려간다. 마을 여자들은 물론, 무당까지도 그녀가 남편에게 도착하기도 전에 길에서 죽고 말 거라고 말리지만 남편에 대한 사랑과 걱정만으로 비누는 천 리 길을 나선다.",621,BOOK
"온 3 - 애장판, 완결",유시진 (지은이),4135,국내도서>만화>본격장르만화>판타지>서사 판타지,9788952749734,"과거와 현재, 이승과 저승, 현실과 꿈, 전생과 환생 등 세상의 모든 모호한 경계가 혼재하는 듯한 기묘한 도시 C시를 무대로 펼쳐지는 고요하면서도 격정적인 세 인물의 인연과 업보, 운명에 관한 이야기다.",,657,BOOK
한자능력 검정시험 3급(3급2 포함) - 3급2 포함,남기탁 (지은이),49927,국내도서>외국어>한자>한자 시험 대비,9788995501955,"읽기배정과 쓰기배정한자를 구분했으며, 유의어와 반의어, 약어 등을 정리했다. 기출문제와 실전과 비슷한 유형의 실전문제를 수록했다.",,2941,BOOK
내 이름은 삐삐 롱스타킹,"아스트리드 린드그렌 (지은이), 롤프 레티히 (그림), 햇살과나무꾼 (옮긴이)",48877,국내도서>어린이>동화/명작/고전>외국창작동화,9788952709486,"전 3권으로 완역된 삐삐 시리즈 중 첫권에 해당하는 이 책은 삐삐가 `뒤죽박죽 별장`으로 오는 것으로부터 이야기를 시작한다. 토미와 아니카와의 첫만남, 친구가 된 두 아이를 따라 학교로 가게 된 삐삐의 엉뚱한 행동들, 그리고 서커스 단장의 가슴을 졸이고, 화가 나게 만든 삐삐의 엄청난 행동들 등의 이야기가 담겨있다.","유쾌한 삐삐의 수다!

아스트리드 린드그렌 아줌마는 어느날 《키다리 아저씨》를 읽은 딸의 독촉을 받는다. '긴 다리 아저씨'는 실컷 읽었으니, 이제 '긴 양말 신은 아이'의 이야기를 들려달라는 것. 그것도 무작정, 엄청나게 조르는 것이다. 아줌마는 참다못해 떠오르는 대로 삐삐 이야기를 지어내기 시작했다. 

이렇게 탄생한 '삐삐' 이야기는 처음에는 너무나 황당한 이야기여서 여러 출판사에서 출판하기를 거절했다고 한다. 우여곡절 끝에 삐삐 이야기는 책으로 나오게 되었고, 나오자마자 선풍적인 인기를 얻었다. 

전 3권으로 완역된 삐삐 시리즈 중 첫권에 해당하는 이 책은 삐삐가 '뒤죽박죽 별장'으로 오는 것으로부터 이야기를 시작한다. 토미와 아니카와의 첫만남, 친구가 된 두 아이를 따라 학교로 가게 된 삐삐의 엉뚱한 행동들, 그리고 서커스 단장의 가슴을 졸이고, 화가 나게 만든 삐삐의 엄청난 행동들, 다과회에서 겉으로만 점잔 빼는 부인들의 속내를 활짝 들여다볼 수 있게 한 유쾌한 삐삐의 수다, 도둑들을 멋지게 혼내주고 정신차리게한 일화 등을 실었다.",29478,BOOK
맨큐의 경제학 - 4판,"그레고리 맨큐 (지은이), 김경환, 김종석 (옮긴이)",8560,국내도서>대학교재/전문서적>경상계열>경제학,9788970857909,하버드 대학의 그레고리 맨큐 교수가 경제학에 입문하려는 학생들을 위해 내놓은 경제학 원론. 경제 이론 나열에 그치지 않고 풍부한 사례와 비유를 사용해 경제학의 기본 원리를 흥미롭게 풀어나간 것이 특징이다.,"<B>경제학의 기본 원리가 체계적으로 정리된 대학교재 겸 이론서!</B>
<BR>
<BR>초판 출간 이래로 전 세계 수많은 대학에서 경제학 전공교재로, 또는 교양교재로 많이 채택하고 있는『맨큐의 경제학』. 경제학 전공자라면 모르는 사람이 없을 정도로 유명한 이 책은 경제학의 중요 이론과 원리를 빠짐없이 정리하였으며, 다양한 사례를 통해 이론서가 쉽게 놓칠 수 있는 현실과의 괴리감을 줄였다.
<BR>
<BR>특히 저자는 학생들이 경제학에 친숙하게 다가가게 하기 위해 되도록 문장은 간결하게 집필하였으며, 문제의 핵심을 보지 못하게 하는 복잡한 설명이나 산만한 내용을 배제하였다. 그리고 각 장의 끝부분에는 '복습문제'와 '응용문제'를 제시하여 본문에서 배운 내용을 제대로 이해하였는지 확인할 수 있도록 하였다.
<BR>
<BR>일반적인 경제학 교재와 달리 딱딱한 경제이론보다는 사례 분석과 정책 문제에 많은 부분을 할애하였고, 다양한 사례를 통해 우리 시대의 사회문제를 조명할 수 있도록 하였다. 아울러 '뉴스 속의 경제학' 코너를 통해 경제학의 기본 이론들이 우리 일상에서 어떻게 적용되는지를 보여주어 새로운 시각으로 세상을 보는 눈도 길러준다.
<BR>
<BR>▶ 이 책은 원서의 제4판(최신판)을 번역한 것입니다.",2779,BOOK
역사,이이화 (지은이),52593,국내도서>역사>한국사 일반,9788970635569,역사 대중화에 앞장서온 이이화의 한 권으로 읽는 우리 역사 에세이. 인류가 발생한 시기부터 1987년 6월항쟁까지 우리나라 역사를 한 권으로 이해할 수 있게 했다.,,750,BOOK
