title,author,genre_id,genre,ISBN,description_aladin,description_naver,salesPoint,mallType
가족앨범 - 성장그림책,"실비아 다이네르트, 티네 크리그 (지은이), 울리케 볼얀 (그림), 엄혜숙 (옮긴이)",35137,국내도서>유아>그림책>나라별 그림책>유럽,9788958280286,아동 성폭력 문제를 자연스럽고도 사려 깊게 녹여 낸 책이다. 의인화와 상징을 통해 에둘러 내용을 표현함으로서 상처받은 아이도 무리 없이 받아들일 수 있게 도와준다.,"『가족 앨범』은 아동 성폭력 문제를 다른 그림책으로, 노골적으로 표현하기 힘든 성폭력의 문제를 생쥐 가족들을 통해 상징적으로 표현하고 있습니다. 생쥐네 두 딸 이름은 단비와 소라. 엄마 아빠 외삼촌과 함께 살고 있지요. 외삼촌은 단비에게 항상 친절하고 단비와 잘 놀아줍니다. 하지만 단비는 왠지 삼촌이 편치 않았어요. 삼촌은 단비에게 자신의 꼬리를 만지게 하고, 자꾸 무릎에 앉히거나 몸 여기저기를 만졌어요. 그리고는 삼촌과 단비 만의 비밀이라고 엄마에게 얘기하지 못하게 했지요.",1145,BOOK
아무튼,"아고타 크리스토프 (지은이), 용경식 (옮긴이)",51036,국내도서>소설/시/희곡>세계의 소설>동유럽소설,9788972753209,"<존재의 세 가지 거짓말> 3부작으로 국내 독자들에게 신선한 충격을 던진 아고타 크리스토프의 2005년 신작 소설집이 출간됐다. 11년 만에 출간된 이 책은 작가의 독특한 경험이 그대로 투영되어 있으며, 길이가 짧은 25개의 단편으로 구성된다. 각 작품들의 중심에 흐르는 주제는 죽음, 존재감의 상실이다.",,211,BOOK
21세기 먼나라 이웃나라 4 - 영국,이원복 (지은이),48905,국내도서>어린이>사회/역사/철학>세계사,9788934913870,"'의회제'로 대표되는 유럽 민주주의의 역사를 배운다. 빅토리아 시대 '해가 지지 않는 나라'로 불릴 만큼 수많은 식민지를 거느렸던 화려한 역사를 가능하게 한 영국인의 저력이 무엇인지를 탐구한다. 또, 영국인의 독특한 문화 -티타임 등-에 대한 기원도 알 수 있다.","수천년 인류의 문명과 지혜를 명쾌하게 짚어내는 교양만화,『먼나라 이웃나라』의 21세기 올컬러판. 달라진 세계와 유럽의 모습을 빠짐없이 반영, 내용과 구성을 대폭 개정하였고, 각 권마다 고운 색깔을 넣어서 만화 보는 재미를 한층 높였다. 제4권에서는 의회 민주주의의 본고장, 전통과 현대가 조화를 이룬 나라 영국을 소개한다. 해가 지지 않는 나라 대영제국이라는 말도 그건 옛날 말이다. 영국도 이젠 수많은 식민지를 거느린 대제국에서 유럽의 한 작은 섬나라가 되고 말았다. 하지만 역사와 문화는 그대로여서 지금도 여왕과 왕세자를 받들며 오랜 전통을 이어가고 있다. 잉글랜드, 스코틀랜드, 북아일랜드… 지방마다 다른 종교와 문화 때문에 밤낮없이 다투는 게 문제이지만 신사의 나라 영국의 저력은 여전하다.",2637,BOOK
키 작은 아이,"이현 (지은이), 최상훈 (그림)",48874,국내도서>어린이>동화/명작/고전>국내창작동화,9788952967503,전교생에서 가장 키가 작은 땅꼬마 은정이가 신체검사를 통해 이루는 마음의 성장 이야기. 남과 비교하지 않고 스스로의 참모습을 찾기 위해 노력하는 아이들의 모습을 담은 그림동화이다. 작은 키 때문에 얻은 마음의 병이 따뜻한 우정과 가족의 사랑으로 치유되는 과정을 잔잔하게 그려냈다.,,314,BOOK
"꼬마 독재자 - 주제별 동화선집 1, 민주주의의 참뜻",어린이도서연구회 (엮은이),48874,국내도서>어린이>동화/명작/고전>국내창작동화,9788935502486,,,1837,BOOK
악어떼가 나왔다 - 제10회 문학동네작가상 수상작,안보윤 (지은이),50993,국내도서>소설/시/희곡>한국소설>2000년대 이후 한국소설,9788982819971,"'문학동네작가상' 10회 당선작으로 안보윤의 장편소설 <악어떼가 나왔다>가 선정됐다. 아마존의 밀림, 허리까지 올라오는 수풀 사이에서 보일 듯 말 듯, 악어떼가 지나간다. 깊이를 알 수 없는 늪 속에서 소리도 없이 지나가는 거대한 악어떼. 스물다섯 신예 작가 안보윤의 인상적인 등장이다.","역량있고 패기 넘치는 신인작가를 발굴해 온 '문학동네작가상'이 제 10회 당선작으로 안보윤 장편소설 『악어떼가 나왔다』를 선보였다. 이 소설은 각각 독립된 네 개의 이야기들이 다시 하나로 엮이는 구조를 가지고 있다. 내용을 보면 얼핏 끔찍하게 보이지만, 작품 곳곳에서 실소를 머금을 수 있게 한다.  더없이 끔찍한 상황들은 모두 가공의 현실이지만, 지금의 현실이 그보다 낫다고 자신할 수는 없다. 지금 이 순간에도 아이들은 사라지고 있고, 누군가는 생계를 위해 생선비늘을 벗겨내며, 또 누군가는 전혀 뜻하지 않게 살인을 ?..",334,BOOK
김영진 일본어 한자읽기 사전,김영진 (지은이),49886,국내도서>외국어>일본어>일본어 어휘/한자/문법,9788980100637,"모든 한자와 단어를 우리말 가나다 순으로 나열하여 쉽게 찾을 수 있게 한 사전으로, 음독과 훈독, 파생어, 연탁음, 예외를 각각 분리시켜 놓아 학습에 능률을 높일 수 있게 하였다.",,2752,BOOK
알버트,"도나 조 나폴리 (지은이), 짐 라마쉬 (그림), 조세형 (옮긴이)",35101,국내도서>유아>4~7세>그림책,9788989773368,,,189,BOOK
나귀 방귀 (보급판) - 옛이야기 보따리 5,"서정오 (지은이), 김환영 (그림)",48874,국내도서>어린이>동화/명작/고전>국내창작동화,9788985494960,"「은근슬쩍 놀려주는 이야기」라는 소제목이 붙어있는 옛이야기 책으로 풍자를 담은 12편의 이야기가 실려있다. 자기 욕심만 챙기는 사람들, 말만 앞서는 사람들, 제 꾀에 제가 넘어가는 사람들, 어리석은 사람들을 은근히 놀려주는 이야기들이다.--어린이도서연구회",,2898,BOOK
조엘 온 소프트웨어 - 유쾌한 오프라인 블로그,"조엘 스폴스키 (지은이), 이해영, 박재호 (옮긴이)",6720,국내도서>컴퓨터/모바일>프로그래밍 개발/방법론>프로그래밍 기초/개발 방법론,9788989975588,소프트웨어 개발내용을 다뤄 개발자들에게 인기가 높은 블로그인 조엘 온 소프트웨어(http://www.joelonsoftware.com)에 실렸던 기사 중에서 유쾌하고 핵심을 찌르는 베스트 기사만을 뽑아 엮었다.,"2005년 15회 JOLT상 수상작!
아마존 선정 컴퓨터 인터넷 부문 10대 도서.
Java.net 선정 개발자 · 관리자 필독서.

조엘 온 소프트웨어는 조엘 스폴스키가 운영하는 유명한 소프트웨어 개발 블로그인 조엘 온 소프트웨어(http://www.joelonsoftware.com)에 수록한 주옥같은 글 중에서 특히 독자들이 관심을 보일 만한 베스트를 뽑아 엮은 책이다. 조엘은 딱딱한 소프트웨어 공학 서적에서 찾아보기 어려운 소프트웨어 개발자의 애환과 톡톡 튀는 생각을 수필에 가까운 부담 없는 필체로 기술하고 있다. 따라서 최전선에서 소프트웨어...",1623,BOOK
"말해 봐, 너 이거 좋아하니...","제라르 그레베랑 (지은이), 마갈리 바르도스 (그림), 유정애 (옮긴이)",35101,국내도서>유아>4~7세>그림책,9788932306841,"한가로운 일요일 아침, 눈내린 하얀 들판, 과자에 뿌려진 설탕 크림, 엄마의 냄새. 말해 봐, 너 이거 좋아하니?",,297,BOOK
그 남자 그 여자 - MBC FM '이소라의 음악도시'의 아름다운 101가지 사랑 이야기,이미나 (지은이),51371,국내도서>에세이>한국에세이,9788957572146,"연인이라 불리는, 또는 불리웠던 두 사람. 같은 시간, 같은 상황에서 그 남자.그 여자는 서로 어떤 생각을 하고 있었을까. 이 책은 한번이라도 사랑을 해봤던 사람이라면, 혹은 밤잠 못이루고 사랑을 꿈꾸는 사람이라면 누구나 공감할 법한 짧은 사랑 이야기이다.",,5907,BOOK
동물농장,"조지 오웰 (지은이), 도정일 (옮긴이)",50919,국내도서>소설/시/희곡>영미소설,9788937460050,1945년에 간행된 조지 오웰의 대표작. 어떤 농장의 동물들이 늙은 돼지 메이저의 부추김에 빠져 농장주의 압제에 대항해 반란을 일으켜 인간의 착취가 없는 '모든 동물이 평등한 이상사회'를 건설한다. 그러나 돼지들이 지도자가 되어 다시 동물들을 압박하기 시작하는데...,"풍자 우화를 통한 사회 비판을 담은 기념비적 소설
 
“모든 동물은 평등하다. 그러나 어떤 동물은 다른 동물들보다 더 평등하다.”

우화 형식으로 당대의 정치적 현실을 날카롭게 묘파한 『동물농장』은 『1984』, 『카탈로니아 찬가』와 함께 조지 오웰이 47세의 나이로 갑작스레 사망하기 전 짧은 작가 생활 동안 남긴 영국 문학의 위대한 결실이다. 이 작품이 영국에서 처음 출간된 것은 2차 세계 대전이 갓 끝난 1945년이었다. 소련과 사회주의에 민감하던 세계 정치적 분위기에서 이 작품은 처음엔 거의 모든 출판사에서 출판을 거절할 정도로 홀대받았으나, 그의 전작 『카탈로니아 찬가』를 출간했던 섹커 앤드 와버그 출판사의 결정으로 겨우 출간에 이를 수 있었다. 사실상 전시(戰時)나 다름없던 무렵 『동물농장』은 출간되자마자 초판 4500부가 매진되고 재쇄를 거듭한 끝에 영국과 미국 모두에서 베스트셀러가 되었다. 그 이후 70여 년이 훌쩍 지난 지금까지 『동물농장』의 판매량은 세계적으로 1천만 부 이상을 넘은 것으로 알려져 있다.

조지 오웰은 『동물농장』에서 인간의 속박에서 벗어나 혁명을 이루고 이상 사회를 건설한 동물 공동체가 변질되는 모습을 통해 구소련의 역사를 재현하며 스탈린 독재 체제를 강도 높게 비판한다. 작중 여러 등장인물 중 인간 주인인 존즈는 러시아 황제 니콜라스 2세를, 혁명을 호소하는 늙은 메이저는 마르크스를, 독재자 나폴레옹은 스탈린을, 나폴레옹에게 축출당하는 스노볼은 트로츠키를 상징한다. 또한 이야기 속에 등장하는 ‘동물학살’과 ‘외양간 전투’ 역시 각기 스탈린 시대의 대숙청과 연합군 침공 등으로 연결된다. 혁명이 성공한 후에 어떻게 변질되고, 권력을 잡은 지도자들이 어떻게 국민을 속이고 핍박하는지를 면밀히 그린 이 우화는 특정한 시대에만 한정되어 읽히지 않는다. 이 작품은 인류가 사회를 이루고 살 때부터 벌어진 ‘독재’를 함축적인 등장인물과 사건을 통해 그려내어 지금까지도 유효한 풍자를 담고 있으며, 그렇기에 조지 오웰이 지닌 사회비판적 문학의 역량이 여실히 드러나는 작품이다.",70760,BOOK
에디슨의 유전자를 가진 아이들,"톰 하트만 (지은이), 최기철 (옮긴이)",51786,국내도서>좋은부모>육아>육아법/육아 일반,9788989353881,"공교육 제도권 내에서 주의력 결핍, 과잉행동, 학교부적응으로 진단받는 아이들을 새로운 시각에서 바라본 책. 토머스 에디슨의 이름을 따서 지은 '에디슨 유전자'를 설명하며, 이 유전자를 가진 아이들의 행동 특성을 어떻게 이해할 것인지 논의한다.","공교육 제도권 내의 주의력 결핍, 과잉행동, 학교부적응 아동을 새로운 시각에서 바라보는 책. 미국에서 이러한 아동들을 위한 학교와 쉼터를 운영하고 있는 저자는 오늘날 공교육 제도권 내에서 장애라는 오해를 받고 있는 아이들을 '에디슨의 유전자를 가진 아이들'이라고 부른다. 저자는 이런 아이들이 대체로 뛰어난 능력의 소유자라고 주장하며, 이 아이들이 재능을 잃지 않고 올바로 자라나기 위해서는 어른들의 사랑과 이해가 필요하다고 당부하고 있다. 

이 책은 '에디슨의 유전자를 가진 아이들'이 흔히 보이는 충동성과 산만함은 장애의 징후가 아닌 뛰어난 창의력의 증거라고 말한다. 이해받지 못하는 환경에서 쉽게 좌절하고 상처받도록 내버려두거나 전혀 필요없는 약물치료에 의존할 것이 아니라, 아이들이 잠재적인 능력을 마음껏 발산할 수 있도록 도와주고 자긍심을 길러줘야 한다고 강조하고 있다.",194,BOOK
앤서니 브라운의 행복한 미술관,"앤서니 브라운 (지은이), 서애경 (옮긴이)",35137,국내도서>유아>그림책>나라별 그림책>유럽,9788901044873,"앤서니 브라운이 런던의 테이트 미술관에서 실제 아이들과 함께 한 워크숍 경험을 토대로 만들어졌다. 전시 작품들에 대한 아이들의 반응, 아이들의 그림놀이가 작품의 기초가 된 것이다. 미술관 구경을 간 어느 가족의 이야기를 통해 가족간의 소통과 따뜻한 관계의 회복까지 전해준다.","미술관에서 행복을 찾은 한 가족의 이야기를 통해 즐겁게 그림을 보는 방법, 나아가 예술 작품의 가치를 깨닫게 해 주는 그림책. 영국 런던의 테이트 미술관에서, 저자가 아이들과 함께 진행한 워크숍의 즐겁고 행복한 기억을 고스란히 담아낸 작품이다. 어느 해 엄마의 생일날, 엄마는 온 가족이 함께 미술관 구경을 가자고 제안한다. 미술관 가는 길은 그리 신나지 않고, 빼곡히 걸린 옛날 그림들은 지루하게만 보인다. 하지만 하나씩 그림에 담긴 이야기를 찾아보고, 서로의 느낌과 생각, 추억들을 나누는 동안 어느새 생기를 되찾고 마음을 열게 된다.",11644,BOOK
천년의 그림여행 - 특별 보급판,"스테파노 추피 (지은이), 이화진, 서현주, 주은정 (옮긴이)",50978,국내도서>예술/대중문화>미술>미술 이야기,9788970842530,"서양 미술사에서 중요하게 자주 꼽히는 800여 점의 그림 안내서. 지은이는 지난 천 년간 서양회화의 변천사와 작가, 작품, 각 지역 미술의 특징을 두루 짚으며, 서양 미술사 전반을 돌아본다. 시대를 초월하는 35점의 걸작은 더 자세하게 소개하며, 부록으로 연표, 찾아보기를 함께 실었다.",,2902,BOOK
21세기 먼나라 이웃나라 12 - 미국 : 대통령 편,이원복 (지은이),48905,국내도서>어린이>사회/역사/철학>세계사,9788934915072,"초대 조지 워싱턴에서 43대 G.W. 부시까지 미국의 대통령들의 이야기. 짧은 역사에도, 미국을 최강대국으로 성장시킨 최고의 인물들에 대한 연구가 펼쳐진다. 세계 최초로 대통령제를 실시한 미국이 걸어온 정치문화의 역사를 거시적으로 보여줌으로써 지도자의 역량과 비전이 얼마나 중요한지를 역설하고 있다.","세계가 좁게 느껴졌던 학습 만화 '먼나라 이웃나라' 시리즈, 미국편 중에서 . 전 세계인들이 주목하는 최강 국가 미국을 마지막으로 20년에 걸쳐 보완된 작품 '먼나라 이웃나라'가 완성되었다. 2004년 출판된 과 은 미국의 모습을 역사문화적으로 접근한 반면, 이번 은 230년이라는 짧은 역사 속에서 최강대국으로 이끈 인물들에 대한 연구를 담았다.",6229,BOOK
이렇게 자 볼까? 저렇게 자 볼까?,"이미애 (지은이), 심미아 (그림)",35134,국내도서>유아>그림책>나라별 그림책>한국 그림책,9788943304225,"늦은 밤, 한적한 시골의 앞마당, 텃밭, 냇물, 바윗돌, 나무 둥지, 동굴, 외양간 등을 배경으로 밤이슬, 달팽이, 겨나니, 청거북, 산새 등이 잠자는 모양을 흉내내는 아이의 모습을 잘 표현하고 있다. 또한 송글송글 밤이슬, 뱅글뱅글 달팽이, 보송보송 볏짚, 날짱날짱 고양이 등 각 장면 장면마다 사물과 동물의 특징을 풍성한 우리말로 잘 담아냈다.",,3309,BOOK
물푸레 물푸레 물푸레,"조호상 (지은이), 이정규 (그림)",48837,국내도서>어린이>초등3~4학년>동화/명작/고전,9788989843115,나직한 목소리의 이야기가 어떤 매력을 가지고 있는지 단적으로 확인할 수 있는 글이다. 처음부터 끝까지 노래라도 부르듯 리듬감 있게 이어지는 글이 간결하다.,,2257,BOOK
스쿨럼블 8,코바야시 진 (지은이),2554,국내도서>만화>소년만화>학원물,9788952970268,"주인공 츠카모토 텐마는 고교 2학년, 많은 여자들이 그렇듯이 그녀 또한 사랑을 하고 있다. 하지만 좋아하는 사람, 같은 반의 카리스마의 오오지에게 마음을 전하지 못하고 있었다…라는 설정은 어디로 갔느뇨!",,307,BOOK
까막나라에서 온 삽사리,정승각 (지은이),48825,국내도서>어린이>초등1~2학년>동화/명작/고전,9788990614001,"옛날 아주 먼 옛날, 하늘이 깜깜한 까막나라가 있었다. 어느 날, 까막나라 임금님은 ""나라가 온통 깜깜하니 다스릴 수가 없구나. 누가 불을 구해 올 수만 있다면...""하고 이야기하지만, 나서는 이가 없다. 그런데, 용감한 불개가 나라를 위해 불을 구하기 위해 북쪽으로 길을 떠난다.",『까막나라에서 온 삽사리』는 '귀신쫓는 개'라는 뜻을 가진 우리나라의 개 '삽사리'의 성품과 털색깔의 비밀을 새롭게 보여주는 그림책이다. 이 책은 어린이들에게 우리 것을 소중히 여기는 마음을 풍성하게 나눠 줄 것이다.,11017,BOOK
"야, 비 온다","이상교 (지은이), 이성표 (그림)",35134,국내도서>유아>그림책>나라별 그림책>한국 그림책,9788943304393,"우산을 갖고 싶은 단이에게 키 큰 삼촌이 우산을 선물했다. 다음 날부터 단이는 나뭇잎이 바람에 흔들리는 소리에도, 발자국 소리에도, '비'가 오는 줄 알고 우산을 펴고 밖으로 나간다.",,2596,BOOK
평화는 어디에서 오나요 - 세계 단편 동화 1,"구드룬 파우제방 (지은이), 신홍민 (옮긴이)",48846,국내도서>어린이>초등5~6학년>동화/명작/고전,9788901022932,아이들은 친구들과 참 많이 싸운다. 싸우는 이유도 가지각색이다. 대개는 어느 한 쪽의 일방적인 잘못보다는 서로의 잘못인 경우가 많다. 이 책에 실린 8편의 동화들은 어떻게 평화를 지킬 수 있을지에 관한 이야기이다. --어린이도서연구회,"재미와 감동이 가득한 평화 이야기 8편을 담은 독일 단편 동화집. 평화는 어디에서 오는 걸까요? 말썽만 피우던 자샤와 눈먼 엘리자베트 할머니가 만나 엮어 가는 따뜻한 우정, 항상 친구들에게 놀림과 따돌림을 받는 디륵에게 일어난 일. <순간 사진>, <마음을 아프게 하는 것>, <자샤와 엘리자베트 할머니> 등 재미와 감동이 가득한 평화 이야기 8편을 모아 엮었습니다.",2622,BOOK
"초등 새국어사전 (제5판, 컬러판) - 2012",두산동아 사서편집국 (엮은이),48917,국내도서>어린이>어린이 사전/도감>국어사전,9788900291742,"초등 교과서 전과목의 주요 낱말을 엄선해 수록하였다. 낱말에 딱 들어맞는 예문을 실어 말뜻을 정확히 이해하도록 했으며, 뜻을 간단.명확하게 풀이하여 이해를 돕는다. 뜻 구별, 어법 사항, 참고 자료를 함께 수록해 국어 학습의 참고로 활용하도록 하였다.",,7219,BOOK
잘 되는 병원에는 이유가 있다,조현 (지은이),2173,국내도서>경제경영>기업 경영>경영전략/혁신,9788955962055,환자들이 진정으로 원하는 병원으로 변화하는 법을 소개한다. 여기서 제시하는 병원 경쟁력의 기준은 시설이나 의료기술 같은 하드웨어가 아니라 경영기법과 서비스경영이라는 소프트웨어. 시간과 에너지를 절약하면서도 고객이 가장 만족스러워할 수 있는 상황을 연출해줄 서비스 노하우를 알려준다.,"100미터만 걸어도 한두 개는 찾을 수 있을 만큼 넘쳐나는 병원들. 깨끗한 시설과 훌륭한 설비, 숙련된 의료종사자는 물론이고 어떻게 하면 더 차별화하여 고객의 마음을 붙들어 놓을 수 있느냐가 관건이 되고 있다. 그렇다면 이 경쟁을 해쳐나갈 수 있는 무기는 과연 무엇일까?



이 책은 현장 사례를 바탕으로 환자들이 진정으로 원하는 병원으로 변화하는 법을 소개한다. 여기서 제시하는 병원 경쟁력의 기준은 시설이나 의료기술 같은 하드웨어가 아니라 경영기법과 서비스경영이라는 소프트웨어. 시간과 에너지를 절약하면서도 고객이 가장 만족스러워할 수 있는 상황을 연출해줄 서비스 노하우를 알려준다.",1627,BOOK
숫자를 찾아라 - 명화로 즐기는 게임북시리즈 2,루시 믹클레스웨이트 (지은이),35123,국내도서>유아>유아 교양/학습>유아 수학,9788940941225,,,499,BOOK
체인징 마인드 - 사람의 마음을 움직이는 7가지 지렛대,"하워드 가드너 (지은이), 이현우 (옮긴이)",51514,국내도서>인문학>심리학/정신분석학>교양 심리학,9788990982100,"유권자의 마음을 움직여야 하는 정치인, 청중의 마음에 감동을 불러일으켜야 하는 예술가. 그들은 무엇을 어떻게 한 것일까? '다중지능' 이론으로 유명한 심리학자 하워드 가드너는 이 책에서 사람의 마음을 효과적으로 변화시키기 위해서는 언제 어떤 일을 해야만 하는가에 대한 상세한 해답을 제시한다.",,674,BOOK
숨 쉬는 도시 꾸리찌바 - 페달을 밟아라 7,"안순혜 (지은이), 박혜선 (그림), 박용남 (감수)",48872,국내도서>어린이>과학/수학/컴퓨터>환경 이야기,9788989192367,"과거의 문화 유산과 현재의 생활 공간이 함께 공존하는 도시, 자연과 인간이 사이좋게 어우러지는 도시. 브라질에 있는 꾸리찌바가 바로 그런 도시다. 30년 가까이 노력해서 제3세계의 가난한 지방 도시에서 세계에서 손꼽히는 생태도시로 탈바꿈한 꾸리찌바의 이야기와 아름다운 도시의 구석구석을 담았다.","과거의 문화 유산과 현재의 생활 공간이 함께 공존하는 도시, 자연과 인간이 사이좋게 어우러지는 도시. 브라질에 있는 꾸리찌바가 바로 그런 도시다. 30년 가까이 노력해서 제3세계의 가난한 지방 도시에서 세계에서 손꼽히는 생태도시로 탈바꿈한 꾸리찌바의 이야기와 아름다운 도시의 구석구석을 담았다.



환이는 도시계획가인 아빠에게 '꾸리찌바'의 이야기를 듣게 된다. 공원을 거닐며 마음껏 푸르름을 즐기는 사람들, 주말이면 무료로 사람들을 공원까지 실어다 주는 녹색 버스가 있는 그곳으로 환이와 아빠는 여행을 떠난다. 깨끗한 공기, 도시 한 가운데를 흐르는 맑은 강물, 차보다 보행자가 우선되는 거리, 알록달록한 온갖 꽃들과 길게 늘어선 나무들, 군데군데 마련된 벤치. 환이는 꾸리찌바에 한 눈에 반한다.



아빠는 그런 환이에게 꾸리찌바가 어떻게 오늘의 모습을 가지게 되었는지를 상세하게 설명해 준다. 나무 보호 정책을 만들어, 사람들이 함부로 나무를 베지 못하게 했고, 꽃과 나무를 많이 기르는 마을에는 세금을 줄이는 혜택을 주었다. 또, 재활용을 통해 자연환경뿐 아니라, 음악, 미술, 연극, 건축을 모두 포함한 종합 예술 도시로 키우기 위해 많은 노력을 기울였다.



꾸리찌바는 인간과 자연이 조화를 이루며 살아가는 도시이다. 그 비결은 바로 사람과 환경을 존중하는 마음에 있다. 사람과 사람, 자연과 사람의 관계가 모두 다 그렇다. 꾸리찌바에는 무분별한 개발이 발 붙이지 못하고, 더 가진 사람이 덜 가진 사람을 위해 기꺼이 부담을 진다. 꾸리찌바 사람들은 어려서부터 자원을 절약하고, 환경을 보호하며, 자기가 사는 곳을 사랑하는 법을 배운다.",11054,BOOK
깃털 없는 기러기 보르카,"존 버닝햄 (지은이), 엄혜숙 (옮긴이)",35137,국내도서>유아>그림책>나라별 그림책>유럽,9788949110165,"장애아 문제를 다룬 그림책이다. 다른 형제들과는 달리 깃털 없는 기러기로 태어난 보르카가 겪는 슬픔과 고난, 행복을 찾게 되는 과정을 그렸다. 외국말이 많이 들어가 있어 자연스럽게 읽을 수 없고, 선장이나 배, 오리들의 모습이 너무 서구적이라는 점이 아쉽지만 다양성을 인정하는 깊은 생각이 담겨있다.",케이트 그리너웨이 상 수상 작품이다. 태어날 때부터 깃털이 없는 거위 보르카를 통해서 장애자 문제를 제기한 책이다. 보르카가 행복하게 살게 되기까지의 슬픔과 모험을 그리고 있다.,9403,BOOK
