title,author,genre_id,genre,ISBN,description_aladin,description_naver,salesPoint,mallType
기적의 계산법 1 - 자연수의 덧셈과 뺄셈 기초,기적의 계산법 연구회 (지은이),48871,국내도서>어린이>과학/수학/컴퓨터>초등 수학,9788975602696,"계산이 느린 아이, 자꾸 실수하는 아이를 빠르고, 정확한 계산박사로 만드는 '기적의 계산법'의 완성편. '기적의 계산법'은 프로그램식으로 계발된 계산력 전문 학습서로, 초등 6년 과정에 꼭 필요한 계산 문제가 모두 들어있다. 모두 7권 70단계로 구성되어 있고, 계산력과 집중력을 동시에 기를 수 있다.",,4206,BOOK
세팅 더 테이블,"대니 메이어 (지은이), 노혜숙 (옮긴이)",852,국내도서>경제경영>기업/경영자 스토리>국외 기업/경영자,9788973378692,"충분한 경험도, 자본도 없이 오직 일에 대한 열정만으로 레스토랑 사업에 도전한 저자가 유니언스퀘어 호스피탤러티 그룹의 CEO로 성공하기까지의 기록이다. 22년 동안의 생생한 경험담에는 레스토랑이라는 공간의 독특한 즐거움뿐만 아니라 사업가와 경영자에게 유용한 저자의 경영 철학을 담겨 있다.","뉴요커의 식탁을 지배하는 레스토랑 이노베이터가 들려주는 경영전략!

〈자갓 서베이〉 〈뉴욕타임즈〉 등이 최고의 레스토랑 경영자로 주목한 대니 메이어. 충분한 경험, 많은 자본도 없이 오직 일에 대한 열정 하나만으로 레스토랑 사업에 도전한 대니 메이어는 정식 레스토랑을 시작으로 도심의 바베큐 전문점, 재즈클럽, 뉴욕 현대미술관 카페 등을 운영하는 유니언스퀘어 호스피탤러티 그룹의 CEO로 큰 성공을 거두었다.

『세팅 더 테이블』은 세계 최고의 레스토랑 경영자 대니 메이어가 이룩한 테이블 위의 성공 신화가 담겨 있다. 22년 동안 그가 겪은 풍부한 경험들, 최고가 되기 위해 거쳐던 고난의 순간들, 그리고 '레스토랑'이라는 공간의 독특한 즐거움을 통해 사업자가 경영자들에게 유용한 경영철학을 들려준다.

여기에는 레스토랑이 맛있는 음식뿐 아니라 즐거운 경험을 선물해야 한다는 경영철학, 고급요리도 편안하게 먹을 수 있다는 창의적 발상, 기술보다 배려지수가 높은 사람들을 채용하는 인재전략, 손님과 투자자를 우선시하는 구시대적 경영관을 깨고 직원, 고객, 사회, 납품업자, 투자자순으로 '배려의 우선순위'를 정한 경영관 등이 담겨 있다. [양장본]",1155,BOOK
지킬박사와 하이드,"로버트 루이스 스티븐슨 (지은이), 한상남 (엮은이), 윤종태 (그림)",48875,국내도서>어린이>동화/명작/고전>세계명작,9788915032866,,"지킬 박사는 오랜 연구 끝에 악의 결정체인 하이드를 탄생시켜, 자비심 많은 학자임과 동시에 악으로 똘똘 뭉친 살인자가 된다. 이중인격을 가진 그는 선과 악 사이에서 갈등하다가 결국에는 자신을 파멸로 몰고 가 죽음에 이른다. 이는 인간의 잘못된 욕망이 얼마나 무서운 결과를 가져올 수 있는지를 잘 보여준다.",2267,BOOK
너무 바빠서 기도합니다,"빌 하이벨스 (지은이), 김성녀 (옮긴이)",51597,국내도서>종교/역학>기독교(개신교)>기독교(개신교) 신앙생활>예배/기도/묵상(QT),9788932820767,"바쁜 현대인들에게 하나님과 고요한 시간을 가질 것을 제안하는 책. 찬미, 고백, 감사, 간구라는 구체적인 기도 유형과 글로 적는 기도 등 '하남님과의 쌍방통행' 지침을 제시한다.",,3873,BOOK
창피모면 굴욕예방 영어상식 99,"이상빈, 이브 로스만 샤인 (지은이)",49833,국내도서>외국어>영어학습법,9788992736008,"이 책은 초급자부터 영어에 어느 정도 자신 있는 중급자가 봐도 도움이 될 만한 내용으로, 쉽고 자주 쓰는 표현 중에 잘 틀리는 것들을 키워드별로 정리해 놓았다.","내가 썼던 영어, 알고 보니 콩글리시?! 
틀리고도 틀린 줄 모르는 우리말식 영어표현을 세심하게 바로잡아주는 책

『창피모면 굴욕예방 영어상식 99』는 초급자부터 영어에 어느 정도 자신 있는 중급자가 봐도 도움이 될 만한 내용으로, 쉽고 자주 쓰는 표현 중에 잘 틀리는 것들을 키워드별로 정리해 놓은 영어책이다.

이 책에서는 한국사람이라면 누구나 틀리기 쉬운 영어표현들을 완벽하게 교정해준다. 특히 밝고 경쾌한 삽화와 쉬운 설명으로, 학습한다는 부담 없이 누구나 쉽게 접근할 수 있도록 하였다.",2450,BOOK
굿바이! 떨림증 - 사람들 앞에서 떨지 않고 자신 있게 말하는 비결,"아소 켄타로 (지은이), 이광철 (옮긴이)",70227,국내도서>자기계발>협상/설득/화술>화술,9788992555159,"떨림증을 없애기 위한 두 가지 처방전과, 실제 상황에서의 떨림증 대처 방법을 알려준다. 남들 앞에 서는 것이 익숙하지 않은 일반인들은 물론이고, 남 앞에서 이야기하는 것이 직업인 아나운서나 개그맨들도 중요한 순간에는 긴장하고 떤다. 소심한 샐러리맨에서 인기 아나운서가 된 저자의 '사람들 앞에서 떨지 않고 자신 있게 말하는 비결'을 들어보자.",,1318,BOOK
천사 같은 우리 애들 왜 이렇게 싸울까? - 부모들이 잘 모르는 자녀들이 싸우는 이유와 대처법,"일레인 마즐리시, 아델 페이버 (지은이), 서진영 (옮긴이)",7257,국내도서>좋은부모>교육/학습>창의 교육,9788990985293,소아 발달심리 분야에서 세계적인 명성을 얻은 저자들이 실제로 개최했던 부모 모임을 바탕으로 쓴 세계적인 베스트셀러다. 워크숍에 참여했던 부모들과 실제로 자녀들 사이의 갈등으로 어려움을 겪었던 저자들의 생생한 목소리를 전하고 그 해결책을 제시해 부모라면 누구나 공감할 수 있다.,,470,BOOK
엄마는 파업중 - 5학년 2학기 읽기 수록도서,"김희숙 (지은이), 박지영 (그림)",48874,국내도서>어린이>동화/명작/고전>국내창작동화,9788957980385,<엄마는 파업중>의 작가가 아이들에게 전하는 메시지는 너무 당연한 얘기여서 진부하게 들릴 수 있지만 “만일 우리 집도 엄마가 파업을 한다면 어떻게 될까?”를 상상케 하며 이야기를 풀어가는 발상이 흥미롭다.,"아동작가 김희숙의 단편동화 모음집! 이 책에 실린 대부분의 작품들은 우리 주변에서 쉽게 볼 수 있는 아이들의 모습을 그리고 있다. 총 12편이 담겨 있다. 

표제작「엄마는 파업중」은 집안일에 지친 엄마가 급기야는 파업을 하게 되고, 그제야 가족 구성원들이 엄마가 하는 일의 중량을 체감하게 된다는 내용이다. 이 작품은 동화의 기피 대상인 주부의 가사 노동을 생생하게 담아낸 것은 물론 초등학교 〈국어〉 교과서에 실려 있다. 

그 외 작품들 또한 자폐아, 장애아우, 남녀평등, 가부장제 등의 주제를 담고 있다. 이렇게 작가는 소외된 이웃들의 결코 가볍지 않은 문제에 관심을 내비친다.",12568,BOOK
강의 - 나의 동양고전 독법,신영복 (지은이),51378,국내도서>인문학>교양 인문학,9788971992029,"자본주의 체제가 양산하는 물질의 낭비와 인간의 소외, 그리고 인간관계의 황폐화를 보다 근본적인 시각으로 재조명하는 신영복 선생의 고전강의를 책으로 엮었다. <시경>, <서경>, <초사>, <주역>, <논어>, <맹자>, <노자>, <장자>, <묵자>, <순자>, <한비자>를 '관계론'의 관점으로 새롭게 읽고 있다.","우리 시대의 지성, 신영복의 동양고전 강의!

자본주의 체제의 물질 낭비와 인간의 소외, 황폐화된 인간관계를 근본적인 시각으로 재조명하는 신영복의 동양고전 강의. 성공회대학교에서 '고전 강독'이란 강좌명으로 진행되었던 신영복 교수의 강의 내용을 정리한 책이다. 저자는 고전 독법에서 과거에 대한 재조명이 가장 중요하다고 이야기하며, 당대 사회의 당면 과제에 대한 문제의식이 고전 독법의 전 과정에 관철되고 있어야 한다고 강조한다. 

이 책에서는 그런 저자의 관점이 반영된 고전 강독을 토대로 과거를 재조명하며 현재와 미래의 방향을 모색하고 있다. 시경, 서경, 초사, 주역, 논어, 맹자, 노자, 장자, 묵자, 순자, 한비자, 불교, 신유학, 대학, 중용, 양명학을 관계론의 관점으로 살펴보고 다양한 예시 문장을 통해 관계론적 사고를 재조명할 수 있도록 구성하였다.",28973,BOOK
독일에서 보물찾기,"곰돌이 co. (지은이), 강경효 (그림)",49224,국내도서>어린이>초등 전학년>학습만화,9788937840296,"2006년 월드컵 주최국이자 유럽의 중심에 자리잡은 나라 독일을 찾아간다. 문학, 철학, 음악에 두루 걸친 독일의 문화적 유산에서부터 나치스라는 불행한 과거, 통일 이후 독일이 안고 있는 문제까지 두루 살펴볼 수 있는 책!","세계 역사를 담은 학습 만화『세계 탐험 만화 역사상식』시리즈 제10권 ≪독일에서 보물찾기≫. 에서 팡이와 지 교수는 미국에서 만난 트레저 헌터 인디아나 존즈와 함께 히틀러가 숨긴 금괴를 찾아 독일로 향합니다. 그러나 금괴의 행방을 알고 있는 유일한 사람, 옛 나치스 당원인 칼 소위가 혼수상태에 빠져 있어요. 가까스로 깨어난 칼 소위는 아들 프란츠의 이름을 부르며 동화라는 단서를 남기고 다시 의식을 잃어 버리는데….  

이 책은 '만화'라는 형식을 통해 독일의 역사 현장을 좀더 생생하게 전달하고 있습니다. 특히, 자칫 흥미 위주로 읽힐 수 있는 만화의 단점을 보완하고자 각 장마다 독일의 역사와 문화, 문화유산 등과 같은 알짜배기 정보를 콕콕 집어주고 있습니다.",6779,BOOK
"깡통 소년 - SF 미스터리, 4단계","크리스티네 뇌스틀링거 (지은이), 프란츠 비트캄프 (그림), 유혜자 (옮긴이)",48877,국내도서>어린이>동화/명작/고전>외국창작동화,9788937840111,혼자 살고 있는 '엉뚱한' 아줌마 바톨로티 부인에게 어느 날 커다란 소포가 배달된다. 소포 안에 들어 있는 것은 커다란 은색 깡통. 그 깡통에서 나타난 것은 여덟 살 된 남자 아이이다.,"혼자 살고 있는 '엉뚱한' 아줌마 바톨로티 부인에게 어느 날 커다란 소포가 배달된다. 소포 안에 들어 있는 것은 커다란 은색 깡통. 그 깡통에서 나타난 것은 여덟 살 된 남자 아이이다. 콘라트라는 이름의 아이는 주문에 맞추어 공장에서 제작된 아이로, 교육 받은 대로 어른 말씀은 어기지 않고, 공부를 열심히 하고, 말썽은 절대 피우지 않는 아이이다.



독특하고 특별한 것을 좋아하는 바톨로티 부인과 제대로만 행동하는 콘라트가 서로에게 익숙해질 무렵, 뜻밖의 편지가 온다. 콘라트를 주문한 사람은 따로 있으므로, 아이를 되돌려 달라는 내용이었다. 그러나 서로에게 정이 든 이들은 헤어지지 않기로 결심하고, 기발한 작전을 세운다.",12933,BOOK
AAT(American Accent Training) (본책(한국어판) 1권 + 본책(영문판) 1권 + Audio CD 5장) - 미국식 영어발음 집중훈련 워크북,"앤 쿡 (지은이), 전창훈 (옮긴이)",49837,국내도서>외국어>영어듣기/말하기,9788991141278,"현재 미국 아마존 발음청취 부문 베스트셀러 1위를 고수하고 있는 AAT는 미국에 유학 가면 가장 먼저 공부해야 하는 책으로 꼽힌다. 일본 아마존 원서 분야 최장기 베스트셀러이며 마이크로소프트, 델, GE 등 유수 기업들의 직원교육용 교재로도 꾸준히 채택되고 있는 발음 분야의 Grammar in Use 같은 책이다.",,5611,BOOK
기탄 수학 F단계 2집 - 초등 2학년,기탄교육연구소 (엮은이),0,,9788989425762,,,17183,BOOK
처음처럼 - 신영복 서화 에세이,"신영복 (지은이), 이승혁, 장지숙 (엮은이)",52906,국내도서>에세이>명사에세이>기타 명사에세이,9788925505626,"신영복 교수의 따뜻한 시선과 깊은 통찰이 빛나는 글과 그림, 글씨를 한 권에 담았다. 기존에 발표된 작품들 중에서 가려 뽑은 서화(글 160편, 그림 150컷, 글씨 30점)로 구성된 이 에세이는, 삶을 사색하고 뒤돌아보게 하며 '더불어' 체온을 느끼게 한다.",,12152,BOOK
"여자 나이 스물아홉, 일할까 결혼할까 공부할까?",김희정 (지은이),70218,국내도서>자기계발>여성의 자기계발,9788956051994,"'스물아홉'으로 대변되는 커리어우먼을 위한 지침서다. 일과 결혼, 자기계발은 모든 여성들이 고민하는 주제다. 과연 어떤 선택을 해야 하는지, 또한 어떻게 해야 일과 결혼, 자기계발에서 성공할 수 있는지 10년 동안 '제스프리 한국지사장'으로 재임한 저자의 노하우를 가르쳐준다.","서른아홉 선배가 스물아홉 후배에게 들려주는 커리우먼 인생의 정답!

이 책은 '스물아홉'으로 대변되는 한창 나이의 커리우먼들에게 바치는 고민해결서이다. 새로운 변화를 앞둔 모든 여성들의 고민거리인 '일, 결혼, 자기계발'을 주제로 '과연 어떤 선택을 해야 후회하지 않는 미래를 살 수 있을 것인가?, 어떻게 해야 일, 결혼, 자기계발의 세 마리 토끼를 잡을 수 있는가?'란 질문에 답한다.

저자는 커리어우먼계에서 사춘기를 겪고 있는 스물아홉 즈음의 여성들에게 10년 동안 '제스프리 한국지사장'으로 재임하며 겪었던 수많은 일화와 교훈들을 토대로 유쾌한 해답을 제시한다. 여자라서 취약한 점과 유리한 점은 무엇인지, 서른의 초임에서 계속 일하려면 무엇을 갖추어야 하는지 등 직장 내 여자로서 성공하기 위한 메커니즘을 소개한다.

아울러 성공하려면 일 잘하는 여자보다 정치 잘하는 여자가 되어야 한다고 조언하며 사내정치를 어떻게 해 나가야 하는지도 알려주고, 이 시대 싱글우먼들이 살아가는 방법과 살아가야 할 방향을 진지하게 충고한다. 특히 저자가 여자이기 때문에 더 잘 알고 있는 여성 직장인의 문제점과 가능성을 조목조목 이야기한다.",383,BOOK
"인간의 미래 - 생명공학이여, 질주하라","라메즈 남 (지은이), 남윤호 (옮긴이)",51205,국내도서>과학>생명과학>생명과학,9788988165850,"유전자 치료, 유전공학, 줄기세포 연구, 생명 연장, 뇌와 컴퓨터의 인터페이스, 클로닝 등 생명공학의 최전선에서 일어나고 있는 과학적 성과들과 장차 그것이 우리 삶에 미칠 영향을 알기 쉽게 설명한 책. 지은이는 생명공학의 진보는 이미 돌아올 수 없는 강을 건넜으며 곧 기계와 인간이 함께 하는 세상이 온다고 주장한다.",,320,BOOK
일본에서 보물찾기,곰돌이 co. (엮은이),49224,국내도서>어린이>초등 전학년>학습만화,9788937840265,,"세계 역사를 담은 학습 만화『세계 탐험 만화 역사상식』시리즈 제7권 ≪일본에서 보물찾기≫. 의 주인공 팡이와 친구들은 독도 해석에 중요한 보물인 칠지도를 찾는 모험을 시작한다. 각고의 노력으로 세 개로 흩어졌던 칠지도를 완성하지만 그들 앞에는 역사를 왜곡하려는 야쿠자 쿠아 일당이 나타나는데…. 
　 
이 책은 마치 애니메이션을 보듯 생생하게 그 이야기를 전한다. 특히, 자칫 흥미 위주로 읽힐 수 있는 만화의 단점을 보완하고자 '한국과 일본의 관계', '일본의 역사 왜곡' 등과 같은 역사 상식을 각 장마다 소개해 놓았다. 만화를 통해 일본에 대한 모든 것을 배울 수 있도록 구성해 놓았다. 

☞ 칠지도는 삼국 시대 때 백제왕이 일본에 전해 주었다는 보물이다.",6231,BOOK
"아틀라스 중국사 - 역사읽기, 이제는 지도다!","이준갑, 김병준, 박한제, 이근명, 김형종 (지은이)",1962,국내도서>역사>중국사>중국사 일반,9788958282365,"각 시대사별 중국사 전문가들이 통사적 안목을 공유하면서 통합적으로 일구어낸 중국사 서적. 단순 교과서식 나열과 정보제공 방식을 지양하고, 지은이들 개개인 고유의 사관을 바탕으로 중국사 핵심 사건들을 96개 주제에 담아냈다.","지도와 함께 읽는 중국사 개설서

입체적인 역사 체험을 제공하는『아틀라스 역사』시리즈. 시간 중심적인 역사 서술을 탈피하고, 시간과 공간을 대등하게 아우르며 역사의 현장을 생생하게 재구성한 역사책이다. 상세한 텍스트와 생생한 지도가 함께 어우어져 있어 역사를 보다 입체적으로 이해할 수 있게 도와준다. 지형이 살아 움직이는 듯한 음영기복도를 사용하였으며, 풍부한 도판 자료와 시각화된 통계 자료를 곳곳에 배치하였다.

제3권 〈아틀라스 중국사〉는 국내 최고 필진이 쓴 정통 중국사 개설서이다. 각 시대사별 중국사 전문가들이 통사적 안목을 공유하면서 통합적으로 하나의 중국사를 서술하고 있다. 그러면서도 필자들은 중국사 각 시대의 최고 전문가답게 자신의 역사관을 독창적으로 투영시키며 중국사의 핵심적인 사건들을 96개의 테마로 구성하였다. 단순 교과서식 서술과 정보 나열을 거부하고, 개성 넘치는 글쓰기로 중국사에 대한 흥미를 이끌어낸다.  

이 책은 텍스트의 내용을 지도에 압축적으로 표현하여, 시간에 갇혀 있는 역사 이해의 폭을 공간으로 넓히고 있다. 철저한 사료 해석과 지리 고증을 토대로 역사적 사건을 지도로 재현하였고, 총 128컷의 지도를 통해 중국사의 다양한 국면들을 시각적으로 보여준다. 또한 각 시대의 특징을 잘 살려낼 수 있는 155개의 도판 자료를 엄선해 수록하였으며, 각 주제의 첫머리에는 해당 시대의 연대와 연표를 제시하였다. [양장본]",2701,BOOK
"Matilda (Paperback, Reissue)",로알드 달 (지은이),106408,외국도서>어린이>픽션>문학 >고전 ,9780141301068,,,1500,FOREIGN
솔빛이네 엄마표 영어연수,이남수 (지은이),7257,국내도서>좋은부모>교육/학습>창의 교육,9788960470286,저자 이남수 씨가 초등학교 4학년이던 딸 솔빛이를 영어로부터 자유로운 아이로 길러내기까지의 이야기와 실전 지침들을 담고 있다.,,1967,BOOK
시누헤 1,"미카 월터리 (지은이), 이순희 (옮긴이)",51124,국내도서>소설/시/희곡>역사소설>외국 역사소설,9788972975458,"자유와 평등을 부르짖었던 파라오 아케나톤의 혁명을 그린 역사소설이다. '시누헤'는 고대 이집트 역사의 거친 풍랑 속에서 아케나톤의 주치의로 종교개혁 과정을 옆에서 지켜보고, 그의 혁명, 평등, 반전에 관한 사상을 이해하게 되는 인물. 아케나톤 혁명을 배경으로 하지만 이야기의 기본 얼개에는 모험과 사랑이 있다.",,334,BOOK
도서관,"사라 스튜어트 (지은이), 데이비드 스몰 (그림), 지혜연 (옮긴이)",35135,국내도서>유아>그림책>나라별 그림책>미국,9788972596356,"주인공 엘리자베스 브라운은 다른 것에는 관심이 없고 오로지 책만 읽는다. 책 때문에 침대가 부서지고, 책장이 무너져 내리기도 한다. 더 이상 집에 책을 둘 곳이 없자 그 책으로 시골마을에 도서관을 세운다. 못말리는 책벌레의 일상을 맑은 수채화로 그려냈다.",책 읽는 즐거움을 깨우치는 그림책. 마르고 수줍음이 많은 자베스 브라운은 아주 어려서부터 책 읽기를 배 워 책읽기가 취미다. 그동안 읽은 책이 너무 많아 더 이상 집에 책을 보관할 수 없을 정도인 그녀는 자신의집을 기증해 도서관을 만든다는 이야기.,10333,BOOK
스케치 쉽게 하기 - 인물 드로잉 - 그림 그리는 즐거움을 배운다!,김충원 (지은이),50987,국내도서>예술/대중문화>미술>미술 실기,9788972215240,"기초부터 실용 테크닉까지, 인물 드로잉에 필요한 다양한 노하우를 소개한 책. 정확하게 대상을 보고 그리기 위해 익혀야 할 기법들을 알기 쉽게 설명한다. 60여 권에 이르는 미술 교재를 집필한 미술 교육가이자 일러스트레이터, 김충원 교수가 집필했다.","가장 쉽고 재미있는 스케치의 시작
시리즈 50만 부 돌파! [스케치 쉽게 하기-인물 드로잉]

시리즈 50만 부 판매 기념 리커버 에디션 출간!
스케치를 시작하는 수많은 독자들의 든든한 길라잡이로 큰 사랑을 받아온『스케치 쉽게 하기-인물 드로잉』이 시리즈 누적 50만 부 판매를 기념하며 새로운 모습으로 출간되었다. 가장 쉽고 재미있게 스케치를 시작하는 방법을 알려주는 『스케치 쉽게 하기』시리즈는 그동안 스케치의 기초를 탄탄하게 다져 주는 바이블로 자리매김해 왔다. 새로운 디자인과 보기 편한 편집으로 스케치에 관한 풍부한 예시를 보면서 유용한 드로잉 기법을 배울 수 있다.
『스케치 쉽게 하기-인물 드로잉』은 우리가 갖고 있는 관념적 시각을 벗어나 정확하게 대상을 보고 그릴 수 있는 다양한 노하우를 알려 주는 책이다. 스케치에 대한 두려움을 극복하는 것이 첫 번째 단계인 만큼, 초보자들이 범하기 쉬운 실수를 예제를 통해 조목조목 짚어 주면서 새로운 습관으로 눈을 길들이도록 돕는다. 또한 눈, 코, 입의 세밀한 묘사를 위해 알아야 할 얼굴이 갖고 있는 법칙과 얼굴의 입체감을 부여하는 그림자의 표현, 다양한 인물의 표현 방식까지 인물 드로잉에 필요한 실용 기법을 자세하게 설명하고 있다.
함께 들어 있는 ‘인물 드로잉 연습장’은 본문 내용을 직접 연습할 수 있도록 만든 실전 편으로 그림이 완성되는 과정을 자세하게 실어 두었으며, 따라 그리기 쉽도록 밑그림을 첨부하였다.",6366,BOOK
좋은 서비스 좋은 가게,"Ryogo Kubo (지은이), 모주희 (옮긴이)",8593,국내도서>경제경영>기업 경영>서비스/고객관리,9788989484868,"한 레스토랑을 배경으로 전개되는 직원과 직원, 그리고 수많은 고객과 직원 사이에서 일어난 크고 작은 사건과 일상을 통해 진정한 서비스 마인드가 무엇인지를 들려준다.",,67,BOOK
신공략 중국어 (책 + CD 1장) - 초급편,"마전비, 소영하, 적염 (지은이), 변형우, 강필임 (옮긴이)",49910,국내도서>외국어>중국어>중국어 첫걸음,9788959955077,<신공략 중국어> 최신개정판. 시대에 뒤떨어지는 단어와 표현을 바로 이 순간 중국 현지에서 사용되고 있는 어휘와 표현으로 전격 교체했다. 또 기초 학습자들의 취약점인 간체자와 번체자 구별을 위한 쓰기연습 및 다양한 중국 관련 상식 코너를 신설했다.,,5498,BOOK
은행원 니시키 씨의 행방,"이케이도 준 (지은이), 민경욱 (옮긴이)",51058,국내도서>소설/시/희곡>추리/미스터리소설>일본 추리/미스터리소설,9788990739612,"에도가와 란포 상 수상 작가 이케이도 준이 쓴 '금융 미스터리'. 조직의 톱니바퀴로 살아가는 평범한 은행원들, 그리고 사회의 톱니바퀴로 굴러가는 평범한 은행. 그리고 어느 여름날 사라진 거액의 현금. 사건에 얽힌 다양한 인간 군상을 보는 묘미, 현대 사회에 살고 있는 우리 모두의 비애를 폭로하는 작가의 목소리가 인상적이다.",,502,BOOK
"나의 라임 오렌지나무 - MBC 느낌표 선정도서, 보급판","J.M. 바스콘셀로스 (지은이), 박동원 (옮긴이)",50920,국내도서>소설/시/희곡>스페인/중남미소설,9788972975236,"우리 나라 독자들에게 많은 사랑을 받아온 <나의 라임오렌지 나무>가 완역본 보급판으로 재출간됐다. 100여 곳이 넘는 기존 책의 오역을 바로잡았고, 공모를 통해 선정한 삽화가의 그림을 함께 실었다.",,16304,BOOK
